path	sentence	client_id	translation	split
common_voice_en_19863574.mp3	He would name his company after his own surname.	74491ccd3495e209ddd31169484962be9536d4e4861cd2cf8eecba0cc90549aa42b1e3b88baedd6a5e231f1580f0b656d378ba61130bc91a960034b174260ceb	그는 자신의 성을 따서 회사 이름을 지었습니다.	train
common_voice_en_19863575.mp3	To the northeast of Harding is the smaller crater Dechen.	74491ccd3495e209ddd31169484962be9536d4e4861cd2cf8eecba0cc90549aa42b1e3b88baedd6a5e231f1580f0b656d378ba61130bc91a960034b174260ceb	하딩의 북동쪽에는 더 작은 분화구인 데첸이 있습니다.	train
common_voice_en_19863576.mp3	He was sensible all the time of having her opposite him.	74491ccd3495e209ddd31169484962be9536d4e4861cd2cf8eecba0cc90549aa42b1e3b88baedd6a5e231f1580f0b656d378ba61130bc91a960034b174260ceb	그는 항상 그녀를 반대편에 두는 것이 현명했습니다.	train
common_voice_en_19950019.mp3	The Porter family at first seem normal enough.	74491ccd3495e209ddd31169484962be9536d4e4861cd2cf8eecba0cc90549aa42b1e3b88baedd6a5e231f1580f0b656d378ba61130bc91a960034b174260ceb	포터 가족은 처음에는 평범해 보였습니다.	train
common_voice_en_19950020.mp3	Many files on radicals, collected for decades, were ordered destroyed.	74491ccd3495e209ddd31169484962be9536d4e4861cd2cf8eecba0cc90549aa42b1e3b88baedd6a5e231f1580f0b656d378ba61130bc91a960034b174260ceb	수십 년 동안 수집된 급진주의자 관련 파일은 대부분 파기 명령을 받았습니다.	train
common_voice_en_19950022.mp3	The Recreation Area continues to be open to the public.	74491ccd3495e209ddd31169484962be9536d4e4861cd2cf8eecba0cc90549aa42b1e3b88baedd6a5e231f1580f0b656d378ba61130bc91a960034b174260ceb	레크리에이션 구역은 계속해서 일반인에게 개방됩니다.	train
common_voice_en_19950023.mp3	George and Harold are also caught outside detention by Mr. Krupp and are suspended.	74491ccd3495e209ddd31169484962be9536d4e4861cd2cf8eecba0cc90549aa42b1e3b88baedd6a5e231f1580f0b656d378ba61130bc91a960034b174260ceb	조지와 해롤드도 크룹 씨에게 구금장 밖에서 붙잡혀 정직 처분을 받습니다.	train
common_voice_en_19950024.mp3	He defeated former Mayor Dan Whitehurst.	74491ccd3495e209ddd31169484962be9536d4e4861cd2cf8eecba0cc90549aa42b1e3b88baedd6a5e231f1580f0b656d378ba61130bc91a960034b174260ceb	그는 댄 화이트허스트 전 시장을 물리쳤습니다.	train
common_voice_en_19950025.mp3	Taste is a distinguishing characteristic in many species, from mild to very acrid.	74491ccd3495e209ddd31169484962be9536d4e4861cd2cf8eecba0cc90549aa42b1e3b88baedd6a5e231f1580f0b656d378ba61130bc91a960034b174260ceb	맛은 순한 맛부터 매우 매운 맛까지 많은 종에서 구별되는 특징입니다.	train
common_voice_en_19950026.mp3	After the Norman conquest, Parbold was part of the Barony of Manchester.	74491ccd3495e209ddd31169484962be9536d4e4861cd2cf8eecba0cc90549aa42b1e3b88baedd6a5e231f1580f0b656d378ba61130bc91a960034b174260ceb	노르만 정복 이후 파볼드는 맨체스터 남작의 일원이 되었습니다.	train
common_voice_en_19950027.mp3	Mountain States Legal Foundation represented Adarand Constructors.	74491ccd3495e209ddd31169484962be9536d4e4861cd2cf8eecba0cc90549aa42b1e3b88baedd6a5e231f1580f0b656d378ba61130bc91a960034b174260ceb	마운틴 스테이트 리걸 파운데이션은 아다랜드 컨스트럭터를 대리했습니다.	train
common_voice_en_19950028.mp3	The Warnow river runs through the district from the southwest to the north.	74491ccd3495e209ddd31169484962be9536d4e4861cd2cf8eecba0cc90549aa42b1e3b88baedd6a5e231f1580f0b656d378ba61130bc91a960034b174260ceb	워노우 강은 남서쪽에서 북쪽으로 지구를 가로질러 흐릅니다.	train
common_voice_en_19950034.mp3	Services offered are often referred to as transition management services.	74491ccd3495e209ddd31169484962be9536d4e4861cd2cf8eecba0cc90549aa42b1e3b88baedd6a5e231f1580f0b656d378ba61130bc91a960034b174260ceb	제공되는 서비스를 흔히 전환 관리 서비스라고 합니다.	train
common_voice_en_19950035.mp3	The chariot is a short, usually one lap, race.	74491ccd3495e209ddd31169484962be9536d4e4861cd2cf8eecba0cc90549aa42b1e3b88baedd6a5e231f1580f0b656d378ba61130bc91a960034b174260ceb	전차 경주는 보통 한 바퀴를 도는 짧은 레이스입니다.	train
common_voice_en_19950036.mp3	The third generation is only available as an Avant.	74491ccd3495e209ddd31169484962be9536d4e4861cd2cf8eecba0cc90549aa42b1e3b88baedd6a5e231f1580f0b656d378ba61130bc91a960034b174260ceb	3세대는 아반트로만 출시됩니다.	train
common_voice_en_19950037.mp3	While private debtors have the resource of bankruptcy protection, sovereign states do not.	74491ccd3495e209ddd31169484962be9536d4e4861cd2cf8eecba0cc90549aa42b1e3b88baedd6a5e231f1580f0b656d378ba61130bc91a960034b174260ceb	개인 채무자에게는 파산 보호라는 자원이 있지만, 주권 국가에는 없습니다.	train
common_voice_en_19950038.mp3	Industrial and factory production has revitalized the local post-coal economy.	74491ccd3495e209ddd31169484962be9536d4e4861cd2cf8eecba0cc90549aa42b1e3b88baedd6a5e231f1580f0b656d378ba61130bc91a960034b174260ceb	산업 및 공장 생산은 석탄 이후 지역 경제에 활력을 불어넣었습니다.	train
common_voice_en_19950039.mp3	In recent years, however, the school district is no longer top rated.	74491ccd3495e209ddd31169484962be9536d4e4861cd2cf8eecba0cc90549aa42b1e3b88baedd6a5e231f1580f0b656d378ba61130bc91a960034b174260ceb	그러나 최근 몇 년 동안 이 학군은 더 이상 최고 등급을 받지 못했습니다.	train
common_voice_en_19950040.mp3	The Newfoundland Democratic Party ran eighteen candidates, none of whom was elected.	74491ccd3495e209ddd31169484962be9536d4e4861cd2cf8eecba0cc90549aa42b1e3b88baedd6a5e231f1580f0b656d378ba61130bc91a960034b174260ceb	뉴펀들랜드 민주당은 18명의 후보를 출마시켰으나 아무도 당선되지 못했습니다.	train
common_voice_en_19950041.mp3	The battle continued until dark, when the Federals retired from the area.	74491ccd3495e209ddd31169484962be9536d4e4861cd2cf8eecba0cc90549aa42b1e3b88baedd6a5e231f1580f0b656d378ba61130bc91a960034b174260ceb	전투는 날이 어두워져 연방군이 이 지역에서 철수할 때까지 계속되었습니다.	train
common_voice_en_19950042.mp3	The songs on the album incorporate themes of folk music, soul music, and jazz.	74491ccd3495e209ddd31169484962be9536d4e4861cd2cf8eecba0cc90549aa42b1e3b88baedd6a5e231f1580f0b656d378ba61130bc91a960034b174260ceb	앨범에 수록된 곡은 포크 음악, 소울 음악, 재즈 등의 테마를 담고 있습니다.	train
common_voice_en_19950043.mp3	The Royal Botanic Gardens, Cranbourne focus solely on Australian native plants.	74491ccd3495e209ddd31169484962be9536d4e4861cd2cf8eecba0cc90549aa42b1e3b88baedd6a5e231f1580f0b656d378ba61130bc91a960034b174260ceb	크랜번의 로열 보타닉 가든은 호주 토종 식물에만 초점을 맞추고 있습니다.	train
common_voice_en_17270065.mp3	Have I offended you?	2840e1708b3432b93a3c13007c994b48618f50fb6e18a8ef47c7a040ded1d934cddccc8e343d8daa0f7901270e04ba8fda6d44d090fbad3d02c501b265d6d73a	제가 불쾌하게 했나요?	train_covost
common_voice_en_17272070.mp3	Pork cutlet is also very tasty, but our religion does not allow us to eat it.	2840e1708b3432b93a3c13007c994b48618f50fb6e18a8ef47c7a040ded1d934cddccc8e343d8daa0f7901270e04ba8fda6d44d090fbad3d02c501b265d6d73a	돈까스도 매우 맛있지만 우리 종교는 그것을 먹는 것을 허용하지 않습니다.	train_covost
common_voice_en_17275391.mp3	The insurance policy will expire in twenty-twenty.	2840e1708b3432b93a3c13007c994b48618f50fb6e18a8ef47c7a040ded1d934cddccc8e343d8daa0f7901270e04ba8fda6d44d090fbad3d02c501b265d6d73a	보험은 20년 후에 만료됩니다.	train_covost
common_voice_en_17275394.mp3	To look as if butter will not melt in his mouth.	2840e1708b3432b93a3c13007c994b48618f50fb6e18a8ef47c7a040ded1d934cddccc8e343d8daa0f7901270e04ba8fda6d44d090fbad3d02c501b265d6d73a	버터가 입안에서 녹지 않는 것처럼 보이게 하려면.	train_covost
common_voice_en_17275398.mp3	Pretty please with a cherry on top!	2840e1708b3432b93a3c13007c994b48618f50fb6e18a8ef47c7a040ded1d934cddccc8e343d8daa0f7901270e04ba8fda6d44d090fbad3d02c501b265d6d73a	위에 체리를 얹어주세요!	train_covost
common_voice_en_17275399.mp3	Every one knows best where the shoe pinches him.	2840e1708b3432b93a3c13007c994b48618f50fb6e18a8ef47c7a040ded1d934cddccc8e343d8daa0f7901270e04ba8fda6d44d090fbad3d02c501b265d6d73a	신발이 끼는 부위는 누구나 가장 잘 알고 있습니다.	train_covost
common_voice_en_17275400.mp3	He nodded his head.	2840e1708b3432b93a3c13007c994b48618f50fb6e18a8ef47c7a040ded1d934cddccc8e343d8daa0f7901270e04ba8fda6d44d090fbad3d02c501b265d6d73a	그는 고개를 끄덕였습니다.	train_covost
common_voice_en_17275401.mp3	An hotel.	2840e1708b3432b93a3c13007c994b48618f50fb6e18a8ef47c7a040ded1d934cddccc8e343d8daa0f7901270e04ba8fda6d44d090fbad3d02c501b265d6d73a	호텔.	train_covost
common_voice_en_17275403.mp3	I met up with Aditya at the party and we talked for hours.	2840e1708b3432b93a3c13007c994b48618f50fb6e18a8ef47c7a040ded1d934cddccc8e343d8daa0f7901270e04ba8fda6d44d090fbad3d02c501b265d6d73a	파티에서 아디트를 만나 몇 시간 동안 이야기를 나눴어요.	train_covost
common_voice_en_17275404.mp3	Tell me what it is.	2840e1708b3432b93a3c13007c994b48618f50fb6e18a8ef47c7a040ded1d934cddccc8e343d8daa0f7901270e04ba8fda6d44d090fbad3d02c501b265d6d73a	뭔지 알려주세요.	train_covost
common_voice_en_17275405.mp3	The album unexpectedly tops the sales chart this Christmas.	2840e1708b3432b93a3c13007c994b48618f50fb6e18a8ef47c7a040ded1d934cddccc8e343d8daa0f7901270e04ba8fda6d44d090fbad3d02c501b265d6d73a	이 앨범은 예상치 못하게 이번 크리스마스 판매 차트에서 1위를 차지했습니다.	train_covost
common_voice_en_17275406.mp3	The mute muffled the high tones of the horn.	2840e1708b3432b93a3c13007c994b48618f50fb6e18a8ef47c7a040ded1d934cddccc8e343d8daa0f7901270e04ba8fda6d44d090fbad3d02c501b265d6d73a	음소거로 경적의 높은 톤이 가려졌습니다.	train_covost
common_voice_en_17275419.mp3	It came about in this way.	2840e1708b3432b93a3c13007c994b48618f50fb6e18a8ef47c7a040ded1d934cddccc8e343d8daa0f7901270e04ba8fda6d44d090fbad3d02c501b265d6d73a	이렇게 해서 탄생했습니다.	train_covost
common_voice_en_17275421.mp3	The twenty-twenty Olympics will be held in Tokyo.	2840e1708b3432b93a3c13007c994b48618f50fb6e18a8ef47c7a040ded1d934cddccc8e343d8daa0f7901270e04ba8fda6d44d090fbad3d02c501b265d6d73a	2023 도쿄 올림픽은 도쿄에서 개최됩니다.	train_covost
common_voice_en_17275422.mp3	The knife was hung inside its bright sheath.	2840e1708b3432b93a3c13007c994b48618f50fb6e18a8ef47c7a040ded1d934cddccc8e343d8daa0f7901270e04ba8fda6d44d090fbad3d02c501b265d6d73a	칼은 밝은 칼집 안에 걸려 있었습니다.	train_covost
common_voice_en_17275425.mp3	Not on your life!	2840e1708b3432b93a3c13007c994b48618f50fb6e18a8ef47c7a040ded1d934cddccc8e343d8daa0f7901270e04ba8fda6d44d090fbad3d02c501b265d6d73a	목숨은 안 돼요!	train_covost
common_voice_en_17275427.mp3	A musical composition for seven instruments.	2840e1708b3432b93a3c13007c994b48618f50fb6e18a8ef47c7a040ded1d934cddccc8e343d8daa0f7901270e04ba8fda6d44d090fbad3d02c501b265d6d73a	7개의 악기를 위한 음악 작품입니다.	train_covost
common_voice_en_17275437.mp3	I want to go on.	2840e1708b3432b93a3c13007c994b48618f50fb6e18a8ef47c7a040ded1d934cddccc8e343d8daa0f7901270e04ba8fda6d44d090fbad3d02c501b265d6d73a	계속하고 싶어요.	train_covost
common_voice_en_17275440.mp3	That’s what you get for testing my patience.	2840e1708b3432b93a3c13007c994b48618f50fb6e18a8ef47c7a040ded1d934cddccc8e343d8daa0f7901270e04ba8fda6d44d090fbad3d02c501b265d6d73a	제 인내심을 시험한 대가가 바로 이것입니다.	train_covost
common_voice_en_17275442.mp3	She slowly led the panda back to her natural habitat.	2840e1708b3432b93a3c13007c994b48618f50fb6e18a8ef47c7a040ded1d934cddccc8e343d8daa0f7901270e04ba8fda6d44d090fbad3d02c501b265d6d73a	그녀는 팬더를 천천히 자연 서식지로 데려갔습니다.	train_covost
common_voice_en_17275452.mp3	At night the alarm roused him from a deep sleep.	2840e1708b3432b93a3c13007c994b48618f50fb6e18a8ef47c7a040ded1d934cddccc8e343d8daa0f7901270e04ba8fda6d44d090fbad3d02c501b265d6d73a	밤이 되자 알람 소리에 깊은 잠에서 깨어났습니다.	train_covost
common_voice_en_17275454.mp3	The hilt of the sword was carved with fine designs.	2840e1708b3432b93a3c13007c994b48618f50fb6e18a8ef47c7a040ded1d934cddccc8e343d8daa0f7901270e04ba8fda6d44d090fbad3d02c501b265d6d73a	검의 칼자루에는 섬세한 디자인이 새겨져 있습니다.	train_covost
common_voice_en_17275462.mp3	They hope to get a hybrid embryo by merging the DNA of a different species.	2840e1708b3432b93a3c13007c994b48618f50fb6e18a8ef47c7a040ded1d934cddccc8e343d8daa0f7901270e04ba8fda6d44d090fbad3d02c501b265d6d73a	그들은 다른 종의 DNA를 합쳐서 잡종 배아를 얻기를 희망합니다.	train_covost
common_voice_en_17275466.mp3	As sure as I am alive.	2840e1708b3432b93a3c13007c994b48618f50fb6e18a8ef47c7a040ded1d934cddccc8e343d8daa0f7901270e04ba8fda6d44d090fbad3d02c501b265d6d73a	내가 살아 있는 것만큼이나 확실합니다.	train_covost
common_voice_en_17275469.mp3	It was too late.	2840e1708b3432b93a3c13007c994b48618f50fb6e18a8ef47c7a040ded1d934cddccc8e343d8daa0f7901270e04ba8fda6d44d090fbad3d02c501b265d6d73a	너무 늦었습니다.	train_covost
common_voice_en_17344987.mp3	Surveillance cameras were set to allow police to find suspicious activities.	2840e1708b3432b93a3c13007c994b48618f50fb6e18a8ef47c7a040ded1d934cddccc8e343d8daa0f7901270e04ba8fda6d44d090fbad3d02c501b265d6d73a	경찰이 의심스러운 활동을 발견할 수 있도록 감시 카메라가 설치되었습니다.	train_covost
common_voice_en_17344999.mp3	The horn of the car woke the sleeping cop.	2840e1708b3432b93a3c13007c994b48618f50fb6e18a8ef47c7a040ded1d934cddccc8e343d8daa0f7901270e04ba8fda6d44d090fbad3d02c501b265d6d73a	차의 경적 소리에 잠든 경찰이 깨어났습니다.	train_covost
common_voice_en_17345001.mp3	To take a drop too much.	2840e1708b3432b93a3c13007c994b48618f50fb6e18a8ef47c7a040ded1d934cddccc8e343d8daa0f7901270e04ba8fda6d44d090fbad3d02c501b265d6d73a	너무 많이 복용하는 경우.	train_covost
common_voice_en_17345053.mp3	The fourth component of homogeneous coordinates is usually set to one.	2840e1708b3432b93a3c13007c994b48618f50fb6e18a8ef47c7a040ded1d934cddccc8e343d8daa0f7901270e04ba8fda6d44d090fbad3d02c501b265d6d73a	균일 좌표의 네 번째 구성 요소는 일반적으로 1로 설정됩니다.	train_covost
common_voice_en_17345087.mp3	Tell me about it.	2840e1708b3432b93a3c13007c994b48618f50fb6e18a8ef47c7a040ded1d934cddccc8e343d8daa0f7901270e04ba8fda6d44d090fbad3d02c501b265d6d73a	알려주세요.	train_covost
common_voice_en_17345114.mp3	"I don't have a single penny left."	2840e1708b3432b93a3c13007c994b48618f50fb6e18a8ef47c7a040ded1d934cddccc8e343d8daa0f7901270e04ba8fda6d44d090fbad3d02c501b265d6d73a	한 푼도 남지 않았습니다.	train_covost
common_voice_en_17357992.mp3	Of course I am!	2840e1708b3432b93a3c13007c994b48618f50fb6e18a8ef47c7a040ded1d934cddccc8e343d8daa0f7901270e04ba8fda6d44d090fbad3d02c501b265d6d73a	물론입니다!	train_covost
common_voice_en_17358030.mp3	The pup jerked the leash as he saw a feline shape.	2840e1708b3432b93a3c13007c994b48618f50fb6e18a8ef47c7a040ded1d934cddccc8e343d8daa0f7901270e04ba8fda6d44d090fbad3d02c501b265d6d73a	강아지는 고양이 모양을 보고 목줄을 잡아당겼습니다.	train_covost
common_voice_en_17358046.mp3	The ramp led up to the wide highway.	2840e1708b3432b93a3c13007c994b48618f50fb6e18a8ef47c7a040ded1d934cddccc8e343d8daa0f7901270e04ba8fda6d44d090fbad3d02c501b265d6d73a	경사로가 넓은 고속도로로 이어졌습니다.	train_covost
common_voice_en_17358093.mp3	Out of the frying-pan into the fire.	2840e1708b3432b93a3c13007c994b48618f50fb6e18a8ef47c7a040ded1d934cddccc8e343d8daa0f7901270e04ba8fda6d44d090fbad3d02c501b265d6d73a	프라이팬에서 불 속으로.	train_covost
common_voice_en_17358163.mp3	"It's an ill bird that fouls its own nest."	2840e1708b3432b93a3c13007c994b48618f50fb6e18a8ef47c7a040ded1d934cddccc8e343d8daa0f7901270e04ba8fda6d44d090fbad3d02c501b265d6d73a	자기 둥지를 더럽히는 병든 새입니다.	train_covost
common_voice_en_17358177.mp3	Seventeen gardeners are working this afternoon.	2840e1708b3432b93a3c13007c994b48618f50fb6e18a8ef47c7a040ded1d934cddccc8e343d8daa0f7901270e04ba8fda6d44d090fbad3d02c501b265d6d73a	오늘 오후에는 17명의 정원사가 일하고 있습니다.	train_covost
common_voice_en_17424581.mp3	Act on these orders with great speed.	2840e1708b3432b93a3c13007c994b48618f50fb6e18a8ef47c7a040ded1d934cddccc8e343d8daa0f7901270e04ba8fda6d44d090fbad3d02c501b265d6d73a	이러한 주문에 신속하게 대응하세요.	train_covost
common_voice_en_17427529.mp3	Eleven scorpions were collected by a hunter.	2840e1708b3432b93a3c13007c994b48618f50fb6e18a8ef47c7a040ded1d934cddccc8e343d8daa0f7901270e04ba8fda6d44d090fbad3d02c501b265d6d73a	전갈 11마리를 사냥꾼이 채집했습니다.	train_covost
common_voice_en_17427535.mp3	Absence makes the heart grow fonder.	2840e1708b3432b93a3c13007c994b48618f50fb6e18a8ef47c7a040ded1d934cddccc8e343d8daa0f7901270e04ba8fda6d44d090fbad3d02c501b265d6d73a	부재는 마음을 더 애틋하게 만듭니다.	train_covost
common_voice_en_17427537.mp3	Roads are paved with sticky tar.	2840e1708b3432b93a3c13007c994b48618f50fb6e18a8ef47c7a040ded1d934cddccc8e343d8daa0f7901270e04ba8fda6d44d090fbad3d02c501b265d6d73a	도로는 끈적끈적한 타르로 포장되어 있습니다.	train_covost
common_voice_en_17427544.mp3	The bank refused my deposit request.	2840e1708b3432b93a3c13007c994b48618f50fb6e18a8ef47c7a040ded1d934cddccc8e343d8daa0f7901270e04ba8fda6d44d090fbad3d02c501b265d6d73a	은행에서 입금 요청을 거부했습니다.	train_covost
common_voice_en_17427551.mp3	She stored a collection of dictionaries and encyclopedia books in this cupboard.	2840e1708b3432b93a3c13007c994b48618f50fb6e18a8ef47c7a040ded1d934cddccc8e343d8daa0f7901270e04ba8fda6d44d090fbad3d02c501b265d6d73a	그녀는 이 찬장에 사전과 백과사전 책을 모아 보관했습니다.	train_covost
common_voice_en_17427555.mp3	Birds of a feather flock together.	2840e1708b3432b93a3c13007c994b48618f50fb6e18a8ef47c7a040ded1d934cddccc8e343d8daa0f7901270e04ba8fda6d44d090fbad3d02c501b265d6d73a	깃털 같은 새들이 모여듭니다.	train_covost
common_voice_en_17427566.mp3	An apple a day keeps the doctor away.	2840e1708b3432b93a3c13007c994b48618f50fb6e18a8ef47c7a040ded1d934cddccc8e343d8daa0f7901270e04ba8fda6d44d090fbad3d02c501b265d6d73a	하루 사과 한 개가 의사를 멀리합니다.	train_covost
common_voice_en_17427590.mp3	Thinking of him or his accomplice alone gives me goose bumps.	2840e1708b3432b93a3c13007c994b48618f50fb6e18a8ef47c7a040ded1d934cddccc8e343d8daa0f7901270e04ba8fda6d44d090fbad3d02c501b265d6d73a	그 사람이나 그의 공범을 생각만 해도 소름이 돋습니다.	train_covost
common_voice_en_17427617.mp3	I think I saw some actors were gathering at a large restaurant.	2840e1708b3432b93a3c13007c994b48618f50fb6e18a8ef47c7a040ded1d934cddccc8e343d8daa0f7901270e04ba8fda6d44d090fbad3d02c501b265d6d73a	배우들이 큰 식당에 모여 있는 것을 본 것 같아요.	train_covost
common_voice_en_17427619.mp3	Breathe deep and smell the piny air.	2840e1708b3432b93a3c13007c994b48618f50fb6e18a8ef47c7a040ded1d934cddccc8e343d8daa0f7901270e04ba8fda6d44d090fbad3d02c501b265d6d73a	심호흡을 하고 상쾌한 공기 냄새를 맡으세요.	train_covost
common_voice_en_17444975.mp3	She did not answer.	2840e1708b3432b93a3c13007c994b48618f50fb6e18a8ef47c7a040ded1d934cddccc8e343d8daa0f7901270e04ba8fda6d44d090fbad3d02c501b265d6d73a	그녀는 대답하지 않았습니다.	train_covost
common_voice_en_17444981.mp3	I am rubber and you are glue. Your words bounce off me and stick to you.	2840e1708b3432b93a3c13007c994b48618f50fb6e18a8ef47c7a040ded1d934cddccc8e343d8daa0f7901270e04ba8fda6d44d090fbad3d02c501b265d6d73a	나는 고무이고 당신은 접착제입니다. 당신의 말은 나에게서 튕겨 나와 당신에게 달라붙습니다.	train_covost
common_voice_en_17444998.mp3	The effect was magical.	2840e1708b3432b93a3c13007c994b48618f50fb6e18a8ef47c7a040ded1d934cddccc8e343d8daa0f7901270e04ba8fda6d44d090fbad3d02c501b265d6d73a	그 효과는 마법과도 같았습니다.	train_covost
common_voice_en_17448883.mp3	Open your book to the first page.	2840e1708b3432b93a3c13007c994b48618f50fb6e18a8ef47c7a040ded1d934cddccc8e343d8daa0f7901270e04ba8fda6d44d090fbad3d02c501b265d6d73a	책을 첫 페이지로 엽니다.	train_covost
common_voice_en_17448891.mp3	Spare the rod and spoil the child.	2840e1708b3432b93a3c13007c994b48618f50fb6e18a8ef47c7a040ded1d934cddccc8e343d8daa0f7901270e04ba8fda6d44d090fbad3d02c501b265d6d73a	막대를 아끼고 아이를 망칠 수 있습니다.	train_covost
common_voice_en_17448899.mp3	I’ve got an announcement to make.	2840e1708b3432b93a3c13007c994b48618f50fb6e18a8ef47c7a040ded1d934cddccc8e343d8daa0f7901270e04ba8fda6d44d090fbad3d02c501b265d6d73a	발표할 내용이 있습니다.	train_covost
common_voice_en_17448939.mp3	"I'm going with Clara to buy some pillows and bolsters."	2840e1708b3432b93a3c13007c994b48618f50fb6e18a8ef47c7a040ded1d934cddccc8e343d8daa0f7901270e04ba8fda6d44d090fbad3d02c501b265d6d73a	클라라와 함께 베개와 받침대를 사러 가려고요.	train_covost
common_voice_en_17448966.mp3	Diana is suffering from migraine again.	2840e1708b3432b93a3c13007c994b48618f50fb6e18a8ef47c7a040ded1d934cddccc8e343d8daa0f7901270e04ba8fda6d44d090fbad3d02c501b265d6d73a	다이애나는 다시 편두통으로 고생하고 있습니다.	train_covost
common_voice_en_17489194.mp3	So far so good.	2840e1708b3432b93a3c13007c994b48618f50fb6e18a8ef47c7a040ded1d934cddccc8e343d8daa0f7901270e04ba8fda6d44d090fbad3d02c501b265d6d73a	지금까지는 괜찮습니다.	train_covost
common_voice_en_17524583.mp3	We were only half a mile from the destination when the engine packed in.	2840e1708b3432b93a3c13007c994b48618f50fb6e18a8ef47c7a040ded1d934cddccc8e343d8daa0f7901270e04ba8fda6d44d090fbad3d02c501b265d6d73a	목적지에서 불과 0.5마일 떨어진 지점에서 엔진이 가득 찼을 때였습니다.	train_covost
common_voice_en_17524595.mp3	No life can be dreary when work is a delight.	2840e1708b3432b93a3c13007c994b48618f50fb6e18a8ef47c7a040ded1d934cddccc8e343d8daa0f7901270e04ba8fda6d44d090fbad3d02c501b265d6d73a	일이 즐거우면 삶이 지루할 수 없습니다.	train_covost
common_voice_en_17524613.mp3	Other energy sources receive subsidies as well, often much higher.	2840e1708b3432b93a3c13007c994b48618f50fb6e18a8ef47c7a040ded1d934cddccc8e343d8daa0f7901270e04ba8fda6d44d090fbad3d02c501b265d6d73a	다른 에너지원도 보조금을 받는데, 보조금이 훨씬 높은 경우가 많습니다.	train_covost
common_voice_en_17524622.mp3	The lawyer tried to lose his case.	2840e1708b3432b93a3c13007c994b48618f50fb6e18a8ef47c7a040ded1d934cddccc8e343d8daa0f7901270e04ba8fda6d44d090fbad3d02c501b265d6d73a	변호사는 소송에서 패소했습니다.	train_covost
common_voice_en_17524634.mp3	The hospital is hiring nurses.	2840e1708b3432b93a3c13007c994b48618f50fb6e18a8ef47c7a040ded1d934cddccc8e343d8daa0f7901270e04ba8fda6d44d090fbad3d02c501b265d6d73a	병원에서 간호사를 채용하고 있습니다.	train_covost
common_voice_en_17524656.mp3	Ship technology has improved.	2840e1708b3432b93a3c13007c994b48618f50fb6e18a8ef47c7a040ded1d934cddccc8e343d8daa0f7901270e04ba8fda6d44d090fbad3d02c501b265d6d73a	선박 기술이 발전했습니다.	train_covost
common_voice_en_17524667.mp3	An injury is forgiven better than an injury revenged.	2840e1708b3432b93a3c13007c994b48618f50fb6e18a8ef47c7a040ded1d934cddccc8e343d8daa0f7901270e04ba8fda6d44d090fbad3d02c501b265d6d73a	부상은 복수를 당하는 것보다 용서받는 것이 더 낫습니다.	train_covost
common_voice_en_17524688.mp3	There are nineteen students in this Economics class.	2840e1708b3432b93a3c13007c994b48618f50fb6e18a8ef47c7a040ded1d934cddccc8e343d8daa0f7901270e04ba8fda6d44d090fbad3d02c501b265d6d73a	이 경제학 수업에는 19명의 학생이 있습니다.	train_covost
common_voice_en_17524709.mp3	"This artful creation is more than just a picture, it's a statement by the artist."	2840e1708b3432b93a3c13007c994b48618f50fb6e18a8ef47c7a040ded1d934cddccc8e343d8daa0f7901270e04ba8fda6d44d090fbad3d02c501b265d6d73a	이 예술적인 작품은 단순한 그림이 아니라 아티스트의 성명서입니다.	train_covost
common_voice_en_17524733.mp3	One of these days is none of these days.	2840e1708b3432b93a3c13007c994b48618f50fb6e18a8ef47c7a040ded1d934cddccc8e343d8daa0f7901270e04ba8fda6d44d090fbad3d02c501b265d6d73a	요즘은 요즘이 아닙니다.	train_covost
common_voice_en_17524734.mp3	"You don't really know what's inside when you eat takeouts."	2840e1708b3432b93a3c13007c994b48618f50fb6e18a8ef47c7a040ded1d934cddccc8e343d8daa0f7901270e04ba8fda6d44d090fbad3d02c501b265d6d73a	테이크아웃 음식을 먹을 때는 안에 무엇이 들어 있는지 알 수 없습니다.	train_covost
common_voice_en_17524744.mp3	It is no use crying over spilt milk.	2840e1708b3432b93a3c13007c994b48618f50fb6e18a8ef47c7a040ded1d934cddccc8e343d8daa0f7901270e04ba8fda6d44d090fbad3d02c501b265d6d73a	엎질러진 우유를 보고 울어도 소용없습니다.	train_covost
common_voice_en_17524773.mp3	Constitution of the empire.	2840e1708b3432b93a3c13007c994b48618f50fb6e18a8ef47c7a040ded1d934cddccc8e343d8daa0f7901270e04ba8fda6d44d090fbad3d02c501b265d6d73a	제국의 헌법.	train_covost
