path	sentence	client_id	translation	split
common_voice_en_18835379.mp3	Adjectives precede the noun they modify.	393ab743f2ad52cee65ab1b53571333466f91b7d69b4ee033fe98374de90d13512bcd6d5758bfd6cdd14f6afa6f8ca3b3f1a7b4fdd8d6c443ab8cef5fa39ce10	형용사는 수식하는 명사 앞에옵니다.	train
common_voice_en_18835380.mp3	Both papers are owned by local residents.	393ab743f2ad52cee65ab1b53571333466f91b7d69b4ee033fe98374de90d13512bcd6d5758bfd6cdd14f6afa6f8ca3b3f1a7b4fdd8d6c443ab8cef5fa39ce10	두 신문 모두 지역 주민이 소유하고 있습니다.	train
common_voice_en_18835382.mp3	The Clapper works with any American standard electrical outlet.	393ab743f2ad52cee65ab1b53571333466f91b7d69b4ee033fe98374de90d13512bcd6d5758bfd6cdd14f6afa6f8ca3b3f1a7b4fdd8d6c443ab8cef5fa39ce10	클래퍼는 모든 미국 표준 전기 콘센트에서 사용할 수 있습니다.	train
common_voice_en_17746282.mp3	Constitution of the empire.	39bca195e7648b029f860b2fa5f9e93ae394a9eb7fb237262b5f528966b779793cf667d873916d3e41962673158a2ee1e31b9121a5a43d86ac56dc07da07d4b7	제국의 헌법.	train_covost
common_voice_en_18852840.mp3	Vikramaditya is a legendary emperor, who is said to have ruled from Ujjain.	39bca195e7648b029f860b2fa5f9e93ae394a9eb7fb237262b5f528966b779793cf667d873916d3e41962673158a2ee1e31b9121a5a43d86ac56dc07da07d4b7	비크라마디티야는 우자인에서 통치했다고 전해지는 전설적인 황제입니다.	train
common_voice_en_18852841.mp3	Almost all of Lesser Poland lies in the Vistula River catchment area.	39bca195e7648b029f860b2fa5f9e93ae394a9eb7fb237262b5f528966b779793cf667d873916d3e41962673158a2ee1e31b9121a5a43d86ac56dc07da07d4b7	레서 폴란드의 거의 모든 지역은 비스툴라 강 유역에 있습니다.	train
common_voice_en_18852843.mp3	It ran for three seasons.	39bca195e7648b029f860b2fa5f9e93ae394a9eb7fb237262b5f528966b779793cf667d873916d3e41962673158a2ee1e31b9121a5a43d86ac56dc07da07d4b7	세 시즌 동안 운영되었습니다.	train
common_voice_en_18852844.mp3	It was a ghost image of Alpha Leonis.	39bca195e7648b029f860b2fa5f9e93ae394a9eb7fb237262b5f528966b779793cf667d873916d3e41962673158a2ee1e31b9121a5a43d86ac56dc07da07d4b7	알파 레오니스의 고스트 이미지였습니다.	train
common_voice_en_19553521.mp3	"He can't compare the situation there to this side, Bainimarama said."	3ca6da97babf68f9f33c19724180c3a89eb4a9def01d94c2c5b1b8d784748915eceb776dde16f21cf9e06ee6d208879a4e532822788a556512e941f48be1d135	바이니마라마는 그곳의 상황과 이쪽의 상황을 비교할 수 없다고 말했습니다.	train
common_voice_en_19553522.mp3	Cunningham lives in New England with her husband and their two sons.	3ca6da97babf68f9f33c19724180c3a89eb4a9def01d94c2c5b1b8d784748915eceb776dde16f21cf9e06ee6d208879a4e532822788a556512e941f48be1d135	커닝햄은 남편과 두 아들과 함께 뉴잉글랜드에 살고 있습니다.	train
common_voice_en_19553524.mp3	With the death of Ibrahim Lodi, the Lodi dynasty also came to an end.	3ca6da97babf68f9f33c19724180c3a89eb4a9def01d94c2c5b1b8d784748915eceb776dde16f21cf9e06ee6d208879a4e532822788a556512e941f48be1d135	이브라힘 로디의 죽음과 함께 로디 왕조도 막을 내렸습니다.	train
common_voice_en_19553555.mp3	The position eventually went to Angels bench coach Roenicke.	3ca6da97babf68f9f33c19724180c3a89eb4a9def01d94c2c5b1b8d784748915eceb776dde16f21cf9e06ee6d208879a4e532822788a556512e941f48be1d135	결국 그 자리는 엔젤스 벤치 코치인 로니케에게 돌아갔습니다.	train
common_voice_en_19553556.mp3	This tradition was dropped several years later.	3ca6da97babf68f9f33c19724180c3a89eb4a9def01d94c2c5b1b8d784748915eceb776dde16f21cf9e06ee6d208879a4e532822788a556512e941f48be1d135	이 전통은 몇 년 후 폐지되었습니다.	train
common_voice_en_19553557.mp3	During this time, no shots were fired.	3ca6da97babf68f9f33c19724180c3a89eb4a9def01d94c2c5b1b8d784748915eceb776dde16f21cf9e06ee6d208879a4e532822788a556512e941f48be1d135	이 기간 동안 총격은 발생하지 않았습니다.	train
common_voice_en_19553558.mp3	There is no different organization for this role.	3ca6da97babf68f9f33c19724180c3a89eb4a9def01d94c2c5b1b8d784748915eceb776dde16f21cf9e06ee6d208879a4e532822788a556512e941f48be1d135	이 역할을 위한 별도의 조직은 없습니다.	train
common_voice_en_19553559.mp3	"Among them were Feyenoord's archrivals Ajax."	3ca6da97babf68f9f33c19724180c3a89eb4a9def01d94c2c5b1b8d784748915eceb776dde16f21cf9e06ee6d208879a4e532822788a556512e941f48be1d135	그중에는 페예노르트의 라이벌인 아약스도 있었습니다.	train
common_voice_en_19553560.mp3	And I can be made!	3ca6da97babf68f9f33c19724180c3a89eb4a9def01d94c2c5b1b8d784748915eceb776dde16f21cf9e06ee6d208879a4e532822788a556512e941f48be1d135	그리고 나는 만들 수 있습니다!	train
common_voice_en_19553561.mp3	Pratt is primarily a left-handed batsman but also bowls right-arm off breaks.	3ca6da97babf68f9f33c19724180c3a89eb4a9def01d94c2c5b1b8d784748915eceb776dde16f21cf9e06ee6d208879a4e532822788a556512e941f48be1d135	프랫은 주로 왼손잡이 타자이지만 오른팔 오프 브레이크 볼링도 구사합니다.	train
common_voice_en_19553562.mp3	Overnight parking is forbidden.	3ca6da97babf68f9f33c19724180c3a89eb4a9def01d94c2c5b1b8d784748915eceb776dde16f21cf9e06ee6d208879a4e532822788a556512e941f48be1d135	야간 주차는 금지되어 있습니다.	train
common_voice_en_19553563.mp3	Her centerfold was photographed by Mario Casilli.	3ca6da97babf68f9f33c19724180c3a89eb4a9def01d94c2c5b1b8d784748915eceb776dde16f21cf9e06ee6d208879a4e532822788a556512e941f48be1d135	센터폴드는 마리오 카실리가 촬영했습니다.	train
common_voice_en_19553564.mp3	Peter has sold his rights to make a film of the Mokee Joe books.	3ca6da97babf68f9f33c19724180c3a89eb4a9def01d94c2c5b1b8d784748915eceb776dde16f21cf9e06ee6d208879a4e532822788a556512e941f48be1d135	Peter는 모키 조 책의 영화화 판권을 판매했습니다.	train
common_voice_en_19689619.mp3	She landed on the island of Delos, which was sacred to Apollo.	3ded721890c0ebc477ba1407f8da7afded7c5d1a3688bc56f5a5ce6032c2a645a07f54ac75bfaec487972508d4fcae2d6af735e1921405508dfa70f186bef190	그녀는 아폴로에게 신성한 섬이었던 델로스 섬에 상륙했습니다.	train
common_voice_en_19689621.mp3	The trustees then appointed Hardenbergh.	3ded721890c0ebc477ba1407f8da7afded7c5d1a3688bc56f5a5ce6032c2a645a07f54ac75bfaec487972508d4fcae2d6af735e1921405508dfa70f186bef190	그 후 이사회는 하든버그를 임명했습니다.	train
common_voice_en_19689623.mp3	Made in translucent or opaque variations, it is quite flexible and tough.	3ded721890c0ebc477ba1407f8da7afded7c5d1a3688bc56f5a5ce6032c2a645a07f54ac75bfaec487972508d4fcae2d6af735e1921405508dfa70f186bef190	반투명 또는 불투명 변형으로 제작되어 매우 유연하고 견고합니다.	train
common_voice_en_19689624.mp3	She was certified a true Albino American Bison.	3ded721890c0ebc477ba1407f8da7afded7c5d1a3688bc56f5a5ce6032c2a645a07f54ac75bfaec487972508d4fcae2d6af735e1921405508dfa70f186bef190	그녀는 진정한 알비노 아메리칸 들소라는 인증을 받았습니다.	train
common_voice_en_19689907.mp3	These notions can be extended to supermanifolds.	3ded721890c0ebc477ba1407f8da7afded7c5d1a3688bc56f5a5ce6032c2a645a07f54ac75bfaec487972508d4fcae2d6af735e1921405508dfa70f186bef190	이러한 개념은 슈퍼곡면으로 확장할 수 있습니다.	train
common_voice_en_19689908.mp3	"The pair finally settle there with the philosophy of ""Hakuna Matata""."	3ded721890c0ebc477ba1407f8da7afded7c5d1a3688bc56f5a5ce6032c2a645a07f54ac75bfaec487972508d4fcae2d6af735e1921405508dfa70f186bef190	두 사람은 마침내 '하쿠나 마타타'라는 철학을 가지고 그곳에 정착합니다.	train
common_voice_en_19689910.mp3	"He was seen as ""Enma"" in ""Mirmo!"	3ded721890c0ebc477ba1407f8da7afded7c5d1a3688bc56f5a5ce6032c2a645a07f54ac75bfaec487972508d4fcae2d6af735e1921405508dfa70f186bef190	그는 '미르모'에서 '엔마'로 등장했습니다.	train
common_voice_en_19689912.mp3	A further difference is the more restrictive boundary-line rules of American croquet.	3ded721890c0ebc477ba1407f8da7afded7c5d1a3688bc56f5a5ce6032c2a645a07f54ac75bfaec487972508d4fcae2d6af735e1921405508dfa70f186bef190	또 다른 차이점은 미국 크로켓의 경계선 규칙이 더 제한적이라는 점입니다.	train
common_voice_en_19689915.mp3	Visual auras can be simple or complex.	3ded721890c0ebc477ba1407f8da7afded7c5d1a3688bc56f5a5ce6032c2a645a07f54ac75bfaec487972508d4fcae2d6af735e1921405508dfa70f186bef190	시각적 아우라는 단순하거나 복잡할 수 있습니다.	train
common_voice_en_19690337.mp3	General John S. Marmaduke.	3ded721890c0ebc477ba1407f8da7afded7c5d1a3688bc56f5a5ce6032c2a645a07f54ac75bfaec487972508d4fcae2d6af735e1921405508dfa70f186bef190	존 S. 마마듀크 장군.	train
common_voice_en_19690340.mp3	"The female version is deeper and less distinct than the male's."	3ded721890c0ebc477ba1407f8da7afded7c5d1a3688bc56f5a5ce6032c2a645a07f54ac75bfaec487972508d4fcae2d6af735e1921405508dfa70f186bef190	여성 버전은 남성 버전보다 더 깊고 덜 뚜렷합니다.	train
common_voice_en_19690341.mp3	The crash is being investigated by Transport Canada and the Transportation Safety Board.	3ded721890c0ebc477ba1407f8da7afded7c5d1a3688bc56f5a5ce6032c2a645a07f54ac75bfaec487972508d4fcae2d6af735e1921405508dfa70f186bef190	이 사고는 캐나다 교통부와 교통안전위원회에서 조사 중입니다.	train
common_voice_en_19690343.mp3	The minerals are sorted by name.	3ded721890c0ebc477ba1407f8da7afded7c5d1a3688bc56f5a5ce6032c2a645a07f54ac75bfaec487972508d4fcae2d6af735e1921405508dfa70f186bef190	미네랄은 이름별로 정렬됩니다.	train
common_voice_en_18943114.mp3	However, the original torch badge was designed by pupils in a competition.	3edcfe2dcbea67ac4c485d1477521987aee3ec9faa3c4d4ce31529df100ff3b8ec8cddf3e88fc50d321300c217570191c0c228afc45346f9ea175288170d04e8	하지만 원래의 성화 배지는 학생들이 공모전을 통해 디자인한 것입니다.	train
common_voice_en_18943115.mp3	Phillipsburg hosts the rodeo each year, typically during the first week of August.	3edcfe2dcbea67ac4c485d1477521987aee3ec9faa3c4d4ce31529df100ff3b8ec8cddf3e88fc50d321300c217570191c0c228afc45346f9ea175288170d04e8	필립스버그는 매년 8월 첫째 주에 로데오를 개최합니다.	train
common_voice_en_18943116.mp3	"Saint Andrew's School is located in Jalan Hj."	3edcfe2dcbea67ac4c485d1477521987aee3ec9faa3c4d4ce31529df100ff3b8ec8cddf3e88fc50d321300c217570191c0c228afc45346f9ea175288170d04e8	세인트 앤드루스 스쿨은 잘란 Hj에 위치해 있습니다.	train
common_voice_en_18943117.mp3	He was director of Shakespeare at the American Academy of Dramatic Arts.	3edcfe2dcbea67ac4c485d1477521987aee3ec9faa3c4d4ce31529df100ff3b8ec8cddf3e88fc50d321300c217570191c0c228afc45346f9ea175288170d04e8	그는 미국 드라마 예술 아카데미에서 셰익스피어 담당 디렉터를 역임했습니다.	train
common_voice_en_18943118.mp3	Combined with corruption scandals, this weakened the party considerably.	3edcfe2dcbea67ac4c485d1477521987aee3ec9faa3c4d4ce31529df100ff3b8ec8cddf3e88fc50d321300c217570191c0c228afc45346f9ea175288170d04e8	부패 스캔들과 맞물려 당의 위상이 크게 약화되었습니다.	train
common_voice_en_18943129.mp3	Besides, it also offers courses in biology and agriculture.	3edcfe2dcbea67ac4c485d1477521987aee3ec9faa3c4d4ce31529df100ff3b8ec8cddf3e88fc50d321300c217570191c0c228afc45346f9ea175288170d04e8	또한 생물학 및 농업 관련 과정도 제공합니다.	train
common_voice_en_18943130.mp3	Bayezid allowed the Jews to live on the banks of the Golden Horn.	3edcfe2dcbea67ac4c485d1477521987aee3ec9faa3c4d4ce31529df100ff3b8ec8cddf3e88fc50d321300c217570191c0c228afc45346f9ea175288170d04e8	바예지드는 유대인들이 골든 혼 강 유역에서 살 수 있도록 허용했습니다.	train
common_voice_en_18943131.mp3	"During the Satsuma Rebellion, he served as commander of the Army's Third Brigade."	3edcfe2dcbea67ac4c485d1477521987aee3ec9faa3c4d4ce31529df100ff3b8ec8cddf3e88fc50d321300c217570191c0c228afc45346f9ea175288170d04e8	사쓰마 반란 당시에는 육군 제3여단 사령관을 역임했습니다.	train
common_voice_en_18943132.mp3	However, the high rate of turnover among anchors returned.	3edcfe2dcbea67ac4c485d1477521987aee3ec9faa3c4d4ce31529df100ff3b8ec8cddf3e88fc50d321300c217570191c0c228afc45346f9ea175288170d04e8	하지만 앵커들의 높은 이직률은 다시 돌아왔습니다.	train
common_voice_en_18943134.mp3	This is the largest crater on the near side of the Moon.	3edcfe2dcbea67ac4c485d1477521987aee3ec9faa3c4d4ce31529df100ff3b8ec8cddf3e88fc50d321300c217570191c0c228afc45346f9ea175288170d04e8	달의 가까운 쪽에서 가장 큰 분화구입니다.	train
common_voice_en_18943136.mp3	Within a few days he received a reply that there were currently no vacancies.	3edcfe2dcbea67ac4c485d1477521987aee3ec9faa3c4d4ce31529df100ff3b8ec8cddf3e88fc50d321300c217570191c0c228afc45346f9ea175288170d04e8	며칠 만에 그는 현재 공석이 없다는 답변을 받았습니다.	train
common_voice_en_18943137.mp3	By offering money instead of land, lords could afford to retain more followers.	3edcfe2dcbea67ac4c485d1477521987aee3ec9faa3c4d4ce31529df100ff3b8ec8cddf3e88fc50d321300c217570191c0c228afc45346f9ea175288170d04e8	영주들은 토지 대신 돈을 제공함으로써 더 많은 추종자를 유지할 수 있었습니다.	train
common_voice_en_18943138.mp3	Scholl College has educated about one-third of all podiatric physicians in the nation.	3edcfe2dcbea67ac4c485d1477521987aee3ec9faa3c4d4ce31529df100ff3b8ec8cddf3e88fc50d321300c217570191c0c228afc45346f9ea175288170d04e8	숄 대학은 미국 전체 족부 전문의의 약 3분의 1을 교육했습니다.	train
common_voice_en_19299473.mp3	It lies on the road between Herisau and Appenzell.	407ac184bc367847dbec9eba4b2edcb191ffc14c0fab6d417fdda799e8b995680d6a214cb96ce1747b54d312e7779775614f3f4c91f999b1d69a0c3c05392d9e	헤리사우와 아펜첼 사이의 도로에 위치해 있다.	train
common_voice_en_19299474.mp3	These regiments were used by Vandamme to defend against enemy cavalry charges.	407ac184bc367847dbec9eba4b2edcb191ffc14c0fab6d417fdda799e8b995680d6a214cb96ce1747b54d312e7779775614f3f4c91f999b1d69a0c3c05392d9e	이 연대는 반담메가 적 기병대의 돌격을 방어하는 데 사용했습니다.	train
common_voice_en_19299476.mp3	As a result, Jacen defeats Supreme Overlord Onimi.	407ac184bc367847dbec9eba4b2edcb191ffc14c0fab6d417fdda799e8b995680d6a214cb96ce1747b54d312e7779775614f3f4c91f999b1d69a0c3c05392d9e	그 결과 제이켄은 대군주 오니미를 물리칩니다.	train
common_voice_en_19299477.mp3	Charles Wallace Howard, north of Kingston.	407ac184bc367847dbec9eba4b2edcb191ffc14c0fab6d417fdda799e8b995680d6a214cb96ce1747b54d312e7779775614f3f4c91f999b1d69a0c3c05392d9e	찰스 월리스 하워드, 킹스턴 북쪽.	train
common_voice_en_19299718.mp3	Vanderbilt lost custody of her daughter to her sister-in-law Gertrude Vanderbilt Whitney.	407ac184bc367847dbec9eba4b2edcb191ffc14c0fab6d417fdda799e8b995680d6a214cb96ce1747b54d312e7779775614f3f4c91f999b1d69a0c3c05392d9e	밴더빌트는 딸의 양육권을 시누이인 거트루드 밴더빌트 휘트니에게 빼앗겼습니다.	train
common_voice_en_19299720.mp3	It did do moderately well in Chile.	407ac184bc367847dbec9eba4b2edcb191ffc14c0fab6d417fdda799e8b995680d6a214cb96ce1747b54d312e7779775614f3f4c91f999b1d69a0c3c05392d9e	칠레에서는 어느 정도 성과를 거두었습니다.	train
common_voice_en_19299722.mp3	Engaru is known as the place where Aikido originated, in the Shirataki area.	407ac184bc367847dbec9eba4b2edcb191ffc14c0fab6d417fdda799e8b995680d6a214cb96ce1747b54d312e7779775614f3f4c91f999b1d69a0c3c05392d9e	엔가루는 합기도의 발상지인 시라타키 지역으로 알려져 있습니다.	train
common_voice_en_19299725.mp3	The painting contains six figures: the Madonna and Child and four angels.	407ac184bc367847dbec9eba4b2edcb191ffc14c0fab6d417fdda799e8b995680d6a214cb96ce1747b54d312e7779775614f3f4c91f999b1d69a0c3c05392d9e	이 그림에는 마돈나와 아이, 네 명의 천사 등 여섯 명의 인물이 등장합니다.	train
common_voice_en_19299727.mp3	On his death the title passed to his eldest son Edward, the third Baron.	407ac184bc367847dbec9eba4b2edcb191ffc14c0fab6d417fdda799e8b995680d6a214cb96ce1747b54d312e7779775614f3f4c91f999b1d69a0c3c05392d9e	그가 사망하자 남작 직위는 장남인 에드워드에게로 넘어갔습니다.	train
common_voice_en_19299798.mp3	Consequently, India has the second-highest genetic diversity in the world.	407ac184bc367847dbec9eba4b2edcb191ffc14c0fab6d417fdda799e8b995680d6a214cb96ce1747b54d312e7779775614f3f4c91f999b1d69a0c3c05392d9e	그 결과 인도는 세계에서 두 번째로 높은 유전적 다양성을 보유하고 있습니다.	train
common_voice_en_19299799.mp3	It lies northwest of Pattambi in Palakkad district, of the state of Kerala, India.	407ac184bc367847dbec9eba4b2edcb191ffc14c0fab6d417fdda799e8b995680d6a214cb96ce1747b54d312e7779775614f3f4c91f999b1d69a0c3c05392d9e	인도 케랄라 주 팔라카드 지역의 파탐비 북서쪽에 위치하고 있습니다.	train
common_voice_en_19299800.mp3	Other emigrants followed, camped in the canyon and went to work at mining.	407ac184bc367847dbec9eba4b2edcb191ffc14c0fab6d417fdda799e8b995680d6a214cb96ce1747b54d312e7779775614f3f4c91f999b1d69a0c3c05392d9e	다른 이민자들도 뒤이어 협곡에서 야영을 하며 광산에서 일하기 시작했습니다.	train
common_voice_en_19299802.mp3	Horsnell believes it is plausible that is how this area got its name.	407ac184bc367847dbec9eba4b2edcb191ffc14c0fab6d417fdda799e8b995680d6a214cb96ce1747b54d312e7779775614f3f4c91f999b1d69a0c3c05392d9e	호르넬은 이 지역이 이렇게 이름이 붙여진 것이 그럴듯하다고 생각합니다.	train
common_voice_en_19626465.mp3	Later that same month, Terrell had another three hits, including a three-run home run.	445a0c87cddfe6ea71b7bde304a70eac46aec662c610fa1b8f64e4b4bd0249209fd8ba8c8c9415f936e6b17c12467103d969378e4eba45076ed8931ebb42f942	같은 달 말, 테렐은 3점 홈런을 포함해 3안타를 더 기록했습니다.	train
common_voice_en_19626466.mp3	After a period of neglect, the building now houses Missouri state offices.	445a0c87cddfe6ea71b7bde304a70eac46aec662c610fa1b8f64e4b4bd0249209fd8ba8c8c9415f936e6b17c12467103d969378e4eba45076ed8931ebb42f942	한동안 방치되었던 이 건물에는 현재 미주리 주정부 사무실이 입주해 있습니다.	train
common_voice_en_19626468.mp3	Consider for example the Smalltalk language.	445a0c87cddfe6ea71b7bde304a70eac46aec662c610fa1b8f64e4b4bd0249209fd8ba8c8c9415f936e6b17c12467103d969378e4eba45076ed8931ebb42f942	예를 들어 스몰토크 언어를 생각해 보세요.	train
common_voice_en_19626470.mp3	Indian Valley Middle School is located in Tuscarawas.	445a0c87cddfe6ea71b7bde304a70eac46aec662c610fa1b8f64e4b4bd0249209fd8ba8c8c9415f936e6b17c12467103d969378e4eba45076ed8931ebb42f942	인디언 밸리 중학교는 투스카라와스에 위치해 있습니다.	train
common_voice_en_19626471.mp3	Numerous tribes participate in Native American regalia with dancing, singing and drumming.	445a0c87cddfe6ea71b7bde304a70eac46aec662c610fa1b8f64e4b4bd0249209fd8ba8c8c9415f936e6b17c12467103d969378e4eba45076ed8931ebb42f942	수많은 부족이 춤과 노래, 북을 치며 아메리카 원주민 의상에 참여합니다.	train
common_voice_en_19626551.mp3	The company has stores across the United States.	445a0c87cddfe6ea71b7bde304a70eac46aec662c610fa1b8f64e4b4bd0249209fd8ba8c8c9415f936e6b17c12467103d969378e4eba45076ed8931ebb42f942	이 회사는 미국 전역에 매장을 보유하고 있습니다.	train
common_voice_en_19626552.mp3	More intense agriculture was characteristic, with terracing and irrigation common.	445a0c87cddfe6ea71b7bde304a70eac46aec662c610fa1b8f64e4b4bd0249209fd8ba8c8c9415f936e6b17c12467103d969378e4eba45076ed8931ebb42f942	계단식 경작과 관개 시설이 일반화되어 보다 집약적인 농업이 특징적이었습니다.	train
common_voice_en_19626553.mp3	Phillip is a former member of the alternative rock band Egos Aside.	445a0c87cddfe6ea71b7bde304a70eac46aec662c610fa1b8f64e4b4bd0249209fd8ba8c8c9415f936e6b17c12467103d969378e4eba45076ed8931ebb42f942	필립은 얼터너티브 록 밴드 에고스 어사이드의 전 멤버입니다.	train
common_voice_en_19626555.mp3	“Six dozen lions?” he said.	445a0c87cddfe6ea71b7bde304a70eac46aec662c610fa1b8f64e4b4bd0249209fd8ba8c8c9415f936e6b17c12467103d969378e4eba45076ed8931ebb42f942	"사자 여섯 마리?" 그가 말했다.	train
common_voice_en_19626557.mp3	Some affected dogs may die suddenly without showing any signs of problems.	445a0c87cddfe6ea71b7bde304a70eac46aec662c610fa1b8f64e4b4bd0249209fd8ba8c8c9415f936e6b17c12467103d969378e4eba45076ed8931ebb42f942	일부 감염된 개는 아무런 징후 없이 갑자기 사망할 수 있습니다.	train
common_voice_en_19626601.mp3	He is also the true father of Hinata and Wakaba.	445a0c87cddfe6ea71b7bde304a70eac46aec662c610fa1b8f64e4b4bd0249209fd8ba8c8c9415f936e6b17c12467103d969378e4eba45076ed8931ebb42f942	그는 히나타와 와카바의 진정한 아버지이기도 합니다.	train
common_voice_en_19626602.mp3	Mohr grew up in Thomson, Georgia, where he played football at Briarwood Academy.	445a0c87cddfe6ea71b7bde304a70eac46aec662c610fa1b8f64e4b4bd0249209fd8ba8c8c9415f936e6b17c12467103d969378e4eba45076ed8931ebb42f942	모어는 조지아주 톰슨에서 자랐으며, 브리어우드 아카데미에서 축구 선수로 활동했습니다.	train
common_voice_en_19626605.mp3	"Some ""Linaria"" are regarded as noxious weeds."	445a0c87cddfe6ea71b7bde304a70eac46aec662c610fa1b8f64e4b4bd0249209fd8ba8c8c9415f936e6b17c12467103d969378e4eba45076ed8931ebb42f942	일부 "리나리아"는 유해한 잡초로 간주됩니다.	train
common_voice_en_19676505.mp3	Some of the officers used pieces of furniture to block the doors.	48c9f000ecd4adc49763b5ea6568a076578ca2a1dbb017f726c11e515b79a1561a797db67b3fbfee034cd181fb648ae7009402ea74834459edc3bd33bc031819	일부 경찰관들은 가구 조각을 이용해 문을 막았습니다.	train
common_voice_en_19676506.mp3	A number of spin-off works were also created, including a play about the brother.	48c9f000ecd4adc49763b5ea6568a076578ca2a1dbb017f726c11e515b79a1561a797db67b3fbfee034cd181fb648ae7009402ea74834459edc3bd33bc031819	형제에 관한 연극을 비롯해 여러 스핀오프 작품도 제작되었습니다.	train
common_voice_en_19676507.mp3	The division served on the Western Front for the duration of the war.	48c9f000ecd4adc49763b5ea6568a076578ca2a1dbb017f726c11e515b79a1561a797db67b3fbfee034cd181fb648ae7009402ea74834459edc3bd33bc031819	이 사단은 전쟁 기간 동안 서부 전선에서 복무했습니다.	train
common_voice_en_19676508.mp3	Eight lived to maturity.	48c9f000ecd4adc49763b5ea6568a076578ca2a1dbb017f726c11e515b79a1561a797db67b3fbfee034cd181fb648ae7009402ea74834459edc3bd33bc031819	여덟 명은 만기까지 살았습니다.	train
common_voice_en_19676509.mp3	It requires forward flight to create the aerodynamic lift component.	48c9f000ecd4adc49763b5ea6568a076578ca2a1dbb017f726c11e515b79a1561a797db67b3fbfee034cd181fb648ae7009402ea74834459edc3bd33bc031819	공기역학적 양력 요소를 생성하려면 전방 비행이 필요합니다.	train
common_voice_en_19676525.mp3	There are also wolverines in the park.	48c9f000ecd4adc49763b5ea6568a076578ca2a1dbb017f726c11e515b79a1561a797db67b3fbfee034cd181fb648ae7009402ea74834459edc3bd33bc031819	공원에는 울버린도 있습니다.	train
common_voice_en_19676527.mp3	In the following centuries, several battles took place in this frontier area.	48c9f000ecd4adc49763b5ea6568a076578ca2a1dbb017f726c11e515b79a1561a797db67b3fbfee034cd181fb648ae7009402ea74834459edc3bd33bc031819	이후 몇 세기 동안 이 국경 지역에서는 여러 차례 전투가 벌어졌습니다.	train
common_voice_en_19676529.mp3	Of the two, Brandon is the largest.	48c9f000ecd4adc49763b5ea6568a076578ca2a1dbb017f726c11e515b79a1561a797db67b3fbfee034cd181fb648ae7009402ea74834459edc3bd33bc031819	둘 중 브랜든이 가장 큰 규모입니다.	train
common_voice_en_19676531.mp3	On the European cover, Devo is seen wearing Sleeveless Maxi-Turtleneck Sweaters.	48c9f000ecd4adc49763b5ea6568a076578ca2a1dbb017f726c11e515b79a1561a797db67b3fbfee034cd181fb648ae7009402ea74834459edc3bd33bc031819	유럽 커버에서 데보는 민소매 맥시 터틀넥 스웨터를 입고 있습니다.	train
common_voice_en_19676589.mp3	Until his retirement, he holds the chair of Sociology at Lund University.	48c9f000ecd4adc49763b5ea6568a076578ca2a1dbb017f726c11e515b79a1561a797db67b3fbfee034cd181fb648ae7009402ea74834459edc3bd33bc031819	은퇴할 때까지 룬드 대학교에서 사회학 교수로 재직했습니다.	train
common_voice_en_19676590.mp3	It was the last major battle of the war.	48c9f000ecd4adc49763b5ea6568a076578ca2a1dbb017f726c11e515b79a1561a797db67b3fbfee034cd181fb648ae7009402ea74834459edc3bd33bc031819	이 전투는 전쟁의 마지막 주요 전투였습니다.	train
common_voice_en_19676591.mp3	Carrack once again left Squeeze, however, after about a year.	48c9f000ecd4adc49763b5ea6568a076578ca2a1dbb017f726c11e515b79a1561a797db67b3fbfee034cd181fb648ae7009402ea74834459edc3bd33bc031819	하지만 캐락은 약 1년 만에 다시 Squeeze를 떠났습니다.	train
common_voice_en_19676592.mp3	Each won his first match, while two were defeated in the second round.	48c9f000ecd4adc49763b5ea6568a076578ca2a1dbb017f726c11e515b79a1561a797db67b3fbfee034cd181fb648ae7009402ea74834459edc3bd33bc031819	두 선수는 첫 경기에서 승리했고, 두 선수는 두 번째 경기에서 패배했습니다.	train
