path	sentence	client_id	translation	split
common_voice_en_18895877.mp3	We ended up lacking challenge.	85f268e45ebcf8d6ec9a420b2dd6584bd67b3c0e5c709a62d88a4d37c69986f4c012f81c971b0a514ad19eb7cf2f2f9ee10c0124d6fc1f1f4ccfe2e13ab3db44	결국 우리는 도전이 부족했습니다.	train
common_voice_en_18895894.mp3	Some have pointed to this as one reason for the breakdown of American-British relations.	85f268e45ebcf8d6ec9a420b2dd6584bd67b3c0e5c709a62d88a4d37c69986f4c012f81c971b0a514ad19eb7cf2f2f9ee10c0124d6fc1f1f4ccfe2e13ab3db44	일각에서는 이를 미국과 영국 관계 악화의 한 원인으로 지적하기도 합니다.	train
common_voice_en_18895895.mp3	"A couple of weeks later, Dowd's wife Lisa gave birth to their first child."	85f268e45ebcf8d6ec9a420b2dd6584bd67b3c0e5c709a62d88a4d37c69986f4c012f81c971b0a514ad19eb7cf2f2f9ee10c0124d6fc1f1f4ccfe2e13ab3db44	몇 주 후, 다우드의 아내 Lisa는 첫 아이를 출산했습니다.	train
common_voice_en_18895896.mp3	Armstrong was too ill to play his trumpet.	85f268e45ebcf8d6ec9a420b2dd6584bd67b3c0e5c709a62d88a4d37c69986f4c012f81c971b0a514ad19eb7cf2f2f9ee10c0124d6fc1f1f4ccfe2e13ab3db44	암스트롱은 너무 아파서 트럼펫을 연주할 수 없었습니다.	train
common_voice_en_18895897.mp3	Air compression on the outer surfaces caused the cabin to heat up during flight.	85f268e45ebcf8d6ec9a420b2dd6584bd67b3c0e5c709a62d88a4d37c69986f4c012f81c971b0a514ad19eb7cf2f2f9ee10c0124d6fc1f1f4ccfe2e13ab3db44	외부 표면의 공기 압축으로 인해 비행 중 기내가 뜨거워집니다.	train
common_voice_en_18895898.mp3	These lizards are prey for many desert species.	85f268e45ebcf8d6ec9a420b2dd6584bd67b3c0e5c709a62d88a4d37c69986f4c012f81c971b0a514ad19eb7cf2f2f9ee10c0124d6fc1f1f4ccfe2e13ab3db44	이 도마뱀은 많은 사막 종의 먹이입니다.	train
common_voice_en_18895909.mp3	This was due to two major factors.	85f268e45ebcf8d6ec9a420b2dd6584bd67b3c0e5c709a62d88a4d37c69986f4c012f81c971b0a514ad19eb7cf2f2f9ee10c0124d6fc1f1f4ccfe2e13ab3db44	이는 크게 두 가지 요인에 기인합니다.	train
common_voice_en_18895910.mp3	Carver County is divided into two congressional districts.	85f268e45ebcf8d6ec9a420b2dd6584bd67b3c0e5c709a62d88a4d37c69986f4c012f81c971b0a514ad19eb7cf2f2f9ee10c0124d6fc1f1f4ccfe2e13ab3db44	카버 카운티는 두 개의 하원 선거구로 나뉩니다.	train
common_voice_en_18895911.mp3	He later served as a pastor for a church in Montclair, New Jersey.	85f268e45ebcf8d6ec9a420b2dd6584bd67b3c0e5c709a62d88a4d37c69986f4c012f81c971b0a514ad19eb7cf2f2f9ee10c0124d6fc1f1f4ccfe2e13ab3db44	이후 뉴저지 몽클레어에 있는 교회에서 목사로 봉사했습니다.	train
common_voice_en_18895912.mp3	They take three or four years to reach maturity.	85f268e45ebcf8d6ec9a420b2dd6584bd67b3c0e5c709a62d88a4d37c69986f4c012f81c971b0a514ad19eb7cf2f2f9ee10c0124d6fc1f1f4ccfe2e13ab3db44	성숙에 도달하는 데 3~4년이 걸립니다.	train
common_voice_en_18895913.mp3	Bolivia is a multiethnic, majority indigenous country in South America.	85f268e45ebcf8d6ec9a420b2dd6584bd67b3c0e5c709a62d88a4d37c69986f4c012f81c971b0a514ad19eb7cf2f2f9ee10c0124d6fc1f1f4ccfe2e13ab3db44	볼리비아는 남미에 위치한 다민족 원주민이 대다수인 국가입니다.	train
common_voice_en_18650342.mp3	"""You have been a soldier,"" observes Sir Leicester, ""and a faithful one."""	8dfb78858c3e41e4ebe34aae460030a36639767a5e51b4717237b151c26fae8449e7d1214c7c267b26d67563be2d4826eaeeafbd2519e2dec7047082974f2259	레스터 경은 "당신은 군인이었고, 충실한 군인이었습니다."라고 말합니다.	train
common_voice_en_18650343.mp3	I never had such a night in my life!	8dfb78858c3e41e4ebe34aae460030a36639767a5e51b4717237b151c26fae8449e7d1214c7c267b26d67563be2d4826eaeeafbd2519e2dec7047082974f2259	제 인생에서 이런 밤은 처음이었어요!	train
common_voice_en_18650344.mp3	"He ceased, and, grabbing out, missed me by a hair's breadth."	8dfb78858c3e41e4ebe34aae460030a36639767a5e51b4717237b151c26fae8449e7d1214c7c267b26d67563be2d4826eaeeafbd2519e2dec7047082974f2259	그는 멈춰서서 나를 붙잡고 머리카락 한 올 차이로 놓쳤습니다.	train
common_voice_en_18650345.mp3	The shopping spree was burning a hole in my wallet.	8dfb78858c3e41e4ebe34aae460030a36639767a5e51b4717237b151c26fae8449e7d1214c7c267b26d67563be2d4826eaeeafbd2519e2dec7047082974f2259	쇼핑으로 인해 지갑에 구멍이 났습니다.	train
common_voice_en_18650346.mp3	Then, feeling queenly, she showed Paul how to blanch almonds.	8dfb78858c3e41e4ebe34aae460030a36639767a5e51b4717237b151c26fae8449e7d1214c7c267b26d67563be2d4826eaeeafbd2519e2dec7047082974f2259	그런 다음 여왕처럼 기분이 좋아진 그녀는 폴에게 아몬드 데치는 방법을 알려주었습니다.	train
common_voice_en_18650347.mp3	She must have changed her dress last night in an unusual hurry.	8dfb78858c3e41e4ebe34aae460030a36639767a5e51b4717237b151c26fae8449e7d1214c7c267b26d67563be2d4826eaeeafbd2519e2dec7047082974f2259	어젯밤 비정상적으로 서둘러 옷을 갈아입었나 봐요.	train
common_voice_en_18650348.mp3	The perplexity upon his face greatly increased.	8dfb78858c3e41e4ebe34aae460030a36639767a5e51b4717237b151c26fae8449e7d1214c7c267b26d67563be2d4826eaeeafbd2519e2dec7047082974f2259	그의 얼굴에 당혹감이 크게 고조되었습니다.	train
common_voice_en_18650349.mp3	Did he look, when he was living, so very ill and poor?	8dfb78858c3e41e4ebe34aae460030a36639767a5e51b4717237b151c26fae8449e7d1214c7c267b26d67563be2d4826eaeeafbd2519e2dec7047082974f2259	그가 살아생전 그렇게 병들고 가난해 보였나요?	train_covost
common_voice_en_18650350.mp3	Open street maps enable humanitarian aid workers to reach the hardest to reach places.	8dfb78858c3e41e4ebe34aae460030a36639767a5e51b4717237b151c26fae8449e7d1214c7c267b26d67563be2d4826eaeeafbd2519e2dec7047082974f2259	개방형 거리 지도를 통해 인도주의적 구호 활동가들은 접근하기 어려운 곳까지 도달할 수 있습니다.	train
common_voice_en_18650351.mp3	My God, I wish I had never seen that cursed motor-car!	8dfb78858c3e41e4ebe34aae460030a36639767a5e51b4717237b151c26fae8449e7d1214c7c267b26d67563be2d4826eaeeafbd2519e2dec7047082974f2259	세상에, 그 저주받은 자동차를 보지 말았어야 했어요!	train_covost
common_voice_en_18654229.mp3	And how do you get on, Richard?	8dfb78858c3e41e4ebe34aae460030a36639767a5e51b4717237b151c26fae8449e7d1214c7c267b26d67563be2d4826eaeeafbd2519e2dec7047082974f2259	어떻게 지내시나요, 리처드?	train
common_voice_en_18654231.mp3	Go away, you crazy loon!	8dfb78858c3e41e4ebe34aae460030a36639767a5e51b4717237b151c26fae8449e7d1214c7c267b26d67563be2d4826eaeeafbd2519e2dec7047082974f2259	저리 가, 이 미친놈아!	train
common_voice_en_18654232.mp3	Where have you come from?	8dfb78858c3e41e4ebe34aae460030a36639767a5e51b4717237b151c26fae8449e7d1214c7c267b26d67563be2d4826eaeeafbd2519e2dec7047082974f2259	어디에서 오셨나요?	train
common_voice_en_18654233.mp3	"The photo doesn't have to be pixel perfect."	8dfb78858c3e41e4ebe34aae460030a36639767a5e51b4717237b151c26fae8449e7d1214c7c267b26d67563be2d4826eaeeafbd2519e2dec7047082974f2259	사진이 픽셀 단위로 완벽할 필요는 없습니다.	train_covost
common_voice_en_18654239.mp3	Oh, I was obtaining evidence.	8dfb78858c3e41e4ebe34aae460030a36639767a5e51b4717237b151c26fae8449e7d1214c7c267b26d67563be2d4826eaeeafbd2519e2dec7047082974f2259	아, 증거를 확보하고 있었어요.	train
common_voice_en_18654240.mp3	We need to avoid misdiagnoses.	8dfb78858c3e41e4ebe34aae460030a36639767a5e51b4717237b151c26fae8449e7d1214c7c267b26d67563be2d4826eaeeafbd2519e2dec7047082974f2259	오진을 피해야 합니다.	train
common_voice_en_18654241.mp3	‘I think I may as well go in at once.’ And in she went.	8dfb78858c3e41e4ebe34aae460030a36639767a5e51b4717237b151c26fae8449e7d1214c7c267b26d67563be2d4826eaeeafbd2519e2dec7047082974f2259	'한 번에 들어가는 게 나을 것 같아요. 그리고 그녀는 들어갔습니다.	train
common_voice_en_18654242.mp3	"Let's think about how we can make it better."	8dfb78858c3e41e4ebe34aae460030a36639767a5e51b4717237b151c26fae8449e7d1214c7c267b26d67563be2d4826eaeeafbd2519e2dec7047082974f2259	어떻게 하면 이 문제를 개선할 수 있을지 생각해 봅시다.	train
common_voice_en_18654243.mp3	The hurricane tore the building apart and shredded it to bits.	8dfb78858c3e41e4ebe34aae460030a36639767a5e51b4717237b151c26fae8449e7d1214c7c267b26d67563be2d4826eaeeafbd2519e2dec7047082974f2259	허리케인으로 인해 건물이 찢어지고 산산조각이 났습니다.	train
common_voice_en_18654244.mp3	Sort the page in descending order.	8dfb78858c3e41e4ebe34aae460030a36639767a5e51b4717237b151c26fae8449e7d1214c7c267b26d67563be2d4826eaeeafbd2519e2dec7047082974f2259	페이지를 내림차순으로 정렬합니다.	train
common_voice_en_18654246.mp3	Using decomposition we can find the final value.	8dfb78858c3e41e4ebe34aae460030a36639767a5e51b4717237b151c26fae8449e7d1214c7c267b26d67563be2d4826eaeeafbd2519e2dec7047082974f2259	분해를 사용하면 최종 값을 찾을 수 있습니다.	train
common_voice_en_18654247.mp3	The distributor cap had come off.	8dfb78858c3e41e4ebe34aae460030a36639767a5e51b4717237b151c26fae8449e7d1214c7c267b26d67563be2d4826eaeeafbd2519e2dec7047082974f2259	배포자 캡이 벗겨졌습니다.	train
common_voice_en_18654248.mp3	Before I came away.	8dfb78858c3e41e4ebe34aae460030a36639767a5e51b4717237b151c26fae8449e7d1214c7c267b26d67563be2d4826eaeeafbd2519e2dec7047082974f2259	제가 떠나기 전에요.	train_covost
common_voice_en_18654249.mp3	I have found out who it was.	8dfb78858c3e41e4ebe34aae460030a36639767a5e51b4717237b151c26fae8449e7d1214c7c267b26d67563be2d4826eaeeafbd2519e2dec7047082974f2259	누군지 알아냈습니다.	train
common_voice_en_18654250.mp3	However, ‘jurymen’ would have done just as well.	8dfb78858c3e41e4ebe34aae460030a36639767a5e51b4717237b151c26fae8449e7d1214c7c267b26d67563be2d4826eaeeafbd2519e2dec7047082974f2259	하지만 '법조인'도 마찬가지였을 것입니다.	train
common_voice_en_18654251.mp3	She lives the same life still?	8dfb78858c3e41e4ebe34aae460030a36639767a5e51b4717237b151c26fae8449e7d1214c7c267b26d67563be2d4826eaeeafbd2519e2dec7047082974f2259	그녀는 여전히 같은 삶을 살고 있나요?	train
common_voice_en_18654252.mp3	The declining number of residents is leaving a massive deficit for the council.	8dfb78858c3e41e4ebe34aae460030a36639767a5e51b4717237b151c26fae8449e7d1214c7c267b26d67563be2d4826eaeeafbd2519e2dec7047082974f2259	주민 수가 감소하면서 의회에 막대한 적자가 발생하고 있습니다.	train
common_voice_en_18654253.mp3	Overtake him; bring him back instantly!	8dfb78858c3e41e4ebe34aae460030a36639767a5e51b4717237b151c26fae8449e7d1214c7c267b26d67563be2d4826eaeeafbd2519e2dec7047082974f2259	그를 추월하고 즉시 다시 데려오세요!	train
common_voice_en_18654256.mp3	I tried sushi once, but it was from a supermarket.	8dfb78858c3e41e4ebe34aae460030a36639767a5e51b4717237b151c26fae8449e7d1214c7c267b26d67563be2d4826eaeeafbd2519e2dec7047082974f2259	초밥을 먹어본 적이 있지만 슈퍼마켓에서 파는 것이었습니다.	train
common_voice_en_18654257.mp3	We felt that he must be very interesting.	8dfb78858c3e41e4ebe34aae460030a36639767a5e51b4717237b151c26fae8449e7d1214c7c267b26d67563be2d4826eaeeafbd2519e2dec7047082974f2259	저희는 그가 매우 흥미로울 거라고 생각했습니다.	train
common_voice_en_18654258.mp3	The road will diverge further along.	8dfb78858c3e41e4ebe34aae460030a36639767a5e51b4717237b151c26fae8449e7d1214c7c267b26d67563be2d4826eaeeafbd2519e2dec7047082974f2259	길은 더 갈라질 것입니다.	train
common_voice_en_19827494.mp3	"The goat was always named 'Billy'."	9042795c235aec45758ff959be5088879033c8d9ee0dcaa7e3ed42a57f23c32065eb8e96947ccaa428e324d670cecc0fdd079a1e62c6afc7f2b3dbc059afdc60	염소의 이름은 항상 '빌리'였습니다.	train
common_voice_en_19827495.mp3	He was a member of the distinguished Claudius family.	9042795c235aec45758ff959be5088879033c8d9ee0dcaa7e3ed42a57f23c32065eb8e96947ccaa428e324d670cecc0fdd079a1e62c6afc7f2b3dbc059afdc60	그는 저명한 클라우디우스 가문의 일원이었습니다.	train
common_voice_en_19827496.mp3	The communities are situated on the eastern shores of Cross Island and Cross Lake.	9042795c235aec45758ff959be5088879033c8d9ee0dcaa7e3ed42a57f23c32065eb8e96947ccaa428e324d670cecc0fdd079a1e62c6afc7f2b3dbc059afdc60	이 커뮤니티는 크로스 아일랜드와 크로스 레이크의 동쪽 해안에 위치해 있습니다.	train
common_voice_en_19827497.mp3	"It also opposed government's proposal of building a prison on Hei Ling Chau Island."	9042795c235aec45758ff959be5088879033c8d9ee0dcaa7e3ed42a57f23c32065eb8e96947ccaa428e324d670cecc0fdd079a1e62c6afc7f2b3dbc059afdc60	또한 헤이링차우 섬에 교도소를 짓겠다는 정부의 제안에도 반대했습니다.	train
common_voice_en_19827498.mp3	Cytochromes operate in the electron transport chain as carrier proteins for electrons.	9042795c235aec45758ff959be5088879033c8d9ee0dcaa7e3ed42a57f23c32065eb8e96947ccaa428e324d670cecc0fdd079a1e62c6afc7f2b3dbc059afdc60	시토크롬은 전자의 운반 단백질로서 전자 수송 사슬에서 작동합니다.	train
common_voice_en_19827499.mp3	After arbitration the two sides settled on a wage reduction of fourteen percent.	9042795c235aec45758ff959be5088879033c8d9ee0dcaa7e3ed42a57f23c32065eb8e96947ccaa428e324d670cecc0fdd079a1e62c6afc7f2b3dbc059afdc60	중재 끝에 양측은 14%의 임금 삭감에 합의했습니다.	train
common_voice_en_19827500.mp3	It was named for Elwood Thomas, a homesteader.	9042795c235aec45758ff959be5088879033c8d9ee0dcaa7e3ed42a57f23c32065eb8e96947ccaa428e324d670cecc0fdd079a1e62c6afc7f2b3dbc059afdc60	농장주인 엘우드 토마스의 이름을 따서 지어진 이름입니다.	train
common_voice_en_19827501.mp3	Note: The tables below are a work in progress.	9042795c235aec45758ff959be5088879033c8d9ee0dcaa7e3ed42a57f23c32065eb8e96947ccaa428e324d670cecc0fdd079a1e62c6afc7f2b3dbc059afdc60	참고: 아래 표는 현재 진행 중인 작업입니다.	train
common_voice_en_19827502.mp3	The church was designed in the prevailing neo-Gothic style.	9042795c235aec45758ff959be5088879033c8d9ee0dcaa7e3ed42a57f23c32065eb8e96947ccaa428e324d670cecc0fdd079a1e62c6afc7f2b3dbc059afdc60	이 교회는 당시 유행하던 네오 고딕 양식으로 설계되었습니다.	train
common_voice_en_19827503.mp3	Romanization includes any use of the Latin alphabet to transliterate Hebrew words.	9042795c235aec45758ff959be5088879033c8d9ee0dcaa7e3ed42a57f23c32065eb8e96947ccaa428e324d670cecc0fdd079a1e62c6afc7f2b3dbc059afdc60	로마자 표기에는 히브리어 단어를 음역할 때 라틴 알파벳을 사용하는 것도 포함됩니다.	train
common_voice_en_19840686.mp3	Sir Frank Newsam was the founder chair of the board.	9042795c235aec45758ff959be5088879033c8d9ee0dcaa7e3ed42a57f23c32065eb8e96947ccaa428e324d670cecc0fdd079a1e62c6afc7f2b3dbc059afdc60	프랭크 뉴삼 경은 창립 이사회 의장이었습니다.	train
common_voice_en_19840687.mp3	Below are two examples of the genitive absolute, in different tenses.	9042795c235aec45758ff959be5088879033c8d9ee0dcaa7e3ed42a57f23c32065eb8e96947ccaa428e324d670cecc0fdd079a1e62c6afc7f2b3dbc059afdc60	다음은 시제가 다른 두 가지 속격 절대사의 예입니다.	train
common_voice_en_19840688.mp3	"The workshop's purpose was to educate the public in non-allopathic methods of healing."	9042795c235aec45758ff959be5088879033c8d9ee0dcaa7e3ed42a57f23c32065eb8e96947ccaa428e324d670cecc0fdd079a1e62c6afc7f2b3dbc059afdc60	이 워크숍의 목적은 대중에게 비동종요법적 치유 방법을 교육하는 것이었습니다.	train
common_voice_en_19840689.mp3	He said he wanted the picture to be the first hip science fiction movie.	9042795c235aec45758ff959be5088879033c8d9ee0dcaa7e3ed42a57f23c32065eb8e96947ccaa428e324d670cecc0fdd079a1e62c6afc7f2b3dbc059afdc60	그는 이 영화가 최초의 최신 공상과학 영화가 되기를 원했다고 말했습니다.	train
common_voice_en_19840690.mp3	"The plot of the video featured an ""acrobatic"" threesome and sex with an ex-boyfriend."	9042795c235aec45758ff959be5088879033c8d9ee0dcaa7e3ed42a57f23c32065eb8e96947ccaa428e324d670cecc0fdd079a1e62c6afc7f2b3dbc059afdc60	동영상의 줄거리는 '아크로바틱한' 쓰리섬과 전 남자친구와의 섹스를 다루고 있습니다.	train
common_voice_en_19840702.mp3	The charter school opened as a way of expanding the school.	9042795c235aec45758ff959be5088879033c8d9ee0dcaa7e3ed42a57f23c32065eb8e96947ccaa428e324d670cecc0fdd079a1e62c6afc7f2b3dbc059afdc60	차터 스쿨은 학교를 확장하기 위한 방법으로 문을 열었습니다.	train
common_voice_en_19840704.mp3	Unfortunately, the struggle got out of control, and the present phase has become militant.	9042795c235aec45758ff959be5088879033c8d9ee0dcaa7e3ed42a57f23c32065eb8e96947ccaa428e324d670cecc0fdd079a1e62c6afc7f2b3dbc059afdc60	안타깝게도 투쟁은 통제 불능 상태가 되었고, 현재 국면은 전투적인 양상을 띠고 있습니다.	train
common_voice_en_19840706.mp3	Access was through a serial video terminal.	9042795c235aec45758ff959be5088879033c8d9ee0dcaa7e3ed42a57f23c32065eb8e96947ccaa428e324d670cecc0fdd079a1e62c6afc7f2b3dbc059afdc60	접속은 직렬 비디오 터미널을 통해 이루어졌습니다.	train
common_voice_en_19840709.mp3	Lees-McRae College is a private four-year college in Banner Elk.	9042795c235aec45758ff959be5088879033c8d9ee0dcaa7e3ed42a57f23c32065eb8e96947ccaa428e324d670cecc0fdd079a1e62c6afc7f2b3dbc059afdc60	리스-맥레이 대학은 배너 엘크에 있는 사립 4년제 대학입니다.	train
common_voice_en_19840710.mp3	"A Nationals official described him as ""like a teenager now""."	9042795c235aec45758ff959be5088879033c8d9ee0dcaa7e3ed42a57f23c32065eb8e96947ccaa428e324d670cecc0fdd079a1e62c6afc7f2b3dbc059afdc60	내셔널스의 한 관계자는 그를 "지금 10대 같다"고 표현했습니다.	train
common_voice_en_19840716.mp3	Jackson was cremated.	9042795c235aec45758ff959be5088879033c8d9ee0dcaa7e3ed42a57f23c32065eb8e96947ccaa428e324d670cecc0fdd079a1e62c6afc7f2b3dbc059afdc60	잭슨은 화장되었습니다.	train
common_voice_en_19840717.mp3	Trees can be easily evaluated in a recursive manner.	9042795c235aec45758ff959be5088879033c8d9ee0dcaa7e3ed42a57f23c32065eb8e96947ccaa428e324d670cecc0fdd079a1e62c6afc7f2b3dbc059afdc60	트리는 재귀적인 방식으로 쉽게 평가할 수 있습니다.	train
common_voice_en_19840719.mp3	He studied and qualified in civil engineering.	9042795c235aec45758ff959be5088879033c8d9ee0dcaa7e3ed42a57f23c32065eb8e96947ccaa428e324d670cecc0fdd079a1e62c6afc7f2b3dbc059afdc60	토목 공학을 전공하고 자격증을 취득했습니다.	train
common_voice_en_19840720.mp3	Philip Joel Urry was born in Auckland, New Zealand.	9042795c235aec45758ff959be5088879033c8d9ee0dcaa7e3ed42a57f23c32065eb8e96947ccaa428e324d670cecc0fdd079a1e62c6afc7f2b3dbc059afdc60	필립 조엘 어리는 뉴질랜드 오클랜드에서 태어났습니다.	train
common_voice_en_19876470.mp3	He teaches radio and television performance at Otterbein College.	9042795c235aec45758ff959be5088879033c8d9ee0dcaa7e3ed42a57f23c32065eb8e96947ccaa428e324d670cecc0fdd079a1e62c6afc7f2b3dbc059afdc60	오터바인 대학에서 라디오와 텔레비전 연기를 가르치고 있습니다.	train
common_voice_en_19876471.mp3	The remainder attend night school.	9042795c235aec45758ff959be5088879033c8d9ee0dcaa7e3ed42a57f23c32065eb8e96947ccaa428e324d670cecc0fdd079a1e62c6afc7f2b3dbc059afdc60	나머지는 야간 학교에 다니고 있습니다.	train
common_voice_en_19876472.mp3	Its capital was Yambio.	9042795c235aec45758ff959be5088879033c8d9ee0dcaa7e3ed42a57f23c32065eb8e96947ccaa428e324d670cecc0fdd079a1e62c6afc7f2b3dbc059afdc60	수도는 얌비오였습니다.	train
common_voice_en_19876473.mp3	"It's self-undermining, because it's so over the top."	9042795c235aec45758ff959be5088879033c8d9ee0dcaa7e3ed42a57f23c32065eb8e96947ccaa428e324d670cecc0fdd079a1e62c6afc7f2b3dbc059afdc60	너무 도를 넘었기 때문에 스스로를 훼손하는 행위입니다.	train
common_voice_en_19876474.mp3	It is located east of the Anacostia River, after which the neighborhood is named.	9042795c235aec45758ff959be5088879033c8d9ee0dcaa7e3ed42a57f23c32065eb8e96947ccaa428e324d670cecc0fdd079a1e62c6afc7f2b3dbc059afdc60	아나코스티아 강 동쪽에 위치하고 있으며, 그 이름을 따서 동네 이름이 붙여졌습니다.	train
common_voice_en_19876495.mp3	But now people love cricket, basketball and football as well in Nepal.	9042795c235aec45758ff959be5088879033c8d9ee0dcaa7e3ed42a57f23c32065eb8e96947ccaa428e324d670cecc0fdd079a1e62c6afc7f2b3dbc059afdc60	하지만 이제 네팔에서도 크리켓, 농구, 축구를 좋아하는 사람들이 많아졌습니다.	train
common_voice_en_19876496.mp3	He takes her place in the bed before Riding Hood arrives.	9042795c235aec45758ff959be5088879033c8d9ee0dcaa7e3ed42a57f23c32065eb8e96947ccaa428e324d670cecc0fdd079a1e62c6afc7f2b3dbc059afdc60	그는 라이딩 후드가 도착하기 전에 침대에서 그녀를 대신합니다.	train
common_voice_en_19876497.mp3	The list of members held guilty of professional or other misconduct is published periodically.	9042795c235aec45758ff959be5088879033c8d9ee0dcaa7e3ed42a57f23c32065eb8e96947ccaa428e324d670cecc0fdd079a1e62c6afc7f2b3dbc059afdc60	직업적 또는 기타 위법 행위로 유죄 판결을 받은 회원의 명단은 주기적으로 공개됩니다.	train
common_voice_en_19876498.mp3	Stewart entered his first motocross race when he was four years old.	9042795c235aec45758ff959be5088879033c8d9ee0dcaa7e3ed42a57f23c32065eb8e96947ccaa428e324d670cecc0fdd079a1e62c6afc7f2b3dbc059afdc60	스튜어트는 네 살 때 처음으로 모터크로스 레이스에 참가했습니다.	train
common_voice_en_19876499.mp3	The autographic feature was marketed as having no extra charge.	9042795c235aec45758ff959be5088879033c8d9ee0dcaa7e3ed42a57f23c32065eb8e96947ccaa428e324d670cecc0fdd079a1e62c6afc7f2b3dbc059afdc60	사인 기능은 추가 비용이 없는 것으로 마케팅되었습니다.	train
common_voice_en_18420543.mp3	"Why don't you get rid of that awful old jacket?"	9a65681f203532281d9cebed42e972d3420ba0df20a0aeb2964c6db043e6071ccf1c1664daf917e6b9955140a67b453e5b50c512f931416ccc9e81e0f2bcbbcd	그 끔찍한 낡은 재킷을 버리지 않으시겠어요?	train_covost
common_voice_en_18420544.mp3	"It's either ours or theirs, I'm not sure which."	9a65681f203532281d9cebed42e972d3420ba0df20a0aeb2964c6db043e6071ccf1c1664daf917e6b9955140a67b453e5b50c512f931416ccc9e81e0f2bcbbcd	우리 쪽인지 저쪽인지 잘 모르겠습니다.	train
common_voice_en_18420545.mp3	Let’s drop the pretence	9a65681f203532281d9cebed42e972d3420ba0df20a0aeb2964c6db043e6071ccf1c1664daf917e6b9955140a67b453e5b50c512f931416ccc9e81e0f2bcbbcd	가식을 버리자	train
common_voice_en_18420573.mp3	Best ever chocolate crepe recipe.	9a65681f203532281d9cebed42e972d3420ba0df20a0aeb2964c6db043e6071ccf1c1664daf917e6b9955140a67b453e5b50c512f931416ccc9e81e0f2bcbbcd	최고의 초콜릿 크레페 레시피.	train
common_voice_en_18420575.mp3	I want to compose my speech.	9a65681f203532281d9cebed42e972d3420ba0df20a0aeb2964c6db043e6071ccf1c1664daf917e6b9955140a67b453e5b50c512f931416ccc9e81e0f2bcbbcd	연설문을 작성하고 싶습니다.	train_covost
common_voice_en_18420576.mp3	You can stop those monkey tricks at once!	9a65681f203532281d9cebed42e972d3420ba0df20a0aeb2964c6db043e6071ccf1c1664daf917e6b9955140a67b453e5b50c512f931416ccc9e81e0f2bcbbcd	원숭이들의 속임수를 한 번에 막을 수 있습니다!	train_covost
common_voice_en_18420577.mp3	Some people like to have vinegar with their chips	9a65681f203532281d9cebed42e972d3420ba0df20a0aeb2964c6db043e6071ccf1c1664daf917e6b9955140a67b453e5b50c512f931416ccc9e81e0f2bcbbcd	어떤 사람들은 칩에 식초를 곁들이는 것을 좋아합니다.	train_covost
common_voice_en_18420594.mp3	I lit a cigarette and began to ponder.	9a65681f203532281d9cebed42e972d3420ba0df20a0aeb2964c6db043e6071ccf1c1664daf917e6b9955140a67b453e5b50c512f931416ccc9e81e0f2bcbbcd	담배에 불을 붙이고 곰곰이 생각하기 시작했습니다.	train
common_voice_en_18420595.mp3	I like leaning on it.	9a65681f203532281d9cebed42e972d3420ba0df20a0aeb2964c6db043e6071ccf1c1664daf917e6b9955140a67b453e5b50c512f931416ccc9e81e0f2bcbbcd	저는 기대는 것을 좋아합니다.	train_covost
common_voice_en_18420596.mp3	I talked to one of the guides – very knowledgeable.	9a65681f203532281d9cebed42e972d3420ba0df20a0aeb2964c6db043e6071ccf1c1664daf917e6b9955140a67b453e5b50c512f931416ccc9e81e0f2bcbbcd	가이드 중 한 명과 이야기를 나눴는데 매우 지식이 풍부했습니다.	train_covost
common_voice_en_18420597.mp3	Hurricanes, forest fires and floods are a problem in parts of the United States.	9a65681f203532281d9cebed42e972d3420ba0df20a0aeb2964c6db043e6071ccf1c1664daf917e6b9955140a67b453e5b50c512f931416ccc9e81e0f2bcbbcd	허리케인, 산불, 홍수는 미국 일부 지역에서 문제가 되고 있습니다.	train
common_voice_en_18420613.mp3	Josh, Dave and Stu are members of a boy band.	9a65681f203532281d9cebed42e972d3420ba0df20a0aeb2964c6db043e6071ccf1c1664daf917e6b9955140a67b453e5b50c512f931416ccc9e81e0f2bcbbcd	조쉬, 데이브, 스튜는 보이 밴드의 멤버입니다.	train
common_voice_en_18420615.mp3	In fact, you will be killing two birds with one stone, sir.	9a65681f203532281d9cebed42e972d3420ba0df20a0aeb2964c6db043e6071ccf1c1664daf917e6b9955140a67b453e5b50c512f931416ccc9e81e0f2bcbbcd	사실, 일석이조의 효과를 얻으실 수 있습니다.	train
