path	sentence	client_id	translation	split
common_voice_en_18627333.mp3	Why, it’s got branches, I declare!	b340e6ac712cfae582ad6ffadfb3f81bc15c316131c59976c13f2829c749725d457f4bc55f7b2d561e4012c3acec07a20eb3a545649c61f21ecb8ae149d54f38	왜, 가지가 있다고 선언합니다!	train_covost
common_voice_en_18627341.mp3	I always had, when I was a medical man.	b340e6ac712cfae582ad6ffadfb3f81bc15c316131c59976c13f2829c749725d457f4bc55f7b2d561e4012c3acec07a20eb3a545649c61f21ecb8ae149d54f38	저는 의료인으로 일할 때 항상 그랬어요.	train_covost
common_voice_en_18627343.mp3	The gritters are out gritting the roads.	b340e6ac712cfae582ad6ffadfb3f81bc15c316131c59976c13f2829c749725d457f4bc55f7b2d561e4012c3acec07a20eb3a545649c61f21ecb8ae149d54f38	그라인더가 도로를 갈고 있습니다.	train_covost
common_voice_en_18627346.mp3	We give employees the flexibility to choose their projects.	b340e6ac712cfae582ad6ffadfb3f81bc15c316131c59976c13f2829c749725d457f4bc55f7b2d561e4012c3acec07a20eb3a545649c61f21ecb8ae149d54f38	직원들에게 프로젝트를 선택할 수 있는 유연성을 제공합니다.	train_covost
common_voice_en_18627347.mp3	Investing in small business startups nationally could catalyze growth in the economy.	b340e6ac712cfae582ad6ffadfb3f81bc15c316131c59976c13f2829c749725d457f4bc55f7b2d561e4012c3acec07a20eb3a545649c61f21ecb8ae149d54f38	전국적으로 소규모 비즈니스 스타트업에 투자하면 경제 성장을 촉진할 수 있습니다.	train_covost
common_voice_en_18627357.mp3	"Snoop Dog popularized the phrase ""For shizzle""."	b340e6ac712cfae582ad6ffadfb3f81bc15c316131c59976c13f2829c749725d457f4bc55f7b2d561e4012c3acec07a20eb3a545649c61f21ecb8ae149d54f38	스눕독은 "시즐을 위해"라는 문구를 대중화했습니다.	train_covost
common_voice_en_18627358.mp3	"""Nonsense, my friend,"" he said, clapping the disconsolate man upon the shoulder."	b340e6ac712cfae582ad6ffadfb3f81bc15c316131c59976c13f2829c749725d457f4bc55f7b2d561e4012c3acec07a20eb3a545649c61f21ecb8ae149d54f38	"말도 안 돼요, 친구." 그는 낙담한 남자의 어깨에 박수를 치며 말했습니다.	train_covost
common_voice_en_18627359.mp3	And he is very great this day.	b340e6ac712cfae582ad6ffadfb3f81bc15c316131c59976c13f2829c749725d457f4bc55f7b2d561e4012c3acec07a20eb3a545649c61f21ecb8ae149d54f38	그리고 그는 오늘도 매우 훌륭합니다.	train_covost
common_voice_en_18627380.mp3	The head hunter from the recruitment agency has hand-picked this strong candidate.	b340e6ac712cfae582ad6ffadfb3f81bc15c316131c59976c13f2829c749725d457f4bc55f7b2d561e4012c3acec07a20eb3a545649c61f21ecb8ae149d54f38	채용 대행사의 헤드헌터가 이 강력한 후보를 직접 뽑았습니다.	train_covost
common_voice_en_18627381.mp3	"""And here he is,"" said the Commissaire."	b340e6ac712cfae582ad6ffadfb3f81bc15c316131c59976c13f2829c749725d457f4bc55f7b2d561e4012c3acec07a20eb3a545649c61f21ecb8ae149d54f38	"그리고 여기 그가 있습니다."라고 위원장이 말했습니다."	train
common_voice_en_18627382.mp3	The dog began to drool at the sight of the cooked steak.	b340e6ac712cfae582ad6ffadfb3f81bc15c316131c59976c13f2829c749725d457f4bc55f7b2d561e4012c3acec07a20eb3a545649c61f21ecb8ae149d54f38	개는 익힌 스테이크를 보자마자 침을 흘리기 시작했습니다.	train_covost
common_voice_en_18627383.mp3	This is the latest incarnation of an automatically rechargeable electric vehicle.	b340e6ac712cfae582ad6ffadfb3f81bc15c316131c59976c13f2829c749725d457f4bc55f7b2d561e4012c3acec07a20eb3a545649c61f21ecb8ae149d54f38	이것은 자동 충전식 전기 자동차의 최신 화신입니다.	train
common_voice_en_18627460.mp3	My guardian said directly he would go too.	b340e6ac712cfae582ad6ffadfb3f81bc15c316131c59976c13f2829c749725d457f4bc55f7b2d561e4012c3acec07a20eb3a545649c61f21ecb8ae149d54f38	제 보호자도 직접 가겠다고 했습니다.	train_covost
common_voice_en_18627463.mp3	But a clever one.	b340e6ac712cfae582ad6ffadfb3f81bc15c316131c59976c13f2829c749725d457f4bc55f7b2d561e4012c3acec07a20eb3a545649c61f21ecb8ae149d54f38	하지만 영리한 사람이죠.	train_covost
common_voice_en_18627464.mp3	Would you have your genome sequenced if it would advance medical science?	b340e6ac712cfae582ad6ffadfb3f81bc15c316131c59976c13f2829c749725d457f4bc55f7b2d561e4012c3acec07a20eb3a545649c61f21ecb8ae149d54f38	의학이 발전할 수 있다면 게놈 시퀀싱을 하시겠습니까?	train
common_voice_en_18627468.mp3	He shaded his eyes with his hand.	b340e6ac712cfae582ad6ffadfb3f81bc15c316131c59976c13f2829c749725d457f4bc55f7b2d561e4012c3acec07a20eb3a545649c61f21ecb8ae149d54f38	그는 손으로 눈을 가렸습니다.	train_covost
common_voice_en_18627470.mp3	Delete all debug breakpoints.	b340e6ac712cfae582ad6ffadfb3f81bc15c316131c59976c13f2829c749725d457f4bc55f7b2d561e4012c3acec07a20eb3a545649c61f21ecb8ae149d54f38	모든 디버그 중단점을 삭제합니다.	train_covost
common_voice_en_18627472.mp3	The council gritted the roads today, so it will probably be Icy tomorrow.	b340e6ac712cfae582ad6ffadfb3f81bc15c316131c59976c13f2829c749725d457f4bc55f7b2d561e4012c3acec07a20eb3a545649c61f21ecb8ae149d54f38	오늘 시의회에서 도로를 제설했기 때문에 내일은 아마 빙판길이 될 것입니다.	train_covost
common_voice_en_18627473.mp3	"We shouldn't squander money just because it isn't ours."	b340e6ac712cfae582ad6ffadfb3f81bc15c316131c59976c13f2829c749725d457f4bc55f7b2d561e4012c3acec07a20eb3a545649c61f21ecb8ae149d54f38	우리 돈이 아니라고 해서 돈을 낭비해서는 안 됩니다.	train_covost
common_voice_en_18627474.mp3	She gave a gulp.	b340e6ac712cfae582ad6ffadfb3f81bc15c316131c59976c13f2829c749725d457f4bc55f7b2d561e4012c3acec07a20eb3a545649c61f21ecb8ae149d54f38	그녀는 침을 꿀꺽 삼켰습니다.	train_covost
common_voice_en_18627475.mp3	"It's sometimes faster to use multiple three-d printers."	b340e6ac712cfae582ad6ffadfb3f81bc15c316131c59976c13f2829c749725d457f4bc55f7b2d561e4012c3acec07a20eb3a545649c61f21ecb8ae149d54f38	여러 대의 3D 프린터를 사용하는 것이 더 빠를 때도 있습니다.	train_covost
common_voice_en_18627476.mp3	It is an uphill challenge for new parents to supervise children online.	b340e6ac712cfae582ad6ffadfb3f81bc15c316131c59976c13f2829c749725d457f4bc55f7b2d561e4012c3acec07a20eb3a545649c61f21ecb8ae149d54f38	초보 부모가 온라인에서 자녀를 감독하는 것은 쉽지 않은 일입니다.	train
common_voice_en_18627477.mp3	Which was the last cupboard or drawer that she touched?	b340e6ac712cfae582ad6ffadfb3f81bc15c316131c59976c13f2829c749725d457f4bc55f7b2d561e4012c3acec07a20eb3a545649c61f21ecb8ae149d54f38	그녀가 마지막으로 만진 찬장이나 서랍은 어디였나요?	train_covost
common_voice_en_18627478.mp3	I have two Twitter accounts, one is for work.	b340e6ac712cfae582ad6ffadfb3f81bc15c316131c59976c13f2829c749725d457f4bc55f7b2d561e4012c3acec07a20eb3a545649c61f21ecb8ae149d54f38	저는 트위터 계정을 두 개 가지고 있는데 하나는 업무용입니다.	train_covost
common_voice_en_18627479.mp3	Now came the next step.	b340e6ac712cfae582ad6ffadfb3f81bc15c316131c59976c13f2829c749725d457f4bc55f7b2d561e4012c3acec07a20eb3a545649c61f21ecb8ae149d54f38	이제 다음 단계로 넘어갑니다.	train_covost
common_voice_en_18627490.mp3	We welcome entrepreneurs and investors.	b340e6ac712cfae582ad6ffadfb3f81bc15c316131c59976c13f2829c749725d457f4bc55f7b2d561e4012c3acec07a20eb3a545649c61f21ecb8ae149d54f38	기업가와 투자자를 환영합니다.	train_covost
common_voice_en_18627491.mp3	It only came from my heart.	b340e6ac712cfae582ad6ffadfb3f81bc15c316131c59976c13f2829c749725d457f4bc55f7b2d561e4012c3acec07a20eb3a545649c61f21ecb8ae149d54f38	제 마음에서 우러나온 말입니다.	train_covost
common_voice_en_18627493.mp3	We need to conserve water until the water supply is restored again.	b340e6ac712cfae582ad6ffadfb3f81bc15c316131c59976c13f2829c749725d457f4bc55f7b2d561e4012c3acec07a20eb3a545649c61f21ecb8ae149d54f38	상수도 공급이 다시 복구될 때까지 물을 아껴 써야 합니다.	train_covost
common_voice_en_18627495.mp3	"""Be so kind as to act as my solicitor,"" said Grandfather."	b340e6ac712cfae582ad6ffadfb3f81bc15c316131c59976c13f2829c749725d457f4bc55f7b2d561e4012c3acec07a20eb3a545649c61f21ecb8ae149d54f38	"내 변호인 역할을 해줘요." 할아버지가 말했습니다.	train
common_voice_en_18627497.mp3	We host our data on-premise for independence from third-party decisions.	b340e6ac712cfae582ad6ffadfb3f81bc15c316131c59976c13f2829c749725d457f4bc55f7b2d561e4012c3acec07a20eb3a545649c61f21ecb8ae149d54f38	당사는 타사의 결정으로부터 독립성을 위해 데이터를 온프레미스로 호스팅합니다.	train
common_voice_en_18627510.mp3	"""He ain't come in yet,"" says Judy."	b340e6ac712cfae582ad6ffadfb3f81bc15c316131c59976c13f2829c749725d457f4bc55f7b2d561e4012c3acec07a20eb3a545649c61f21ecb8ae149d54f38	"아직 안 들어왔어요." 주디가 말합니다.	train_covost
common_voice_en_18627511.mp3	To overcome procrastination, tackle one task at a time.	b340e6ac712cfae582ad6ffadfb3f81bc15c316131c59976c13f2829c749725d457f4bc55f7b2d561e4012c3acec07a20eb3a545649c61f21ecb8ae149d54f38	미루는 습관을 극복하려면 한 번에 한 가지 작업씩 해결하세요.	train_covost
common_voice_en_18627512.mp3	My dear friend, will you shake me up a little?	b340e6ac712cfae582ad6ffadfb3f81bc15c316131c59976c13f2829c749725d457f4bc55f7b2d561e4012c3acec07a20eb3a545649c61f21ecb8ae149d54f38	친애하는 친구, 나를 좀 흔들어 주겠니?	train_covost
common_voice_en_18627514.mp3	"It's in better keeping."	b340e6ac712cfae582ad6ffadfb3f81bc15c316131c59976c13f2829c749725d457f4bc55f7b2d561e4012c3acec07a20eb3a545649c61f21ecb8ae149d54f38	더 잘 보관할 수 있습니다.	train_covost
common_voice_en_18627525.mp3	This is leasehold land.	b340e6ac712cfae582ad6ffadfb3f81bc15c316131c59976c13f2829c749725d457f4bc55f7b2d561e4012c3acec07a20eb3a545649c61f21ecb8ae149d54f38	여기는 임대 토지입니다.	train_covost
common_voice_en_18627526.mp3	I am sorry sir.	b340e6ac712cfae582ad6ffadfb3f81bc15c316131c59976c13f2829c749725d457f4bc55f7b2d561e4012c3acec07a20eb3a545649c61f21ecb8ae149d54f38	죄송합니다.	train_covost
common_voice_en_18627527.mp3	The Duchess, the Duchess!	b340e6ac712cfae582ad6ffadfb3f81bc15c316131c59976c13f2829c749725d457f4bc55f7b2d561e4012c3acec07a20eb3a545649c61f21ecb8ae149d54f38	공작부인, 공작부인!	train_covost
common_voice_en_18627528.mp3	I thought of it too.	b340e6ac712cfae582ad6ffadfb3f81bc15c316131c59976c13f2829c749725d457f4bc55f7b2d561e4012c3acec07a20eb3a545649c61f21ecb8ae149d54f38	저도 그 생각을 했습니다.	train_covost
common_voice_en_18627529.mp3	They were terribly bruised.	b340e6ac712cfae582ad6ffadfb3f81bc15c316131c59976c13f2829c749725d457f4bc55f7b2d561e4012c3acec07a20eb3a545649c61f21ecb8ae149d54f38	그들은 끔찍하게 멍이 들었습니다.	train_covost
common_voice_en_18627540.mp3	The valley of the kings has the tombs of ancient Egyptian pharaohs.	b340e6ac712cfae582ad6ffadfb3f81bc15c316131c59976c13f2829c749725d457f4bc55f7b2d561e4012c3acec07a20eb3a545649c61f21ecb8ae149d54f38	왕들의 계곡에는 고대 이집트 파라오의 무덤이 있습니다.	train_covost
common_voice_en_18627541.mp3	It can be readily imagined.	b340e6ac712cfae582ad6ffadfb3f81bc15c316131c59976c13f2829c749725d457f4bc55f7b2d561e4012c3acec07a20eb3a545649c61f21ecb8ae149d54f38	쉽게 상상할 수 있습니다.	train_covost
common_voice_en_18627542.mp3	No one could see him from the hotel.	b340e6ac712cfae582ad6ffadfb3f81bc15c316131c59976c13f2829c749725d457f4bc55f7b2d561e4012c3acec07a20eb3a545649c61f21ecb8ae149d54f38	호텔에서는 아무도 그를 볼 수 없었습니다.	train
common_voice_en_18627543.mp3	"That's point number two."	b340e6ac712cfae582ad6ffadfb3f81bc15c316131c59976c13f2829c749725d457f4bc55f7b2d561e4012c3acec07a20eb3a545649c61f21ecb8ae149d54f38	이것이 두 번째 포인트입니다.	train_covost
common_voice_en_18627544.mp3	Crisps are made from potato.	b340e6ac712cfae582ad6ffadfb3f81bc15c316131c59976c13f2829c749725d457f4bc55f7b2d561e4012c3acec07a20eb3a545649c61f21ecb8ae149d54f38	크리스피는 감자로 만듭니다.	train_covost
common_voice_en_18634386.mp3	It would be better not to keep them now.	b340e6ac712cfae582ad6ffadfb3f81bc15c316131c59976c13f2829c749725d457f4bc55f7b2d561e4012c3acec07a20eb3a545649c61f21ecb8ae149d54f38	지금은 보관하지 않는 것이 좋습니다.	train
common_voice_en_18634387.mp3	After that I did not look back; I had no time.	b340e6ac712cfae582ad6ffadfb3f81bc15c316131c59976c13f2829c749725d457f4bc55f7b2d561e4012c3acec07a20eb3a545649c61f21ecb8ae149d54f38	그 후로는 뒤도 돌아보지 않았고 시간이 없었습니다.	train
common_voice_en_18634389.mp3	I asked a few idiotic questions, and they soon kicked me out.	b340e6ac712cfae582ad6ffadfb3f81bc15c316131c59976c13f2829c749725d457f4bc55f7b2d561e4012c3acec07a20eb3a545649c61f21ecb8ae149d54f38	멍청한 질문을 몇 개 했더니 곧 쫓겨났습니다.	train_covost
common_voice_en_18634390.mp3	You will be perfectly safe.	b340e6ac712cfae582ad6ffadfb3f81bc15c316131c59976c13f2829c749725d457f4bc55f7b2d561e4012c3acec07a20eb3a545649c61f21ecb8ae149d54f38	완벽하게 안전할 것입니다.	train_covost
common_voice_en_18634391.mp3	‘I deny it!’ said the March Hare.	b340e6ac712cfae582ad6ffadfb3f81bc15c316131c59976c13f2829c749725d457f4bc55f7b2d561e4012c3acec07a20eb3a545649c61f21ecb8ae149d54f38	"나는 그것을 부인합니다!" 행진 토끼가 말했습니다.	train
common_voice_en_18634392.mp3	Yes, If you so desire.	b340e6ac712cfae582ad6ffadfb3f81bc15c316131c59976c13f2829c749725d457f4bc55f7b2d561e4012c3acec07a20eb3a545649c61f21ecb8ae149d54f38	예, 원하신다면 가능합니다.	train_covost
common_voice_en_18634393.mp3	I opened the gate before.	b340e6ac712cfae582ad6ffadfb3f81bc15c316131c59976c13f2829c749725d457f4bc55f7b2d561e4012c3acec07a20eb3a545649c61f21ecb8ae149d54f38	전에도 문을 열어본 적이 있습니다.	train_covost
common_voice_en_18634394.mp3	"They had an argument and aren't talking to each other."	b340e6ac712cfae582ad6ffadfb3f81bc15c316131c59976c13f2829c749725d457f4bc55f7b2d561e4012c3acec07a20eb3a545649c61f21ecb8ae149d54f38	둘은 말다툼을 했고 서로 대화하지 않습니다.	train_covost
common_voice_en_18634395.mp3	He stayed with them.	b340e6ac712cfae582ad6ffadfb3f81bc15c316131c59976c13f2829c749725d457f4bc55f7b2d561e4012c3acec07a20eb3a545649c61f21ecb8ae149d54f38	그는 그들과 함께 머물렀습니다.	train_covost
common_voice_en_18634426.mp3	His talk of guards that would skin their own grandmothers was all billy-o.	b340e6ac712cfae582ad6ffadfb3f81bc15c316131c59976c13f2829c749725d457f4bc55f7b2d561e4012c3acec07a20eb3a545649c61f21ecb8ae149d54f38	할머니의 가죽을 벗기는 경비병에 대한 그의 이야기는 모두 헛소리에 불과했습니다.	train_covost
common_voice_en_18634427.mp3	Your necessities are greater than mine.	b340e6ac712cfae582ad6ffadfb3f81bc15c316131c59976c13f2829c749725d457f4bc55f7b2d561e4012c3acec07a20eb3a545649c61f21ecb8ae149d54f38	여러분의 필수품은 저보다 더 큽니다.	train_covost
common_voice_en_18634428.mp3	The battery is low, please attach the charger promptly.	b340e6ac712cfae582ad6ffadfb3f81bc15c316131c59976c13f2829c749725d457f4bc55f7b2d561e4012c3acec07a20eb3a545649c61f21ecb8ae149d54f38	배터리가 부족할 경우 즉시 충전기를 연결하세요.	train
common_voice_en_18634429.mp3	What is the etiquette of greeting a person in your country?	b340e6ac712cfae582ad6ffadfb3f81bc15c316131c59976c13f2829c749725d457f4bc55f7b2d561e4012c3acec07a20eb3a545649c61f21ecb8ae149d54f38	여러분의 나라에서 인사하는 에티켓은 무엇인가요?	train_covost
common_voice_en_18634430.mp3	Harry was sitting on the verandah.	b340e6ac712cfae582ad6ffadfb3f81bc15c316131c59976c13f2829c749725d457f4bc55f7b2d561e4012c3acec07a20eb3a545649c61f21ecb8ae149d54f38	해리는 베란다에 앉아 있었습니다.	train_covost
common_voice_en_18645608.mp3	Allan is a dear fellow, and in his profession faultless.	b340e6ac712cfae582ad6ffadfb3f81bc15c316131c59976c13f2829c749725d457f4bc55f7b2d561e4012c3acec07a20eb3a545649c61f21ecb8ae149d54f38	앨런은 자신의 직업에 흠잡을 데 없는 훌륭한 동료입니다.	train
common_voice_en_18645609.mp3	"I've got engaged three times at Brinkley."	b340e6ac712cfae582ad6ffadfb3f81bc15c316131c59976c13f2829c749725d457f4bc55f7b2d561e4012c3acec07a20eb3a545649c61f21ecb8ae149d54f38	브링클리에서 약혼을 세 번이나 했어요.	train_covost
common_voice_en_18645611.mp3	‘She’s coming!’ cried the Larkspur.	b340e6ac712cfae582ad6ffadfb3f81bc15c316131c59976c13f2829c749725d457f4bc55f7b2d561e4012c3acec07a20eb3a545649c61f21ecb8ae149d54f38	'그녀가 온다!' 라크스퍼가 외쳤습니다.	train_covost
common_voice_en_18645612.mp3	When did you ask for permission?	b340e6ac712cfae582ad6ffadfb3f81bc15c316131c59976c13f2829c749725d457f4bc55f7b2d561e4012c3acec07a20eb3a545649c61f21ecb8ae149d54f38	언제 허가를 요청했나요?	train_covost
common_voice_en_18667629.mp3	We need to admit her to the hospital.	b340e6ac712cfae582ad6ffadfb3f81bc15c316131c59976c13f2829c749725d457f4bc55f7b2d561e4012c3acec07a20eb3a545649c61f21ecb8ae149d54f38	병원에 입원시켜야 해요.	train_covost
common_voice_en_18667632.mp3	The Tumour metastases were identified months after diagnosis of the primary tumour.	b340e6ac712cfae582ad6ffadfb3f81bc15c316131c59976c13f2829c749725d457f4bc55f7b2d561e4012c3acec07a20eb3a545649c61f21ecb8ae149d54f38	종양 전이는 원발성 종양 진단 후 수개월 후에 확인되었습니다.	train_covost
common_voice_en_18667633.mp3	‘He must have imitated somebody else’s hand,’ said the King.	b340e6ac712cfae582ad6ffadfb3f81bc15c316131c59976c13f2829c749725d457f4bc55f7b2d561e4012c3acec07a20eb3a545649c61f21ecb8ae149d54f38	왕은 '다른 사람의 손을 모방한 것이 틀림없다'고 말했습니다.	train_covost
common_voice_en_18667635.mp3	I like the idea but have some concerns about how it will work.	b340e6ac712cfae582ad6ffadfb3f81bc15c316131c59976c13f2829c749725d457f4bc55f7b2d561e4012c3acec07a20eb3a545649c61f21ecb8ae149d54f38	아이디어는 마음에 들지만 어떻게 작동할지 걱정되는 부분이 있습니다.	train_covost
common_voice_en_18447163.mp3	It turned out the millennium bug was not a thing.	d8f79af55e5db3e7a6b73d73d200e16a0839edd42719869f452d4c0e757f72806806a7cbe3d0b53cc31cdd1e58f4f5d3caff0abbe69dbcedfff23180fb99b58e	밀레니엄 버그는 아무것도 아닌 것으로 밝혀졌습니다.	train_covost
common_voice_en_18447164.mp3	But is it a kind heart?	d8f79af55e5db3e7a6b73d73d200e16a0839edd42719869f452d4c0e757f72806806a7cbe3d0b53cc31cdd1e58f4f5d3caff0abbe69dbcedfff23180fb99b58e	하지만 친절한 마음일까요?	train_covost
common_voice_en_18447166.mp3	My study is crammed full of books.	d8f79af55e5db3e7a6b73d73d200e16a0839edd42719869f452d4c0e757f72806806a7cbe3d0b53cc31cdd1e58f4f5d3caff0abbe69dbcedfff23180fb99b58e	제 서재는 책으로 가득 차 있습니다.	train_covost
common_voice_en_18447167.mp3	If you can afford it, take a taxi rather than a bus	d8f79af55e5db3e7a6b73d73d200e16a0839edd42719869f452d4c0e757f72806806a7cbe3d0b53cc31cdd1e58f4f5d3caff0abbe69dbcedfff23180fb99b58e	여유가 있다면 버스보다는 택시를 이용하세요.	train_covost
common_voice_en_18447187.mp3	"Don't you dare presume to demand anything of me!"	d8f79af55e5db3e7a6b73d73d200e16a0839edd42719869f452d4c0e757f72806806a7cbe3d0b53cc31cdd1e58f4f5d3caff0abbe69dbcedfff23180fb99b58e	감히 저에게 무언가를 요구할 생각은 하지 마세요!	train_covost
common_voice_en_18447188.mp3	We need to work on that in parallel.	d8f79af55e5db3e7a6b73d73d200e16a0839edd42719869f452d4c0e757f72806806a7cbe3d0b53cc31cdd1e58f4f5d3caff0abbe69dbcedfff23180fb99b58e	이 작업도 병행해야 합니다.	train_covost
common_voice_en_18447191.mp3	They never did that when I visited.	d8f79af55e5db3e7a6b73d73d200e16a0839edd42719869f452d4c0e757f72806806a7cbe3d0b53cc31cdd1e58f4f5d3caff0abbe69dbcedfff23180fb99b58e	제가 방문했을 때는 그렇게 하지 않았어요.	train_covost
common_voice_en_18447192.mp3	"I'm really not able to choose between them."	d8f79af55e5db3e7a6b73d73d200e16a0839edd42719869f452d4c0e757f72806806a7cbe3d0b53cc31cdd1e58f4f5d3caff0abbe69dbcedfff23180fb99b58e	정말 둘 중 하나를 선택할 수 없습니다.	train
common_voice_en_18447213.mp3	Her writing betrays her warped sense of priorities.	d8f79af55e5db3e7a6b73d73d200e16a0839edd42719869f452d4c0e757f72806806a7cbe3d0b53cc31cdd1e58f4f5d3caff0abbe69dbcedfff23180fb99b58e	그녀의 글은 그녀의 뒤틀린 우선순위에 대한 감각을 배반합니다.	train_covost
common_voice_en_18447214.mp3	The Mouse only growled in reply.	d8f79af55e5db3e7a6b73d73d200e16a0839edd42719869f452d4c0e757f72806806a7cbe3d0b53cc31cdd1e58f4f5d3caff0abbe69dbcedfff23180fb99b58e	쥐는 으르렁거리며 대답만 했습니다.	train_covost
common_voice_en_18447215.mp3	I had another whack at it.	d8f79af55e5db3e7a6b73d73d200e16a0839edd42719869f452d4c0e757f72806806a7cbe3d0b53cc31cdd1e58f4f5d3caff0abbe69dbcedfff23180fb99b58e	한 번 더 해봤습니다.	train_covost
common_voice_en_18447216.mp3	Burns your throat, too, and makes one as thirsty as the dickens.	d8f79af55e5db3e7a6b73d73d200e16a0839edd42719869f452d4c0e757f72806806a7cbe3d0b53cc31cdd1e58f4f5d3caff0abbe69dbcedfff23180fb99b58e	목구멍도 타들어가고 목이 마를 정도로 목이 마르게 됩니다.	train_covost
common_voice_en_18447217.mp3	Suppose they make faces at me.	d8f79af55e5db3e7a6b73d73d200e16a0839edd42719869f452d4c0e757f72806806a7cbe3d0b53cc31cdd1e58f4f5d3caff0abbe69dbcedfff23180fb99b58e	그들이 저에게 표정을 짓는다고 가정해 보겠습니다.	train_covost
common_voice_en_18447233.mp3	I suppose, as a matter of fact, Jeeves suggested it.	d8f79af55e5db3e7a6b73d73d200e16a0839edd42719869f452d4c0e757f72806806a7cbe3d0b53cc31cdd1e58f4f5d3caff0abbe69dbcedfff23180fb99b58e	사실 지브스가 제안한 것 같아요.	train_covost
common_voice_en_18447234.mp3	"It's no good threatening me. I can prove it!"	d8f79af55e5db3e7a6b73d73d200e16a0839edd42719869f452d4c0e757f72806806a7cbe3d0b53cc31cdd1e58f4f5d3caff0abbe69dbcedfff23180fb99b58e	저를 협박하는 것은 소용이 없습니다. 제가 증명할 수 있어요!	train_covost
common_voice_en_18447235.mp3	The new law prohibits smoking in public transportation systems.	d8f79af55e5db3e7a6b73d73d200e16a0839edd42719869f452d4c0e757f72806806a7cbe3d0b53cc31cdd1e58f4f5d3caff0abbe69dbcedfff23180fb99b58e	새로운 법은 대중교통 시스템에서 흡연을 금지하고 있습니다.	train_covost
common_voice_en_18447236.mp3	Can we do nothing about fake news?	d8f79af55e5db3e7a6b73d73d200e16a0839edd42719869f452d4c0e757f72806806a7cbe3d0b53cc31cdd1e58f4f5d3caff0abbe69dbcedfff23180fb99b58e	가짜 뉴스에 대해 아무것도 할 수 없나요?	train_covost
common_voice_en_18447237.mp3	A mere ordinary tribute of respect to a great artist.	d8f79af55e5db3e7a6b73d73d200e16a0839edd42719869f452d4c0e757f72806806a7cbe3d0b53cc31cdd1e58f4f5d3caff0abbe69dbcedfff23180fb99b58e	위대한 예술가에게 경의를 표하는 평범한 헌정입니다.	train_covost
common_voice_en_18447264.mp3	She was a schoolmistress in her younger days.	d8f79af55e5db3e7a6b73d73d200e16a0839edd42719869f452d4c0e757f72806806a7cbe3d0b53cc31cdd1e58f4f5d3caff0abbe69dbcedfff23180fb99b58e	젊은 시절에는 여선생님이었습니다.	train_covost
common_voice_en_18447267.mp3	She was the only female surgeon that I knew.	d8f79af55e5db3e7a6b73d73d200e16a0839edd42719869f452d4c0e757f72806806a7cbe3d0b53cc31cdd1e58f4f5d3caff0abbe69dbcedfff23180fb99b58e	그녀는 제가 아는 유일한 여성 외과의사였습니다.	train_covost
common_voice_en_18447273.mp3	He tried to persuade her with a rather artificial argument	d8f79af55e5db3e7a6b73d73d200e16a0839edd42719869f452d4c0e757f72806806a7cbe3d0b53cc31cdd1e58f4f5d3caff0abbe69dbcedfff23180fb99b58e	그는 다소 인위적인 논리로 그녀를 설득하려고했습니다.	train_covost
common_voice_en_18447274.mp3	But the bearded bloke had shot his bolt.	d8f79af55e5db3e7a6b73d73d200e16a0839edd42719869f452d4c0e757f72806806a7cbe3d0b53cc31cdd1e58f4f5d3caff0abbe69dbcedfff23180fb99b58e	하지만 수염 난 남자는 화살을 쐈어요.	train_covost
common_voice_en_18447276.mp3	The air in the hut was close and oppressive.	d8f79af55e5db3e7a6b73d73d200e16a0839edd42719869f452d4c0e757f72806806a7cbe3d0b53cc31cdd1e58f4f5d3caff0abbe69dbcedfff23180fb99b58e	오두막 안의 공기는 답답하고 답답했습니다.	train_covost
common_voice_en_18447284.mp3	At a moment like that?	d8f79af55e5db3e7a6b73d73d200e16a0839edd42719869f452d4c0e757f72806806a7cbe3d0b53cc31cdd1e58f4f5d3caff0abbe69dbcedfff23180fb99b58e	그런 순간에?	train_covost
common_voice_en_18447301.mp3	She was coughing and spluttering all the way through the concert.	d8f79af55e5db3e7a6b73d73d200e16a0839edd42719869f452d4c0e757f72806806a7cbe3d0b53cc31cdd1e58f4f5d3caff0abbe69dbcedfff23180fb99b58e	그녀는 콘서트 내내 기침을 하고 가래를 뱉었습니다.	train_covost
common_voice_en_18447302.mp3	The cat harassed the pygmy vole.	d8f79af55e5db3e7a6b73d73d200e16a0839edd42719869f452d4c0e757f72806806a7cbe3d0b53cc31cdd1e58f4f5d3caff0abbe69dbcedfff23180fb99b58e	고양이가 피그미족제비를 괴롭혔습니다.	train_covost
common_voice_en_18447309.mp3	Have a good trip back.	d8f79af55e5db3e7a6b73d73d200e16a0839edd42719869f452d4c0e757f72806806a7cbe3d0b53cc31cdd1e58f4f5d3caff0abbe69dbcedfff23180fb99b58e	즐거운 여행 되세요.	train_covost
common_voice_en_18447310.mp3	Ah, there you have me.	d8f79af55e5db3e7a6b73d73d200e16a0839edd42719869f452d4c0e757f72806806a7cbe3d0b53cc31cdd1e58f4f5d3caff0abbe69dbcedfff23180fb99b58e	아, 여기 있었군요.	train_covost
