path	sentence	client_id	translation	split
common_voice_en_19181260.mp3	Tiny amounts of the other isotopes may be produced as direct fission products.	de7bee48052d9f9082f0ae0740968f73a51938bd79e5da0c3e5cf9a1b473a843df28994f0f9a68a2b6dc7844a39e9efb9034ce3f82fe5a79601c55162aaa3c5f	소량의 다른 동위원소는 직접 핵분열 생성물로 생성될 수 있습니다.	train
common_voice_en_19181262.mp3	Authoring a notable dissenting opinion was from then-Judge Samuel Alito.	de7bee48052d9f9082f0ae0740968f73a51938bd79e5da0c3e5cf9a1b473a843df28994f0f9a68a2b6dc7844a39e9efb9034ce3f82fe5a79601c55162aaa3c5f	주목할 만한 반대 의견을 낸 사람은 당시 새뮤얼 알리토 판사였습니다.	train
common_voice_en_19181267.mp3	Robert Dudley Baxter was educated privately and at Trinity College, Cambridge University.	de7bee48052d9f9082f0ae0740968f73a51938bd79e5da0c3e5cf9a1b473a843df28994f0f9a68a2b6dc7844a39e9efb9034ce3f82fe5a79601c55162aaa3c5f	로버트 더들리 박스터는 케임브리지 대학교 트리니티 칼리지에서 사립 교육을 받았습니다.	train
common_voice_en_19181270.mp3	It is surrounded by wetlands.	de7bee48052d9f9082f0ae0740968f73a51938bd79e5da0c3e5cf9a1b473a843df28994f0f9a68a2b6dc7844a39e9efb9034ce3f82fe5a79601c55162aaa3c5f	습지로 둘러싸여 있습니다.	train
common_voice_en_19181271.mp3	It also includes sound effects.	de7bee48052d9f9082f0ae0740968f73a51938bd79e5da0c3e5cf9a1b473a843df28994f0f9a68a2b6dc7844a39e9efb9034ce3f82fe5a79601c55162aaa3c5f	음향 효과도 포함되어 있습니다.	train
common_voice_en_19181272.mp3	Neither could she deny the justice of his description of Jane.	de7bee48052d9f9082f0ae0740968f73a51938bd79e5da0c3e5cf9a1b473a843df28994f0f9a68a2b6dc7844a39e9efb9034ce3f82fe5a79601c55162aaa3c5f	제인에 대한 그의 설명이 정당하다는 것을 부인할 수도 없었습니다.	train
common_voice_en_19181273.mp3	Whitlam then appointed Sir John Kerr.	de7bee48052d9f9082f0ae0740968f73a51938bd79e5da0c3e5cf9a1b473a843df28994f0f9a68a2b6dc7844a39e9efb9034ce3f82fe5a79601c55162aaa3c5f	그 후 휘틀럼은 존 커 경을 임명했습니다.	train
common_voice_en_19181274.mp3	To preserve operational security, Bradley forbade their use until Cobra was launched.	de7bee48052d9f9082f0ae0740968f73a51938bd79e5da0c3e5cf9a1b473a843df28994f0f9a68a2b6dc7844a39e9efb9034ce3f82fe5a79601c55162aaa3c5f	브래들리는 작전 보안을 유지하기 위해 코브라가 출시될 때까지 사용을 금지했습니다.	train
common_voice_en_19181377.mp3	Gena also blogs for Celebrity Baby Scoop.	de7bee48052d9f9082f0ae0740968f73a51938bd79e5da0c3e5cf9a1b473a843df28994f0f9a68a2b6dc7844a39e9efb9034ce3f82fe5a79601c55162aaa3c5f	Gena는 유명인 아기 특종에 대한 블로그도 운영하고 있습니다.	train
common_voice_en_19181378.mp3	During the battle one of his horses was killed and another wounded under him.	de7bee48052d9f9082f0ae0740968f73a51938bd79e5da0c3e5cf9a1b473a843df28994f0f9a68a2b6dc7844a39e9efb9034ce3f82fe5a79601c55162aaa3c5f	전투 중에 그의 말 한 마리가 죽고 다른 한 마리가 부상을 입었습니다.	train
common_voice_en_19181379.mp3	I thought it was rather sweet.	de7bee48052d9f9082f0ae0740968f73a51938bd79e5da0c3e5cf9a1b473a843df28994f0f9a68a2b6dc7844a39e9efb9034ce3f82fe5a79601c55162aaa3c5f	다소 달콤하다고 생각했습니다.	train
common_voice_en_19181380.mp3	At once, a storm followed.	de7bee48052d9f9082f0ae0740968f73a51938bd79e5da0c3e5cf9a1b473a843df28994f0f9a68a2b6dc7844a39e9efb9034ce3f82fe5a79601c55162aaa3c5f	한순간에 폭풍이 몰아쳤습니다.	train
common_voice_en_18266892.mp3	Technology can augment the physical capabilities of humans.	1c7c6c5c3989680a98b0f510260ce578accfff3e655fe70d4ea6f10b07ced55e0dbb8a295ede39bea85fff8a286c0c54bffb81bfea87287bf42e492bc69ab9c4	기술은 인간의 신체적 능력을 증강할 수 있습니다.	train_covost
common_voice_en_18266895.mp3	Welcome to my house.	1c7c6c5c3989680a98b0f510260ce578accfff3e655fe70d4ea6f10b07ced55e0dbb8a295ede39bea85fff8a286c0c54bffb81bfea87287bf42e492bc69ab9c4	내 집에 오신 것을 환영합니다.	train_covost
common_voice_en_18266916.mp3	"I can't swim."	1c7c6c5c3989680a98b0f510260ce578accfff3e655fe70d4ea6f10b07ced55e0dbb8a295ede39bea85fff8a286c0c54bffb81bfea87287bf42e492bc69ab9c4	수영을 못해요.	train_covost
common_voice_en_18266918.mp3	The motor has failed.	1c7c6c5c3989680a98b0f510260ce578accfff3e655fe70d4ea6f10b07ced55e0dbb8a295ede39bea85fff8a286c0c54bffb81bfea87287bf42e492bc69ab9c4	모터가 고장났습니다.	train_covost
common_voice_en_18266936.mp3	The network administrator resolved the connectivity issue of the router.	1c7c6c5c3989680a98b0f510260ce578accfff3e655fe70d4ea6f10b07ced55e0dbb8a295ede39bea85fff8a286c0c54bffb81bfea87287bf42e492bc69ab9c4	네트워크 관리자가 라우터의 연결 문제를 해결했습니다.	train_covost
common_voice_en_18266944.mp3	We began saving up for our first home.	1c7c6c5c3989680a98b0f510260ce578accfff3e655fe70d4ea6f10b07ced55e0dbb8a295ede39bea85fff8a286c0c54bffb81bfea87287bf42e492bc69ab9c4	저희는 첫 번째 집을 마련하기 위해 저축을 시작했습니다.	train_covost
common_voice_en_18266946.mp3	The Beta version will be released soon.	1c7c6c5c3989680a98b0f510260ce578accfff3e655fe70d4ea6f10b07ced55e0dbb8a295ede39bea85fff8a286c0c54bffb81bfea87287bf42e492bc69ab9c4	베타 버전은 곧 출시될 예정입니다.	train_covost
common_voice_en_18266947.mp3	The papers were graded.	1c7c6c5c3989680a98b0f510260ce578accfff3e655fe70d4ea6f10b07ced55e0dbb8a295ede39bea85fff8a286c0c54bffb81bfea87287bf42e492bc69ab9c4	논문이 채점되었습니다.	train_covost
common_voice_en_18266984.mp3	The falcon watched its prey.	1c7c6c5c3989680a98b0f510260ce578accfff3e655fe70d4ea6f10b07ced55e0dbb8a295ede39bea85fff8a286c0c54bffb81bfea87287bf42e492bc69ab9c4	매는 먹이를 지켜보았습니다.	train_covost
common_voice_en_18267007.mp3	"Let's not focus on the Minutiae details."	1c7c6c5c3989680a98b0f510260ce578accfff3e655fe70d4ea6f10b07ced55e0dbb8a295ede39bea85fff8a286c0c54bffb81bfea87287bf42e492bc69ab9c4	사소한 세부 사항에는 집중하지 마세요.	train_covost
common_voice_en_18267029.mp3	No need to take that tone sir.	1c7c6c5c3989680a98b0f510260ce578accfff3e655fe70d4ea6f10b07ced55e0dbb8a295ede39bea85fff8a286c0c54bffb81bfea87287bf42e492bc69ab9c4	그렇게 말씀하실 필요 없습니다.	train_covost
common_voice_en_18267075.mp3	Claire waited patiently.	1c7c6c5c3989680a98b0f510260ce578accfff3e655fe70d4ea6f10b07ced55e0dbb8a295ede39bea85fff8a286c0c54bffb81bfea87287bf42e492bc69ab9c4	클레어는 참을성 있게 기다렸습니다.	train_covost
common_voice_en_18267076.mp3	A meal presented well is most memorable.	1c7c6c5c3989680a98b0f510260ce578accfff3e655fe70d4ea6f10b07ced55e0dbb8a295ede39bea85fff8a286c0c54bffb81bfea87287bf42e492bc69ab9c4	잘 차려진 식사가 가장 기억에 남습니다.	train_covost
common_voice_en_18466860.mp3	I’ll have to remember to chase that up.	1c7c6c5c3989680a98b0f510260ce578accfff3e655fe70d4ea6f10b07ced55e0dbb8a295ede39bea85fff8a286c0c54bffb81bfea87287bf42e492bc69ab9c4	꼭 기억해 두어야겠습니다.	train_covost
common_voice_en_18466863.mp3	And, as he stooped, his trousers split up the back.	1c7c6c5c3989680a98b0f510260ce578accfff3e655fe70d4ea6f10b07ced55e0dbb8a295ede39bea85fff8a286c0c54bffb81bfea87287bf42e492bc69ab9c4	그리고 허리를 구부리자 바지가 찢어졌습니다.	train_covost
common_voice_en_18466864.mp3	He has the stuff in gobs, but he hates giving up.	1c7c6c5c3989680a98b0f510260ce578accfff3e655fe70d4ea6f10b07ced55e0dbb8a295ede39bea85fff8a286c0c54bffb81bfea87287bf42e492bc69ab9c4	하지만 그는 포기하는 것을 싫어합니다.	train_covost
common_voice_en_18466866.mp3	But what on earth can you do?	1c7c6c5c3989680a98b0f510260ce578accfff3e655fe70d4ea6f10b07ced55e0dbb8a295ede39bea85fff8a286c0c54bffb81bfea87287bf42e492bc69ab9c4	하지만 도대체 무엇을 할 수 있을까요?	train_covost
common_voice_en_18466867.mp3	"Move to the left-hand lane if you're going to pull off here"	1c7c6c5c3989680a98b0f510260ce578accfff3e655fe70d4ea6f10b07ced55e0dbb8a295ede39bea85fff8a286c0c54bffb81bfea87287bf42e492bc69ab9c4	여기서 차를 세우려면 왼쪽 차선으로 이동하세요.	train_covost
common_voice_en_18466869.mp3	Fiona and Jamie were engaged to be married.	1c7c6c5c3989680a98b0f510260ce578accfff3e655fe70d4ea6f10b07ced55e0dbb8a295ede39bea85fff8a286c0c54bffb81bfea87287bf42e492bc69ab9c4	피오나와 제이미는 약혼한 상태였습니다.	train_covost
common_voice_en_18466874.mp3	The regret in his voice was provocative of a second burst of laughter.	1c7c6c5c3989680a98b0f510260ce578accfff3e655fe70d4ea6f10b07ced55e0dbb8a295ede39bea85fff8a286c0c54bffb81bfea87287bf42e492bc69ab9c4	그의 목소리에 담긴 아쉬움은 다시 한 번 웃음을 터뜨리게 만들었습니다.	train_covost
common_voice_en_18466876.mp3	According to him, no.	1c7c6c5c3989680a98b0f510260ce578accfff3e655fe70d4ea6f10b07ced55e0dbb8a295ede39bea85fff8a286c0c54bffb81bfea87287bf42e492bc69ab9c4	그의 말에 따르면 그렇지 않다고 합니다.	train_covost
common_voice_en_18466877.mp3	He wondered, too, where Roscoe was.	1c7c6c5c3989680a98b0f510260ce578accfff3e655fe70d4ea6f10b07ced55e0dbb8a295ede39bea85fff8a286c0c54bffb81bfea87287bf42e492bc69ab9c4	그는 로스코가 어디 있는지 궁금해했습니다.	train_covost
common_voice_en_18466879.mp3	The kiwi is a flightless bird of New Zealand.	1c7c6c5c3989680a98b0f510260ce578accfff3e655fe70d4ea6f10b07ced55e0dbb8a295ede39bea85fff8a286c0c54bffb81bfea87287bf42e492bc69ab9c4	키위는 뉴질랜드의 날지 못하는 새입니다.	train_covost
common_voice_en_18466887.mp3	Do we have robust disaster planning for that scenario?	1c7c6c5c3989680a98b0f510260ce578accfff3e655fe70d4ea6f10b07ced55e0dbb8a295ede39bea85fff8a286c0c54bffb81bfea87287bf42e492bc69ab9c4	해당 시나리오에 대한 강력한 재해 계획이 마련되어 있나요?	train_covost
common_voice_en_18466889.mp3	"I bet she's pregnant!"	1c7c6c5c3989680a98b0f510260ce578accfff3e655fe70d4ea6f10b07ced55e0dbb8a295ede39bea85fff8a286c0c54bffb81bfea87287bf42e492bc69ab9c4	분명 임신했을 거예요!	train_covost
common_voice_en_18466893.mp3	"If there's anything you need, just ask"	1c7c6c5c3989680a98b0f510260ce578accfff3e655fe70d4ea6f10b07ced55e0dbb8a295ede39bea85fff8a286c0c54bffb81bfea87287bf42e492bc69ab9c4	필요한 것이 있으면 문의하세요.	train_covost
common_voice_en_18466895.mp3	Isaac Newton was indisputably a genius.	1c7c6c5c3989680a98b0f510260ce578accfff3e655fe70d4ea6f10b07ced55e0dbb8a295ede39bea85fff8a286c0c54bffb81bfea87287bf42e492bc69ab9c4	아이작 뉴턴은 틀림없이 천재였습니다.	train_covost
common_voice_en_18466898.mp3	Those wistful eyes of hers!	1c7c6c5c3989680a98b0f510260ce578accfff3e655fe70d4ea6f10b07ced55e0dbb8a295ede39bea85fff8a286c0c54bffb81bfea87287bf42e492bc69ab9c4	그녀의 아쉬운 눈빛!	train_covost
common_voice_en_18466908.mp3	Her mileometer told her that she had only travelled ten miles	1c7c6c5c3989680a98b0f510260ce578accfff3e655fe70d4ea6f10b07ced55e0dbb8a295ede39bea85fff8a286c0c54bffb81bfea87287bf42e492bc69ab9c4	그녀의 마일 미터는 겨우 10마일을 이동했다고 알려주었습니다.	train
common_voice_en_18466910.mp3	Whilst we wait, here are a few kittens to look at.	1c7c6c5c3989680a98b0f510260ce578accfff3e655fe70d4ea6f10b07ced55e0dbb8a295ede39bea85fff8a286c0c54bffb81bfea87287bf42e492bc69ab9c4	기다리는 동안 고양이 몇 마리를 소개합니다.	train_covost
common_voice_en_18466921.mp3	It was simple, in its way, and no virtue of his.	1c7c6c5c3989680a98b0f510260ce578accfff3e655fe70d4ea6f10b07ced55e0dbb8a295ede39bea85fff8a286c0c54bffb81bfea87287bf42e492bc69ab9c4	그 방식은 단순했고, 그의 미덕은 없었습니다.	train_covost
common_voice_en_18466922.mp3	She made light work of her sewing.	1c7c6c5c3989680a98b0f510260ce578accfff3e655fe70d4ea6f10b07ced55e0dbb8a295ede39bea85fff8a286c0c54bffb81bfea87287bf42e492bc69ab9c4	그녀는 바느질을 가볍게 했습니다.	train_covost
common_voice_en_18466923.mp3	I’m not sure whether this pub offers accommodation	1c7c6c5c3989680a98b0f510260ce578accfff3e655fe70d4ea6f10b07ced55e0dbb8a295ede39bea85fff8a286c0c54bffb81bfea87287bf42e492bc69ab9c4	이 펍에서 숙박 시설을 제공하는지 잘 모르겠습니다.	train_covost
common_voice_en_18466935.mp3	A big canvas tent was the first thing to come within his vision.	1c7c6c5c3989680a98b0f510260ce578accfff3e655fe70d4ea6f10b07ced55e0dbb8a295ede39bea85fff8a286c0c54bffb81bfea87287bf42e492bc69ab9c4	그의 시야에 가장 먼저 들어온 것은 커다란 캔버스 텐트였습니다.	train_covost
common_voice_en_18466937.mp3	To shine an unflinching light.	1c7c6c5c3989680a98b0f510260ce578accfff3e655fe70d4ea6f10b07ced55e0dbb8a295ede39bea85fff8a286c0c54bffb81bfea87287bf42e492bc69ab9c4	흔들림 없는 빛을 비추기 위해.	train_covost
common_voice_en_18466945.mp3	Shorty turned to their employers.	1c7c6c5c3989680a98b0f510260ce578accfff3e655fe70d4ea6f10b07ced55e0dbb8a295ede39bea85fff8a286c0c54bffb81bfea87287bf42e492bc69ab9c4	쇼티는 고용주에게 문의했습니다.	train_covost
common_voice_en_18466946.mp3	Have you ever made a speech, Bertie?	1c7c6c5c3989680a98b0f510260ce578accfff3e655fe70d4ea6f10b07ced55e0dbb8a295ede39bea85fff8a286c0c54bffb81bfea87287bf42e492bc69ab9c4	연설해 본 적 있나요, 버티?	train_covost
common_voice_en_18466947.mp3	Go placidly amid the noise and the haste	1c7c6c5c3989680a98b0f510260ce578accfff3e655fe70d4ea6f10b07ced55e0dbb8a295ede39bea85fff8a286c0c54bffb81bfea87287bf42e492bc69ab9c4	소음과 분주함 속에서도 평온하게 이동하세요.	train_covost
common_voice_en_18466948.mp3	How can I cross the desert?	1c7c6c5c3989680a98b0f510260ce578accfff3e655fe70d4ea6f10b07ced55e0dbb8a295ede39bea85fff8a286c0c54bffb81bfea87287bf42e492bc69ab9c4	사막을 건너려면 어떻게 해야 하나요?	train_covost
common_voice_en_18466955.mp3	"It's not a thing you can do twice."	1c7c6c5c3989680a98b0f510260ce578accfff3e655fe70d4ea6f10b07ced55e0dbb8a295ede39bea85fff8a286c0c54bffb81bfea87287bf42e492bc69ab9c4	두 번 할 수 있는 일이 아닙니다.	train_covost
common_voice_en_18466957.mp3	Zilla relaxed her sour mouth long enough to sigh her satisfaction.	1c7c6c5c3989680a98b0f510260ce578accfff3e655fe70d4ea6f10b07ced55e0dbb8a295ede39bea85fff8a286c0c54bffb81bfea87287bf42e492bc69ab9c4	질라는 만족스러운 한숨을 내쉬며 신맛이 나는 입을 한참동안 이완했습니다.	train_covost
common_voice_en_18466963.mp3	"I'm so tired, I can't be bothered to move."	1c7c6c5c3989680a98b0f510260ce578accfff3e655fe70d4ea6f10b07ced55e0dbb8a295ede39bea85fff8a286c0c54bffb81bfea87287bf42e492bc69ab9c4	너무 피곤해서 움직이기가 귀찮아요.	train_covost
common_voice_en_18466964.mp3	The cricket club’s groundsman is called Bob	1c7c6c5c3989680a98b0f510260ce578accfff3e655fe70d4ea6f10b07ced55e0dbb8a295ede39bea85fff8a286c0c54bffb81bfea87287bf42e492bc69ab9c4	크리켓 클럽의 그라운드맨은 밥이라고 불립니다.	train_covost
common_voice_en_18466966.mp3	The most popular type of council housing is a council house	1c7c6c5c3989680a98b0f510260ce578accfff3e655fe70d4ea6f10b07ced55e0dbb8a295ede39bea85fff8a286c0c54bffb81bfea87287bf42e492bc69ab9c4	가장 인기 있는 협의회 주택 유형은 협의회 하우스입니다.	train_covost
common_voice_en_18466978.mp3	This business of Angela and me.	1c7c6c5c3989680a98b0f510260ce578accfff3e655fe70d4ea6f10b07ced55e0dbb8a295ede39bea85fff8a286c0c54bffb81bfea87287bf42e492bc69ab9c4	안젤라와 저의 이 사업.	train_covost
common_voice_en_18466992.mp3	Once in the cockpit, he was in his element.	1c7c6c5c3989680a98b0f510260ce578accfff3e655fe70d4ea6f10b07ced55e0dbb8a295ede39bea85fff8a286c0c54bffb81bfea87287bf42e492bc69ab9c4	조종석에 앉자마자 그는 제 기량을 마음껏 발휘했습니다.	train_covost
common_voice_en_18467002.mp3	For always there will be greater and lesser persons than yourself.	1c7c6c5c3989680a98b0f510260ce578accfff3e655fe70d4ea6f10b07ced55e0dbb8a295ede39bea85fff8a286c0c54bffb81bfea87287bf42e492bc69ab9c4	항상 자신보다 더 큰 사람과 더 작은 사람이 있기 마련입니다.	train_covost
common_voice_en_18467004.mp3	The Duodenum is part of the small intestine.	1c7c6c5c3989680a98b0f510260ce578accfff3e655fe70d4ea6f10b07ced55e0dbb8a295ede39bea85fff8a286c0c54bffb81bfea87287bf42e492bc69ab9c4	십이지장은 소장의 일부입니다.	train
common_voice_en_18467014.mp3	My grandmother always wrote her letters with a traditional fountain pen.	1c7c6c5c3989680a98b0f510260ce578accfff3e655fe70d4ea6f10b07ced55e0dbb8a295ede39bea85fff8a286c0c54bffb81bfea87287bf42e492bc69ab9c4	할머니는 항상 전통적인 만년필로 편지를 쓰셨어요.	train_covost
common_voice_en_18467026.mp3	It was an ancient yew, probably planted during the Victorian period.	1c7c6c5c3989680a98b0f510260ce578accfff3e655fe70d4ea6f10b07ced55e0dbb8a295ede39bea85fff8a286c0c54bffb81bfea87287bf42e492bc69ab9c4	빅토리아 시대에 심어진 것으로 추정되는 고대 주목입니다.	train_covost
common_voice_en_18467029.mp3	"The rowing boat can't accommodate any more."	1c7c6c5c3989680a98b0f510260ce578accfff3e655fe70d4ea6f10b07ced55e0dbb8a295ede39bea85fff8a286c0c54bffb81bfea87287bf42e492bc69ab9c4	노 젓는 보트가 더 이상 수용하지 못합니다.	train_covost
common_voice_en_18467037.mp3	In the matter of curry she is a sheer genius.	1c7c6c5c3989680a98b0f510260ce578accfff3e655fe70d4ea6f10b07ced55e0dbb8a295ede39bea85fff8a286c0c54bffb81bfea87287bf42e492bc69ab9c4	카레에 관한 한 그녀는 순수한 천재입니다.	train_covost
common_voice_en_18467038.mp3	"How do you know I'll be all right?"	1c7c6c5c3989680a98b0f510260ce578accfff3e655fe70d4ea6f10b07ced55e0dbb8a295ede39bea85fff8a286c0c54bffb81bfea87287bf42e492bc69ab9c4	제가 괜찮을지 어떻게 알 수 있나요?	train_covost
common_voice_en_18467039.mp3	Dahlia was in the drawing-room.	1c7c6c5c3989680a98b0f510260ce578accfff3e655fe70d4ea6f10b07ced55e0dbb8a295ede39bea85fff8a286c0c54bffb81bfea87287bf42e492bc69ab9c4	달리아는 응접실에 있었습니다.	train_covost
common_voice_en_18467045.mp3	I had no wish to tear myself away unless I had to.	1c7c6c5c3989680a98b0f510260ce578accfff3e655fe70d4ea6f10b07ced55e0dbb8a295ede39bea85fff8a286c0c54bffb81bfea87287bf42e492bc69ab9c4	꼭 해야만 하는 일이 아니라면 제 자신을 찢어버리고 싶지 않았습니다.	train_covost
common_voice_en_18467047.mp3	"'Do you hear?’ she continued."	1c7c6c5c3989680a98b0f510260ce578accfff3e655fe70d4ea6f10b07ced55e0dbb8a295ede39bea85fff8a286c0c54bffb81bfea87287bf42e492bc69ab9c4	'들리나요?' 그녀가 계속 물었습니다.	train_covost
common_voice_en_18467049.mp3	It makes the perfect gift.	1c7c6c5c3989680a98b0f510260ce578accfff3e655fe70d4ea6f10b07ced55e0dbb8a295ede39bea85fff8a286c0c54bffb81bfea87287bf42e492bc69ab9c4	완벽한 선물이 될 것입니다.	train_covost
common_voice_en_18467051.mp3	I ticked him off properly, the poor fish.	1c7c6c5c3989680a98b0f510260ce578accfff3e655fe70d4ea6f10b07ced55e0dbb8a295ede39bea85fff8a286c0c54bffb81bfea87287bf42e492bc69ab9c4	불쌍한 물고기를 제대로 혼내줬어요.	train_covost
common_voice_en_18467052.mp3	Yes, I call that pretty good.	1c7c6c5c3989680a98b0f510260ce578accfff3e655fe70d4ea6f10b07ced55e0dbb8a295ede39bea85fff8a286c0c54bffb81bfea87287bf42e492bc69ab9c4	네, 꽤 괜찮다고 생각합니다.	train_covost
common_voice_en_18467053.mp3	We were now good friends.	1c7c6c5c3989680a98b0f510260ce578accfff3e655fe70d4ea6f10b07ced55e0dbb8a295ede39bea85fff8a286c0c54bffb81bfea87287bf42e492bc69ab9c4	우리는 이제 좋은 친구가 되었습니다.	train_covost
common_voice_en_18467060.mp3	Yes, that rings a bell.	1c7c6c5c3989680a98b0f510260ce578accfff3e655fe70d4ea6f10b07ced55e0dbb8a295ede39bea85fff8a286c0c54bffb81bfea87287bf42e492bc69ab9c4	네, 생각나는군요.	train_covost
common_voice_en_18467066.mp3	"That melody really tugs at the heartstrings, doesn't it?"	1c7c6c5c3989680a98b0f510260ce578accfff3e655fe70d4ea6f10b07ced55e0dbb8a295ede39bea85fff8a286c0c54bffb81bfea87287bf42e492bc69ab9c4	그 멜로디가 정말 가슴을 울리지 않나요?	train_covost
common_voice_en_18467067.mp3	"Yes, lovely, isn't it?"	1c7c6c5c3989680a98b0f510260ce578accfff3e655fe70d4ea6f10b07ced55e0dbb8a295ede39bea85fff8a286c0c54bffb81bfea87287bf42e492bc69ab9c4	네, 멋지지 않나요?	train
common_voice_en_18467069.mp3	The most popular stall at the village fete was the lucky dip	1c7c6c5c3989680a98b0f510260ce578accfff3e655fe70d4ea6f10b07ced55e0dbb8a295ede39bea85fff8a286c0c54bffb81bfea87287bf42e492bc69ab9c4	마을 축제에서 가장 인기 있었던 가판대는 행운의 물놀이였어요.	train_covost
common_voice_en_18467076.mp3	At the best, they were necessary accessories.	1c7c6c5c3989680a98b0f510260ce578accfff3e655fe70d4ea6f10b07ced55e0dbb8a295ede39bea85fff8a286c0c54bffb81bfea87287bf42e492bc69ab9c4	기껏해야 필요한 액세서리였을 뿐입니다.	train_covost
common_voice_en_18467078.mp3	What brand of toilet paper do you use?	1c7c6c5c3989680a98b0f510260ce578accfff3e655fe70d4ea6f10b07ced55e0dbb8a295ede39bea85fff8a286c0c54bffb81bfea87287bf42e492bc69ab9c4	어떤 브랜드의 화장지를 사용하시나요?	train_covost
common_voice_en_18467088.mp3	But now I saw that I must carry on as planned.	1c7c6c5c3989680a98b0f510260ce578accfff3e655fe70d4ea6f10b07ced55e0dbb8a295ede39bea85fff8a286c0c54bffb81bfea87287bf42e492bc69ab9c4	하지만 이제는 계획대로 진행해야 한다는 것을 깨달았습니다.	train_covost
common_voice_en_18467089.mp3	Treacle can sometimes be used in cooking as a sweetener	1c7c6c5c3989680a98b0f510260ce578accfff3e655fe70d4ea6f10b07ced55e0dbb8a295ede39bea85fff8a286c0c54bffb81bfea87287bf42e492bc69ab9c4	트레클은 때때로 감미료로 요리에 사용할 수 있습니다.	train_covost
common_voice_en_18467162.mp3	Typhoid -- did I tell you.	1c7c6c5c3989680a98b0f510260ce578accfff3e655fe70d4ea6f10b07ced55e0dbb8a295ede39bea85fff8a286c0c54bffb81bfea87287bf42e492bc69ab9c4	장티푸스 - 제가 말씀드렸나요?	train_covost
common_voice_en_18467163.mp3	I want you to consider my suggestion carefully.	1c7c6c5c3989680a98b0f510260ce578accfff3e655fe70d4ea6f10b07ced55e0dbb8a295ede39bea85fff8a286c0c54bffb81bfea87287bf42e492bc69ab9c4	제 제안을 신중하게 고려해 주시기 바랍니다.	train
common_voice_en_18467175.mp3	"You weren't nervous?"	1c7c6c5c3989680a98b0f510260ce578accfff3e655fe70d4ea6f10b07ced55e0dbb8a295ede39bea85fff8a286c0c54bffb81bfea87287bf42e492bc69ab9c4	긴장되지 않으셨나요?	train_covost
common_voice_en_18467176.mp3	And the air was growing chilly.	1c7c6c5c3989680a98b0f510260ce578accfff3e655fe70d4ea6f10b07ced55e0dbb8a295ede39bea85fff8a286c0c54bffb81bfea87287bf42e492bc69ab9c4	그리고 공기는 점점 쌀쌀해졌습니다.	train_covost
common_voice_en_18467177.mp3	"Palmated or syncopated, it doesn't matter which."	1c7c6c5c3989680a98b0f510260ce578accfff3e655fe70d4ea6f10b07ced55e0dbb8a295ede39bea85fff8a286c0c54bffb81bfea87287bf42e492bc69ab9c4	손바닥이든 실신이든 상관없습니다.	train_covost
common_voice_en_18467186.mp3	"I'm still good friends with my ex-husband."	1c7c6c5c3989680a98b0f510260ce578accfff3e655fe70d4ea6f10b07ced55e0dbb8a295ede39bea85fff8a286c0c54bffb81bfea87287bf42e492bc69ab9c4	저는 여전히 전남편과 좋은 친구입니다.	train_covost
common_voice_en_18467188.mp3	You got out by fighting, and I through a pretty girl.	1c7c6c5c3989680a98b0f510260ce578accfff3e655fe70d4ea6f10b07ced55e0dbb8a295ede39bea85fff8a286c0c54bffb81bfea87287bf42e492bc69ab9c4	당신은 싸워서 빠져나왔고, 저는 예쁜 여자를 통해 빠져나왔습니다.	train_covost
common_voice_en_18467189.mp3	I left the car at the garage.	1c7c6c5c3989680a98b0f510260ce578accfff3e655fe70d4ea6f10b07ced55e0dbb8a295ede39bea85fff8a286c0c54bffb81bfea87287bf42e492bc69ab9c4	차를 차고에 두고 왔습니다.	train_covost
common_voice_en_18467201.mp3	My brain ceased to reel.	1c7c6c5c3989680a98b0f510260ce578accfff3e655fe70d4ea6f10b07ced55e0dbb8a295ede39bea85fff8a286c0c54bffb81bfea87287bf42e492bc69ab9c4	제 머릿속은 더 이상 돌아가지 않았습니다.	train_covost
common_voice_en_18467203.mp3	Court-chaplain, I thank you.	1c7c6c5c3989680a98b0f510260ce578accfff3e655fe70d4ea6f10b07ced55e0dbb8a295ede39bea85fff8a286c0c54bffb81bfea87287bf42e492bc69ab9c4	궁정 군목님, 감사합니다.	train_covost
common_voice_en_18467213.mp3	Make your report.	1c7c6c5c3989680a98b0f510260ce578accfff3e655fe70d4ea6f10b07ced55e0dbb8a295ede39bea85fff8a286c0c54bffb81bfea87287bf42e492bc69ab9c4	보고서를 작성하세요.	train
common_voice_en_18467214.mp3	‘I don’t much care where—’ said Alice.	1c7c6c5c3989680a98b0f510260ce578accfff3e655fe70d4ea6f10b07ced55e0dbb8a295ede39bea85fff8a286c0c54bffb81bfea87287bf42e492bc69ab9c4	'어디에 있든 상관없어요'라고 앨리스가 말했습니다.	train_covost
common_voice_en_18467242.mp3	They led on, slashing their way through the dense forest.	1c7c6c5c3989680a98b0f510260ce578accfff3e655fe70d4ea6f10b07ced55e0dbb8a295ede39bea85fff8a286c0c54bffb81bfea87287bf42e492bc69ab9c4	그들은 울창한 숲을 헤치고 나아갔습니다.	train_covost
common_voice_en_18467244.mp3	Where one door shuts, another opens.	1c7c6c5c3989680a98b0f510260ce578accfff3e655fe70d4ea6f10b07ced55e0dbb8a295ede39bea85fff8a286c0c54bffb81bfea87287bf42e492bc69ab9c4	한 문이 닫히면 다른 문이 열립니다.	train_covost
common_voice_en_18503211.mp3	You need to select a different menu option to switch modes.	1c7c6c5c3989680a98b0f510260ce578accfff3e655fe70d4ea6f10b07ced55e0dbb8a295ede39bea85fff8a286c0c54bffb81bfea87287bf42e492bc69ab9c4	모드를 전환하려면 다른 메뉴 옵션을 선택해야 합니다.	train_covost
