path	sentence	client_id	translation	split
common_voice_en_18503212.mp3	The next thing to watch out for is bed sores.	1c7c6c5c3989680a98b0f510260ce578accfff3e655fe70d4ea6f10b07ced55e0dbb8a295ede39bea85fff8a286c0c54bffb81bfea87287bf42e492bc69ab9c4	다음으로 주의해야 할 것은 욕창입니다.	train_covost
common_voice_en_18503214.mp3	"If you don't stop it manually, the next video clip will autoplay."	1c7c6c5c3989680a98b0f510260ce578accfff3e655fe70d4ea6f10b07ced55e0dbb8a295ede39bea85fff8a286c0c54bffb81bfea87287bf42e492bc69ab9c4	수동으로 중지하지 않으면 다음 동영상 클립이 자동 재생됩니다.	train
common_voice_en_18503215.mp3	It was the greatest compliment that he could imagine.	1c7c6c5c3989680a98b0f510260ce578accfff3e655fe70d4ea6f10b07ced55e0dbb8a295ede39bea85fff8a286c0c54bffb81bfea87287bf42e492bc69ab9c4	그가 상상할 수 있는 최고의 칭찬이었습니다.	train_covost
common_voice_en_18122296.mp3	Attack is the best form of defense.	d1a8e331d207cd824d6f39c6af021125535cf2616f8db442bcc432a57cb863d17e4f718fa213c14129c3dbbe59405fb11230e76713c6ab474d0247d981fa73c9	공격은 최고의 방어 수단입니다.	train_covost
common_voice_en_18122307.mp3	The horn of the car woke the sleeping cop.	d1a8e331d207cd824d6f39c6af021125535cf2616f8db442bcc432a57cb863d17e4f718fa213c14129c3dbbe59405fb11230e76713c6ab474d0247d981fa73c9	차의 경적 소리에 잠든 경찰이 깨어났습니다.	train_covost
common_voice_en_18122312.mp3	Jerk the rope and the bell rings weakly.	d1a8e331d207cd824d6f39c6af021125535cf2616f8db442bcc432a57cb863d17e4f718fa213c14129c3dbbe59405fb11230e76713c6ab474d0247d981fa73c9	밧줄을 잡아당기면 벨이 약하게 울립니다.	train_covost
common_voice_en_18122349.mp3	The bombs left most of the town in ruins.	d1a8e331d207cd824d6f39c6af021125535cf2616f8db442bcc432a57cb863d17e4f718fa213c14129c3dbbe59405fb11230e76713c6ab474d0247d981fa73c9	폭탄은 마을 대부분을 폐허로 만들었습니다.	train_covost
common_voice_en_18122369.mp3	War to the knife bitter end.	d1a8e331d207cd824d6f39c6af021125535cf2616f8db442bcc432a57cb863d17e4f718fa213c14129c3dbbe59405fb11230e76713c6ab474d0247d981fa73c9	칼끝까지 가는 전쟁.	train_covost
common_voice_en_18122409.mp3	"Stone buildings don't burn."	d1a8e331d207cd824d6f39c6af021125535cf2616f8db442bcc432a57cb863d17e4f718fa213c14129c3dbbe59405fb11230e76713c6ab474d0247d981fa73c9	석조 건물은 타지 않습니다.	train_covost
common_voice_en_18123322.mp3	A group of three notes of equal length.	d1a8e331d207cd824d6f39c6af021125535cf2616f8db442bcc432a57cb863d17e4f718fa213c14129c3dbbe59405fb11230e76713c6ab474d0247d981fa73c9	길이가 같은 세 개의 음표로 이루어진 그룹입니다.	train_covost
common_voice_en_18123330.mp3	This frequency must appear in the absorption and emission spectrum of ionized hydrogen molecule.	d1a8e331d207cd824d6f39c6af021125535cf2616f8db442bcc432a57cb863d17e4f718fa213c14129c3dbbe59405fb11230e76713c6ab474d0247d981fa73c9	이 주파수는 이온화된 수소 분자의 흡수 및 방출 스펙트럼에 나타나야 합니다.	train_covost
common_voice_en_18123341.mp3	"Didn't they have any guitars you liked?"	d1a8e331d207cd824d6f39c6af021125535cf2616f8db442bcc432a57cb863d17e4f718fa213c14129c3dbbe59405fb11230e76713c6ab474d0247d981fa73c9	마음에 드는 기타가 없었나요?	train_covost
common_voice_en_18123342.mp3	So basically establishing a system where the externalities are added to the price.	d1a8e331d207cd824d6f39c6af021125535cf2616f8db442bcc432a57cb863d17e4f718fa213c14129c3dbbe59405fb11230e76713c6ab474d0247d981fa73c9	따라서 기본적으로 외부효과가 가격에 추가되는 시스템을 구축하는 것입니다.	train_covost
common_voice_en_18123354.mp3	"Since it's been repaired, the car hasn't shown the issue any more."	d1a8e331d207cd824d6f39c6af021125535cf2616f8db442bcc432a57cb863d17e4f718fa213c14129c3dbbe59405fb11230e76713c6ab474d0247d981fa73c9	수리를 마친 후로는 더 이상 문제가 나타나지 않습니다.	train_covost
common_voice_en_18123373.mp3	I woke up to the screech of my neighbor practicing trumpet.	d1a8e331d207cd824d6f39c6af021125535cf2616f8db442bcc432a57cb863d17e4f718fa213c14129c3dbbe59405fb11230e76713c6ab474d0247d981fa73c9	옆집에서 트럼펫을 연습하는 소리에 잠에서 깼어요.	train_covost
common_voice_en_18123382.mp3	"Don't believe the lies they are telling you, invent your own instead."	d1a8e331d207cd824d6f39c6af021125535cf2616f8db442bcc432a57cb863d17e4f718fa213c14129c3dbbe59405fb11230e76713c6ab474d0247d981fa73c9	그들이 말하는 거짓말을 믿지 말고 직접 만들어 보세요.	train_covost
common_voice_en_18123383.mp3	Much of the story makes good sense.	d1a8e331d207cd824d6f39c6af021125535cf2616f8db442bcc432a57cb863d17e4f718fa213c14129c3dbbe59405fb11230e76713c6ab474d0247d981fa73c9	대부분의 이야기는 일리가 있습니다.	train_covost
common_voice_en_18123384.mp3	This allows remote hosts to connect to local forwarded ports.	d1a8e331d207cd824d6f39c6af021125535cf2616f8db442bcc432a57cb863d17e4f718fa213c14129c3dbbe59405fb11230e76713c6ab474d0247d981fa73c9	이렇게 하면 원격 호스트가 로컬 포워딩 포트에 연결할 수 있습니다.	train_covost
common_voice_en_18126254.mp3	I would recommend doing it before you get too old.	d1a8e331d207cd824d6f39c6af021125535cf2616f8db442bcc432a57cb863d17e4f718fa213c14129c3dbbe59405fb11230e76713c6ab474d0247d981fa73c9	더 나이가 들기 전에 하는 것이 좋습니다.	train_covost
common_voice_en_18126257.mp3	Wine is not an emulator.	d1a8e331d207cd824d6f39c6af021125535cf2616f8db442bcc432a57cb863d17e4f718fa213c14129c3dbbe59405fb11230e76713c6ab474d0247d981fa73c9	Wine은 에뮬레이터가 아닙니다.	train_covost
common_voice_en_18126258.mp3	A single hair casts a shadow.	d1a8e331d207cd824d6f39c6af021125535cf2616f8db442bcc432a57cb863d17e4f718fa213c14129c3dbbe59405fb11230e76713c6ab474d0247d981fa73c9	머리카락 한 올이 그림자를 드리웁니다.	train_covost
common_voice_en_18126268.mp3	The boss ran the show with a watchful eye.	d1a8e331d207cd824d6f39c6af021125535cf2616f8db442bcc432a57cb863d17e4f718fa213c14129c3dbbe59405fb11230e76713c6ab474d0247d981fa73c9	사장님은 주의 깊은 눈으로 쇼를 진행했습니다.	train_covost
common_voice_en_18126270.mp3	They have prejudices against foreigners.	d1a8e331d207cd824d6f39c6af021125535cf2616f8db442bcc432a57cb863d17e4f718fa213c14129c3dbbe59405fb11230e76713c6ab474d0247d981fa73c9	외국인에 대한 편견이 있습니다.	train_covost
common_voice_en_18126276.mp3	Both lost their lives in the raging storm.	d1a8e331d207cd824d6f39c6af021125535cf2616f8db442bcc432a57cb863d17e4f718fa213c14129c3dbbe59405fb11230e76713c6ab474d0247d981fa73c9	두 사람 모두 격렬한 폭풍우 속에서 목숨을 잃었습니다.	train_covost
common_voice_en_18126293.mp3	But recently, the view has been replaced by a more nuanced explanation.	d1a8e331d207cd824d6f39c6af021125535cf2616f8db442bcc432a57cb863d17e4f718fa213c14129c3dbbe59405fb11230e76713c6ab474d0247d981fa73c9	하지만 최근에는 이러한 관점이 좀 더 미묘한 설명으로 대체되었습니다.	train_covost
common_voice_en_18126301.mp3	Let me know by the thirteenth.	d1a8e331d207cd824d6f39c6af021125535cf2616f8db442bcc432a57cb863d17e4f718fa213c14129c3dbbe59405fb11230e76713c6ab474d0247d981fa73c9	13일까지 알려주세요.	train_covost
common_voice_en_18725149.mp3	It was invented as a means to remove cold cream.	d1a8e331d207cd824d6f39c6af021125535cf2616f8db442bcc432a57cb863d17e4f718fa213c14129c3dbbe59405fb11230e76713c6ab474d0247d981fa73c9	콜드 크림을 제거하기 위한 수단으로 발명되었습니다.	train
common_voice_en_18725150.mp3	The river itself offers excellent spots for fishing, waterskiing and boating.	d1a8e331d207cd824d6f39c6af021125535cf2616f8db442bcc432a57cb863d17e4f718fa213c14129c3dbbe59405fb11230e76713c6ab474d0247d981fa73c9	강 자체는 낚시, 수상스키, 보트 타기를 위한 훌륭한 장소를 제공합니다.	train
common_voice_en_18725151.mp3	He has worked as senior visual effects supervisor on several films.	d1a8e331d207cd824d6f39c6af021125535cf2616f8db442bcc432a57cb863d17e4f718fa213c14129c3dbbe59405fb11230e76713c6ab474d0247d981fa73c9	그는 여러 영화에서 선임 시각 효과 감독으로 일했습니다.	train
common_voice_en_18725152.mp3	"The album remains, to this day, the best-selling record of Williams' career."	d1a8e331d207cd824d6f39c6af021125535cf2616f8db442bcc432a57cb863d17e4f718fa213c14129c3dbbe59405fb11230e76713c6ab474d0247d981fa73c9	이 앨범은 지금까지도 윌리엄스의 커리어 중 가장 많이 팔린 음반으로 남아 있습니다.	train
common_voice_en_18725153.mp3	The reports continued, with the situation escalating.	d1a8e331d207cd824d6f39c6af021125535cf2616f8db442bcc432a57cb863d17e4f718fa213c14129c3dbbe59405fb11230e76713c6ab474d0247d981fa73c9	신고는 계속 이어졌고 상황은 더욱 악화되었습니다.	train
common_voice_en_18725174.mp3	Other work included pantomime and reviews.	d1a8e331d207cd824d6f39c6af021125535cf2616f8db442bcc432a57cb863d17e4f718fa213c14129c3dbbe59405fb11230e76713c6ab474d0247d981fa73c9	다른 작업으로는 팬터마임과 리뷰가 있습니다.	train
common_voice_en_18725175.mp3	It is considered a dietary supplement and is not a prescription.	d1a8e331d207cd824d6f39c6af021125535cf2616f8db442bcc432a57cb863d17e4f718fa213c14129c3dbbe59405fb11230e76713c6ab474d0247d981fa73c9	이는 건강 보조 식품으로 간주되며 처방전이 아닙니다.	train
common_voice_en_18725177.mp3	It is a mirror of the sky.	d1a8e331d207cd824d6f39c6af021125535cf2616f8db442bcc432a57cb863d17e4f718fa213c14129c3dbbe59405fb11230e76713c6ab474d0247d981fa73c9	하늘을 비추는 거울입니다.	train
common_voice_en_18725178.mp3	The town is now run by a manager.	d1a8e331d207cd824d6f39c6af021125535cf2616f8db442bcc432a57cb863d17e4f718fa213c14129c3dbbe59405fb11230e76713c6ab474d0247d981fa73c9	이제 이 마을은 관리자가 운영합니다.	train
common_voice_en_18725179.mp3	In western Germany the most educated women were the most likely to be childless.	d1a8e331d207cd824d6f39c6af021125535cf2616f8db442bcc432a57cb863d17e4f718fa213c14129c3dbbe59405fb11230e76713c6ab474d0247d981fa73c9	서부 독일에서는 교육을 가장 많이 받은 여성이 자녀가 없을 가능성이 가장 높았습니다.	train
common_voice_en_18404097.mp3	We are planning to visit the Grand Canyon.	381be909ff316356e4ae92d1902dff7c932f66f0c864fde9c7c21e7697759adbb52e924b4a10941546d8fbb2a7659fb795db90e6ad52681b236c76507df6d4d9	그랜드 캐년을 방문할 계획입니다.	train_covost
common_voice_en_18404099.mp3	Thou comest well, if thou comest alone said of misfortunes.	381be909ff316356e4ae92d1902dff7c932f66f0c864fde9c7c21e7697759adbb52e924b4a10941546d8fbb2a7659fb795db90e6ad52681b236c76507df6d4d9	네가 혼자서 불행에 대해 말한다면 너는 잘한다.	train_covost
common_voice_en_18404100.mp3	I need something clean.	381be909ff316356e4ae92d1902dff7c932f66f0c864fde9c7c21e7697759adbb52e924b4a10941546d8fbb2a7659fb795db90e6ad52681b236c76507df6d4d9	깨끗한 것이 필요합니다.	train_covost
common_voice_en_18561407.mp3	We are to meet as usual?	381be909ff316356e4ae92d1902dff7c932f66f0c864fde9c7c21e7697759adbb52e924b4a10941546d8fbb2a7659fb795db90e6ad52681b236c76507df6d4d9	평소처럼 만나기로 했나요?	train
common_voice_en_18561408.mp3	A good tone, mind you!	381be909ff316356e4ae92d1902dff7c932f66f0c864fde9c7c21e7697759adbb52e924b4a10941546d8fbb2a7659fb795db90e6ad52681b236c76507df6d4d9	좋은 톤으로요!	train_covost
common_voice_en_18561409.mp3	"It's the most beautiful thing that ever was seen!"	381be909ff316356e4ae92d1902dff7c932f66f0c864fde9c7c21e7697759adbb52e924b4a10941546d8fbb2a7659fb795db90e6ad52681b236c76507df6d4d9	지금까지 본 것 중 가장 아름다운 것입니다!	train
common_voice_en_18561410.mp3	So did his father, and his grandfather, and his great-grandfather!	381be909ff316356e4ae92d1902dff7c932f66f0c864fde9c7c21e7697759adbb52e924b4a10941546d8fbb2a7659fb795db90e6ad52681b236c76507df6d4d9	그의 아버지와 할아버지, 증조부도 마찬가지였습니다!	train
common_voice_en_18561411.mp3	We must design systems so they will benefit everyone	381be909ff316356e4ae92d1902dff7c932f66f0c864fde9c7c21e7697759adbb52e924b4a10941546d8fbb2a7659fb795db90e6ad52681b236c76507df6d4d9	모든 사람에게 혜택이 돌아갈 수 있도록 시스템을 설계해야 합니다.	train
common_voice_en_18561418.mp3	"Then he said abruptly: ""Nothing, of course; nothing."""	381be909ff316356e4ae92d1902dff7c932f66f0c864fde9c7c21e7697759adbb52e924b4a10941546d8fbb2a7659fb795db90e6ad52681b236c76507df6d4d9	"그러자 그는 갑자기 말했습니다: "물론 아무것도 아닙니다.	train
common_voice_en_18561419.mp3	"""I think I am, miss,"" she replied."	381be909ff316356e4ae92d1902dff7c932f66f0c864fde9c7c21e7697759adbb52e924b4a10941546d8fbb2a7659fb795db90e6ad52681b236c76507df6d4d9	"그런 것 같아요, 아가씨." 그녀가 대답했습니다.	train
common_voice_en_18561422.mp3	You all think something else, I see.	381be909ff316356e4ae92d1902dff7c932f66f0c864fde9c7c21e7697759adbb52e924b4a10941546d8fbb2a7659fb795db90e6ad52681b236c76507df6d4d9	다들 다른 생각을 하시나 보군요.	train
common_voice_en_18561423.mp3	Mary Poppins coined the catchy phrase Supercalifragilisticexpialidocious.	381be909ff316356e4ae92d1902dff7c932f66f0c864fde9c7c21e7697759adbb52e924b4a10941546d8fbb2a7659fb795db90e6ad52681b236c76507df6d4d9	메리 포핀스는 '슈퍼칼리프라길리스티스엑스피알리도셔스'라는 유행어를 만들어냈습니다.	train_covost
common_voice_en_18561427.mp3	Madame believed it, and brought her home.	381be909ff316356e4ae92d1902dff7c932f66f0c864fde9c7c21e7697759adbb52e924b4a10941546d8fbb2a7659fb795db90e6ad52681b236c76507df6d4d9	마담은 그 말을 믿고 그녀를 집으로 데려왔습니다.	train
common_voice_en_18561428.mp3	The cooked meat was tender to the touch.	381be909ff316356e4ae92d1902dff7c932f66f0c864fde9c7c21e7697759adbb52e924b4a10941546d8fbb2a7659fb795db90e6ad52681b236c76507df6d4d9	익힌 고기는 촉감이 부드러웠습니다.	train_covost
common_voice_en_18561429.mp3	The functionality was extended.	381be909ff316356e4ae92d1902dff7c932f66f0c864fde9c7c21e7697759adbb52e924b4a10941546d8fbb2a7659fb795db90e6ad52681b236c76507df6d4d9	기능이 확장되었습니다.	train_covost
common_voice_en_18561430.mp3	In the back room up there.	381be909ff316356e4ae92d1902dff7c932f66f0c864fde9c7c21e7697759adbb52e924b4a10941546d8fbb2a7659fb795db90e6ad52681b236c76507df6d4d9	저기 뒷방에 있습니다.	train
common_voice_en_18561431.mp3	This is not in the scope of the project.	381be909ff316356e4ae92d1902dff7c932f66f0c864fde9c7c21e7697759adbb52e924b4a10941546d8fbb2a7659fb795db90e6ad52681b236c76507df6d4d9	이는 프로젝트의 범위에 포함되지 않습니다.	train
common_voice_en_18561437.mp3	These are Canadian tourists.	381be909ff316356e4ae92d1902dff7c932f66f0c864fde9c7c21e7697759adbb52e924b4a10941546d8fbb2a7659fb795db90e6ad52681b236c76507df6d4d9	캐나다 관광객입니다.	train_covost
common_voice_en_18561438.mp3	I’m mad. You’re mad.	381be909ff316356e4ae92d1902dff7c932f66f0c864fde9c7c21e7697759adbb52e924b4a10941546d8fbb2a7659fb795db90e6ad52681b236c76507df6d4d9	난 미쳤어 당신도 미쳤어.	train
common_voice_en_18561439.mp3	I was thinking that Tuppy is probably lurking somewhere.	381be909ff316356e4ae92d1902dff7c932f66f0c864fde9c7c21e7697759adbb52e924b4a10941546d8fbb2a7659fb795db90e6ad52681b236c76507df6d4d9	터피가 어딘가에 숨어 있을 거라고 생각했어요.	train_covost
common_voice_en_18561440.mp3	I will watch over you.	381be909ff316356e4ae92d1902dff7c932f66f0c864fde9c7c21e7697759adbb52e924b4a10941546d8fbb2a7659fb795db90e6ad52681b236c76507df6d4d9	제가 지켜드리겠습니다.	train_covost
common_voice_en_18561441.mp3	The engine is idling too fast.	381be909ff316356e4ae92d1902dff7c932f66f0c864fde9c7c21e7697759adbb52e924b4a10941546d8fbb2a7659fb795db90e6ad52681b236c76507df6d4d9	엔진이 너무 빨리 공회전합니다.	train
common_voice_en_18561442.mp3	"She said gently, but very seriously, ""you are not kind."""	381be909ff316356e4ae92d1902dff7c932f66f0c864fde9c7c21e7697759adbb52e924b4a10941546d8fbb2a7659fb795db90e6ad52681b236c76507df6d4d9	"그녀는 부드럽게, 그러나 매우 진지하게 "당신은 친절하지 않아요.	train_covost
common_voice_en_18561443.mp3	I asked her if Mrs. Jellyby knew that her wedding-day was fixed.	381be909ff316356e4ae92d1902dff7c932f66f0c864fde9c7c21e7697759adbb52e924b4a10941546d8fbb2a7659fb795db90e6ad52681b236c76507df6d4d9	저는 젤리비 부인에게 결혼 날짜가 정해졌다는 사실을 알고 있는지 물었습니다.	train
common_voice_en_18561444.mp3	Call it four and ninepence — call it four pounds nine.	381be909ff316356e4ae92d1902dff7c932f66f0c864fde9c7c21e7697759adbb52e924b4a10941546d8fbb2a7659fb795db90e6ad52681b236c76507df6d4d9	4파운드 9펜스라고 부르세요.	train_covost
common_voice_en_18561445.mp3	I lifted my veil and spoke to the woman.	381be909ff316356e4ae92d1902dff7c932f66f0c864fde9c7c21e7697759adbb52e924b4a10941546d8fbb2a7659fb795db90e6ad52681b236c76507df6d4d9	저는 베일을 벗고 그 여성에게 말을 걸었습니다.	train_covost
common_voice_en_18561446.mp3	"You've been in low spirits this afternoon."	381be909ff316356e4ae92d1902dff7c932f66f0c864fde9c7c21e7697759adbb52e924b4a10941546d8fbb2a7659fb795db90e6ad52681b236c76507df6d4d9	오늘 오후에 기분이 좋지 않으셨어요.	train
common_voice_en_18561447.mp3	It is designed and guided, like the human mind.	381be909ff316356e4ae92d1902dff7c932f66f0c864fde9c7c21e7697759adbb52e924b4a10941546d8fbb2a7659fb795db90e6ad52681b236c76507df6d4d9	인간의 마음처럼 설계되고 안내됩니다.	train
common_voice_en_18561449.mp3	Beside her is a canvas bag, or bundle, she has carried.	381be909ff316356e4ae92d1902dff7c932f66f0c864fde9c7c21e7697759adbb52e924b4a10941546d8fbb2a7659fb795db90e6ad52681b236c76507df6d4d9	그녀의 옆에는 그녀가 들고 다니는 캔버스 가방, 즉 번들이 있습니다.	train
common_voice_en_18561450.mp3	"""If you believe you are a good prophet,"" said I."	381be909ff316356e4ae92d1902dff7c932f66f0c864fde9c7c21e7697759adbb52e924b4a10941546d8fbb2a7659fb795db90e6ad52681b236c76507df6d4d9	"당신이 좋은 선지자라고 믿는다면요."라고 말했습니다."	train
common_voice_en_18561451.mp3	How do you balance on a Segway?	381be909ff316356e4ae92d1902dff7c932f66f0c864fde9c7c21e7697759adbb52e924b4a10941546d8fbb2a7659fb795db90e6ad52681b236c76507df6d4d9	세그웨이에서 균형을 잡는 방법은 무엇인가요?	train_covost
common_voice_en_18561452.mp3	You are of that opinion?	381be909ff316356e4ae92d1902dff7c932f66f0c864fde9c7c21e7697759adbb52e924b4a10941546d8fbb2a7659fb795db90e6ad52681b236c76507df6d4d9	그렇게 생각하시나요?	train
common_voice_en_18561453.mp3	How do you mean, settled?	381be909ff316356e4ae92d1902dff7c932f66f0c864fde9c7c21e7697759adbb52e924b4a10941546d8fbb2a7659fb795db90e6ad52681b236c76507df6d4d9	정착이라니 무슨 뜻인가요?	train
common_voice_en_18561454.mp3	This is an incubator for innovation.	381be909ff316356e4ae92d1902dff7c932f66f0c864fde9c7c21e7697759adbb52e924b4a10941546d8fbb2a7659fb795db90e6ad52681b236c76507df6d4d9	혁신을 위한 인큐베이터입니다.	train_covost
common_voice_en_18561455.mp3	This is our company charter.	381be909ff316356e4ae92d1902dff7c932f66f0c864fde9c7c21e7697759adbb52e924b4a10941546d8fbb2a7659fb795db90e6ad52681b236c76507df6d4d9	이것이 저희 회사 헌장입니다.	train
common_voice_en_18561456.mp3	‘Does the boots and shoes!’ she repeated in a wondering tone.	381be909ff316356e4ae92d1902dff7c932f66f0c864fde9c7c21e7697759adbb52e924b4a10941546d8fbb2a7659fb795db90e6ad52681b236c76507df6d4d9	"부츠와 신발은요!" 그녀는 신기한 어조로 반복했습니다.	train
common_voice_en_18561457.mp3	He would never accept of help from me now.	381be909ff316356e4ae92d1902dff7c932f66f0c864fde9c7c21e7697759adbb52e924b4a10941546d8fbb2a7659fb795db90e6ad52681b236c76507df6d4d9	그는 지금 제 도움을 절대 받아들이지 않을 것입니다.	train
common_voice_en_18561458.mp3	The taste of victory is palpable.	381be909ff316356e4ae92d1902dff7c932f66f0c864fde9c7c21e7697759adbb52e924b4a10941546d8fbb2a7659fb795db90e6ad52681b236c76507df6d4d9	승리의 맛을 느낄 수 있습니다.	train
common_voice_en_18561459.mp3	“Should we go, mother?” he said.	381be909ff316356e4ae92d1902dff7c932f66f0c864fde9c7c21e7697759adbb52e924b4a10941546d8fbb2a7659fb795db90e6ad52681b236c76507df6d4d9	"우리 갈까요, 엄마?" 그가 물었습니다.	train_covost
common_voice_en_18561460.mp3	"In an instant Adele's head was out of the window."	381be909ff316356e4ae92d1902dff7c932f66f0c864fde9c7c21e7697759adbb52e924b4a10941546d8fbb2a7659fb795db90e6ad52681b236c76507df6d4d9	순식간에 아델의 머릿속은 창밖으로 사라졌습니다.	train_covost
common_voice_en_18561461.mp3	And a second afterwards, a tiny bright light shone.	381be909ff316356e4ae92d1902dff7c932f66f0c864fde9c7c21e7697759adbb52e924b4a10941546d8fbb2a7659fb795db90e6ad52681b236c76507df6d4d9	그리고 잠시 후 작고 밝은 빛이 비쳤습니다.	train_covost
common_voice_en_18561468.mp3	The advantages of eating healthily are too many to list.	381be909ff316356e4ae92d1902dff7c932f66f0c864fde9c7c21e7697759adbb52e924b4a10941546d8fbb2a7659fb795db90e6ad52681b236c76507df6d4d9	건강한 식습관의 장점은 일일이 열거하기 힘들 정도로 많습니다.	train
common_voice_en_18561469.mp3	Your contribution to our charity is appreciated.	381be909ff316356e4ae92d1902dff7c932f66f0c864fde9c7c21e7697759adbb52e924b4a10941546d8fbb2a7659fb795db90e6ad52681b236c76507df6d4d9	자선 단체에 기부해 주셔서 감사합니다.	train
common_voice_en_18561470.mp3	The two friends rise and look at one another.	381be909ff316356e4ae92d1902dff7c932f66f0c864fde9c7c21e7697759adbb52e924b4a10941546d8fbb2a7659fb795db90e6ad52681b236c76507df6d4d9	두 친구는 자리에서 일어나 서로를 바라봅니다.	train
common_voice_en_18561471.mp3	"I don't know, I am sure!"	381be909ff316356e4ae92d1902dff7c932f66f0c864fde9c7c21e7697759adbb52e924b4a10941546d8fbb2a7659fb795db90e6ad52681b236c76507df6d4d9	모르겠어요, 확실해요!	train_covost
common_voice_en_18561477.mp3	And do you always lock the babies up when you go out?	381be909ff316356e4ae92d1902dff7c932f66f0c864fde9c7c21e7697759adbb52e924b4a10941546d8fbb2a7659fb795db90e6ad52681b236c76507df6d4d9	외출할 때는 항상 아기를 가둬두나요?	train
common_voice_en_18561478.mp3	Find me a blueprint for building stable software.	381be909ff316356e4ae92d1902dff7c932f66f0c864fde9c7c21e7697759adbb52e924b4a10941546d8fbb2a7659fb795db90e6ad52681b236c76507df6d4d9	안정적인 소프트웨어를 구축하기 위한 청사진을 찾아주세요.	train
common_voice_en_18561479.mp3	These are forces of change.	381be909ff316356e4ae92d1902dff7c932f66f0c864fde9c7c21e7697759adbb52e924b4a10941546d8fbb2a7659fb795db90e6ad52681b236c76507df6d4d9	이것이 바로 변화의 힘입니다.	train
common_voice_en_18561480.mp3	No, I could not speak; I had not the courage.	381be909ff316356e4ae92d1902dff7c932f66f0c864fde9c7c21e7697759adbb52e924b4a10941546d8fbb2a7659fb795db90e6ad52681b236c76507df6d4d9	아니요, 용기가 없어서 말을 할 수 없었습니다.	train
common_voice_en_18561481.mp3	Hanaud clapped him on the shoulder.	381be909ff316356e4ae92d1902dff7c932f66f0c864fde9c7c21e7697759adbb52e924b4a10941546d8fbb2a7659fb795db90e6ad52681b236c76507df6d4d9	하나우는 그의 어깨에 박수를 보냈습니다.	train_covost
common_voice_en_18561482.mp3	What is your desired difficulty level?	381be909ff316356e4ae92d1902dff7c932f66f0c864fde9c7c21e7697759adbb52e924b4a10941546d8fbb2a7659fb795db90e6ad52681b236c76507df6d4d9	원하는 난이도는 어느 정도인가요?	train_covost
common_voice_en_18561483.mp3	When water is boiled, it will evaporate.	381be909ff316356e4ae92d1902dff7c932f66f0c864fde9c7c21e7697759adbb52e924b4a10941546d8fbb2a7659fb795db90e6ad52681b236c76507df6d4d9	물이 끓으면 증발합니다.	train
common_voice_en_18561484.mp3	The charwoman had been sent home.	381be909ff316356e4ae92d1902dff7c932f66f0c864fde9c7c21e7697759adbb52e924b4a10941546d8fbb2a7659fb795db90e6ad52681b236c76507df6d4d9	그 여자는 집으로 돌려보냈습니다.	train
common_voice_en_18561485.mp3	Mr. Bucket, dismissing his sudden anger, checks him.	381be909ff316356e4ae92d1902dff7c932f66f0c864fde9c7c21e7697759adbb52e924b4a10941546d8fbb2a7659fb795db90e6ad52681b236c76507df6d4d9	버킷 씨는 갑작스러운 분노를 억누르며 그를 확인합니다.	train
common_voice_en_18561486.mp3	I am a little rambling.	381be909ff316356e4ae92d1902dff7c932f66f0c864fde9c7c21e7697759adbb52e924b4a10941546d8fbb2a7659fb795db90e6ad52681b236c76507df6d4d9	약간 횡설수설하고 있습니다.	train
common_voice_en_18561497.mp3	I would like to inform you that I am temporarily out of work.	381be909ff316356e4ae92d1902dff7c932f66f0c864fde9c7c21e7697759adbb52e924b4a10941546d8fbb2a7659fb795db90e6ad52681b236c76507df6d4d9	일시적으로 업무가 중단되었음을 알려드리고자 합니다.	train
common_voice_en_18561498.mp3	"It's reassuring and encouraging to hear your words."	381be909ff316356e4ae92d1902dff7c932f66f0c864fde9c7c21e7697759adbb52e924b4a10941546d8fbb2a7659fb795db90e6ad52681b236c76507df6d4d9	여러분의 말씀을 들으니 안심이 되고 힘이 납니다.	train
common_voice_en_18561499.mp3	The bill remained unpaid so was referred to the high court.	381be909ff316356e4ae92d1902dff7c932f66f0c864fde9c7c21e7697759adbb52e924b4a10941546d8fbb2a7659fb795db90e6ad52681b236c76507df6d4d9	청구서는 미납된 상태로 남아 있어 고등법원에 회부되었습니다.	train_covost
