path	sentence	client_id	translation	split
common_voice_en_20075241.mp3	His factory in downtown Huntingdon was later relocated to nearby Alexandria.	dd194fc7a04af593ac6a1376b3c3bbc27d6a0a4a1c8a5b6dfb3aaccb8f6a13734adf1eada368fbd4d984d7f8e505eb69e1630356ac7eb2d04eb7afaffc2731d8	헌팅던 시내에 있던 그의 공장은 나중에 인근 알렉산드리아로 이전했습니다.	train
common_voice_en_20075242.mp3	Other skills taught may include management or pedagogy.	dd194fc7a04af593ac6a1376b3c3bbc27d6a0a4a1c8a5b6dfb3aaccb8f6a13734adf1eada368fbd4d984d7f8e505eb69e1630356ac7eb2d04eb7afaffc2731d8	기타 가르치는 기술에는 관리 또는 교육학이 포함될 수 있습니다.	train
common_voice_en_20075243.mp3	He modeled for Versace, Calvin Klein, and Armani, among others before he started acting.	dd194fc7a04af593ac6a1376b3c3bbc27d6a0a4a1c8a5b6dfb3aaccb8f6a13734adf1eada368fbd4d984d7f8e505eb69e1630356ac7eb2d04eb7afaffc2731d8	연기를 시작하기 전에는 베르사체, 캘빈클라인, 아르마니 등의 모델로 활동했습니다.	train
common_voice_en_20075244.mp3	"Like ""Shanghai Baby"", the novel is again narrated by Coco, a thinly disguised Weihui."	dd194fc7a04af593ac6a1376b3c3bbc27d6a0a4a1c8a5b6dfb3aaccb8f6a13734adf1eada368fbd4d984d7f8e505eb69e1630356ac7eb2d04eb7afaffc2731d8	'상하이 베이비'와 마찬가지로 이 소설도 얇게 변장한 웨이후이인 코코가 내레이션을 맡았습니다.	train
common_voice_en_20075245.mp3	Father Nikolle Marku is the leader of the new denomination.	dd194fc7a04af593ac6a1376b3c3bbc27d6a0a4a1c8a5b6dfb3aaccb8f6a13734adf1eada368fbd4d984d7f8e505eb69e1630356ac7eb2d04eb7afaffc2731d8	니콜 마르쿠 신부는 새로운 교단의 지도자입니다.	train
common_voice_en_19995016.mp3	I hear bad production and I hear bad performances as well.	dd42b3d0a4cc0d2f3e33c4a754f0e54305a2f4043944df94eac9cac34a7f500200f79be01779cae03a9ff9299b6ca4a1d672f3e801565d8e3a841ee95a1fa5bd	제작도 안 좋고 공연도 안 좋다고 들었습니다.	train
common_voice_en_19995017.mp3	Students are expected to adhere to a Moral Code of Conduct.	dd42b3d0a4cc0d2f3e33c4a754f0e54305a2f4043944df94eac9cac34a7f500200f79be01779cae03a9ff9299b6ca4a1d672f3e801565d8e3a841ee95a1fa5bd	학생은 도덕적 행동 강령을 준수해야 합니다.	train
common_voice_en_19995018.mp3	They sometimes form collections of defaced art for future enjoyment.	dd42b3d0a4cc0d2f3e33c4a754f0e54305a2f4043944df94eac9cac34a7f500200f79be01779cae03a9ff9299b6ca4a1d672f3e801565d8e3a841ee95a1fa5bd	때때로 그들은 훗날의 즐거움을 위해 훼손된 예술품 컬렉션을 만들기도 합니다.	train
common_voice_en_19995019.mp3	"Commander Jones' body was washed ashore in Western Sweden some days after the battle."	dd42b3d0a4cc0d2f3e33c4a754f0e54305a2f4043944df94eac9cac34a7f500200f79be01779cae03a9ff9299b6ca4a1d672f3e801565d8e3a841ee95a1fa5bd	존스 중령의 시신은 전투 며칠 후 스웨덴 서부에서 해변으로 떠밀려왔습니다.	train
common_voice_en_19995020.mp3	He said, There goes Willie.	dd42b3d0a4cc0d2f3e33c4a754f0e54305a2f4043944df94eac9cac34a7f500200f79be01779cae03a9ff9299b6ca4a1d672f3e801565d8e3a841ee95a1fa5bd	그가 말했죠, 저기 윌리가 간다.	train
common_voice_en_19571360.mp3	Hendricks and some of his gang are killed, and the rest are driven off.	dd438cbeacbfecfcc92cee46dd8e1a438d7c963b1098ab22036bbc1a2d1eb9cdd68a3c8e0e4bb1c6e21f6e85210f1559f2e682407447763a15e74c9d1fcf205d	헨드릭스와 그의 일당 중 일부는 죽고 나머지는 쫓겨납니다.	train
common_voice_en_19571361.mp3	It forms part of one of the Big Four banks in Ireland.	dd438cbeacbfecfcc92cee46dd8e1a438d7c963b1098ab22036bbc1a2d1eb9cdd68a3c8e0e4bb1c6e21f6e85210f1559f2e682407447763a15e74c9d1fcf205d	아일랜드의 빅4 은행 중 하나에 속해 있습니다.	train
common_voice_en_19571362.mp3	It does not imply that other types of dogs do not work.	dd438cbeacbfecfcc92cee46dd8e1a438d7c963b1098ab22036bbc1a2d1eb9cdd68a3c8e0e4bb1c6e21f6e85210f1559f2e682407447763a15e74c9d1fcf205d	다른 유형의 개가 작동하지 않는다는 것을 의미하지는 않습니다.	train
common_voice_en_19571363.mp3	One, Abe Nobuyuki, was Prime Minister before his appointment as Governor-General.	dd438cbeacbfecfcc92cee46dd8e1a438d7c963b1098ab22036bbc1a2d1eb9cdd68a3c8e0e4bb1c6e21f6e85210f1559f2e682407447763a15e74c9d1fcf205d	아베 노부유키는 총독으로 임명되기 전 총리를 지낸 바 있습니다.	train
common_voice_en_19571364.mp3	The Navy agreed.	dd438cbeacbfecfcc92cee46dd8e1a438d7c963b1098ab22036bbc1a2d1eb9cdd68a3c8e0e4bb1c6e21f6e85210f1559f2e682407447763a15e74c9d1fcf205d	해군도 동의했습니다.	train
common_voice_en_19660198.mp3	He is of Russian ancestry.	dd55f8d05c1b7a3017c941e248e4404bd2e890300c98dc10a592423ef8af4db95e8f47af1efdc4c88f9e78f42654039e7a17d28a2e667f6f220f66070cf79717	그는 러시아 혈통입니다.	train
common_voice_en_19660204.mp3	Merrill soon went to work developing standards, launching tests, designing equipment and uncovering hazards.	dd55f8d05c1b7a3017c941e248e4404bd2e890300c98dc10a592423ef8af4db95e8f47af1efdc4c88f9e78f42654039e7a17d28a2e667f6f220f66070cf79717	메릴은 곧 표준을 개발하고, 테스트를 시작하고, 장비를 설계하고, 위험을 발견하는 작업에 착수했습니다.	train
common_voice_en_19660208.mp3	Defiance and Elon continue to relate to the United Church of Christ today.	dd55f8d05c1b7a3017c941e248e4404bd2e890300c98dc10a592423ef8af4db95e8f47af1efdc4c88f9e78f42654039e7a17d28a2e667f6f220f66070cf79717	디파이언스와 엘론은 오늘날에도 여전히 그리스도의 연합 교회와 관련이 있습니다.	train
common_voice_en_19660210.mp3	There were no local elections in Scotland, Wales or Northern Ireland.	dd55f8d05c1b7a3017c941e248e4404bd2e890300c98dc10a592423ef8af4db95e8f47af1efdc4c88f9e78f42654039e7a17d28a2e667f6f220f66070cf79717	스코틀랜드, 웨일즈, 북아일랜드에서는 지방 선거가 실시되지 않았습니다.	train
common_voice_en_19660212.mp3	"After Protesilaus' death, his brother, Podarces, joined the war in his place."	dd55f8d05c1b7a3017c941e248e4404bd2e890300c98dc10a592423ef8af4db95e8f47af1efdc4c88f9e78f42654039e7a17d28a2e667f6f220f66070cf79717	프로테실라우스가 죽은 후 그의 동생 포다르세스가 그를 대신해 전쟁에 참여했습니다.	train
common_voice_en_18455234.mp3	"We're going to Paris for our honeymoon."	dd69ce659f90a72cee41423b5550d64a6424a2158cc5734b8a3cb277e37eddde5c17f3d4fb6a39256704cb83284486dff5dd36370bbf45e67ba256d0c86dd515	신혼여행을 위해 파리에 갈 거예요.	train
common_voice_en_18455235.mp3	"Why's she being so spiky at the moment?"	dd69ce659f90a72cee41423b5550d64a6424a2158cc5734b8a3cb277e37eddde5c17f3d4fb6a39256704cb83284486dff5dd36370bbf45e67ba256d0c86dd515	왜 지금 저렇게 삐딱한 거죠?	train
common_voice_en_18455236.mp3	The championship will be ours!	dd69ce659f90a72cee41423b5550d64a6424a2158cc5734b8a3cb277e37eddde5c17f3d4fb6a39256704cb83284486dff5dd36370bbf45e67ba256d0c86dd515	우승은 우리의 것이 될 것입니다!	train
common_voice_en_18455237.mp3	She was unfairly criticised	dd69ce659f90a72cee41423b5550d64a6424a2158cc5734b8a3cb277e37eddde5c17f3d4fb6a39256704cb83284486dff5dd36370bbf45e67ba256d0c86dd515	부당한 비판을 받았습니다.	train
common_voice_en_18455238.mp3	Maths is the British abbreviation for mathematics	dd69ce659f90a72cee41423b5550d64a6424a2158cc5734b8a3cb277e37eddde5c17f3d4fb6a39256704cb83284486dff5dd36370bbf45e67ba256d0c86dd515	수학은 수학의 영국식 약어입니다.	train
common_voice_en_18422047.mp3	Palm Sunday is the Sunday before Easter.	dd6ef4e7df2fb01e892a6a8726e72360e4c4f744a6d3ad580bf74d6a4e72f0825c177502316ec38924598e9075ed782b7aa1cbb3e377355abdcc797846c52012	종려주일은 부활절 전 일요일입니다.	train_covost
common_voice_en_18422048.mp3	Then I saw the way.	dd6ef4e7df2fb01e892a6a8726e72360e4c4f744a6d3ad580bf74d6a4e72f0825c177502316ec38924598e9075ed782b7aa1cbb3e377355abdcc797846c52012	그러다 길이 보였습니다.	train
common_voice_en_18422049.mp3	This area is under construction.	dd6ef4e7df2fb01e892a6a8726e72360e4c4f744a6d3ad580bf74d6a4e72f0825c177502316ec38924598e9075ed782b7aa1cbb3e377355abdcc797846c52012	이 영역은 현재 공사 중입니다.	train
common_voice_en_18422050.mp3	I was going to do my wrapping tonight.	dd6ef4e7df2fb01e892a6a8726e72360e4c4f744a6d3ad580bf74d6a4e72f0825c177502316ec38924598e9075ed782b7aa1cbb3e377355abdcc797846c52012	오늘 밤에 포장을 하려고 했어요.	train
common_voice_en_19727553.mp3	In my mind, Dog is not intended to be Sabretooth, but he could be.	dd6f815dc00c77cca90173da7cf417d3c5997e21a0f8c7805e7b62ce0bfce1fd68e427d9b9858116271a939183f4bf214f30fc80ab9f7d4a7f69e1cf0e17b89f	제 생각에 개는 세이버투스가 될 의도는 없었지만 그럴 수도 있습니다.	train
common_voice_en_19727554.mp3	As for specific models, Obama took a buy-American stance.	dd6f815dc00c77cca90173da7cf417d3c5997e21a0f8c7805e7b62ce0bfce1fd68e427d9b9858116271a939183f4bf214f30fc80ab9f7d4a7f69e1cf0e17b89f	특정 모델에 대해 오바마는 미국산 구매 입장을 취했습니다.	train
common_voice_en_19727555.mp3	"A former Army intelligence major, Francis J. McNamara, was the editor of ""Counterattack""."	dd6f815dc00c77cca90173da7cf417d3c5997e21a0f8c7805e7b62ce0bfce1fd68e427d9b9858116271a939183f4bf214f30fc80ab9f7d4a7f69e1cf0e17b89f	육군 정보 소령 출신인 프란시스 J. 맥나마라는 '카운터어택'의 편집자였습니다.	train
common_voice_en_19727556.mp3	Many of its members also belonged to the Ulster Volunteer Force.	dd6f815dc00c77cca90173da7cf417d3c5997e21a0f8c7805e7b62ce0bfce1fd68e427d9b9858116271a939183f4bf214f30fc80ab9f7d4a7f69e1cf0e17b89f	많은 회원들이 얼스터 자원 봉사단 소속이기도 합니다.	train
common_voice_en_19727557.mp3	Newspapers are handed out during this hour once the newspapers have been published.	dd6f815dc00c77cca90173da7cf417d3c5997e21a0f8c7805e7b62ce0bfce1fd68e427d9b9858116271a939183f4bf214f30fc80ab9f7d4a7f69e1cf0e17b89f	신문이 발행되면 이 시간 동안 신문을 배포합니다.	train
common_voice_en_127876.mp3	How does anything like this ever start?	dd72c65d2f2923177f1aff764fa86c9b9e286bfad4deabd4f67eeb918b32b94b78a58d53a71c9e6f606630ecc08fb23ba894764030464ad60232bebf7eeecf5e	어떻게 이런 일이 시작될 수 있을까요?	train
common_voice_en_19713834.mp3	It works at the Butterley Park Miniature Railway, part of the Swanwick Junction complex.	dd737b19fc576fad18573d34a8d56a42b544024d697d8693663827f64d6c764d82c92aea24842da2625a4d3b68122c66c475ab730a708c662efa3af4e86d2581	스완윅 정션 단지의 일부인 버터리 파크 미니어처 철도에서 작동합니다.	train
common_voice_en_19713835.mp3	There are no conclusive arguments either way.	dd737b19fc576fad18573d34a8d56a42b544024d697d8693663827f64d6c764d82c92aea24842da2625a4d3b68122c66c475ab730a708c662efa3af4e86d2581	어느 쪽이든 결정적인 주장은 없습니다.	train
common_voice_en_19713836.mp3	It was built by London and South Western Railway in their typical style.	dd737b19fc576fad18573d34a8d56a42b544024d697d8693663827f64d6c764d82c92aea24842da2625a4d3b68122c66c475ab730a708c662efa3af4e86d2581	런던과 사우스웨스턴 철도에 의해 전형적인 스타일로 지어졌습니다.	train
common_voice_en_19713837.mp3	Later the club members also began to organise fencing, hiking, boxing and cycling.	dd737b19fc576fad18573d34a8d56a42b544024d697d8693663827f64d6c764d82c92aea24842da2625a4d3b68122c66c475ab730a708c662efa3af4e86d2581	나중에 클럽 회원들은 펜싱, 하이킹, 복싱, 사이클링도 조직하기 시작했습니다.	train
common_voice_en_19713838.mp3	School, Bhopal and was the head girl of her school.	dd737b19fc576fad18573d34a8d56a42b544024d697d8693663827f64d6c764d82c92aea24842da2625a4d3b68122c66c475ab730a708c662efa3af4e86d2581	보팔의 학교를 졸업하고 학교의 여학생 대표를 맡았습니다.	train
common_voice_en_19392869.mp3	After the end of his term, Noel continued to be active in state politics.	dd75d45cc977616903fccd456f90df331207743606c58e96690f0bf858764d5c73050819c4a3c51d85bcce14ca32f4cecbb0c4949101c3d444bbe1d7133e251a	임기가 끝난 후에도 노엘은 계속해서 주 정치에 적극적으로 참여했습니다.	train
common_voice_en_19392870.mp3	"I don't see that going anywhere in the near future."	dd75d45cc977616903fccd456f90df331207743606c58e96690f0bf858764d5c73050819c4a3c51d85bcce14ca32f4cecbb0c4949101c3d444bbe1d7133e251a	가까운 장래에 그런 일이 벌어질 것 같지는 않습니다.	train
common_voice_en_19392871.mp3	And this is heritage site also.	dd75d45cc977616903fccd456f90df331207743606c58e96690f0bf858764d5c73050819c4a3c51d85bcce14ca32f4cecbb0c4949101c3d444bbe1d7133e251a	그리고 이곳도 유적지입니다.	train
common_voice_en_19392873.mp3	"Steele tells Ann, ""she must never know"" she is going to die soon."	dd75d45cc977616903fccd456f90df331207743606c58e96690f0bf858764d5c73050819c4a3c51d85bcce14ca32f4cecbb0c4949101c3d444bbe1d7133e251a	스틸은 앤에게 자신이 곧 죽을 거라는 사실을 "절대 알면 안 된다"고 말합니다.	train
common_voice_en_19392874.mp3	Frog rides to ask Miss Mouse to marry him.	dd75d45cc977616903fccd456f90df331207743606c58e96690f0bf858764d5c73050819c4a3c51d85bcce14ca32f4cecbb0c4949101c3d444bbe1d7133e251a	개구리가 미스 마우스에게 청혼하러 갑니다.	train
common_voice_en_63492.mp3	What is the weather forecast for Danvers	dd83608544c966fd64c8f5f1b571f4381334ab0c79cb7ad977c89fec218a59866378ea08228fd5a5f3cffda4844982b96d0a448c95035cb20ee0acb365276d91	댄버스의 일기 예보	train
common_voice_en_63493.mp3	This cup is made of polystyrene.	dd83608544c966fd64c8f5f1b571f4381334ab0c79cb7ad977c89fec218a59866378ea08228fd5a5f3cffda4844982b96d0a448c95035cb20ee0acb365276d91	이 컵은 폴리스티렌으로 제작되었습니다.	train
