path	sentence	client_id	translation	split
common_voice_en_18940443.mp3	No goats are placed on the board during the initial setup.	276db9e3a5ff46631436bae01ff612f8b4a3a776e1e2b704a8416301e3f9f7ac867e64333a82a2e30593fadbe0dc5ad38f5ebf7229efe89db3f171c8a3d1d939	초기 설정 중에는 보드에 염소를 배치하지 않습니다.	train
common_voice_en_18940444.mp3	The seamen are called packetmen, and the business is called packet trade.	276db9e3a5ff46631436bae01ff612f8b4a3a776e1e2b704a8416301e3f9f7ac867e64333a82a2e30593fadbe0dc5ad38f5ebf7229efe89db3f171c8a3d1d939	선원들은 패킷맨이라고 불리며, 이 사업을 패킷 트레이드라고 부릅니다.	train
common_voice_en_18940445.mp3	The Conference mandates a Secretariat to Coordinate Conference activities.	276db9e3a5ff46631436bae01ff612f8b4a3a776e1e2b704a8416301e3f9f7ac867e64333a82a2e30593fadbe0dc5ad38f5ebf7229efe89db3f171c8a3d1d939	컨퍼런스에서는 컨퍼런스 활동을 조정하는 사무국을 두도록 규정하고 있습니다.	train
common_voice_en_18940446.mp3	The competition itself is composed of a theoretical and practical element.	276db9e3a5ff46631436bae01ff612f8b4a3a776e1e2b704a8416301e3f9f7ac867e64333a82a2e30593fadbe0dc5ad38f5ebf7229efe89db3f171c8a3d1d939	대회 자체는 이론적 요소와 실무적 요소로 구성됩니다.	train
common_voice_en_18940447.mp3	Meals occur primarily at homes, restaurants, and cafeterias, but may occur anywhere.	276db9e3a5ff46631436bae01ff612f8b4a3a776e1e2b704a8416301e3f9f7ac867e64333a82a2e30593fadbe0dc5ad38f5ebf7229efe89db3f171c8a3d1d939	식사는 주로 가정, 식당, 카페테리아에서 이루어지지만 어디서든 발생할 수 있습니다.	train
common_voice_en_18940448.mp3	"R'lyeh is characterized by bizarre architecture likened to non-Euclidean geometry."	276db9e3a5ff46631436bae01ff612f8b4a3a776e1e2b704a8416301e3f9f7ac867e64333a82a2e30593fadbe0dc5ad38f5ebf7229efe89db3f171c8a3d1d939	라일레는 비유클리드 기하학에 비유되는 기괴한 구조가 특징입니다.	train
common_voice_en_18067018.mp3	Act on these orders with great speed.	277178f338159e61ffeac7004469477cfbb83bc426220e392272c67865e85e021df4dd11d5f086617f9e2d4ae05365bd03d91b9e7612e60b9ba9363c7830890d	이러한 주문에 신속하게 대응하세요.	train_covost
common_voice_en_18067024.mp3	Riches are the sumpter mules of fortune.	277178f338159e61ffeac7004469477cfbb83bc426220e392272c67865e85e021df4dd11d5f086617f9e2d4ae05365bd03d91b9e7612e60b9ba9363c7830890d	재물은 행운의 운반수단입니다.	train
common_voice_en_19645983.mp3	Louisburg has a rich history of struggle against racial inequality and injustice.	2788e54cdb73c1e2ee0da3a1009e24586efcc4d2f3c404c2d573103244d36bf16e98571deeaf8560a9b542bc2b83f54d45db8fe64bc8ce5a54d7b47e96dac6b5	루이버그는 인종 불평등과 불공정에 맞서 투쟁한 역사가 깊은 곳입니다.	train
common_voice_en_19645984.mp3	Nuclear energy is historically linked to issues of national security.	2788e54cdb73c1e2ee0da3a1009e24586efcc4d2f3c404c2d573103244d36bf16e98571deeaf8560a9b542bc2b83f54d45db8fe64bc8ce5a54d7b47e96dac6b5	원자력은 역사적으로 국가 안보 문제와 관련이 있습니다.	train
common_voice_en_19645985.mp3	The race is held at the Springdale Race Course, just north of Camden.	2788e54cdb73c1e2ee0da3a1009e24586efcc4d2f3c404c2d573103244d36bf16e98571deeaf8560a9b542bc2b83f54d45db8fe64bc8ce5a54d7b47e96dac6b5	레이스는 캠든 바로 북쪽에 있는 스프링데일 레이스 코스에서 열립니다.	train
common_voice_en_19645986.mp3	"Anfang's father Dieter spent some time as a football coach."	2788e54cdb73c1e2ee0da3a1009e24586efcc4d2f3c404c2d573103244d36bf16e98571deeaf8560a9b542bc2b83f54d45db8fe64bc8ce5a54d7b47e96dac6b5	안팡의 아버지 디터는 축구 코치로 일한 적이 있습니다.	train
common_voice_en_19645987.mp3	"Shriver's godfather is former professional tennis player Donald Dell."	2788e54cdb73c1e2ee0da3a1009e24586efcc4d2f3c404c2d573103244d36bf16e98571deeaf8560a9b542bc2b83f54d45db8fe64bc8ce5a54d7b47e96dac6b5	슈라이버의 대부는 전 프로 테니스 선수인 도널드 델입니다.	train
common_voice_en_19646020.mp3	The educated clergy of the time would not have used runes.	2788e54cdb73c1e2ee0da3a1009e24586efcc4d2f3c404c2d573103244d36bf16e98571deeaf8560a9b542bc2b83f54d45db8fe64bc8ce5a54d7b47e96dac6b5	당시의 교육받은 성직자들은 룬을 사용하지 않았을 것입니다.	train
common_voice_en_19646021.mp3	The station, and all trains serving it, is operated by Abellio Greater Anglia.	2788e54cdb73c1e2ee0da3a1009e24586efcc4d2f3c404c2d573103244d36bf16e98571deeaf8560a9b542bc2b83f54d45db8fe64bc8ce5a54d7b47e96dac6b5	이 역과 이곳을 운행하는 모든 열차는 아벨리오 그레이터 앵글리아에서 운영합니다.	train
common_voice_en_19646022.mp3	She was the first Australian woman to receive damehoods in different orders.	2788e54cdb73c1e2ee0da3a1009e24586efcc4d2f3c404c2d573103244d36bf16e98571deeaf8560a9b542bc2b83f54d45db8fe64bc8ce5a54d7b47e96dac6b5	그녀는 호주 여성으로서는 최초로 여러 차례에 걸쳐 여사직을 받은 여성입니다.	train
common_voice_en_19646023.mp3	Matt and Suzy are now married and have two children.	2788e54cdb73c1e2ee0da3a1009e24586efcc4d2f3c404c2d573103244d36bf16e98571deeaf8560a9b542bc2b83f54d45db8fe64bc8ce5a54d7b47e96dac6b5	매트와 수지는 현재 결혼하여 두 자녀를 두고 있습니다.	train
common_voice_en_19646024.mp3	Wang Xiangzhai, founder of dachengquan was his last closed door disciple.	2788e54cdb73c1e2ee0da3a1009e24586efcc4d2f3c404c2d573103244d36bf16e98571deeaf8560a9b542bc2b83f54d45db8fe64bc8ce5a54d7b47e96dac6b5	다청콴의 창립자인 왕샹자이는 그의 마지막 비공개 제자였습니다.	train
common_voice_en_19368002.mp3	Etherow Country Park has many local groups associated with it.	29a3b3d73ebe9b4594ac3d08bdf4c81580a922c6cae58bb42ddec832a68599e4ae1ab297b1124bf5486d2b59fb94c9c53fceeb3baa3055deacbb455da0398bc3	에더로우 컨트리 파크에는 많은 지역 단체가 관련되어 있습니다.	train
common_voice_en_19368003.mp3	"It is Britain's oldest complete human skeleton."	29a3b3d73ebe9b4594ac3d08bdf4c81580a922c6cae58bb42ddec832a68599e4ae1ab297b1124bf5486d2b59fb94c9c53fceeb3baa3055deacbb455da0398bc3	영국에서 가장 오래된 완전한 인체 골격입니다.	train
common_voice_en_19368004.mp3	"The novel would later receive critical acclaim, and is now considered Welsh's masterpiece."	29a3b3d73ebe9b4594ac3d08bdf4c81580a922c6cae58bb42ddec832a68599e4ae1ab297b1124bf5486d2b59fb94c9c53fceeb3baa3055deacbb455da0398bc3	이 소설은 훗날 비평가들의 찬사를 받으며 웨일스의 걸작으로 꼽힙니다.	train
common_voice_en_19368005.mp3	"Euripides mentions the Libyan Sibyl in the prologue of the ""Lamia""."	29a3b3d73ebe9b4594ac3d08bdf4c81580a922c6cae58bb42ddec832a68599e4ae1ab297b1124bf5486d2b59fb94c9c53fceeb3baa3055deacbb455da0398bc3	에우리피데스는 "라미아"의 프롤로그에서 리비아 시빌을 언급합니다.	train
common_voice_en_19368006.mp3	Harrelson said during promotion: When this movie came along, I loved it right away.	29a3b3d73ebe9b4594ac3d08bdf4c81580a922c6cae58bb42ddec832a68599e4ae1ab297b1124bf5486d2b59fb94c9c53fceeb3baa3055deacbb455da0398bc3	해럴슨은 홍보 중에 이렇게 말했습니다: 이 영화가 나왔을 때 바로 마음에 들었습니다.	train
common_voice_en_19368012.mp3	In both finals, he defeated Pete Sampras.	29a3b3d73ebe9b4594ac3d08bdf4c81580a922c6cae58bb42ddec832a68599e4ae1ab297b1124bf5486d2b59fb94c9c53fceeb3baa3055deacbb455da0398bc3	두 번의 결승전에서 모두 피트 샘프라스를 꺾었습니다.	train
common_voice_en_19368013.mp3	There are currently no plans to add more episodes.	29a3b3d73ebe9b4594ac3d08bdf4c81580a922c6cae58bb42ddec832a68599e4ae1ab297b1124bf5486d2b59fb94c9c53fceeb3baa3055deacbb455da0398bc3	현재 추가 에피소드를 추가할 계획은 없습니다.	train
common_voice_en_19368014.mp3	“Eight guineas!” said he.	29a3b3d73ebe9b4594ac3d08bdf4c81580a922c6cae58bb42ddec832a68599e4ae1ab297b1124bf5486d2b59fb94c9c53fceeb3baa3055deacbb455da0398bc3	"여덟 기니!" 그가 말했습니다.	train
common_voice_en_19368015.mp3	Kariny Joala has also been a member of the Estonian Bad Angels dance group.	29a3b3d73ebe9b4594ac3d08bdf4c81580a922c6cae58bb42ddec832a68599e4ae1ab297b1124bf5486d2b59fb94c9c53fceeb3baa3055deacbb455da0398bc3	카리니 조알라는 에스토니아의 댄스 그룹 배드 엔젤스의 멤버이기도 합니다.	train
common_voice_en_19368016.mp3	It was their only major chart success.	29a3b3d73ebe9b4594ac3d08bdf4c81580a922c6cae58bb42ddec832a68599e4ae1ab297b1124bf5486d2b59fb94c9c53fceeb3baa3055deacbb455da0398bc3	이 곡이 유일한 주요 차트 성공작이었습니다.	train
common_voice_en_19628422.mp3	These studies remain morally troubling, however, for several reasons.	2bd6748588399fb619a7913f84990e44b2ddb79dd728dc9a102d3bccfe88833f3ae01f1a9b4114f93f292690ef47372772bd890649ba35a05c6207b522d60783	그러나 이러한 연구는 몇 가지 이유로 여전히 도덕적으로 문제가 되고 있습니다.	train
common_voice_en_19628423.mp3	Senator Clifford P. Hansen.	2bd6748588399fb619a7913f84990e44b2ddb79dd728dc9a102d3bccfe88833f3ae01f1a9b4114f93f292690ef47372772bd890649ba35a05c6207b522d60783	클리포드 P. 한센 상원의원.	train
common_voice_en_19628424.mp3	The edge of the obverse is decorated with small denticles.	2bd6748588399fb619a7913f84990e44b2ddb79dd728dc9a102d3bccfe88833f3ae01f1a9b4114f93f292690ef47372772bd890649ba35a05c6207b522d60783	앞면의 가장자리는 작은 치아로 장식되어 있습니다.	train
common_voice_en_19628425.mp3	The Clives had collected them during their service with the British East India Company.	2bd6748588399fb619a7913f84990e44b2ddb79dd728dc9a102d3bccfe88833f3ae01f1a9b4114f93f292690ef47372772bd890649ba35a05c6207b522d60783	클라이브 부부는 영국 동인도 회사에서 근무하는 동안 수집한 것입니다.	train
common_voice_en_19628453.mp3	Del-Mar-Va Council is divided into districts.	2bd6748588399fb619a7913f84990e44b2ddb79dd728dc9a102d3bccfe88833f3ae01f1a9b4114f93f292690ef47372772bd890649ba35a05c6207b522d60783	델-마르-바 협의회는 지구로 나뉩니다.	train
common_voice_en_19628455.mp3	He was traded back to the Braves for Hal Breeden after the season.	2bd6748588399fb619a7913f84990e44b2ddb79dd728dc9a102d3bccfe88833f3ae01f1a9b4114f93f292690ef47372772bd890649ba35a05c6207b522d60783	시즌이 끝난 후 할 브리든과 브레이브스로 트레이드되었습니다.	train
common_voice_en_19628456.mp3	The detachment remained at Rota through February, training with Spanish Forces.	2bd6748588399fb619a7913f84990e44b2ddb79dd728dc9a102d3bccfe88833f3ae01f1a9b4114f93f292690ef47372772bd890649ba35a05c6207b522d60783	이 부대는 2월까지 로타에 머물며 스페인군과 함께 훈련했습니다.	train
common_voice_en_19628457.mp3	"Cosima Wagner described it as a ""wonder of decorative beauty, a sublime lumber-room""."	2bd6748588399fb619a7913f84990e44b2ddb79dd728dc9a102d3bccfe88833f3ae01f1a9b4114f93f292690ef47372772bd890649ba35a05c6207b522d60783	코시마 바그너는 이를 "장식적인 아름다움의 경이로움, 숭고한 목재 방"이라고 표현했습니다.	train
common_voice_en_19628458.mp3	Only one was built and it is not known whether it was ever flown.	2bd6748588399fb619a7913f84990e44b2ddb79dd728dc9a102d3bccfe88833f3ae01f1a9b4114f93f292690ef47372772bd890649ba35a05c6207b522d60783	단 한 대만 제작되었으며 비행 여부는 알려지지 않았습니다.	train
common_voice_en_18826788.mp3	Later models introduced innovations such as spell-checking programs, and improved formatting options.	2c70af50a88824f57cce6b4ea11832599859348171f356865d27fabfd3b13b4a921d2f176223ab59a51ec5b0d8c9edd5695ca35d9f31e8aad2c55ac84c44d31a	이후 모델에는 맞춤법 검사 프로그램, 향상된 서식 지정 옵션과 같은 혁신적인 기능이 도입되었습니다.	train
