path	sentence	client_id	translation	split
common_voice_en_19182842.mp3	The mosque is accessible within walking distance north west of Kuala Lumpur railway station.	b74ab1c0d457168bab7f97306989829f30cd8f4774df2e775d2690cb4ad09e481aeb436e3bd807efff38d45e1d9c26de15f3567a0a41aeba824675b5a18519e6	모스크는 쿠알라룸푸르 기차역에서 북서쪽으로 걸어서 갈 수 있는 거리에 있습니다.	train
common_voice_en_19182843.mp3	Despite this, because of her age, no one takes her seriously.	b74ab1c0d457168bab7f97306989829f30cd8f4774df2e775d2690cb4ad09e481aeb436e3bd807efff38d45e1d9c26de15f3567a0a41aeba824675b5a18519e6	그럼에도 불구하고 나이 때문에 아무도 그녀를 진지하게 받아들이지 않습니다.	train
common_voice_en_19182844.mp3	The below is an incomplete list.	b74ab1c0d457168bab7f97306989829f30cd8f4774df2e775d2690cb4ad09e481aeb436e3bd807efff38d45e1d9c26de15f3567a0a41aeba824675b5a18519e6	아래는 불완전한 목록입니다.	train
common_voice_en_19183313.mp3	His coin and art collection was auctioned off after his death.	b74ab1c0d457168bab7f97306989829f30cd8f4774df2e775d2690cb4ad09e481aeb436e3bd807efff38d45e1d9c26de15f3567a0a41aeba824675b5a18519e6	그의 동전과 예술품 컬렉션은 그가 사망한 후 경매에 부쳐졌습니다.	train
common_voice_en_19183314.mp3	He studied photography at Parsons The New School for Design in New York City.	b74ab1c0d457168bab7f97306989829f30cd8f4774df2e775d2690cb4ad09e481aeb436e3bd807efff38d45e1d9c26de15f3567a0a41aeba824675b5a18519e6	뉴욕의 파슨스 뉴 스쿨 오브 디자인에서 사진을 전공했습니다.	train
common_voice_en_19183315.mp3	The mascot is the Raider, generally represented by a raccoon.	b74ab1c0d457168bab7f97306989829f30cd8f4774df2e775d2690cb4ad09e481aeb436e3bd807efff38d45e1d9c26de15f3567a0a41aeba824675b5a18519e6	마스코트는 일반적으로 너구리로 대표되는 레이더입니다.	train
common_voice_en_19183316.mp3	Retired players not included.	b74ab1c0d457168bab7f97306989829f30cd8f4774df2e775d2690cb4ad09e481aeb436e3bd807efff38d45e1d9c26de15f3567a0a41aeba824675b5a18519e6	은퇴한 선수는 포함되지 않습니다.	train
common_voice_en_19183317.mp3	"This loyalty gave the legion the cognomen ""Augusta""."	b74ab1c0d457168bab7f97306989829f30cd8f4774df2e775d2690cb4ad09e481aeb436e3bd807efff38d45e1d9c26de15f3567a0a41aeba824675b5a18519e6	이러한 충성심으로 군단은 '오거스타'라는 별명을 얻게 되었습니다.	train
common_voice_en_19184587.mp3	It remained on the list for the next three months.	b74ab1c0d457168bab7f97306989829f30cd8f4774df2e775d2690cb4ad09e481aeb436e3bd807efff38d45e1d9c26de15f3567a0a41aeba824675b5a18519e6	이후 3개월 동안 목록에 남아있었습니다.	train
common_voice_en_19184588.mp3	"Recipes may omit the egg and produce a ""Caesar vinaigrette""."	b74ab1c0d457168bab7f97306989829f30cd8f4774df2e775d2690cb4ad09e481aeb436e3bd807efff38d45e1d9c26de15f3567a0a41aeba824675b5a18519e6	레시피에 따라 달걀을 생략하고 '시저 비네그레트'를 만들 수도 있습니다.	train
common_voice_en_19184589.mp3	All songs by Sondre Lerche unless otherwise noted.	b74ab1c0d457168bab7f97306989829f30cd8f4774df2e775d2690cb4ad09e481aeb436e3bd807efff38d45e1d9c26de15f3567a0a41aeba824675b5a18519e6	별도의 언급이 없는 한 모든 노래는 손드레 레르슈의 곡입니다.	train
common_voice_en_19184590.mp3	They are also found in agricultural areas, such as in barns and crop fields.	b74ab1c0d457168bab7f97306989829f30cd8f4774df2e775d2690cb4ad09e481aeb436e3bd807efff38d45e1d9c26de15f3567a0a41aeba824675b5a18519e6	축사나 농작물 재배지와 같은 농업 지역에서도 발견됩니다.	train
common_voice_en_19184591.mp3	"""Intermediate Perl"" is a follow-up to ""Learning Perl""."	b74ab1c0d457168bab7f97306989829f30cd8f4774df2e775d2690cb4ad09e481aeb436e3bd807efff38d45e1d9c26de15f3567a0a41aeba824675b5a18519e6	'중급 Perl'은 'Perl 배우기'의 후속편입니다.	train
common_voice_en_19184592.mp3	"Turnbull describes both rivers as, ""large creeks"" with settlements around the both."	b74ab1c0d457168bab7f97306989829f30cd8f4774df2e775d2690cb4ad09e481aeb436e3bd807efff38d45e1d9c26de15f3567a0a41aeba824675b5a18519e6	턴불은 두 강을 모두 주변에 정착촌이 있는 "큰 개울"이라고 설명합니다.	train
common_voice_en_19184593.mp3	This is the third feat.	b74ab1c0d457168bab7f97306989829f30cd8f4774df2e775d2690cb4ad09e481aeb436e3bd807efff38d45e1d9c26de15f3567a0a41aeba824675b5a18519e6	이번이 세 번째 성과입니다.	train
common_voice_en_19184595.mp3	Much of the road is privately owned and financed by tolls.	b74ab1c0d457168bab7f97306989829f30cd8f4774df2e775d2690cb4ad09e481aeb436e3bd807efff38d45e1d9c26de15f3567a0a41aeba824675b5a18519e6	도로의 대부분은 개인 소유이며 통행료로 재정을 충당합니다.	train
common_voice_en_19184596.mp3	This station has a season ticket sales office.	b74ab1c0d457168bab7f97306989829f30cd8f4774df2e775d2690cb4ad09e481aeb436e3bd807efff38d45e1d9c26de15f3567a0a41aeba824675b5a18519e6	이 역에는 시즌 티켓 판매소가 있습니다.	train
common_voice_en_19184598.mp3	"The first steelpan band was Roy Martin's Wilberforce Steel Pan."	b74ab1c0d457168bab7f97306989829f30cd8f4774df2e775d2690cb4ad09e481aeb436e3bd807efff38d45e1d9c26de15f3567a0a41aeba824675b5a18519e6	최초의 스틸팬 밴드는 로이 마틴의 윌버포스 스틸팬이었습니다.	train
common_voice_en_20049071.mp3	"Previous shows featured a standard credit with Scheimer's name above Prescott's."	62937aac345cc709eea15b1476dcac6298818335a312fea0792db3ab10e23414f78884919d112fcdf8b81c171a08b2a373d48a9eab2a140fde36895f15982ece	이전 쇼에서는 프레스콧의 이름 위에 스케이머의 이름이 있는 표준 크레딧을 사용했습니다.	train
common_voice_en_20049074.mp3	Palmer switched political parties throughout his life, starting out a Democrat.	62937aac345cc709eea15b1476dcac6298818335a312fea0792db3ab10e23414f78884919d112fcdf8b81c171a08b2a373d48a9eab2a140fde36895f15982ece	팔머는 민주당원으로 시작해 평생 동안 여러 차례 정당을 옮겼습니다.	train
common_voice_en_20049116.mp3	Luther Preparatory School is the oldest Lutheran high school in the United States.	62937aac345cc709eea15b1476dcac6298818335a312fea0792db3ab10e23414f78884919d112fcdf8b81c171a08b2a373d48a9eab2a140fde36895f15982ece	루터 예비학교는 미국에서 가장 오래된 루터교 고등학교입니다.	train
common_voice_en_20049117.mp3	In comparison with its acid derivative, iodoacetate, iodoacetamide reacts substantially more quickly.	62937aac345cc709eea15b1476dcac6298818335a312fea0792db3ab10e23414f78884919d112fcdf8b81c171a08b2a373d48a9eab2a140fde36895f15982ece	산 유도체인 요오도아세테이트에 비해 요오도아세타마이드는 훨씬 더 빠르게 반응합니다.	train
common_voice_en_20049119.mp3	From a former marriage she is mother of a son.	62937aac345cc709eea15b1476dcac6298818335a312fea0792db3ab10e23414f78884919d112fcdf8b81c171a08b2a373d48a9eab2a140fde36895f15982ece	전 결혼 생활에서 아들을 둔 엄마이기도 합니다.	train
common_voice_en_20049120.mp3	"Among Lupin's group, Jigen is the least apprehensive at taking human life."	62937aac345cc709eea15b1476dcac6298818335a312fea0792db3ab10e23414f78884919d112fcdf8b81c171a08b2a373d48a9eab2a140fde36895f15982ece	루팡의 그룹 중 지겐은 인간의 생명을 빼앗는 것에 가장 덜 불안해합니다.	train
common_voice_en_20049141.mp3	"The month was named after the Latin word ""fructus"", which means ""fruit""."	62937aac345cc709eea15b1476dcac6298818335a312fea0792db3ab10e23414f78884919d112fcdf8b81c171a08b2a373d48a9eab2a140fde36895f15982ece	이 달은 '과일'을 뜻하는 라틴어 '프룩투스'의 이름을 따서 명명되었습니다.	train
common_voice_en_20049142.mp3	"""Deification"", that ignores any interpretation of mythology as irrelevant."	62937aac345cc709eea15b1476dcac6298818335a312fea0792db3ab10e23414f78884919d112fcdf8b81c171a08b2a373d48a9eab2a140fde36895f15982ece	신격화'는 신화에 대한 모든 해석을 무의미한 것으로 무시합니다.	train
common_voice_en_20049143.mp3	Lig side Tuzlaspor.	62937aac345cc709eea15b1476dcac6298818335a312fea0792db3ab10e23414f78884919d112fcdf8b81c171a08b2a373d48a9eab2a140fde36895f15982ece	LIG 측 투즐라스포.	train
common_voice_en_20049144.mp3	Additional differences include teal eyes, black pants, and a blue jewel.	62937aac345cc709eea15b1476dcac6298818335a312fea0792db3ab10e23414f78884919d112fcdf8b81c171a08b2a373d48a9eab2a140fde36895f15982ece	다른 차이점으로는 청록색 눈, 검은색 바지, 파란색 보석이 있습니다.	train
common_voice_en_20049145.mp3	Mapleton is part of the Peoria, Illinois Metropolitan Statistical Area.	62937aac345cc709eea15b1476dcac6298818335a312fea0792db3ab10e23414f78884919d112fcdf8b81c171a08b2a373d48a9eab2a140fde36895f15982ece	메이플턴은 일리노이주 피오리아 대도시 통계 지역에 속해 있습니다.	train
common_voice_en_20049166.mp3	Industrially, Horsforth has a history of producing high quality stone from its quarries.	62937aac345cc709eea15b1476dcac6298818335a312fea0792db3ab10e23414f78884919d112fcdf8b81c171a08b2a373d48a9eab2a140fde36895f15982ece	산업적으로 호스포스는 채석장에서 고품질의 석재를 생산해 온 역사를 가지고 있습니다.	train
common_voice_en_20049167.mp3	Violence destroys the work of justice.	62937aac345cc709eea15b1476dcac6298818335a312fea0792db3ab10e23414f78884919d112fcdf8b81c171a08b2a373d48a9eab2a140fde36895f15982ece	폭력은 정의의 실현을 파괴합니다.	train
common_voice_en_20049168.mp3	He received an All Star award for his performances that year.	62937aac345cc709eea15b1476dcac6298818335a312fea0792db3ab10e23414f78884919d112fcdf8b81c171a08b2a373d48a9eab2a140fde36895f15982ece	그는 그 해에 올스타상을 수상했습니다.	train
common_voice_en_20049169.mp3	He also acted in several theatrical productions.	62937aac345cc709eea15b1476dcac6298818335a312fea0792db3ab10e23414f78884919d112fcdf8b81c171a08b2a373d48a9eab2a140fde36895f15982ece	또한 여러 연극 작품에 출연하기도 했습니다.	train
common_voice_en_20049170.mp3	"Bimba's Regional style overshadowed traditional capoeiristas, who were still distrusted by society."	62937aac345cc709eea15b1476dcac6298818335a312fea0792db3ab10e23414f78884919d112fcdf8b81c171a08b2a373d48a9eab2a140fde36895f15982ece	빔바의 지역적 스타일은 여전히 사회에서 불신을 받던 전통적인 카포에리스타를 압도했습니다.	train
common_voice_en_20049223.mp3	Biotite, sodium-rich amphiboles and pyroxenes along with iron-rich olivine are common minor minerals.	62937aac345cc709eea15b1476dcac6298818335a312fea0792db3ab10e23414f78884919d112fcdf8b81c171a08b2a373d48a9eab2a140fde36895f15982ece	철분이 풍부한 감람석과 함께 흑운모, 나트륨이 풍부한 암피볼, 파이록센은 일반적인 미량 광물입니다.	train
common_voice_en_20049225.mp3	There are two central types of physics simulations; rigid body and soft-body simulators.	62937aac345cc709eea15b1476dcac6298818335a312fea0792db3ab10e23414f78884919d112fcdf8b81c171a08b2a373d48a9eab2a140fde36895f15982ece	물리 시뮬레이션에는 강체와 연체 시뮬레이터라는 두 가지 핵심 유형이 있습니다.	train
common_voice_en_20049226.mp3	The Katwa-Burdwan and Katwa-Ahmedpur narrow gauge railway lines are being converted to broad gauge.	62937aac345cc709eea15b1476dcac6298818335a312fea0792db3ab10e23414f78884919d112fcdf8b81c171a08b2a373d48a9eab2a140fde36895f15982ece	카트와 부르드완 및 카트와 아메드푸르 협궤 철도 노선이 광궤로 전환되고 있습니다.	train
common_voice_en_20049227.mp3	The Super One-Eleven division was headquartered in Manchester.	62937aac345cc709eea15b1476dcac6298818335a312fea0792db3ab10e23414f78884919d112fcdf8b81c171a08b2a373d48a9eab2a140fde36895f15982ece	슈퍼 원일레븐 사업부는 맨체스터에 본사를 두고 있었습니다.	train
common_voice_en_20049233.mp3	Suddenly we became aware that we had an audience.	62937aac345cc709eea15b1476dcac6298818335a312fea0792db3ab10e23414f78884919d112fcdf8b81c171a08b2a373d48a9eab2a140fde36895f15982ece	갑자기 우리에겐 잠재고객이 있다는 사실을 깨닫게 되었습니다.	train
common_voice_en_20049234.mp3	West Ryde as a locality was gradually evolving.	62937aac345cc709eea15b1476dcac6298818335a312fea0792db3ab10e23414f78884919d112fcdf8b81c171a08b2a373d48a9eab2a140fde36895f15982ece	지역으로서의 웨스트 라이드는 점차 진화하고 있었습니다.	train
common_voice_en_20049235.mp3	This non-commercial program teaches young adults about responsible money management.	62937aac345cc709eea15b1476dcac6298818335a312fea0792db3ab10e23414f78884919d112fcdf8b81c171a08b2a373d48a9eab2a140fde36895f15982ece	이 비영리 프로그램은 청년들에게 책임감 있는 돈 관리에 대해 가르칩니다.	train
common_voice_en_20049236.mp3	He was known not to use a helmet while fielding close in.	62937aac345cc709eea15b1476dcac6298818335a312fea0792db3ab10e23414f78884919d112fcdf8b81c171a08b2a373d48a9eab2a140fde36895f15982ece	그는 근접 수비 시에는 헬멧을 쓰지 않는 것으로 알려져 있습니다.	train
common_voice_en_20049237.mp3	Dean was born in Arcadia, the seat of Bienville Parish in north Louisiana.	62937aac345cc709eea15b1476dcac6298818335a312fea0792db3ab10e23414f78884919d112fcdf8b81c171a08b2a373d48a9eab2a140fde36895f15982ece	딘은 루이지애나 북부의 비엔빌 교구가 있는 아카디아에서 태어났습니다.	train
common_voice_en_20049251.mp3	Permits are required and can be collected at a self-registration station.	62937aac345cc709eea15b1476dcac6298818335a312fea0792db3ab10e23414f78884919d112fcdf8b81c171a08b2a373d48a9eab2a140fde36895f15982ece	허가증이 필요하며 셀프 등록 스테이션에서 허가증을 수령할 수 있습니다.	train
common_voice_en_20049253.mp3	As a secular and anti-clerical, was an opposer of Christian Democracy.	62937aac345cc709eea15b1476dcac6298818335a312fea0792db3ab10e23414f78884919d112fcdf8b81c171a08b2a373d48a9eab2a140fde36895f15982ece	세속적이고 성직에 반대하는 그는 기독교 민주주의에 반대했습니다.	train
common_voice_en_20049254.mp3	The floor is not significantly marked by impacts.	62937aac345cc709eea15b1476dcac6298818335a312fea0792db3ab10e23414f78884919d112fcdf8b81c171a08b2a373d48a9eab2a140fde36895f15982ece	바닥은 충격에 의해 크게 손상되지 않습니다.	train
common_voice_en_20049256.mp3	If candidates are chosen, the First Presidency extends the call to serve.	62937aac345cc709eea15b1476dcac6298818335a312fea0792db3ab10e23414f78884919d112fcdf8b81c171a08b2a373d48a9eab2a140fde36895f15982ece	후보자가 선정되면 제일회장단은 봉사 청빙을 연장합니다.	train
common_voice_en_20049257.mp3	Equivalently, a set is co-r.e.	62937aac345cc709eea15b1476dcac6298818335a312fea0792db3ab10e23414f78884919d112fcdf8b81c171a08b2a373d48a9eab2a140fde36895f15982ece	동등하게, 집합은 공동 집합입니다.	train
common_voice_en_20049258.mp3	The content of an institutional repository depends on the focus of the institution.	62937aac345cc709eea15b1476dcac6298818335a312fea0792db3ab10e23414f78884919d112fcdf8b81c171a08b2a373d48a9eab2a140fde36895f15982ece	교육기관 리포지토리의 콘텐츠는 교육기관의 초점에 따라 달라집니다.	train
common_voice_en_20049261.mp3	"Details of the Center's construction are still being worked out."	62937aac345cc709eea15b1476dcac6298818335a312fea0792db3ab10e23414f78884919d112fcdf8b81c171a08b2a373d48a9eab2a140fde36895f15982ece	센터 건립에 대한 세부 사항은 아직 확정 중입니다.	train
common_voice_en_20049263.mp3	Neo-Tifinagh is the modern fully alphabetic script developed from earlier forms of Tifinagh.	62937aac345cc709eea15b1476dcac6298818335a312fea0792db3ab10e23414f78884919d112fcdf8b81c171a08b2a373d48a9eab2a140fde36895f15982ece	네오 티피나흐는 이전 형태의 티피나흐에서 개발된 현대식 완전 알파벳 문자입니다.	train
common_voice_en_20049265.mp3	It is also spelled Chafets, Chaffetz, Chaifetz, Cheifetz, Chofets.	62937aac345cc709eea15b1476dcac6298818335a312fea0792db3ab10e23414f78884919d112fcdf8b81c171a08b2a373d48a9eab2a140fde36895f15982ece	차페츠, 차페츠, 차이페츠, 차이페츠, 쵸페츠라고도 표기합니다.	train
common_voice_en_20049278.mp3	Many of them were members of the Indian Independence League.	62937aac345cc709eea15b1476dcac6298818335a312fea0792db3ab10e23414f78884919d112fcdf8b81c171a08b2a373d48a9eab2a140fde36895f15982ece	그들 중 다수는 인도 독립 연맹의 회원이었습니다.	train
common_voice_en_20049279.mp3	"The inhabitants are called ""Cassassiens""."	62937aac345cc709eea15b1476dcac6298818335a312fea0792db3ab10e23414f78884919d112fcdf8b81c171a08b2a373d48a9eab2a140fde36895f15982ece	주민들은 "카사시엔"이라고 불립니다.	train
common_voice_en_20049280.mp3	He is responsible for electronic drums, percussion and live keyboards.	62937aac345cc709eea15b1476dcac6298818335a312fea0792db3ab10e23414f78884919d112fcdf8b81c171a08b2a373d48a9eab2a140fde36895f15982ece	그는 전자 드럼, 퍼커션, 라이브 키보드를 담당하고 있습니다.	train
common_voice_en_20049281.mp3	Stubs work by means of standing waves of radio waves along their length.	62937aac345cc709eea15b1476dcac6298818335a312fea0792db3ab10e23414f78884919d112fcdf8b81c171a08b2a373d48a9eab2a140fde36895f15982ece	스텁은 길이를 따라 전파의 정재파를 사용하여 작동합니다.	train
common_voice_en_20049282.mp3	Following this, she retired from films and focused on raising her children.	62937aac345cc709eea15b1476dcac6298818335a312fea0792db3ab10e23414f78884919d112fcdf8b81c171a08b2a373d48a9eab2a140fde36895f15982ece	그 후 영화계에서 은퇴하고 자녀 양육에 집중했습니다.	train
common_voice_en_20049298.mp3	Evans was born in Salt Lake City, Utah.	62937aac345cc709eea15b1476dcac6298818335a312fea0792db3ab10e23414f78884919d112fcdf8b81c171a08b2a373d48a9eab2a140fde36895f15982ece	에반스는 유타주 솔트레이크시티에서 태어났습니다.	train
common_voice_en_20049299.mp3	He graduated from the University of Virginia.	62937aac345cc709eea15b1476dcac6298818335a312fea0792db3ab10e23414f78884919d112fcdf8b81c171a08b2a373d48a9eab2a140fde36895f15982ece	버지니아 대학교를 졸업했습니다.	train
common_voice_en_20049300.mp3	Cacatois simply declares that he will remarry and try again for a son.	62937aac345cc709eea15b1476dcac6298818335a312fea0792db3ab10e23414f78884919d112fcdf8b81c171a08b2a373d48a9eab2a140fde36895f15982ece	카카토아는 재혼해서 아들을 다시 얻겠다고 선언합니다.	train
common_voice_en_20049301.mp3	He reportedly does not own a car and lives in a modest condo.	62937aac345cc709eea15b1476dcac6298818335a312fea0792db3ab10e23414f78884919d112fcdf8b81c171a08b2a373d48a9eab2a140fde36895f15982ece	그는 자동차를 소유하지 않고 평범한 콘도에 살고 있는 것으로 알려졌습니다.	train
common_voice_en_20049302.mp3	Amelia was not officially platted.	62937aac345cc709eea15b1476dcac6298818335a312fea0792db3ab10e23414f78884919d112fcdf8b81c171a08b2a373d48a9eab2a140fde36895f15982ece	아멜리아는 공식적으로 플래티넘을 획득하지 못했습니다.	train
common_voice_en_20049308.mp3	He was a nephew of the poet Percy Bysshe Shelley.	62937aac345cc709eea15b1476dcac6298818335a312fea0792db3ab10e23414f78884919d112fcdf8b81c171a08b2a373d48a9eab2a140fde36895f15982ece	그는 시인 퍼시 비셰 셸리의 조카였습니다.	train
common_voice_en_20049309.mp3	"It also uses a real-time ""Magic Weather"" system similar to ""Shenmue""."	62937aac345cc709eea15b1476dcac6298818335a312fea0792db3ab10e23414f78884919d112fcdf8b81c171a08b2a373d48a9eab2a140fde36895f15982ece	또한 '쉔무에'와 유사한 실시간 '매직 웨더' 시스템을 사용합니다.	train
common_voice_en_20049310.mp3	It superseded edlin, the standard editor in earlier versions.	62937aac345cc709eea15b1476dcac6298818335a312fea0792db3ab10e23414f78884919d112fcdf8b81c171a08b2a373d48a9eab2a140fde36895f15982ece	이전 버전의 표준 편집기인 에드린을 대체했습니다.	train
common_voice_en_20049311.mp3	Both the aircraft sales companies also offer storage as well.	62937aac345cc709eea15b1476dcac6298818335a312fea0792db3ab10e23414f78884919d112fcdf8b81c171a08b2a373d48a9eab2a140fde36895f15982ece	두 항공기 판매 회사 모두 보관 서비스도 제공합니다.	train
common_voice_en_20049312.mp3	As such, these rights were rewritten with greater emphasis in our federal statutory system.	62937aac345cc709eea15b1476dcac6298818335a312fea0792db3ab10e23414f78884919d112fcdf8b81c171a08b2a373d48a9eab2a140fde36895f15982ece	따라서 이러한 권리는 미국 연방 법률 체계에서 더욱 강조되어 재작성되었습니다.	train
common_voice_en_20049333.mp3	"Bush's relationship with the navy was more turbulent."	62937aac345cc709eea15b1476dcac6298818335a312fea0792db3ab10e23414f78884919d112fcdf8b81c171a08b2a373d48a9eab2a140fde36895f15982ece	부시와 해군의 관계는 더 격렬했습니다.	train
common_voice_en_20049334.mp3	The badges are offered at three levels: gold, silver and bronze.	62937aac345cc709eea15b1476dcac6298818335a312fea0792db3ab10e23414f78884919d112fcdf8b81c171a08b2a373d48a9eab2a140fde36895f15982ece	배지는 골드, 실버, 브론즈의 세 가지 레벨로 제공됩니다.	train
common_voice_en_20049335.mp3	"The word ""knipl"" means roughly ""nest egg"" in Yiddish."	62937aac345cc709eea15b1476dcac6298818335a312fea0792db3ab10e23414f78884919d112fcdf8b81c171a08b2a373d48a9eab2a140fde36895f15982ece	""knipl"이라는 단어는 이디시어로 대략 ‘둥지 달걀’이라는 뜻입니다."	train
common_voice_en_20049336.mp3	"Wilhelm Reich, an opponent of Freud's theories, is discussed in part three."	62937aac345cc709eea15b1476dcac6298818335a312fea0792db3ab10e23414f78884919d112fcdf8b81c171a08b2a373d48a9eab2a140fde36895f15982ece	프로이트의 이론에 반대했던 빌헬름 라이히에 대해서는 3부에서 설명합니다.	train
common_voice_en_20049353.mp3	Her father owned several factories in Europe.	62937aac345cc709eea15b1476dcac6298818335a312fea0792db3ab10e23414f78884919d112fcdf8b81c171a08b2a373d48a9eab2a140fde36895f15982ece	그녀의 아버지는 유럽에서 여러 개의 공장을 소유하고 있었습니다.	train
common_voice_en_20049355.mp3	The game was won in one of two ways.	62937aac345cc709eea15b1476dcac6298818335a312fea0792db3ab10e23414f78884919d112fcdf8b81c171a08b2a373d48a9eab2a140fde36895f15982ece	이 게임은 두 가지 방법 중 하나로 승리했습니다.	train
common_voice_en_20049356.mp3	Cochise managed to escape, but his family and warriors remained in custody.	62937aac345cc709eea15b1476dcac6298818335a312fea0792db3ab10e23414f78884919d112fcdf8b81c171a08b2a373d48a9eab2a140fde36895f15982ece	코치세는 가까스로 탈출했지만 그의 가족과 전사들은 여전히 구금되어 있었습니다.	train
common_voice_en_20049357.mp3	As a result, Joyce resigned from his post as principal.	62937aac345cc709eea15b1476dcac6298818335a312fea0792db3ab10e23414f78884919d112fcdf8b81c171a08b2a373d48a9eab2a140fde36895f15982ece	그 결과 조이스 교장은 교장직에서 사임했습니다.	train
common_voice_en_20049377.mp3	It is also believed that, praying to Lord Hanuman, gives the best result.	62937aac345cc709eea15b1476dcac6298818335a312fea0792db3ab10e23414f78884919d112fcdf8b81c171a08b2a373d48a9eab2a140fde36895f15982ece	또한 하누만 신에게 기도하면 최상의 결과를 얻을 수 있다고 믿어집니다.	train
common_voice_en_20049379.mp3	The architect was Hiroshi Hara.	62937aac345cc709eea15b1476dcac6298818335a312fea0792db3ab10e23414f78884919d112fcdf8b81c171a08b2a373d48a9eab2a140fde36895f15982ece	건축가는 하라 히로시였습니다.	train
common_voice_en_20049380.mp3	"Sega of America packaged it with American Genesis consoles, replacing ""Altered Beast""."	62937aac345cc709eea15b1476dcac6298818335a312fea0792db3ab10e23414f78884919d112fcdf8b81c171a08b2a373d48a9eab2a140fde36895f15982ece	세가 오브 아메리카는 '얼터드 비스트'를 대체하여 미국 제네시스 콘솔로 패키징했습니다.	train
common_voice_en_20049381.mp3	"That is the only 'news' in all the journalism of these articles."	62937aac345cc709eea15b1476dcac6298818335a312fea0792db3ab10e23414f78884919d112fcdf8b81c171a08b2a373d48a9eab2a140fde36895f15982ece	이 기사의 모든 저널리즘에서 유일한 '뉴스'입니다.	train
common_voice_en_20049382.mp3	Pratt built some useful tools.	62937aac345cc709eea15b1476dcac6298818335a312fea0792db3ab10e23414f78884919d112fcdf8b81c171a08b2a373d48a9eab2a140fde36895f15982ece	프랫은 몇 가지 유용한 도구를 만들었습니다.	train
common_voice_en_20049393.mp3	"With time, many of the label's artists have died."	62937aac345cc709eea15b1476dcac6298818335a312fea0792db3ab10e23414f78884919d112fcdf8b81c171a08b2a373d48a9eab2a140fde36895f15982ece	시간이 지나면서 레이블의 많은 아티스트가 세상을 떠났습니다.	train
common_voice_en_20049394.mp3	The practice of yoga relaxation has been found to reduce tension and anxiety.	62937aac345cc709eea15b1476dcac6298818335a312fea0792db3ab10e23414f78884919d112fcdf8b81c171a08b2a373d48a9eab2a140fde36895f15982ece	요가를 통한 이완은 긴장과 불안을 완화하는 것으로 밝혀졌습니다.	train
common_voice_en_20049395.mp3	Because of swamps, marshes, and rivers, construction would be very expensive.	62937aac345cc709eea15b1476dcac6298818335a312fea0792db3ab10e23414f78884919d112fcdf8b81c171a08b2a373d48a9eab2a140fde36895f15982ece	늪, 습지, 강 때문에 건설 비용이 매우 많이 들었습니다.	train
