path	sentence	client_id	translation	split
common_voice_en_604552.mp3	weather in Hillsview Massachusetts	7d5c20c7154bbc6987847479f9e822fdc9fe50f77a79e3d39df6c7551ca2dda6e7e538a12cf0603a2e5dc0a54ffc89eb646ae89e9b0d380e9e33b2bd5693f4ef	매사추세츠 주 힐스뷰 날씨	train_covost
common_voice_en_604553.mp3	"Because I don't love him."	7d5c20c7154bbc6987847479f9e822fdc9fe50f77a79e3d39df6c7551ca2dda6e7e538a12cf0603a2e5dc0a54ffc89eb646ae89e9b0d380e9e33b2bd5693f4ef	그를 사랑하지 않으니까요.	train_covost
common_voice_en_604568.mp3	Finally, as promised, here is my code for jumping within a line.	7d5c20c7154bbc6987847479f9e822fdc9fe50f77a79e3d39df6c7551ca2dda6e7e538a12cf0603a2e5dc0a54ffc89eb646ae89e9b0d380e9e33b2bd5693f4ef	마지막으로, 약속한 대로 한 줄 내에서 점프하는 코드를 알려드리겠습니다.	train_covost
common_voice_en_604569.mp3	Find movie schedules nearby.	7d5c20c7154bbc6987847479f9e822fdc9fe50f77a79e3d39df6c7551ca2dda6e7e538a12cf0603a2e5dc0a54ffc89eb646ae89e9b0d380e9e33b2bd5693f4ef	가까운 영화 상영 시간표를 찾아보세요.	train_covost
common_voice_en_604574.mp3	Evading the search party was her top priority.	7d5c20c7154bbc6987847479f9e822fdc9fe50f77a79e3d39df6c7551ca2dda6e7e538a12cf0603a2e5dc0a54ffc89eb646ae89e9b0d380e9e33b2bd5693f4ef	수색대를 피하는 것이 그녀의 최우선 과제였습니다.	train_covost
common_voice_en_19644291.mp3	However, that she was poisoned thereby was a gross assumption.	81ee7f656b2acd43bb7dacbb09f5e6e2cd8050ea233b3b9960871c95cc262c8c0314dc583f3399197da263ea561901cca8cc75e252537df10f71d302d3761386	그러나 그녀가 독살당했다는 것은 지나친 가정입니다.	train
common_voice_en_19644292.mp3	His over-the-board and real-life characters were in stark contrast to each other.	81ee7f656b2acd43bb7dacbb09f5e6e2cd8050ea233b3b9960871c95cc262c8c0314dc583f3399197da263ea561901cca8cc75e252537df10f71d302d3761386	그의 과장된 캐릭터와 현실의 캐릭터는 서로 극명한 대조를 이룹니다.	train
common_voice_en_19644293.mp3	It is a member of the Kawartha Pine Ridge District School Board.	81ee7f656b2acd43bb7dacbb09f5e6e2cd8050ea233b3b9960871c95cc262c8c0314dc583f3399197da263ea561901cca8cc75e252537df10f71d302d3761386	카와르타 파인 릿지 교육구 교육위원회의 회원입니다.	train
common_voice_en_19644342.mp3	"Gridlock Sam, is an American transportation engineer, most notable for popularizing the phrase ""gridlock""."	81ee7f656b2acd43bb7dacbb09f5e6e2cd8050ea233b3b9960871c95cc262c8c0314dc583f3399197da263ea561901cca8cc75e252537df10f71d302d3761386	그리드락 샘은 미국의 교통 엔지니어로, '그리드락'이라는 표현을 대중화한 것으로 유명합니다.	train
common_voice_en_19644345.mp3	The donor site regenerates skin and heals over a period of two weeks.	81ee7f656b2acd43bb7dacbb09f5e6e2cd8050ea233b3b9960871c95cc262c8c0314dc583f3399197da263ea561901cca8cc75e252537df10f71d302d3761386	기증 부위는 2주 동안 피부를 재생하고 치유됩니다.	train
common_voice_en_19644347.mp3	Search Marketing products.	81ee7f656b2acd43bb7dacbb09f5e6e2cd8050ea233b3b9960871c95cc262c8c0314dc583f3399197da263ea561901cca8cc75e252537df10f71d302d3761386	검색 마케팅 제품.	train
common_voice_en_19644349.mp3	The stone bears both Latin and Runic letters.	81ee7f656b2acd43bb7dacbb09f5e6e2cd8050ea233b3b9960871c95cc262c8c0314dc583f3399197da263ea561901cca8cc75e252537df10f71d302d3761386	이 돌에는 라틴어와 룬 문자가 모두 새겨져 있습니다.	train
common_voice_en_19644350.mp3	Typical maturities are ten, fifteen or twenty years up to a certain age limit.	81ee7f656b2acd43bb7dacbb09f5e6e2cd8050ea233b3b9960871c95cc262c8c0314dc583f3399197da263ea561901cca8cc75e252537df10f71d302d3761386	일반적인 만기는 특정 연령 제한까지 10년, 15년 또는 20년입니다.	train
common_voice_en_19644386.mp3	It is often lauded for its polished, clear Latin.	81ee7f656b2acd43bb7dacbb09f5e6e2cd8050ea233b3b9960871c95cc262c8c0314dc583f3399197da263ea561901cca8cc75e252537df10f71d302d3761386	세련되고 명료한 라틴어로 찬사를 받기도 합니다.	train
common_voice_en_19644387.mp3	Major tributaries include the Titna, Big Mud, Little Mud, Lost, and Sulatna rivers.	81ee7f656b2acd43bb7dacbb09f5e6e2cd8050ea233b3b9960871c95cc262c8c0314dc583f3399197da263ea561901cca8cc75e252537df10f71d302d3761386	주요 지류로는 티트나, 빅 머드, 리틀 머드, 로스트, 술라트나 강이 있습니다.	train
common_voice_en_19644388.mp3	In the Middle Ages it was a flourishing market town.	81ee7f656b2acd43bb7dacbb09f5e6e2cd8050ea233b3b9960871c95cc262c8c0314dc583f3399197da263ea561901cca8cc75e252537df10f71d302d3761386	중세 시대에는 번성했던 시장 도시였습니다.	train
common_voice_en_19644389.mp3	Despite getting an award from Berklee, he did not study there.	81ee7f656b2acd43bb7dacbb09f5e6e2cd8050ea233b3b9960871c95cc262c8c0314dc583f3399197da263ea561901cca8cc75e252537df10f71d302d3761386	버클리에서 상을 받았음에도 불구하고 그는 그곳에서 공부하지 않았습니다.	train
common_voice_en_19644451.mp3	That same year saw the start of the technical handling collections.	81ee7f656b2acd43bb7dacbb09f5e6e2cd8050ea233b3b9960871c95cc262c8c0314dc583f3399197da263ea561901cca8cc75e252537df10f71d302d3761386	같은 해에 기술 처리 수집이 시작되었습니다.	train
common_voice_en_19644452.mp3	His brother, Paul, was also a notable French diplomat.	81ee7f656b2acd43bb7dacbb09f5e6e2cd8050ea233b3b9960871c95cc262c8c0314dc583f3399197da263ea561901cca8cc75e252537df10f71d302d3761386	그의 형인 폴 역시 저명한 프랑스 외교관이었습니다.	train
common_voice_en_19644453.mp3	The class A certificate holder exercised control over major budgetary and disposition decisions.	81ee7f656b2acd43bb7dacbb09f5e6e2cd8050ea233b3b9960871c95cc262c8c0314dc583f3399197da263ea561901cca8cc75e252537df10f71d302d3761386	A등급 인증서 보유자는 주요 예산 및 처분 결정에 대한 통제권을 행사했습니다.	train
common_voice_en_19644454.mp3	"He currently serves as the director of Berkeley's Central Sierra Field Research Stations."	81ee7f656b2acd43bb7dacbb09f5e6e2cd8050ea233b3b9960871c95cc262c8c0314dc583f3399197da263ea561901cca8cc75e252537df10f71d302d3761386	현재 버클리의 센트럴 시에라 필드 연구소의 책임자로 재직 중입니다.	train
common_voice_en_19644455.mp3	Chris and Joy kept watch and control of the computer from the present.	81ee7f656b2acd43bb7dacbb09f5e6e2cd8050ea233b3b9960871c95cc262c8c0314dc583f3399197da263ea561901cca8cc75e252537df10f71d302d3761386	크리스와 조이는 현재에서 컴퓨터를 계속 감시하고 제어했습니다.	train
common_voice_en_19644498.mp3	"O'Donovan invited to campus various figures whose visits have sparked controversy, including Larry Flynt."	81ee7f656b2acd43bb7dacbb09f5e6e2cd8050ea233b3b9960871c95cc262c8c0314dc583f3399197da263ea561901cca8cc75e252537df10f71d302d3761386	오도노반은 래리 플린트 등 논란을 불러일으킨 다양한 인사들을 캠퍼스로 초대했습니다.	train
common_voice_en_19644499.mp3	He also lectured in Iran and in the Soviet Union.	81ee7f656b2acd43bb7dacbb09f5e6e2cd8050ea233b3b9960871c95cc262c8c0314dc583f3399197da263ea561901cca8cc75e252537df10f71d302d3761386	이란과 소련에서도 강의했습니다.	train
common_voice_en_19644500.mp3	Verdon Roe was the grandfather of professional racing driver Bobby Verdon-Roe.	81ee7f656b2acd43bb7dacbb09f5e6e2cd8050ea233b3b9960871c95cc262c8c0314dc583f3399197da263ea561901cca8cc75e252537df10f71d302d3761386	베르동 로는 프로 레이싱 드라이버인 바비 베르동 로의 할아버지입니다.	train
common_voice_en_19644527.mp3	The Prime Minister took other steps to deter Hitler from aggression.	81ee7f656b2acd43bb7dacbb09f5e6e2cd8050ea233b3b9960871c95cc262c8c0314dc583f3399197da263ea561901cca8cc75e252537df10f71d302d3761386	수상은 히틀러의 침략을 저지하기 위해 다른 조치를 취했습니다.	train
common_voice_en_19644528.mp3	"The win secured Telford's place in the Conference National for the following season."	81ee7f656b2acd43bb7dacbb09f5e6e2cd8050ea233b3b9960871c95cc262c8c0314dc583f3399197da263ea561901cca8cc75e252537df10f71d302d3761386	이 승리로 텔포드는 다음 시즌에도 컨퍼런스 내셔널에 참가할 수 있게 되었습니다.	train
common_voice_en_19644529.mp3	Hughes Hall is suite style, fully carpeted with air conditioning and semi-private baths.	81ee7f656b2acd43bb7dacbb09f5e6e2cd8050ea233b3b9960871c95cc262c8c0314dc583f3399197da263ea561901cca8cc75e252537df10f71d302d3761386	휴즈 홀은 스위트 룸 스타일로 카펫이 깔려 있고 에어컨과 세미 전용 욕실이 있습니다.	train
common_voice_en_19644530.mp3	Perkins has had work displayed in museums both in and outside the United States.	81ee7f656b2acd43bb7dacbb09f5e6e2cd8050ea233b3b9960871c95cc262c8c0314dc583f3399197da263ea561901cca8cc75e252537df10f71d302d3761386	퍼킨스는 미국 안팎의 박물관에 작품을 전시한 바 있습니다.	train
common_voice_en_19644531.mp3	His funeral in Pilsen was a large public event.	81ee7f656b2acd43bb7dacbb09f5e6e2cd8050ea233b3b9960871c95cc262c8c0314dc583f3399197da263ea561901cca8cc75e252537df10f71d302d3761386	필젠에서 열린 그의 장례식은 대규모 공개 행사였습니다.	train
common_voice_en_19644563.mp3	One way of accounting for treasury stock is with the cost method.	81ee7f656b2acd43bb7dacbb09f5e6e2cd8050ea233b3b9960871c95cc262c8c0314dc583f3399197da263ea561901cca8cc75e252537df10f71d302d3761386	자사주를 회계 처리하는 한 가지 방법은 원가법을 사용하는 것입니다.	train_covost
common_voice_en_19644564.mp3	"Songs were originally released on ""Take It"", ""Totally Nude"", and ""Catch a Falling Star""."	81ee7f656b2acd43bb7dacbb09f5e6e2cd8050ea233b3b9960871c95cc262c8c0314dc583f3399197da263ea561901cca8cc75e252537df10f71d302d3761386	노래는 원래 'Take It', 'Totally Nude', 'Catch a Falling Star'에서 공개되었습니다.	train
common_voice_en_19644565.mp3	The album was the first non-classical recording to be released in compact disc format.	81ee7f656b2acd43bb7dacbb09f5e6e2cd8050ea233b3b9960871c95cc262c8c0314dc583f3399197da263ea561901cca8cc75e252537df10f71d302d3761386	이 앨범은 컴팩트 디스크 형식으로 발매된 최초의 비클래식 음반입니다.	train
common_voice_en_19644566.mp3	The causes of Gulf War Syndrome have yet to be been determined.	81ee7f656b2acd43bb7dacbb09f5e6e2cd8050ea233b3b9960871c95cc262c8c0314dc583f3399197da263ea561901cca8cc75e252537df10f71d302d3761386	걸프전 증후군의 원인은 아직 밝혀지지 않았습니다.	train
common_voice_en_19644587.mp3	Also City and Village Council elections are held every four years throughout the country.	81ee7f656b2acd43bb7dacbb09f5e6e2cd8050ea233b3b9960871c95cc262c8c0314dc583f3399197da263ea561901cca8cc75e252537df10f71d302d3761386	또한 전국적으로 4년마다 시의회 및 마을의회 선거가 실시됩니다.	train
common_voice_en_19644588.mp3	The addition added a kitchen and four bedrooms.	81ee7f656b2acd43bb7dacbb09f5e6e2cd8050ea233b3b9960871c95cc262c8c0314dc583f3399197da263ea561901cca8cc75e252537df10f71d302d3761386	주방과 침실 4개가 추가되었습니다.	train
common_voice_en_19644589.mp3	Geological processes include erosion, sedimentation, and volcanic activities such as geysers and earthquakes.	81ee7f656b2acd43bb7dacbb09f5e6e2cd8050ea233b3b9960871c95cc262c8c0314dc583f3399197da263ea561901cca8cc75e252537df10f71d302d3761386	지질학적 과정에는 침식, 퇴적, 간헐천과 지진과 같은 화산 활동이 포함됩니다.	train
common_voice_en_19644590.mp3	I never believed that the paragraph had any foundation, my dear — impossible.	81ee7f656b2acd43bb7dacbb09f5e6e2cd8050ea233b3b9960871c95cc262c8c0314dc583f3399197da263ea561901cca8cc75e252537df10f71d302d3761386	저는 그 단락에 어떤 근거가 있다고 믿지 않았습니다.	train
common_voice_en_19644591.mp3	"This representation was based on a number of Leonardo's preparatory drawings."	81ee7f656b2acd43bb7dacbb09f5e6e2cd8050ea233b3b9960871c95cc262c8c0314dc583f3399197da263ea561901cca8cc75e252537df10f71d302d3761386	이 표현은 레오나르도의 여러 준비 도면을 기반으로 했습니다.	train
common_voice_en_18400529.mp3	She was a mature six-year-old.	8249a3c60ac1ec759932012e25e4846fed41d7896885a7dc45cac5a842496d4403a92a8c2349a723b7a989183a83b6e7d98f8cc57fde29d9be60936efbedc2c6	그녀는 6살의 성숙한 아이였습니다.	train_covost
common_voice_en_18400532.mp3	The gull intends to harass the picnickers.	8249a3c60ac1ec759932012e25e4846fed41d7896885a7dc45cac5a842496d4403a92a8c2349a723b7a989183a83b6e7d98f8cc57fde29d9be60936efbedc2c6	갈매기는 피크닉객을 괴롭히려 합니다.	train_covost
common_voice_en_18400533.mp3	He was wearing that informative look of his.	8249a3c60ac1ec759932012e25e4846fed41d7896885a7dc45cac5a842496d4403a92a8c2349a723b7a989183a83b6e7d98f8cc57fde29d9be60936efbedc2c6	그는 유익한 표정을 짓고 있었습니다.	train
common_voice_en_18400544.mp3	"It's aching for a different reason altogether."	8249a3c60ac1ec759932012e25e4846fed41d7896885a7dc45cac5a842496d4403a92a8c2349a723b7a989183a83b6e7d98f8cc57fde29d9be60936efbedc2c6	다른 이유로도 아픕니다.	train
common_voice_en_18400546.mp3	I was stunned.	8249a3c60ac1ec759932012e25e4846fed41d7896885a7dc45cac5a842496d4403a92a8c2349a723b7a989183a83b6e7d98f8cc57fde29d9be60936efbedc2c6	깜짝 놀랐습니다.	train_covost
common_voice_en_18400547.mp3	Sherry trifle is the tops!	8249a3c60ac1ec759932012e25e4846fed41d7896885a7dc45cac5a842496d4403a92a8c2349a723b7a989183a83b6e7d98f8cc57fde29d9be60936efbedc2c6	셰리 사소한 것이 최고입니다!	train
common_voice_en_18400548.mp3	And they used to dance like elves of delight.	8249a3c60ac1ec759932012e25e4846fed41d7896885a7dc45cac5a842496d4403a92a8c2349a723b7a989183a83b6e7d98f8cc57fde29d9be60936efbedc2c6	그리고 그들은 기쁨의 엘프처럼 춤을 추곤 했습니다.	train
common_voice_en_18433005.mp3	"That's exactly what I've been thinking myself."	8249a3c60ac1ec759932012e25e4846fed41d7896885a7dc45cac5a842496d4403a92a8c2349a723b7a989183a83b6e7d98f8cc57fde29d9be60936efbedc2c6	저도 바로 그런 생각을 하고 있었습니다.	train_covost
common_voice_en_18433007.mp3	I hope my employer is going to pursue this matter.	8249a3c60ac1ec759932012e25e4846fed41d7896885a7dc45cac5a842496d4403a92a8c2349a723b7a989183a83b6e7d98f8cc57fde29d9be60936efbedc2c6	고용주가 이 문제를 해결해 주길 바랍니다.	train_covost
common_voice_en_18433009.mp3	You found him in here, laughing heartily.	8249a3c60ac1ec759932012e25e4846fed41d7896885a7dc45cac5a842496d4403a92a8c2349a723b7a989183a83b6e7d98f8cc57fde29d9be60936efbedc2c6	여기서 그가 활짝 웃고 있는 것을 발견했습니다.	train_covost
common_voice_en_18433010.mp3	"It's a terrific idea, Bertie."	8249a3c60ac1ec759932012e25e4846fed41d7896885a7dc45cac5a842496d4403a92a8c2349a723b7a989183a83b6e7d98f8cc57fde29d9be60936efbedc2c6	정말 좋은 생각이에요, 버티.	train
common_voice_en_18433022.mp3	The town centre can get very crowded on Saturday afternoons	8249a3c60ac1ec759932012e25e4846fed41d7896885a7dc45cac5a842496d4403a92a8c2349a723b7a989183a83b6e7d98f8cc57fde29d9be60936efbedc2c6	토요일 오후에는 시내 중심가가 매우 혼잡할 수 있습니다.	train_covost
common_voice_en_18433023.mp3	I flitted, I fled, I flew.	8249a3c60ac1ec759932012e25e4846fed41d7896885a7dc45cac5a842496d4403a92a8c2349a723b7a989183a83b6e7d98f8cc57fde29d9be60936efbedc2c6	나는 도망치고, 도망치고, 도망쳤습니다.	train_covost
common_voice_en_18433024.mp3	Her presentation was fantastic!	8249a3c60ac1ec759932012e25e4846fed41d7896885a7dc45cac5a842496d4403a92a8c2349a723b7a989183a83b6e7d98f8cc57fde29d9be60936efbedc2c6	그녀의 프레젠테이션은 환상적이었습니다!	train
common_voice_en_18433025.mp3	After he was ripped off, he demanded a refund.	8249a3c60ac1ec759932012e25e4846fed41d7896885a7dc45cac5a842496d4403a92a8c2349a723b7a989183a83b6e7d98f8cc57fde29d9be60936efbedc2c6	바가지를 쓴 후 그는 환불을 요구했습니다.	train
common_voice_en_18469598.mp3	"I'll never forget what they did for me, as long as I live."	8249a3c60ac1ec759932012e25e4846fed41d7896885a7dc45cac5a842496d4403a92a8c2349a723b7a989183a83b6e7d98f8cc57fde29d9be60936efbedc2c6	그들이 저에게 해준 일은 제가 살아있는 한 절대 잊지 못할 것입니다.	train
common_voice_en_18469599.mp3	The dog wagged its tail.	8249a3c60ac1ec759932012e25e4846fed41d7896885a7dc45cac5a842496d4403a92a8c2349a723b7a989183a83b6e7d98f8cc57fde29d9be60936efbedc2c6	개가 꼬리를 흔들었습니다.	train_covost
common_voice_en_18469600.mp3	Best regards, Michael	8249a3c60ac1ec759932012e25e4846fed41d7896885a7dc45cac5a842496d4403a92a8c2349a723b7a989183a83b6e7d98f8cc57fde29d9be60936efbedc2c6	감사합니다, Michael	train_covost
common_voice_en_18469601.mp3	"She wasn't able to anticipate the strike."	8249a3c60ac1ec759932012e25e4846fed41d7896885a7dc45cac5a842496d4403a92a8c2349a723b7a989183a83b6e7d98f8cc57fde29d9be60936efbedc2c6	그녀는 파업을 예상하지 못했습니다.	train
common_voice_en_18469602.mp3	‘Then it doesn’t matter which way you go,’ said the Cat.	8249a3c60ac1ec759932012e25e4846fed41d7896885a7dc45cac5a842496d4403a92a8c2349a723b7a989183a83b6e7d98f8cc57fde29d9be60936efbedc2c6	"그럼 어느 쪽으로 가든지 상관없어요." 고양이가 말했습니다.	train_covost
common_voice_en_18469613.mp3	"If they come much closer, they'll be within spitting distance."	8249a3c60ac1ec759932012e25e4846fed41d7896885a7dc45cac5a842496d4403a92a8c2349a723b7a989183a83b6e7d98f8cc57fde29d9be60936efbedc2c6	훨씬 더 가까이 다가오면 뱉어낼 수 있는 거리 내에 있습니다.	train_covost
common_voice_en_18469615.mp3	Oh thank you! she cried. I am so glad!	8249a3c60ac1ec759932012e25e4846fed41d7896885a7dc45cac5a842496d4403a92a8c2349a723b7a989183a83b6e7d98f8cc57fde29d9be60936efbedc2c6	오, 고마워요! 울었어요. 정말 기뻐요!	train_covost
common_voice_en_18469616.mp3	Tell me whom you keep company with, and I will tell you what you do.	8249a3c60ac1ec759932012e25e4846fed41d7896885a7dc45cac5a842496d4403a92a8c2349a723b7a989183a83b6e7d98f8cc57fde29d9be60936efbedc2c6	누구와 함께 지내는지 알려주시면 어떤 일을 하는지 알려드리겠습니다.	train
common_voice_en_18469623.mp3	Presently she began again.	8249a3c60ac1ec759932012e25e4846fed41d7896885a7dc45cac5a842496d4403a92a8c2349a723b7a989183a83b6e7d98f8cc57fde29d9be60936efbedc2c6	현재 그녀는 다시 시작했습니다.	train_covost
common_voice_en_18469626.mp3	He seemed impressed by my eloquence.	8249a3c60ac1ec759932012e25e4846fed41d7896885a7dc45cac5a842496d4403a92a8c2349a723b7a989183a83b6e7d98f8cc57fde29d9be60936efbedc2c6	그는 제 웅변에 깊은 인상을 받은 것 같았습니다.	train_covost
common_voice_en_18469627.mp3	I stared at him, speechless.	8249a3c60ac1ec759932012e25e4846fed41d7896885a7dc45cac5a842496d4403a92a8c2349a723b7a989183a83b6e7d98f8cc57fde29d9be60936efbedc2c6	저는 할 말을 잃은 채 그를 쳐다보았습니다.	train_covost
common_voice_en_18895804.mp3	However his fortunes soon took a turn for the worse.	85f268e45ebcf8d6ec9a420b2dd6584bd67b3c0e5c709a62d88a4d37c69986f4c012f81c971b0a514ad19eb7cf2f2f9ee10c0124d6fc1f1f4ccfe2e13ab3db44	하지만 그의 운명은 곧 나빠졌습니다.	train
common_voice_en_18895805.mp3	The project was never realised.	85f268e45ebcf8d6ec9a420b2dd6584bd67b3c0e5c709a62d88a4d37c69986f4c012f81c971b0a514ad19eb7cf2f2f9ee10c0124d6fc1f1f4ccfe2e13ab3db44	이 프로젝트는 실현되지 못했습니다.	train_covost
common_voice_en_18895806.mp3	This song was a number one hit in several countries.	85f268e45ebcf8d6ec9a420b2dd6584bd67b3c0e5c709a62d88a4d37c69986f4c012f81c971b0a514ad19eb7cf2f2f9ee10c0124d6fc1f1f4ccfe2e13ab3db44	이 노래는 여러 나라에서 1위를 차지했습니다.	train
common_voice_en_18895807.mp3	Today, the location is a state historic site.	85f268e45ebcf8d6ec9a420b2dd6584bd67b3c0e5c709a62d88a4d37c69986f4c012f81c971b0a514ad19eb7cf2f2f9ee10c0124d6fc1f1f4ccfe2e13ab3db44	현재 이곳은 주립 사적지로 지정되어 있습니다.	train
common_voice_en_18895808.mp3	It is situated to the southwest of the Duke Ellington Bridge.	85f268e45ebcf8d6ec9a420b2dd6584bd67b3c0e5c709a62d88a4d37c69986f4c012f81c971b0a514ad19eb7cf2f2f9ee10c0124d6fc1f1f4ccfe2e13ab3db44	듀크 엘링턴 다리 남서쪽에 위치해 있습니다.	train
common_voice_en_18895814.mp3	It contained several anchor stores and a food court.	85f268e45ebcf8d6ec9a420b2dd6584bd67b3c0e5c709a62d88a4d37c69986f4c012f81c971b0a514ad19eb7cf2f2f9ee10c0124d6fc1f1f4ccfe2e13ab3db44	여기에는 여러 앵커 스토어와 푸드코트가 있었습니다.	train_covost
common_voice_en_18895815.mp3	Its home field was Capilano Stadium.	85f268e45ebcf8d6ec9a420b2dd6584bd67b3c0e5c709a62d88a4d37c69986f4c012f81c971b0a514ad19eb7cf2f2f9ee10c0124d6fc1f1f4ccfe2e13ab3db44	홈 구장은 카필라노 스타디움이었습니다.	train
common_voice_en_18895817.mp3	With funding secured, physical construction could commence.	85f268e45ebcf8d6ec9a420b2dd6584bd67b3c0e5c709a62d88a4d37c69986f4c012f81c971b0a514ad19eb7cf2f2f9ee10c0124d6fc1f1f4ccfe2e13ab3db44	자금이 확보되면 실제 공사를 시작할 수 있습니다.	train
common_voice_en_18895818.mp3	The closer the damping pad, the shorter the reverb time.	85f268e45ebcf8d6ec9a420b2dd6584bd67b3c0e5c709a62d88a4d37c69986f4c012f81c971b0a514ad19eb7cf2f2f9ee10c0124d6fc1f1f4ccfe2e13ab3db44	댐핑 패드가 가까울수록 리버브 시간이 짧아집니다.	train
common_voice_en_18895829.mp3	He was succeeded by Democrat Tom Henry.	85f268e45ebcf8d6ec9a420b2dd6584bd67b3c0e5c709a62d88a4d37c69986f4c012f81c971b0a514ad19eb7cf2f2f9ee10c0124d6fc1f1f4ccfe2e13ab3db44	그의 후임은 민주당의 톰 헨리 의원이 맡았습니다.	train
common_voice_en_18895830.mp3	"He played a soldier in the series ""Army Wives"", appearing in two episodes."	85f268e45ebcf8d6ec9a420b2dd6584bd67b3c0e5c709a62d88a4d37c69986f4c012f81c971b0a514ad19eb7cf2f2f9ee10c0124d6fc1f1f4ccfe2e13ab3db44	그는 '군인 아내' 시리즈에서 군인 역을 맡아 두 편의 에피소드에 출연했습니다.	train
common_voice_en_18895831.mp3	Her younger sister is the novelist Cammie McGovern.	85f268e45ebcf8d6ec9a420b2dd6584bd67b3c0e5c709a62d88a4d37c69986f4c012f81c971b0a514ad19eb7cf2f2f9ee10c0124d6fc1f1f4ccfe2e13ab3db44	그녀의 여동생은 소설가 Cam미 맥거번입니다.	train
common_voice_en_18895832.mp3	All four quarters are played to a time limit.	85f268e45ebcf8d6ec9a420b2dd6584bd67b3c0e5c709a62d88a4d37c69986f4c012f81c971b0a514ad19eb7cf2f2f9ee10c0124d6fc1f1f4ccfe2e13ab3db44	4쿼터는 모두 제한 시간 내에 진행됩니다.	train
common_voice_en_18895833.mp3	It was also the first newspaper in Britain to have a crossword puzzle.	85f268e45ebcf8d6ec9a420b2dd6584bd67b3c0e5c709a62d88a4d37c69986f4c012f81c971b0a514ad19eb7cf2f2f9ee10c0124d6fc1f1f4ccfe2e13ab3db44	또한 영국 최초로 십자말풀이를 실은 신문이기도 합니다.	train
common_voice_en_18895847.mp3	This standard was designed for high-end graphics.	85f268e45ebcf8d6ec9a420b2dd6584bd67b3c0e5c709a62d88a4d37c69986f4c012f81c971b0a514ad19eb7cf2f2f9ee10c0124d6fc1f1f4ccfe2e13ab3db44	이 표준은 하이엔드 그래픽을 위해 설계되었습니다.	train
common_voice_en_18895850.mp3	It was shot in Toronto, Ontario, and San Francisco, California.	85f268e45ebcf8d6ec9a420b2dd6584bd67b3c0e5c709a62d88a4d37c69986f4c012f81c971b0a514ad19eb7cf2f2f9ee10c0124d6fc1f1f4ccfe2e13ab3db44	온타리오주 토론토와 캘리포니아주 샌프란시스코에서 촬영되었습니다.	train
common_voice_en_18895851.mp3	The city was named after Milan, in Italy.	85f268e45ebcf8d6ec9a420b2dd6584bd67b3c0e5c709a62d88a4d37c69986f4c012f81c971b0a514ad19eb7cf2f2f9ee10c0124d6fc1f1f4ccfe2e13ab3db44	이 도시는 이탈리아 밀라노의 이름을 따서 명명되었습니다.	train
common_voice_en_18895852.mp3	Not all dogs that are famous for saving lives are working dogs.	85f268e45ebcf8d6ec9a420b2dd6584bd67b3c0e5c709a62d88a4d37c69986f4c012f81c971b0a514ad19eb7cf2f2f9ee10c0124d6fc1f1f4ccfe2e13ab3db44	생명을 구하는 것으로 유명한 개들이 모두 인명 구조견인 것은 아닙니다.	train
common_voice_en_18895853.mp3	I have read most of his novels in the past.	85f268e45ebcf8d6ec9a420b2dd6584bd67b3c0e5c709a62d88a4d37c69986f4c012f81c971b0a514ad19eb7cf2f2f9ee10c0124d6fc1f1f4ccfe2e13ab3db44	저는 과거에 그의 소설을 대부분 읽었습니다.	train
common_voice_en_18895869.mp3	Employees in Spain are represented by several labor unions.	85f268e45ebcf8d6ec9a420b2dd6584bd67b3c0e5c709a62d88a4d37c69986f4c012f81c971b0a514ad19eb7cf2f2f9ee10c0124d6fc1f1f4ccfe2e13ab3db44	스페인의 직원들은 여러 노동조합에 의해 대표됩니다.	train
common_voice_en_18895871.mp3	The rest of his production is completely forgotten.	85f268e45ebcf8d6ec9a420b2dd6584bd67b3c0e5c709a62d88a4d37c69986f4c012f81c971b0a514ad19eb7cf2f2f9ee10c0124d6fc1f1f4ccfe2e13ab3db44	그의 나머지 작품은 완전히 잊혀졌습니다.	train
common_voice_en_18895873.mp3	It is the second-largest employer in the city.	85f268e45ebcf8d6ec9a420b2dd6584bd67b3c0e5c709a62d88a4d37c69986f4c012f81c971b0a514ad19eb7cf2f2f9ee10c0124d6fc1f1f4ccfe2e13ab3db44	뉴욕시에서 두 번째로 큰 고용주입니다.	train
common_voice_en_18895875.mp3	The event usually consists of bands, food, and a parade.	85f268e45ebcf8d6ec9a420b2dd6584bd67b3c0e5c709a62d88a4d37c69986f4c012f81c971b0a514ad19eb7cf2f2f9ee10c0124d6fc1f1f4ccfe2e13ab3db44	이 행사는 보통 밴드, 음식, 퍼레이드로 구성됩니다.	train
