path	sentence	client_id	translation	split
common_voice_en_18447311.mp3	I never had.	d8f79af55e5db3e7a6b73d73d200e16a0839edd42719869f452d4c0e757f72806806a7cbe3d0b53cc31cdd1e58f4f5d3caff0abbe69dbcedfff23180fb99b58e	그런 적이 없습니다.	train
common_voice_en_18447312.mp3	Besides, had he not whipped the big owl in the forest.	d8f79af55e5db3e7a6b73d73d200e16a0839edd42719869f452d4c0e757f72806806a7cbe3d0b53cc31cdd1e58f4f5d3caff0abbe69dbcedfff23180fb99b58e	게다가 그가 숲에서 큰 올빼미를 채찍질하지 않았다면.	train_covost
common_voice_en_18447328.mp3	The railway tracks were held together with sleepers	d8f79af55e5db3e7a6b73d73d200e16a0839edd42719869f452d4c0e757f72806806a7cbe3d0b53cc31cdd1e58f4f5d3caff0abbe69dbcedfff23180fb99b58e	철로는 침목과 함께 고정되었습니다.	train_covost
common_voice_en_18447329.mp3	You can get reasonable at the basics in a few hours.	d8f79af55e5db3e7a6b73d73d200e16a0839edd42719869f452d4c0e757f72806806a7cbe3d0b53cc31cdd1e58f4f5d3caff0abbe69dbcedfff23180fb99b58e	몇 시간만 투자하면 기본에 충실할 수 있습니다.	train_covost
common_voice_en_18447330.mp3	Perhaps we should join a wine club.	d8f79af55e5db3e7a6b73d73d200e16a0839edd42719869f452d4c0e757f72806806a7cbe3d0b53cc31cdd1e58f4f5d3caff0abbe69dbcedfff23180fb99b58e	와인 클럽에 가입해야 할지도 모르겠네요.	train_covost
common_voice_en_18447331.mp3	His eyes were smouldering with a dull fire.	d8f79af55e5db3e7a6b73d73d200e16a0839edd42719869f452d4c0e757f72806806a7cbe3d0b53cc31cdd1e58f4f5d3caff0abbe69dbcedfff23180fb99b58e	그의 눈은 둔탁한 불길로 타오르고 있었습니다.	train_covost
common_voice_en_18447332.mp3	Talk about the day I met her.	d8f79af55e5db3e7a6b73d73d200e16a0839edd42719869f452d4c0e757f72806806a7cbe3d0b53cc31cdd1e58f4f5d3caff0abbe69dbcedfff23180fb99b58e	제가 그녀를 만난 날에 대해 이야기해 보세요.	train_covost
common_voice_en_18447355.mp3	"We're late! According to the timetable, the lecture started at nine o'clock"	d8f79af55e5db3e7a6b73d73d200e16a0839edd42719869f452d4c0e757f72806806a7cbe3d0b53cc31cdd1e58f4f5d3caff0abbe69dbcedfff23180fb99b58e	늦었어요! 시간표에 따르면 강의는 9시에 시작되었습니다.	train_covost
common_voice_en_18447356.mp3	I seem to remember just wearing a t-shirt and jeans.	d8f79af55e5db3e7a6b73d73d200e16a0839edd42719869f452d4c0e757f72806806a7cbe3d0b53cc31cdd1e58f4f5d3caff0abbe69dbcedfff23180fb99b58e	티셔츠와 청바지만 입었던 기억이 납니다.	train_covost
common_voice_en_18447357.mp3	I feel I should at least get some use out of it.	d8f79af55e5db3e7a6b73d73d200e16a0839edd42719869f452d4c0e757f72806806a7cbe3d0b53cc31cdd1e58f4f5d3caff0abbe69dbcedfff23180fb99b58e	최소한 어느 정도는 사용해야 한다고 생각합니다.	train_covost
common_voice_en_18447373.mp3	As if I would talk on such a subject!	d8f79af55e5db3e7a6b73d73d200e16a0839edd42719869f452d4c0e757f72806806a7cbe3d0b53cc31cdd1e58f4f5d3caff0abbe69dbcedfff23180fb99b58e	마치 내가 그런 주제에 대해 이야기할 것처럼!	train_covost
