path	sentence	client_id	translation	split
common_voice_en_19819411.mp3	It was here that she designed and produced her first silk jersey dresses.	2770fca40f8650f002f3b78f45a534ddbcdbec9536be974757c7ad0b7e743cf5422b3b51b89cd252cf302da9acc017aa2db97b6b77c4d1d8b108dd2ec99a4923	이곳에서 그녀는 처음으로 실크 저지 드레스를 디자인하고 제작했습니다.	train
common_voice_en_19819412.mp3	There were many differences between these two cultures, so the connection was not clear.	2770fca40f8650f002f3b78f45a534ddbcdbec9536be974757c7ad0b7e743cf5422b3b51b89cd252cf302da9acc017aa2db97b6b77c4d1d8b108dd2ec99a4923	이 두 문화 사이에는 많은 차이가 있었기 때문에 연결 고리가 명확하지 않았습니다.	train
common_voice_en_19819413.mp3	Ellsworth County is divided into nineteen townships.	2770fca40f8650f002f3b78f45a534ddbcdbec9536be974757c7ad0b7e743cf5422b3b51b89cd252cf302da9acc017aa2db97b6b77c4d1d8b108dd2ec99a4923	엘스워스 카운티는 19개의 타운십으로 나뉩니다.	train
common_voice_en_19819414.mp3	"The name translates ""the monks' estates""."	2770fca40f8650f002f3b78f45a534ddbcdbec9536be974757c7ad0b7e743cf5422b3b51b89cd252cf302da9acc017aa2db97b6b77c4d1d8b108dd2ec99a4923	이 이름은 "수도사들의 영지"라는 뜻입니다.	train
common_voice_en_19819415.mp3	This was particularly true for early color television sets.	2770fca40f8650f002f3b78f45a534ddbcdbec9536be974757c7ad0b7e743cf5422b3b51b89cd252cf302da9acc017aa2db97b6b77c4d1d8b108dd2ec99a4923	이는 특히 초기 컬러 텔레비전 세트의 경우 더욱 그러했습니다.	train
common_voice_en_19819416.mp3	It is the only locomotive in this sub-class.	2770fca40f8650f002f3b78f45a534ddbcdbec9536be974757c7ad0b7e743cf5422b3b51b89cd252cf302da9acc017aa2db97b6b77c4d1d8b108dd2ec99a4923	이 하위 클래스에서 유일한 기관차입니다.	train
common_voice_en_19819417.mp3	This began to change around the time of the Industrial Revolution.	2770fca40f8650f002f3b78f45a534ddbcdbec9536be974757c7ad0b7e743cf5422b3b51b89cd252cf302da9acc017aa2db97b6b77c4d1d8b108dd2ec99a4923	이는 산업 혁명 무렵부터 변화하기 시작했습니다.	train
common_voice_en_19819418.mp3	‘You had better not!’ said Mr. Sawyer, with a threatening aspect.	2770fca40f8650f002f3b78f45a534ddbcdbec9536be974757c7ad0b7e743cf5422b3b51b89cd252cf302da9acc017aa2db97b6b77c4d1d8b108dd2ec99a4923	"그러지 않는 게 좋을 거예요!" 소여 씨가 위협적인 표정으로 말했습니다.	train
common_voice_en_19819419.mp3	Ford tells them and the two agents believe them.	2770fca40f8650f002f3b78f45a534ddbcdbec9536be974757c7ad0b7e743cf5422b3b51b89cd252cf302da9acc017aa2db97b6b77c4d1d8b108dd2ec99a4923	포드는 그들에게 말하고 두 요원은 이를 믿습니다.	train
common_voice_en_19819420.mp3	Section One - Upper Right.	2770fca40f8650f002f3b78f45a534ddbcdbec9536be974757c7ad0b7e743cf5422b3b51b89cd252cf302da9acc017aa2db97b6b77c4d1d8b108dd2ec99a4923	섹션 1 - 오른쪽 상단.	train
common_voice_en_575331.mp3	Sometimes being clever can land you in trouble.	30e401085133a5864647d6a6455cfa2d1d00931874ab7995ccf4d70d10b761812b809aa11d20d40ef04b3dcbf2c89819294e38f4c2ba51bb3a722e3dc922157f	때때로 똑똑하다고 해서 곤경에 처할 수도 있습니다.	train_covost
common_voice_en_575339.mp3	Must she keep playing that?	30e401085133a5864647d6a6455cfa2d1d00931874ab7995ccf4d70d10b761812b809aa11d20d40ef04b3dcbf2c89819294e38f4c2ba51bb3a722e3dc922157f	계속 저걸 연주해야 하나요?	train_covost
common_voice_en_575340.mp3	"And shouldn't they be garnished?"	30e401085133a5864647d6a6455cfa2d1d00931874ab7995ccf4d70d10b761812b809aa11d20d40ef04b3dcbf2c89819294e38f4c2ba51bb3a722e3dc922157f	고명을 얹어야 하지 않을까요?	train_covost
common_voice_en_575349.mp3	I want to spend Christmas in California with my family.	30e401085133a5864647d6a6455cfa2d1d00931874ab7995ccf4d70d10b761812b809aa11d20d40ef04b3dcbf2c89819294e38f4c2ba51bb3a722e3dc922157f	가족과 함께 캘리포니아에서 크리스마스를 보내고 싶어요.	train_covost
common_voice_en_575359.mp3	You got your sea legs yet?	30e401085133a5864647d6a6455cfa2d1d00931874ab7995ccf4d70d10b761812b809aa11d20d40ef04b3dcbf2c89819294e38f4c2ba51bb3a722e3dc922157f	아직 바다에 적응하지 못하셨나요?	train_covost
common_voice_en_575364.mp3	"I'd like to know where he is heading at."	30e401085133a5864647d6a6455cfa2d1d00931874ab7995ccf4d70d10b761812b809aa11d20d40ef04b3dcbf2c89819294e38f4c2ba51bb3a722e3dc922157f	어디로 향하고 있는지 알고 싶습니다.	train_covost
common_voice_en_575371.mp3	"I haven't any hard feelings."	30e401085133a5864647d6a6455cfa2d1d00931874ab7995ccf4d70d10b761812b809aa11d20d40ef04b3dcbf2c89819294e38f4c2ba51bb3a722e3dc922157f	힘든 감정은 전혀 없습니다.	train_covost
common_voice_en_575373.mp3	There is absolutely no way I can finish on time.	30e401085133a5864647d6a6455cfa2d1d00931874ab7995ccf4d70d10b761812b809aa11d20d40ef04b3dcbf2c89819294e38f4c2ba51bb3a722e3dc922157f	제 시간에 끝낼 수 있는 방법이 전혀 없습니다.	train_covost
common_voice_en_575374.mp3	Book a reservation for a pub serving burritos	30e401085133a5864647d6a6455cfa2d1d00931874ab7995ccf4d70d10b761812b809aa11d20d40ef04b3dcbf2c89819294e38f4c2ba51bb3a722e3dc922157f	부리토를 제공하는 펍 예약하기	train_covost
common_voice_en_575376.mp3	something on Spotify please	30e401085133a5864647d6a6455cfa2d1d00931874ab7995ccf4d70d10b761812b809aa11d20d40ef04b3dcbf2c89819294e38f4c2ba51bb3a722e3dc922157f	스포티파이에 뭔가 올려주세요	train
common_voice_en_575377.mp3	"That's when he'll be safe and not a minute before."	30e401085133a5864647d6a6455cfa2d1d00931874ab7995ccf4d70d10b761812b809aa11d20d40ef04b3dcbf2c89819294e38f4c2ba51bb3a722e3dc922157f	그때가 바로 안전할 때입니다.	train_covost
common_voice_en_18834997.mp3	Therefore, the final decision lay with the Peruvian Congress.	75a2817996e864651d91899f05e6a4a685908c262ebaa849aac6afce6a1c03e83734c172876c62a651b1409b65b724bb15c9de27d47d9a4ce35b5e8bc526aeba	따라서 최종 결정은 페루 의회에 달려 있습니다.	train
common_voice_en_18834998.mp3	He claimed it was self-defense.	75a2817996e864651d91899f05e6a4a685908c262ebaa849aac6afce6a1c03e83734c172876c62a651b1409b65b724bb15c9de27d47d9a4ce35b5e8bc526aeba	그는 정당방위라고 주장했습니다.	train
common_voice_en_18835000.mp3	He lives in Devon.	75a2817996e864651d91899f05e6a4a685908c262ebaa849aac6afce6a1c03e83734c172876c62a651b1409b65b724bb15c9de27d47d9a4ce35b5e8bc526aeba	그는 데본에 살고 있습니다.	train
common_voice_en_18835042.mp3	"Not as good as ""Atomizer"", so don't get your hopes up, cheese."	75a2817996e864651d91899f05e6a4a685908c262ebaa849aac6afce6a1c03e83734c172876c62a651b1409b65b724bb15c9de27d47d9a4ce35b5e8bc526aeba	""분무기"만큼은 아니니 너무 기대하지 마세요, 치즈."	train
common_voice_en_18835043.mp3	These images of a blood-red sea can have a shocking effect on bystanders.	75a2817996e864651d91899f05e6a4a685908c262ebaa849aac6afce6a1c03e83734c172876c62a651b1409b65b724bb15c9de27d47d9a4ce35b5e8bc526aeba	피처럼 붉은 바다의 이미지는 구경꾼에게 충격적인 영향을 미칠 수 있습니다.	train
common_voice_en_18835045.mp3	"Though many riders bring their own bicycles, the participants maintain a ""Zoobomb pile""."	75a2817996e864651d91899f05e6a4a685908c262ebaa849aac6afce6a1c03e83734c172876c62a651b1409b65b724bb15c9de27d47d9a4ce35b5e8bc526aeba	많은 라이더가 자신의 자전거를 가져오지만, 참가자들은 '주폭 더미'를 유지합니다.	train
common_voice_en_18835046.mp3	"It's going that way."	75a2817996e864651d91899f05e6a4a685908c262ebaa849aac6afce6a1c03e83734c172876c62a651b1409b65b724bb15c9de27d47d9a4ce35b5e8bc526aeba	그 방향으로 가고 있습니다.	train
common_voice_en_18835062.mp3	Ten damned souls have died and descended into Hell.	75a2817996e864651d91899f05e6a4a685908c262ebaa849aac6afce6a1c03e83734c172876c62a651b1409b65b724bb15c9de27d47d9a4ce35b5e8bc526aeba	10명의 저주받은 영혼이 죽어 지옥으로 내려갔습니다.	train
common_voice_en_18835063.mp3	Captain Joseph O. Masefield replaced Redmill in September.	75a2817996e864651d91899f05e6a4a685908c262ebaa849aac6afce6a1c03e83734c172876c62a651b1409b65b724bb15c9de27d47d9a4ce35b5e8bc526aeba	9월에 조셉 O. 마세필드 대위가 레드밀을 대신했습니다.	train
common_voice_en_18835064.mp3	This pungent dairy product was made at the now-closed Borden plant.	75a2817996e864651d91899f05e6a4a685908c262ebaa849aac6afce6a1c03e83734c172876c62a651b1409b65b724bb15c9de27d47d9a4ce35b5e8bc526aeba	이 매콤한 유제품은 지금은 문을 닫은 보든 공장에서 만들어졌습니다.	train
common_voice_en_18835065.mp3	As expected, patients with carcinoma usually present larger tumors than patients with adenoma.	75a2817996e864651d91899f05e6a4a685908c262ebaa849aac6afce6a1c03e83734c172876c62a651b1409b65b724bb15c9de27d47d9a4ce35b5e8bc526aeba	예상대로 암종 환자는 일반적으로 선종 환자보다 종양이 더 큽니다.	train
common_voice_en_18835066.mp3	Soon, Alexander got fed up with the jumper and gave it back.	75a2817996e864651d91899f05e6a4a685908c262ebaa849aac6afce6a1c03e83734c172876c62a651b1409b65b724bb15c9de27d47d9a4ce35b5e8bc526aeba	곧 알렉산더는 점퍼가 싫증이 나서 돌려주었습니다.	train
common_voice_en_18835087.mp3	"I Corps' current mission is part of the United States' Asia-Pacific Shift."	75a2817996e864651d91899f05e6a4a685908c262ebaa849aac6afce6a1c03e83734c172876c62a651b1409b65b724bb15c9de27d47d9a4ce35b5e8bc526aeba	I Corps의 현재 임무는 미국의 아시아 태평양 시프트의 일부입니다.	train
common_voice_en_18835088.mp3	There will be no dissenting judgment.	75a2817996e864651d91899f05e6a4a685908c262ebaa849aac6afce6a1c03e83734c172876c62a651b1409b65b724bb15c9de27d47d9a4ce35b5e8bc526aeba	반대하는 판단은 없을 것입니다.	train
common_voice_en_18835089.mp3	He was the nephew of the politician Assad Bucaram, who was mayor of Guayaquil.	75a2817996e864651d91899f05e6a4a685908c262ebaa849aac6afce6a1c03e83734c172876c62a651b1409b65b724bb15c9de27d47d9a4ce35b5e8bc526aeba	그는 과야킬 시장을 지낸 정치인 아사드 부카람의 조카였습니다.	train
common_voice_en_18835090.mp3	However, a number of artificial systems have since been established.	75a2817996e864651d91899f05e6a4a685908c262ebaa849aac6afce6a1c03e83734c172876c62a651b1409b65b724bb15c9de27d47d9a4ce35b5e8bc526aeba	그러나 이후 여러 가지 인위적인 시스템이 구축되었습니다.	train
common_voice_en_18835091.mp3	Pearl Musical Instrument Company is located within Yachiyo.	75a2817996e864651d91899f05e6a4a685908c262ebaa849aac6afce6a1c03e83734c172876c62a651b1409b65b724bb15c9de27d47d9a4ce35b5e8bc526aeba	펄 악기 회사는 야치요 내에 있습니다.	train
common_voice_en_18835117.mp3	Andrew Thompson is the chief executive officer of all three railroads.	75a2817996e864651d91899f05e6a4a685908c262ebaa849aac6afce6a1c03e83734c172876c62a651b1409b65b724bb15c9de27d47d9a4ce35b5e8bc526aeba	앤드류 톰슨은 세 철도 회사 모두의 최고 경영자입니다.	train
common_voice_en_18835119.mp3	The oscillations are multi-periodic with periods from several hours up to several days.	75a2817996e864651d91899f05e6a4a685908c262ebaa849aac6afce6a1c03e83734c172876c62a651b1409b65b724bb15c9de27d47d9a4ce35b5e8bc526aeba	진동은 몇 시간에서 며칠까지 주기가 여러 번 반복됩니다.	train
common_voice_en_18835121.mp3	It ends his career in the Foreign Legion, his only real love.	75a2817996e864651d91899f05e6a4a685908c262ebaa849aac6afce6a1c03e83734c172876c62a651b1409b65b724bb15c9de27d47d9a4ce35b5e8bc526aeba	이로써 그의 유일한 사랑인 외인 군단에서의 경력은 끝이 납니다.	train_covost
common_voice_en_18835132.mp3	Lancelot arrives and rescues the queen.	75a2817996e864651d91899f05e6a4a685908c262ebaa849aac6afce6a1c03e83734c172876c62a651b1409b65b724bb15c9de27d47d9a4ce35b5e8bc526aeba	랜슬롯이 도착하여 여왕을 구출합니다.	train
common_voice_en_18835133.mp3	There are numerous theories as to how creole languages form.	75a2817996e864651d91899f05e6a4a685908c262ebaa849aac6afce6a1c03e83734c172876c62a651b1409b65b724bb15c9de27d47d9a4ce35b5e8bc526aeba	크리올어가 어떻게 형성되는지에 대해서는 여러 가지 이론이 있습니다.	train
common_voice_en_18835134.mp3	Doolin wasted no time.	75a2817996e864651d91899f05e6a4a685908c262ebaa849aac6afce6a1c03e83734c172876c62a651b1409b65b724bb15c9de27d47d9a4ce35b5e8bc526aeba	둘린은 시간을 낭비하지 않았습니다.	train
