path	sentence	client_id	translation	split
common_voice_en_20049877.mp3	Benjamin Bevan was employed as the engineer and construction began at Foxton.	62937aac345cc709eea15b1476dcac6298818335a312fea0792db3ab10e23414f78884919d112fcdf8b81c171a08b2a373d48a9eab2a140fde36895f15982ece	벤자민 베반이 엔지니어로 고용되어 폭스톤에서 공사가 시작되었습니다.	train
common_voice_en_20049878.mp3	Selman teaches courses on artificial intelligence at Cornell University and advises postdoctoral fellows.	62937aac345cc709eea15b1476dcac6298818335a312fea0792db3ab10e23414f78884919d112fcdf8b81c171a08b2a373d48a9eab2a140fde36895f15982ece	셀먼은 코넬대학교에서 인공지능 관련 강의를 하고 있으며 박사후 연구원을 지도하고 있습니다.	train
common_voice_en_20049879.mp3	In these fields, Lotman has been one of the most widely cited authors.	62937aac345cc709eea15b1476dcac6298818335a312fea0792db3ab10e23414f78884919d112fcdf8b81c171a08b2a373d48a9eab2a140fde36895f15982ece	이 분야에서 로트먼은 가장 널리 인용되는 저자 중 한 명입니다.	train
common_voice_en_20049880.mp3	"""Doomsday Machine"" received mixed reviews by critics."	62937aac345cc709eea15b1476dcac6298818335a312fea0792db3ab10e23414f78884919d112fcdf8b81c171a08b2a373d48a9eab2a140fde36895f15982ece	'둠스데이 머신'은 평론가들로부터 엇갈린 평가를 받았습니다.	train
common_voice_en_20049881.mp3	Gabriel has an additional problem in that he procrastinated getting married.	62937aac345cc709eea15b1476dcac6298818335a312fea0792db3ab10e23414f78884919d112fcdf8b81c171a08b2a373d48a9eab2a140fde36895f15982ece	가브리엘은 결혼을 미뤘다는 점에서 또 다른 문제가 있습니다.	train
common_voice_en_20049882.mp3	The economic cycle of Honey Harbour is tied to the cycle of the cottagers.	62937aac345cc709eea15b1476dcac6298818335a312fea0792db3ab10e23414f78884919d112fcdf8b81c171a08b2a373d48a9eab2a140fde36895f15982ece	허니하버의 경제 사이클은 코티지 주민의 경제 사이클과 연결되어 있습니다.	train
common_voice_en_20049883.mp3	He fought off the life-threatening condition and returned to the races in May.	62937aac345cc709eea15b1476dcac6298818335a312fea0792db3ab10e23414f78884919d112fcdf8b81c171a08b2a373d48a9eab2a140fde36895f15982ece	그는 생명을 위협하는 병마와 싸워 이겨내고 5월에 레이스에 복귀했습니다.	train
common_voice_en_20049884.mp3	He returned to the Wuhan football club afterwards.	62937aac345cc709eea15b1476dcac6298818335a312fea0792db3ab10e23414f78884919d112fcdf8b81c171a08b2a373d48a9eab2a140fde36895f15982ece	이후 그는 우한 축구 클럽으로 복귀했습니다.	train
common_voice_en_20049885.mp3	This was his second consecutive year in the Pro Bowl.	62937aac345cc709eea15b1476dcac6298818335a312fea0792db3ab10e23414f78884919d112fcdf8b81c171a08b2a373d48a9eab2a140fde36895f15982ece	2년 연속 프로 보울에 출전했습니다.	train
common_voice_en_20049886.mp3	Picket and Nickum are never mentioned after book six.	62937aac345cc709eea15b1476dcac6298818335a312fea0792db3ab10e23414f78884919d112fcdf8b81c171a08b2a373d48a9eab2a140fde36895f15982ece	피켓과 니쿰은 6권 이후에는 언급되지 않습니다.	train
common_voice_en_20049887.mp3	The other information may be irrelevant and confusing.	62937aac345cc709eea15b1476dcac6298818335a312fea0792db3ab10e23414f78884919d112fcdf8b81c171a08b2a373d48a9eab2a140fde36895f15982ece	다른 정보는 관련성이 없고 혼란스러울 수 있습니다.	train
common_voice_en_20049888.mp3	In the beginning, Associated Rediffusion lost money.	62937aac345cc709eea15b1476dcac6298818335a312fea0792db3ab10e23414f78884919d112fcdf8b81c171a08b2a373d48a9eab2a140fde36895f15982ece	처음에 Associated Rediffusion은 손실을 입었습니다.	train
common_voice_en_20049889.mp3	"It is near ""The Monument of King Rama the First""."	62937aac345cc709eea15b1476dcac6298818335a312fea0792db3ab10e23414f78884919d112fcdf8b81c171a08b2a373d48a9eab2a140fde36895f15982ece	"라마 1세 왕 기념비" 근처에 있습니다.	train
common_voice_en_20049890.mp3	It was also the home of the Philadelphia Sports Writers Association Banquet.	62937aac345cc709eea15b1476dcac6298818335a312fea0792db3ab10e23414f78884919d112fcdf8b81c171a08b2a373d48a9eab2a140fde36895f15982ece	필라델피아 스포츠 작가 협회 연회가 열린 곳이기도 합니다.	train
common_voice_en_20049891.mp3	This formation is interpreted as a semiarid environment with distinct wet and dry seasons.	62937aac345cc709eea15b1476dcac6298818335a312fea0792db3ab10e23414f78884919d112fcdf8b81c171a08b2a373d48a9eab2a140fde36895f15982ece	이 지형은 우기와 건기가 뚜렷한 반건조 환경으로 해석됩니다.	train
common_voice_en_20049892.mp3	The government provided public disaster aid to affected property owners.	62937aac345cc709eea15b1476dcac6298818335a312fea0792db3ab10e23414f78884919d112fcdf8b81c171a08b2a373d48a9eab2a140fde36895f15982ece	정부는 피해를 입은 부동산 소유주에게 공공 재난 지원을 제공했습니다.	train
common_voice_en_20049893.mp3	Admiral Peary carried Collins tools to the North Pole.	62937aac345cc709eea15b1476dcac6298818335a312fea0792db3ab10e23414f78884919d112fcdf8b81c171a08b2a373d48a9eab2a140fde36895f15982ece	피어리 제독은 콜린스 도구를 북극으로 가져갔습니다.	train
common_voice_en_20049894.mp3	Some of the homes were flattened.	62937aac345cc709eea15b1476dcac6298818335a312fea0792db3ab10e23414f78884919d112fcdf8b81c171a08b2a373d48a9eab2a140fde36895f15982ece	일부 집은 평평해졌습니다.	train
common_voice_en_20049900.mp3	This has been criticised as detrimental to links between the Liberia and the diaspora.	62937aac345cc709eea15b1476dcac6298818335a312fea0792db3ab10e23414f78884919d112fcdf8b81c171a08b2a373d48a9eab2a140fde36895f15982ece	이는 라이베리아와 디아스포라 간의 연결에 해롭다는 비판을 받아왔습니다.	train
common_voice_en_20049902.mp3	Commander Chuck Taggart must try to keep his family together.	62937aac345cc709eea15b1476dcac6298818335a312fea0792db3ab10e23414f78884919d112fcdf8b81c171a08b2a373d48a9eab2a140fde36895f15982ece	척 타가트 사령관은 가족을 지키기 위해 노력해야 합니다.	train
common_voice_en_20049903.mp3	Jacob then took both women as wives.	62937aac345cc709eea15b1476dcac6298818335a312fea0792db3ab10e23414f78884919d112fcdf8b81c171a08b2a373d48a9eab2a140fde36895f15982ece	야곱은 두 여인을 아내로 맞이했습니다.	train
common_voice_en_20049904.mp3	Many of their songs have also appeared on Estonian various artists compilation albums.	62937aac345cc709eea15b1476dcac6298818335a312fea0792db3ab10e23414f78884919d112fcdf8b81c171a08b2a373d48a9eab2a140fde36895f15982ece	이들의 노래 중 다수는 에스토니아의 다양한 아티스트 컴필레이션 앨범에도 수록되었습니다.	train
common_voice_en_20049916.mp3	However, the Celtics continued to struggle as Pitino failed to achieve meaningful success.	62937aac345cc709eea15b1476dcac6298818335a312fea0792db3ab10e23414f78884919d112fcdf8b81c171a08b2a373d48a9eab2a140fde36895f15982ece	그러나 피티노 감독이 의미 있는 성공을 거두지 못하면서 셀틱스는 계속해서 어려움을 겪었습니다.	train
common_voice_en_20049917.mp3	"He is currently writing the third volume of the official history of ""The Guardian""."	62937aac345cc709eea15b1476dcac6298818335a312fea0792db3ab10e23414f78884919d112fcdf8b81c171a08b2a373d48a9eab2a140fde36895f15982ece	현재 '가디언'의 공식 역사 3권을 집필 중입니다.	train
common_voice_en_20049918.mp3	All but one of its seats were in Ulster.	62937aac345cc709eea15b1476dcac6298818335a312fea0792db3ab10e23414f78884919d112fcdf8b81c171a08b2a373d48a9eab2a140fde36895f15982ece	한 석을 제외한 모든 의석이 울스터에 있었습니다.	train
common_voice_en_20049919.mp3	Also known as Metro Silicon Valley, the paper serves the greater Silicon Valley area.	62937aac345cc709eea15b1476dcac6298818335a312fea0792db3ab10e23414f78884919d112fcdf8b81c171a08b2a373d48a9eab2a140fde36895f15982ece	메트로 실리콘 밸리라고도 불리는 이 신문은 실리콘 밸리 지역을 대상으로 서비스를 제공합니다.	train
common_voice_en_20049940.mp3	The commander of Pakistani forces Major General Nasir Ahmed Khan was killed in action.	62937aac345cc709eea15b1476dcac6298818335a312fea0792db3ab10e23414f78884919d112fcdf8b81c171a08b2a373d48a9eab2a140fde36895f15982ece	파키스탄군 사령관 나시르 아흐메드 칸 소장이 전투 중 사망했습니다.	train
common_voice_en_20049941.mp3	"He was a head researcher in Manhattan's International Hospital."	62937aac345cc709eea15b1476dcac6298818335a312fea0792db3ab10e23414f78884919d112fcdf8b81c171a08b2a373d48a9eab2a140fde36895f15982ece	그는 맨해튼의 국제 병원에서 수석 연구원으로 근무했습니다.	train
common_voice_en_20049942.mp3	After the successful revolution, Bolognesi was a Lieutenant Colonel on the General Staff.	62937aac345cc709eea15b1476dcac6298818335a312fea0792db3ab10e23414f78884919d112fcdf8b81c171a08b2a373d48a9eab2a140fde36895f15982ece	혁명이 성공한 후 볼로네시는 총참모부 중령으로 근무했습니다.	train
common_voice_en_20049943.mp3	All three of the original Medallions are now lost.	62937aac345cc709eea15b1476dcac6298818335a312fea0792db3ab10e23414f78884919d112fcdf8b81c171a08b2a373d48a9eab2a140fde36895f15982ece	이제 기존 메달 세 개가 모두 사라졌습니다.	train
common_voice_en_20049944.mp3	The current Leader of the Opposition is Mike Nahan of the Liberal Party.	62937aac345cc709eea15b1476dcac6298818335a312fea0792db3ab10e23414f78884919d112fcdf8b81c171a08b2a373d48a9eab2a140fde36895f15982ece	현재 야당 지도자는 자유당의 마이크 나한입니다.	train
common_voice_en_20049957.mp3	Much of his research is related to the causes of schizophrenia.	62937aac345cc709eea15b1476dcac6298818335a312fea0792db3ab10e23414f78884919d112fcdf8b81c171a08b2a373d48a9eab2a140fde36895f15982ece	그의 연구의 대부분은 정신분열증의 원인과 관련이 있습니다.	train
common_voice_en_20049958.mp3	He was stupid like a child.	62937aac345cc709eea15b1476dcac6298818335a312fea0792db3ab10e23414f78884919d112fcdf8b81c171a08b2a373d48a9eab2a140fde36895f15982ece	그는 어린아이처럼 어리석었습니다.	train
common_voice_en_20049959.mp3	Thus it is susceptible to flooding in both the spring and the autumn.	62937aac345cc709eea15b1476dcac6298818335a312fea0792db3ab10e23414f78884919d112fcdf8b81c171a08b2a373d48a9eab2a140fde36895f15982ece	따라서 봄과 가을에 홍수가 발생하기 쉽습니다.	train
common_voice_en_20049960.mp3	See the literature given for order theory and domain theory.	62937aac345cc709eea15b1476dcac6298818335a312fea0792db3ab10e23414f78884919d112fcdf8b81c171a08b2a373d48a9eab2a140fde36895f15982ece	질서 이론과 도메인 이론에 대해서는 주어진 문헌을 참조하세요.	train
common_voice_en_20049966.mp3	A common aim of statistical analysis is to produce information about some chosen population.	62937aac345cc709eea15b1476dcac6298818335a312fea0792db3ab10e23414f78884919d112fcdf8b81c171a08b2a373d48a9eab2a140fde36895f15982ece	통계 분석의 일반적인 목적은 선택한 일부 모집단에 대한 정보를 생성하는 것입니다.	train
common_voice_en_20049967.mp3	This instruction set was enabled in silicon on the original Pentium processors.	62937aac345cc709eea15b1476dcac6298818335a312fea0792db3ab10e23414f78884919d112fcdf8b81c171a08b2a373d48a9eab2a140fde36895f15982ece	이 명령어 세트는 기존 펜티엄 프로세서의 실리콘에서 활성화되었습니다.	train
common_voice_en_20049968.mp3	He made extensive studies of variable stars in globular clusters in the southern skies.	62937aac345cc709eea15b1476dcac6298818335a312fea0792db3ab10e23414f78884919d112fcdf8b81c171a08b2a373d48a9eab2a140fde36895f15982ece	그는 남쪽 하늘의 구상성단에 있는 변성단에 대한 광범위한 연구를 수행했습니다.	train
common_voice_en_20049969.mp3	Thereafter management restructured the balance sheet to wipe out a large number of shareholders.	62937aac345cc709eea15b1476dcac6298818335a312fea0792db3ab10e23414f78884919d112fcdf8b81c171a08b2a373d48a9eab2a140fde36895f15982ece	그 후 경영진은 대차대조표를 재구성하여 많은 수의 주주를 정리했습니다.	train
common_voice_en_20049970.mp3	This was a controversial issue at the time.	62937aac345cc709eea15b1476dcac6298818335a312fea0792db3ab10e23414f78884919d112fcdf8b81c171a08b2a373d48a9eab2a140fde36895f15982ece	이는 당시 논란이 되었던 문제였습니다.	train
common_voice_en_20049996.mp3	Front suspension is upper and lower wishbones with coil springs and shock absorbers.	62937aac345cc709eea15b1476dcac6298818335a312fea0792db3ab10e23414f78884919d112fcdf8b81c171a08b2a373d48a9eab2a140fde36895f15982ece	앞 서스펜션은 코일 스프링과 쇽 업소버가 장착된 상부 및 하부 위시본입니다.	train
common_voice_en_20049997.mp3	Nearby locations include Ouse, Hamilton and Kempton.	62937aac345cc709eea15b1476dcac6298818335a312fea0792db3ab10e23414f78884919d112fcdf8b81c171a08b2a373d48a9eab2a140fde36895f15982ece	인근 위치로는 오스, 해밀턴 및 켐튼이 있습니다.	train
common_voice_en_20049999.mp3	However, there are many newer developments in these areas.	62937aac345cc709eea15b1476dcac6298818335a312fea0792db3ab10e23414f78884919d112fcdf8b81c171a08b2a373d48a9eab2a140fde36895f15982ece	그러나 이러한 영역에는 많은 새로운 개발이 이루어지고 있습니다.	train
common_voice_en_20050000.mp3	Lyubov Speranskaya has become famous scenographic producer and master of scenic and national clothes.	62937aac345cc709eea15b1476dcac6298818335a312fea0792db3ab10e23414f78884919d112fcdf8b81c171a08b2a373d48a9eab2a140fde36895f15982ece	류보프 스페란스카야는 유명한 시노그래픽 제작자이자 경치 및 민족 복장의 대가가 되었습니다.	train
common_voice_en_20050011.mp3	The main improvement was the use of a dual gap head permitting write verify.	62937aac345cc709eea15b1476dcac6298818335a312fea0792db3ab10e23414f78884919d112fcdf8b81c171a08b2a373d48a9eab2a140fde36895f15982ece	주요 개선 사항은 쓰기 확인을 허용하는 이중 갭 헤드의 사용입니다.	train
common_voice_en_20050012.mp3	He is well known in Puerto Rico for his political activism.	62937aac345cc709eea15b1476dcac6298818335a312fea0792db3ab10e23414f78884919d112fcdf8b81c171a08b2a373d48a9eab2a140fde36895f15982ece	그는 푸에르토리코에서 정치 활동으로 잘 알려져 있습니다.	train
common_voice_en_20050013.mp3	He gave concerts in the few cafes available to Poles under German occupation.	62937aac345cc709eea15b1476dcac6298818335a312fea0792db3ab10e23414f78884919d112fcdf8b81c171a08b2a373d48a9eab2a140fde36895f15982ece	그는 독일 점령하의 폴란드인들이 이용할 수 있었던 몇 안 되는 카페에서 콘서트를 열었습니다.	train
common_voice_en_20050014.mp3	"With Fox's involvement, nearly all of the band's songs had electric violin tracks."	62937aac345cc709eea15b1476dcac6298818335a312fea0792db3ab10e23414f78884919d112fcdf8b81c171a08b2a373d48a9eab2a140fde36895f15982ece	Fox의 참여로 밴드의 거의 모든 곡에 일렉트릭 바이올린 트랙이 추가되었습니다.	train
common_voice_en_20050015.mp3	"One of the books was his own first work, ""After the Man""."	62937aac345cc709eea15b1476dcac6298818335a312fea0792db3ab10e23414f78884919d112fcdf8b81c171a08b2a373d48a9eab2a140fde36895f15982ece	그 책 중 하나는 그의 첫 번째 작품인 '애프터 더 맨'이었습니다.	train
common_voice_en_20050044.mp3	He was chiefly responsible for its early sounds.	62937aac345cc709eea15b1476dcac6298818335a312fea0792db3ab10e23414f78884919d112fcdf8b81c171a08b2a373d48a9eab2a140fde36895f15982ece	그는 초기 사운드를 주로 담당했습니다.	train
common_voice_en_20050045.mp3	Winwood had no children by any of her marriages.	62937aac345cc709eea15b1476dcac6298818335a312fea0792db3ab10e23414f78884919d112fcdf8b81c171a08b2a373d48a9eab2a140fde36895f15982ece	윈우드는 결혼 생활 중 자녀가 없었습니다.	train
common_voice_en_20050049.mp3	Autran was born in Marseille.	62937aac345cc709eea15b1476dcac6298818335a312fea0792db3ab10e23414f78884919d112fcdf8b81c171a08b2a373d48a9eab2a140fde36895f15982ece	오트란은 마르세유에서 태어났습니다.	train
common_voice_en_20050050.mp3	"The media did not portray the spill kindly, labelling them the 'Gang of Four'."	62937aac345cc709eea15b1476dcac6298818335a312fea0792db3ab10e23414f78884919d112fcdf8b81c171a08b2a373d48a9eab2a140fde36895f15982ece	언론은 이들을 '4인조 갱단'이라고 부르며 이번 유출 사건을 친절하게 묘사하지 않았습니다.	train
common_voice_en_20050051.mp3	"The organisation is operated from its office in Sydney's Circular Quay."	62937aac345cc709eea15b1476dcac6298818335a312fea0792db3ab10e23414f78884919d112fcdf8b81c171a08b2a373d48a9eab2a140fde36895f15982ece	이 단체는 시드니 서큘러키에 있는 사무실에서 운영되고 있습니다.	train
