path	sentence	client_id	translation	split
common_voice_en_18697360.mp3	In many towns, the concert hall is combined with a convention center.	6f1d5ed8eb8759351a9b27dbb04346d0fa58f2c4efd645cd75f703011a40c7d2cc6f5e1c0f971a6efc1ee9506b9fdce70cbe3303e9270cae8601c008890cab6e	많은 도시에서 콘서트홀은 컨벤션 센터와 결합되어 있습니다.	train
common_voice_en_18697361.mp3	John ran in another dimension of time and space.	6f1d5ed8eb8759351a9b27dbb04346d0fa58f2c4efd645cd75f703011a40c7d2cc6f5e1c0f971a6efc1ee9506b9fdce70cbe3303e9270cae8601c008890cab6e	존은 다른 차원의 시간과 공간에서 달렸습니다.	train
common_voice_en_18697362.mp3	Turkey would finish the tournament in third place.	6f1d5ed8eb8759351a9b27dbb04346d0fa58f2c4efd645cd75f703011a40c7d2cc6f5e1c0f971a6efc1ee9506b9fdce70cbe3303e9270cae8601c008890cab6e	터키는 3위로 대회를 마쳤습니다.	train
common_voice_en_18697363.mp3	The attributes are detailed in the recommendations given in the standard.	6f1d5ed8eb8759351a9b27dbb04346d0fa58f2c4efd645cd75f703011a40c7d2cc6f5e1c0f971a6efc1ee9506b9fdce70cbe3303e9270cae8601c008890cab6e	속성은 표준에 제시된 권장 사항에 자세히 설명되어 있습니다.	train
common_voice_en_568511.mp3	It turns out this is easier than you might expect.	72d7b8076ec6bc5d733e0d38492c9a39173ee006424478db063d5c77b29eb16eee71f5ef0ee00e9dc592c99f5cb89ec6df64d4264d431afc60b5d2106a013623	이 작업은 생각보다 쉬운 것으로 밝혀졌습니다.	train_covost
common_voice_en_568513.mp3	"I'd like for you to put this artist to my Evening Commute playlist."	72d7b8076ec6bc5d733e0d38492c9a39173ee006424478db063d5c77b29eb16eee71f5ef0ee00e9dc592c99f5cb89ec6df64d4264d431afc60b5d2106a013623	이 아티스트를 저녁 출퇴근길 재생 목록에 추가해 주셨으면 합니다.	train_covost
common_voice_en_568515.mp3	The first baseman dropped the ball.	72d7b8076ec6bc5d733e0d38492c9a39173ee006424478db063d5c77b29eb16eee71f5ef0ee00e9dc592c99f5cb89ec6df64d4264d431afc60b5d2106a013623	1루수가 공을 떨어뜨렸습니다.	train_covost
common_voice_en_568516.mp3	"I haven't heard the baby complain yet."	72d7b8076ec6bc5d733e0d38492c9a39173ee006424478db063d5c77b29eb16eee71f5ef0ee00e9dc592c99f5cb89ec6df64d4264d431afc60b5d2106a013623	아직 아기가 불평하는 소리를 듣지 못했습니다.	train_covost
common_voice_en_568517.mp3	First, the land based trade route between east and west lost relevance.	72d7b8076ec6bc5d733e0d38492c9a39173ee006424478db063d5c77b29eb16eee71f5ef0ee00e9dc592c99f5cb89ec6df64d4264d431afc60b5d2106a013623	첫째, 동서양을 잇는 육상 무역 루트가 관련성을 잃었습니다.	train_covost
common_voice_en_568520.mp3	The video conferencing tool had been too unreliable for high-stakes meetings.	72d7b8076ec6bc5d733e0d38492c9a39173ee006424478db063d5c77b29eb16eee71f5ef0ee00e9dc592c99f5cb89ec6df64d4264d431afc60b5d2106a013623	화상 회의 도구는 중요한 회의에 사용하기에는 너무 불안정했습니다.	train_covost
common_voice_en_568522.mp3	You will now retire to arrive at a verdict.	72d7b8076ec6bc5d733e0d38492c9a39173ee006424478db063d5c77b29eb16eee71f5ef0ee00e9dc592c99f5cb89ec6df64d4264d431afc60b5d2106a013623	이제 평결에 도달하기 위해 퇴장합니다.	train_covost
common_voice_en_568524.mp3	Our new AI can dynamically adapt the balance of the gameplay.	72d7b8076ec6bc5d733e0d38492c9a39173ee006424478db063d5c77b29eb16eee71f5ef0ee00e9dc592c99f5cb89ec6df64d4264d431afc60b5d2106a013623	새로운 AI는 게임플레이의 밸런스를 동적으로 조정할 수 있습니다.	train_covost
common_voice_en_568525.mp3	The baby definitely has the sniffles.	72d7b8076ec6bc5d733e0d38492c9a39173ee006424478db063d5c77b29eb16eee71f5ef0ee00e9dc592c99f5cb89ec6df64d4264d431afc60b5d2106a013623	아기가 확실히 콧물을 흘립니다.	train_covost
common_voice_en_568526.mp3	What will the weather be in the Iñao National Park and Integrated Management Natural Area?	72d7b8076ec6bc5d733e0d38492c9a39173ee006424478db063d5c77b29eb16eee71f5ef0ee00e9dc592c99f5cb89ec6df64d4264d431afc60b5d2106a013623	이나오 국립공원 및 통합 관리 자연 지역의 날씨는 어떻습니까?	train
common_voice_en_568527.mp3	"Add the artist Jurij Szewczuk to tisha's soul revived playlist."	72d7b8076ec6bc5d733e0d38492c9a39173ee006424478db063d5c77b29eb16eee71f5ef0ee00e9dc592c99f5cb89ec6df64d4264d431afc60b5d2106a013623	티샤의 영혼이 되살아난 재생 목록에 아티스트 Jurij Szewczuk을 추가하세요.	train_covost
common_voice_en_568528.mp3	Book spot at Fried chicken restaurant in Mauritania	72d7b8076ec6bc5d733e0d38492c9a39173ee006424478db063d5c77b29eb16eee71f5ef0ee00e9dc592c99f5cb89ec6df64d4264d431afc60b5d2106a013623	모리타니의 프라이드 치킨 레스토랑 예약하기	train_covost
common_voice_en_19098048.mp3	Clifford conjugation is the combined action of grade involution and reversion.	7a09d8772d8e52d34ba7595e11d1fdd6caaaa07da4639155e4a4bf63bb4bc4a23909ee2fad38831de20374829867dbccc99328f1f8632126b6f367b7fd89a720	클리포드 활용은 등급 변환과 회귀의 결합된 동작입니다.	train
common_voice_en_19098049.mp3	His father, Jim Harrell Senior still practices and was once mayor of Elkin.	7a09d8772d8e52d34ba7595e11d1fdd6caaaa07da4639155e4a4bf63bb4bc4a23909ee2fad38831de20374829867dbccc99328f1f8632126b6f367b7fd89a720	그의 아버지인 짐 해럴 시니어는 여전히 현직에 있으며 한때 엘킨의 시장을 역임했습니다.	train
common_voice_en_19098050.mp3	She was a cheerleader in junior high school and has two older brothers.	7a09d8772d8e52d34ba7595e11d1fdd6caaaa07da4639155e4a4bf63bb4bc4a23909ee2fad38831de20374829867dbccc99328f1f8632126b6f367b7fd89a720	중학교 때 치어리더로 활동했고 오빠가 둘 있습니다.	train
common_voice_en_19098051.mp3	It was during this time that he began teaching at The New School.	7a09d8772d8e52d34ba7595e11d1fdd6caaaa07da4639155e4a4bf63bb4bc4a23909ee2fad38831de20374829867dbccc99328f1f8632126b6f367b7fd89a720	이 시기에 그는 새로운 학교에서 강의를 시작했습니다.	train
common_voice_en_19098052.mp3	Rhythms and costumes are colorfully native, with voodooism a frequent theme.	7a09d8772d8e52d34ba7595e11d1fdd6caaaa07da4639155e4a4bf63bb4bc4a23909ee2fad38831de20374829867dbccc99328f1f8632126b6f367b7fd89a720	리듬과 의상은 부두교를 자주 테마로 하는 다채로운 원주민 의상을 선보입니다.	train
common_voice_en_19098058.mp3	After mining finishes, the mine area must undergo rehabilitation.	7a09d8772d8e52d34ba7595e11d1fdd6caaaa07da4639155e4a4bf63bb4bc4a23909ee2fad38831de20374829867dbccc99328f1f8632126b6f367b7fd89a720	채굴이 끝나면 광산 지역은 복구 작업을 거쳐야 합니다.	train
common_voice_en_19098059.mp3	Of his small town houses, the most successful is The Wick, in Richmond.	7a09d8772d8e52d34ba7595e11d1fdd6caaaa07da4639155e4a4bf63bb4bc4a23909ee2fad38831de20374829867dbccc99328f1f8632126b6f367b7fd89a720	그의 작은 타운 하우스 중 가장 성공한 곳은 리치몬드에 있는 더 윅입니다.	train
common_voice_en_19098060.mp3	Seriously defeated, Norbanus was forced to retreat to Capua where there was no respite.	7a09d8772d8e52d34ba7595e11d1fdd6caaaa07da4639155e4a4bf63bb4bc4a23909ee2fad38831de20374829867dbccc99328f1f8632126b6f367b7fd89a720	심각한 패배를 당한 노르바누스는 휴식처가 없는 카푸아로 후퇴해야 했습니다.	train
common_voice_en_19098062.mp3	Many other chhatris exist in other parts of Rajasthan.	7a09d8772d8e52d34ba7595e11d1fdd6caaaa07da4639155e4a4bf63bb4bc4a23909ee2fad38831de20374829867dbccc99328f1f8632126b6f367b7fd89a720	라자스탄의 다른 지역에도 많은 다른 차트리스가 존재합니다.	train
common_voice_en_19098064.mp3	"The album was the band's biggest mainstream hit."	7a09d8772d8e52d34ba7595e11d1fdd6caaaa07da4639155e4a4bf63bb4bc4a23909ee2fad38831de20374829867dbccc99328f1f8632126b6f367b7fd89a720	이 앨범은 밴드의 가장 큰 주류 히트작이었습니다.	train
common_voice_en_19098078.mp3	Whereas in the past, the magazine featured lengthy expositions, recent issues have shorter articles.	7a09d8772d8e52d34ba7595e11d1fdd6caaaa07da4639155e4a4bf63bb4bc4a23909ee2fad38831de20374829867dbccc99328f1f8632126b6f367b7fd89a720	과거에는 잡지에 장문의 기사가 실렸지만, 최근 호에는 기사가 짧아졌습니다.	train
common_voice_en_19098079.mp3	Some have been mistaken for those of Stradivari.	7a09d8772d8e52d34ba7595e11d1fdd6caaaa07da4639155e4a4bf63bb4bc4a23909ee2fad38831de20374829867dbccc99328f1f8632126b6f367b7fd89a720	일부는 스트라디바리의 것으로 오인되기도 합니다.	train
common_voice_en_19098080.mp3	His daughter is New York fashion designer Kimberly Ovitz.	7a09d8772d8e52d34ba7595e11d1fdd6caaaa07da4639155e4a4bf63bb4bc4a23909ee2fad38831de20374829867dbccc99328f1f8632126b6f367b7fd89a720	그의 딸은 뉴욕 패션 디자이너 킴벌리 오비츠입니다.	train
common_voice_en_19098081.mp3	It is the only pre-Dreadnought battleship in the game.	7a09d8772d8e52d34ba7595e11d1fdd6caaaa07da4639155e4a4bf63bb4bc4a23909ee2fad38831de20374829867dbccc99328f1f8632126b6f367b7fd89a720	게임 내 유일한 드레드노트 이전 전함입니다.	train
common_voice_en_19098082.mp3	"Barnett later claimed he had received death threats on account of Gowdy's criticism."	7a09d8772d8e52d34ba7595e11d1fdd6caaaa07da4639155e4a4bf63bb4bc4a23909ee2fad38831de20374829867dbccc99328f1f8632126b6f367b7fd89a720	바넷은 나중에 고우디의 비판 때문에 살해 협박을 받았다고 주장했습니다.	train
common_voice_en_19098091.mp3	Faced with few options, Quwatli reappointed Asali as Prime Minister.	7a09d8772d8e52d34ba7595e11d1fdd6caaaa07da4639155e4a4bf63bb4bc4a23909ee2fad38831de20374829867dbccc99328f1f8632126b6f367b7fd89a720	선택의 여지가 거의 없었던 쿠와틀리는 아살리를 총리로 재임명했습니다.	train
common_voice_en_19098092.mp3	Vizrt customers are typically broadcasters and publishing houses.	7a09d8772d8e52d34ba7595e11d1fdd6caaaa07da4639155e4a4bf63bb4bc4a23909ee2fad38831de20374829867dbccc99328f1f8632126b6f367b7fd89a720	Vizrt 고객은 일반적으로 방송사 및 출판사입니다.	train
common_voice_en_19098094.mp3	It is the third least populated municipality of Sweden.	7a09d8772d8e52d34ba7595e11d1fdd6caaaa07da4639155e4a4bf63bb4bc4a23909ee2fad38831de20374829867dbccc99328f1f8632126b6f367b7fd89a720	스웨덴에서 세 번째로 인구가 적은 지방 자치 단체입니다.	train
common_voice_en_19098095.mp3	Nintendo also released the Wii Mini, a cheaper and non-networked redesign of the Wii.	7a09d8772d8e52d34ba7595e11d1fdd6caaaa07da4639155e4a4bf63bb4bc4a23909ee2fad38831de20374829867dbccc99328f1f8632126b6f367b7fd89a720	닌텐도는 더 저렴하고 네트워크에 연결되지 않는 Wii를 재설계한 Wii 미니도 출시했습니다.	train
common_voice_en_19098096.mp3	The armies of both sides included Swiss mercenaries.	7a09d8772d8e52d34ba7595e11d1fdd6caaaa07da4639155e4a4bf63bb4bc4a23909ee2fad38831de20374829867dbccc99328f1f8632126b6f367b7fd89a720	양측 군대에는 스위스 용병이 포함되어 있었습니다.	train
common_voice_en_19098103.mp3	"The village's president and clerk are elected to two-year terms."	7a09d8772d8e52d34ba7595e11d1fdd6caaaa07da4639155e4a4bf63bb4bc4a23909ee2fad38831de20374829867dbccc99328f1f8632126b6f367b7fd89a720	마을의 회장과 서기는 2년 임기로 선출됩니다.	train
common_voice_en_19098104.mp3	This will also bring more people to the municipality to live.	7a09d8772d8e52d34ba7595e11d1fdd6caaaa07da4639155e4a4bf63bb4bc4a23909ee2fad38831de20374829867dbccc99328f1f8632126b6f367b7fd89a720	이는 또한 더 많은 사람들이 살기 위해 지방 자치 단체로 유입될 것입니다.	train
common_voice_en_19098105.mp3	He has two sisters, Keta and Camillie, and a brother, Kenneth.	7a09d8772d8e52d34ba7595e11d1fdd6caaaa07da4639155e4a4bf63bb4bc4a23909ee2fad38831de20374829867dbccc99328f1f8632126b6f367b7fd89a720	케타와 카밀리라는 두 자매와 케네스라는 형제가 있습니다.	train
common_voice_en_19098106.mp3	He was dismissed from the army and lived with his family in Petrograd.	7a09d8772d8e52d34ba7595e11d1fdd6caaaa07da4639155e4a4bf63bb4bc4a23909ee2fad38831de20374829867dbccc99328f1f8632126b6f367b7fd89a720	그는 군대에서 제대하고 페트로그라드에서 가족과 함께 살았습니다.	train
common_voice_en_19098107.mp3	Others try to excite it.	7a09d8772d8e52d34ba7595e11d1fdd6caaaa07da4639155e4a4bf63bb4bc4a23909ee2fad38831de20374829867dbccc99328f1f8632126b6f367b7fd89a720	다른 사람들은 그것을 자극하려고 노력합니다.	train
common_voice_en_19098113.mp3	He is also a member of the Board of Advisors of Albright Stonebridge Group.	7a09d8772d8e52d34ba7595e11d1fdd6caaaa07da4639155e4a4bf63bb4bc4a23909ee2fad38831de20374829867dbccc99328f1f8632126b6f367b7fd89a720	또한 올브라이트 스톤브릿지 그룹의 자문위원회 위원으로 활동하고 있습니다.	train
common_voice_en_19098115.mp3	In addition he founded two more congregations.	7a09d8772d8e52d34ba7595e11d1fdd6caaaa07da4639155e4a4bf63bb4bc4a23909ee2fad38831de20374829867dbccc99328f1f8632126b6f367b7fd89a720	또한 그는 두 개의 교회를 더 설립했습니다.	train
common_voice_en_19098116.mp3	It is extraordinarily well done, comprehensive and at the same time comprehendible-a great thing.	7a09d8772d8e52d34ba7595e11d1fdd6caaaa07da4639155e4a4bf63bb4bc4a23909ee2fad38831de20374829867dbccc99328f1f8632126b6f367b7fd89a720	매우 훌륭하고 포괄적이며 동시에 이해할 수 있는 훌륭한 책입니다.	train
common_voice_en_19098117.mp3	Partick Thistle won the Scottish Division Two.	7a09d8772d8e52d34ba7595e11d1fdd6caaaa07da4639155e4a4bf63bb4bc4a23909ee2fad38831de20374829867dbccc99328f1f8632126b6f367b7fd89a720	파틱 시슬이 스코틀랜드 디비전 2에서 우승했습니다.	train
common_voice_en_19098128.mp3	The Arakynthos mountains lie to the northeast.	7a09d8772d8e52d34ba7595e11d1fdd6caaaa07da4639155e4a4bf63bb4bc4a23909ee2fad38831de20374829867dbccc99328f1f8632126b6f367b7fd89a720	북동쪽에는 아라킨토스 산맥이 있습니다.	train
common_voice_en_19098129.mp3	A simple method to reduce this use is to switch to low-flow, high-performance showerheads.	7a09d8772d8e52d34ba7595e11d1fdd6caaaa07da4639155e4a4bf63bb4bc4a23909ee2fad38831de20374829867dbccc99328f1f8632126b6f367b7fd89a720	물 사용량을 줄이는 간단한 방법은 저유량 고성능 샤워헤드로 전환하는 것입니다.	train
common_voice_en_19098130.mp3	His father worked in advertising on Madison Avenue while they lived in New York.	7a09d8772d8e52d34ba7595e11d1fdd6caaaa07da4639155e4a4bf63bb4bc4a23909ee2fad38831de20374829867dbccc99328f1f8632126b6f367b7fd89a720	그의 아버지는 뉴욕에 살면서 매디슨 애비뉴에서 광고 일을 했습니다.	train
common_voice_en_19098131.mp3	The club badge is based on the coat of arms of Huddersfield.	7a09d8772d8e52d34ba7595e11d1fdd6caaaa07da4639155e4a4bf63bb4bc4a23909ee2fad38831de20374829867dbccc99328f1f8632126b6f367b7fd89a720	클럽 배지는 허더즈필드의 문장을 모티브로 제작되었습니다.	train
common_voice_en_19098132.mp3	"It had the first power looms for woolens and the first manufacture of ""satinets""."	7a09d8772d8e52d34ba7595e11d1fdd6caaaa07da4639155e4a4bf63bb4bc4a23909ee2fad38831de20374829867dbccc99328f1f8632126b6f367b7fd89a720	모직물을 위한 최초의 동력 직기와 최초의 '새티넷' 제조기를 보유했습니다.	train
common_voice_en_19244982.mp3	Oh, I can just imagine myself doing it.	7b5493f065bdffe5be87c1b1a081fc50503c19b094b3b6cdb3e677c1fd2802ffa653d531b5c49a9cdb366c4ad4ebb1db6383c62e6a02c1f05238a853cead3f18	제가 하는 모습을 상상해 보세요.	train
common_voice_en_19244983.mp3	I wonder how you got that idea!	7b5493f065bdffe5be87c1b1a081fc50503c19b094b3b6cdb3e677c1fd2802ffa653d531b5c49a9cdb366c4ad4ebb1db6383c62e6a02c1f05238a853cead3f18	어떻게 그런 아이디어를 얻으셨는지 궁금합니다!	train
common_voice_en_19244984.mp3	‘There’s a barrow t’other side of the hedge,’ said the boy.	7b5493f065bdffe5be87c1b1a081fc50503c19b094b3b6cdb3e677c1fd2802ffa653d531b5c49a9cdb366c4ad4ebb1db6383c62e6a02c1f05238a853cead3f18	"울타리 저편에 무덤이 있어요." 소년이 말했습니다.	train
common_voice_en_19244985.mp3	His mother turned on him like a fury.	7b5493f065bdffe5be87c1b1a081fc50503c19b094b3b6cdb3e677c1fd2802ffa653d531b5c49a9cdb366c4ad4ebb1db6383c62e6a02c1f05238a853cead3f18	그의 어머니는 분노에 찬 표정을 지었습니다.	train
common_voice_en_19244986.mp3	Mike was alone in the doorway.	7b5493f065bdffe5be87c1b1a081fc50503c19b094b3b6cdb3e677c1fd2802ffa653d531b5c49a9cdb366c4ad4ebb1db6383c62e6a02c1f05238a853cead3f18	마이크는 현관에 혼자 있었습니다.	train
common_voice_en_19244997.mp3	I do not know where I am.	7b5493f065bdffe5be87c1b1a081fc50503c19b094b3b6cdb3e677c1fd2802ffa653d531b5c49a9cdb366c4ad4ebb1db6383c62e6a02c1f05238a853cead3f18	여기가 어딘지 모르겠어요.	train
common_voice_en_19244998.mp3	"Shut up, Anthony, I'm talking to Gloria."	7b5493f065bdffe5be87c1b1a081fc50503c19b094b3b6cdb3e677c1fd2802ffa653d531b5c49a9cdb366c4ad4ebb1db6383c62e6a02c1f05238a853cead3f18	닥쳐요, 앤서니 글로리아랑 얘기 중이잖아요.	train
common_voice_en_19244999.mp3	But this indulgence he refused.	7b5493f065bdffe5be87c1b1a081fc50503c19b094b3b6cdb3e677c1fd2802ffa653d531b5c49a9cdb366c4ad4ebb1db6383c62e6a02c1f05238a853cead3f18	하지만 그는 이 관용을 거부했습니다.	train
common_voice_en_19245003.mp3	Who lit the candle?	7b5493f065bdffe5be87c1b1a081fc50503c19b094b3b6cdb3e677c1fd2802ffa653d531b5c49a9cdb366c4ad4ebb1db6383c62e6a02c1f05238a853cead3f18	누가 촛불을 켰나요?	train
common_voice_en_19245022.mp3	“You are a child of four,” she repeated in her anger.	7b5493f065bdffe5be87c1b1a081fc50503c19b094b3b6cdb3e677c1fd2802ffa653d531b5c49a9cdb366c4ad4ebb1db6383c62e6a02c1f05238a853cead3f18	"넌 네 살짜리 아이야." 그녀는 분노에 찬 목소리로 반복했습니다.	train
common_voice_en_19245023.mp3	Paul felt rather guilty.	7b5493f065bdffe5be87c1b1a081fc50503c19b094b3b6cdb3e677c1fd2802ffa653d531b5c49a9cdb366c4ad4ebb1db6383c62e6a02c1f05238a853cead3f18	폴은 오히려 죄책감을 느꼈습니다.	train
common_voice_en_19245024.mp3	He knew she suffered badly.	7b5493f065bdffe5be87c1b1a081fc50503c19b094b3b6cdb3e677c1fd2802ffa653d531b5c49a9cdb366c4ad4ebb1db6383c62e6a02c1f05238a853cead3f18	그는 그녀가 심하게 고통받았다는 것을 알고 있었습니다.	train
common_voice_en_19245025.mp3	The cyclist, a gigantic figure, towered above him.	7b5493f065bdffe5be87c1b1a081fc50503c19b094b3b6cdb3e677c1fd2802ffa653d531b5c49a9cdb366c4ad4ebb1db6383c62e6a02c1f05238a853cead3f18	거대한 체구의 사이클리스트가 그 위에 우뚝 솟아 있었습니다.	train
common_voice_en_19245026.mp3	Yes, to all those questions.	7b5493f065bdffe5be87c1b1a081fc50503c19b094b3b6cdb3e677c1fd2802ffa653d531b5c49a9cdb366c4ad4ebb1db6383c62e6a02c1f05238a853cead3f18	네, 이 모든 질문에 대한 답변입니다.	train
common_voice_en_19245032.mp3	Dear mother, I wish you could see her!	7b5493f065bdffe5be87c1b1a081fc50503c19b094b3b6cdb3e677c1fd2802ffa653d531b5c49a9cdb366c4ad4ebb1db6383c62e6a02c1f05238a853cead3f18	어머니, 보고 싶어요!	train
common_voice_en_19245033.mp3	Beyond it, she would not proceed.	7b5493f065bdffe5be87c1b1a081fc50503c19b094b3b6cdb3e677c1fd2802ffa653d531b5c49a9cdb366c4ad4ebb1db6383c62e6a02c1f05238a853cead3f18	그 이상은 더 이상 진행하지 않았습니다.	train
common_voice_en_19245034.mp3	“It’s bad enough,” she replied.	7b5493f065bdffe5be87c1b1a081fc50503c19b094b3b6cdb3e677c1fd2802ffa653d531b5c49a9cdb366c4ad4ebb1db6383c62e6a02c1f05238a853cead3f18	"충분히 나쁘죠." 그녀가 대답했습니다.	train
common_voice_en_19245035.mp3	The people are winning.	7b5493f065bdffe5be87c1b1a081fc50503c19b094b3b6cdb3e677c1fd2802ffa653d531b5c49a9cdb366c4ad4ebb1db6383c62e6a02c1f05238a853cead3f18	사람들이 승리하고 있습니다.	train
common_voice_en_19245036.mp3	He’s a bird of bad omen: no mate for you.	7b5493f065bdffe5be87c1b1a081fc50503c19b094b3b6cdb3e677c1fd2802ffa653d531b5c49a9cdb366c4ad4ebb1db6383c62e6a02c1f05238a853cead3f18	그는 불길한 징조의 새입니다: 당신에게 맞는 짝이 없습니다.	train
common_voice_en_19245043.mp3	‘The press is a mighty engine, sir,’ said Pott.	7b5493f065bdffe5be87c1b1a081fc50503c19b094b3b6cdb3e677c1fd2802ffa653d531b5c49a9cdb366c4ad4ebb1db6383c62e6a02c1f05238a853cead3f18	"언론은 강력한 엔진입니다." 포트가 말했습니다.	train
common_voice_en_19245045.mp3	She was winking at him as he did so.	7b5493f065bdffe5be87c1b1a081fc50503c19b094b3b6cdb3e677c1fd2802ffa653d531b5c49a9cdb366c4ad4ebb1db6383c62e6a02c1f05238a853cead3f18	그녀는 그렇게 하면서 그에게 윙크를 보냈습니다.	train
common_voice_en_19245050.mp3	"I don't think that's right."	7b5493f065bdffe5be87c1b1a081fc50503c19b094b3b6cdb3e677c1fd2802ffa653d531b5c49a9cdb366c4ad4ebb1db6383c62e6a02c1f05238a853cead3f18	그건 아닌 것 같습니다.	train
common_voice_en_19245054.mp3	"It's just a mode of being sorry for yourself."	7b5493f065bdffe5be87c1b1a081fc50503c19b094b3b6cdb3e677c1fd2802ffa653d531b5c49a9cdb366c4ad4ebb1db6383c62e6a02c1f05238a853cead3f18	스스로에게 미안해하는 모드일 뿐입니다.	train
common_voice_en_19245056.mp3	You really think so, mother?	7b5493f065bdffe5be87c1b1a081fc50503c19b094b3b6cdb3e677c1fd2802ffa653d531b5c49a9cdb366c4ad4ebb1db6383c62e6a02c1f05238a853cead3f18	정말 그렇게 생각하세요, 어머니?	train
common_voice_en_19245062.mp3	He was never still, he was never alone.	7b5493f065bdffe5be87c1b1a081fc50503c19b094b3b6cdb3e677c1fd2802ffa653d531b5c49a9cdb366c4ad4ebb1db6383c62e6a02c1f05238a853cead3f18	그는 결코 가만히 있지 않았고, 결코 혼자가 아니었습니다.	train
common_voice_en_19245063.mp3	"Therefore I say there's no time to lose."	7b5493f065bdffe5be87c1b1a081fc50503c19b094b3b6cdb3e677c1fd2802ffa653d531b5c49a9cdb366c4ad4ebb1db6383c62e6a02c1f05238a853cead3f18	그래서 저는 잃을 시간이 없다고 말합니다.	train
common_voice_en_19245064.mp3	She might be intimate and sad with him.	7b5493f065bdffe5be87c1b1a081fc50503c19b094b3b6cdb3e677c1fd2802ffa653d531b5c49a9cdb366c4ad4ebb1db6383c62e6a02c1f05238a853cead3f18	그녀는 그와 친밀하고 슬퍼할 수도 있습니다.	train
common_voice_en_19245065.mp3	She waited, and she kept Paul near to her.	7b5493f065bdffe5be87c1b1a081fc50503c19b094b3b6cdb3e677c1fd2802ffa653d531b5c49a9cdb366c4ad4ebb1db6383c62e6a02c1f05238a853cead3f18	그녀는 기다렸고 폴을 곁에 두었습니다.	train
common_voice_en_19245067.mp3	"But I can't help detesting my relations."	7b5493f065bdffe5be87c1b1a081fc50503c19b094b3b6cdb3e677c1fd2802ffa653d531b5c49a9cdb366c4ad4ebb1db6383c62e6a02c1f05238a853cead3f18	하지만 인간관계가 싫은 건 어쩔 수 없죠.	train
common_voice_en_19245082.mp3	Juliet was diagnosed with Body Dysmorphic Disorder.	7b5493f065bdffe5be87c1b1a081fc50503c19b094b3b6cdb3e677c1fd2802ffa653d531b5c49a9cdb366c4ad4ebb1db6383c62e6a02c1f05238a853cead3f18	줄리엣은 신체 이형성 장애 진단을 받았습니다.	train
common_voice_en_19245083.mp3	Mrs. Spencer said your place was named Green Gables.	7b5493f065bdffe5be87c1b1a081fc50503c19b094b3b6cdb3e677c1fd2802ffa653d531b5c49a9cdb366c4ad4ebb1db6383c62e6a02c1f05238a853cead3f18	스펜서 부인이 당신 집 이름이 그린 게이블이라고 하더군요.	train
common_voice_en_19245084.mp3	He must be dignified, hurt, grieved.	7b5493f065bdffe5be87c1b1a081fc50503c19b094b3b6cdb3e677c1fd2802ffa653d531b5c49a9cdb366c4ad4ebb1db6383c62e6a02c1f05238a853cead3f18	그는 존엄하고, 상처받고, 슬퍼해야 합니다.	train
common_voice_en_19245085.mp3	He made swift calculations.	7b5493f065bdffe5be87c1b1a081fc50503c19b094b3b6cdb3e677c1fd2802ffa653d531b5c49a9cdb366c4ad4ebb1db6383c62e6a02c1f05238a853cead3f18	그는 재빠르게 계산했습니다.	train
common_voice_en_19245089.mp3	He stepped off the bed, and stood a moment, shuddering.	7b5493f065bdffe5be87c1b1a081fc50503c19b094b3b6cdb3e677c1fd2802ffa653d531b5c49a9cdb366c4ad4ebb1db6383c62e6a02c1f05238a853cead3f18	그는 침대에서 내려와 몸을 떨며 잠시 서 있었습니다.	train
common_voice_en_604542.mp3	"I'd like to put Ryō Yamazaki onto my sylvia plath playlist."	7d5c20c7154bbc6987847479f9e822fdc9fe50f77a79e3d39df6c7551ca2dda6e7e538a12cf0603a2e5dc0a54ffc89eb646ae89e9b0d380e9e33b2bd5693f4ef	실비아 플라스 재생 목록에 야마자키 료의 노래를 추가하고 싶어요.	train_covost
common_voice_en_604543.mp3	Latvia and Estonia are both between the Baltic Sea and Russia.	7d5c20c7154bbc6987847479f9e822fdc9fe50f77a79e3d39df6c7551ca2dda6e7e538a12cf0603a2e5dc0a54ffc89eb646ae89e9b0d380e9e33b2bd5693f4ef	라트비아와 에스토니아는 모두 발트해와 러시아 사이에 있습니다.	train_covost
common_voice_en_604545.mp3	Can you find me the work, Frisbee: The Life and Death of a Hippie Preacher?	7d5c20c7154bbc6987847479f9e822fdc9fe50f77a79e3d39df6c7551ca2dda6e7e538a12cf0603a2e5dc0a54ffc89eb646ae89e9b0d380e9e33b2bd5693f4ef	작품 좀 찾아줄래, 프리스비? 프리스비: 한 히피 설교자의 삶과 죽음?	train_covost
common_voice_en_604547.mp3	Add this carlos libedinsky song to my zen focus playlist	7d5c20c7154bbc6987847479f9e822fdc9fe50f77a79e3d39df6c7551ca2dda6e7e538a12cf0603a2e5dc0a54ffc89eb646ae89e9b0d380e9e33b2bd5693f4ef	이 카를로스 리베딘스키 노래를 내 집중력 재생 목록에 추가하세요.	train
common_voice_en_604550.mp3	Please get me the work, All Killer.	7d5c20c7154bbc6987847479f9e822fdc9fe50f77a79e3d39df6c7551ca2dda6e7e538a12cf0603a2e5dc0a54ffc89eb646ae89e9b0d380e9e33b2bd5693f4ef	올킬러, 작품 좀 가져다주세요.	train_covost
