path	sentence	client_id	translation	split
common_voice_en_19961450.mp3	Kaduri lived a life of poverty and simplicity.	108ed24d65e2758f808343b2b47aa218ecbea24c10e5e164440fdbea047f13d2106b13fbe2ea86bc1c806bc01ac1cd311edb8436d246894da04c6e20c1c36f65	카두리는 가난하고 소박한 삶을 살았습니다.	train
common_voice_en_19961451.mp3	In Japan, he is currently under the Cutting Edge label.	108ed24d65e2758f808343b2b47aa218ecbea24c10e5e164440fdbea047f13d2106b13fbe2ea86bc1c806bc01ac1cd311edb8436d246894da04c6e20c1c36f65	일본에서는 현재 커팅 엣지 레이블로 활동하고 있습니다.	train
common_voice_en_19961453.mp3	"Saba is known as ""The Unspoiled Queen"" of the Caribbean."	108ed24d65e2758f808343b2b47aa218ecbea24c10e5e164440fdbea047f13d2106b13fbe2ea86bc1c806bc01ac1cd311edb8436d246894da04c6e20c1c36f65	사바는 카리브해의 '때묻지 않은 여왕'으로 알려져 있습니다.	train
common_voice_en_19961474.mp3	It’s all imagination.	108ed24d65e2758f808343b2b47aa218ecbea24c10e5e164440fdbea047f13d2106b13fbe2ea86bc1c806bc01ac1cd311edb8436d246894da04c6e20c1c36f65	모두 상상력입니다.	train
common_voice_en_19961475.mp3	It was discontinued primarily due to its location in a remote area of Japan.	108ed24d65e2758f808343b2b47aa218ecbea24c10e5e164440fdbea047f13d2106b13fbe2ea86bc1c806bc01ac1cd311edb8436d246894da04c6e20c1c36f65	주로 일본의 외딴 지역에 위치하여 운영이 중단되었습니다.	train
common_voice_en_19961476.mp3	"Adams chose the album title ""Pneumonia"" for symbolic reasons."	108ed24d65e2758f808343b2b47aa218ecbea24c10e5e164440fdbea047f13d2106b13fbe2ea86bc1c806bc01ac1cd311edb8436d246894da04c6e20c1c36f65	Adams는 상징적인 이유로 앨범 제목을 '폐렴'으로 정했습니다.	train
common_voice_en_19961477.mp3	The Moutons had two daughters named Jane Martha and Jacquelyn Cruse.	108ed24d65e2758f808343b2b47aa218ecbea24c10e5e164440fdbea047f13d2106b13fbe2ea86bc1c806bc01ac1cd311edb8436d246894da04c6e20c1c36f65	무통 부부에게는 제인 마사와 재클린 크루스라는 두 딸이 있었습니다.	train
common_voice_en_19961478.mp3	It was they who introduced the Reformation to the area.	108ed24d65e2758f808343b2b47aa218ecbea24c10e5e164440fdbea047f13d2106b13fbe2ea86bc1c806bc01ac1cd311edb8436d246894da04c6e20c1c36f65	이 지역에 종교개혁을 소개한 것은 바로 이들이었습니다.	train
common_voice_en_19961489.mp3	The word is also found in other Romance languages such as Spanish or Portuguese.	108ed24d65e2758f808343b2b47aa218ecbea24c10e5e164440fdbea047f13d2106b13fbe2ea86bc1c806bc01ac1cd311edb8436d246894da04c6e20c1c36f65	이 단어는 스페인어 또는 포르투갈어와 같은 다른 로맨스 언어에서도 찾을 수 있습니다.	train
common_voice_en_19961490.mp3	"Originally, the album was to be called ""The Beatles Again""."	108ed24d65e2758f808343b2b47aa218ecbea24c10e5e164440fdbea047f13d2106b13fbe2ea86bc1c806bc01ac1cd311edb8436d246894da04c6e20c1c36f65	원래 이 앨범의 제목은 '다시 비틀즈'였습니다.	train
common_voice_en_19961491.mp3	Achinstein specializes in philosophy of science with strong interests in the history of science.	108ed24d65e2758f808343b2b47aa218ecbea24c10e5e164440fdbea047f13d2106b13fbe2ea86bc1c806bc01ac1cd311edb8436d246894da04c6e20c1c36f65	아킨슈타인은 과학의 역사에 큰 관심을 가지고 과학 철학을 전공했습니다.	train
common_voice_en_19961493.mp3	She was a great wee lassie.	108ed24d65e2758f808343b2b47aa218ecbea24c10e5e164440fdbea047f13d2106b13fbe2ea86bc1c806bc01ac1cd311edb8436d246894da04c6e20c1c36f65	그녀는 정말 멋진 아가씨였어요.	train
common_voice_en_19674535.mp3	The Portuguese introduced grafting on mango trees to produce extraordinary varieties like Alphonso.	11611daa8a7d150615bf71ea80e0d10704ae3e344487415722f67acc8f6619d8c493ba5a2dbd6e7eb575126207d49d5ecf7ac086ee110a094e526462a6b55c52	포르투갈인들은 망고 나무에 접목을 도입하여 알폰소와 같은 특별한 품종을 생산했습니다.	train
common_voice_en_19674536.mp3	He often visited the museum for inspiration while working on the film.	11611daa8a7d150615bf71ea80e0d10704ae3e344487415722f67acc8f6619d8c493ba5a2dbd6e7eb575126207d49d5ecf7ac086ee110a094e526462a6b55c52	그는 영화 작업을 하면서 영감을 얻기 위해 박물관을 자주 방문했습니다.	train
common_voice_en_19674537.mp3	The name has been used for two tropical cyclones in the Australian region.	11611daa8a7d150615bf71ea80e0d10704ae3e344487415722f67acc8f6619d8c493ba5a2dbd6e7eb575126207d49d5ecf7ac086ee110a094e526462a6b55c52	이 이름은 호주 지역에서 발생한 두 개의 열대성 저기압에 사용되었습니다.	train
common_voice_en_19674538.mp3	The therapeutic, stress-relieving device was invented by Temple Grandin while she was attending college.	11611daa8a7d150615bf71ea80e0d10704ae3e344487415722f67acc8f6619d8c493ba5a2dbd6e7eb575126207d49d5ecf7ac086ee110a094e526462a6b55c52	템플 그랜딘이 대학 재학 중에 개발한 스트레스 해소용 치료기입니다.	train
common_voice_en_19674539.mp3	The Eastern Fleet is headquartered here.	11611daa8a7d150615bf71ea80e0d10704ae3e344487415722f67acc8f6619d8c493ba5a2dbd6e7eb575126207d49d5ecf7ac086ee110a094e526462a6b55c52	동부 함대는 이곳에 본부를 두고 있습니다.	train
common_voice_en_19674606.mp3	"With Solomon as RootsAction's coordinator, the group has addressed a wide range of concerns."	11611daa8a7d150615bf71ea80e0d10704ae3e344487415722f67acc8f6619d8c493ba5a2dbd6e7eb575126207d49d5ecf7ac086ee110a094e526462a6b55c52	솔로몬이 루츠액션의 코디네이터로 활동하면서 이 그룹은 다양한 문제를 해결해 왔습니다.	train
common_voice_en_19674609.mp3	G. William Noble Park is well kept and gets new playground equipment periodically.	11611daa8a7d150615bf71ea80e0d10704ae3e344487415722f67acc8f6619d8c493ba5a2dbd6e7eb575126207d49d5ecf7ac086ee110a094e526462a6b55c52	G. 윌리엄 노블 파크는 잘 관리되고 있으며 주기적으로 새로운 놀이기구를 도입합니다.	train
common_voice_en_19674610.mp3	During it, she loses one of her earrings and sustains several minor injuries.	11611daa8a7d150615bf71ea80e0d10704ae3e344487415722f67acc8f6619d8c493ba5a2dbd6e7eb575126207d49d5ecf7ac086ee110a094e526462a6b55c52	그 과정에서 그녀는 귀걸이 하나를 잃고 몇 가지 경미한 부상을 입습니다.	train
common_voice_en_19674612.mp3	"There is no official translation of ""Indonesia Raya"" into other languages."	11611daa8a7d150615bf71ea80e0d10704ae3e344487415722f67acc8f6619d8c493ba5a2dbd6e7eb575126207d49d5ecf7ac086ee110a094e526462a6b55c52	다른 언어로 "인도네시아 라야"를 번역할 수 있는 공식 번역은 없습니다.	train
common_voice_en_19674641.mp3	Sancho took over military matters, while Theresa assumed administrative functions.	11611daa8a7d150615bf71ea80e0d10704ae3e344487415722f67acc8f6619d8c493ba5a2dbd6e7eb575126207d49d5ecf7ac086ee110a094e526462a6b55c52	산초는 군사 문제를 맡았고 테레사는 행정 업무를 맡았습니다.	train
common_voice_en_19674642.mp3	Billy Struve was its main producer in New Orleans.	11611daa8a7d150615bf71ea80e0d10704ae3e344487415722f67acc8f6619d8c493ba5a2dbd6e7eb575126207d49d5ecf7ac086ee110a094e526462a6b55c52	뉴올리언스의 메인 프로듀서는 빌리 스트루브였습니다.	train
common_voice_en_19674644.mp3	"He is the creator of Comedy Central's ""Threesome""."	11611daa8a7d150615bf71ea80e0d10704ae3e344487415722f67acc8f6619d8c493ba5a2dbd6e7eb575126207d49d5ecf7ac086ee110a094e526462a6b55c52	그는 코미디 센트럴의 '삼인조'의 제작자입니다.	train
common_voice_en_19674645.mp3	It contains some of the best gags we have seen in cartoons.	11611daa8a7d150615bf71ea80e0d10704ae3e344487415722f67acc8f6619d8c493ba5a2dbd6e7eb575126207d49d5ecf7ac086ee110a094e526462a6b55c52	만화에서 본 최고의 개그가 담겨 있습니다.	train
common_voice_en_19857815.mp3	Griffin, after being told the news by close friend DeAndre Jordan, declared, Yeah!	1180afe5f040ce86d29d8b767ff1c47970f56eb0e8ca8a25b6980dc75e28acd3a5fc45c694e8e6687519c386aa96862955e97db0920c0c63f13594953b6b218e	"그리핀은 절친한 친구인 디안드레 조던으로부터 이 소식을 전해 듣고 "그래!	train
common_voice_en_19857816.mp3	This has greatly improved the reputation of the film.	1180afe5f040ce86d29d8b767ff1c47970f56eb0e8ca8a25b6980dc75e28acd3a5fc45c694e8e6687519c386aa96862955e97db0920c0c63f13594953b6b218e	이로 인해 영화의 평판이 크게 향상되었습니다.	train
common_voice_en_19857817.mp3	Not long thereafter, the group disbanded.	1180afe5f040ce86d29d8b767ff1c47970f56eb0e8ca8a25b6980dc75e28acd3a5fc45c694e8e6687519c386aa96862955e97db0920c0c63f13594953b6b218e	얼마 지나지 않아 그룹은 해체되었습니다.	train
common_voice_en_19857818.mp3	The immediate area of was evacuated.	1180afe5f040ce86d29d8b767ff1c47970f56eb0e8ca8a25b6980dc75e28acd3a5fc45c694e8e6687519c386aa96862955e97db0920c0c63f13594953b6b218e	의 인근 지역이 대피했습니다.	train
common_voice_en_19857819.mp3	Near the pier is the National Library of Thailand.	1180afe5f040ce86d29d8b767ff1c47970f56eb0e8ca8a25b6980dc75e28acd3a5fc45c694e8e6687519c386aa96862955e97db0920c0c63f13594953b6b218e	부두 근처에는 태국 국립 도서관이 있습니다.	train
common_voice_en_19857820.mp3	Burmese Indians practise Hinduism, Islam, Sikhism, Buddhism and Christianity.	1180afe5f040ce86d29d8b767ff1c47970f56eb0e8ca8a25b6980dc75e28acd3a5fc45c694e8e6687519c386aa96862955e97db0920c0c63f13594953b6b218e	버마 인디언은 힌두교, 이슬람교, 시크교, 불교, 기독교를 믿습니다.	train
common_voice_en_19857821.mp3	The meat pie is considered iconic in Australia and New Zealand.	1180afe5f040ce86d29d8b767ff1c47970f56eb0e8ca8a25b6980dc75e28acd3a5fc45c694e8e6687519c386aa96862955e97db0920c0c63f13594953b6b218e	미트 파이는 호주와 뉴질랜드에서 상징적인 음식으로 여겨집니다.	train
common_voice_en_19857822.mp3	Military District Courts.	1180afe5f040ce86d29d8b767ff1c47970f56eb0e8ca8a25b6980dc75e28acd3a5fc45c694e8e6687519c386aa96862955e97db0920c0c63f13594953b6b218e	군사 지방 법원.	train
common_voice_en_19857823.mp3	"Smith's articles approached religious topics without endorsing the Bible as literally true."	1180afe5f040ce86d29d8b767ff1c47970f56eb0e8ca8a25b6980dc75e28acd3a5fc45c694e8e6687519c386aa96862955e97db0920c0c63f13594953b6b218e	스미스의 글은 성경을 문자 그대로 사실로 지지하지 않고 종교적인 주제에 접근했습니다.	train
common_voice_en_19857824.mp3	The thirty-minute film was later shown on television in various countries.	1180afe5f040ce86d29d8b767ff1c47970f56eb0e8ca8a25b6980dc75e28acd3a5fc45c694e8e6687519c386aa96862955e97db0920c0c63f13594953b6b218e	30분 분량의 이 영화는 이후 여러 나라의 텔레비전에서 상영되었습니다.	train
common_voice_en_19861244.mp3	Many species live in groups and males defend territories.	1180afe5f040ce86d29d8b767ff1c47970f56eb0e8ca8a25b6980dc75e28acd3a5fc45c694e8e6687519c386aa96862955e97db0920c0c63f13594953b6b218e	많은 종들이 무리를 지어 살고 수컷이 영토를 지키고 있습니다.	train
common_voice_en_19861245.mp3	Christensen is also a professional painter.	1180afe5f040ce86d29d8b767ff1c47970f56eb0e8ca8a25b6980dc75e28acd3a5fc45c694e8e6687519c386aa96862955e97db0920c0c63f13594953b6b218e	크리스텐슨은 전문 화가이기도 합니다.	train
common_voice_en_19861248.mp3	"Thus we may assume that ""p"" does not divide ""c""."	1180afe5f040ce86d29d8b767ff1c47970f56eb0e8ca8a25b6980dc75e28acd3a5fc45c694e8e6687519c386aa96862955e97db0920c0c63f13594953b6b218e	따라서 'p'가 'c'를 나누지 않는다고 가정할 수 있습니다.	train
common_voice_en_19720562.mp3	Passengers may select a seat prior to their flight for a fee.	11e2aeb6d2ec72cae85fb11350737e406525d641ee97f5a4b49a289f862d3f2dcecf5480cd914fa7810e8440eb60ea9a97f9aa4e96436e377adb58f7800be10e	승객은 비행 전에 유료로 좌석을 선택할 수 있습니다.	train
common_voice_en_19720563.mp3	Seventeenth-century occupants included several papal nuncios, including Mazarin.	11e2aeb6d2ec72cae85fb11350737e406525d641ee97f5a4b49a289f862d3f2dcecf5480cd914fa7810e8440eb60ea9a97f9aa4e96436e377adb58f7800be10e	17세기 거주자 중에는 마자린을 비롯한 여러 교황청 수녀가 포함되어 있었습니다.	train
common_voice_en_19720565.mp3	The history from Professor Wu is as follows.	11e2aeb6d2ec72cae85fb11350737e406525d641ee97f5a4b49a289f862d3f2dcecf5480cd914fa7810e8440eb60ea9a97f9aa4e96436e377adb58f7800be10e	우 교수의 이야기는 다음과 같습니다.	train
common_voice_en_19720569.mp3	The unit has Denso engine management, as in most Circle L engines.	11e2aeb6d2ec72cae85fb11350737e406525d641ee97f5a4b49a289f862d3f2dcecf5480cd914fa7810e8440eb60ea9a97f9aa4e96436e377adb58f7800be10e	이 장치에는 대부분의 Circle L 엔진과 마찬가지로 덴소 엔진 관리 기능이 있습니다.	train
common_voice_en_19720583.mp3	He is hit and killed by the coaster.	11e2aeb6d2ec72cae85fb11350737e406525d641ee97f5a4b49a289f862d3f2dcecf5480cd914fa7810e8440eb60ea9a97f9aa4e96436e377adb58f7800be10e	그는 코스터에 치여 사망합니다.	train
common_voice_en_19720586.mp3	There is a small amount of car parking in the village.	11e2aeb6d2ec72cae85fb11350737e406525d641ee97f5a4b49a289f862d3f2dcecf5480cd914fa7810e8440eb60ea9a97f9aa4e96436e377adb58f7800be10e	마을에 소량의 주차장이 있습니다.	train
common_voice_en_19720588.mp3	"Gasparini's works were performed throughout Italy, and also on occasion in Germany and England."	11e2aeb6d2ec72cae85fb11350737e406525d641ee97f5a4b49a289f862d3f2dcecf5480cd914fa7810e8440eb60ea9a97f9aa4e96436e377adb58f7800be10e	가스파리니의 작품은 이탈리아 전역에서 공연되었으며, 독일과 영국에서도 가끔씩 공연되었습니다.	train
common_voice_en_19720590.mp3	Allan Wells forcefully denies the allegations.	11e2aeb6d2ec72cae85fb11350737e406525d641ee97f5a4b49a289f862d3f2dcecf5480cd914fa7810e8440eb60ea9a97f9aa4e96436e377adb58f7800be10e	앨런 웰스는 혐의를 강력하게 부인합니다.	train
