path	sentence	client_id	translation	split
common_voice_en_18261285.mp3	The purple heart was blazing with fire.	2840e1708b3432b93a3c13007c994b48618f50fb6e18a8ef47c7a040ded1d934cddccc8e343d8daa0f7901270e04ba8fda6d44d090fbad3d02c501b265d6d73a	보라색 심장이 불길로 타오르고 있었습니다.	train_covost
common_voice_en_18261286.mp3	The correct pronunciation is.	2840e1708b3432b93a3c13007c994b48618f50fb6e18a8ef47c7a040ded1d934cddccc8e343d8daa0f7901270e04ba8fda6d44d090fbad3d02c501b265d6d73a	정확한 발음은 다음과 같습니다.	train_covost
common_voice_en_18261288.mp3	She sat across the room.	2840e1708b3432b93a3c13007c994b48618f50fb6e18a8ef47c7a040ded1d934cddccc8e343d8daa0f7901270e04ba8fda6d44d090fbad3d02c501b265d6d73a	그녀는 방 맞은편에 앉았습니다.	train_covost
common_voice_en_18261292.mp3	The clothes were torn.	2840e1708b3432b93a3c13007c994b48618f50fb6e18a8ef47c7a040ded1d934cddccc8e343d8daa0f7901270e04ba8fda6d44d090fbad3d02c501b265d6d73a	옷이 찢어졌습니다.	train_covost
common_voice_en_18261294.mp3	Technology plays a vital role in reaching people following natural disasters.	2840e1708b3432b93a3c13007c994b48618f50fb6e18a8ef47c7a040ded1d934cddccc8e343d8daa0f7901270e04ba8fda6d44d090fbad3d02c501b265d6d73a	기술은 자연재해가 발생한 후 사람들에게 다가가는 데 중요한 역할을 합니다.	train_covost
common_voice_en_18261295.mp3	Untreated sewage would pollute the rivers.	2840e1708b3432b93a3c13007c994b48618f50fb6e18a8ef47c7a040ded1d934cddccc8e343d8daa0f7901270e04ba8fda6d44d090fbad3d02c501b265d6d73a	처리되지 않은 하수는 강을 오염시킬 수 있습니다.	train_covost
common_voice_en_18261300.mp3	So we could have some respite.	2840e1708b3432b93a3c13007c994b48618f50fb6e18a8ef47c7a040ded1d934cddccc8e343d8daa0f7901270e04ba8fda6d44d090fbad3d02c501b265d6d73a	그래서 잠시 휴식을 취할 수 있었습니다.	train_covost
common_voice_en_18261301.mp3	Why do you feel you need to make them happy?	2840e1708b3432b93a3c13007c994b48618f50fb6e18a8ef47c7a040ded1d934cddccc8e343d8daa0f7901270e04ba8fda6d44d090fbad3d02c501b265d6d73a	왜 그들을 행복하게 만들어야 한다고 생각하시나요?	train_covost
common_voice_en_18261303.mp3	The device has a gyro motor.	2840e1708b3432b93a3c13007c994b48618f50fb6e18a8ef47c7a040ded1d934cddccc8e343d8daa0f7901270e04ba8fda6d44d090fbad3d02c501b265d6d73a	이 장치에는 자이로 모터가 있습니다.	train_covost
common_voice_en_18289842.mp3	I was stuck in traffic all day!	2840e1708b3432b93a3c13007c994b48618f50fb6e18a8ef47c7a040ded1d934cddccc8e343d8daa0f7901270e04ba8fda6d44d090fbad3d02c501b265d6d73a	하루 종일 교통 체증에 시달렸어요!	train_covost
common_voice_en_18289854.mp3	Which version do you have?	2840e1708b3432b93a3c13007c994b48618f50fb6e18a8ef47c7a040ded1d934cddccc8e343d8daa0f7901270e04ba8fda6d44d090fbad3d02c501b265d6d73a	어떤 버전을 가지고 계신가요?	train_covost
common_voice_en_18315830.mp3	It is also an insidious, deceitful sun.	2840e1708b3432b93a3c13007c994b48618f50fb6e18a8ef47c7a040ded1d934cddccc8e343d8daa0f7901270e04ba8fda6d44d090fbad3d02c501b265d6d73a	또한 교활하고 기만적인 태양이기도 합니다.	train_covost
common_voice_en_18315831.mp3	On Saturday afternoons my wife and I normally go shopping	2840e1708b3432b93a3c13007c994b48618f50fb6e18a8ef47c7a040ded1d934cddccc8e343d8daa0f7901270e04ba8fda6d44d090fbad3d02c501b265d6d73a	토요일 오후에 아내와 저는 보통 쇼핑을 하러 갑니다.	train_covost
common_voice_en_18315878.mp3	I sailed third mate in the little Vampire before you were born.	2840e1708b3432b93a3c13007c994b48618f50fb6e18a8ef47c7a040ded1d934cddccc8e343d8daa0f7901270e04ba8fda6d44d090fbad3d02c501b265d6d73a	난 네가 태어나기 전에 작은 뱀파이어호에서 3등 항해사로 일했어.	train_covost
common_voice_en_18315882.mp3	"It was this proposition that started the big idea in Daughtry's mind."	2840e1708b3432b93a3c13007c994b48618f50fb6e18a8ef47c7a040ded1d934cddccc8e343d8daa0f7901270e04ba8fda6d44d090fbad3d02c501b265d6d73a	도트리의 머릿속에서 큰 아이디어가 시작된 것은 바로 이 명제였습니다.	train_covost
common_voice_en_18315883.mp3	"If not, let's say our prayers and go to bed."	2840e1708b3432b93a3c13007c994b48618f50fb6e18a8ef47c7a040ded1d934cddccc8e343d8daa0f7901270e04ba8fda6d44d090fbad3d02c501b265d6d73a	그렇지 않다면 기도를 하고 잠자리에 들도록 하세요.	train_covost
common_voice_en_18315888.mp3	She was a great fan of country music	2840e1708b3432b93a3c13007c994b48618f50fb6e18a8ef47c7a040ded1d934cddccc8e343d8daa0f7901270e04ba8fda6d44d090fbad3d02c501b265d6d73a	그녀는 컨트리 음악의 열렬한 팬이었습니다.	train_covost
common_voice_en_18315889.mp3	That is the strange part of it.	2840e1708b3432b93a3c13007c994b48618f50fb6e18a8ef47c7a040ded1d934cddccc8e343d8daa0f7901270e04ba8fda6d44d090fbad3d02c501b265d6d73a	그게 바로 이상한 부분입니다.	train_covost
common_voice_en_18315891.mp3	He had barely entered this when he saw the glow of a fire.	2840e1708b3432b93a3c13007c994b48618f50fb6e18a8ef47c7a040ded1d934cddccc8e343d8daa0f7901270e04ba8fda6d44d090fbad3d02c501b265d6d73a	그는 불빛을 보고 겨우 들어왔을 때였습니다.	train_covost
common_voice_en_18315893.mp3	Such is my passage engaged on the steamer.	2840e1708b3432b93a3c13007c994b48618f50fb6e18a8ef47c7a040ded1d934cddccc8e343d8daa0f7901270e04ba8fda6d44d090fbad3d02c501b265d6d73a	찜통에 걸린 제 통로입니다.	train_covost
common_voice_en_18315899.mp3	And after the bath a shave would not be bad.	2840e1708b3432b93a3c13007c994b48618f50fb6e18a8ef47c7a040ded1d934cddccc8e343d8daa0f7901270e04ba8fda6d44d090fbad3d02c501b265d6d73a	그리고 목욕 후에는 면도도 나쁘지 않을 것입니다.	train_covost
common_voice_en_18315901.mp3	Poor little Crooked-Leg was terribly scared.	2840e1708b3432b93a3c13007c994b48618f50fb6e18a8ef47c7a040ded1d934cddccc8e343d8daa0f7901270e04ba8fda6d44d090fbad3d02c501b265d6d73a	불쌍한 꼬마 구부러진 다리는 몹시 무서워했습니다.	train_covost
common_voice_en_18315903.mp3	In many cases, Refugees were highly educated professionals in their former home nation.	2840e1708b3432b93a3c13007c994b48618f50fb6e18a8ef47c7a040ded1d934cddccc8e343d8daa0f7901270e04ba8fda6d44d090fbad3d02c501b265d6d73a	많은 경우 난민은 이전 고국에서 고학력 전문직 종사자였습니다.	train_covost
common_voice_en_18315907.mp3	Behind him lay the thousand-years-long road across all Siberia and Russia.	2840e1708b3432b93a3c13007c994b48618f50fb6e18a8ef47c7a040ded1d934cddccc8e343d8daa0f7901270e04ba8fda6d44d090fbad3d02c501b265d6d73a	그의 뒤에는 시베리아와 러시아 전역을 가로지르는 천 년 길이의 도로가 놓여 있었습니다.	train_covost
common_voice_en_18315911.mp3	Both Johnny and his mother shuffled their feet as they walked.	2840e1708b3432b93a3c13007c994b48618f50fb6e18a8ef47c7a040ded1d934cddccc8e343d8daa0f7901270e04ba8fda6d44d090fbad3d02c501b265d6d73a	조니와 그의 어머니는 걸으면서 발을 헛디뎠습니다.	train_covost
common_voice_en_18315913.mp3	Did you find a car park, or did you park on the street?	2840e1708b3432b93a3c13007c994b48618f50fb6e18a8ef47c7a040ded1d934cddccc8e343d8daa0f7901270e04ba8fda6d44d090fbad3d02c501b265d6d73a	주차장을 찾았나요, 아니면 길거리에 주차했나요?	train_covost
common_voice_en_18315917.mp3	He told himself that as he washed himself and groomed his disheveled clothes.	2840e1708b3432b93a3c13007c994b48618f50fb6e18a8ef47c7a040ded1d934cddccc8e343d8daa0f7901270e04ba8fda6d44d090fbad3d02c501b265d6d73a	그는 몸을 씻고 흐트러진 옷을 단정히 정리하면서 스스로에게 말했습니다.	train_covost
