path	sentence	client_id	translation	split
common_voice_en_18851730.mp3	The pile-up included a significant number of cars which blocked the track entirely.	bd8fde1c5e7b0891e3740031d254efecbb60977cd44e53a1953507067c6c90c322c62cda4d993a224065915680ab8ec210a382cb667de683a240c863c6796f87	이 사고로 인해 상당수의 차량이 선로를 완전히 막았습니다.	train
common_voice_en_18851731.mp3	During this single Olympiad, only two rapid fire series were fired in the finals.	bd8fde1c5e7b0891e3740031d254efecbb60977cd44e53a1953507067c6c90c322c62cda4d993a224065915680ab8ec210a382cb667de683a240c863c6796f87	이번 올림피아드에서 결승전에서는 단 두 번의 속사 시리즈만 진행되었습니다.	train
common_voice_en_18851732.mp3	Wainscot stories involve hidden parts of the familiar, mundane world.	bd8fde1c5e7b0891e3740031d254efecbb60977cd44e53a1953507067c6c90c322c62cda4d993a224065915680ab8ec210a382cb667de683a240c863c6796f87	웨인스콧 스토리는 친숙하고 평범한 세상의 숨겨진 부분을 담고 있습니다.	train
common_voice_en_18851733.mp3	The erbium doped amplifier is a high gain amplifier.	bd8fde1c5e7b0891e3740031d254efecbb60977cd44e53a1953507067c6c90c322c62cda4d993a224065915680ab8ec210a382cb667de683a240c863c6796f87	에르븀 도핑 증폭기는 고이득 증폭기입니다.	train
common_voice_en_18851734.mp3	"The opening resembles an Alekhine's Defence but on the opposite side of the board."	bd8fde1c5e7b0891e3740031d254efecbb60977cd44e53a1953507067c6c90c322c62cda4d993a224065915680ab8ec210a382cb667de683a240c863c6796f87	오프닝은 알레히네의 수비와 비슷하지만 보드의 반대편에 있습니다.	train
common_voice_en_18851735.mp3	It also helped popularize cryptograms and secret writing.	bd8fde1c5e7b0891e3740031d254efecbb60977cd44e53a1953507067c6c90c322c62cda4d993a224065915680ab8ec210a382cb667de683a240c863c6796f87	또한 암호문과 비밀 글쓰기의 대중화에도 도움이 되었습니다.	train
common_voice_en_18851736.mp3	"""Du Pont"" survived the hurricane, but was heavily damaged."	bd8fde1c5e7b0891e3740031d254efecbb60977cd44e53a1953507067c6c90c322c62cda4d993a224065915680ab8ec210a382cb667de683a240c863c6796f87	듀퐁'은 허리케인에서 살아남았지만 큰 피해를 입었습니다.	train
common_voice_en_18851737.mp3	Rubens painted several compositions of the subject at different points in his career.	bd8fde1c5e7b0891e3740031d254efecbb60977cd44e53a1953507067c6c90c322c62cda4d993a224065915680ab8ec210a382cb667de683a240c863c6796f87	루벤스는 경력의 여러 시점에 여러 가지 주제의 작품을 그렸습니다.	train
common_voice_en_18851739.mp3	"Behind the Director's house there is an elegant, small stables for the Director's horses."	bd8fde1c5e7b0891e3740031d254efecbb60977cd44e53a1953507067c6c90c322c62cda4d993a224065915680ab8ec210a382cb667de683a240c863c6796f87	감독관 집 뒤에는 감독관의 말을 위한 우아하고 작은 마구간이 있습니다.	train
common_voice_en_18851740.mp3	It became a classic text in second-wave feminism in the United States.	bd8fde1c5e7b0891e3740031d254efecbb60977cd44e53a1953507067c6c90c322c62cda4d993a224065915680ab8ec210a382cb667de683a240c863c6796f87	이 책은 미국 제2의 물결 페미니즘의 고전이 되었습니다.	train
common_voice_en_18851741.mp3	Stationers sell preprinted cards.	bd8fde1c5e7b0891e3740031d254efecbb60977cd44e53a1953507067c6c90c322c62cda4d993a224065915680ab8ec210a382cb667de683a240c863c6796f87	문구점에서 사전 인쇄된 카드를 판매합니다.	train
common_voice_en_18851742.mp3	But soon to be updated like it normally had been.	bd8fde1c5e7b0891e3740031d254efecbb60977cd44e53a1953507067c6c90c322c62cda4d993a224065915680ab8ec210a382cb667de683a240c863c6796f87	하지만 곧 평소처럼 업데이트될 예정입니다.	train
common_voice_en_18851743.mp3	In store-bought canned preparations, adding milk is less common.	bd8fde1c5e7b0891e3740031d254efecbb60977cd44e53a1953507067c6c90c322c62cda4d993a224065915680ab8ec210a382cb667de683a240c863c6796f87	매장에서 구입한 통조림 제품에서는 우유를 추가하는 경우가 많지 않습니다.	train
common_voice_en_18851744.mp3	This would match a king who ruled only a short time.	bd8fde1c5e7b0891e3740031d254efecbb60977cd44e53a1953507067c6c90c322c62cda4d993a224065915680ab8ec210a382cb667de683a240c863c6796f87	이는 짧은 기간만 통치한 왕과 일치합니다.	train
common_voice_en_18851745.mp3	All aboard were killed.	bd8fde1c5e7b0891e3740031d254efecbb60977cd44e53a1953507067c6c90c322c62cda4d993a224065915680ab8ec210a382cb667de683a240c863c6796f87	탑승자 전원이 사망했습니다.	train
common_voice_en_18851746.mp3	Note that there are multiple orthographies for the Tongva language.	bd8fde1c5e7b0891e3740031d254efecbb60977cd44e53a1953507067c6c90c322c62cda4d993a224065915680ab8ec210a382cb667de683a240c863c6796f87	통바 언어에는 여러 가지 맞춤법이 있다는 점에 유의하세요.	train
common_voice_en_18851747.mp3	He also served as an army Captain in the Mexican-American War.	bd8fde1c5e7b0891e3740031d254efecbb60977cd44e53a1953507067c6c90c322c62cda4d993a224065915680ab8ec210a382cb667de683a240c863c6796f87	또한 멕시코-미국 전쟁에서 육군 대위로 복무했습니다.	train
common_voice_en_18851749.mp3	"Jon's on-air sidekicks don't share his enthusiasm."	bd8fde1c5e7b0891e3740031d254efecbb60977cd44e53a1953507067c6c90c322c62cda4d993a224065915680ab8ec210a382cb667de683a240c863c6796f87	존의 방송 조력자들은 그의 열정을 공유하지 않습니다.	train
common_voice_en_18851750.mp3	It is not sufficient to pass a wet hand over the dry place.	bd8fde1c5e7b0891e3740031d254efecbb60977cd44e53a1953507067c6c90c322c62cda4d993a224065915680ab8ec210a382cb667de683a240c863c6796f87	젖은 손을 마른 곳에 대는 것만으로는 충분하지 않습니다.	train
common_voice_en_18851751.mp3	"This concludes Christ's message."	bd8fde1c5e7b0891e3740031d254efecbb60977cd44e53a1953507067c6c90c322c62cda4d993a224065915680ab8ec210a382cb667de683a240c863c6796f87	이것으로 그리스도의 메시지를 마칩니다.	train
common_voice_en_18851752.mp3	"This palace was preceded by a royal mansion called ""Torvesund""."	bd8fde1c5e7b0891e3740031d254efecbb60977cd44e53a1953507067c6c90c322c62cda4d993a224065915680ab8ec210a382cb667de683a240c863c6796f87	이 궁전 앞에는 "토르베순드"라는 왕실 저택이 있었습니다.	train
common_voice_en_18851753.mp3	It has rarely been seriously organized and resolutely pursued.	bd8fde1c5e7b0891e3740031d254efecbb60977cd44e53a1953507067c6c90c322c62cda4d993a224065915680ab8ec210a382cb667de683a240c863c6796f87	진지하게 조직화되고 단호하게 추진된 적은 거의 없습니다.	train
common_voice_en_18606904.mp3	Holograph technology is being commercialized finally.	0feb9485d2bebbd308c68f8618b70d780d750208d04afd768400a369f2d239c0f0f5c32d6face1cebf2e1bb2dc073b60c83cf0d44f67048351fdfd2eb1914ae6	홀로그램 기술이 드디어 상용화되고 있습니다.	train_covost
common_voice_en_18606929.mp3	"And all's fish that comes to my net."	0feb9485d2bebbd308c68f8618b70d780d750208d04afd768400a369f2d239c0f0f5c32d6face1cebf2e1bb2dc073b60c83cf0d44f67048351fdfd2eb1914ae6	그리고 내 그물에 들어오는 물고기는 모두 물고기입니다.	train
common_voice_en_18606930.mp3	I gathered that he had no preference in parties.	0feb9485d2bebbd308c68f8618b70d780d750208d04afd768400a369f2d239c0f0f5c32d6face1cebf2e1bb2dc073b60c83cf0d44f67048351fdfd2eb1914ae6	그는 파티를 선호하지 않는다고 들었습니다.	train
common_voice_en_18606932.mp3	I have a supercar at home, although it is a toy model.	0feb9485d2bebbd308c68f8618b70d780d750208d04afd768400a369f2d239c0f0f5c32d6face1cebf2e1bb2dc073b60c83cf0d44f67048351fdfd2eb1914ae6	집에 장난감 모형이긴 하지만 슈퍼카가 있습니다.	train
common_voice_en_18606934.mp3	The car was found abandoned two miles away from the bank.	0feb9485d2bebbd308c68f8618b70d780d750208d04afd768400a369f2d239c0f0f5c32d6face1cebf2e1bb2dc073b60c83cf0d44f67048351fdfd2eb1914ae6	이 차는 은행에서 2마일 떨어진 곳에서 버려진 채 발견되었습니다.	train
common_voice_en_18606935.mp3	Ten percent remaining before fuel depletion.	0feb9485d2bebbd308c68f8618b70d780d750208d04afd768400a369f2d239c0f0f5c32d6face1cebf2e1bb2dc073b60c83cf0d44f67048351fdfd2eb1914ae6	연료 고갈 전까지 10%가 남았습니다.	train
common_voice_en_18606936.mp3	We will be recruiting a scrum master.	0feb9485d2bebbd308c68f8618b70d780d750208d04afd768400a369f2d239c0f0f5c32d6face1cebf2e1bb2dc073b60c83cf0d44f67048351fdfd2eb1914ae6	스크럼 마스터를 모집합니다.	train_covost
common_voice_en_18606940.mp3	Was it the Red King, Kitty? Which do you think it was?	0feb9485d2bebbd308c68f8618b70d780d750208d04afd768400a369f2d239c0f0f5c32d6face1cebf2e1bb2dc073b60c83cf0d44f67048351fdfd2eb1914ae6	붉은 왕이었나요, 키티? 어떤 것 같나요?	train
common_voice_en_18606941.mp3	But why do I make these excuses?	0feb9485d2bebbd308c68f8618b70d780d750208d04afd768400a369f2d239c0f0f5c32d6face1cebf2e1bb2dc073b60c83cf0d44f67048351fdfd2eb1914ae6	하지만 왜 이런 핑계를 대는 걸까요?	train_covost
common_voice_en_18606942.mp3	I have full confidence in your capabilities.	0feb9485d2bebbd308c68f8618b70d780d750208d04afd768400a369f2d239c0f0f5c32d6face1cebf2e1bb2dc073b60c83cf0d44f67048351fdfd2eb1914ae6	저는 여러분의 역량을 전적으로 신뢰합니다.	train_covost
common_voice_en_18606943.mp3	We must all agree in that.	0feb9485d2bebbd308c68f8618b70d780d750208d04afd768400a369f2d239c0f0f5c32d6face1cebf2e1bb2dc073b60c83cf0d44f67048351fdfd2eb1914ae6	우리 모두는 그 점에 동의해야 합니다.	train
common_voice_en_18606945.mp3	The material is non-porous.	0feb9485d2bebbd308c68f8618b70d780d750208d04afd768400a369f2d239c0f0f5c32d6face1cebf2e1bb2dc073b60c83cf0d44f67048351fdfd2eb1914ae6	소재는 비다공성입니다.	train_covost
common_voice_en_18606946.mp3	It is, then, something belonging to her.	0feb9485d2bebbd308c68f8618b70d780d750208d04afd768400a369f2d239c0f0f5c32d6face1cebf2e1bb2dc073b60c83cf0d44f67048351fdfd2eb1914ae6	그렇다면 그것은 그녀에게 속한 무언가입니다.	train_covost
common_voice_en_18606947.mp3	The branches bent down and twined around him.	0feb9485d2bebbd308c68f8618b70d780d750208d04afd768400a369f2d239c0f0f5c32d6face1cebf2e1bb2dc073b60c83cf0d44f67048351fdfd2eb1914ae6	나뭇가지가 구부러져 그의 주위를 감쌌습니다.	train_covost
common_voice_en_18606948.mp3	The executive summary was littered with grammatical errors.	0feb9485d2bebbd308c68f8618b70d780d750208d04afd768400a369f2d239c0f0f5c32d6face1cebf2e1bb2dc073b60c83cf0d44f67048351fdfd2eb1914ae6	요약본은 문법 오류로 가득 차 있었습니다.	train_covost
common_voice_en_18606949.mp3	Then, feeling queenly, she showed Paul how to blanch almonds.	0feb9485d2bebbd308c68f8618b70d780d750208d04afd768400a369f2d239c0f0f5c32d6face1cebf2e1bb2dc073b60c83cf0d44f67048351fdfd2eb1914ae6	그런 다음 여왕처럼 기분이 좋아진 그녀는 폴에게 아몬드 데치는 방법을 알려주었습니다.	train_covost
common_voice_en_18606950.mp3	"Can't you see it?"	0feb9485d2bebbd308c68f8618b70d780d750208d04afd768400a369f2d239c0f0f5c32d6face1cebf2e1bb2dc073b60c83cf0d44f67048351fdfd2eb1914ae6	보이지 않나요?	train
common_voice_en_18606951.mp3	He sprang up from his chair.	0feb9485d2bebbd308c68f8618b70d780d750208d04afd768400a369f2d239c0f0f5c32d6face1cebf2e1bb2dc073b60c83cf0d44f67048351fdfd2eb1914ae6	그는 의자에서 벌떡 일어났습니다.	train
common_voice_en_18606952.mp3	Who is your employer?	0feb9485d2bebbd308c68f8618b70d780d750208d04afd768400a369f2d239c0f0f5c32d6face1cebf2e1bb2dc073b60c83cf0d44f67048351fdfd2eb1914ae6	고용주는 누구인가요?	train
common_voice_en_18606953.mp3	Our system is ethically designed to minimize any unintended impacts.	0feb9485d2bebbd308c68f8618b70d780d750208d04afd768400a369f2d239c0f0f5c32d6face1cebf2e1bb2dc073b60c83cf0d44f67048351fdfd2eb1914ae6	저희 시스템은 의도하지 않은 영향을 최소화하도록 윤리적으로 설계되었습니다.	train
common_voice_en_18606954.mp3	The declining number of residents is leaving a massive deficit for the council.	0feb9485d2bebbd308c68f8618b70d780d750208d04afd768400a369f2d239c0f0f5c32d6face1cebf2e1bb2dc073b60c83cf0d44f67048351fdfd2eb1914ae6	주민 수가 감소하면서 의회에 막대한 적자가 발생하고 있습니다.	train_covost
common_voice_en_18606955.mp3	A dark flush overspread his face.	0feb9485d2bebbd308c68f8618b70d780d750208d04afd768400a369f2d239c0f0f5c32d6face1cebf2e1bb2dc073b60c83cf0d44f67048351fdfd2eb1914ae6	얼굴에 짙은 홍조가 퍼졌습니다.	train_covost
