path	sentence	client_id	translation	split
common_voice_en_18451588.mp3	They only lifted seven hundred and fifty.	5cd95c7c22c6fd21f386f93b700187d1559ab9a63eab1b44b4af4717e61bee61dbf54a0de0d35e3014a441bc557f5a0a4d36ad4e3a815d4bd3c395c9e98daade	그들은 겨우 7백 50개를 들어 올렸습니다.	train_covost
common_voice_en_18451591.mp3	Outwardly, he maintained a calm and smiling aspect.	5cd95c7c22c6fd21f386f93b700187d1559ab9a63eab1b44b4af4717e61bee61dbf54a0de0d35e3014a441bc557f5a0a4d36ad4e3a815d4bd3c395c9e98daade	겉으로는 침착하고 웃는 모습을 유지했습니다.	train_covost
common_voice_en_18451594.mp3	The scientists were investigating extreme temperature events.	5cd95c7c22c6fd21f386f93b700187d1559ab9a63eab1b44b4af4717e61bee61dbf54a0de0d35e3014a441bc557f5a0a4d36ad4e3a815d4bd3c395c9e98daade	과학자들은 극한 기온 현상을 조사하고 있었습니다.	train_covost
common_voice_en_18451621.mp3	The demonstration turned violent, and ended in a huge punch-up	5cd95c7c22c6fd21f386f93b700187d1559ab9a63eab1b44b4af4717e61bee61dbf54a0de0d35e3014a441bc557f5a0a4d36ad4e3a815d4bd3c395c9e98daade	시위는 폭력적으로 변했고, 결국 큰 충돌로 끝났습니다.	train_covost
common_voice_en_18451622.mp3	He advised throwing in the towel.	5cd95c7c22c6fd21f386f93b700187d1559ab9a63eab1b44b4af4717e61bee61dbf54a0de0d35e3014a441bc557f5a0a4d36ad4e3a815d4bd3c395c9e98daade	그는 포기하는 것이 좋다고 조언했습니다.	train_covost
common_voice_en_18451624.mp3	And each year something happened, and I did not go.	5cd95c7c22c6fd21f386f93b700187d1559ab9a63eab1b44b4af4717e61bee61dbf54a0de0d35e3014a441bc557f5a0a4d36ad4e3a815d4bd3c395c9e98daade	그리고 매년 무슨 일이 일어났고 저는 가지 않았습니다.	train_covost
common_voice_en_18451645.mp3	Scientists believe that life on Earth started more than four billion years ago	5cd95c7c22c6fd21f386f93b700187d1559ab9a63eab1b44b4af4717e61bee61dbf54a0de0d35e3014a441bc557f5a0a4d36ad4e3a815d4bd3c395c9e98daade	과학자들은 지구의 생명체가 40억 년 전에 시작되었다고 믿습니다.	train_covost
common_voice_en_18451646.mp3	He also contended that better confidence was established by carrying no weapons.	5cd95c7c22c6fd21f386f93b700187d1559ab9a63eab1b44b4af4717e61bee61dbf54a0de0d35e3014a441bc557f5a0a4d36ad4e3a815d4bd3c395c9e98daade	그는 또한 무기를 소지하지 않음으로써 더 나은 신뢰를 구축할 수 있다고 주장했습니다.	train_covost
common_voice_en_18451647.mp3	But he no longer cared quite so much for that form of diversion.	5cd95c7c22c6fd21f386f93b700187d1559ab9a63eab1b44b4af4717e61bee61dbf54a0de0d35e3014a441bc557f5a0a4d36ad4e3a815d4bd3c395c9e98daade	하지만 그는 더 이상 그런 형태의 기분 전환에 그다지 신경 쓰지 않았습니다.	train_covost
common_voice_en_18451648.mp3	"I'll look on Github for support."	5cd95c7c22c6fd21f386f93b700187d1559ab9a63eab1b44b4af4717e61bee61dbf54a0de0d35e3014a441bc557f5a0a4d36ad4e3a815d4bd3c395c9e98daade	Github에서 지원을 찾아보겠습니다.	train_covost
common_voice_en_18451649.mp3	"The hotel has a pool, so don't forget to pack your swimming costume"	5cd95c7c22c6fd21f386f93b700187d1559ab9a63eab1b44b4af4717e61bee61dbf54a0de0d35e3014a441bc557f5a0a4d36ad4e3a815d4bd3c395c9e98daade	호텔에는 수영장이 있으니 수영복을 챙기는 것을 잊지 마세요.	train_covost
common_voice_en_18451675.mp3	A little before dawn of the day following, the fire relief came.	5cd95c7c22c6fd21f386f93b700187d1559ab9a63eab1b44b4af4717e61bee61dbf54a0de0d35e3014a441bc557f5a0a4d36ad4e3a815d4bd3c395c9e98daade	다음 날 새벽이 조금 지나서야 화재 구호대가 도착했습니다.	train_covost
common_voice_en_18451676.mp3	Not very quick.	5cd95c7c22c6fd21f386f93b700187d1559ab9a63eab1b44b4af4717e61bee61dbf54a0de0d35e3014a441bc557f5a0a4d36ad4e3a815d4bd3c395c9e98daade	그렇게 빠르지는 않습니다.	train_covost
common_voice_en_18451677.mp3	The Indian felt the worship of her warm in his heart.	5cd95c7c22c6fd21f386f93b700187d1559ab9a63eab1b44b4af4717e61bee61dbf54a0de0d35e3014a441bc557f5a0a4d36ad4e3a815d4bd3c395c9e98daade	인디언은 그녀에 대한 숭배가 마음속에서 따뜻하게 느껴졌습니다.	train_covost
common_voice_en_18451679.mp3	In spite of their absurdity the words affected Philip curiously.	5cd95c7c22c6fd21f386f93b700187d1559ab9a63eab1b44b4af4717e61bee61dbf54a0de0d35e3014a441bc557f5a0a4d36ad4e3a815d4bd3c395c9e98daade	터무니없는 말임에도 불구하고 필립은 신기하게도 그 말에 영향을 받았습니다.	train_covost
common_voice_en_18451690.mp3	His blood grew hot with rage at the thought.	5cd95c7c22c6fd21f386f93b700187d1559ab9a63eab1b44b4af4717e61bee61dbf54a0de0d35e3014a441bc557f5a0a4d36ad4e3a815d4bd3c395c9e98daade	그 생각에 그의 피는 분노로 뜨거워졌습니다.	train_covost
common_voice_en_18451691.mp3	Get down and dig in.	5cd95c7c22c6fd21f386f93b700187d1559ab9a63eab1b44b4af4717e61bee61dbf54a0de0d35e3014a441bc557f5a0a4d36ad4e3a815d4bd3c395c9e98daade	내려와서 자세히 살펴보세요.	train_covost
common_voice_en_18451692.mp3	I need to post this letter. Is there a postbox nearby?	5cd95c7c22c6fd21f386f93b700187d1559ab9a63eab1b44b4af4717e61bee61dbf54a0de0d35e3014a441bc557f5a0a4d36ad4e3a815d4bd3c395c9e98daade	이 편지를 우편으로 보내야 합니다. 근처에 우체통이 있나요?	train_covost
common_voice_en_18451693.mp3	They do not know the length of time of incubation.	5cd95c7c22c6fd21f386f93b700187d1559ab9a63eab1b44b4af4717e61bee61dbf54a0de0d35e3014a441bc557f5a0a4d36ad4e3a815d4bd3c395c9e98daade	그들은 잠복기를 알지 못합니다.	train_covost
common_voice_en_18451725.mp3	Am I loud enough, or do I need a loudhailer?	5cd95c7c22c6fd21f386f93b700187d1559ab9a63eab1b44b4af4717e61bee61dbf54a0de0d35e3014a441bc557f5a0a4d36ad4e3a815d4bd3c395c9e98daade	내가 충분히 시끄러운가요, 아니면 확성기가 필요한가요?	train_covost
common_voice_en_18451727.mp3	She wears woollen clothes or natural fibres such as silk, cotton or linen.	5cd95c7c22c6fd21f386f93b700187d1559ab9a63eab1b44b4af4717e61bee61dbf54a0de0d35e3014a441bc557f5a0a4d36ad4e3a815d4bd3c395c9e98daade	그녀는 모직 옷이나 실크, 면, 린넨과 같은 천연 섬유를 입습니다.	train_covost
common_voice_en_18451728.mp3	A crotchet, pronounced with the t, is equivalent to a quarter note	5cd95c7c22c6fd21f386f93b700187d1559ab9a63eab1b44b4af4717e61bee61dbf54a0de0d35e3014a441bc557f5a0a4d36ad4e3a815d4bd3c395c9e98daade	T로 발음되는 크로셰는 4분의 1음표에 해당합니다.	train_covost
common_voice_en_18451729.mp3	You can see thousands of stars with the naked eye in the night sky?	5cd95c7c22c6fd21f386f93b700187d1559ab9a63eab1b44b4af4717e61bee61dbf54a0de0d35e3014a441bc557f5a0a4d36ad4e3a815d4bd3c395c9e98daade	밤하늘에서 육안으로 수천 개의 별을 볼 수 있나요?	train_covost
common_voice_en_18451750.mp3	The python programming language has become very popular nowadays	5cd95c7c22c6fd21f386f93b700187d1559ab9a63eab1b44b4af4717e61bee61dbf54a0de0d35e3014a441bc557f5a0a4d36ad4e3a815d4bd3c395c9e98daade	파이썬 프로그래밍 언어는 요즘 매우 인기가 있습니다.	train_covost
common_voice_en_18451751.mp3	"I'm not sure; I think the chances are about fifty-fifty"	5cd95c7c22c6fd21f386f93b700187d1559ab9a63eab1b44b4af4717e61bee61dbf54a0de0d35e3014a441bc557f5a0a4d36ad4e3a815d4bd3c395c9e98daade	잘 모르겠습니다. 확률은 반반 정도인 것 같습니다.	train_covost
common_voice_en_18451752.mp3	He confessed that the sketch had startled him.	5cd95c7c22c6fd21f386f93b700187d1559ab9a63eab1b44b4af4717e61bee61dbf54a0de0d35e3014a441bc557f5a0a4d36ad4e3a815d4bd3c395c9e98daade	그는 그 스케치가 자신을 놀라게 했다고 고백했습니다.	train_covost
common_voice_en_18451753.mp3	Many families go to church on Sunday mornings.	5cd95c7c22c6fd21f386f93b700187d1559ab9a63eab1b44b4af4717e61bee61dbf54a0de0d35e3014a441bc557f5a0a4d36ad4e3a815d4bd3c395c9e98daade	일요일 아침에는 많은 가족이 교회에 갑니다.	train_covost
common_voice_en_18451770.mp3	"I'd sooner have my chips back."	5cd95c7c22c6fd21f386f93b700187d1559ab9a63eab1b44b4af4717e61bee61dbf54a0de0d35e3014a441bc557f5a0a4d36ad4e3a815d4bd3c395c9e98daade	빨리 칩을 돌려받고 싶어요.	train_covost
common_voice_en_18451772.mp3	"What's the date?"	5cd95c7c22c6fd21f386f93b700187d1559ab9a63eab1b44b4af4717e61bee61dbf54a0de0d35e3014a441bc557f5a0a4d36ad4e3a815d4bd3c395c9e98daade	날짜가 언제인가요?	train_covost
common_voice_en_18451773.mp3	I have been robbed, sir, I amended.	5cd95c7c22c6fd21f386f93b700187d1559ab9a63eab1b44b4af4717e61bee61dbf54a0de0d35e3014a441bc557f5a0a4d36ad4e3a815d4bd3c395c9e98daade	강도를 당했습니다, 수정했습니다.	train_covost
common_voice_en_18451804.mp3	Not feeling fab at the moment.	5cd95c7c22c6fd21f386f93b700187d1559ab9a63eab1b44b4af4717e61bee61dbf54a0de0d35e3014a441bc557f5a0a4d36ad4e3a815d4bd3c395c9e98daade	지금은 기분이 좋지 않습니다.	train_covost
common_voice_en_18451806.mp3	I want to learn Zoology.	5cd95c7c22c6fd21f386f93b700187d1559ab9a63eab1b44b4af4717e61bee61dbf54a0de0d35e3014a441bc557f5a0a4d36ad4e3a815d4bd3c395c9e98daade	동물학을 배우고 싶어요.	train_covost
common_voice_en_18451809.mp3	"Life is very sad, isn't it?"	5cd95c7c22c6fd21f386f93b700187d1559ab9a63eab1b44b4af4717e61bee61dbf54a0de0d35e3014a441bc557f5a0a4d36ad4e3a815d4bd3c395c9e98daade	인생은 참 슬프죠, 그렇죠?	train_covost
common_voice_en_18451828.mp3	‘Serpent!’ screamed the Pigeon.	5cd95c7c22c6fd21f386f93b700187d1559ab9a63eab1b44b4af4717e61bee61dbf54a0de0d35e3014a441bc557f5a0a4d36ad4e3a815d4bd3c395c9e98daade	'뱀!' 비둘기가 소리쳤습니다.	train_covost
common_voice_en_18451829.mp3	My father was a Squadron Leader in the Air Force	5cd95c7c22c6fd21f386f93b700187d1559ab9a63eab1b44b4af4717e61bee61dbf54a0de0d35e3014a441bc557f5a0a4d36ad4e3a815d4bd3c395c9e98daade	아버지는 공군 편대장이었습니다.	train_covost
common_voice_en_18451831.mp3	"His eyes never took themselves for an instant from his companion's face."	5cd95c7c22c6fd21f386f93b700187d1559ab9a63eab1b44b4af4717e61bee61dbf54a0de0d35e3014a441bc557f5a0a4d36ad4e3a815d4bd3c395c9e98daade	그의 눈은 동료의 얼굴에서 한순간도 눈을 떼지 않았습니다.	train_covost
common_voice_en_18451875.mp3	Check the calorimeter.	5cd95c7c22c6fd21f386f93b700187d1559ab9a63eab1b44b4af4717e61bee61dbf54a0de0d35e3014a441bc557f5a0a4d36ad4e3a815d4bd3c395c9e98daade	칼로리계를 확인합니다.	train_covost
common_voice_en_18451876.mp3	"It's just a camera, take a closer look and you'll see for yourself."	5cd95c7c22c6fd21f386f93b700187d1559ab9a63eab1b44b4af4717e61bee61dbf54a0de0d35e3014a441bc557f5a0a4d36ad4e3a815d4bd3c395c9e98daade	그냥 카메라일 뿐이니 자세히 살펴보면 직접 확인하실 수 있습니다.	train_covost
common_voice_en_18451878.mp3	If you can afford it, take a taxi rather than a bus	5cd95c7c22c6fd21f386f93b700187d1559ab9a63eab1b44b4af4717e61bee61dbf54a0de0d35e3014a441bc557f5a0a4d36ad4e3a815d4bd3c395c9e98daade	여유가 있다면 버스보다는 택시를 이용하세요.	train_covost
common_voice_en_18451879.mp3	Your face was the personification of duplicity.	5cd95c7c22c6fd21f386f93b700187d1559ab9a63eab1b44b4af4717e61bee61dbf54a0de0d35e3014a441bc557f5a0a4d36ad4e3a815d4bd3c395c9e98daade	당신의 얼굴은 이중성의 화신이었어요.	train_covost
common_voice_en_18451890.mp3	He had picked up most of his collection second-hand, at car boot sales	5cd95c7c22c6fd21f386f93b700187d1559ab9a63eab1b44b4af4717e61bee61dbf54a0de0d35e3014a441bc557f5a0a4d36ad4e3a815d4bd3c395c9e98daade	그는 대부분의 컬렉션을 중고품 판매점에서 중고로 구입했습니다.	train_covost
common_voice_en_18451891.mp3	The award should go to the one who has tried hardest.	5cd95c7c22c6fd21f386f93b700187d1559ab9a63eab1b44b4af4717e61bee61dbf54a0de0d35e3014a441bc557f5a0a4d36ad4e3a815d4bd3c395c9e98daade	이 상은 가장 열심히 노력한 사람에게 주어져야 합니다.	train_covost
common_voice_en_18451893.mp3	Mardi Gras is an extravagant event every spring in New Orleans.	5cd95c7c22c6fd21f386f93b700187d1559ab9a63eab1b44b4af4717e61bee61dbf54a0de0d35e3014a441bc557f5a0a4d36ad4e3a815d4bd3c395c9e98daade	마디 그라는 매년 봄 뉴올리언스에서 열리는 화려한 행사입니다.	train_covost
common_voice_en_18451894.mp3	Whoever lived on the ranch did that.	5cd95c7c22c6fd21f386f93b700187d1559ab9a63eab1b44b4af4717e61bee61dbf54a0de0d35e3014a441bc557f5a0a4d36ad4e3a815d4bd3c395c9e98daade	목장에 살던 사람이 그렇게 했습니다.	train_covost
common_voice_en_18451905.mp3	The correct pronunciation is.	5cd95c7c22c6fd21f386f93b700187d1559ab9a63eab1b44b4af4717e61bee61dbf54a0de0d35e3014a441bc557f5a0a4d36ad4e3a815d4bd3c395c9e98daade	정확한 발음은 다음과 같습니다.	train_covost
common_voice_en_18451906.mp3	A professional babysitter is often known as a childminder	5cd95c7c22c6fd21f386f93b700187d1559ab9a63eab1b44b4af4717e61bee61dbf54a0de0d35e3014a441bc557f5a0a4d36ad4e3a815d4bd3c395c9e98daade	전문 베이비시터는 흔히 보모로 알려져 있습니다.	train_covost
common_voice_en_18451908.mp3	Together they ate the rabbit.	5cd95c7c22c6fd21f386f93b700187d1559ab9a63eab1b44b4af4717e61bee61dbf54a0de0d35e3014a441bc557f5a0a4d36ad4e3a815d4bd3c395c9e98daade	그들은 함께 토끼를 먹었습니다.	train_covost
common_voice_en_18451920.mp3	Your tone shocks me.	5cd95c7c22c6fd21f386f93b700187d1559ab9a63eab1b44b4af4717e61bee61dbf54a0de0d35e3014a441bc557f5a0a4d36ad4e3a815d4bd3c395c9e98daade	당신의 어조는 저에게 충격을 주었습니다.	train_covost
common_voice_en_18451921.mp3	Which English author wrote a series of twenty-one novels?	5cd95c7c22c6fd21f386f93b700187d1559ab9a63eab1b44b4af4717e61bee61dbf54a0de0d35e3014a441bc557f5a0a4d36ad4e3a815d4bd3c395c9e98daade	21편의 소설 시리즈를 쓴 영국 작가는 누구인가요?	train_covost
common_voice_en_18451922.mp3	The score is deuce.	5cd95c7c22c6fd21f386f93b700187d1559ab9a63eab1b44b4af4717e61bee61dbf54a0de0d35e3014a441bc557f5a0a4d36ad4e3a815d4bd3c395c9e98daade	점수는 듀스입니다.	train_covost
common_voice_en_18451923.mp3	I am going to surprise father, and you will go with Pierre.	5cd95c7c22c6fd21f386f93b700187d1559ab9a63eab1b44b4af4717e61bee61dbf54a0de0d35e3014a441bc557f5a0a4d36ad4e3a815d4bd3c395c9e98daade	나는 아버지를 깜짝 놀라게 할 테니 넌 피에르와 함께 가자.	train_covost
common_voice_en_18451924.mp3	Half the married men you meet began by talking about the sunset.	5cd95c7c22c6fd21f386f93b700187d1559ab9a63eab1b44b4af4717e61bee61dbf54a0de0d35e3014a441bc557f5a0a4d36ad4e3a815d4bd3c395c9e98daade	당신이 만나는 기혼 남성의 절반은 일몰에 대해 이야기하기 시작합니다.	train_covost
common_voice_en_18451956.mp3	My favourite operatic composers are Handel, Mozart and Puccini	5cd95c7c22c6fd21f386f93b700187d1559ab9a63eab1b44b4af4717e61bee61dbf54a0de0d35e3014a441bc557f5a0a4d36ad4e3a815d4bd3c395c9e98daade	제가 가장 좋아하는 오페라 작곡가는 헨델, 모차르트, 푸치니입니다.	train_covost
common_voice_en_18451957.mp3	All good things come to an end.	5cd95c7c22c6fd21f386f93b700187d1559ab9a63eab1b44b4af4717e61bee61dbf54a0de0d35e3014a441bc557f5a0a4d36ad4e3a815d4bd3c395c9e98daade	모든 좋은 일에는 끝이 있습니다.	train_covost
common_voice_en_18451958.mp3	To fix a poster to a noticeboard you should use a drawing pin	5cd95c7c22c6fd21f386f93b700187d1559ab9a63eab1b44b4af4717e61bee61dbf54a0de0d35e3014a441bc557f5a0a4d36ad4e3a815d4bd3c395c9e98daade	포스터를 게시판에 고정하려면 드로잉 핀을 사용해야 합니다.	train_covost
common_voice_en_18451959.mp3	He was smooth-shaven, and his hair and eyes were black.	5cd95c7c22c6fd21f386f93b700187d1559ab9a63eab1b44b4af4717e61bee61dbf54a0de0d35e3014a441bc557f5a0a4d36ad4e3a815d4bd3c395c9e98daade	그는 깔끔하게 면도했고 머리와 눈은 검은색이었습니다.	train_covost
common_voice_en_18451965.mp3	How do I go about preparing asparagus?	5cd95c7c22c6fd21f386f93b700187d1559ab9a63eab1b44b4af4717e61bee61dbf54a0de0d35e3014a441bc557f5a0a4d36ad4e3a815d4bd3c395c9e98daade	아스파라거스는 어떻게 준비하나요?	train_covost
common_voice_en_18451966.mp3	Stephen caught a huge pike yesterday	5cd95c7c22c6fd21f386f93b700187d1559ab9a63eab1b44b4af4717e61bee61dbf54a0de0d35e3014a441bc557f5a0a4d36ad4e3a815d4bd3c395c9e98daade	스티븐이 어제 큰 파이크를 잡았습니다.	train_covost
common_voice_en_18451967.mp3	Everybody carries a mobile phone nowadays	5cd95c7c22c6fd21f386f93b700187d1559ab9a63eab1b44b4af4717e61bee61dbf54a0de0d35e3014a441bc557f5a0a4d36ad4e3a815d4bd3c395c9e98daade	요즘은 누구나 휴대전화를 가지고 다닙니다.	train_covost
common_voice_en_18451968.mp3	The ticket tout was illegally selling Centre Court tickets for Wimbledon	5cd95c7c22c6fd21f386f93b700187d1559ab9a63eab1b44b4af4717e61bee61dbf54a0de0d35e3014a441bc557f5a0a4d36ad4e3a815d4bd3c395c9e98daade	윔블던 센터 코트 티켓을 불법으로 판매한 티켓 판매원	train_covost
common_voice_en_18451969.mp3	"From now on we're pals."	5cd95c7c22c6fd21f386f93b700187d1559ab9a63eab1b44b4af4717e61bee61dbf54a0de0d35e3014a441bc557f5a0a4d36ad4e3a815d4bd3c395c9e98daade	이제부터 우리는 친구입니다.	train_covost
common_voice_en_18451975.mp3	"We're out of sellotape."	5cd95c7c22c6fd21f386f93b700187d1559ab9a63eab1b44b4af4717e61bee61dbf54a0de0d35e3014a441bc557f5a0a4d36ad4e3a815d4bd3c395c9e98daade	셀로테이프가 다 떨어졌습니다.	train_covost
common_voice_en_18451976.mp3	Our genetics define our appearances and traits. Our experiences define who we are.	5cd95c7c22c6fd21f386f93b700187d1559ab9a63eab1b44b4af4717e61bee61dbf54a0de0d35e3014a441bc557f5a0a4d36ad4e3a815d4bd3c395c9e98daade	우리의 유전자는 우리의 외모와 특성을 정의합니다. 우리의 경험은 우리가 누구인지 정의합니다.	train_covost
common_voice_en_18451977.mp3	The singing voice approached rapidly.	5cd95c7c22c6fd21f386f93b700187d1559ab9a63eab1b44b4af4717e61bee61dbf54a0de0d35e3014a441bc557f5a0a4d36ad4e3a815d4bd3c395c9e98daade	노래하는 목소리가 빠르게 다가왔습니다.	train_covost
common_voice_en_18451978.mp3	She loved science, and at school physics and mathematics were her favourite subjects	5cd95c7c22c6fd21f386f93b700187d1559ab9a63eab1b44b4af4717e61bee61dbf54a0de0d35e3014a441bc557f5a0a4d36ad4e3a815d4bd3c395c9e98daade	그녀는 과학을 좋아했고, 학교에서는 물리학과 수학이 가장 좋아하는 과목이었습니다.	train_covost
common_voice_en_18451979.mp3	Now have you got anything to say against me, Mr Philip.	5cd95c7c22c6fd21f386f93b700187d1559ab9a63eab1b44b4af4717e61bee61dbf54a0de0d35e3014a441bc557f5a0a4d36ad4e3a815d4bd3c395c9e98daade	이제 저에 대해 하실 말씀이 있으신가요, 필립 씨?	train_covost
common_voice_en_18451991.mp3	"I'm not your personal butler, Jake."	5cd95c7c22c6fd21f386f93b700187d1559ab9a63eab1b44b4af4717e61bee61dbf54a0de0d35e3014a441bc557f5a0a4d36ad4e3a815d4bd3c395c9e98daade	저는 여러분의 개인 집사가 아닙니다, 제이크.	train_covost
common_voice_en_18451992.mp3	New York City is a bustling metropolis.	5cd95c7c22c6fd21f386f93b700187d1559ab9a63eab1b44b4af4717e61bee61dbf54a0de0d35e3014a441bc557f5a0a4d36ad4e3a815d4bd3c395c9e98daade	뉴욕은 분주한 대도시입니다.	train_covost
common_voice_en_18451993.mp3	Also, at regular intervals, he would mutter.	5cd95c7c22c6fd21f386f93b700187d1559ab9a63eab1b44b4af4717e61bee61dbf54a0de0d35e3014a441bc557f5a0a4d36ad4e3a815d4bd3c395c9e98daade	또한 일정한 간격으로 중얼거리기도 했습니다.	train_covost
common_voice_en_18452000.mp3	There are four, all low, McCoy answered.	5cd95c7c22c6fd21f386f93b700187d1559ab9a63eab1b44b4af4717e61bee61dbf54a0de0d35e3014a441bc557f5a0a4d36ad4e3a815d4bd3c395c9e98daade	맥코이는 네 가지가 있는데 모두 낮다고 대답했습니다.	train_covost
common_voice_en_18452001.mp3	So we could have some respite.	5cd95c7c22c6fd21f386f93b700187d1559ab9a63eab1b44b4af4717e61bee61dbf54a0de0d35e3014a441bc557f5a0a4d36ad4e3a815d4bd3c395c9e98daade	그래서 잠시 휴식을 취할 수 있었습니다.	train_covost
common_voice_en_18452002.mp3	Two years ago I gave up civilization for this.	5cd95c7c22c6fd21f386f93b700187d1559ab9a63eab1b44b4af4717e61bee61dbf54a0de0d35e3014a441bc557f5a0a4d36ad4e3a815d4bd3c395c9e98daade	2년 전 저는 이를 위해 문명을 포기했습니다.	train_covost
common_voice_en_18452004.mp3	I thought that her new novel was absolutely hopeless. Complete rubbish	5cd95c7c22c6fd21f386f93b700187d1559ab9a63eab1b44b4af4717e61bee61dbf54a0de0d35e3014a441bc557f5a0a4d36ad4e3a815d4bd3c395c9e98daade	저는 그녀의 새 소설이 완전히 절망적이라고 생각했습니다. 완전한 쓰레기	train_covost
common_voice_en_18452010.mp3	"There's Fort Churchill, a rifle-shot beyond the ridge, asleep."	5cd95c7c22c6fd21f386f93b700187d1559ab9a63eab1b44b4af4717e61bee61dbf54a0de0d35e3014a441bc557f5a0a4d36ad4e3a815d4bd3c395c9e98daade	산등성이 너머에 소총을 쏘며 잠들어 있는 처칠 요새가 있습니다.	train_covost
common_voice_en_18452012.mp3	"It's that much junk."	5cd95c7c22c6fd21f386f93b700187d1559ab9a63eab1b44b4af4717e61bee61dbf54a0de0d35e3014a441bc557f5a0a4d36ad4e3a815d4bd3c395c9e98daade	그만큼 쓰레기가 많습니다.	train_covost
common_voice_en_18452013.mp3	I would love to take the car for a test drive.	5cd95c7c22c6fd21f386f93b700187d1559ab9a63eab1b44b4af4717e61bee61dbf54a0de0d35e3014a441bc557f5a0a4d36ad4e3a815d4bd3c395c9e98daade	차를 시승해보고 싶어요.	train_covost
common_voice_en_18452014.mp3	In such a tumbling of values was no time to sell.	5cd95c7c22c6fd21f386f93b700187d1559ab9a63eab1b44b4af4717e61bee61dbf54a0de0d35e3014a441bc557f5a0a4d36ad4e3a815d4bd3c395c9e98daade	이렇게 가치가 폭락하는 상황에서는 판매할 시간이 없었습니다.	train_covost
common_voice_en_18488874.mp3	Baked chicken nuggets, with ice cream.	5cd95c7c22c6fd21f386f93b700187d1559ab9a63eab1b44b4af4717e61bee61dbf54a0de0d35e3014a441bc557f5a0a4d36ad4e3a815d4bd3c395c9e98daade	아이스크림을 곁들인 구운 치킨 너겟.	train_covost
common_voice_en_18488875.mp3	He went down in midstream, searching the shadows of both shores.	5cd95c7c22c6fd21f386f93b700187d1559ab9a63eab1b44b4af4717e61bee61dbf54a0de0d35e3014a441bc557f5a0a4d36ad4e3a815d4bd3c395c9e98daade	그는 양쪽 해안의 그림자를 찾으며 강 중간으로 내려갔습니다.	train_covost
common_voice_en_18488876.mp3	Philip knew that she was not an Indian.	5cd95c7c22c6fd21f386f93b700187d1559ab9a63eab1b44b4af4717e61bee61dbf54a0de0d35e3014a441bc557f5a0a4d36ad4e3a815d4bd3c395c9e98daade	필립은 그녀가 인도인이 아니라는 것을 알고 있었습니다.	train_covost
common_voice_en_18488877.mp3	Such is my passage engaged on the steamer.	5cd95c7c22c6fd21f386f93b700187d1559ab9a63eab1b44b4af4717e61bee61dbf54a0de0d35e3014a441bc557f5a0a4d36ad4e3a815d4bd3c395c9e98daade	찜통에 걸린 제 통로입니다.	train_covost
common_voice_en_18488878.mp3	There are many different versions of Santa Claus, including Father Christmas from England	5cd95c7c22c6fd21f386f93b700187d1559ab9a63eab1b44b4af4717e61bee61dbf54a0de0d35e3014a441bc557f5a0a4d36ad4e3a815d4bd3c395c9e98daade	영국에서 온 산타클로스 등 다양한 버전의 산타클로스가 있습니다.	train_covost
common_voice_en_18488917.mp3	"When I'm buying a guitar I tend to just fiddle with lots until I find one I really like."	5cd95c7c22c6fd21f386f93b700187d1559ab9a63eab1b44b4af4717e61bee61dbf54a0de0d35e3014a441bc557f5a0a4d36ad4e3a815d4bd3c395c9e98daade	저는 기타를 살 때 마음에 드는 기타를 찾을 때까지 여러 대를 만지작거리는 편입니다.	train_covost
common_voice_en_18488926.mp3	"Keith's mouth formed a large O in surprise."	5cd95c7c22c6fd21f386f93b700187d1559ab9a63eab1b44b4af4717e61bee61dbf54a0de0d35e3014a441bc557f5a0a4d36ad4e3a815d4bd3c395c9e98daade	키스의 입이 놀란 듯 큰 O자 모양을 만들었습니다.	train_covost
common_voice_en_18488927.mp3	Philip thrust himself against it and entered.	5cd95c7c22c6fd21f386f93b700187d1559ab9a63eab1b44b4af4717e61bee61dbf54a0de0d35e3014a441bc557f5a0a4d36ad4e3a815d4bd3c395c9e98daade	필립은 몸을 밀치며 그 안으로 들어갔습니다.	train_covost
common_voice_en_18488944.mp3	Please clear your browser cache and try again.	5cd95c7c22c6fd21f386f93b700187d1559ab9a63eab1b44b4af4717e61bee61dbf54a0de0d35e3014a441bc557f5a0a4d36ad4e3a815d4bd3c395c9e98daade	브라우저 캐시를 지우고 다시 시도하세요.	train_covost
common_voice_en_18488945.mp3	I use great trouble advisedly.	5cd95c7c22c6fd21f386f93b700187d1559ab9a63eab1b44b4af4717e61bee61dbf54a0de0d35e3014a441bc557f5a0a4d36ad4e3a815d4bd3c395c9e98daade	저는 큰 문제를 신중하게 사용합니다.	train_covost
common_voice_en_18488946.mp3	But all my dreams violated this law.	5cd95c7c22c6fd21f386f93b700187d1559ab9a63eab1b44b4af4717e61bee61dbf54a0de0d35e3014a441bc557f5a0a4d36ad4e3a815d4bd3c395c9e98daade	하지만 제 모든 꿈은 이 법을 위반했습니다.	train_covost
common_voice_en_18488947.mp3	Read my bio for more info.	5cd95c7c22c6fd21f386f93b700187d1559ab9a63eab1b44b4af4717e61bee61dbf54a0de0d35e3014a441bc557f5a0a4d36ad4e3a815d4bd3c395c9e98daade	자세한 내용은 내 약력을 참조하세요.	train_covost
common_voice_en_18488948.mp3	He came back nicely and carried on.	5cd95c7c22c6fd21f386f93b700187d1559ab9a63eab1b44b4af4717e61bee61dbf54a0de0d35e3014a441bc557f5a0a4d36ad4e3a815d4bd3c395c9e98daade	그는 멋지게 돌아와서 계속 진행했습니다.	train_covost
