path	sentence	client_id	translation	split
common_voice_en_19704370.mp3	The county courthouse was abandoned, thus beginning about five years of Liberal Party rule.	74491ccd3495e209ddd31169484962be9536d4e4861cd2cf8eecba0cc90549aa42b1e3b88baedd6a5e231f1580f0b656d378ba61130bc91a960034b174260ceb	카운티 법원은 버려졌고, 이로써 약 5년간의 자유당 통치가 시작되었습니다.	train
common_voice_en_19704373.mp3	Howman appeared as the character Buster Briggs.	74491ccd3495e209ddd31169484962be9536d4e4861cd2cf8eecba0cc90549aa42b1e3b88baedd6a5e231f1580f0b656d378ba61130bc91a960034b174260ceb	하우먼은 버스터 브릭스 캐릭터로 등장했습니다.	train
common_voice_en_19704377.mp3	After the meal, the passengers rejoin the train for the return journey to Belgrave.	74491ccd3495e209ddd31169484962be9536d4e4861cd2cf8eecba0cc90549aa42b1e3b88baedd6a5e231f1580f0b656d378ba61130bc91a960034b174260ceb	식사 후 승객들은 벨그레이브로 돌아가는 여정을 위해 다시 열차에 합류합니다.	train
common_voice_en_19704379.mp3	Traditional punta dancing is consciously competitive.	74491ccd3495e209ddd31169484962be9536d4e4861cd2cf8eecba0cc90549aa42b1e3b88baedd6a5e231f1580f0b656d378ba61130bc91a960034b174260ceb	전통 푼타 댄스는 의식적으로 경쟁이 치열합니다.	train
common_voice_en_19704416.mp3	He was survived by his wife, their son and four daughters, and twelve grandchildren.	74491ccd3495e209ddd31169484962be9536d4e4861cd2cf8eecba0cc90549aa42b1e3b88baedd6a5e231f1580f0b656d378ba61130bc91a960034b174260ceb	그의 유족으로는 아내와 아들, 딸 넷, 손자 열두 명이 있습니다.	train
common_voice_en_19704417.mp3	He is also one of the most cited authors in science and engineering.	74491ccd3495e209ddd31169484962be9536d4e4861cd2cf8eecba0cc90549aa42b1e3b88baedd6a5e231f1580f0b656d378ba61130bc91a960034b174260ceb	또한 과학 및 공학 분야에서 가장 많이 인용되는 저자 중 한 명입니다.	train
common_voice_en_19704418.mp3	"Kerrl once dubbed Hitler 'Germany's Jesus Christ'."	74491ccd3495e209ddd31169484962be9536d4e4861cd2cf8eecba0cc90549aa42b1e3b88baedd6a5e231f1580f0b656d378ba61130bc91a960034b174260ceb	켈은 한때 히틀러를 '독일의 예수 그리스도'라고 불렀습니다.	train
common_voice_en_19704419.mp3	"Opponents are concerned about Renouf's role in the Holocaust denial movement."	74491ccd3495e209ddd31169484962be9536d4e4861cd2cf8eecba0cc90549aa42b1e3b88baedd6a5e231f1580f0b656d378ba61130bc91a960034b174260ceb	반대자들은 홀로코스트 거부 운동에서 레누프의 역할에 대해 우려하고 있습니다.	train
common_voice_en_19704440.mp3	Also, code can be run through a debugger and its data inspected.	74491ccd3495e209ddd31169484962be9536d4e4861cd2cf8eecba0cc90549aa42b1e3b88baedd6a5e231f1580f0b656d378ba61130bc91a960034b174260ceb	또한 디버거를 통해 코드를 실행하고 데이터를 검사할 수도 있습니다.	train
common_voice_en_19704444.mp3	He is welcome to them.	74491ccd3495e209ddd31169484962be9536d4e4861cd2cf8eecba0cc90549aa42b1e3b88baedd6a5e231f1580f0b656d378ba61130bc91a960034b174260ceb	환영합니다.	train
common_voice_en_19704446.mp3	This was the sole bid received by the bankruptcy judge, who approved the bid.	74491ccd3495e209ddd31169484962be9536d4e4861cd2cf8eecba0cc90549aa42b1e3b88baedd6a5e231f1580f0b656d378ba61130bc91a960034b174260ceb	이 입찰은 파산 판사가 승인한 유일한 입찰이었으며, 파산 판사는 이 입찰을 승인했습니다.	train
common_voice_en_19704448.mp3	Cornwallis responded with a night-time attack to dislodge Tipu from his lines.	74491ccd3495e209ddd31169484962be9536d4e4861cd2cf8eecba0cc90549aa42b1e3b88baedd6a5e231f1580f0b656d378ba61130bc91a960034b174260ceb	콘월리스는 야간 공격으로 대응해 티푸를 라인에서 몰아냈습니다.	train
common_voice_en_19773925.mp3	At the time, it was the fourth longest bridge in the world.	74491ccd3495e209ddd31169484962be9536d4e4861cd2cf8eecba0cc90549aa42b1e3b88baedd6a5e231f1580f0b656d378ba61130bc91a960034b174260ceb	당시 이 다리는 세계에서 네 번째로 긴 다리였습니다.	train
common_voice_en_19773927.mp3	"He also contributed to the collection with the story ""NippleJesus""."	74491ccd3495e209ddd31169484962be9536d4e4861cd2cf8eecba0cc90549aa42b1e3b88baedd6a5e231f1580f0b656d378ba61130bc91a960034b174260ceb	그는 또한 "젖꼭지 예수"라는 이야기로 컬렉션에 기여했습니다.	train
common_voice_en_19773928.mp3	"Turner's private life has led the tabloids to take a continuing interest in her."	74491ccd3495e209ddd31169484962be9536d4e4861cd2cf8eecba0cc90549aa42b1e3b88baedd6a5e231f1580f0b656d378ba61130bc91a960034b174260ceb	터너의 사생활로 인해 타블로이드지는 그녀에 대한 지속적인 관심을 보였습니다.	train
common_voice_en_19773929.mp3	The star rotates at an inclination of degrees relative to Earth.	74491ccd3495e209ddd31169484962be9536d4e4861cd2cf8eecba0cc90549aa42b1e3b88baedd6a5e231f1580f0b656d378ba61130bc91a960034b174260ceb	별은 지구를 기준으로 몇 도의 기울기로 자전합니다.	train
common_voice_en_19773940.mp3	Their paper tabulated the coefficients required to process the data after testing.	74491ccd3495e209ddd31169484962be9536d4e4861cd2cf8eecba0cc90549aa42b1e3b88baedd6a5e231f1580f0b656d378ba61130bc91a960034b174260ceb	이 논문은 테스트 후 데이터를 처리하는 데 필요한 계수를 표로 정리했습니다.	train
common_voice_en_19773942.mp3	The latter was his home England debut.	74491ccd3495e209ddd31169484962be9536d4e4861cd2cf8eecba0cc90549aa42b1e3b88baedd6a5e231f1580f0b656d378ba61130bc91a960034b174260ceb	후자는 그의 고향인 영국에서의 데뷔전이었습니다.	train
common_voice_en_19773944.mp3	"He was buried in Saint Paul's, Covent Garden."	74491ccd3495e209ddd31169484962be9536d4e4861cd2cf8eecba0cc90549aa42b1e3b88baedd6a5e231f1580f0b656d378ba61130bc91a960034b174260ceb	그는 코벤트 가든의 세인트 폴 교회에 묻혔습니다.	train
common_voice_en_19773946.mp3	She was succeeded in the Congress by Pascal Vittori.	74491ccd3495e209ddd31169484962be9536d4e4861cd2cf8eecba0cc90549aa42b1e3b88baedd6a5e231f1580f0b656d378ba61130bc91a960034b174260ceb	그녀의 뒤를 이어 파스칼 비토리가 의회에 진출했습니다.	train
common_voice_en_19773965.mp3	Instead, he saw a bipedal, ape-like creature standing about five feet tall.	74491ccd3495e209ddd31169484962be9536d4e4861cd2cf8eecba0cc90549aa42b1e3b88baedd6a5e231f1580f0b656d378ba61130bc91a960034b174260ceb	대신 그는 키가 5피트 정도 되는 이족보행의 유인원 같은 생명체를 목격했습니다.	train
common_voice_en_19773966.mp3	He eventually exacts a promise from Ada that she will not see Baines.	74491ccd3495e209ddd31169484962be9536d4e4861cd2cf8eecba0cc90549aa42b1e3b88baedd6a5e231f1580f0b656d378ba61130bc91a960034b174260ceb	결국 그는 에이다로부터 베인스를 만나지 않겠다는 약속을 받아냅니다.	train
common_voice_en_19773967.mp3	"""Extrapolation"" was the first journal to publish academic work on science fiction and fantasy."	74491ccd3495e209ddd31169484962be9536d4e4861cd2cf8eecba0cc90549aa42b1e3b88baedd6a5e231f1580f0b656d378ba61130bc91a960034b174260ceb	"외삽"은 공상 과학과 판타지에 관한 학술 연구를 출판한 최초의 저널입니다."	train
common_voice_en_19773968.mp3	Burns was drawn to acting late in college.	74491ccd3495e209ddd31169484962be9536d4e4861cd2cf8eecba0cc90549aa42b1e3b88baedd6a5e231f1580f0b656d378ba61130bc91a960034b174260ceb	번스는 대학 늦깎이로 연기에 매료되었습니다.	train
common_voice_en_19773969.mp3	This high-frequency round turn reduces the audible level of tape hiss.	74491ccd3495e209ddd31169484962be9536d4e4861cd2cf8eecba0cc90549aa42b1e3b88baedd6a5e231f1580f0b656d378ba61130bc91a960034b174260ceb	이 고주파 라운드 턴은 테이프 히스의 가청 수준을 줄여줍니다.	train
common_voice_en_19782129.mp3	Other panellists were Andy Burnham, Jeremy Hunt, Sarah Teather and Shami Chakrabarti.	74491ccd3495e209ddd31169484962be9536d4e4861cd2cf8eecba0cc90549aa42b1e3b88baedd6a5e231f1580f0b656d378ba61130bc91a960034b174260ceb	다른 패널로는 앤디 번햄, 제레미 헌트, 사라 테더, 샤미 차크라바티가 참여했습니다.	train
common_voice_en_19782132.mp3	This seat is currently held by Member of Parliament Jake Berry.	74491ccd3495e209ddd31169484962be9536d4e4861cd2cf8eecba0cc90549aa42b1e3b88baedd6a5e231f1580f0b656d378ba61130bc91a960034b174260ceb	이 자리는 현재 제이크 베리 국회의원이 맡고 있습니다.	train
common_voice_en_19782133.mp3	"Its literal meaning is 'noisy water'."	74491ccd3495e209ddd31169484962be9536d4e4861cd2cf8eecba0cc90549aa42b1e3b88baedd6a5e231f1580f0b656d378ba61130bc91a960034b174260ceb	문자 그대로의 의미는 '시끄러운 물'입니다.	train
common_voice_en_19782134.mp3	Their courtship was described, fancifully, by Lydia Maria Child in The Youthful Emigrant.	74491ccd3495e209ddd31169484962be9536d4e4861cd2cf8eecba0cc90549aa42b1e3b88baedd6a5e231f1580f0b656d378ba61130bc91a960034b174260ceb	이들의 구애는 리디아 마리아 차일드가 <젊은 이민자>에서 환상적으로 묘사했습니다.	train
common_voice_en_19782136.mp3	The main in-county rival is and will continue to be Belen High School.	74491ccd3495e209ddd31169484962be9536d4e4861cd2cf8eecba0cc90549aa42b1e3b88baedd6a5e231f1580f0b656d378ba61130bc91a960034b174260ceb	카운티 내 주요 라이벌은 벨렌 고등학교이며 앞으로도 그럴 것입니다.	train
common_voice_en_19782156.mp3	He is also a former color commentator for Royals telecasts.	74491ccd3495e209ddd31169484962be9536d4e4861cd2cf8eecba0cc90549aa42b1e3b88baedd6a5e231f1580f0b656d378ba61130bc91a960034b174260ceb	또한 전 로열스 방송의 컬러 해설자이기도 합니다.	train
common_voice_en_19782158.mp3	That is, individually the evidence may underdetermine the conclusion, but together they overdetermine it.	74491ccd3495e209ddd31169484962be9536d4e4861cd2cf8eecba0cc90549aa42b1e3b88baedd6a5e231f1580f0b656d378ba61130bc91a960034b174260ceb	즉, 개별적으로 증거는 결론을 과소 결정할 수 있지만 함께 사용하면 결론을 과대 결정할 수 있습니다.	train
common_voice_en_19782159.mp3	Holland greatly mistreated him, a matter FitzAlan would cruelly repay many years later.	74491ccd3495e209ddd31169484962be9536d4e4861cd2cf8eecba0cc90549aa42b1e3b88baedd6a5e231f1580f0b656d378ba61130bc91a960034b174260ceb	홀랜드는 그를 크게 학대했고, 피츠알런은 수년 후 잔인하게 보답했습니다.	train
common_voice_en_19782160.mp3	If the uploaded avatar is larger or smaller, the avatar is scaled appropriately.	74491ccd3495e209ddd31169484962be9536d4e4861cd2cf8eecba0cc90549aa42b1e3b88baedd6a5e231f1580f0b656d378ba61130bc91a960034b174260ceb	업로드한 아바타가 크거나 작으면 아바타의 크기가 적절하게 조정됩니다.	train
common_voice_en_19782181.mp3	"The Museum's collections range from the Paleo-Indian period through the present day."	74491ccd3495e209ddd31169484962be9536d4e4861cd2cf8eecba0cc90549aa42b1e3b88baedd6a5e231f1580f0b656d378ba61130bc91a960034b174260ceb	박물관의 소장품은 구석기 시대부터 현재에 이르기까지 다양합니다.	train
common_voice_en_19782182.mp3	However, the two characters have little else in common.	74491ccd3495e209ddd31169484962be9536d4e4861cd2cf8eecba0cc90549aa42b1e3b88baedd6a5e231f1580f0b656d378ba61130bc91a960034b174260ceb	하지만 두 캐릭터의 공통점은 거의 없습니다.	train
common_voice_en_19782183.mp3	"In dissent, Justice Black argued that the Court's holding was motivated by anti-communist bias."	74491ccd3495e209ddd31169484962be9536d4e4861cd2cf8eecba0cc90549aa42b1e3b88baedd6a5e231f1580f0b656d378ba61130bc91a960034b174260ceb	블랙 판사는 반대 의견에서 법원의 판결이 반공주의적 편견에서 비롯된 것이라고 주장했습니다.	train
common_voice_en_19782184.mp3	The family surname is most likely either of Prussian or German origins.	74491ccd3495e209ddd31169484962be9536d4e4861cd2cf8eecba0cc90549aa42b1e3b88baedd6a5e231f1580f0b656d378ba61130bc91a960034b174260ceb	가족 성은 프로이센 또는 독일 출신일 가능성이 높습니다.	train
common_voice_en_19782185.mp3	Principal cities and towns include Komono and Zanaga.	74491ccd3495e209ddd31169484962be9536d4e4861cd2cf8eecba0cc90549aa42b1e3b88baedd6a5e231f1580f0b656d378ba61130bc91a960034b174260ceb	주요 도시와 마을로는 고모노와 자나가 등이 있습니다.	train
common_voice_en_19782206.mp3	Kladruby nad Labem is renowned as home of the Kladruber horse breed.	74491ccd3495e209ddd31169484962be9536d4e4861cd2cf8eecba0cc90549aa42b1e3b88baedd6a5e231f1580f0b656d378ba61130bc91a960034b174260ceb	클라드루비 나드 라벰은 클라드루버 말 품종의 고향으로 유명합니다.	train
common_voice_en_19782207.mp3	Willisville was an early name for Cornwall-on-Hudson.	74491ccd3495e209ddd31169484962be9536d4e4861cd2cf8eecba0cc90549aa42b1e3b88baedd6a5e231f1580f0b656d378ba61130bc91a960034b174260ceb	윌리스빌은 콘월 온 허드슨의 초기 이름입니다.	train
common_voice_en_19782208.mp3	She gave a public apology that night to avoid arrest.	74491ccd3495e209ddd31169484962be9536d4e4861cd2cf8eecba0cc90549aa42b1e3b88baedd6a5e231f1580f0b656d378ba61130bc91a960034b174260ceb	그날 밤 그녀는 체포되지 않기 위해 공개 사과를 했습니다.	train
common_voice_en_19782210.mp3	The Follett Labor government resumed power, and Kaine again became Leader of the Opposition.	74491ccd3495e209ddd31169484962be9536d4e4861cd2cf8eecba0cc90549aa42b1e3b88baedd6a5e231f1580f0b656d378ba61130bc91a960034b174260ceb	폴레트 노동당 정부가 다시 집권했고 케인은 다시 야당 당수가 되었습니다.	train
common_voice_en_19791426.mp3	Flight diversions can also be arranged when required.	74491ccd3495e209ddd31169484962be9536d4e4861cd2cf8eecba0cc90549aa42b1e3b88baedd6a5e231f1580f0b656d378ba61130bc91a960034b174260ceb	필요한 경우 항공편 우회도 가능합니다.	train
common_voice_en_19791427.mp3	Later the type became referred to as burley tobacco, and it was air-cured.	74491ccd3495e209ddd31169484962be9536d4e4861cd2cf8eecba0cc90549aa42b1e3b88baedd6a5e231f1580f0b656d378ba61130bc91a960034b174260ceb	나중에 이 유형은 벌리 담배로 불리게 되었고, 공기 경화 담배가 되었습니다.	train
common_voice_en_19791429.mp3	In the United States Grattan gained considerable reputation as a speaker and raconteur.	74491ccd3495e209ddd31169484962be9536d4e4861cd2cf8eecba0cc90549aa42b1e3b88baedd6a5e231f1580f0b656d378ba61130bc91a960034b174260ceb	미국에서 그라탄은 연설가이자 레이콘테르로서 상당한 명성을 얻었습니다.	train
common_voice_en_19791436.mp3	During that movement, Nawaz Sharif travelled through the length and breadth of Pakistan.	74491ccd3495e209ddd31169484962be9536d4e4861cd2cf8eecba0cc90549aa42b1e3b88baedd6a5e231f1580f0b656d378ba61130bc91a960034b174260ceb	그 운동 기간 동안 나와즈 샤리프는 파키스탄의 길고 넓은 지역을 여행했습니다.	train
common_voice_en_19791437.mp3	Look at Elvis.	74491ccd3495e209ddd31169484962be9536d4e4861cd2cf8eecba0cc90549aa42b1e3b88baedd6a5e231f1580f0b656d378ba61130bc91a960034b174260ceb	엘비스를 보세요.	train
common_voice_en_19791438.mp3	Huger was born in South Carolina.	74491ccd3495e209ddd31169484962be9536d4e4861cd2cf8eecba0cc90549aa42b1e3b88baedd6a5e231f1580f0b656d378ba61130bc91a960034b174260ceb	휴거는 사우스 캐롤라이나에서 태어났습니다.	train
common_voice_en_19791439.mp3	Death can occur quickly, due to secondary hyperammonemia, infection, cardiomyopathy, or basal ganglial stroke.	74491ccd3495e209ddd31169484962be9536d4e4861cd2cf8eecba0cc90549aa42b1e3b88baedd6a5e231f1580f0b656d378ba61130bc91a960034b174260ceb	이차성 고암모니아혈증, 감염, 심근병증 또는 기저신경절 뇌졸중으로 인해 사망이 빠르게 발생할 수 있습니다.	train
common_voice_en_19791440.mp3	Also included was a new, sleeker side view mirror design.	74491ccd3495e209ddd31169484962be9536d4e4861cd2cf8eecba0cc90549aa42b1e3b88baedd6a5e231f1580f0b656d378ba61130bc91a960034b174260ceb	또한 새롭고 세련된 사이드미러 디자인도 포함되었습니다.	train
common_voice_en_19795857.mp3	Although, they are a quite rude rendition of the two.	74491ccd3495e209ddd31169484962be9536d4e4861cd2cf8eecba0cc90549aa42b1e3b88baedd6a5e231f1580f0b656d378ba61130bc91a960034b174260ceb	하지만 이 둘은 상당히 무례한 표현입니다.	train
common_voice_en_19795865.mp3	"An estimated due date is given by Naegele's rule."	74491ccd3495e209ddd31169484962be9536d4e4861cd2cf8eecba0cc90549aa42b1e3b88baedd6a5e231f1580f0b656d378ba61130bc91a960034b174260ceb	예상 마감일은 내겔레의 규칙에 따라 정해집니다.	train
common_voice_en_19795866.mp3	Liah promptly turned her glass to the wall.	74491ccd3495e209ddd31169484962be9536d4e4861cd2cf8eecba0cc90549aa42b1e3b88baedd6a5e231f1580f0b656d378ba61130bc91a960034b174260ceb	리아는 즉시 잔을 벽으로 돌렸습니다.	train
common_voice_en_19795869.mp3	"Cher recorded ""Good Thing"" on one of her albums."	74491ccd3495e209ddd31169484962be9536d4e4861cd2cf8eecba0cc90549aa42b1e3b88baedd6a5e231f1580f0b656d378ba61130bc91a960034b174260ceb	Cher는 자신의 앨범 중 하나에 "Good Thing"을 녹음했습니다.	train
common_voice_en_19796188.mp3	"Many of the illustrations were previously featured in the ""Fiend Factory"" column as well."	74491ccd3495e209ddd31169484962be9536d4e4861cd2cf8eecba0cc90549aa42b1e3b88baedd6a5e231f1580f0b656d378ba61130bc91a960034b174260ceb	많은 일러스트레이션이 이전에도 '악마 공장' 칼럼에 소개된 바 있습니다.	train
common_voice_en_19796189.mp3	For sports other than football and basketball there are no scheduling requirements.	74491ccd3495e209ddd31169484962be9536d4e4861cd2cf8eecba0cc90549aa42b1e3b88baedd6a5e231f1580f0b656d378ba61130bc91a960034b174260ceb	축구와 농구 이외의 스포츠의 경우 예약 요건이 없습니다.	train
common_voice_en_19796192.mp3	With William Roscoe, he defended the violence with which slaves liberated themselves.	74491ccd3495e209ddd31169484962be9536d4e4861cd2cf8eecba0cc90549aa42b1e3b88baedd6a5e231f1580f0b656d378ba61130bc91a960034b174260ceb	윌리엄 로스코와 함께 그는 노예들이 스스로를 해방시키는 폭력을 옹호했습니다.	train
common_voice_en_19796198.mp3	A plaque outside the hotel memorializes him.	74491ccd3495e209ddd31169484962be9536d4e4861cd2cf8eecba0cc90549aa42b1e3b88baedd6a5e231f1580f0b656d378ba61130bc91a960034b174260ceb	호텔 외부에 그를 추모하는 명판이 세워져 있습니다.	train
common_voice_en_19796199.mp3	Elections may be partisan or nonpartisan.	74491ccd3495e209ddd31169484962be9536d4e4861cd2cf8eecba0cc90549aa42b1e3b88baedd6a5e231f1580f0b656d378ba61130bc91a960034b174260ceb	선거는 당파적 또는 비당파적으로 진행될 수 있습니다.	train
common_voice_en_19796200.mp3	He was the first physician and surgeon in Providence.	74491ccd3495e209ddd31169484962be9536d4e4861cd2cf8eecba0cc90549aa42b1e3b88baedd6a5e231f1580f0b656d378ba61130bc91a960034b174260ceb	그는 프로비던스 최초의 의사이자 외과의사였습니다.	train
common_voice_en_19796201.mp3	The acoustic version was previously unreleased.	74491ccd3495e209ddd31169484962be9536d4e4861cd2cf8eecba0cc90549aa42b1e3b88baedd6a5e231f1580f0b656d378ba61130bc91a960034b174260ceb	어쿠스틱 버전은 이전에 출시되지 않았습니다.	train
common_voice_en_19796202.mp3	The gods are only comforted by the hope the hero fails.	74491ccd3495e209ddd31169484962be9536d4e4861cd2cf8eecba0cc90549aa42b1e3b88baedd6a5e231f1580f0b656d378ba61130bc91a960034b174260ceb	신들은 영웅의 실패에 대한 희망으로만 위로를 받습니다.	train
common_voice_en_19797076.mp3	He was executed during the Reign of Terror.	74491ccd3495e209ddd31169484962be9536d4e4861cd2cf8eecba0cc90549aa42b1e3b88baedd6a5e231f1580f0b656d378ba61130bc91a960034b174260ceb	그는 공포의 통치 기간에 처형당했습니다.	train
common_voice_en_19797077.mp3	Each experience, however similar, is different from others experiencing this illness.	74491ccd3495e209ddd31169484962be9536d4e4861cd2cf8eecba0cc90549aa42b1e3b88baedd6a5e231f1580f0b656d378ba61130bc91a960034b174260ceb	비슷해 보이지만 각 경험은 이 질병을 경험하는 다른 사람들과 다릅니다.	train
common_voice_en_19797079.mp3	It currently exists as an international franchise and an online music store.	74491ccd3495e209ddd31169484962be9536d4e4861cd2cf8eecba0cc90549aa42b1e3b88baedd6a5e231f1580f0b656d378ba61130bc91a960034b174260ceb	현재 국제적인 프랜차이즈와 온라인 뮤직 스토어로 존재합니다.	train
common_voice_en_19863547.mp3	A companion video was directed by David Brodsky.	74491ccd3495e209ddd31169484962be9536d4e4861cd2cf8eecba0cc90549aa42b1e3b88baedd6a5e231f1580f0b656d378ba61130bc91a960034b174260ceb	동반 동영상은 데이비드 브로드스키가 감독했습니다.	train
common_voice_en_19863548.mp3	Gwildor is a member of the Thenurians, a dwarf-like race of people.	74491ccd3495e209ddd31169484962be9536d4e4861cd2cf8eecba0cc90549aa42b1e3b88baedd6a5e231f1580f0b656d378ba61130bc91a960034b174260ceb	길도르는 난쟁이 같은 종족인 테누리안족의 일원이에요.	train
common_voice_en_19863549.mp3	It will be built in phases.	74491ccd3495e209ddd31169484962be9536d4e4861cd2cf8eecba0cc90549aa42b1e3b88baedd6a5e231f1580f0b656d378ba61130bc91a960034b174260ceb	단계적으로 구축될 예정입니다.	train
common_voice_en_19863550.mp3	The University of Agder is located in Kristiansand.	74491ccd3495e209ddd31169484962be9536d4e4861cd2cf8eecba0cc90549aa42b1e3b88baedd6a5e231f1580f0b656d378ba61130bc91a960034b174260ceb	아그데르 대학교는 크리스티안샌드에 위치해 있습니다.	train
common_voice_en_19863551.mp3	Berger was in comfortable lead followed by Schumacher.	74491ccd3495e209ddd31169484962be9536d4e4861cd2cf8eecba0cc90549aa42b1e3b88baedd6a5e231f1580f0b656d378ba61130bc91a960034b174260ceb	버거가 편안하게 선두를 달리고 있었고 슈마허가 그 뒤를 따랐습니다.	train
common_voice_en_19863552.mp3	"Every representation of the multiplicative group ""G"" is a direct sum of irreducible representations."	74491ccd3495e209ddd31169484962be9536d4e4861cd2cf8eecba0cc90549aa42b1e3b88baedd6a5e231f1580f0b656d378ba61130bc91a960034b174260ceb	곱셈 그룹 "G"의 모든 표현은 환원 불가능한 표현의 직접적인 합입니다.	train
common_voice_en_19863553.mp3	King Vidor was nominated for a Best Director Oscar for the film.	74491ccd3495e209ddd31169484962be9536d4e4861cd2cf8eecba0cc90549aa42b1e3b88baedd6a5e231f1580f0b656d378ba61130bc91a960034b174260ceb	비도르 왕은 이 영화로 오스카 감독상 후보에 올랐습니다.	train
common_voice_en_19863554.mp3	He also endorses Remo drumheads, Latin Percussion and Pro-Mark sticks.	74491ccd3495e209ddd31169484962be9536d4e4861cd2cf8eecba0cc90549aa42b1e3b88baedd6a5e231f1580f0b656d378ba61130bc91a960034b174260ceb	그는 또한 Remo 드럼헤드, 라틴 퍼커션 및 Pro-Mark 스틱을 지지합니다.	train
common_voice_en_19863555.mp3	Mafco Holdings is owned by Al-Fayed and his family.	74491ccd3495e209ddd31169484962be9536d4e4861cd2cf8eecba0cc90549aa42b1e3b88baedd6a5e231f1580f0b656d378ba61130bc91a960034b174260ceb	마프코 홀딩스는 알 파예드와 그의 가족이 소유하고 있습니다.	train
common_voice_en_19863556.mp3	Litigation continued, however.	74491ccd3495e209ddd31169484962be9536d4e4861cd2cf8eecba0cc90549aa42b1e3b88baedd6a5e231f1580f0b656d378ba61130bc91a960034b174260ceb	하지만 소송은 계속되었습니다.	train
common_voice_en_19863562.mp3	Western Farm Service is the only customer on the line.	74491ccd3495e209ddd31169484962be9536d4e4861cd2cf8eecba0cc90549aa42b1e3b88baedd6a5e231f1580f0b656d378ba61130bc91a960034b174260ceb	웨스턴팜서비스가 유일한 고객입니다.	train
common_voice_en_19863563.mp3	The port propeller was donated to the Western Australia Maritime Museum.	74491ccd3495e209ddd31169484962be9536d4e4861cd2cf8eecba0cc90549aa42b1e3b88baedd6a5e231f1580f0b656d378ba61130bc91a960034b174260ceb	항구 프로펠러는 서호주 해양 박물관에 기증되었습니다.	train
common_voice_en_19863564.mp3	"It includes a cover of The Knack's ""My Sharona""."	74491ccd3495e209ddd31169484962be9536d4e4861cd2cf8eecba0cc90549aa42b1e3b88baedd6a5e231f1580f0b656d378ba61130bc91a960034b174260ceb	더 낵의 '마이 샤로나' 커버가 포함되어 있습니다.	train
common_voice_en_19863565.mp3	She began ballet classes at age five.	74491ccd3495e209ddd31169484962be9536d4e4861cd2cf8eecba0cc90549aa42b1e3b88baedd6a5e231f1580f0b656d378ba61130bc91a960034b174260ceb	5살 때부터 발레 수업을 시작했습니다.	train
common_voice_en_19863566.mp3	An unnamed narrator wanders through the Winter Palace in Saint Petersburg.	74491ccd3495e209ddd31169484962be9536d4e4861cd2cf8eecba0cc90549aa42b1e3b88baedd6a5e231f1580f0b656d378ba61130bc91a960034b174260ceb	이름 모를 내레이터가 상트페테르부르크의 겨울 궁전을 돌아다닙니다.	train
common_voice_en_19863572.mp3	Instead, it was one of several early microbes.	74491ccd3495e209ddd31169484962be9536d4e4861cd2cf8eecba0cc90549aa42b1e3b88baedd6a5e231f1580f0b656d378ba61130bc91a960034b174260ceb	대신 초기의 여러 미생물 중 하나였습니다.	train
common_voice_en_19863573.mp3	For earlier office-holders see Under-Secretary of State for War and the Colonies.	74491ccd3495e209ddd31169484962be9536d4e4861cd2cf8eecba0cc90549aa42b1e3b88baedd6a5e231f1580f0b656d378ba61130bc91a960034b174260ceb	이전 공직자는 전쟁 및 식민지 담당 국무부 차관보를 참조하세요.	train
