path	sentence	client_id	translation	split
common_voice_en_18420616.mp3	"The average person won't know the difference."	9a65681f203532281d9cebed42e972d3420ba0df20a0aeb2964c6db043e6071ccf1c1664daf917e6b9955140a67b453e5b50c512f931416ccc9e81e0f2bcbbcd	일반인은 그 차이를 모를 것입니다.	train
common_voice_en_18747226.mp3	The nearest city is Fulton, located south of Oswego and north of Syracuse.	9a65681f203532281d9cebed42e972d3420ba0df20a0aeb2964c6db043e6071ccf1c1664daf917e6b9955140a67b453e5b50c512f931416ccc9e81e0f2bcbbcd	가장 가까운 도시는 오스웨고 남쪽과 시라큐스 북쪽에 위치한 풀턴입니다.	train
common_voice_en_18747227.mp3	He works in the areas of social stratification, macrosociology, and recently cultural consumption.	9a65681f203532281d9cebed42e972d3420ba0df20a0aeb2964c6db043e6071ccf1c1664daf917e6b9955140a67b453e5b50c512f931416ccc9e81e0f2bcbbcd	그는 사회 계층화, 거시 사회학, 그리고 최근에는 문화 소비 분야에서 일하고 있습니다.	train
common_voice_en_18747228.mp3	Many of the fugitives tried to cross the bridge, which broke under the weight.	9a65681f203532281d9cebed42e972d3420ba0df20a0aeb2964c6db043e6071ccf1c1664daf917e6b9955140a67b453e5b50c512f931416ccc9e81e0f2bcbbcd	많은 도망자들이 다리를 건너려다 무게로 인해 다리가 부러졌습니다.	train
common_voice_en_18747229.mp3	It is sown in weakness, it is raised in power.	9a65681f203532281d9cebed42e972d3420ba0df20a0aeb2964c6db043e6071ccf1c1664daf917e6b9955140a67b453e5b50c512f931416ccc9e81e0f2bcbbcd	약함 속에서 뿌려지고 힘 속에서 자라납니다.	train
common_voice_en_18747230.mp3	Caton Thompson retired from fieldwork after the Second World War.	9a65681f203532281d9cebed42e972d3420ba0df20a0aeb2964c6db043e6071ccf1c1664daf917e6b9955140a67b453e5b50c512f931416ccc9e81e0f2bcbbcd	캐튼 톰슨은 2차 세계대전이 끝난 후 현장 활동에서 은퇴했습니다.	train
common_voice_en_18747231.mp3	There is no dress style.	9a65681f203532281d9cebed42e972d3420ba0df20a0aeb2964c6db043e6071ccf1c1664daf917e6b9955140a67b453e5b50c512f931416ccc9e81e0f2bcbbcd	복장 스타일은 없습니다.	train
common_voice_en_18747232.mp3	Shooting and recording were performed by Nelvana Canada.	9a65681f203532281d9cebed42e972d3420ba0df20a0aeb2964c6db043e6071ccf1c1664daf917e6b9955140a67b453e5b50c512f931416ccc9e81e0f2bcbbcd	촬영 및 녹음은 캐나다 넬바나에서 수행했습니다.	train
common_voice_en_18747233.mp3	Dawn runs outside in tears and into Xander.	9a65681f203532281d9cebed42e972d3420ba0df20a0aeb2964c6db043e6071ccf1c1664daf917e6b9955140a67b453e5b50c512f931416ccc9e81e0f2bcbbcd	던은 눈물을 흘리며 밖으로 뛰어나가 잰더를 만납니다.	train
common_voice_en_18747234.mp3	The Barons Carrington are related to the Barons Bicester.	9a65681f203532281d9cebed42e972d3420ba0df20a0aeb2964c6db043e6071ccf1c1664daf917e6b9955140a67b453e5b50c512f931416ccc9e81e0f2bcbbcd	캐링턴 남작은 비스터 남작과 관련이 있습니다.	train
common_voice_en_18747235.mp3	"At Korby's request, only Kirk and Chapel beam down."	9a65681f203532281d9cebed42e972d3420ba0df20a0aeb2964c6db043e6071ccf1c1664daf917e6b9955140a67b453e5b50c512f931416ccc9e81e0f2bcbbcd	코비의 요청에 따라 커크와 채플만 빔이 내려옵니다.	train
common_voice_en_18747237.mp3	He was born in Coleraine, Ireland.	9a65681f203532281d9cebed42e972d3420ba0df20a0aeb2964c6db043e6071ccf1c1664daf917e6b9955140a67b453e5b50c512f931416ccc9e81e0f2bcbbcd	아일랜드 콜러레인에서 태어났습니다.	train
common_voice_en_18747238.mp3	Their greed leads to distrust and dishonesty, and eventually the society crumbles.	9a65681f203532281d9cebed42e972d3420ba0df20a0aeb2964c6db043e6071ccf1c1664daf917e6b9955140a67b453e5b50c512f931416ccc9e81e0f2bcbbcd	그들의 탐욕은 불신과 부정직으로 이어지고, 결국 사회는 무너집니다.	train
common_voice_en_18747240.mp3	Such an arrangement would form a Graeco-Latin square.	9a65681f203532281d9cebed42e972d3420ba0df20a0aeb2964c6db043e6071ccf1c1664daf917e6b9955140a67b453e5b50c512f931416ccc9e81e0f2bcbbcd	이러한 배열은 그라에코-라틴 정사각형을 형성합니다.	train
common_voice_en_18747242.mp3	Notable examples include the upper torso humanoid robot Cog and the insect-like robot Hannibal.	9a65681f203532281d9cebed42e972d3420ba0df20a0aeb2964c6db043e6071ccf1c1664daf917e6b9955140a67b453e5b50c512f931416ccc9e81e0f2bcbbcd	상반신 휴머노이드 로봇인 코그와 곤충형 로봇인 한니발이 대표적인 예입니다.	train
common_voice_en_18747243.mp3	He adopted a militant attitude towards the Moors of Al-Andalus, especially the Almoravids.	9a65681f203532281d9cebed42e972d3420ba0df20a0aeb2964c6db043e6071ccf1c1664daf917e6b9955140a67b453e5b50c512f931416ccc9e81e0f2bcbbcd	그는 알 안달루스의 무어인, 특히 알모라비족에 대해 전투적인 태도를 취했습니다.	train
common_voice_en_18747244.mp3	Institutions may vary in the amount of first-language instruction that is utilized.	9a65681f203532281d9cebed42e972d3420ba0df20a0aeb2964c6db043e6071ccf1c1664daf917e6b9955140a67b453e5b50c512f931416ccc9e81e0f2bcbbcd	교육기관에 따라 활용하는 모국어 교육의 양은 다를 수 있습니다.	train
common_voice_en_18747245.mp3	Compton became the general manager of C. B.	9a65681f203532281d9cebed42e972d3420ba0df20a0aeb2964c6db043e6071ccf1c1664daf917e6b9955140a67b453e5b50c512f931416ccc9e81e0f2bcbbcd	컴튼은 C. B.의 총괄 매니저가 되었습니다.	train
common_voice_en_614223.mp3	Play an ep from Little Jimmy Dickens.	9be8b7fdc0b32488e0548c05fc24b49414de599c6e212e36d5ab62aeef000691b1e39d1267a7e6fd5b0007da3631af7c2209dc3b435e4760dfde5550603e2c1b	리틀 지미 디킨스의 에피소드를 재생합니다.	train
common_voice_en_614230.mp3	Play itunes and Vimeo music	9be8b7fdc0b32488e0548c05fc24b49414de599c6e212e36d5ab62aeef000691b1e39d1267a7e6fd5b0007da3631af7c2209dc3b435e4760dfde5550603e2c1b	아이튠즈 및 비메오 음악 재생	train
common_voice_en_614237.mp3	Rate All That Remains a five	9be8b7fdc0b32488e0548c05fc24b49414de599c6e212e36d5ab62aeef000691b1e39d1267a7e6fd5b0007da3631af7c2209dc3b435e4760dfde5550603e2c1b	남아있는 모든 것 평가하기 5점	train_covost
common_voice_en_614238.mp3	"Are you certain it's not a monster?"	9be8b7fdc0b32488e0548c05fc24b49414de599c6e212e36d5ab62aeef000691b1e39d1267a7e6fd5b0007da3631af7c2209dc3b435e4760dfde5550603e2c1b	괴물이 아닌 게 확실해요?	train_covost
common_voice_en_614241.mp3	Birds of a feather flock together.	9be8b7fdc0b32488e0548c05fc24b49414de599c6e212e36d5ab62aeef000691b1e39d1267a7e6fd5b0007da3631af7c2209dc3b435e4760dfde5550603e2c1b	깃털 같은 새들이 모여듭니다.	train_covost
common_voice_en_614242.mp3	Weather in Cairngorms-Nationalpark close from freezing	9be8b7fdc0b32488e0548c05fc24b49414de599c6e212e36d5ab62aeef000691b1e39d1267a7e6fd5b0007da3631af7c2209dc3b435e4760dfde5550603e2c1b	케언곰즈 국립공원 영하 날씨	train
common_voice_en_614244.mp3	As good luck would have it	9be8b7fdc0b32488e0548c05fc24b49414de599c6e212e36d5ab62aeef000691b1e39d1267a7e6fd5b0007da3631af7c2209dc3b435e4760dfde5550603e2c1b	운이 좋다면	train
common_voice_en_614247.mp3	Can you find me the painting titled Across the Line?	9be8b7fdc0b32488e0548c05fc24b49414de599c6e212e36d5ab62aeef000691b1e39d1267a7e6fd5b0007da3631af7c2209dc3b435e4760dfde5550603e2c1b	'선을 넘어'라는 제목의 그림을 찾아주시겠어요?	train
common_voice_en_614248.mp3	Salad days	9be8b7fdc0b32488e0548c05fc24b49414de599c6e212e36d5ab62aeef000691b1e39d1267a7e6fd5b0007da3631af7c2209dc3b435e4760dfde5550603e2c1b	샐러드 데이	train
common_voice_en_614249.mp3	Came back three days ago.	9be8b7fdc0b32488e0548c05fc24b49414de599c6e212e36d5ab62aeef000691b1e39d1267a7e6fd5b0007da3631af7c2209dc3b435e4760dfde5550603e2c1b	3일 전에 돌아왔습니다.	train_covost
common_voice_en_614256.mp3	The filesize of a video file is only an indication of its video quality.	9be8b7fdc0b32488e0548c05fc24b49414de599c6e212e36d5ab62aeef000691b1e39d1267a7e6fd5b0007da3631af7c2209dc3b435e4760dfde5550603e2c1b	동영상 파일의 파일 크기는 동영상 품질을 나타내는 지표일 뿐입니다.	train_covost
common_voice_en_614257.mp3	But you also benefit from the estimable built-in support such as contexts, task switching, and window management.	9be8b7fdc0b32488e0548c05fc24b49414de599c6e212e36d5ab62aeef000691b1e39d1267a7e6fd5b0007da3631af7c2209dc3b435e4760dfde5550603e2c1b	하지만 컨텍스트, 작업 전환 및 창 관리와 같은 예상 가능한 기본 지원의 이점도 누릴 수 있습니다.	train
common_voice_en_614262.mp3	He asked for him.	9be8b7fdc0b32488e0548c05fc24b49414de599c6e212e36d5ab62aeef000691b1e39d1267a7e6fd5b0007da3631af7c2209dc3b435e4760dfde5550603e2c1b	그는 그를 요청했습니다.	train_covost
common_voice_en_19600541.mp3	New layers of identity were created by the influx of Celts to America.	9f13d97215cd06833d3029596b05a0d5c5b5af5ceb152336b3da467b987aa401f8e04581f3f9bbc887021c2ba74dd524eb4667f4615cb5ed72020c80fa85d85e	켈트족이 미국으로 유입되면서 새로운 정체성 층이 형성되었습니다.	train
common_voice_en_19600542.mp3	Simultaneous to this, other disciplines have started breaking down their barriers.	9f13d97215cd06833d3029596b05a0d5c5b5af5ceb152336b3da467b987aa401f8e04581f3f9bbc887021c2ba74dd524eb4667f4615cb5ed72020c80fa85d85e	이와 동시에 다른 분야에서도 장벽을 허물기 시작했습니다.	train
common_voice_en_19600543.mp3	Semivowels, by definition, contrast with vowels by being non-syllabic.	9f13d97215cd06833d3029596b05a0d5c5b5af5ceb152336b3da467b987aa401f8e04581f3f9bbc887021c2ba74dd524eb4667f4615cb5ed72020c80fa85d85e	정의상 반모음은 음절이 없다는 점에서 모음과 대조됩니다.	train
