path	sentence	client_id	translation	split
common_voice_en_20049660.mp3	Today the park is still a recreation ground and cricket is still played there.	62937aac345cc709eea15b1476dcac6298818335a312fea0792db3ab10e23414f78884919d112fcdf8b81c171a08b2a373d48a9eab2a140fde36895f15982ece	오늘날에도 이 공원은 여전히 레크리에이션 장소로 사용되고 있으며 크리켓 경기는 여전히 열리고 있습니다.	train
common_voice_en_20049661.mp3	The refutation of any gambit begins with accepting it.	62937aac345cc709eea15b1476dcac6298818335a312fea0792db3ab10e23414f78884919d112fcdf8b81c171a08b2a373d48a9eab2a140fde36895f15982ece	모든 도박에 대한 반박은 그것을 받아들이는 것에서 시작됩니다.	train
common_voice_en_20049665.mp3	"Colasanto's character was written out of the show as also having died."	62937aac345cc709eea15b1476dcac6298818335a312fea0792db3ab10e23414f78884919d112fcdf8b81c171a08b2a373d48a9eab2a140fde36895f15982ece	콜란토의 캐릭터는 쇼에서 사망한 것으로 기록되었습니다.	train
common_voice_en_20049666.mp3	Despite this Tootoosis continued to assert a leadership position.	62937aac345cc709eea15b1476dcac6298818335a312fea0792db3ab10e23414f78884919d112fcdf8b81c171a08b2a373d48a9eab2a140fde36895f15982ece	그럼에도 불구하고 투토시스는 계속해서 선두 자리를 고수했습니다.	train
common_voice_en_20049667.mp3	Both candidates tried to round up the support of minor parties.	62937aac345cc709eea15b1476dcac6298818335a312fea0792db3ab10e23414f78884919d112fcdf8b81c171a08b2a373d48a9eab2a140fde36895f15982ece	두 후보 모두 군소 정당의 지지를 모으기 위해 노력했습니다.	train
common_voice_en_20049668.mp3	It is characterized by obesity, heart disease, diabetes, hypertension, and shortened life span.	62937aac345cc709eea15b1476dcac6298818335a312fea0792db3ab10e23414f78884919d112fcdf8b81c171a08b2a373d48a9eab2a140fde36895f15982ece	비만, 심장병, 당뇨병, 고혈압, 수명 단축이 특징입니다.	train
common_voice_en_20049669.mp3	Condensed milk is used in numerous dessert dishes in many countries.	62937aac345cc709eea15b1476dcac6298818335a312fea0792db3ab10e23414f78884919d112fcdf8b81c171a08b2a373d48a9eab2a140fde36895f15982ece	연유는 여러 나라에서 수많은 디저트 요리에 사용됩니다.	train
common_voice_en_20049685.mp3	Chief litigation attorney Stanley Chesley raised millions through the class action, benefiting many survivors.	62937aac345cc709eea15b1476dcac6298818335a312fea0792db3ab10e23414f78884919d112fcdf8b81c171a08b2a373d48a9eab2a140fde36895f15982ece	수석 소송 변호사 스탠리 체슬리는 집단 소송을 통해 수백만 달러를 모금하여 많은 생존자에게 혜택을 제공했습니다.	train
common_voice_en_20049686.mp3	Still disguised, Lucejo breaches the garden, but hides when he hears Scipione approaching.	62937aac345cc709eea15b1476dcac6298818335a312fea0792db3ab10e23414f78884919d112fcdf8b81c171a08b2a373d48a9eab2a140fde36895f15982ece	변장한 채 정원에 침입한 루세조는 스키피오네가 다가오는 소리를 듣고 숨습니다.	train
common_voice_en_20049687.mp3	Production ammunition and rifles are still available from a few manufacturers.	62937aac345cc709eea15b1476dcac6298818335a312fea0792db3ab10e23414f78884919d112fcdf8b81c171a08b2a373d48a9eab2a140fde36895f15982ece	일부 제조업체에서는 여전히 생산용 탄약과 소총을 판매하고 있습니다.	train
common_voice_en_20049688.mp3	A polymer composed of pentose sugars is called a pentosan.	62937aac345cc709eea15b1476dcac6298818335a312fea0792db3ab10e23414f78884919d112fcdf8b81c171a08b2a373d48a9eab2a140fde36895f15982ece	펜토오스 당으로 구성된 폴리머를 펜토산이라고 합니다.	train
common_voice_en_20049689.mp3	"The Institute was a non-profit foundation situated in Berlin's Tiergarten."	62937aac345cc709eea15b1476dcac6298818335a312fea0792db3ab10e23414f78884919d112fcdf8b81c171a08b2a373d48a9eab2a140fde36895f15982ece	이 연구소는 베를린의 티어가르텐에 위치한 비영리 재단입니다.	train
common_voice_en_20049695.mp3	Lakehead also offers Aboriginal support including the Office of Aboriginal Initiatives.	62937aac345cc709eea15b1476dcac6298818335a312fea0792db3ab10e23414f78884919d112fcdf8b81c171a08b2a373d48a9eab2a140fde36895f15982ece	레이크헤드는 원주민 이니셔티브 사무소를 비롯한 원주민 지원 서비스도 제공합니다.	train
common_voice_en_20049696.mp3	Scholars consider it likely that the capital of Abilene was the city of Saidnaya.	62937aac345cc709eea15b1476dcac6298818335a312fea0792db3ab10e23414f78884919d112fcdf8b81c171a08b2a373d48a9eab2a140fde36895f15982ece	학자들은 아빌레네의 수도가 사이드나야 도시였을 가능성이 높다고 보고 있습니다.	train
common_voice_en_20049697.mp3	"The name originates from the Anglo-Saxon ""Chenefield"", meaning 'good lands'."	62937aac345cc709eea15b1476dcac6298818335a312fea0792db3ab10e23414f78884919d112fcdf8b81c171a08b2a373d48a9eab2a140fde36895f15982ece	이 이름은 '좋은 땅'이라는 뜻의 앵글로색슨어 '체네필드'에서 유래했습니다.	train
common_voice_en_20049698.mp3	Lileks has had a wide-ranging career as a columnist, radio personality, author, and blogger.	62937aac345cc709eea15b1476dcac6298818335a312fea0792db3ab10e23414f78884919d112fcdf8b81c171a08b2a373d48a9eab2a140fde36895f15982ece	Lileks는 칼럼니스트, 라디오 진행자, 작가, 블로거 등 다양한 경력을 쌓았습니다.	train
common_voice_en_20049699.mp3	Her writings reflect a traditional orientation toward sentimentalism and the cult of true womanhood.	62937aac345cc709eea15b1476dcac6298818335a312fea0792db3ab10e23414f78884919d112fcdf8b81c171a08b2a373d48a9eab2a140fde36895f15982ece	그녀의 글은 감상주의와 진정한 여성성에 대한 숭배를 지향하는 전통적인 성향을 반영합니다.	train
common_voice_en_20049710.mp3	Her father, a chicory professor, and her mother both currently live in Waregem.	62937aac345cc709eea15b1476dcac6298818335a312fea0792db3ab10e23414f78884919d112fcdf8b81c171a08b2a373d48a9eab2a140fde36895f15982ece	치커리 교수인 아버지와 어머니는 현재 모두 와레젬에 거주하고 있습니다.	train
common_voice_en_20049711.mp3	Licensed to the area of Dover-New Philadelphia, Ohio, it serves the Tuscarawas County area.	62937aac345cc709eea15b1476dcac6298818335a312fea0792db3ab10e23414f78884919d112fcdf8b81c171a08b2a373d48a9eab2a140fde36895f15982ece	오하이오주 도버-뉴 필라델피아 지역에 라이센스가 있으며, 투스카라와스 카운티 지역에 서비스를 제공합니다.	train
common_voice_en_20049712.mp3	Dossenheim is primarily a residential community.	62937aac345cc709eea15b1476dcac6298818335a312fea0792db3ab10e23414f78884919d112fcdf8b81c171a08b2a373d48a9eab2a140fde36895f15982ece	도센하임은 주로 주거 지역입니다.	train
common_voice_en_20049713.mp3	No foul play was suspected, according to the Pulaski County Coroner.	62937aac345cc709eea15b1476dcac6298818335a312fea0792db3ab10e23414f78884919d112fcdf8b81c171a08b2a373d48a9eab2a140fde36895f15982ece	풀라스키 카운티 검시관에 따르면 부정 행위는 의심되지 않는다고 합니다.	train
common_voice_en_20049714.mp3	He was master of the party; his father was no good.	62937aac345cc709eea15b1476dcac6298818335a312fea0792db3ab10e23414f78884919d112fcdf8b81c171a08b2a373d48a9eab2a140fde36895f15982ece	그는 파티의 주인이었고 그의 아버지는 좋지 않았습니다.	train
common_voice_en_20049725.mp3	The next known is Jovan Vladimir, who became a Bulgarian vassal.	62937aac345cc709eea15b1476dcac6298818335a312fea0792db3ab10e23414f78884919d112fcdf8b81c171a08b2a373d48a9eab2a140fde36895f15982ece	다음으로 알려진 인물은 불가리아의 가신이 된 조반 블라디미르입니다.	train
common_voice_en_20049726.mp3	"Johnson purchased the script and had Bob Gordon rewrite it into ""Galaxy Quest""."	62937aac345cc709eea15b1476dcac6298818335a312fea0792db3ab10e23414f78884919d112fcdf8b81c171a08b2a373d48a9eab2a140fde36895f15982ece	존슨은 대본을 구입해 밥 고든에게 '갤럭시 퀘스트'로 다시 쓰게 했습니다.	train
common_voice_en_20049727.mp3	"Rohde received a bachelor's degree in Fine Arts from Occidental College in Los Angeles."	62937aac345cc709eea15b1476dcac6298818335a312fea0792db3ab10e23414f78884919d112fcdf8b81c171a08b2a373d48a9eab2a140fde36895f15982ece	로데는 로스앤젤레스에 있는 옥시덴탈 칼리지에서 미술학 학사 학위를 받았습니다.	train
common_voice_en_20049729.mp3	The local gliding club also provides instruction in flying gliders and light aircraft.	62937aac345cc709eea15b1476dcac6298818335a312fea0792db3ab10e23414f78884919d112fcdf8b81c171a08b2a373d48a9eab2a140fde36895f15982ece	지역 글라이딩 클럽에서는 글라이더와 경비행기 비행 강습도 제공합니다.	train
common_voice_en_20049730.mp3	"Naval Institute's Distinguished Author of the Year."	62937aac345cc709eea15b1476dcac6298818335a312fea0792db3ab10e23414f78884919d112fcdf8b81c171a08b2a373d48a9eab2a140fde36895f15982ece	해군연구소의 올해의 저명한 저자.	train
common_voice_en_20049731.mp3	The investment began on September Nineteenth, exactly four months ago today.	62937aac345cc709eea15b1476dcac6298818335a312fea0792db3ab10e23414f78884919d112fcdf8b81c171a08b2a373d48a9eab2a140fde36895f15982ece	투자는 정확히 오늘로부터 4개월 전인 9월 19일에 시작되었습니다.	train
common_voice_en_20049732.mp3	A sharp white stripe extends from the forehead to the back of the neck.	62937aac345cc709eea15b1476dcac6298818335a312fea0792db3ab10e23414f78884919d112fcdf8b81c171a08b2a373d48a9eab2a140fde36895f15982ece	이마에서 목 뒤까지 선명한 흰색 줄무늬가 이어집니다.	train
common_voice_en_20049733.mp3	They slowly drifted apart.	62937aac345cc709eea15b1476dcac6298818335a312fea0792db3ab10e23414f78884919d112fcdf8b81c171a08b2a373d48a9eab2a140fde36895f15982ece	그들은 서서히 멀어졌습니다.	train
common_voice_en_20049734.mp3	The pseudonym August Klotz was given by Prinzhorn.	62937aac345cc709eea15b1476dcac6298818335a312fea0792db3ab10e23414f78884919d112fcdf8b81c171a08b2a373d48a9eab2a140fde36895f15982ece	아우구스트 클로츠라는 가명은 프린츠혼이 지어준 것입니다.	train
common_voice_en_20049751.mp3	Afterwards, Castle Pinckney was abandoned and fell into disrepair.	62937aac345cc709eea15b1476dcac6298818335a312fea0792db3ab10e23414f78884919d112fcdf8b81c171a08b2a373d48a9eab2a140fde36895f15982ece	그 후 핀크니 성은 버려져 폐허가 되었습니다.	train
common_voice_en_20049752.mp3	He has also toured extensively with such acts as The Crystal Method.	62937aac345cc709eea15b1476dcac6298818335a312fea0792db3ab10e23414f78884919d112fcdf8b81c171a08b2a373d48a9eab2a140fde36895f15982ece	그는 또한 '크리스탈 메소드' 등의 공연으로 광범위한 투어를 진행했습니다.	train
common_voice_en_20049753.mp3	An Elim Pentecostal Church, Kingdom Living Church, also meets at the Methodist church.	62937aac345cc709eea15b1476dcac6298818335a312fea0792db3ab10e23414f78884919d112fcdf8b81c171a08b2a373d48a9eab2a140fde36895f15982ece	엘림 오순절 교회인 킹덤 리빙 교회도 감리교회에서 모임을 갖습니다.	train
common_voice_en_20049754.mp3	Porsche substantially revised the suspension, replacing torsion bars with coil springs and shock absorbers.	62937aac345cc709eea15b1476dcac6298818335a312fea0792db3ab10e23414f78884919d112fcdf8b81c171a08b2a373d48a9eab2a140fde36895f15982ece	포르쉐는 토션 바를 코일 스프링과 쇼크 업소버로 교체하는 등 서스펜션을 대폭 수정했습니다.	train
common_voice_en_20049765.mp3	Dead and injured were taken to Dil-chora Hospital in Dire Dawa.	62937aac345cc709eea15b1476dcac6298818335a312fea0792db3ab10e23414f78884919d112fcdf8b81c171a08b2a373d48a9eab2a140fde36895f15982ece	사망자와 부상자들은 디어 다와에 있는 딜-초라 병원으로 이송되었습니다.	train
common_voice_en_20049766.mp3	This remains the prevailing position among Orthodox and Conservative Jews.	62937aac345cc709eea15b1476dcac6298818335a312fea0792db3ab10e23414f78884919d112fcdf8b81c171a08b2a373d48a9eab2a140fde36895f15982ece	이는 정통파 유대인과 보수파 유대인 사이에서 여전히 지배적인 입장입니다.	train
common_voice_en_20049767.mp3	Other programmers in this effort included John Ahlstrom, Greg George, and Joe Polak.	62937aac345cc709eea15b1476dcac6298818335a312fea0792db3ab10e23414f78884919d112fcdf8b81c171a08b2a373d48a9eab2a140fde36895f15982ece	이 작업에 참여한 다른 프로그래머로는 존 알스트롬, 그렉 조지, 조 폴락 등이 있습니다.	train
common_voice_en_20049768.mp3	Permafrost and underground ice are very common.	62937aac345cc709eea15b1476dcac6298818335a312fea0792db3ab10e23414f78884919d112fcdf8b81c171a08b2a373d48a9eab2a140fde36895f15982ece	영구 동토층과 지하 얼음은 매우 흔합니다.	train
common_voice_en_20049769.mp3	His name is commonly shortened to Schwerin.	62937aac345cc709eea15b1476dcac6298818335a312fea0792db3ab10e23414f78884919d112fcdf8b81c171a08b2a373d48a9eab2a140fde36895f15982ece	그의 이름은 일반적으로 슈베린으로 줄여서 부릅니다.	train
common_voice_en_20049780.mp3	Such pairs of polyhedra are still topologically or abstractly dual.	62937aac345cc709eea15b1476dcac6298818335a312fea0792db3ab10e23414f78884919d112fcdf8b81c171a08b2a373d48a9eab2a140fde36895f15982ece	이러한 다면체 쌍은 여전히 위상학적으로 또는 추상적으로 이중적입니다.	train
common_voice_en_20049781.mp3	Eddy developed his talent as a boy soprano in church choirs.	62937aac345cc709eea15b1476dcac6298818335a312fea0792db3ab10e23414f78884919d112fcdf8b81c171a08b2a373d48a9eab2a140fde36895f15982ece	에디는 교회 합창단에서 소년 소프라노로 활동하며 재능을 키웠습니다.	train
common_voice_en_20049782.mp3	I was mad about him.	62937aac345cc709eea15b1476dcac6298818335a312fea0792db3ab10e23414f78884919d112fcdf8b81c171a08b2a373d48a9eab2a140fde36895f15982ece	저는 그에게 화가 났어요.	train
common_voice_en_20049783.mp3	The Indian Coast Guard also has the rank of inspector general.	62937aac345cc709eea15b1476dcac6298818335a312fea0792db3ab10e23414f78884919d112fcdf8b81c171a08b2a373d48a9eab2a140fde36895f15982ece	인도 해안 경비대에는 감찰관 직급도 있습니다.	train
common_voice_en_20049784.mp3	The outfield distances replicate those of Yankee stadium where Maris made history.	62937aac345cc709eea15b1476dcac6298818335a312fea0792db3ab10e23414f78884919d112fcdf8b81c171a08b2a373d48a9eab2a140fde36895f15982ece	외야 거리는 마리스가 역사를 만든 양키 스타디움의 외야 거리를 재현했습니다.	train
common_voice_en_20049786.mp3	The myth of the Hall of Records is featured in many creative works.	62937aac345cc709eea15b1476dcac6298818335a312fea0792db3ab10e23414f78884919d112fcdf8b81c171a08b2a373d48a9eab2a140fde36895f15982ece	기록의 전당의 신화는 많은 창의적인 작품에 등장합니다.	train
common_voice_en_20049787.mp3	He then took a fellowship at the New York Orthopedic Hospital.	62937aac345cc709eea15b1476dcac6298818335a312fea0792db3ab10e23414f78884919d112fcdf8b81c171a08b2a373d48a9eab2a140fde36895f15982ece	그 후 뉴욕 정형외과 병원에서 펠로우십을 받았습니다.	train
common_voice_en_20049788.mp3	And further on other people are buying annuities.	62937aac345cc709eea15b1476dcac6298818335a312fea0792db3ab10e23414f78884919d112fcdf8b81c171a08b2a373d48a9eab2a140fde36895f15982ece	그리고 더 나아가 다른 사람들도 연금을 구매하고 있습니다.	train
common_voice_en_20049789.mp3	"""Nightlife"" adds the option to add a ""downtown"" sub-neighborhood to each proper neighborhood."	62937aac345cc709eea15b1476dcac6298818335a312fea0792db3ab10e23414f78884919d112fcdf8b81c171a08b2a373d48a9eab2a140fde36895f15982ece	"나이트 라이프"는 각 적절한 이웃에 ‘시내’ 하위 이웃을 추가하는 옵션을 추가합니다."	train
common_voice_en_20049795.mp3	Destinations include: Westerham, Redhill, East Grinstead and Caterham.	62937aac345cc709eea15b1476dcac6298818335a312fea0792db3ab10e23414f78884919d112fcdf8b81c171a08b2a373d48a9eab2a140fde36895f15982ece	목적지는 다음과 같습니다: 웨스터햄, 레드힐, 이스트 그린스테드 및 케이터햄.	train
common_voice_en_20049796.mp3	Madame Groupil, now seventy-two years old, was beaten unconscious and suffered multiple stab wounds.	62937aac345cc709eea15b1476dcac6298818335a312fea0792db3ab10e23414f78884919d112fcdf8b81c171a08b2a373d48a9eab2a140fde36895f15982ece	현재 72세인 그루길 여사는 의식을 잃은 채 구타당해 여러 차례 자상을 입었습니다.	train
common_voice_en_20049797.mp3	Side effects are common.	62937aac345cc709eea15b1476dcac6298818335a312fea0792db3ab10e23414f78884919d112fcdf8b81c171a08b2a373d48a9eab2a140fde36895f15982ece	부작용은 흔한 일입니다.	train
common_voice_en_20049798.mp3	Sandalwood garlands are used to dress the body during Jain cremation ceremonies.	62937aac345cc709eea15b1476dcac6298818335a312fea0792db3ab10e23414f78884919d112fcdf8b81c171a08b2a373d48a9eab2a140fde36895f15982ece	샌달우드 화환은 자이나교 화장 의식에서 시신을 입히는 데 사용됩니다.	train
common_voice_en_20049799.mp3	Glover was born in Sheffield, West Riding of Yorkshire, but grew up in Barnsley.	62937aac345cc709eea15b1476dcac6298818335a312fea0792db3ab10e23414f78884919d112fcdf8b81c171a08b2a373d48a9eab2a140fde36895f15982ece	글로버는 요크셔주 웨스트 라이딩의 셰필드에서 태어났지만 반슬리에서 자랐습니다.	train
common_voice_en_20049810.mp3	"A common nickname for the car is ""'Sud""."	62937aac345cc709eea15b1476dcac6298818335a312fea0792db3ab10e23414f78884919d112fcdf8b81c171a08b2a373d48a9eab2a140fde36895f15982ece	이 차의 일반적인 별명은 '수드'입니다.	train
common_voice_en_20049811.mp3	Toyoyama is located in the flatlands of central Aichi Prefecture.	62937aac345cc709eea15b1476dcac6298818335a312fea0792db3ab10e23414f78884919d112fcdf8b81c171a08b2a373d48a9eab2a140fde36895f15982ece	도요야마는 아이치현 중부의 평지에 위치해 있습니다.	train
common_voice_en_20049812.mp3	The return game was won by Club Olimpia by the same score.	62937aac345cc709eea15b1476dcac6298818335a312fea0792db3ab10e23414f78884919d112fcdf8b81c171a08b2a373d48a9eab2a140fde36895f15982ece	리턴 매치에서는 클럽 올림피아가 같은 스코어로 승리했습니다.	train
common_voice_en_20049813.mp3	"That wasn't exactly the case with our next two records."	62937aac345cc709eea15b1476dcac6298818335a312fea0792db3ab10e23414f78884919d112fcdf8b81c171a08b2a373d48a9eab2a140fde36895f15982ece	다음 두 개의 기록은 그렇지 않았습니다.	train
common_voice_en_20049814.mp3	"Early English settlers called it the ""Sandwich River"" and also the ""Hawkes River""."	62937aac345cc709eea15b1476dcac6298818335a312fea0792db3ab10e23414f78884919d112fcdf8b81c171a08b2a373d48a9eab2a140fde36895f15982ece	초기 영국 정착민들은 이 강을 "샌드위치 강" 또는 "호크스 강"이라고 불렀습니다.	train
common_voice_en_20049825.mp3	"""A Free Soul"" stars Norma Shearer, Leslie Howard, Lionel Barrymore, and Clark Gable."	62937aac345cc709eea15b1476dcac6298818335a312fea0792db3ab10e23414f78884919d112fcdf8b81c171a08b2a373d48a9eab2a140fde36895f15982ece	노마 시어러, 레슬리 하워드, 라이오넬 배리모어, 클락 게이블 등이 출연합니다.	train
common_voice_en_20049826.mp3	Alwinton is in the parliamentary constituency of Berwick-upon-Tweed.	62937aac345cc709eea15b1476dcac6298818335a312fea0792db3ab10e23414f78884919d112fcdf8b81c171a08b2a373d48a9eab2a140fde36895f15982ece	알윈턴은 버윅-어폰-트위드의 국회의원 선거구에 속해 있습니다.	train
common_voice_en_20049827.mp3	Bettinus lies due south of the Schiller-Zucchius Basin.	62937aac345cc709eea15b1476dcac6298818335a312fea0792db3ab10e23414f78884919d112fcdf8b81c171a08b2a373d48a9eab2a140fde36895f15982ece	베티누스는 쉴러-주키우스 분지 남쪽에 있습니다.	train
common_voice_en_20049828.mp3	"""Awamori"" is aged underground in constant cool temperatures in clay pots or vases."	62937aac345cc709eea15b1476dcac6298818335a312fea0792db3ab10e23414f78884919d112fcdf8b81c171a08b2a373d48a9eab2a140fde36895f15982ece	'아와모리'는 항아리나 꽃병에 담아 일정한 서늘한 온도에서 지하에서 숙성시킵니다.	train
common_voice_en_20049829.mp3	Pavone recorded a total of thirteen albums.	62937aac345cc709eea15b1476dcac6298818335a312fea0792db3ab10e23414f78884919d112fcdf8b81c171a08b2a373d48a9eab2a140fde36895f15982ece	파보네는 총 13개의 앨범을 녹음했습니다.	train
common_voice_en_20049830.mp3	However, he was on a losing team each season in Pittsburgh.	62937aac345cc709eea15b1476dcac6298818335a312fea0792db3ab10e23414f78884919d112fcdf8b81c171a08b2a373d48a9eab2a140fde36895f15982ece	하지만 그는 피츠버그에서 매 시즌 패배하는 팀에 속해 있었습니다.	train
common_voice_en_20049831.mp3	"The album spawned three singles: ""Pop"", ""Gone"" and ""Girlfriend""."	62937aac345cc709eea15b1476dcac6298818335a312fea0792db3ab10e23414f78884919d112fcdf8b81c171a08b2a373d48a9eab2a140fde36895f15982ece	이 앨범은 세 개의 싱글을 낳았습니다: "팝", ‘사라져’, ‘여자친구’.	train
common_voice_en_20049832.mp3	Somerset has a mayor-council form of city government.	62937aac345cc709eea15b1476dcac6298818335a312fea0792db3ab10e23414f78884919d112fcdf8b81c171a08b2a373d48a9eab2a140fde36895f15982ece	서머셋은 시장-의회 형태의 시 정부를 운영하고 있습니다.	train
common_voice_en_20049833.mp3	These images blend European and indigenous artistic traditions.	62937aac345cc709eea15b1476dcac6298818335a312fea0792db3ab10e23414f78884919d112fcdf8b81c171a08b2a373d48a9eab2a140fde36895f15982ece	이 이미지들은 유럽과 원주민의 예술적 전통이 조화를 이루고 있습니다.	train
common_voice_en_20049834.mp3	Only fatigue seems to have given her pause.	62937aac345cc709eea15b1476dcac6298818335a312fea0792db3ab10e23414f78884919d112fcdf8b81c171a08b2a373d48a9eab2a140fde36895f15982ece	피곤함만이 그녀를 잠시 멈추게 한 것 같습니다.	train
common_voice_en_20049845.mp3	This is no exercise.	62937aac345cc709eea15b1476dcac6298818335a312fea0792db3ab10e23414f78884919d112fcdf8b81c171a08b2a373d48a9eab2a140fde36895f15982ece	이것은 운동이 아닙니다.	train
common_voice_en_20049846.mp3	The Genesee River helps define the east town line.	62937aac345cc709eea15b1476dcac6298818335a312fea0792db3ab10e23414f78884919d112fcdf8b81c171a08b2a373d48a9eab2a140fde36895f15982ece	제네시 강은 동쪽 마을의 경계선을 정의하는 데 도움이 됩니다.	train
common_voice_en_20049847.mp3	It ranges over western and central Australia, often inhabiting very dry, near desert areas.	62937aac345cc709eea15b1476dcac6298818335a312fea0792db3ab10e23414f78884919d112fcdf8b81c171a08b2a373d48a9eab2a140fde36895f15982ece	호주 서부 및 중부 지역에 걸쳐 분포하며, 매우 건조한 사막 근처에서 서식하는 경우가 많습니다.	train
common_voice_en_20049848.mp3	Upon learning this, Tony pummels Joe, who leaves the vineyards.	62937aac345cc709eea15b1476dcac6298818335a312fea0792db3ab10e23414f78884919d112fcdf8b81c171a08b2a373d48a9eab2a140fde36895f15982ece	이 사실을 알게 된 토니는 포도밭을 떠나는 조를 때립니다.	train
common_voice_en_20049849.mp3	"Chamoun's political boycott did not extend to municipal politics."	62937aac345cc709eea15b1476dcac6298818335a312fea0792db3ab10e23414f78884919d112fcdf8b81c171a08b2a373d48a9eab2a140fde36895f15982ece	샤문의 정치 보이콧은 지자체 정치까지 확대되지는 않았습니다.	train
common_voice_en_20049859.mp3	He went to Strasburg and Basel, but met with failure.	62937aac345cc709eea15b1476dcac6298818335a312fea0792db3ab10e23414f78884919d112fcdf8b81c171a08b2a373d48a9eab2a140fde36895f15982ece	그는 스트라스부르크와 바젤에 갔지만 실패를 맛보았습니다.	train
common_voice_en_20049861.mp3	The video game was based on this season.	62937aac345cc709eea15b1476dcac6298818335a312fea0792db3ab10e23414f78884919d112fcdf8b81c171a08b2a373d48a9eab2a140fde36895f15982ece	비디오 게임은 이번 시즌을 기반으로 제작되었습니다.	train
common_voice_en_20049862.mp3	The formula is proved as follows.	62937aac345cc709eea15b1476dcac6298818335a312fea0792db3ab10e23414f78884919d112fcdf8b81c171a08b2a373d48a9eab2a140fde36895f15982ece	공식은 다음과 같이 증명됩니다.	train
common_voice_en_20049863.mp3	"The obsolete name ""Ecpantheria scribonia"" is still occasionally encountered."	62937aac345cc709eea15b1476dcac6298818335a312fea0792db3ab10e23414f78884919d112fcdf8b81c171a08b2a373d48a9eab2a140fde36895f15982ece	사용되지 않는 이름인 '에크판테리아 스크리보니아'는 여전히 가끔씩 발견됩니다.	train
common_voice_en_20049864.mp3	From that point the motorway is six lanes up to the Pacific Motorway Merge.	62937aac345cc709eea15b1476dcac6298818335a312fea0792db3ab10e23414f78884919d112fcdf8b81c171a08b2a373d48a9eab2a140fde36895f15982ece	이 지점부터 태평양 고속도로 합류 지점까지 6차선 고속도로가 이어집니다.	train
common_voice_en_20049875.mp3	"The ""T"" in his name stands for ""The."	62937aac345cc709eea15b1476dcac6298818335a312fea0792db3ab10e23414f78884919d112fcdf8b81c171a08b2a373d48a9eab2a140fde36895f15982ece	그의 이름에서 "T"는 "The"를 의미합니다.	train
