path	sentence	client_id	translation	split
common_voice_en_18680782.mp3	The material may be graphite, beryllium, steel, tungsten carbide, or other materials.	4311ac2c9248c11f2c6a52cd2a2b3f7541c3058634ec391e4195c707bcfd2983f577468c8955ca622540e3c13a7a866839a8c84278e97eb2530e789a162231e9	재료는 흑연, 베릴륨, 강철, 텅스텐 카바이드 또는 기타 재료일 수 있습니다.	train
common_voice_en_18680783.mp3	Xiuhtecuhtli dwelt inside an enclosure of turquoise stones, fortifying himself with turquoise bird water.	4311ac2c9248c11f2c6a52cd2a2b3f7541c3058634ec391e4195c707bcfd2983f577468c8955ca622540e3c13a7a866839a8c84278e97eb2530e789a162231e9	시우테쿠틀리는 청록색 돌로 만든 울타리 안에 살면서 청록색 새의 물로 몸을 강화했습니다.	train
common_voice_en_18680784.mp3	The objectivity of the analysis departs from moral considerations and moralistic views.	4311ac2c9248c11f2c6a52cd2a2b3f7541c3058634ec391e4195c707bcfd2983f577468c8955ca622540e3c13a7a866839a8c84278e97eb2530e789a162231e9	분석의 객관성은 도덕적 고려 사항과 도덕주의적 견해에서 출발합니다.	train
common_voice_en_18680785.mp3	Its rivers and creeks intersperse throughout the length and breadth of the municipality.	4311ac2c9248c11f2c6a52cd2a2b3f7541c3058634ec391e4195c707bcfd2983f577468c8955ca622540e3c13a7a866839a8c84278e97eb2530e789a162231e9	강과 개울이 시정촌의 길이와 폭에 걸쳐 산재해 있습니다.	train
common_voice_en_18680786.mp3	They have two daughters, Colette and Charlotte.	4311ac2c9248c11f2c6a52cd2a2b3f7541c3058634ec391e4195c707bcfd2983f577468c8955ca622540e3c13a7a866839a8c84278e97eb2530e789a162231e9	그들에게는 두 딸, 콜레트와 샬롯이 있습니다.	train
common_voice_en_18680787.mp3	"The band's genre has been described as metalcore."	4311ac2c9248c11f2c6a52cd2a2b3f7541c3058634ec391e4195c707bcfd2983f577468c8955ca622540e3c13a7a866839a8c84278e97eb2530e789a162231e9	이 밴드의 장르는 메탈코어입니다.	train
common_voice_en_18680788.mp3	He was buried in Calvary Cemetery in the west suburb of McKees Rocks.	4311ac2c9248c11f2c6a52cd2a2b3f7541c3058634ec391e4195c707bcfd2983f577468c8955ca622540e3c13a7a866839a8c84278e97eb2530e789a162231e9	그는 맥키스 록스 서쪽 교외에 있는 갈보리 묘지에 묻혔습니다.	train
common_voice_en_18680789.mp3	"But more possibly it is related to the German ""mahlen"" which means ""to mill""."	4311ac2c9248c11f2c6a52cd2a2b3f7541c3058634ec391e4195c707bcfd2983f577468c8955ca622540e3c13a7a866839a8c84278e97eb2530e789a162231e9	그러나 "밀다"라는 뜻의 독일어 "말렌"과 관련이 있을 가능성이 더 높습니다.	train
common_voice_en_18680790.mp3	Such reagents are used to attach butyl groups to various substrates.	4311ac2c9248c11f2c6a52cd2a2b3f7541c3058634ec391e4195c707bcfd2983f577468c8955ca622540e3c13a7a866839a8c84278e97eb2530e789a162231e9	이러한 시약은 다양한 기질에 부틸기를 부착하는 데 사용됩니다.	train
common_voice_en_18680791.mp3	All of the tracks feature heavy use of distortion and guitar.	4311ac2c9248c11f2c6a52cd2a2b3f7541c3058634ec391e4195c707bcfd2983f577468c8955ca622540e3c13a7a866839a8c84278e97eb2530e789a162231e9	모든 트랙은 디스토션과 기타를 많이 사용하는 것이 특징입니다.	train
common_voice_en_18680792.mp3	But the best ships are friendships, and may they always be.	4311ac2c9248c11f2c6a52cd2a2b3f7541c3058634ec391e4195c707bcfd2983f577468c8955ca622540e3c13a7a866839a8c84278e97eb2530e789a162231e9	하지만 최고의 배는 우정이며, 항상 우정이 있기를 바랍니다.	train
common_voice_en_18680793.mp3	The pressure rises to a maximum level.	4311ac2c9248c11f2c6a52cd2a2b3f7541c3058634ec391e4195c707bcfd2983f577468c8955ca622540e3c13a7a866839a8c84278e97eb2530e789a162231e9	압력이 최대 수준까지 상승합니다.	train
common_voice_en_18680794.mp3	"It had simply been understood that you didn't put a Chinese up for membership""."	4311ac2c9248c11f2c6a52cd2a2b3f7541c3058634ec391e4195c707bcfd2983f577468c8955ca622540e3c13a7a866839a8c84278e97eb2530e789a162231e9	"중국인을 회원으로 등록하지 않은 것으로 이해했습니다."	train
common_voice_en_18680795.mp3	Crane’s hobbies include water skiing, swimming and surfing.	4311ac2c9248c11f2c6a52cd2a2b3f7541c3058634ec391e4195c707bcfd2983f577468c8955ca622540e3c13a7a866839a8c84278e97eb2530e789a162231e9	크레인의 취미는 수상 스키, 수영, 서핑입니다.	train
common_voice_en_18680796.mp3	Greenberg, Drs.	4311ac2c9248c11f2c6a52cd2a2b3f7541c3058634ec391e4195c707bcfd2983f577468c8955ca622540e3c13a7a866839a8c84278e97eb2530e789a162231e9	그린버그 박사	train
common_voice_en_18680797.mp3	Crailsheim became a possession of the Burgrave of Nuremberg following the siege.	4311ac2c9248c11f2c6a52cd2a2b3f7541c3058634ec391e4195c707bcfd2983f577468c8955ca622540e3c13a7a866839a8c84278e97eb2530e789a162231e9	포위 공격 이후 크라일즈하임은 뉘른베르크의 버그레이브의 소유물이 되었습니다.	train
common_voice_en_18680799.mp3	"Peruvian popular opinion considered the treaty as detrimental to Peru's national honor."	4311ac2c9248c11f2c6a52cd2a2b3f7541c3058634ec391e4195c707bcfd2983f577468c8955ca622540e3c13a7a866839a8c84278e97eb2530e789a162231e9	페루의 여론은 이 조약이 페루의 국가적 명예에 해롭다고 생각했습니다.	train
common_voice_en_18680800.mp3	The last reported population was restricted to Georgian Bay off Lake Huron in Canada.	4311ac2c9248c11f2c6a52cd2a2b3f7541c3058634ec391e4195c707bcfd2983f577468c8955ca622540e3c13a7a866839a8c84278e97eb2530e789a162231e9	마지막으로 보고된 인구는 캐나다 휴런 호수 연안의 조지안 베이로 제한되었습니다.	train
common_voice_en_18680801.mp3	"One of Harbin's beers is a wheat beer."	4311ac2c9248c11f2c6a52cd2a2b3f7541c3058634ec391e4195c707bcfd2983f577468c8955ca622540e3c13a7a866839a8c84278e97eb2530e789a162231e9	하얼빈의 맥주 중 하나는 밀맥주입니다.	train
common_voice_en_18680802.mp3	Korakias peak is a part of Mount Kouroupas, above the modern village of Atsipades.	4311ac2c9248c11f2c6a52cd2a2b3f7541c3058634ec391e4195c707bcfd2983f577468c8955ca622540e3c13a7a866839a8c84278e97eb2530e789a162231e9	코라키아스 봉우리는 쿠루파스 산의 일부로, 현대식 마을 아치파데스 위에 있습니다.	train
common_voice_en_18680803.mp3	Details are included in the civil parish of Aldwark, North Yorkshire.	4311ac2c9248c11f2c6a52cd2a2b3f7541c3058634ec391e4195c707bcfd2983f577468c8955ca622540e3c13a7a866839a8c84278e97eb2530e789a162231e9	자세한 내용은 노스요크셔 알드워크의 시민 교구에서 확인할 수 있습니다.	train
common_voice_en_18680804.mp3	I am against any order which interferes with that objective.	4311ac2c9248c11f2c6a52cd2a2b3f7541c3058634ec391e4195c707bcfd2983f577468c8955ca622540e3c13a7a866839a8c84278e97eb2530e789a162231e9	저는 그 목적을 방해하는 모든 명령에 반대합니다.	train
common_voice_en_18680805.mp3	in music from the San Francisco Conservatory of Music.	4311ac2c9248c11f2c6a52cd2a2b3f7541c3058634ec391e4195c707bcfd2983f577468c8955ca622540e3c13a7a866839a8c84278e97eb2530e789a162231e9	샌프란시스코 음악원에서 음악을 전공했습니다.	train
common_voice_en_18680806.mp3	Like most other emeralds, the downy emerald has bright shiny green eyes.	4311ac2c9248c11f2c6a52cd2a2b3f7541c3058634ec391e4195c707bcfd2983f577468c8955ca622540e3c13a7a866839a8c84278e97eb2530e789a162231e9	대부분의 다른 에메랄드와 마찬가지로 솜털 에메랄드도 밝고 반짝이는 녹색 눈을 가지고 있습니다.	train
common_voice_en_18680807.mp3	The mid-eighties saw the range expanding to encompass liquid detergent and compact powder.	4311ac2c9248c11f2c6a52cd2a2b3f7541c3058634ec391e4195c707bcfd2983f577468c8955ca622540e3c13a7a866839a8c84278e97eb2530e789a162231e9	80년대 중반에는 액체 세제와 콤팩트 파우더로 그 범위가 확장되었습니다.	train
common_voice_en_18680808.mp3	It is located in the community of St. Johns.	4311ac2c9248c11f2c6a52cd2a2b3f7541c3058634ec391e4195c707bcfd2983f577468c8955ca622540e3c13a7a866839a8c84278e97eb2530e789a162231e9	세인트 존스 커뮤니티에 위치해 있습니다.	train
common_voice_en_18680809.mp3	These are usually removed from the assembled machine code by the assembler.	4311ac2c9248c11f2c6a52cd2a2b3f7541c3058634ec391e4195c707bcfd2983f577468c8955ca622540e3c13a7a866839a8c84278e97eb2530e789a162231e9	이는 일반적으로 어셈블러에 의해 어셈블된 머신 코드에서 제거됩니다.	train
common_voice_en_18680810.mp3	To everyone that they are responsible for, they remain fiercely true.	4311ac2c9248c11f2c6a52cd2a2b3f7541c3058634ec391e4195c707bcfd2983f577468c8955ca622540e3c13a7a866839a8c84278e97eb2530e789a162231e9	그들이 책임지고 있는 모든 사람에게, 그들은 여전히 치열하게 진실합니다.	train
common_voice_en_18680811.mp3	Dawn, Doug E. Fresh, Gravediggaz, and New Kingdom.	4311ac2c9248c11f2c6a52cd2a2b3f7541c3058634ec391e4195c707bcfd2983f577468c8955ca622540e3c13a7a866839a8c84278e97eb2530e789a162231e9	던, 더그 E. 프레시, 그레이브디가즈, 뉴킹덤.	train
common_voice_en_18680812.mp3	The capital is Ungoofaaru.	4311ac2c9248c11f2c6a52cd2a2b3f7541c3058634ec391e4195c707bcfd2983f577468c8955ca622540e3c13a7a866839a8c84278e97eb2530e789a162231e9	수도는 운구파루입니다.	train
common_voice_en_18680813.mp3	The album was recorded in Los Angeles and in London at Abbey Road Studios.	4311ac2c9248c11f2c6a52cd2a2b3f7541c3058634ec391e4195c707bcfd2983f577468c8955ca622540e3c13a7a866839a8c84278e97eb2530e789a162231e9	이 앨범은 로스앤젤레스와 런던의 애비 로드 스튜디오에서 녹음되었습니다.	train
common_voice_en_18680814.mp3	This chapter is about Endocrine, nutritional and metabolic diseases.	4311ac2c9248c11f2c6a52cd2a2b3f7541c3058634ec391e4195c707bcfd2983f577468c8955ca622540e3c13a7a866839a8c84278e97eb2530e789a162231e9	이 장에서는 내분비, 영양 및 대사 질환에 대해 설명합니다.	train
common_voice_en_18680815.mp3	The Cathedra represents his three main offices of teaching, sanctifying and governing.	4311ac2c9248c11f2c6a52cd2a2b3f7541c3058634ec391e4195c707bcfd2983f577468c8955ca622540e3c13a7a866839a8c84278e97eb2530e789a162231e9	카테드라는 가르치고, 거룩하게 하고, 다스리는 세 가지 주요 직분을 상징합니다.	train
common_voice_en_18680816.mp3	"Williams' girlfriend is played by Australian model Lisa Seiffert."	4311ac2c9248c11f2c6a52cd2a2b3f7541c3058634ec391e4195c707bcfd2983f577468c8955ca622540e3c13a7a866839a8c84278e97eb2530e789a162231e9	윌리엄스의 여자 친구는 호주 모델 리사 세이퍼트가 연기합니다.	train
common_voice_en_18680822.mp3	Now they include University teams from the London area that are not in UoL.	4311ac2c9248c11f2c6a52cd2a2b3f7541c3058634ec391e4195c707bcfd2983f577468c8955ca622540e3c13a7a866839a8c84278e97eb2530e789a162231e9	이제 UoL에 속하지 않은 런던 지역의 대학 팀도 포함됩니다.	train
common_voice_en_18680823.mp3	Floyd birdied the first extra hole.	4311ac2c9248c11f2c6a52cd2a2b3f7541c3058634ec391e4195c707bcfd2983f577468c8955ca622540e3c13a7a866839a8c84278e97eb2530e789a162231e9	플로이드가 첫 번째 추가 홀에서 버디를 기록했습니다.	train
common_voice_en_18680824.mp3	In this comic book Goofy appears in different parody type stories.	4311ac2c9248c11f2c6a52cd2a2b3f7541c3058634ec391e4195c707bcfd2983f577468c8955ca622540e3c13a7a866839a8c84278e97eb2530e789a162231e9	이 만화책에서 구피는 다양한 패러디 유형의 이야기에 등장합니다.	train
common_voice_en_18680825.mp3	This refusal to condemn violence brought the agreements to an end.	4311ac2c9248c11f2c6a52cd2a2b3f7541c3058634ec391e4195c707bcfd2983f577468c8955ca622540e3c13a7a866839a8c84278e97eb2530e789a162231e9	폭력에 대한 비난을 거부하는 이러한 태도로 인해 합의가 결렬되었습니다.	train
common_voice_en_18680826.mp3	He is primarily known for directing comedy television shows.	4311ac2c9248c11f2c6a52cd2a2b3f7541c3058634ec391e4195c707bcfd2983f577468c8955ca622540e3c13a7a866839a8c84278e97eb2530e789a162231e9	그는 주로 코미디 TV 쇼를 연출하는 것으로 유명합니다.	train
common_voice_en_18680827.mp3	He has won four Swedish Championships.	4311ac2c9248c11f2c6a52cd2a2b3f7541c3058634ec391e4195c707bcfd2983f577468c8955ca622540e3c13a7a866839a8c84278e97eb2530e789a162231e9	그는 스웨덴 챔피언십에서 네 차례 우승했습니다.	train
common_voice_en_18680828.mp3	"The operative method of the Wehrmacht in Poland followed the more traditional ""Vernichtungsgedanke""."	4311ac2c9248c11f2c6a52cd2a2b3f7541c3058634ec391e4195c707bcfd2983f577468c8955ca622540e3c13a7a866839a8c84278e97eb2530e789a162231e9	폴란드에서 독일군의 작전 방식은 보다 전통적인 '베르니히퉁스게안케'를 따랐습니다.	train
common_voice_en_18680829.mp3	"He is also an executive producer for comedy television series ""Detroiters""."	4311ac2c9248c11f2c6a52cd2a2b3f7541c3058634ec391e4195c707bcfd2983f577468c8955ca622540e3c13a7a866839a8c84278e97eb2530e789a162231e9	또한 코미디 TV 시리즈 '디트로이터스'의 총괄 프로듀서이기도 합니다.	train
common_voice_en_18680830.mp3	"""I said, 'This may be a little old for me."	4311ac2c9248c11f2c6a52cd2a2b3f7541c3058634ec391e4195c707bcfd2983f577468c8955ca622540e3c13a7a866839a8c84278e97eb2530e789a162231e9	'저한테는 좀 오래된 것 같아요.	train
common_voice_en_18680831.mp3	He has advocated civil disobedience in a comment on Ley Sinde.	4311ac2c9248c11f2c6a52cd2a2b3f7541c3058634ec391e4195c707bcfd2983f577468c8955ca622540e3c13a7a866839a8c84278e97eb2530e789a162231e9	그는 레이 신데에 대한 논평에서 시민 불복종을 옹호한 바 있습니다.	train
common_voice_en_18680832.mp3	"Both countries are Pakistan's neighbours having significant strategic importance for her."	4311ac2c9248c11f2c6a52cd2a2b3f7541c3058634ec391e4195c707bcfd2983f577468c8955ca622540e3c13a7a866839a8c84278e97eb2530e789a162231e9	두 나라는 파키스탄의 이웃 국가로 파키스탄에게 전략적으로 매우 중요한 국가입니다.	train
common_voice_en_18680833.mp3	Aike Grange Stud is a dressage park, and hosts regional competitions.	4311ac2c9248c11f2c6a52cd2a2b3f7541c3058634ec391e4195c707bcfd2983f577468c8955ca622540e3c13a7a866839a8c84278e97eb2530e789a162231e9	아이케 그랜지 스터드는 마장마술 공원이며 지역 대회를 개최합니다.	train
common_voice_en_18680834.mp3	The line-up was Martin Belmont, Sean Tyla, Micky Groome and Billy Rankin.	4311ac2c9248c11f2c6a52cd2a2b3f7541c3058634ec391e4195c707bcfd2983f577468c8955ca622540e3c13a7a866839a8c84278e97eb2530e789a162231e9	마틴 벨몬트, 숀 타일라, 미키 그룸, 빌리 랭킨이 라인업에 올랐습니다.	train
common_voice_en_18680836.mp3	The forum allowed her visitors to get answers to the many questions they had.	4311ac2c9248c11f2c6a52cd2a2b3f7541c3058634ec391e4195c707bcfd2983f577468c8955ca622540e3c13a7a866839a8c84278e97eb2530e789a162231e9	포럼을 통해 방문자들은 많은 질문에 대한 답을 얻을 수 있었습니다.	train
common_voice_en_18680837.mp3	When human subjects were given time to practice, they substantially outperformed the young chimps.	4311ac2c9248c11f2c6a52cd2a2b3f7541c3058634ec391e4195c707bcfd2983f577468c8955ca622540e3c13a7a866839a8c84278e97eb2530e789a162231e9	인간 피험자에게 연습할 시간이 주어졌을 때, 인간 피험자는 어린 침팬지보다 훨씬 더 뛰어난 성과를 거두었습니다.	train
common_voice_en_18680838.mp3	The station building still stands, but is not used for railway purposes.	4311ac2c9248c11f2c6a52cd2a2b3f7541c3058634ec391e4195c707bcfd2983f577468c8955ca622540e3c13a7a866839a8c84278e97eb2530e789a162231e9	역 건물은 여전히 남아 있지만 철도 용도로는 사용되지 않습니다.	train
common_voice_en_18680839.mp3	He then eventually seals the Daevas into the box from which he released them.	4311ac2c9248c11f2c6a52cd2a2b3f7541c3058634ec391e4195c707bcfd2983f577468c8955ca622540e3c13a7a866839a8c84278e97eb2530e789a162231e9	그런 다음 그는 결국 데바를 풀어준 상자에 봉인합니다.	train
common_voice_en_18680840.mp3	Though successful, he abruptly quit, as he enjoyed dirt jumping more than racing.	4311ac2c9248c11f2c6a52cd2a2b3f7541c3058634ec391e4195c707bcfd2983f577468c8955ca622540e3c13a7a866839a8c84278e97eb2530e789a162231e9	성공은 했지만 레이싱보다 더트 점프를 더 좋아했던 그는 갑작스럽게 그만두었습니다.	train
