path	sentence	client_id	translation	split
common_voice_en_19725952.mp3	Historian Zachary J.	3c1898a1da75b527a778bc6cd314d434b70e03531e5fe820f3295c2ba00c19d1589d4f8c1449c869753e07c3eaee9796a0e591aad8e4eba3ec50ed5cec5022f5	역사학자 재커리 제이	train
common_voice_en_19725953.mp3	The Blue Moon is called Ladeca.	3c1898a1da75b527a778bc6cd314d434b70e03531e5fe820f3295c2ba00c19d1589d4f8c1449c869753e07c3eaee9796a0e591aad8e4eba3ec50ed5cec5022f5	블루문은 라데카라고 합니다.	train
common_voice_en_19725954.mp3	"""The Doors"" is a quiet book."	3c1898a1da75b527a778bc6cd314d434b70e03531e5fe820f3295c2ba00c19d1589d4f8c1449c869753e07c3eaee9796a0e591aad8e4eba3ec50ed5cec5022f5	"The Doors"는 조용한 책입니다."	train
common_voice_en_19725965.mp3	They ask for an Ice House, I give them- a Frieze.	3c1898a1da75b527a778bc6cd314d434b70e03531e5fe820f3295c2ba00c19d1589d4f8c1449c869753e07c3eaee9796a0e591aad8e4eba3ec50ed5cec5022f5	아이스 하우스를 요청하면 프리즈를 제공합니다.	train
common_voice_en_19725966.mp3	Fields never was an amateur.	3c1898a1da75b527a778bc6cd314d434b70e03531e5fe820f3295c2ba00c19d1589d4f8c1449c869753e07c3eaee9796a0e591aad8e4eba3ec50ed5cec5022f5	필즈는 결코 아마추어가 아니었습니다.	train
common_voice_en_19725967.mp3	Other pioneering manufacturers were Alvin Puffer, Andrew Morse, Gustavus Dows, and James Tufts.	3c1898a1da75b527a778bc6cd314d434b70e03531e5fe820f3295c2ba00c19d1589d4f8c1449c869753e07c3eaee9796a0e591aad8e4eba3ec50ed5cec5022f5	다른 선구적인 제조업체로는 앨빈 퍼퍼, 앤드류 모스, 구스타버스 다우즈, 제임스 터프츠 등이 있습니다.	train
common_voice_en_19725968.mp3	Drawn by Tom Paterson.	3c1898a1da75b527a778bc6cd314d434b70e03531e5fe820f3295c2ba00c19d1589d4f8c1449c869753e07c3eaee9796a0e591aad8e4eba3ec50ed5cec5022f5	톰 패터슨이 그렸습니다.	train
common_voice_en_19725969.mp3	"Alternatively, the name may derive from Native American words meaning ""stone island""."	3c1898a1da75b527a778bc6cd314d434b70e03531e5fe820f3295c2ba00c19d1589d4f8c1449c869753e07c3eaee9796a0e591aad8e4eba3ec50ed5cec5022f5	또는 "돌섬"을 의미하는 아메리카 원주민 단어에서 유래한 이름일 수도 있습니다.	train
common_voice_en_19725985.mp3	Paxville is believed to be the oldest town in Clarendon County.	3c1898a1da75b527a778bc6cd314d434b70e03531e5fe820f3295c2ba00c19d1589d4f8c1449c869753e07c3eaee9796a0e591aad8e4eba3ec50ed5cec5022f5	팍스빌은 클레렌던 카운티에서 가장 오래된 마을로 알려져 있습니다.	train
common_voice_en_19725986.mp3	"German techno band Scooter sampled ""Exile"" on their single ""Jigga Jigga!"	3c1898a1da75b527a778bc6cd314d434b70e03531e5fe820f3295c2ba00c19d1589d4f8c1449c869753e07c3eaee9796a0e591aad8e4eba3ec50ed5cec5022f5	독일 테크노 밴드 스쿠터는 싱글 '지그가 지그가'에서 "Exile"을 샘플링했습니다!	train
common_voice_en_19725987.mp3	They erupt out of the breeding range when the cone crop fails.	3c1898a1da75b527a778bc6cd314d434b70e03531e5fe820f3295c2ba00c19d1589d4f8c1449c869753e07c3eaee9796a0e591aad8e4eba3ec50ed5cec5022f5	원뿔 작물이 실패하면 번식 범위에서 분화합니다.	train
common_voice_en_19725988.mp3	The anti-corruption campaigner Hans-Peter Martin polled strongly and his list won two seats.	3c1898a1da75b527a778bc6cd314d434b70e03531e5fe820f3295c2ba00c19d1589d4f8c1449c869753e07c3eaee9796a0e591aad8e4eba3ec50ed5cec5022f5	반부패 운동가인 한스-피터 마틴은 높은 득표율로 두 의석을 차지했습니다.	train
common_voice_en_19725989.mp3	He first practiced acting in amateur theatrical plays staged by the Israeli Army.	3c1898a1da75b527a778bc6cd314d434b70e03531e5fe820f3295c2ba00c19d1589d4f8c1449c869753e07c3eaee9796a0e591aad8e4eba3ec50ed5cec5022f5	그는 이스라엘 육군이 무대에 올린 아마추어 연극에서 처음 연기를 연습했습니다.	train
common_voice_en_19725995.mp3	He practiced sumo as a teenager, but lacked the ideal build for the sport.	3c1898a1da75b527a778bc6cd314d434b70e03531e5fe820f3295c2ba00c19d1589d4f8c1449c869753e07c3eaee9796a0e591aad8e4eba3ec50ed5cec5022f5	그는 10대 시절 스모를 연습했지만 스모에 적합한 체격이 아니었습니다.	train
common_voice_en_19725996.mp3	Subsequent episodes that involve hockey also depict players wearing these sweater designs.	3c1898a1da75b527a778bc6cd314d434b70e03531e5fe820f3295c2ba00c19d1589d4f8c1449c869753e07c3eaee9796a0e591aad8e4eba3ec50ed5cec5022f5	이후 하키와 관련된 에피소드에서도 선수들이 이 스웨터 디자인을 입고 등장하는 장면이 등장합니다.	train
common_voice_en_19725997.mp3	It was thought to include battery.	3c1898a1da75b527a778bc6cd314d434b70e03531e5fe820f3295c2ba00c19d1589d4f8c1449c869753e07c3eaee9796a0e591aad8e4eba3ec50ed5cec5022f5	배터리가 포함되어 있는 것으로 생각했습니다.	train
common_voice_en_19725998.mp3	This technology was intended to make up for the unavailability of regular update packages.	3c1898a1da75b527a778bc6cd314d434b70e03531e5fe820f3295c2ba00c19d1589d4f8c1449c869753e07c3eaee9796a0e591aad8e4eba3ec50ed5cec5022f5	이 기술은 정기 업데이트 패키지를 사용할 수 없는 상황을 보완하기 위한 것입니다.	train
common_voice_en_19725999.mp3	It combines quasi-dystopian lyrics with a pop tempo.	3c1898a1da75b527a778bc6cd314d434b70e03531e5fe820f3295c2ba00c19d1589d4f8c1449c869753e07c3eaee9796a0e591aad8e4eba3ec50ed5cec5022f5	준 디스토피아적 가사와 팝 템포가 결합된 곡입니다.	train
common_voice_en_19726015.mp3	"American soldiers used the term ""Black Echo"" to describe the conditions within the tunnels."	3c1898a1da75b527a778bc6cd314d434b70e03531e5fe820f3295c2ba00c19d1589d4f8c1449c869753e07c3eaee9796a0e591aad8e4eba3ec50ed5cec5022f5	미군들은 터널 안의 상황을 설명하기 위해 '블랙 에코'라는 용어를 사용했습니다.	train
common_voice_en_19726016.mp3	"One of these relocators was the infamous confidence man Jefferson Randolph ""Soapy"" Smith."	3c1898a1da75b527a778bc6cd314d434b70e03531e5fe820f3295c2ba00c19d1589d4f8c1449c869753e07c3eaee9796a0e591aad8e4eba3ec50ed5cec5022f5	이 재배치자 중 한 명은 악명 높은 자신감의 소유자 제퍼슨 랜돌프 "소피" 스미스였습니다.	train
common_voice_en_19726017.mp3	His third wife gassed herself to death on hearing the news.	3c1898a1da75b527a778bc6cd314d434b70e03531e5fe820f3295c2ba00c19d1589d4f8c1449c869753e07c3eaee9796a0e591aad8e4eba3ec50ed5cec5022f5	그의 세 번째 부인은 이 소식을 듣고 가스를 마시고 스스로 목숨을 끊었습니다.	train
common_voice_en_19726018.mp3	"Akira Terao's hit song ""Ruby no Yubiwa"" won the Grand Prix award."	3c1898a1da75b527a778bc6cd314d434b70e03531e5fe820f3295c2ba00c19d1589d4f8c1449c869753e07c3eaee9796a0e591aad8e4eba3ec50ed5cec5022f5	테라오 아키라의 히트곡 '루비의 유비와'가 그랑프리를 수상했습니다.	train
common_voice_en_19726019.mp3	He practiced medicine while residing successively in Dillon, Warm Springs, and Butte.	3c1898a1da75b527a778bc6cd314d434b70e03531e5fe820f3295c2ba00c19d1589d4f8c1449c869753e07c3eaee9796a0e591aad8e4eba3ec50ed5cec5022f5	그는 딜런, 웜 스프링스, 버트에서 연이어 거주하면서 의술을 펼쳤습니다.	train
common_voice_en_19726075.mp3	I chose to come to Sunderland because I need to play every week.	3c1898a1da75b527a778bc6cd314d434b70e03531e5fe820f3295c2ba00c19d1589d4f8c1449c869753e07c3eaee9796a0e591aad8e4eba3ec50ed5cec5022f5	매주 경기를 해야 하기 때문에 선덜랜드에 오기로 결정했습니다.	train
common_voice_en_19726077.mp3	The packaging has changed from jewel case to Digipak.	3c1898a1da75b527a778bc6cd314d434b70e03531e5fe820f3295c2ba00c19d1589d4f8c1449c869753e07c3eaee9796a0e591aad8e4eba3ec50ed5cec5022f5	패키지가 쥬얼 케이스에서 디지팩으로 변경되었습니다.	train
common_voice_en_19726078.mp3	Student Council is also available to those who choose to run for a position.	3c1898a1da75b527a778bc6cd314d434b70e03531e5fe820f3295c2ba00c19d1589d4f8c1449c869753e07c3eaee9796a0e591aad8e4eba3ec50ed5cec5022f5	학생회 임원직에 출마하고자 하는 학생도 학생회 활동을 할 수 있습니다.	train
common_voice_en_19726080.mp3	These all can be called the preferential treatments of the taxation agreement.	3c1898a1da75b527a778bc6cd314d434b70e03531e5fe820f3295c2ba00c19d1589d4f8c1449c869753e07c3eaee9796a0e591aad8e4eba3ec50ed5cec5022f5	이 모든 것이 조세 협정의 특혜라고 할 수 있습니다.	train
common_voice_en_19726105.mp3	Little River is also home to Little River Airport with its mile-long runway.	3c1898a1da75b527a778bc6cd314d434b70e03531e5fe820f3295c2ba00c19d1589d4f8c1449c869753e07c3eaee9796a0e591aad8e4eba3ec50ed5cec5022f5	리틀 리버에는 1마일 길이의 활주로가 있는 리틀 리버 공항도 있습니다.	train
common_voice_en_19726106.mp3	In addition to Greek translations of previously written books, Anubis also publishes original works.	3c1898a1da75b527a778bc6cd314d434b70e03531e5fe820f3295c2ba00c19d1589d4f8c1449c869753e07c3eaee9796a0e591aad8e4eba3ec50ed5cec5022f5	아누비스는 이전에 쓰여진 책의 그리스어 번역본 외에도 오리지널 작품도 출판합니다.	train
common_voice_en_19726107.mp3	"It also publishes ""Physical Review X"", an online-only gold open access journal."	3c1898a1da75b527a778bc6cd314d434b70e03531e5fe820f3295c2ba00c19d1589d4f8c1449c869753e07c3eaee9796a0e591aad8e4eba3ec50ed5cec5022f5	또한 온라인 전용 골드 오픈 액세스 저널인 'Physical Review X'를 발행하고 있습니다.	train
common_voice_en_19726108.mp3	Boys Town is a suburb of Omaha.	3c1898a1da75b527a778bc6cd314d434b70e03531e5fe820f3295c2ba00c19d1589d4f8c1449c869753e07c3eaee9796a0e591aad8e4eba3ec50ed5cec5022f5	보이즈 타운은 오마하 교외에 있는 도시입니다.	train
common_voice_en_19726109.mp3	Barber was succeeded as Chief Engraver by his son Charles.	3c1898a1da75b527a778bc6cd314d434b70e03531e5fe820f3295c2ba00c19d1589d4f8c1449c869753e07c3eaee9796a0e591aad8e4eba3ec50ed5cec5022f5	바버는 아들 찰스에게 수석 조각사의 자리를 물려주었습니다.	train
common_voice_en_19726116.mp3	"He 'short circuits' in a massive electrical surge, taking out Kraven, Sandman and Vulture."	3c1898a1da75b527a778bc6cd314d434b70e03531e5fe820f3295c2ba00c19d1589d4f8c1449c869753e07c3eaee9796a0e591aad8e4eba3ec50ed5cec5022f5	그는 대규모 전기 서지로 '합선'하여 크레이븐, 샌드맨, 벌처를 제거합니다.	train
common_voice_en_19726117.mp3	Its local government area is the City of Stonnington.	3c1898a1da75b527a778bc6cd314d434b70e03531e5fe820f3295c2ba00c19d1589d4f8c1449c869753e07c3eaee9796a0e591aad8e4eba3ec50ed5cec5022f5	지방 정부 지역은 스토닝턴시입니다.	train
common_voice_en_19726119.mp3	Home team given first.	3c1898a1da75b527a778bc6cd314d434b70e03531e5fe820f3295c2ba00c19d1589d4f8c1449c869753e07c3eaee9796a0e591aad8e4eba3ec50ed5cec5022f5	홈 팀이 먼저 주어집니다.	train
common_voice_en_19726120.mp3	He also left Saudi Arabia while still under contract with Al Nassr.	3c1898a1da75b527a778bc6cd314d434b70e03531e5fe820f3295c2ba00c19d1589d4f8c1449c869753e07c3eaee9796a0e591aad8e4eba3ec50ed5cec5022f5	또한 알 나스르와 계약이 남아 있는 상태에서 사우디아라비아를 떠났습니다.	train
common_voice_en_18679845.mp3	While in hospital, he discussed technical details with the engineer Vittorio Jano.	546226eb3f486b667bec0e3a3c89429ce73526488b47f517ccd12b71cbf8499fcc8803a45ede093e9f336be833678674f409ea0ba0d640deb136d2bc1f036e56	병원에 있는 동안 그는 엔지니어인 비토리오 야노와 기술적인 세부 사항을 논의했습니다.	train
common_voice_en_18679852.mp3	Also with a possessive suffix.	546226eb3f486b667bec0e3a3c89429ce73526488b47f517ccd12b71cbf8499fcc8803a45ede093e9f336be833678674f409ea0ba0d640deb136d2bc1f036e56	소유격 접미사도 사용할 수 있습니다.	train
common_voice_en_18679855.mp3	A quarter of Ethiopia’s imports and half of its exports move through the ports.	546226eb3f486b667bec0e3a3c89429ce73526488b47f517ccd12b71cbf8499fcc8803a45ede093e9f336be833678674f409ea0ba0d640deb136d2bc1f036e56	에티오피아 수입의 4분의 1과 수출의 절반이 항구를 통해 이동합니다.	train
common_voice_en_18679856.mp3	The factor comes from Fourier transform conventions.	546226eb3f486b667bec0e3a3c89429ce73526488b47f517ccd12b71cbf8499fcc8803a45ede093e9f336be833678674f409ea0ba0d640deb136d2bc1f036e56	이 요소는 푸리에 변환 규칙에서 비롯됩니다.	train
common_voice_en_18679874.mp3	The effect increases across the elementary and secondary school years.	546226eb3f486b667bec0e3a3c89429ce73526488b47f517ccd12b71cbf8499fcc8803a45ede093e9f336be833678674f409ea0ba0d640deb136d2bc1f036e56	이러한 효과는 초등학교와 중등학교에 걸쳐 증가합니다.	train
common_voice_en_18679875.mp3	It is owned and operated by the Society of the Divine Word.	546226eb3f486b667bec0e3a3c89429ce73526488b47f517ccd12b71cbf8499fcc8803a45ede093e9f336be833678674f409ea0ba0d640deb136d2bc1f036e56	신성한 말씀학회에서 소유하고 운영합니다.	train
common_voice_en_18679877.mp3	"He was nicknamed ""The Great Wall""."	546226eb3f486b667bec0e3a3c89429ce73526488b47f517ccd12b71cbf8499fcc8803a45ede093e9f336be833678674f409ea0ba0d640deb136d2bc1f036e56	그는 '만리장성'이라는 별명을 가졌습니다.	train
common_voice_en_18679878.mp3	Many students from Gdynia attend also universities located in the Tricity.	546226eb3f486b667bec0e3a3c89429ce73526488b47f517ccd12b71cbf8499fcc8803a45ede093e9f336be833678674f409ea0ba0d640deb136d2bc1f036e56	그디니아에서 온 많은 학생들은 트리시티에 위치한 대학에도 다니고 있습니다.	train
common_voice_en_18679894.mp3	Some of the previous shows characters did return, however, including Bishop and Baxter Stockman.	546226eb3f486b667bec0e3a3c89429ce73526488b47f517ccd12b71cbf8499fcc8803a45ede093e9f336be833678674f409ea0ba0d640deb136d2bc1f036e56	하지만 비숍과 박스터 스톡맨 등 이전 쇼의 일부 캐릭터가 다시 등장하기도 했습니다.	train
common_voice_en_18679895.mp3	It is well-known to lepidopterists as the main foodplant of the Old World swallowtail.	546226eb3f486b667bec0e3a3c89429ce73526488b47f517ccd12b71cbf8499fcc8803a45ede093e9f336be833678674f409ea0ba0d640deb136d2bc1f036e56	나비 전문가들에게는 구세계 제비꼬리의 주요 먹이 식물로 잘 알려져 있습니다.	train
common_voice_en_18679896.mp3	The most common mohawk turn is the forward inside open mohawk.	546226eb3f486b667bec0e3a3c89429ce73526488b47f517ccd12b71cbf8499fcc8803a45ede093e9f336be833678674f409ea0ba0d640deb136d2bc1f036e56	가장 일반적인 모호크 턴은 포워드 인사이드 오픈 모호크입니다.	train
common_voice_en_18679897.mp3	Access is by boat only and for day–use only.	546226eb3f486b667bec0e3a3c89429ce73526488b47f517ccd12b71cbf8499fcc8803a45ede093e9f336be833678674f409ea0ba0d640deb136d2bc1f036e56	보트를 이용해야만 입장할 수 있으며 당일 이용만 가능합니다.	train
common_voice_en_18679898.mp3	The United States Postal Service operates the Basin Post Office.	546226eb3f486b667bec0e3a3c89429ce73526488b47f517ccd12b71cbf8499fcc8803a45ede093e9f336be833678674f409ea0ba0d640deb136d2bc1f036e56	미국 우정국은 베이슨 우체국을 운영합니다.	train
common_voice_en_18679914.mp3	Several of these innovations were retained for future LucasArts adventure games.	546226eb3f486b667bec0e3a3c89429ce73526488b47f517ccd12b71cbf8499fcc8803a45ede093e9f336be833678674f409ea0ba0d640deb136d2bc1f036e56	이러한 혁신 중 몇 가지는 향후 루카스아츠 어드벤처 게임에도 그대로 적용되었습니다.	train
common_voice_en_18679915.mp3	It is the current high school section in Hwa Chong Institution.	546226eb3f486b667bec0e3a3c89429ce73526488b47f517ccd12b71cbf8499fcc8803a45ede093e9f336be833678674f409ea0ba0d640deb136d2bc1f036e56	현재 화총학원 내 고등부입니다.	train
common_voice_en_18679916.mp3	The Ladywell was fenced off in the Victorian era.	546226eb3f486b667bec0e3a3c89429ce73526488b47f517ccd12b71cbf8499fcc8803a45ede093e9f336be833678674f409ea0ba0d640deb136d2bc1f036e56	레이디웰은 빅토리아 시대에 울타리가 쳐져 있었어요.	train
