path	sentence	client_id	translation	split
common_voice_en_19090662.mp3	Alan blamed nerves for his difficulty in finding Kennedy with accurate passes.	db99480957721b73d3325059d36820258301014b5f8fdf05e83b71914d274709a51fd916a5f11829efd045bfc64e369d5552f55d5514392b51d003e5e8df108e	앨런은 정확한 패스로 케네디를 찾는 데 어려움을 겪은 것에 대해 신경질적인 탓을 했습니다.	train
common_voice_en_19090663.mp3	The rock under Moncrieff consists of Canberra Formation of middle Silurian age.	db99480957721b73d3325059d36820258301014b5f8fdf05e83b71914d274709a51fd916a5f11829efd045bfc64e369d5552f55d5514392b51d003e5e8df108e	몬크리프 아래의 암석은 중기 실루리안 시대의 캔버라 지층으로 이루어져 있습니다.	train
common_voice_en_19090664.mp3	The landscape and lake frontage have attracted human activity for many centuries.	db99480957721b73d3325059d36820258301014b5f8fdf05e83b71914d274709a51fd916a5f11829efd045bfc64e369d5552f55d5514392b51d003e5e8df108e	경치와 호숫가 풍경은 수 세기 동안 인간의 활동을 끌어당겼습니다.	train
common_voice_en_19538482.mp3	In the first modern archery competition at the Olympics, Puerto Rico entered one man.	dbade84edb9339336bd123e220d9430cce8a40829d5f0bdb6b08fbd868023d7658f5010881d741309c63e1c15801bb346d16a6f892ed5867ae57520e4418ec4b	올림픽 최초의 근대 양궁 경기에서 푸에르토리코는 남자 선수 한 명을 출전시켰습니다.	train
common_voice_en_19538483.mp3	Lauda led from Scheckter, James Hunt and Jochen Mass.	dbade84edb9339336bd123e220d9430cce8a40829d5f0bdb6b08fbd868023d7658f5010881d741309c63e1c15801bb346d16a6f892ed5867ae57520e4418ec4b	라우다는 쉑터, 제임스 헌트, 조첸 매스를 이끌었습니다.	train
common_voice_en_19538484.mp3	"Another recurring element in Sharp's work is the ""Eternity"" signature."	dbade84edb9339336bd123e220d9430cce8a40829d5f0bdb6b08fbd868023d7658f5010881d741309c63e1c15801bb346d16a6f892ed5867ae57520e4418ec4b	샤프의 작품에서 반복적으로 등장하는 또 다른 요소는 '영원' 시그니처입니다.	train
common_voice_en_19538485.mp3	As noted above, immunoglobulins include light chains and heavy chains.	dbade84edb9339336bd123e220d9430cce8a40829d5f0bdb6b08fbd868023d7658f5010881d741309c63e1c15801bb346d16a6f892ed5867ae57520e4418ec4b	위에서 언급했듯이 면역 글로불린에는 경쇄와 중쇄가 있습니다.	train
common_voice_en_19538486.mp3	His daughter from his first marriage is actress Yancy Butler.	dbade84edb9339336bd123e220d9430cce8a40829d5f0bdb6b08fbd868023d7658f5010881d741309c63e1c15801bb346d16a6f892ed5867ae57520e4418ec4b	그의 첫 번째 결혼에서 얻은 딸은 배우 얀시 버틀러입니다.	train
common_voice_en_20006718.mp3	The district includes areas with significant conservation and cultural values.	dbb5c1fadca7e74c783f25779e879f65ef30be9fed9d1cefbefb3fed2ab8cb112c44c473dd05e3a90fa73d52ce0aafe4b4e3e925e2f101078fe3b0cf8334979a	이 지구에는 중요한 보존 및 문화적 가치가 있는 지역이 포함되어 있습니다.	train
common_voice_en_20006719.mp3	There are also some transport and spedition companies in the area.	dbb5c1fadca7e74c783f25779e879f65ef30be9fed9d1cefbefb3fed2ab8cb112c44c473dd05e3a90fa73d52ce0aafe4b4e3e925e2f101078fe3b0cf8334979a	이 지역에는 일부 운송 및 배송 회사도 있습니다.	train
common_voice_en_20006720.mp3	However, and for reasons unclear, things never quite came together for the team.	dbb5c1fadca7e74c783f25779e879f65ef30be9fed9d1cefbefb3fed2ab8cb112c44c473dd05e3a90fa73d52ce0aafe4b4e3e925e2f101078fe3b0cf8334979a	하지만 불분명한 이유로 인해 팀원들의 의견이 제대로 모아지지 않았습니다.	train
common_voice_en_20006721.mp3	He traveled worldwide, speaking on his specialist subjects.	dbb5c1fadca7e74c783f25779e879f65ef30be9fed9d1cefbefb3fed2ab8cb112c44c473dd05e3a90fa73d52ce0aafe4b4e3e925e2f101078fe3b0cf8334979a	그는 전 세계를 돌아다니며 자신의 전문 주제에 대해 강연했습니다.	train
common_voice_en_20006722.mp3	Supergirl saves him and gets him to medical care.	dbb5c1fadca7e74c783f25779e879f65ef30be9fed9d1cefbefb3fed2ab8cb112c44c473dd05e3a90fa73d52ce0aafe4b4e3e925e2f101078fe3b0cf8334979a	슈퍼걸이 그를 구하고 병원으로 데려갑니다.	train
common_voice_en_19768462.mp3	"Catalina is mortified at the thought of Monica's heartbreak."	dbb7ef1c5c22456059fa952523b437b01837d88852ea70b9a4cd2fd0d6b6d8fa531ac8cdc01ce9a2d3743c36c89a7e546604c386e9f23ebd3ef9b5f63baca633	카탈리나는 모니카의 슬픔을 생각하면 가슴이 미어집니다.	train
common_voice_en_19768463.mp3	Pre-ignition and engine knock both sharply increase combustion chamber temperatures.	dbb7ef1c5c22456059fa952523b437b01837d88852ea70b9a4cd2fd0d6b6d8fa531ac8cdc01ce9a2d3743c36c89a7e546604c386e9f23ebd3ef9b5f63baca633	사전 점화 및 엔진 노크는 모두 연소실 온도를 급격히 상승시킵니다.	train
common_voice_en_19768464.mp3	The New Mexico Highlands University is home to the Thomas C. Donnelly Library.	dbb7ef1c5c22456059fa952523b437b01837d88852ea70b9a4cd2fd0d6b6d8fa531ac8cdc01ce9a2d3743c36c89a7e546604c386e9f23ebd3ef9b5f63baca633	뉴멕시코 하이랜드 대학교에는 토마스 C. 도넬리 도서관이 있습니다.	train
common_voice_en_19768465.mp3	"His nickname is ""Bengan"", a common nickname in Sweden for people named Bengt."	dbb7ef1c5c22456059fa952523b437b01837d88852ea70b9a4cd2fd0d6b6d8fa531ac8cdc01ce9a2d3743c36c89a7e546604c386e9f23ebd3ef9b5f63baca633	그의 별명은 '벵간'으로, 스웨덴에서 벵트라는 이름을 가진 사람들을 부르는 일반적인 별명입니다.	train
common_voice_en_19768466.mp3	"There is also Guy, the dorm's resident adviser."	dbb7ef1c5c22456059fa952523b437b01837d88852ea70b9a4cd2fd0d6b6d8fa531ac8cdc01ce9a2d3743c36c89a7e546604c386e9f23ebd3ef9b5f63baca633	기숙사의 상주 고문인 가이도 있습니다.	train
common_voice_en_556343.mp3	Portals are used in many computer games to instantly travel from one place to another.	dbba93049b37c6df3a1dbfda01fdc530dba74b6ccb4fa7613cd42d266b3fc9da8cfefbeafbda2c572388027fcf234735ede7be71a39b4f076ac58b8b394c269e	포털은 많은 컴퓨터 게임에서 한 장소에서 다른 장소로 즉시 이동하는 데 사용됩니다.	train
common_voice_en_19950974.mp3	They also performed well on secondary and inter-regional services for many years.	dbcb560e4aa45fdb4bcf24be2d55ae9a282b6c5d241d9a44b18ccd0ad0cdcd9fc8346d3c8a38a755948ae6e3c8a14baf2894634c98b3d37259798ff098130d0a	또한 수년 동안 보조 및 지역 간 서비스에서도 좋은 성과를 거두었습니다.	train
common_voice_en_19950975.mp3	A new compound was prepared at the park to house them on their arrival.	dbcb560e4aa45fdb4bcf24be2d55ae9a282b6c5d241d9a44b18ccd0ad0cdcd9fc8346d3c8a38a755948ae6e3c8a14baf2894634c98b3d37259798ff098130d0a	그들이 도착하자마자 그들을 수용하기 위해 공원에 새로운 화합물이 준비되었습니다.	train
common_voice_en_19950976.mp3	Despite its short run, the series has a dedicated fan base today.	dbcb560e4aa45fdb4bcf24be2d55ae9a282b6c5d241d9a44b18ccd0ad0cdcd9fc8346d3c8a38a755948ae6e3c8a14baf2894634c98b3d37259798ff098130d0a	짧은 방영 기간에도 불구하고 이 시리즈는 현재 열성적인 팬층을 보유하고 있습니다.	train
common_voice_en_19950977.mp3	She began to import materials from Germany.	dbcb560e4aa45fdb4bcf24be2d55ae9a282b6c5d241d9a44b18ccd0ad0cdcd9fc8346d3c8a38a755948ae6e3c8a14baf2894634c98b3d37259798ff098130d0a	그녀는 독일에서 자재를 수입하기 시작했습니다.	train
common_voice_en_19950978.mp3	The town lies on a hill surrounded by the rivers Minho, Rato and Chanca.	dbcb560e4aa45fdb4bcf24be2d55ae9a282b6c5d241d9a44b18ccd0ad0cdcd9fc8346d3c8a38a755948ae6e3c8a14baf2894634c98b3d37259798ff098130d0a	이 마을은 민호, 라토, 찬카 강으로 둘러싸인 언덕 위에 자리하고 있습니다.	train
common_voice_en_19598362.mp3	Ventrally it is whitish or covered with blackish dots.	dbde21ff93c9d8e7f01c508d697dedfbfde055b9ef1ff2ab94506c7920399f60e00d4442e51f59a119b865eaf9f73b11248183c058a2a7e563d3bb7a958a11d4	윗부분은 희거나 검은색 점으로 덮여 있습니다.	train
common_voice_en_19598364.mp3	There is no quick fix.	dbde21ff93c9d8e7f01c508d697dedfbfde055b9ef1ff2ab94506c7920399f60e00d4442e51f59a119b865eaf9f73b11248183c058a2a7e563d3bb7a958a11d4	빠른 해결 방법은 없습니다.	train
common_voice_en_19598369.mp3	These societies still exist, but their influence has waned.	dbde21ff93c9d8e7f01c508d697dedfbfde055b9ef1ff2ab94506c7920399f60e00d4442e51f59a119b865eaf9f73b11248183c058a2a7e563d3bb7a958a11d4	이러한 사회는 여전히 존재하지만 그 영향력은 약해졌습니다.	train
common_voice_en_19598387.mp3	Donovan earned Man of the Match for his actions.	dbde21ff93c9d8e7f01c508d697dedfbfde055b9ef1ff2ab94506c7920399f60e00d4442e51f59a119b865eaf9f73b11248183c058a2a7e563d3bb7a958a11d4	도노반은 이러한 활약으로 맨 오브 더 매치를 수상했습니다.	train
common_voice_en_19598388.mp3	Her memoirs, How Do You Want Me?	dbde21ff93c9d8e7f01c508d697dedfbfde055b9ef1ff2ab94506c7920399f60e00d4442e51f59a119b865eaf9f73b11248183c058a2a7e563d3bb7a958a11d4	그녀의 회고록, 어떻게 나를 원하십니까?	train
common_voice_en_18529672.mp3	There was a long knife through his heart which skewered him to the floor.	dbe01784b7000dfa539ad52568386b6df2cfed7f2bad4ceb8fa9f0d86c3f67b7cc385a0c228d6594486d5b05f55d05eac89d643d967ac033eb2c770d8117074f	심장을 관통한 긴 칼에 찔려 바닥에 쓰러져 있었습니다.	train
common_voice_en_18529673.mp3	He rose and held out his hands.	dbe01784b7000dfa539ad52568386b6df2cfed7f2bad4ceb8fa9f0d86c3f67b7cc385a0c228d6594486d5b05f55d05eac89d643d967ac033eb2c770d8117074f	그는 일어나서 손을 내밀었습니다.	train
common_voice_en_18529674.mp3	"""All right now,"" returns the trooper."	dbe01784b7000dfa539ad52568386b6df2cfed7f2bad4ceb8fa9f0d86c3f67b7cc385a0c228d6594486d5b05f55d05eac89d643d967ac033eb2c770d8117074f	"이제 됐어요." 병사가 대답합니다.	train
common_voice_en_18529675.mp3	We will assess the risk of flooding in your area.	dbe01784b7000dfa539ad52568386b6df2cfed7f2bad4ceb8fa9f0d86c3f67b7cc385a0c228d6594486d5b05f55d05eac89d643d967ac033eb2c770d8117074f	해당 지역의 홍수 위험을 평가합니다.	train
common_voice_en_18529676.mp3	They waited outside the exit while the passengers gave up their tickets.	dbe01784b7000dfa539ad52568386b6df2cfed7f2bad4ceb8fa9f0d86c3f67b7cc385a0c228d6594486d5b05f55d05eac89d643d967ac033eb2c770d8117074f	그들은 승객들이 표를 포기하는 동안 출구 밖에서 기다렸습니다.	train
common_voice_en_19348831.mp3	The poorhouse with attached farm concept was favored in Canada.	dbf075e601faac925789b198905bfd93b75a89d278860bf19c8705add8f0b9f6d48795da83cb8b67a8df66eabd371bdbd8d2ff68e599dc4566f91854900858d8	캐나다에서는 농장이 딸린 빈민가 콘셉트가 선호되었습니다.	train
common_voice_en_19348832.mp3	The sugar was then sold in Hinulawan, the old name of Toledo.	dbf075e601faac925789b198905bfd93b75a89d278860bf19c8705add8f0b9f6d48795da83cb8b67a8df66eabd371bdbd8d2ff68e599dc4566f91854900858d8	그 후 설탕은 톨레도의 옛 이름인 히눌라완에서 판매되었습니다.	train
common_voice_en_19348833.mp3	Her research focuses on understanding the learning and memory mechanisms that develop during infancy.	dbf075e601faac925789b198905bfd93b75a89d278860bf19c8705add8f0b9f6d48795da83cb8b67a8df66eabd371bdbd8d2ff68e599dc4566f91854900858d8	그녀의 연구는 유아기에 발달하는 학습과 기억 메커니즘을 이해하는 데 중점을 둡니다.	train
common_voice_en_19348834.mp3	In the direction tangent to the curve, the function remains smooth.	dbf075e601faac925789b198905bfd93b75a89d278860bf19c8705add8f0b9f6d48795da83cb8b67a8df66eabd371bdbd8d2ff68e599dc4566f91854900858d8	커브에 접하는 방향에서는 함수가 부드럽게 유지됩니다.	train
common_voice_en_19348835.mp3	"Ultimately, LeFevre's anti-collaboration methods lost favor and faded away."	dbf075e601faac925789b198905bfd93b75a89d278860bf19c8705add8f0b9f6d48795da83cb8b67a8df66eabd371bdbd8d2ff68e599dc4566f91854900858d8	결국 르페브르의 반협업 방식은 호응을 얻지 못하고 사라졌습니다.	train
common_voice_en_19620052.mp3	By late afternoon, the two Brazilian battalions were back to square one.	dbfc9cd11c0dba9590e67d5d41a050d4d6775d4f152f79cc351e02a7fd498582663cb4791216c97e113b96464b647fe195635948fc60e4643ee4c1ed4bca152b	늦은 오후가 되자 브라질의 두 대대는 다시 원점으로 돌아갔습니다.	train
common_voice_en_19620053.mp3	A stealth cupola is now offered.	dbfc9cd11c0dba9590e67d5d41a050d4d6775d4f152f79cc351e02a7fd498582663cb4791216c97e113b96464b647fe195635948fc60e4643ee4c1ed4bca152b	이제 스텔스 큐폴라가 제공됩니다.	train
common_voice_en_19620054.mp3	It is primarily dance music, containing both slow and fast pieces.	dbfc9cd11c0dba9590e67d5d41a050d4d6775d4f152f79cc351e02a7fd498582663cb4791216c97e113b96464b647fe195635948fc60e4643ee4c1ed4bca152b	주로 느린 곡과 빠른 곡이 모두 포함된 댄스 음악입니다.	train
common_voice_en_19620055.mp3	Thus, the story opens.	dbfc9cd11c0dba9590e67d5d41a050d4d6775d4f152f79cc351e02a7fd498582663cb4791216c97e113b96464b647fe195635948fc60e4643ee4c1ed4bca152b	이렇게 이야기가 시작됩니다.	train
common_voice_en_19620056.mp3	The word signifies membership in the Masurians ethnic group.	dbfc9cd11c0dba9590e67d5d41a050d4d6775d4f152f79cc351e02a7fd498582663cb4791216c97e113b96464b647fe195635948fc60e4643ee4c1ed4bca152b	이 단어는 마수리안 종족의 멤버십을 의미합니다.	train
common_voice_en_19693612.mp3	That day decided my whole life.	dc29ae054713dc50f9fc200144fc275f0037ba530a5df56730e74ad8a1f90fe5401b68ecc2bb74c3cf8e12eab6d1e5d866ab13022833f44caeafbb2eb630dece	그날이 제 인생 전체를 결정했습니다.	train
common_voice_en_19693613.mp3	What the film on the personal camera showed, however, was different.	dc29ae054713dc50f9fc200144fc275f0037ba530a5df56730e74ad8a1f90fe5401b68ecc2bb74c3cf8e12eab6d1e5d866ab13022833f44caeafbb2eb630dece	하지만 개인용 카메라에 담긴 영상은 달랐습니다.	train
common_voice_en_19693614.mp3	The histories and the Puranas are said to be the fifth Veda.	dc29ae054713dc50f9fc200144fc275f0037ba530a5df56730e74ad8a1f90fe5401b68ecc2bb74c3cf8e12eab6d1e5d866ab13022833f44caeafbb2eb630dece	역사와 푸라나는 다섯 번째 베다로 알려져 있습니다.	train
common_voice_en_19693615.mp3	He grew up in New York City where he lived with his mother.	dc29ae054713dc50f9fc200144fc275f0037ba530a5df56730e74ad8a1f90fe5401b68ecc2bb74c3cf8e12eab6d1e5d866ab13022833f44caeafbb2eb630dece	그는 뉴욕에서 어머니와 함께 살면서 자랐습니다.	train
common_voice_en_19693616.mp3	"See ""Mesorevet get"" below."	dc29ae054713dc50f9fc200144fc275f0037ba530a5df56730e74ad8a1f90fe5401b68ecc2bb74c3cf8e12eab6d1e5d866ab13022833f44caeafbb2eb630dece	아래의 '메조벳 가져오기'를 참조하세요.	train
common_voice_en_18591715.mp3	She was the leader.	dc470f596a6f11396d8963a9294410d51f4dc1f62d2da9360d9bbde68fb3cf147d3d5dee07fcf7ca82175c53f3dd2892c7ecb34cda5ef6aa206d150b963c3532	그녀는 리더였습니다.	train
common_voice_en_18591716.mp3	He will be no worse off than he was, you know.	dc470f596a6f11396d8963a9294410d51f4dc1f62d2da9360d9bbde68fb3cf147d3d5dee07fcf7ca82175c53f3dd2892c7ecb34cda5ef6aa206d150b963c3532	전보다 더 나빠지지는 않을 겁니다.	train
common_voice_en_18591717.mp3	She stood up again.	dc470f596a6f11396d8963a9294410d51f4dc1f62d2da9360d9bbde68fb3cf147d3d5dee07fcf7ca82175c53f3dd2892c7ecb34cda5ef6aa206d150b963c3532	그녀는 다시 일어섰습니다.	train
common_voice_en_18591718.mp3	The next step was what puzzled me.	dc470f596a6f11396d8963a9294410d51f4dc1f62d2da9360d9bbde68fb3cf147d3d5dee07fcf7ca82175c53f3dd2892c7ecb34cda5ef6aa206d150b963c3532	그 다음 단계는 저를 당황하게 만들었습니다.	train
common_voice_en_18591719.mp3	The graphics designer presented several versions of the logo.	dc470f596a6f11396d8963a9294410d51f4dc1f62d2da9360d9bbde68fb3cf147d3d5dee07fcf7ca82175c53f3dd2892c7ecb34cda5ef6aa206d150b963c3532	그래픽 디자이너는 여러 버전의 로고를 제시했습니다.	train
common_voice_en_19802936.mp3	There are many other small businesses located in Gulen today.	dc5813f5bc57d4b4ecc551d0fa33e4112e4169758395c28e29261b8333fc87a5d52afac5b84a2939b1db377f2b73e5ad28656e644e7e6e5c5c7025b356cce4f0	현재 굴렌에는 다른 많은 소규모 비즈니스가 있습니다.	train
common_voice_en_19802937.mp3	For a small fee, artists outside the Royal Academy could exhibit their works.	dc5813f5bc57d4b4ecc551d0fa33e4112e4169758395c28e29261b8333fc87a5d52afac5b84a2939b1db377f2b73e5ad28656e644e7e6e5c5c7025b356cce4f0	소정의 수수료를 내면 왕립 아카데미 외부의 예술가들도 자신의 작품을 전시할 수 있습니다.	train
common_voice_en_19802938.mp3	Senator Hale questions that statement, saying there have been a good many fights since.	dc5813f5bc57d4b4ecc551d0fa33e4112e4169758395c28e29261b8333fc87a5d52afac5b84a2939b1db377f2b73e5ad28656e644e7e6e5c5c7025b356cce4f0	헤일 상원의원은 그 이후로 많은 싸움이 있었다며 그 진술에 의문을 제기했습니다.	train
common_voice_en_19802939.mp3	Various handicrafts were developed in the area.	dc5813f5bc57d4b4ecc551d0fa33e4112e4169758395c28e29261b8333fc87a5d52afac5b84a2939b1db377f2b73e5ad28656e644e7e6e5c5c7025b356cce4f0	이 지역에서는 다양한 수공예품이 개발되었습니다.	train
common_voice_en_19802940.mp3	Han Solo and Princess Leia are recently married.	dc5813f5bc57d4b4ecc551d0fa33e4112e4169758395c28e29261b8333fc87a5d52afac5b84a2939b1db377f2b73e5ad28656e644e7e6e5c5c7025b356cce4f0	한 솔로와 레이아 공주는 최근 결혼했습니다.	train
common_voice_en_19705850.mp3	He recruited William Lowrie as director of agriculture.	dc818adbf40ef080c6b00ca92be4104048ab9bd04612e7ff521f22da03c30bfea924621cb6dc87bf58dc5a79b59594b86595ec338a0afe73f3309907c48202d9	그는 윌리엄 로리를 농업 담당 이사로 영입했습니다.	train
common_voice_en_19705854.mp3	We had a great time.	dc818adbf40ef080c6b00ca92be4104048ab9bd04612e7ff521f22da03c30bfea924621cb6dc87bf58dc5a79b59594b86595ec338a0afe73f3309907c48202d9	저희는 즐거운 시간을 보냈습니다.	train
common_voice_en_19705858.mp3	Ultimately, the meaning of the words is determined by an individuals unqiue expierence.	dc818adbf40ef080c6b00ca92be4104048ab9bd04612e7ff521f22da03c30bfea924621cb6dc87bf58dc5a79b59594b86595ec338a0afe73f3309907c48202d9	궁극적으로 단어의 의미는 개인의 고유한 경험에 의해 결정됩니다.	train
common_voice_en_19705860.mp3	"The club's second consecutive top flight campaign was a dramatic one."	dc818adbf40ef080c6b00ca92be4104048ab9bd04612e7ff521f22da03c30bfea924621cb6dc87bf58dc5a79b59594b86595ec338a0afe73f3309907c48202d9	클럽의 2연속 정상 등극은 극적인 일이었습니다.	train
common_voice_en_19705861.mp3	He was also known as a gifted orator and tireless union advocate.	dc818adbf40ef080c6b00ca92be4104048ab9bd04612e7ff521f22da03c30bfea924621cb6dc87bf58dc5a79b59594b86595ec338a0afe73f3309907c48202d9	그는 재능 있는 웅변가이자 지칠 줄 모르는 노조 옹호자로도 유명했습니다.	train
common_voice_en_19614087.mp3	From the southeast corner, the building appears as a peacock.	dcac44e93911637e8d2b2dc8b4054d7849c672f561e4bc00d1ee9ab46dfee9da2102e240e2b5df77e289c62256c0343742d551a9dc2f0b3ec70c45df5473cd3c	남동쪽 모퉁이에서 보면 건물이 공작처럼 보입니다.	train
common_voice_en_19614088.mp3	Although they shared much of their programming, each member station was privately owned.	dcac44e93911637e8d2b2dc8b4054d7849c672f561e4bc00d1ee9ab46dfee9da2102e240e2b5df77e289c62256c0343742d551a9dc2f0b3ec70c45df5473cd3c	많은 프로그램을 공유했지만 각 회원 방송국은 개인 소유였습니다.	train
common_voice_en_19614089.mp3	He was particularly well-known to European, American and Russian ornithologists.	dcac44e93911637e8d2b2dc8b4054d7849c672f561e4bc00d1ee9ab46dfee9da2102e240e2b5df77e289c62256c0343742d551a9dc2f0b3ec70c45df5473cd3c	그는 특히 유럽, 미국, 러시아 조류학자들에게 잘 알려져 있습니다.	train
common_voice_en_19614090.mp3	"Bushranger Dan 'Mad Dog' Morgan operated in the area for a time."	dcac44e93911637e8d2b2dc8b4054d7849c672f561e4bc00d1ee9ab46dfee9da2102e240e2b5df77e289c62256c0343742d551a9dc2f0b3ec70c45df5473cd3c	부시레인저 댄 '매드독' 모건은 한동안 이 지역에서 활동했습니다.	train
common_voice_en_19614091.mp3	This is important as the physician can then perform an allergy test.	dcac44e93911637e8d2b2dc8b4054d7849c672f561e4bc00d1ee9ab46dfee9da2102e240e2b5df77e289c62256c0343742d551a9dc2f0b3ec70c45df5473cd3c	의사가 알레르기 검사를 실시할 수 있기 때문에 이는 매우 중요합니다.	train
common_voice_en_18562102.mp3	Jujitsu and Judo are grappling sports.	dcecd6fbc74218b7ff0c4031da449c736c62674a3fd28e9ed07061aedd2b12d8d78f11ea0e9203a8e583b5f5a812906b393b41ad6f2fea0440fdb9abb43082f1	주짓수와 유도는 격투 스포츠입니다.	train
common_voice_en_18562103.mp3	The car was parked.	dcecd6fbc74218b7ff0c4031da449c736c62674a3fd28e9ed07061aedd2b12d8d78f11ea0e9203a8e583b5f5a812906b393b41ad6f2fea0440fdb9abb43082f1	차가 주차되어 있었습니다.	train
common_voice_en_18562104.mp3	But I do not believe that they are going to be married.	dcecd6fbc74218b7ff0c4031da449c736c62674a3fd28e9ed07061aedd2b12d8d78f11ea0e9203a8e583b5f5a812906b393b41ad6f2fea0440fdb9abb43082f1	그러나 나는 그들이 결혼할 것이라고 믿지 않습니다.	train
common_voice_en_18562105.mp3	And there was science to an unlimited extent.	dcecd6fbc74218b7ff0c4031da449c736c62674a3fd28e9ed07061aedd2b12d8d78f11ea0e9203a8e583b5f5a812906b393b41ad6f2fea0440fdb9abb43082f1	그리고 과학은 무한대로 발전했습니다.	train
common_voice_en_18562106.mp3	"Don't you see what this means?"	dcecd6fbc74218b7ff0c4031da449c736c62674a3fd28e9ed07061aedd2b12d8d78f11ea0e9203a8e583b5f5a812906b393b41ad6f2fea0440fdb9abb43082f1	이게 무슨 뜻인지 모르시겠어요?	train
common_voice_en_19639042.mp3	B term is due to the field-induced mixing of states.	dceffda472276858a6d8899ff7bdf7a9d8b3d11e4f52dd1838d872731222535f379ff2dba3d78b4dc1b6006ef13711dc76f17363e526972f8f12683f49945c9f	B 항은 필드에 의한 상태의 혼합으로 인한 것입니다.	train
common_voice_en_19639045.mp3	No physical evidence was ever found.	dceffda472276858a6d8899ff7bdf7a9d8b3d11e4f52dd1838d872731222535f379ff2dba3d78b4dc1b6006ef13711dc76f17363e526972f8f12683f49945c9f	물리적 증거는 발견되지 않았습니다.	train
common_voice_en_19639047.mp3	The plot had changed as well.	dceffda472276858a6d8899ff7bdf7a9d8b3d11e4f52dd1838d872731222535f379ff2dba3d78b4dc1b6006ef13711dc76f17363e526972f8f12683f49945c9f	줄거리도 바뀌었습니다.	train
common_voice_en_19639048.mp3	It takes place in the Minho Province region.	dceffda472276858a6d8899ff7bdf7a9d8b3d11e4f52dd1838d872731222535f379ff2dba3d78b4dc1b6006ef13711dc76f17363e526972f8f12683f49945c9f	민호 지방에서 진행됩니다.	train
common_voice_en_19715256.mp3	Desire is a state that is satisfied when the world fits it.	dcfa5e9d3fa5c29eb3c835a2ba02c7be2a68fc931ed3484d41090dba7ce7ea938ee8cb01e822c31f9f56eaca0fd4cfe25a48d2204660b8c4aceec9e49fe5301f	욕망은 세상이 자신에게 맞을 때 충족되는 상태입니다.	train
common_voice_en_19715257.mp3	The flora includes seakale, sea holly, and yellow-horned poppy.	dcfa5e9d3fa5c29eb3c835a2ba02c7be2a68fc931ed3484d41090dba7ce7ea938ee8cb01e822c31f9f56eaca0fd4cfe25a48d2204660b8c4aceec9e49fe5301f	식물군에는 바다갈매기, 바다호랑가시나무, 노란뿔양귀비 등이 있습니다.	train
common_voice_en_19715258.mp3	The main battery turrets had thick sides.	dcfa5e9d3fa5c29eb3c835a2ba02c7be2a68fc931ed3484d41090dba7ce7ea938ee8cb01e822c31f9f56eaca0fd4cfe25a48d2204660b8c4aceec9e49fe5301f	주 배터리 포탑의 측면이 두껍습니다.	train
common_voice_en_19715259.mp3	Helensburgh is the next town, travelling south.	dcfa5e9d3fa5c29eb3c835a2ba02c7be2a68fc931ed3484d41090dba7ce7ea938ee8cb01e822c31f9f56eaca0fd4cfe25a48d2204660b8c4aceec9e49fe5301f	헬렌스버그는 남쪽으로 이동하면 다음 도시입니다.	train
common_voice_en_19715260.mp3	"The founders decided to use the name ""Pedare"" to recoginise the past pioneers."	dcfa5e9d3fa5c29eb3c835a2ba02c7be2a68fc931ed3484d41090dba7ce7ea938ee8cb01e822c31f9f56eaca0fd4cfe25a48d2204660b8c4aceec9e49fe5301f	창립자들은 과거의 선구자들을 기리기 위해 '페다레'라는 이름을 사용하기로 결정했습니다.	train
common_voice_en_18519813.mp3	How big is the Endangered Species List?	dd0d75f723bbd731aaa42ea67aa8087ecbab25c7aa4122d74597b36b1c8ce32156417b5108ec4635e9b9554689d8f6c9539fde3abf0685796592782b4ae035d9	멸종 위기종 목록의 규모는 어느 정도인가요?	train
common_voice_en_18519815.mp3	"Right on the bull's-eye."	dd0d75f723bbd731aaa42ea67aa8087ecbab25c7aa4122d74597b36b1c8ce32156417b5108ec4635e9b9554689d8f6c9539fde3abf0685796592782b4ae035d9	바로 과녁에 맞췄습니다.	train
common_voice_en_18519816.mp3	His bark is worse than his bite.	dd0d75f723bbd731aaa42ea67aa8087ecbab25c7aa4122d74597b36b1c8ce32156417b5108ec4635e9b9554689d8f6c9539fde3abf0685796592782b4ae035d9	물린 것보다 짖는 것이 더 심합니다.	train
common_voice_en_18519817.mp3	It was on my to-do list.	dd0d75f723bbd731aaa42ea67aa8087ecbab25c7aa4122d74597b36b1c8ce32156417b5108ec4635e9b9554689d8f6c9539fde3abf0685796592782b4ae035d9	제 할 일 목록에 있었습니다.	train
