path	sentence	client_id	translation	split
common_voice_en_18649640.mp3	If you are affected by this, please let us know.	a7b1db5f82512a77c669d789c4d8d94060eca2838e3ffa3ec81bbe15421aa6903f5a5f35e23bb83c4fe312c634838ae01afd029f196d0daff7c62aeeaf3ef811	이로 인해 피해를 입으신 경우 알려주시기 바랍니다.	train
common_voice_en_18649641.mp3	But it is no use.	a7b1db5f82512a77c669d789c4d8d94060eca2838e3ffa3ec81bbe15421aa6903f5a5f35e23bb83c4fe312c634838ae01afd029f196d0daff7c62aeeaf3ef811	하지만 소용이 없습니다.	train_covost
common_voice_en_18649642.mp3	On these national occasions Sir Leicester finds the cousins useful.	a7b1db5f82512a77c669d789c4d8d94060eca2838e3ffa3ec81bbe15421aa6903f5a5f35e23bb83c4fe312c634838ae01afd029f196d0daff7c62aeeaf3ef811	이러한 국가적인 행사에서 레스터 경은 사촌들이 유용하다고 생각합니다.	train
common_voice_en_18649668.mp3	Metal wires conduct electricity and must be insulated.	a7b1db5f82512a77c669d789c4d8d94060eca2838e3ffa3ec81bbe15421aa6903f5a5f35e23bb83c4fe312c634838ae01afd029f196d0daff7c62aeeaf3ef811	금속 와이어는 전기를 전도하므로 절연 처리해야 합니다.	train
common_voice_en_18649669.mp3	We use content delivery networks to reduce latency times around the world.	a7b1db5f82512a77c669d789c4d8d94060eca2838e3ffa3ec81bbe15421aa6903f5a5f35e23bb83c4fe312c634838ae01afd029f196d0daff7c62aeeaf3ef811	콘텐츠 전송 네트워크를 사용하여 전 세계에서 지연 시간을 단축합니다.	train
common_voice_en_18649670.mp3	We will endeavour to answer your call within thirty seconds.	a7b1db5f82512a77c669d789c4d8d94060eca2838e3ffa3ec81bbe15421aa6903f5a5f35e23bb83c4fe312c634838ae01afd029f196d0daff7c62aeeaf3ef811	30초 이내에 전화에 응답하도록 노력하겠습니다.	train_covost
common_voice_en_18649671.mp3	Caution, Handle with care.	a7b1db5f82512a77c669d789c4d8d94060eca2838e3ffa3ec81bbe15421aa6903f5a5f35e23bb83c4fe312c634838ae01afd029f196d0daff7c62aeeaf3ef811	주의, 조심해서 다루세요.	train_covost
common_voice_en_18649672.mp3	Parents acquiesce to a crying toddler.	a7b1db5f82512a77c669d789c4d8d94060eca2838e3ffa3ec81bbe15421aa6903f5a5f35e23bb83c4fe312c634838ae01afd029f196d0daff7c62aeeaf3ef811	부모는 우는 유아를 묵인합니다.	train
common_voice_en_18649680.mp3	And suddenly, Mr. Ricardo began to reflect.	a7b1db5f82512a77c669d789c4d8d94060eca2838e3ffa3ec81bbe15421aa6903f5a5f35e23bb83c4fe312c634838ae01afd029f196d0daff7c62aeeaf3ef811	그리고 갑자기 리카르도 씨는 반성하기 시작했습니다.	train_covost
common_voice_en_18649681.mp3	It was all gone now.	a7b1db5f82512a77c669d789c4d8d94060eca2838e3ffa3ec81bbe15421aa6903f5a5f35e23bb83c4fe312c634838ae01afd029f196d0daff7c62aeeaf3ef811	이제 모두 사라졌습니다.	train_covost
common_voice_en_18649682.mp3	A gymnast moves around flexibly.	a7b1db5f82512a77c669d789c4d8d94060eca2838e3ffa3ec81bbe15421aa6903f5a5f35e23bb83c4fe312c634838ae01afd029f196d0daff7c62aeeaf3ef811	체조 선수는 유연하게 움직입니다.	train
common_voice_en_18649688.mp3	I hurried on so swiftly that my maid was surprised.	a7b1db5f82512a77c669d789c4d8d94060eca2838e3ffa3ec81bbe15421aa6903f5a5f35e23bb83c4fe312c634838ae01afd029f196d0daff7c62aeeaf3ef811	너무 급하게 서둘러서 가정부가 놀랐어요.	train_covost
common_voice_en_18649689.mp3	"We can't cook anything whatever."	a7b1db5f82512a77c669d789c4d8d94060eca2838e3ffa3ec81bbe15421aa6903f5a5f35e23bb83c4fe312c634838ae01afd029f196d0daff7c62aeeaf3ef811	우리는 아무 것도 요리할 수 없습니다.	train_covost
common_voice_en_18649691.mp3	"""More than ever,"" he said."	a7b1db5f82512a77c669d789c4d8d94060eca2838e3ffa3ec81bbe15421aa6903f5a5f35e23bb83c4fe312c634838ae01afd029f196d0daff7c62aeeaf3ef811	"그 어느 때보다도요."라고 그는 말했습니다."	train
common_voice_en_18649692.mp3	I did not attempt it.	a7b1db5f82512a77c669d789c4d8d94060eca2838e3ffa3ec81bbe15421aa6903f5a5f35e23bb83c4fe312c634838ae01afd029f196d0daff7c62aeeaf3ef811	시도하지 않았습니다.	train_covost
common_voice_en_18649693.mp3	"Can't we? You just watch us."	a7b1db5f82512a77c669d789c4d8d94060eca2838e3ffa3ec81bbe15421aa6903f5a5f35e23bb83c4fe312c634838ae01afd029f196d0daff7c62aeeaf3ef811	안 되나요? 그냥 지켜봐주세요.	train_covost
