path	sentence	client_id	translation	split
common_voice_en_19138014.mp3	"San Diego High School's mascot is the Cavers - originally the Cavemen."	77ce342b80a242bc451784f55f1ad07aa371c6f1f7ab3cba39022a85afd29d5b7b932538e647d458fac171b15608fc66b7bea203f2cf070b3533aa4223596871	샌디에이고 고등학교의 마스코트는 원래 원시인인 캐버스입니다.	train
common_voice_en_19138015.mp3	Public schools are managed by the Alto Independent School District.	77ce342b80a242bc451784f55f1ad07aa371c6f1f7ab3cba39022a85afd29d5b7b932538e647d458fac171b15608fc66b7bea203f2cf070b3533aa4223596871	공립학교는 알토 독립 교육구에서 관리합니다.	train
common_voice_en_19138021.mp3	All five of the top throwers defeated the old Olympic record.	77ce342b80a242bc451784f55f1ad07aa371c6f1f7ab3cba39022a85afd29d5b7b932538e647d458fac171b15608fc66b7bea203f2cf070b3533aa4223596871	상위 5명의 선수 모두 기존 올림픽 신기록을 갈아치웠습니다.	train
common_voice_en_19138022.mp3	The town stretches across eight sections, linked by old-fashioned stone bridges.	77ce342b80a242bc451784f55f1ad07aa371c6f1f7ab3cba39022a85afd29d5b7b932538e647d458fac171b15608fc66b7bea203f2cf070b3533aa4223596871	마을은 8개의 구역으로 나뉘어 있으며, 오래된 돌다리로 연결되어 있습니다.	train
common_voice_en_19138023.mp3	Towns for Families.	77ce342b80a242bc451784f55f1ad07aa371c6f1f7ab3cba39022a85afd29d5b7b932538e647d458fac171b15608fc66b7bea203f2cf070b3533aa4223596871	가족을 위한 마을.	train
common_voice_en_19138024.mp3	At the back of the house is the living room and the kitchen.	77ce342b80a242bc451784f55f1ad07aa371c6f1f7ab3cba39022a85afd29d5b7b932538e647d458fac171b15608fc66b7bea203f2cf070b3533aa4223596871	집 뒤쪽에는 거실과 주방이 있습니다.	train
common_voice_en_19138025.mp3	Little is known about him, except for some of his remaining coins.	77ce342b80a242bc451784f55f1ad07aa371c6f1f7ab3cba39022a85afd29d5b7b932538e647d458fac171b15608fc66b7bea203f2cf070b3533aa4223596871	그의 남은 동전 일부를 제외하고는 그에 대해 알려진 것이 거의 없습니다.	train
common_voice_en_19138034.mp3	"What we know as ""light"" is but a narrow region of the electromagnetic spectrum."	77ce342b80a242bc451784f55f1ad07aa371c6f1f7ab3cba39022a85afd29d5b7b932538e647d458fac171b15608fc66b7bea203f2cf070b3533aa4223596871	우리가 '빛'이라고 알고 있는 것은 전자기 스펙트럼의 좁은 영역에 불과합니다.	train
common_voice_en_19138036.mp3	Welding skills gave him something he could trade upon.	77ce342b80a242bc451784f55f1ad07aa371c6f1f7ab3cba39022a85afd29d5b7b932538e647d458fac171b15608fc66b7bea203f2cf070b3533aa4223596871	용접 기술은 그에게 거래할 수 있는 무언가를 제공했습니다.	train
common_voice_en_19138038.mp3	The player must dock with the mysterious ship and gain entry to its interior.	77ce342b80a242bc451784f55f1ad07aa371c6f1f7ab3cba39022a85afd29d5b7b932538e647d458fac171b15608fc66b7bea203f2cf070b3533aa4223596871	플레이어는 수수께끼의 우주선에 도킹하여 우주선 내부로 들어가야 합니다.	train
common_voice_en_19138039.mp3	By this stage McCudden was suffering from combat fatigue.	77ce342b80a242bc451784f55f1ad07aa371c6f1f7ab3cba39022a85afd29d5b7b932538e647d458fac171b15608fc66b7bea203f2cf070b3533aa4223596871	이 무렵 맥커든은 전투 피로에 시달리고 있었습니다.	train
common_voice_en_19138040.mp3	Combat is resolved per-element, in the order desired by the active player.	77ce342b80a242bc451784f55f1ad07aa371c6f1f7ab3cba39022a85afd29d5b7b932538e647d458fac171b15608fc66b7bea203f2cf070b3533aa4223596871	전투는 활성 플레이어가 원하는 순서대로 요소별로 해결됩니다.	train
common_voice_en_19138049.mp3	"Numerous Japanese restaurants have also emerged in Manhattan's Koreatown."	77ce342b80a242bc451784f55f1ad07aa371c6f1f7ab3cba39022a85afd29d5b7b932538e647d458fac171b15608fc66b7bea203f2cf070b3533aa4223596871	맨해튼의 코리아타운에도 수많은 일식 레스토랑이 생겨났어요.	train
common_voice_en_19138050.mp3	"Full-face masks can provide more protection for the divers' facial skin."	77ce342b80a242bc451784f55f1ad07aa371c6f1f7ab3cba39022a85afd29d5b7b932538e647d458fac171b15608fc66b7bea203f2cf070b3533aa4223596871	풀 페이스 마스크는 다이버의 얼굴 피부를 더 잘 보호할 수 있습니다.	train
common_voice_en_19138052.mp3	He puts his best friend, Captain William Bush, in command.	77ce342b80a242bc451784f55f1ad07aa371c6f1f7ab3cba39022a85afd29d5b7b932538e647d458fac171b15608fc66b7bea203f2cf070b3533aa4223596871	그는 자신의 절친한 친구인 윌리엄 부시 대위를 지휘관으로 임명합니다.	train
common_voice_en_19138055.mp3	He helped develop and support new aircraft designs.	77ce342b80a242bc451784f55f1ad07aa371c6f1f7ab3cba39022a85afd29d5b7b932538e647d458fac171b15608fc66b7bea203f2cf070b3533aa4223596871	그는 새로운 항공기 설계를 개발하고 지원하는 데 도움을 주었습니다.	train
common_voice_en_19138057.mp3	It is the best-selling environment book of the century to date.	77ce342b80a242bc451784f55f1ad07aa371c6f1f7ab3cba39022a85afd29d5b7b932538e647d458fac171b15608fc66b7bea203f2cf070b3533aa4223596871	이 책은 현재까지 가장 많이 팔린 세기의 환경 서적입니다.	train
common_voice_en_19138287.mp3	An adult alpine marmot may stand at at the shoulder.	77ce342b80a242bc451784f55f1ad07aa371c6f1f7ab3cba39022a85afd29d5b7b932538e647d458fac171b15608fc66b7bea203f2cf070b3533aa4223596871	성체 알파인 마멋은 어깨 높이로 서 있을 수 있습니다.	train
common_voice_en_19138289.mp3	Instead, it features many parks with nature as their theme.	77ce342b80a242bc451784f55f1ad07aa371c6f1f7ab3cba39022a85afd29d5b7b932538e647d458fac171b15608fc66b7bea203f2cf070b3533aa4223596871	대신 자연을 테마로 한 공원이 많이 있습니다.	train
common_voice_en_19138291.mp3	Glen also played bass on their self-titled album funded by a Pledge Music campaign.	77ce342b80a242bc451784f55f1ad07aa371c6f1f7ab3cba39022a85afd29d5b7b932538e647d458fac171b15608fc66b7bea203f2cf070b3533aa4223596871	Glen은 Pledge Music 캠페인으로 자금을 지원받은 셀프 타이틀 앨범에서 베이스를 연주하기도 했습니다.	train
common_voice_en_19138294.mp3	Each province in the region is further subdivided into communes.	77ce342b80a242bc451784f55f1ad07aa371c6f1f7ab3cba39022a85afd29d5b7b932538e647d458fac171b15608fc66b7bea203f2cf070b3533aa4223596871	이 지역의 각 지방은 다시 코뮌으로 세분화됩니다.	train
common_voice_en_18841277.mp3	"Men's basketball and track and field began around the same time."	bd8fde1c5e7b0891e3740031d254efecbb60977cd44e53a1953507067c6c90c322c62cda4d993a224065915680ab8ec210a382cb667de683a240c863c6796f87	남자 농구와 육상은 거의 같은 시기에 시작되었습니다.	train
common_voice_en_18841278.mp3	The opium poppy continues to be a major industrial source of opiates, including morphine.	bd8fde1c5e7b0891e3740031d254efecbb60977cd44e53a1953507067c6c90c322c62cda4d993a224065915680ab8ec210a382cb667de683a240c863c6796f87	아편 양귀비는 모르핀을 포함한 아편제의 주요 산업 공급원이 되고 있습니다.	train
common_voice_en_18841279.mp3	Several of his paintings are in the Morris-Butler House.	bd8fde1c5e7b0891e3740031d254efecbb60977cd44e53a1953507067c6c90c322c62cda4d993a224065915680ab8ec210a382cb667de683a240c863c6796f87	그의 그림 중 일부는 모리스-버틀러 하우스에 소장되어 있습니다.	train
common_voice_en_18841280.mp3	Following Portland, Lazier started only two more races during the season.	bd8fde1c5e7b0891e3740031d254efecbb60977cd44e53a1953507067c6c90c322c62cda4d993a224065915680ab8ec210a382cb667de683a240c863c6796f87	포틀랜드에 이어 Lazier는 시즌 중 단 두 번의 레이스에만 출전했습니다.	train
common_voice_en_18841281.mp3	Princess Galyani Vadhana was interested in photography.	bd8fde1c5e7b0891e3740031d254efecbb60977cd44e53a1953507067c6c90c322c62cda4d993a224065915680ab8ec210a382cb667de683a240c863c6796f87	갈리아니 바다나 공주는 사진에 관심이 많았습니다.	train
common_voice_en_18841283.mp3	He was a high school student.	bd8fde1c5e7b0891e3740031d254efecbb60977cd44e53a1953507067c6c90c322c62cda4d993a224065915680ab8ec210a382cb667de683a240c863c6796f87	그는 고등학생이었습니다.	train
common_voice_en_18841284.mp3	There are several locations near Hong Kong named in his memory.	bd8fde1c5e7b0891e3740031d254efecbb60977cd44e53a1953507067c6c90c322c62cda4d993a224065915680ab8ec210a382cb667de683a240c863c6796f87	홍콩 근처에는 그의 이름을 딴 여러 장소가 있습니다.	train
common_voice_en_18841285.mp3	Puerto Castilla is now a native fishing village of about six hundred residents.	bd8fde1c5e7b0891e3740031d254efecbb60977cd44e53a1953507067c6c90c322c62cda4d993a224065915680ab8ec210a382cb667de683a240c863c6796f87	푸에르토 카스티야는 현재 약 600명의 주민이 거주하는 원주민 어촌 마을입니다.	train
common_voice_en_18841286.mp3	The course led along the coast of the new found land.	bd8fde1c5e7b0891e3740031d254efecbb60977cd44e53a1953507067c6c90c322c62cda4d993a224065915680ab8ec210a382cb667de683a240c863c6796f87	코스는 새로 발견된 땅의 해안을 따라 이어졌습니다.	train
common_voice_en_18841292.mp3	Ellenor Fenn was his sister.	bd8fde1c5e7b0891e3740031d254efecbb60977cd44e53a1953507067c6c90c322c62cda4d993a224065915680ab8ec210a382cb667de683a240c863c6796f87	엘레노어 펜은 그의 여동생이었습니다.	train
common_voice_en_18841293.mp3	A uniform naming scheme for Communist parties was adopted by the Communist International.	bd8fde1c5e7b0891e3740031d254efecbb60977cd44e53a1953507067c6c90c322c62cda4d993a224065915680ab8ec210a382cb667de683a240c863c6796f87	공산당에 대한 통일된 명칭 체계는 공산주의 인터내셔널에 의해 채택되었습니다.	train
common_voice_en_18841294.mp3	"The union published the ""Dockers' Record"" as a monthly report of its activities."	bd8fde1c5e7b0891e3740031d254efecbb60977cd44e53a1953507067c6c90c322c62cda4d993a224065915680ab8ec210a382cb667de683a240c863c6796f87	노조는 매월 활동 보고서로 '도커스의 기록'을 발간했습니다.	train
common_voice_en_18841295.mp3	She released several albums and once performed with Frank Sinatra at Carnegie Hall.	bd8fde1c5e7b0891e3740031d254efecbb60977cd44e53a1953507067c6c90c322c62cda4d993a224065915680ab8ec210a382cb667de683a240c863c6796f87	여러 앨범을 발표하고 카네기 홀에서 프랭크 시나트라와 함께 공연한 적도 있습니다.	train
common_voice_en_18841296.mp3	One of the main purposes of a roof is to resist water.	bd8fde1c5e7b0891e3740031d254efecbb60977cd44e53a1953507067c6c90c322c62cda4d993a224065915680ab8ec210a382cb667de683a240c863c6796f87	지붕의 주요 목적 중 하나는 물에 견디는 것입니다.	train
common_voice_en_18841298.mp3	"His name in Sanskrit means ""the fast one"", deriving from Raghu's chariot-driving abilities."	bd8fde1c5e7b0891e3740031d254efecbb60977cd44e53a1953507067c6c90c322c62cda4d993a224065915680ab8ec210a382cb667de683a240c863c6796f87	산스크리트어로 '빠른 자'라는 뜻의 라구라는 이름은 라구의 전차 운전 능력에서 유래했습니다.	train
common_voice_en_18841300.mp3	"The meaning of ""Hoshi-no-ie"" is ""a star house""."	bd8fde1c5e7b0891e3740031d254efecbb60977cd44e53a1953507067c6c90c322c62cda4d993a224065915680ab8ec210a382cb667de683a240c863c6796f87	'호시노이에'의 뜻은 '별의 집'이라는 뜻입니다.	train
common_voice_en_18841301.mp3	Smear tactics are commonly used to undermine effective arguments or critiques.	bd8fde1c5e7b0891e3740031d254efecbb60977cd44e53a1953507067c6c90c322c62cda4d993a224065915680ab8ec210a382cb667de683a240c863c6796f87	명예훼손 전술은 효과적인 주장이나 비판을 약화시키기 위해 일반적으로 사용됩니다.	train
common_voice_en_18841303.mp3	Common strict liability offenses today include the selling of alcohol to underage persons.	bd8fde1c5e7b0891e3740031d254efecbb60977cd44e53a1953507067c6c90c322c62cda4d993a224065915680ab8ec210a382cb667de683a240c863c6796f87	오늘날 일반적인 엄격 책임 위반에는 미성년자에게 주류를 판매하는 행위가 포함됩니다.	train
common_voice_en_18841304.mp3	Chelamma is a Scorpion goddess and is worshipped along with Kolaramma in Kolar.	bd8fde1c5e7b0891e3740031d254efecbb60977cd44e53a1953507067c6c90c322c62cda4d993a224065915680ab8ec210a382cb667de683a240c863c6796f87	첼람마는 전갈의 여신으로, 콜라에서 콜라람마와 함께 숭배됩니다.	train
common_voice_en_18841305.mp3	This broader definition includes navigation.	bd8fde1c5e7b0891e3740031d254efecbb60977cd44e53a1953507067c6c90c322c62cda4d993a224065915680ab8ec210a382cb667de683a240c863c6796f87	이 광범위한 정의에는 탐색이 포함됩니다.	train
common_voice_en_18841307.mp3	He was a contemporary to Swami Vivekanand, who deeply admired him.	bd8fde1c5e7b0891e3740031d254efecbb60977cd44e53a1953507067c6c90c322c62cda4d993a224065915680ab8ec210a382cb667de683a240c863c6796f87	그는 스와미 비베카난드와 동시대 인물로, 그를 깊이 존경했습니다.	train
common_voice_en_18841313.mp3	The strip ended so that Harrison could take over Minnie the Minx.	bd8fde1c5e7b0891e3740031d254efecbb60977cd44e53a1953507067c6c90c322c62cda4d993a224065915680ab8ec210a382cb667de683a240c863c6796f87	해리슨이 밍크스 미니를 이어받을 수 있도록 스트립이 끝났습니다.	train
common_voice_en_18841314.mp3	Epidermal thickening is another characteristic histologic finding of psoriasis lesions.	bd8fde1c5e7b0891e3740031d254efecbb60977cd44e53a1953507067c6c90c322c62cda4d993a224065915680ab8ec210a382cb667de683a240c863c6796f87	표피 비후는 건선 병변의 또 다른 특징적인 조직학적 소견입니다.	train
common_voice_en_18841315.mp3	Like Sammy, he also observes the girls in the store with interest.	bd8fde1c5e7b0891e3740031d254efecbb60977cd44e53a1953507067c6c90c322c62cda4d993a224065915680ab8ec210a382cb667de683a240c863c6796f87	새미와 마찬가지로 그도 매장에 있는 소녀들을 흥미롭게 관찰합니다.	train
common_voice_en_18841316.mp3	"Some cultivars, such as 'Bradford', are particularly susceptible to storm damage."	bd8fde1c5e7b0891e3740031d254efecbb60977cd44e53a1953507067c6c90c322c62cda4d993a224065915680ab8ec210a382cb667de683a240c863c6796f87	'브래드포드'와 같은 일부 품종은 특히 폭풍 피해에 취약합니다.	train
common_voice_en_18841317.mp3	He still makes his residence north of town at his Brindley Farm.	bd8fde1c5e7b0891e3740031d254efecbb60977cd44e53a1953507067c6c90c322c62cda4d993a224065915680ab8ec210a382cb667de683a240c863c6796f87	그는 여전히 마을 북쪽에 있는 브린들리 농장에 거주하고 있습니다.	train
common_voice_en_18841323.mp3	They had two children, Ganson and Lucia Depew.	bd8fde1c5e7b0891e3740031d254efecbb60977cd44e53a1953507067c6c90c322c62cda4d993a224065915680ab8ec210a382cb667de683a240c863c6796f87	두 사람 사이에는 간슨과 루시아 데퓨라는 두 자녀가 있었습니다.	train
common_voice_en_18841324.mp3	The town refused.	bd8fde1c5e7b0891e3740031d254efecbb60977cd44e53a1953507067c6c90c322c62cda4d993a224065915680ab8ec210a382cb667de683a240c863c6796f87	마을은 거절했습니다.	train
common_voice_en_18841325.mp3	The gauge name Colonial Gauge was used in New Zealand.	bd8fde1c5e7b0891e3740031d254efecbb60977cd44e53a1953507067c6c90c322c62cda4d993a224065915680ab8ec210a382cb667de683a240c863c6796f87	콜로니얼 게이지라는 게이지 이름은 뉴질랜드에서 사용되었습니다.	train
common_voice_en_18841327.mp3	"She had voice role in Walt Disney's ""Dinosaur""."	bd8fde1c5e7b0891e3740031d254efecbb60977cd44e53a1953507067c6c90c322c62cda4d993a224065915680ab8ec210a382cb667de683a240c863c6796f87	월트 디즈니의 '다이노소어'에서 목소리 연기를 맡았습니다.	train
common_voice_en_18841328.mp3	Rogersville, the main settlement in the township, is west of Waynesburg, the county seat.	bd8fde1c5e7b0891e3740031d254efecbb60977cd44e53a1953507067c6c90c322c62cda4d993a224065915680ab8ec210a382cb667de683a240c863c6796f87	마을의 주요 정착지인 로저스빌은 카운티 소재지인 웨인즈버그 서쪽에 있습니다.	train
common_voice_en_18841330.mp3	It is part of the Unorganized Borough and therefore has no borough seat.	bd8fde1c5e7b0891e3740031d254efecbb60977cd44e53a1953507067c6c90c322c62cda4d993a224065915680ab8ec210a382cb667de683a240c863c6796f87	미조직 자치구에 속해 있으므로 자치구 의석이 없습니다.	train
common_voice_en_18841331.mp3	"His first job was coaching the youth divisions of Argentine club Newell's Old Boys."	bd8fde1c5e7b0891e3740031d254efecbb60977cd44e53a1953507067c6c90c322c62cda4d993a224065915680ab8ec210a382cb667de683a240c863c6796f87	그의 첫 번째 직업은 아르헨티나 클럽 뉴웰의 올드 보이즈의 유소년 부서를 코치하는 일이었습니다.	train
common_voice_en_18841332.mp3	He practiced and wrote with skill and sense.	bd8fde1c5e7b0891e3740031d254efecbb60977cd44e53a1953507067c6c90c322c62cda4d993a224065915680ab8ec210a382cb667de683a240c863c6796f87	그는 실력과 감각으로 연습하고 글을 썼습니다.	train
common_voice_en_18841401.mp3	These were of Soviet, Chinese or local manufacture.	bd8fde1c5e7b0891e3740031d254efecbb60977cd44e53a1953507067c6c90c322c62cda4d993a224065915680ab8ec210a382cb667de683a240c863c6796f87	이들은 소련, 중국 또는 현지에서 제조된 제품입니다.	train
common_voice_en_18841403.mp3	It is located near Lake Scugog in Durham Region.	bd8fde1c5e7b0891e3740031d254efecbb60977cd44e53a1953507067c6c90c322c62cda4d993a224065915680ab8ec210a382cb667de683a240c863c6796f87	더럼 지역의 스쿠곡 호수 근처에 위치해 있습니다.	train
common_voice_en_18841405.mp3	The Supreme Court has not squarely addressed the limits of signing statements.	bd8fde1c5e7b0891e3740031d254efecbb60977cd44e53a1953507067c6c90c322c62cda4d993a224065915680ab8ec210a382cb667de683a240c863c6796f87	대법원은 서명 진술의 한계에 대해 명확하게 다루지 않았습니다.	train
common_voice_en_18841406.mp3	A few exceptions exist, where the dies are used despite producing obvious flaws.	bd8fde1c5e7b0891e3740031d254efecbb60977cd44e53a1953507067c6c90c322c62cda4d993a224065915680ab8ec210a382cb667de683a240c863c6796f87	명백한 결함이 발생했음에도 불구하고 금형을 사용하는 몇 가지 예외가 있습니다.	train
common_voice_en_18841407.mp3	She defied them and completed the trip.	bd8fde1c5e7b0891e3740031d254efecbb60977cd44e53a1953507067c6c90c322c62cda4d993a224065915680ab8ec210a382cb667de683a240c863c6796f87	그녀는 그들을 무시하고 여행을 완주했습니다.	train
common_voice_en_18841425.mp3	In Europe, Poma and Leitner operate as separate ventures.	bd8fde1c5e7b0891e3740031d254efecbb60977cd44e53a1953507067c6c90c322c62cda4d993a224065915680ab8ec210a382cb667de683a240c863c6796f87	유럽에서는 포마와 라이트너가 별도의 벤처로 운영되고 있습니다.	train
common_voice_en_18841426.mp3	The hard approach depends on close supervision, intimidation, and imminent punishment.	bd8fde1c5e7b0891e3740031d254efecbb60977cd44e53a1953507067c6c90c322c62cda4d993a224065915680ab8ec210a382cb667de683a240c863c6796f87	엄격한 접근 방식은 면밀한 감독, 협박, 임박한 처벌에 의존합니다.	train
common_voice_en_18841428.mp3	His Liberal activities led to some work in local broadcasting.	bd8fde1c5e7b0891e3740031d254efecbb60977cd44e53a1953507067c6c90c322c62cda4d993a224065915680ab8ec210a382cb667de683a240c863c6796f87	그의 자유주의 활동은 지역 방송에서 일하게 되었습니다.	train
common_voice_en_18841430.mp3	The moral is okay.	bd8fde1c5e7b0891e3740031d254efecbb60977cd44e53a1953507067c6c90c322c62cda4d993a224065915680ab8ec210a382cb667de683a240c863c6796f87	교훈은 괜찮습니다.	train
common_voice_en_18841463.mp3	"Canada's archery squad in Sydney consisted of only one man, veteran Rob Rusnov."	bd8fde1c5e7b0891e3740031d254efecbb60977cd44e53a1953507067c6c90c322c62cda4d993a224065915680ab8ec210a382cb667de683a240c863c6796f87	시드니에 출전한 캐나다 양궁 대표팀은 베테랑 롭 루스노프 단 한 명으로만 구성되었습니다.	train
common_voice_en_18841464.mp3	Rugby School was the birthplace of Rugby football.	bd8fde1c5e7b0891e3740031d254efecbb60977cd44e53a1953507067c6c90c322c62cda4d993a224065915680ab8ec210a382cb667de683a240c863c6796f87	럭비 학교는 럭비 축구의 발상지였습니다.	train
common_voice_en_18841465.mp3	The sound box may be a pot or jug or some open-ended hollow object.	bd8fde1c5e7b0891e3740031d254efecbb60977cd44e53a1953507067c6c90c322c62cda4d993a224065915680ab8ec210a382cb667de683a240c863c6796f87	사운드 박스는 냄비나 주전자 또는 속이 비어 있는 개방형 물체일 수 있습니다.	train_covost
common_voice_en_18841467.mp3	Khulna is under the jurisdiction of the Jessore Education Board.	bd8fde1c5e7b0891e3740031d254efecbb60977cd44e53a1953507067c6c90c322c62cda4d993a224065915680ab8ec210a382cb667de683a240c863c6796f87	쿨나는 제소르 교육청의 관할 하에 있습니다.	train
common_voice_en_18841473.mp3	Cox continued to work with Galliano for a further six seasons.	bd8fde1c5e7b0891e3740031d254efecbb60977cd44e53a1953507067c6c90c322c62cda4d993a224065915680ab8ec210a382cb667de683a240c863c6796f87	콕스는 이후 6시즌 동안 갈리아노와 계속 함께 일했습니다.	train
common_voice_en_18841474.mp3	The province is divided in four cantons.	bd8fde1c5e7b0891e3740031d254efecbb60977cd44e53a1953507067c6c90c322c62cda4d993a224065915680ab8ec210a382cb667de683a240c863c6796f87	이 주는 4개의 주(州)로 나뉩니다.	train
common_voice_en_18841475.mp3	Bolder was born in Kingston upon Hull, East Riding of Yorkshire, England.	bd8fde1c5e7b0891e3740031d254efecbb60977cd44e53a1953507067c6c90c322c62cda4d993a224065915680ab8ec210a382cb667de683a240c863c6796f87	Bolder는 영국 요크셔주 이스트 라이딩의 킹스턴 어폰 헐에서 태어났습니다.	train
common_voice_en_18841476.mp3	But another league and another opportunity was in his future.	bd8fde1c5e7b0891e3740031d254efecbb60977cd44e53a1953507067c6c90c322c62cda4d993a224065915680ab8ec210a382cb667de683a240c863c6796f87	하지만 그의 미래에는 또 다른 리그와 또 다른 기회가 기다리고 있었습니다.	train
common_voice_en_18841477.mp3	This made the coding of counting loops very efficient.	bd8fde1c5e7b0891e3740031d254efecbb60977cd44e53a1953507067c6c90c322c62cda4d993a224065915680ab8ec210a382cb667de683a240c863c6796f87	덕분에 카운팅 루프 코딩이 매우 효율적이었습니다.	train
common_voice_en_18841483.mp3	Two spectators were also injured by flying debris.	bd8fde1c5e7b0891e3740031d254efecbb60977cd44e53a1953507067c6c90c322c62cda4d993a224065915680ab8ec210a382cb667de683a240c863c6796f87	관중 두 명도 날아오는 파편에 맞아 부상을 입었습니다.	train
common_voice_en_18841484.mp3	Ribbonfish possess all the characteristics of fish living at very great depths.	bd8fde1c5e7b0891e3740031d254efecbb60977cd44e53a1953507067c6c90c322c62cda4d993a224065915680ab8ec210a382cb667de683a240c863c6796f87	리본피쉬는 매우 깊은 수심에 사는 물고기의 모든 특성을 가지고 있습니다.	train
common_voice_en_18841486.mp3	Unruh was born in Koblenz, Germany.	bd8fde1c5e7b0891e3740031d254efecbb60977cd44e53a1953507067c6c90c322c62cda4d993a224065915680ab8ec210a382cb667de683a240c863c6796f87	운루는 독일 코블렌츠에서 태어났습니다.	train
common_voice_en_18841487.mp3	Basta Every Day, Happy!	bd8fde1c5e7b0891e3740031d254efecbb60977cd44e53a1953507067c6c90c322c62cda4d993a224065915680ab8ec210a382cb667de683a240c863c6796f87	매일 바스타, 행복하세요!	train
common_voice_en_18851724.mp3	He has competed in archery since the age of seven.	bd8fde1c5e7b0891e3740031d254efecbb60977cd44e53a1953507067c6c90c322c62cda4d993a224065915680ab8ec210a382cb667de683a240c863c6796f87	그는 7살 때부터 양궁 선수로 활동했습니다.	train
common_voice_en_18851725.mp3	The financial situation was a source of very grave anxiety.	bd8fde1c5e7b0891e3740031d254efecbb60977cd44e53a1953507067c6c90c322c62cda4d993a224065915680ab8ec210a382cb667de683a240c863c6796f87	재정 상황은 매우 심각한 불안의 원인이었습니다.	train
common_voice_en_18851726.mp3	Each hut also often housed two patients, although only built and designed for one.	bd8fde1c5e7b0891e3740031d254efecbb60977cd44e53a1953507067c6c90c322c62cda4d993a224065915680ab8ec210a382cb667de683a240c863c6796f87	각 오두막에는 종종 두 명의 환자를 수용하기도 했지만, 한 명만을 위해 지어지고 설계되었습니다.	train
common_voice_en_18851727.mp3	Afrikaans has a considerably more regular morphology, grammar, and spelling.	bd8fde1c5e7b0891e3740031d254efecbb60977cd44e53a1953507067c6c90c322c62cda4d993a224065915680ab8ec210a382cb667de683a240c863c6796f87	아프리칸스어는 상당히 규칙적인 형태, 문법, 철자를 가지고 있습니다.	train
common_voice_en_18851728.mp3	"Saint Andrew's is a Grade One listed building."	bd8fde1c5e7b0891e3740031d254efecbb60977cd44e53a1953507067c6c90c322c62cda4d993a224065915680ab8ec210a382cb667de683a240c863c6796f87	세인트 앤드루스는 1등급 건물로 등재된 건물입니다.	train
common_voice_en_18851729.mp3	Adult females have a brown head and a mostly grey body.	bd8fde1c5e7b0891e3740031d254efecbb60977cd44e53a1953507067c6c90c322c62cda4d993a224065915680ab8ec210a382cb667de683a240c863c6796f87	성체 암컷은 머리가 갈색이고 몸은 대부분 회색입니다.	train
