path	sentence	client_id	translation	split
common_voice_en_18623572.mp3	In February it will be our anniversary.	a4ee526e2273e838a673a73f093a162b7fb42d416d28681d1f09bc8306c497dd541674bad63ecc5e59e25f6ffa17cced46287ffb18fb18c1219c1abec736559c	2월이 되면 창립 1주년이 됩니다.	train_covost
common_voice_en_18623573.mp3	What are your recommendations?	a4ee526e2273e838a673a73f093a162b7fb42d416d28681d1f09bc8306c497dd541674bad63ecc5e59e25f6ffa17cced46287ffb18fb18c1219c1abec736559c	어떤 것을 추천하시나요?	train_covost
common_voice_en_18623574.mp3	And her voice was feverish.	a4ee526e2273e838a673a73f093a162b7fb42d416d28681d1f09bc8306c497dd541674bad63ecc5e59e25f6ffa17cced46287ffb18fb18c1219c1abec736559c	그리고 그녀의 목소리는 열이 났습니다.	train_covost
common_voice_en_18623575.mp3	We are tackling these challenges on several fronts.	a4ee526e2273e838a673a73f093a162b7fb42d416d28681d1f09bc8306c497dd541674bad63ecc5e59e25f6ffa17cced46287ffb18fb18c1219c1abec736559c	저희는 여러 방면에서 이러한 문제를 해결하고 있습니다.	train
common_voice_en_18623576.mp3	At the entrance from the corridor a porter barred the way.	a4ee526e2273e838a673a73f093a162b7fb42d416d28681d1f09bc8306c497dd541674bad63ecc5e59e25f6ffa17cced46287ffb18fb18c1219c1abec736559c	복도 입구에는 포터가 길을 막고 있었습니다.	train_covost
common_voice_en_18623582.mp3	We use a distributed backup system.	a4ee526e2273e838a673a73f093a162b7fb42d416d28681d1f09bc8306c497dd541674bad63ecc5e59e25f6ffa17cced46287ffb18fb18c1219c1abec736559c	저희는 분산 백업 시스템을 사용합니다.	train
common_voice_en_18623583.mp3	I always wanted to be an astronomer since I was little.	a4ee526e2273e838a673a73f093a162b7fb42d416d28681d1f09bc8306c497dd541674bad63ecc5e59e25f6ffa17cced46287ffb18fb18c1219c1abec736559c	어렸을 때부터 항상 천문학자가 되고 싶었어요.	train_covost
common_voice_en_18623584.mp3	I should have brought mine.	a4ee526e2273e838a673a73f093a162b7fb42d416d28681d1f09bc8306c497dd541674bad63ecc5e59e25f6ffa17cced46287ffb18fb18c1219c1abec736559c	제 것을 가져올 걸 그랬어요.	train_covost
common_voice_en_18623585.mp3	She seemed glad to see me.	a4ee526e2273e838a673a73f093a162b7fb42d416d28681d1f09bc8306c497dd541674bad63ecc5e59e25f6ffa17cced46287ffb18fb18c1219c1abec736559c	그녀는 저를 만나서 반가워하는 것 같았습니다.	train
common_voice_en_18623586.mp3	The gate is open at eleven.	a4ee526e2273e838a673a73f093a162b7fb42d416d28681d1f09bc8306c497dd541674bad63ecc5e59e25f6ffa17cced46287ffb18fb18c1219c1abec736559c	게이트는 11시에 열립니다.	train_covost
common_voice_en_18623620.mp3	The building has inadequate insulation and loses heat.	a4ee526e2273e838a673a73f093a162b7fb42d416d28681d1f09bc8306c497dd541674bad63ecc5e59e25f6ffa17cced46287ffb18fb18c1219c1abec736559c	건물의 단열이 불충분하여 열이 손실됩니다.	train_covost
common_voice_en_18623621.mp3	The news article said the chef at this restaurant used to cook for royalty.	a4ee526e2273e838a673a73f093a162b7fb42d416d28681d1f09bc8306c497dd541674bad63ecc5e59e25f6ffa17cced46287ffb18fb18c1219c1abec736559c	뉴스 기사에 따르면 이 레스토랑의 셰프가 왕족을 위해 요리를 했다고 합니다.	train
common_voice_en_18623623.mp3	In the future, large companies will dis-intermediate to compete with smaller agile companies.	a4ee526e2273e838a673a73f093a162b7fb42d416d28681d1f09bc8306c497dd541674bad63ecc5e59e25f6ffa17cced46287ffb18fb18c1219c1abec736559c	앞으로 대기업은 더 작은 애자일 기업들과 경쟁하기 위해 중간 단계를 없애게 될 것입니다.	train
common_voice_en_18623624.mp3	Our interaction was brief.	a4ee526e2273e838a673a73f093a162b7fb42d416d28681d1f09bc8306c497dd541674bad63ecc5e59e25f6ffa17cced46287ffb18fb18c1219c1abec736559c	저희의 대화는 짧았습니다.	train_covost
common_voice_en_18623625.mp3	The man who fetched that car fetched it carefully.	a4ee526e2273e838a673a73f093a162b7fb42d416d28681d1f09bc8306c497dd541674bad63ecc5e59e25f6ffa17cced46287ffb18fb18c1219c1abec736559c	그 차를 가져온 남자는 조심스럽게 차를 가져왔습니다.	train
common_voice_en_18644807.mp3	And thank you very much for asking,’ said Tweedledum.	a7b1db5f82512a77c669d789c4d8d94060eca2838e3ffa3ec81bbe15421aa6903f5a5f35e23bb83c4fe312c634838ae01afd029f196d0daff7c62aeeaf3ef811	"그리고 물어봐 주셔서 정말 감사합니다."라고 트위들덤은 말했습니다."	train_covost
common_voice_en_18644808.mp3	The garden was a ragged place of unmown lawn and straggling bushes.	a7b1db5f82512a77c669d789c4d8d94060eca2838e3ffa3ec81bbe15421aa6903f5a5f35e23bb83c4fe312c634838ae01afd029f196d0daff7c62aeeaf3ef811	정원은 깎지 않은 잔디와 덤불이 무성한 울퉁불퉁한 곳이었어요.	train_covost
common_voice_en_18644809.mp3	The exploitation of child workers was rampant until there was a public outcry.	a7b1db5f82512a77c669d789c4d8d94060eca2838e3ffa3ec81bbe15421aa6903f5a5f35e23bb83c4fe312c634838ae01afd029f196d0daff7c62aeeaf3ef811	아동 노동자에 대한 착취는 대중의 항의가 있기 전까지 만연해 있었습니다.	train_covost
common_voice_en_18644822.mp3	One finds it difficult to hazard a conjecture, sir.	a7b1db5f82512a77c669d789c4d8d94060eca2838e3ffa3ec81bbe15421aa6903f5a5f35e23bb83c4fe312c634838ae01afd029f196d0daff7c62aeeaf3ef811	섣부른 추측을 하기는 어렵습니다.	train_covost
common_voice_en_18644823.mp3	I was not aware that you were here, Sir Leicester.	a7b1db5f82512a77c669d789c4d8d94060eca2838e3ffa3ec81bbe15421aa6903f5a5f35e23bb83c4fe312c634838ae01afd029f196d0daff7c62aeeaf3ef811	여기 계신 줄 몰랐습니다, 레스터 경.	train_covost
common_voice_en_18644824.mp3	I am the amateur.	a7b1db5f82512a77c669d789c4d8d94060eca2838e3ffa3ec81bbe15421aa6903f5a5f35e23bb83c4fe312c634838ae01afd029f196d0daff7c62aeeaf3ef811	저는 아마추어입니다.	train_covost
common_voice_en_18644826.mp3	Non-conformists are still conforming to something.	a7b1db5f82512a77c669d789c4d8d94060eca2838e3ffa3ec81bbe15421aa6903f5a5f35e23bb83c4fe312c634838ae01afd029f196d0daff7c62aeeaf3ef811	비순응자는 여전히 무언가에 순응하고 있습니다.	train_covost
common_voice_en_18644842.mp3	She put her hat on her head.	a7b1db5f82512a77c669d789c4d8d94060eca2838e3ffa3ec81bbe15421aa6903f5a5f35e23bb83c4fe312c634838ae01afd029f196d0daff7c62aeeaf3ef811	그녀는 모자를 머리에 썼습니다.	train
common_voice_en_18644843.mp3	The candy grab bag had all sorts of chocolates.	a7b1db5f82512a77c669d789c4d8d94060eca2838e3ffa3ec81bbe15421aa6903f5a5f35e23bb83c4fe312c634838ae01afd029f196d0daff7c62aeeaf3ef811	사탕 봉지에는 온갖 종류의 초콜릿이 들어 있었습니다.	train
common_voice_en_18644845.mp3	Do you accept or decline?	a7b1db5f82512a77c669d789c4d8d94060eca2838e3ffa3ec81bbe15421aa6903f5a5f35e23bb83c4fe312c634838ae01afd029f196d0daff7c62aeeaf3ef811	수락하시겠습니까, 거절하시겠습니까?	train_covost
common_voice_en_18644846.mp3	Canned food lasts long but is not the same as the fresh food.	a7b1db5f82512a77c669d789c4d8d94060eca2838e3ffa3ec81bbe15421aa6903f5a5f35e23bb83c4fe312c634838ae01afd029f196d0daff7c62aeeaf3ef811	통조림 식품은 오래 보관할 수 있지만 신선 식품과 같지는 않습니다.	train_covost
common_voice_en_18644859.mp3	"It's a good room!"	a7b1db5f82512a77c669d789c4d8d94060eca2838e3ffa3ec81bbe15421aa6903f5a5f35e23bb83c4fe312c634838ae01afd029f196d0daff7c62aeeaf3ef811	좋은 방입니다!	train
common_voice_en_18644861.mp3	‘Not I!’ he replied.	a7b1db5f82512a77c669d789c4d8d94060eca2838e3ffa3ec81bbe15421aa6903f5a5f35e23bb83c4fe312c634838ae01afd029f196d0daff7c62aeeaf3ef811	"저는 아닙니다!" 그가 대답했습니다.	train_covost
common_voice_en_18644862.mp3	"""She means well,"" said Mr. Jarndyce hastily."	a7b1db5f82512a77c669d789c4d8d94060eca2838e3ffa3ec81bbe15421aa6903f5a5f35e23bb83c4fe312c634838ae01afd029f196d0daff7c62aeeaf3ef811	"좋은 뜻으로 한 말이죠." 잰디스가 서둘러 말했다.	train_covost
common_voice_en_18644867.mp3	And when I got downstairs, oh, how I cried!	a7b1db5f82512a77c669d789c4d8d94060eca2838e3ffa3ec81bbe15421aa6903f5a5f35e23bb83c4fe312c634838ae01afd029f196d0daff7c62aeeaf3ef811	그리고 아래층에 내려갔을 때 얼마나 울었는지 몰라요!	train_covost
common_voice_en_18644868.mp3	My finger’s bleeding!	a7b1db5f82512a77c669d789c4d8d94060eca2838e3ffa3ec81bbe15421aa6903f5a5f35e23bb83c4fe312c634838ae01afd029f196d0daff7c62aeeaf3ef811	손가락에서 피가 나요!	train
common_voice_en_18644869.mp3	I know the signs, my dear.	a7b1db5f82512a77c669d789c4d8d94060eca2838e3ffa3ec81bbe15421aa6903f5a5f35e23bb83c4fe312c634838ae01afd029f196d0daff7c62aeeaf3ef811	나도 징후를 알아, 여보.	train_covost
common_voice_en_18644870.mp3	"Thank goodness you've come, Bertie."	a7b1db5f82512a77c669d789c4d8d94060eca2838e3ffa3ec81bbe15421aa6903f5a5f35e23bb83c4fe312c634838ae01afd029f196d0daff7c62aeeaf3ef811	와주셔서 감사합니다, 버티.	train_covost
common_voice_en_18644873.mp3	She smiled imploringly, gratefully.	a7b1db5f82512a77c669d789c4d8d94060eca2838e3ffa3ec81bbe15421aa6903f5a5f35e23bb83c4fe312c634838ae01afd029f196d0daff7c62aeeaf3ef811	그녀는 감사한 듯 간절한 미소를 지었습니다.	train_covost
common_voice_en_18644874.mp3	Let me show you something interesting.	a7b1db5f82512a77c669d789c4d8d94060eca2838e3ffa3ec81bbe15421aa6903f5a5f35e23bb83c4fe312c634838ae01afd029f196d0daff7c62aeeaf3ef811	흥미로운 것을 보여드리겠습니다.	train_covost
common_voice_en_18644875.mp3	The hours crept anxiously by: another evening came.	a7b1db5f82512a77c669d789c4d8d94060eca2838e3ffa3ec81bbe15421aa6903f5a5f35e23bb83c4fe312c634838ae01afd029f196d0daff7c62aeeaf3ef811	시간은 불안하게 흘러가고 또 다른 저녁이 찾아왔습니다.	train_covost
common_voice_en_18644876.mp3	Let me outline it for you.	a7b1db5f82512a77c669d789c4d8d94060eca2838e3ffa3ec81bbe15421aa6903f5a5f35e23bb83c4fe312c634838ae01afd029f196d0daff7c62aeeaf3ef811	간략하게 설명해 드리겠습니다.	train
common_voice_en_18644877.mp3	I’m going to back you up.	a7b1db5f82512a77c669d789c4d8d94060eca2838e3ffa3ec81bbe15421aa6903f5a5f35e23bb83c4fe312c634838ae01afd029f196d0daff7c62aeeaf3ef811	제가 도와드리겠습니다.	train
common_voice_en_18644888.mp3	Maths skills are particularly useful for machine learning.	a7b1db5f82512a77c669d789c4d8d94060eca2838e3ffa3ec81bbe15421aa6903f5a5f35e23bb83c4fe312c634838ae01afd029f196d0daff7c62aeeaf3ef811	수학 능력은 머신러닝에 특히 유용합니다.	train_covost
common_voice_en_18644889.mp3	Mr. Woodcourt listened with interest and expressed his regret.	a7b1db5f82512a77c669d789c4d8d94060eca2838e3ffa3ec81bbe15421aa6903f5a5f35e23bb83c4fe312c634838ae01afd029f196d0daff7c62aeeaf3ef811	우드코트 씨는 흥미롭게 경청하며 유감을 표했습니다.	train_covost
common_voice_en_18644890.mp3	The director was an ignominious person.	a7b1db5f82512a77c669d789c4d8d94060eca2838e3ffa3ec81bbe15421aa6903f5a5f35e23bb83c4fe312c634838ae01afd029f196d0daff7c62aeeaf3ef811	감독은 불명예스러운 사람이었습니다.	train_covost
common_voice_en_18644891.mp3	"It's not on the checklist so we will not do that today."	a7b1db5f82512a77c669d789c4d8d94060eca2838e3ffa3ec81bbe15421aa6903f5a5f35e23bb83c4fe312c634838ae01afd029f196d0daff7c62aeeaf3ef811	체크리스트에 없으므로 오늘은 이 작업을 수행하지 않겠습니다.	train_covost
common_voice_en_18644892.mp3	She was awakened some time the next day by the door opening.	a7b1db5f82512a77c669d789c4d8d94060eca2838e3ffa3ec81bbe15421aa6903f5a5f35e23bb83c4fe312c634838ae01afd029f196d0daff7c62aeeaf3ef811	다음 날 문이 열리는 소리에 잠에서 깨어났습니다.	train_covost
common_voice_en_18644893.mp3	A whisky and soda, eh?	a7b1db5f82512a77c669d789c4d8d94060eca2838e3ffa3ec81bbe15421aa6903f5a5f35e23bb83c4fe312c634838ae01afd029f196d0daff7c62aeeaf3ef811	위스키와 탄산음료?	train
common_voice_en_18644894.mp3	"After a silence he is asked, ""In which room?"""	a7b1db5f82512a77c669d789c4d8d94060eca2838e3ffa3ec81bbe15421aa6903f5a5f35e23bb83c4fe312c634838ae01afd029f196d0daff7c62aeeaf3ef811	침묵이 흐른 후 그는 "어느 방에서?"라고 물었습니다.	train_covost
common_voice_en_18644899.mp3	It is a profound technology revolution.	a7b1db5f82512a77c669d789c4d8d94060eca2838e3ffa3ec81bbe15421aa6903f5a5f35e23bb83c4fe312c634838ae01afd029f196d0daff7c62aeeaf3ef811	이는 엄청난 기술 혁명입니다.	train
common_voice_en_18644900.mp3	How would you rate the comprehensiveness of this report?	a7b1db5f82512a77c669d789c4d8d94060eca2838e3ffa3ec81bbe15421aa6903f5a5f35e23bb83c4fe312c634838ae01afd029f196d0daff7c62aeeaf3ef811	이 보고서의 포괄성에 대해 어떻게 평가하시나요?	train
common_voice_en_18644901.mp3	It was a morbid movie.	a7b1db5f82512a77c669d789c4d8d94060eca2838e3ffa3ec81bbe15421aa6903f5a5f35e23bb83c4fe312c634838ae01afd029f196d0daff7c62aeeaf3ef811	병적인 영화였습니다.	train_covost
common_voice_en_18644902.mp3	Pray excuse the introduction of such mean topics.	a7b1db5f82512a77c669d789c4d8d94060eca2838e3ffa3ec81bbe15421aa6903f5a5f35e23bb83c4fe312c634838ae01afd029f196d0daff7c62aeeaf3ef811	이런 비열한 주제를 소개하게 된 것을 용서해 주세요.	train
common_voice_en_18644903.mp3	The footsteps stopped, a light shone for a moment outside.	a7b1db5f82512a77c669d789c4d8d94060eca2838e3ffa3ec81bbe15421aa6903f5a5f35e23bb83c4fe312c634838ae01afd029f196d0daff7c62aeeaf3ef811	발걸음이 멈추고 밖에서 잠시 불빛이 비쳤습니다.	train_covost
common_voice_en_18644904.mp3	That is what you have to remember.	a7b1db5f82512a77c669d789c4d8d94060eca2838e3ffa3ec81bbe15421aa6903f5a5f35e23bb83c4fe312c634838ae01afd029f196d0daff7c62aeeaf3ef811	이것이 바로 여러분이 기억해야 할 사항입니다.	train_covost
common_voice_en_18644905.mp3	I’m a great hand at inventing things.	a7b1db5f82512a77c669d789c4d8d94060eca2838e3ffa3ec81bbe15421aa6903f5a5f35e23bb83c4fe312c634838ae01afd029f196d0daff7c62aeeaf3ef811	저는 무언가를 발명하는 데 능숙합니다.	train_covost
common_voice_en_18644906.mp3	Suddenly my prisoner broke from me and flung himself on the wall.	a7b1db5f82512a77c669d789c4d8d94060eca2838e3ffa3ec81bbe15421aa6903f5a5f35e23bb83c4fe312c634838ae01afd029f196d0daff7c62aeeaf3ef811	갑자기 제 죄수가 제게서 도망쳐 벽에 몸을 던졌습니다.	train_covost
common_voice_en_18644907.mp3	They have gone.	a7b1db5f82512a77c669d789c4d8d94060eca2838e3ffa3ec81bbe15421aa6903f5a5f35e23bb83c4fe312c634838ae01afd029f196d0daff7c62aeeaf3ef811	그들은 떠났습니다.	train_covost
common_voice_en_18644909.mp3	It was there-and-then that I caught it.	a7b1db5f82512a77c669d789c4d8d94060eca2838e3ffa3ec81bbe15421aa6903f5a5f35e23bb83c4fe312c634838ae01afd029f196d0daff7c62aeeaf3ef811	거기서 바로 잡았습니다.	train_covost
common_voice_en_18644910.mp3	The conversation completely went over my head.	a7b1db5f82512a77c669d789c4d8d94060eca2838e3ffa3ec81bbe15421aa6903f5a5f35e23bb83c4fe312c634838ae01afd029f196d0daff7c62aeeaf3ef811	대화는 완전히 제 머리 위로 넘어갔습니다.	train_covost
common_voice_en_18644911.mp3	The defragmentation process is twenty-two percent complete.	a7b1db5f82512a77c669d789c4d8d94060eca2838e3ffa3ec81bbe15421aa6903f5a5f35e23bb83c4fe312c634838ae01afd029f196d0daff7c62aeeaf3ef811	조각 모음 프로세스가 22% 완료되었습니다.	train_covost
common_voice_en_18644912.mp3	He always played the tune.	a7b1db5f82512a77c669d789c4d8d94060eca2838e3ffa3ec81bbe15421aa6903f5a5f35e23bb83c4fe312c634838ae01afd029f196d0daff7c62aeeaf3ef811	그는 항상 곡을 연주했습니다.	train_covost
common_voice_en_18644913.mp3	The estimates were reasonable.	a7b1db5f82512a77c669d789c4d8d94060eca2838e3ffa3ec81bbe15421aa6903f5a5f35e23bb83c4fe312c634838ae01afd029f196d0daff7c62aeeaf3ef811	추정치는 합리적이었습니다.	train_covost
common_voice_en_18644915.mp3	‘Fifteenth,’ said the March Hare.	a7b1db5f82512a77c669d789c4d8d94060eca2838e3ffa3ec81bbe15421aa6903f5a5f35e23bb83c4fe312c634838ae01afd029f196d0daff7c62aeeaf3ef811	'열다섯 번째'라고 행진 토끼가 말했습니다.	train_covost
common_voice_en_18644916.mp3	I snapped the switch, but there was nobody there.	a7b1db5f82512a77c669d789c4d8d94060eca2838e3ffa3ec81bbe15421aa6903f5a5f35e23bb83c4fe312c634838ae01afd029f196d0daff7c62aeeaf3ef811	스위치를 눌렀지만 아무도 없었습니다.	train_covost
common_voice_en_18644917.mp3	"I'm sorry, Bertie, I didn't hear."	a7b1db5f82512a77c669d789c4d8d94060eca2838e3ffa3ec81bbe15421aa6903f5a5f35e23bb83c4fe312c634838ae01afd029f196d0daff7c62aeeaf3ef811	미안해요, 버티, 못 들었어요.	train_covost
common_voice_en_18644918.mp3	Jo follows her a pace or two into a quiet court.	a7b1db5f82512a77c669d789c4d8d94060eca2838e3ffa3ec81bbe15421aa6903f5a5f35e23bb83c4fe312c634838ae01afd029f196d0daff7c62aeeaf3ef811	조는 그녀를 따라 조용한 코트 안으로 한두 걸음 들어갔습니다.	train_covost
common_voice_en_18644919.mp3	I was going to remonstrate.	a7b1db5f82512a77c669d789c4d8d94060eca2838e3ffa3ec81bbe15421aa6903f5a5f35e23bb83c4fe312c634838ae01afd029f196d0daff7c62aeeaf3ef811	저는 항의하려고 했어요.	train_covost
common_voice_en_18644922.mp3	Additionally you will need to spend one hour per day revising these topics.	a7b1db5f82512a77c669d789c4d8d94060eca2838e3ffa3ec81bbe15421aa6903f5a5f35e23bb83c4fe312c634838ae01afd029f196d0daff7c62aeeaf3ef811	또한 이러한 주제를 수정하는 데 하루에 한 시간씩 투자해야 합니다.	train
common_voice_en_18649583.mp3	"A brickmaker's wife, Charley?"	a7b1db5f82512a77c669d789c4d8d94060eca2838e3ffa3ec81bbe15421aa6903f5a5f35e23bb83c4fe312c634838ae01afd029f196d0daff7c62aeeaf3ef811	벽돌공의 아내, 찰리?	train_covost
common_voice_en_18649584.mp3	Please try again.	a7b1db5f82512a77c669d789c4d8d94060eca2838e3ffa3ec81bbe15421aa6903f5a5f35e23bb83c4fe312c634838ae01afd029f196d0daff7c62aeeaf3ef811	다시 시도해 주세요.	train
common_voice_en_18649585.mp3	What had first directed his thoughts to that seemingly heart-broken man?	a7b1db5f82512a77c669d789c4d8d94060eca2838e3ffa3ec81bbe15421aa6903f5a5f35e23bb83c4fe312c634838ae01afd029f196d0daff7c62aeeaf3ef811	무엇이 그 상심해 보이는 남자에게 처음 그의 생각을 이끌었을까요?	train
common_voice_en_18649587.mp3	Not at the house of one of your friends?	a7b1db5f82512a77c669d789c4d8d94060eca2838e3ffa3ec81bbe15421aa6903f5a5f35e23bb83c4fe312c634838ae01afd029f196d0daff7c62aeeaf3ef811	친구의 집에 있지 않나요?	train
common_voice_en_18649588.mp3	But only the echo came back from the rock.	a7b1db5f82512a77c669d789c4d8d94060eca2838e3ffa3ec81bbe15421aa6903f5a5f35e23bb83c4fe312c634838ae01afd029f196d0daff7c62aeeaf3ef811	하지만 바위에서 울려 퍼진 메아리만 돌아왔습니다.	train
common_voice_en_18649589.mp3	So I was right, you see!	a7b1db5f82512a77c669d789c4d8d94060eca2838e3ffa3ec81bbe15421aa6903f5a5f35e23bb83c4fe312c634838ae01afd029f196d0daff7c62aeeaf3ef811	제 말이 맞았군요!	train
common_voice_en_18649590.mp3	I hoped they were going to take up my tracks there.	a7b1db5f82512a77c669d789c4d8d94060eca2838e3ffa3ec81bbe15421aa6903f5a5f35e23bb83c4fe312c634838ae01afd029f196d0daff7c62aeeaf3ef811	거기서 제 트랙을 가져가길 바랐어요.	train
common_voice_en_18649591.mp3	You have been an age.	a7b1db5f82512a77c669d789c4d8d94060eca2838e3ffa3ec81bbe15421aa6903f5a5f35e23bb83c4fe312c634838ae01afd029f196d0daff7c62aeeaf3ef811	나이가 들었습니다.	train_covost
common_voice_en_18649592.mp3	And even now, with this case, I hesitate.	a7b1db5f82512a77c669d789c4d8d94060eca2838e3ffa3ec81bbe15421aa6903f5a5f35e23bb83c4fe312c634838ae01afd029f196d0daff7c62aeeaf3ef811	그리고 지금도 이 사건은 망설여집니다.	train_covost
common_voice_en_18649598.mp3	But of course Monsieur will require your presence.	a7b1db5f82512a77c669d789c4d8d94060eca2838e3ffa3ec81bbe15421aa6903f5a5f35e23bb83c4fe312c634838ae01afd029f196d0daff7c62aeeaf3ef811	하지만 물론 무슈는 여러분의 참석을 요구할 것입니다.	train
common_voice_en_18649600.mp3	And I meant it to sting.	a7b1db5f82512a77c669d789c4d8d94060eca2838e3ffa3ec81bbe15421aa6903f5a5f35e23bb83c4fe312c634838ae01afd029f196d0daff7c62aeeaf3ef811	그리고 제가 의도한 것은 따끔거림이었습니다.	train_covost
common_voice_en_18649602.mp3	“All right,” I said.	a7b1db5f82512a77c669d789c4d8d94060eca2838e3ffa3ec81bbe15421aa6903f5a5f35e23bb83c4fe312c634838ae01afd029f196d0daff7c62aeeaf3ef811	"알았어요." 제가 말했습니다.	train
common_voice_en_18649608.mp3	She assembled the flat-pack desk all by herself.	a7b1db5f82512a77c669d789c4d8d94060eca2838e3ffa3ec81bbe15421aa6903f5a5f35e23bb83c4fe312c634838ae01afd029f196d0daff7c62aeeaf3ef811	그녀는 혼자서 플랫팩 책상을 조립했습니다.	train
common_voice_en_18649609.mp3	Considering one perspective creates a limited view of the world.	a7b1db5f82512a77c669d789c4d8d94060eca2838e3ffa3ec81bbe15421aa6903f5a5f35e23bb83c4fe312c634838ae01afd029f196d0daff7c62aeeaf3ef811	한 가지 관점만 고려하면 세상을 보는 시각이 제한됩니다.	train_covost
common_voice_en_18649610.mp3	Since the car is gone, as you say, that is so.	a7b1db5f82512a77c669d789c4d8d94060eca2838e3ffa3ec81bbe15421aa6903f5a5f35e23bb83c4fe312c634838ae01afd029f196d0daff7c62aeeaf3ef811	말씀하신 대로 차가 사라졌으니 그렇죠.	train_covost
common_voice_en_18649611.mp3	Once Ricardo lifted himself up with the hair stirring on his scalp.	a7b1db5f82512a77c669d789c4d8d94060eca2838e3ffa3ec81bbe15421aa6903f5a5f35e23bb83c4fe312c634838ae01afd029f196d0daff7c62aeeaf3ef811	리카르도가 두피의 머리카락을 휘저으며 몸을 일으켜 세웠습니다.	train
common_voice_en_18649612.mp3	The tap was leaking.	a7b1db5f82512a77c669d789c4d8d94060eca2838e3ffa3ec81bbe15421aa6903f5a5f35e23bb83c4fe312c634838ae01afd029f196d0daff7c62aeeaf3ef811	수돗물이 새고 있었습니다.	train
common_voice_en_18649613.mp3	Harry sprang up from his chair in desperation.	a7b1db5f82512a77c669d789c4d8d94060eca2838e3ffa3ec81bbe15421aa6903f5a5f35e23bb83c4fe312c634838ae01afd029f196d0daff7c62aeeaf3ef811	해리는 절박한 심정으로 의자에서 벌떡 일어났습니다.	train_covost
common_voice_en_18649614.mp3	But then I often think I know you as you really are.	a7b1db5f82512a77c669d789c4d8d94060eca2838e3ffa3ec81bbe15421aa6903f5a5f35e23bb83c4fe312c634838ae01afd029f196d0daff7c62aeeaf3ef811	하지만 저는 종종 여러분을 있는 그대로 알고 있다고 생각합니다.	train
common_voice_en_18649615.mp3	He always touched his hat when she came out of the house.	a7b1db5f82512a77c669d789c4d8d94060eca2838e3ffa3ec81bbe15421aa6903f5a5f35e23bb83c4fe312c634838ae01afd029f196d0daff7c62aeeaf3ef811	그는 집에서 나올 때면 항상 모자를 만졌습니다.	train_covost
common_voice_en_18649616.mp3	I only tell you what I know.	a7b1db5f82512a77c669d789c4d8d94060eca2838e3ffa3ec81bbe15421aa6903f5a5f35e23bb83c4fe312c634838ae01afd029f196d0daff7c62aeeaf3ef811	제가 아는 것만 말씀드리겠습니다.	train_covost
common_voice_en_18649617.mp3	The greatest minds in machine learning still take inspiration from the human brain.	a7b1db5f82512a77c669d789c4d8d94060eca2838e3ffa3ec81bbe15421aa6903f5a5f35e23bb83c4fe312c634838ae01afd029f196d0daff7c62aeeaf3ef811	머신러닝 분야의 최고 인재들은 여전히 인간의 두뇌에서 영감을 얻습니다.	train_covost
common_voice_en_18649623.mp3	I am consistent on punctuality.	a7b1db5f82512a77c669d789c4d8d94060eca2838e3ffa3ec81bbe15421aa6903f5a5f35e23bb83c4fe312c634838ae01afd029f196d0daff7c62aeeaf3ef811	저는 시간 엄수를 철저히 지킵니다.	train_covost
common_voice_en_18649624.mp3	We all strive to seek fulfilment in our lives.	a7b1db5f82512a77c669d789c4d8d94060eca2838e3ffa3ec81bbe15421aa6903f5a5f35e23bb83c4fe312c634838ae01afd029f196d0daff7c62aeeaf3ef811	우리 모두는 삶에서 성취감을 추구하기 위해 노력합니다.	train_covost
common_voice_en_18649625.mp3	‘Look, look!’ she cried, pointing eagerly.	a7b1db5f82512a77c669d789c4d8d94060eca2838e3ffa3ec81bbe15421aa6903f5a5f35e23bb83c4fe312c634838ae01afd029f196d0daff7c62aeeaf3ef811	"봐요, 봐요!" 그녀는 열심히 가리키며 울부짖었습니다.	train_covost
common_voice_en_18649626.mp3	And now, Bertie, like a good chap, shove off.	a7b1db5f82512a77c669d789c4d8d94060eca2838e3ffa3ec81bbe15421aa6903f5a5f35e23bb83c4fe312c634838ae01afd029f196d0daff7c62aeeaf3ef811	이제 버티는 착한 녀석답게 씩씩하게 출발합니다.	train_covost
common_voice_en_18649627.mp3	I graduated with a second upper-class honours degree.	a7b1db5f82512a77c669d789c4d8d94060eca2838e3ffa3ec81bbe15421aa6903f5a5f35e23bb83c4fe312c634838ae01afd029f196d0daff7c62aeeaf3ef811	저는 두 번째 우등 학위를 받았습니다.	train_covost
common_voice_en_18649628.mp3	I plan on becoming a lecturer next year.	a7b1db5f82512a77c669d789c4d8d94060eca2838e3ffa3ec81bbe15421aa6903f5a5f35e23bb83c4fe312c634838ae01afd029f196d0daff7c62aeeaf3ef811	내년에 강사가 될 계획입니다.	train
common_voice_en_18649631.mp3	What will satisfy you for the trouble of producing it?	a7b1db5f82512a77c669d789c4d8d94060eca2838e3ffa3ec81bbe15421aa6903f5a5f35e23bb83c4fe312c634838ae01afd029f196d0daff7c62aeeaf3ef811	제작하는 수고에 대한 보상은 무엇일까요?	train
common_voice_en_18649632.mp3	Brazilian footballers have the best flair.	a7b1db5f82512a77c669d789c4d8d94060eca2838e3ffa3ec81bbe15421aa6903f5a5f35e23bb83c4fe312c634838ae01afd029f196d0daff7c62aeeaf3ef811	브라질 축구 선수들은 최고의 재능을 가지고 있습니다.	train
