path	sentence	client_id	translation	split
common_voice_en_19698473.mp3	The Neartown Little League, located in Neartown, holds its games at Chew Park.	35aa3e4a48d0c1e276ab79524ebb784038b4fc999535bdf12eb004adc75cba62bb516c75760e47594e6f3bb0753a1fadb4e0ee71ab29836a4281c53ff23ae402	네어타운에 위치한 네어타운 리틀리그는 츄 파크에서 경기를 개최합니다.	train
common_voice_en_19698474.mp3	He was also banished from the state under threat of death.	35aa3e4a48d0c1e276ab79524ebb784038b4fc999535bdf12eb004adc75cba62bb516c75760e47594e6f3bb0753a1fadb4e0ee71ab29836a4281c53ff23ae402	그는 또한 살해 위협을 받고 주에서 추방당했습니다.	train
common_voice_en_19698475.mp3	He broke twenty-three records after breaking the one-minute backstroke mark.	35aa3e4a48d0c1e276ab79524ebb784038b4fc999535bdf12eb004adc75cba62bb516c75760e47594e6f3bb0753a1fadb4e0ee71ab29836a4281c53ff23ae402	배영 1분 기록을 경신한 후 23개의 기록을 경신했습니다.	train
common_voice_en_19698476.mp3	The city can also be reached by air taxis and private plane.	35aa3e4a48d0c1e276ab79524ebb784038b4fc999535bdf12eb004adc75cba62bb516c75760e47594e6f3bb0753a1fadb4e0ee71ab29836a4281c53ff23ae402	에어 택시와 개인 비행기로도 이동하실 수 있습니다.	train
common_voice_en_19698477.mp3	He was born at Ratton Park, Sussex, and educated at Haileybury College.	35aa3e4a48d0c1e276ab79524ebb784038b4fc999535bdf12eb004adc75cba62bb516c75760e47594e6f3bb0753a1fadb4e0ee71ab29836a4281c53ff23ae402	서섹스의 래튼 파크에서 태어나 헤일리베리 대학에서 교육을 받았습니다.	train
common_voice_en_19698478.mp3	Nevertheless, the battle continued and Sergeant Chapman was killed along with several enemy fighters.	35aa3e4a48d0c1e276ab79524ebb784038b4fc999535bdf12eb004adc75cba62bb516c75760e47594e6f3bb0753a1fadb4e0ee71ab29836a4281c53ff23ae402	그럼에도 불구하고 전투는 계속되었고 채프먼 병장은 여러 명의 적 전사들과 함께 전사했습니다.	train
common_voice_en_19698479.mp3	Sleeper also worked in mercantile industries.	35aa3e4a48d0c1e276ab79524ebb784038b4fc999535bdf12eb004adc75cba62bb516c75760e47594e6f3bb0753a1fadb4e0ee71ab29836a4281c53ff23ae402	슬리퍼는 상공업 분야에서도 일했습니다.	train
common_voice_en_19698495.mp3	Council meetings are attended regularly by civil society organizations.	35aa3e4a48d0c1e276ab79524ebb784038b4fc999535bdf12eb004adc75cba62bb516c75760e47594e6f3bb0753a1fadb4e0ee71ab29836a4281c53ff23ae402	위원회 회의에는 시민 사회 단체가 정기적으로 참석합니다.	train
common_voice_en_19698496.mp3	The city is served by a number of parks, most notably Candy Cane Park.	35aa3e4a48d0c1e276ab79524ebb784038b4fc999535bdf12eb004adc75cba62bb516c75760e47594e6f3bb0753a1fadb4e0ee71ab29836a4281c53ff23ae402	이 도시에는 여러 공원이 있으며, 그중에서도 캔디 케인 공원이 가장 유명합니다.	train
common_voice_en_19698497.mp3	Peacocks are abundant in the region and Viralimalai forms a sanctuary for the birds.	35aa3e4a48d0c1e276ab79524ebb784038b4fc999535bdf12eb004adc75cba62bb516c75760e47594e6f3bb0753a1fadb4e0ee71ab29836a4281c53ff23ae402	이 지역에는 공작새가 풍부하고 비랄리말라이가 새들의 안식처를 형성하고 있습니다.	train
common_voice_en_19698498.mp3	Bapende dancers often wear traditional costumes comprising colorful masks and attire made from raffia.	35aa3e4a48d0c1e276ab79524ebb784038b4fc999535bdf12eb004adc75cba62bb516c75760e47594e6f3bb0753a1fadb4e0ee71ab29836a4281c53ff23ae402	바펜데 무용수들은 화려한 가면과 라피아로 만든 복장으로 구성된 전통 의상을 자주 입습니다.	train
common_voice_en_19698499.mp3	His daughter Henriette Dessaulles became a noted writer and journalist.	35aa3e4a48d0c1e276ab79524ebb784038b4fc999535bdf12eb004adc75cba62bb516c75760e47594e6f3bb0753a1fadb4e0ee71ab29836a4281c53ff23ae402	그의 딸 앙리에트 데사울레는 저명한 작가이자 저널리스트가 되었습니다.	train_covost
common_voice_en_19698545.mp3	"I'm the one in the middle."	35aa3e4a48d0c1e276ab79524ebb784038b4fc999535bdf12eb004adc75cba62bb516c75760e47594e6f3bb0753a1fadb4e0ee71ab29836a4281c53ff23ae402	저는 중간에 있는 사람입니다.	train
common_voice_en_19698546.mp3	Hunza was an independent principality for centuries.	35aa3e4a48d0c1e276ab79524ebb784038b4fc999535bdf12eb004adc75cba62bb516c75760e47594e6f3bb0753a1fadb4e0ee71ab29836a4281c53ff23ae402	훈자는 수세기 동안 독립된 공국이었습니다.	train
common_voice_en_19698547.mp3	The Anglican Parish Church of Wylam, Northumberland, England is dedicated to Saint Oswin.	35aa3e4a48d0c1e276ab79524ebb784038b4fc999535bdf12eb004adc75cba62bb516c75760e47594e6f3bb0753a1fadb4e0ee71ab29836a4281c53ff23ae402	영국 노섬벌랜드의 와일럼 성공회 교구 교회는 세인트 오스윈을 기리는 곳입니다.	train
common_voice_en_19698548.mp3	The town has a well-preserved medieval centre, retaining the ancient street plan.	35aa3e4a48d0c1e276ab79524ebb784038b4fc999535bdf12eb004adc75cba62bb516c75760e47594e6f3bb0753a1fadb4e0ee71ab29836a4281c53ff23ae402	이 마을에는 고대 거리 계획이 잘 보존된 중세 중심지가 있습니다.	train
common_voice_en_19698549.mp3	"The term ""seaplane"" is used by some instead of ""floatplane""."	35aa3e4a48d0c1e276ab79524ebb784038b4fc999535bdf12eb004adc75cba62bb516c75760e47594e6f3bb0753a1fadb4e0ee71ab29836a4281c53ff23ae402	일부에서는 '수상 비행기' 대신 '수상 비행기'라는 용어를 사용합니다.	train
common_voice_en_19698550.mp3	When they arrived at Fanahammeren, the cross was easy to carry.	35aa3e4a48d0c1e276ab79524ebb784038b4fc999535bdf12eb004adc75cba62bb516c75760e47594e6f3bb0753a1fadb4e0ee71ab29836a4281c53ff23ae402	파나하메렌에 도착했을 때 십자가는 쉽게 운반할 수 있었습니다.	train
common_voice_en_19698551.mp3	The service was one of the first charter flights in the United Kingdom.	35aa3e4a48d0c1e276ab79524ebb784038b4fc999535bdf12eb004adc75cba62bb516c75760e47594e6f3bb0753a1fadb4e0ee71ab29836a4281c53ff23ae402	이 서비스는 영국 최초의 전세 항공편 중 하나였습니다.	train
common_voice_en_19698552.mp3	They are also used in the definition of an enriched category.	35aa3e4a48d0c1e276ab79524ebb784038b4fc999535bdf12eb004adc75cba62bb516c75760e47594e6f3bb0753a1fadb4e0ee71ab29836a4281c53ff23ae402	또한 강화된 카테고리의 정의에도 사용됩니다.	train
common_voice_en_19698553.mp3	They performed on Saxhorns from the company of Adolph Sax.	35aa3e4a48d0c1e276ab79524ebb784038b4fc999535bdf12eb004adc75cba62bb516c75760e47594e6f3bb0753a1fadb4e0ee71ab29836a4281c53ff23ae402	그들은 아돌프 색스의 색소폰으로 연주했습니다.	train
common_voice_en_19698554.mp3	Seely was born and educated in Lincoln.	35aa3e4a48d0c1e276ab79524ebb784038b4fc999535bdf12eb004adc75cba62bb516c75760e47594e6f3bb0753a1fadb4e0ee71ab29836a4281c53ff23ae402	실리는 링컨에서 태어나 교육을 받았습니다.	train
common_voice_en_19698600.mp3	It was formed by the Ontario ice lobe during the Port Huron Stadial.	35aa3e4a48d0c1e276ab79524ebb784038b4fc999535bdf12eb004adc75cba62bb516c75760e47594e6f3bb0753a1fadb4e0ee71ab29836a4281c53ff23ae402	포트 휴런 스타디얼 기간 동안 온타리오 빙엽에 의해 형성되었습니다.	train
common_voice_en_19698601.mp3	There is a distinct originality in her new expedient for keeping the secret.	35aa3e4a48d0c1e276ab79524ebb784038b4fc999535bdf12eb004adc75cba62bb516c75760e47594e6f3bb0753a1fadb4e0ee71ab29836a4281c53ff23ae402	비밀을 지키기 위한 그녀의 새로운 방법에는 독특한 독창성이 있습니다.	train
common_voice_en_19698602.mp3	The quorum for Privy Council meetings is four.	35aa3e4a48d0c1e276ab79524ebb784038b4fc999535bdf12eb004adc75cba62bb516c75760e47594e6f3bb0753a1fadb4e0ee71ab29836a4281c53ff23ae402	비공개 위원회 회의의 정족수는 4명입니다.	train
common_voice_en_19698603.mp3	They do not give the right to jointly adopt children.	35aa3e4a48d0c1e276ab79524ebb784038b4fc999535bdf12eb004adc75cba62bb516c75760e47594e6f3bb0753a1fadb4e0ee71ab29836a4281c53ff23ae402	자녀를 공동으로 입양할 수 있는 권리를 부여하지 않습니다.	train
common_voice_en_19698605.mp3	It was a royal city of Poland.	35aa3e4a48d0c1e276ab79524ebb784038b4fc999535bdf12eb004adc75cba62bb516c75760e47594e6f3bb0753a1fadb4e0ee71ab29836a4281c53ff23ae402	폴란드의 왕실 도시였습니다.	train
common_voice_en_19698625.mp3	Residual methanol is typically recovered by distillation and reused.	35aa3e4a48d0c1e276ab79524ebb784038b4fc999535bdf12eb004adc75cba62bb516c75760e47594e6f3bb0753a1fadb4e0ee71ab29836a4281c53ff23ae402	잔여 메탄올은 일반적으로 증류를 통해 회수하여 재사용합니다.	train
common_voice_en_19698626.mp3	It also gives advice on training and rider assessments.	35aa3e4a48d0c1e276ab79524ebb784038b4fc999535bdf12eb004adc75cba62bb516c75760e47594e6f3bb0753a1fadb4e0ee71ab29836a4281c53ff23ae402	또한 훈련 및 라이더 평가에 대한 조언도 제공합니다.	train
common_voice_en_19698628.mp3	Seven feet from your head, up a tree.	35aa3e4a48d0c1e276ab79524ebb784038b4fc999535bdf12eb004adc75cba62bb516c75760e47594e6f3bb0753a1fadb4e0ee71ab29836a4281c53ff23ae402	머리에서 7피트 높이의 나무 위.	train
common_voice_en_19698629.mp3	He is interred in the Hillside Memorial Park Cemetery in Culver City, California.	35aa3e4a48d0c1e276ab79524ebb784038b4fc999535bdf12eb004adc75cba62bb516c75760e47594e6f3bb0753a1fadb4e0ee71ab29836a4281c53ff23ae402	그는 캘리포니아 컬버 시티의 힐사이드 메모리얼 파크 묘지에 안장되어 있습니다.	train
common_voice_en_19698635.mp3	The Bay Area has three major airports with airline service.	35aa3e4a48d0c1e276ab79524ebb784038b4fc999535bdf12eb004adc75cba62bb516c75760e47594e6f3bb0753a1fadb4e0ee71ab29836a4281c53ff23ae402	베이 지역에는 항공 서비스를 제공하는 세 개의 주요 공항이 있습니다.	train
common_voice_en_19698636.mp3	Blakley produced records for other acts, including the Rubettes, Bilbo Baggins and Mungo Jerry.	35aa3e4a48d0c1e276ab79524ebb784038b4fc999535bdf12eb004adc75cba62bb516c75760e47594e6f3bb0753a1fadb4e0ee71ab29836a4281c53ff23ae402	블레이클리는 루베츠, 빌보 배긴스, 문고 제리 등 다른 공연의 음반을 제작했습니다.	train
common_voice_en_19698637.mp3	The primary proved to be one of the closest watched of the cycle.	35aa3e4a48d0c1e276ab79524ebb784038b4fc999535bdf12eb004adc75cba62bb516c75760e47594e6f3bb0753a1fadb4e0ee71ab29836a4281c53ff23ae402	이번 1차 투표는 이번 주기 중 가장 많은 사람들이 지켜본 투표 중 하나였습니다.	train
common_voice_en_19698640.mp3	He appeared as a member of the jazz combo the Classical Jazz Quartet.	35aa3e4a48d0c1e276ab79524ebb784038b4fc999535bdf12eb004adc75cba62bb516c75760e47594e6f3bb0753a1fadb4e0ee71ab29836a4281c53ff23ae402	그는 재즈 콤비인 클래식 재즈 콰르텟의 멤버로 출연했습니다.	train
common_voice_en_19698665.mp3	The North Caspian depression is part of the continental or semi-arid desert biome.	35aa3e4a48d0c1e276ab79524ebb784038b4fc999535bdf12eb004adc75cba62bb516c75760e47594e6f3bb0753a1fadb4e0ee71ab29836a4281c53ff23ae402	북카스피해 함몰 지대는 대륙 또는 반건조 사막 생물 군계의 일부입니다.	train
common_voice_en_19698666.mp3	South Bank station is served by Beenleigh, Cleveland and Gold Coast line services.	35aa3e4a48d0c1e276ab79524ebb784038b4fc999535bdf12eb004adc75cba62bb516c75760e47594e6f3bb0753a1fadb4e0ee71ab29836a4281c53ff23ae402	사우스 뱅크 역은 빈레이, 클리블랜드, 골드코스트 노선이 운행하는 역입니다.	train
common_voice_en_19698667.mp3	He graduated from high school at Yuraikuei High School.	35aa3e4a48d0c1e276ab79524ebb784038b4fc999535bdf12eb004adc75cba62bb516c75760e47594e6f3bb0753a1fadb4e0ee71ab29836a4281c53ff23ae402	그는 유라이쿠에이 고등학교를 졸업했습니다.	train
common_voice_en_19698668.mp3	"In Israel, she is known as ""queen of the Israeli cinema and theatre""."	35aa3e4a48d0c1e276ab79524ebb784038b4fc999535bdf12eb004adc75cba62bb516c75760e47594e6f3bb0753a1fadb4e0ee71ab29836a4281c53ff23ae402	이스라엘에서는 '이스라엘 영화와 연극의 여왕'으로 알려져 있습니다.	train
common_voice_en_19698669.mp3	This was reflected at the population of Malinska, which decreased by one third.	35aa3e4a48d0c1e276ab79524ebb784038b4fc999535bdf12eb004adc75cba62bb516c75760e47594e6f3bb0753a1fadb4e0ee71ab29836a4281c53ff23ae402	이는 말린스카의 인구가 3분의 1로 감소한 데에도 반영되었습니다.	train
common_voice_en_19698709.mp3	In that year, the band recorded their first song in the kote kalandadze studio.	35aa3e4a48d0c1e276ab79524ebb784038b4fc999535bdf12eb004adc75cba62bb516c75760e47594e6f3bb0753a1fadb4e0ee71ab29836a4281c53ff23ae402	그해에 밴드는 코테 칼란다제 스튜디오에서 첫 곡을 녹음했습니다.	train
common_voice_en_19698710.mp3	Females have paired oviducts.	35aa3e4a48d0c1e276ab79524ebb784038b4fc999535bdf12eb004adc75cba62bb516c75760e47594e6f3bb0753a1fadb4e0ee71ab29836a4281c53ff23ae402	암컷은 한 쌍의 난관을 가지고 있습니다.	train
common_voice_en_19698712.mp3	"The name Gotham comes from the Old English for ""goat home""."	35aa3e4a48d0c1e276ab79524ebb784038b4fc999535bdf12eb004adc75cba62bb516c75760e47594e6f3bb0753a1fadb4e0ee71ab29836a4281c53ff23ae402	고담이라는 이름은 "염소 집"이라는 뜻의 고대 영어에서 유래했습니다.	train
common_voice_en_19698713.mp3	At that time, Hereti became part of the principality of Kakheti.	35aa3e4a48d0c1e276ab79524ebb784038b4fc999535bdf12eb004adc75cba62bb516c75760e47594e6f3bb0753a1fadb4e0ee71ab29836a4281c53ff23ae402	그 당시 헤레티는 카케티 공국의 일부가 되었습니다.	train
common_voice_en_19698714.mp3	"The deed could not be located after the death of Carver's London widow."	35aa3e4a48d0c1e276ab79524ebb784038b4fc999535bdf12eb004adc75cba62bb516c75760e47594e6f3bb0753a1fadb4e0ee71ab29836a4281c53ff23ae402	카버의 런던 미망인이 사망한 후에는 증서를 찾을 수 없었습니다.	train
common_voice_en_19725750.mp3	"This has been referred to as an ""iceberg phenomenon""."	3c1898a1da75b527a778bc6cd314d434b70e03531e5fe820f3295c2ba00c19d1589d4f8c1449c869753e07c3eaee9796a0e591aad8e4eba3ec50ed5cec5022f5	이를 '빙산 현상'이라고 합니다.	train
common_voice_en_19725751.mp3	However, plans were altered and the Dutchman was shelved.	3c1898a1da75b527a778bc6cd314d434b70e03531e5fe820f3295c2ba00c19d1589d4f8c1449c869753e07c3eaee9796a0e591aad8e4eba3ec50ed5cec5022f5	그러나 계획이 변경되어 더치맨은 보류되었습니다.	train
common_voice_en_19725752.mp3	Southern Arizona has been inhabited by human beings for several millennia.	3c1898a1da75b527a778bc6cd314d434b70e03531e5fe820f3295c2ba00c19d1589d4f8c1449c869753e07c3eaee9796a0e591aad8e4eba3ec50ed5cec5022f5	남부 애리조나에는 수천 년 동안 인류가 거주해 왔습니다.	train
common_voice_en_19725753.mp3	“Come on,” she coaxed.	3c1898a1da75b527a778bc6cd314d434b70e03531e5fe820f3295c2ba00c19d1589d4f8c1449c869753e07c3eaee9796a0e591aad8e4eba3ec50ed5cec5022f5	"어서요." 그녀가 달랬습니다.	train
common_voice_en_19725754.mp3	An excellent pure passer, he had to forego spring football practice to play baseball.	3c1898a1da75b527a778bc6cd314d434b70e03531e5fe820f3295c2ba00c19d1589d4f8c1449c869753e07c3eaee9796a0e591aad8e4eba3ec50ed5cec5022f5	뛰어난 순수 패스 능력을 지닌 그는 야구를 하기 위해 봄 축구 연습을 포기해야 했습니다.	train
common_voice_en_19725785.mp3	Other cameras produce parallel stereoimages, where left and right are not swapped.	3c1898a1da75b527a778bc6cd314d434b70e03531e5fe820f3295c2ba00c19d1589d4f8c1449c869753e07c3eaee9796a0e591aad8e4eba3ec50ed5cec5022f5	다른 카메라는 왼쪽과 오른쪽이 바뀌지 않는 병렬 스테레오 이미지를 생성합니다.	train
common_voice_en_19725786.mp3	YouGov specialises in market research through online methods.	3c1898a1da75b527a778bc6cd314d434b70e03531e5fe820f3295c2ba00c19d1589d4f8c1449c869753e07c3eaee9796a0e591aad8e4eba3ec50ed5cec5022f5	YouGov는 온라인을 통한 시장 조사를 전문으로 합니다.	train
common_voice_en_19725787.mp3	The station became financially self-supporting and began providing surplus funds to the city government.	3c1898a1da75b527a778bc6cd314d434b70e03531e5fe820f3295c2ba00c19d1589d4f8c1449c869753e07c3eaee9796a0e591aad8e4eba3ec50ed5cec5022f5	방송국은 재정적으로 자립할 수 있게 되었고 시 정부에 잉여금을 제공하기 시작했습니다.	train
common_voice_en_19725788.mp3	"But I think he would've finished us."	3c1898a1da75b527a778bc6cd314d434b70e03531e5fe820f3295c2ba00c19d1589d4f8c1449c869753e07c3eaee9796a0e591aad8e4eba3ec50ed5cec5022f5	하지만 그는 우리를 끝냈을 것 같아요.	train
common_voice_en_19725789.mp3	The men were separated from the women and children for interrogation.	3c1898a1da75b527a778bc6cd314d434b70e03531e5fe820f3295c2ba00c19d1589d4f8c1449c869753e07c3eaee9796a0e591aad8e4eba3ec50ed5cec5022f5	남성들은 심문을 위해 여성과 어린이들과 분리되었습니다.	train
common_voice_en_19725805.mp3	He vowed not to remarry, believing in only one living wife.	3c1898a1da75b527a778bc6cd314d434b70e03531e5fe820f3295c2ba00c19d1589d4f8c1449c869753e07c3eaee9796a0e591aad8e4eba3ec50ed5cec5022f5	그는 살아있는 아내 한 명만 믿고 재혼하지 않겠다고 맹세했습니다.	train
common_voice_en_19725806.mp3	It has two county seats - Fort Madison and Keokuk.	3c1898a1da75b527a778bc6cd314d434b70e03531e5fe820f3295c2ba00c19d1589d4f8c1449c869753e07c3eaee9796a0e591aad8e4eba3ec50ed5cec5022f5	포트 매디슨과 케오쿡이라는 두 개의 카운티 의석이 있습니다.	train
common_voice_en_19725807.mp3	This is a part of ongoing research to achieve self-dependency in defense area.	3c1898a1da75b527a778bc6cd314d434b70e03531e5fe820f3295c2ba00c19d1589d4f8c1449c869753e07c3eaee9796a0e591aad8e4eba3ec50ed5cec5022f5	이는 국방 분야에서 자립을 달성하기 위한 지속적인 연구의 일환입니다.	train
common_voice_en_19725808.mp3	"The cover image is a cropped ""Troubled Waters"" by seminal American photographer William Eggleston."	3c1898a1da75b527a778bc6cd314d434b70e03531e5fe820f3295c2ba00c19d1589d4f8c1449c869753e07c3eaee9796a0e591aad8e4eba3ec50ed5cec5022f5	표지 이미지는 미국의 저명한 사진작가 윌리엄 에글스턴의 '트러블 워터스'를 크롭한 사진입니다.	train
common_voice_en_19725809.mp3	Yet another informant could not tell them apart.	3c1898a1da75b527a778bc6cd314d434b70e03531e5fe820f3295c2ba00c19d1589d4f8c1449c869753e07c3eaee9796a0e591aad8e4eba3ec50ed5cec5022f5	하지만 또 다른 제보자는 이 둘을 구분할 수 없었습니다.	train
common_voice_en_19725825.mp3	John F. Ross is well known for its excellent and diverse academic programs.	3c1898a1da75b527a778bc6cd314d434b70e03531e5fe820f3295c2ba00c19d1589d4f8c1449c869753e07c3eaee9796a0e591aad8e4eba3ec50ed5cec5022f5	존 에프 로스는 우수하고 다양한 학술 프로그램으로 잘 알려져 있습니다.	train
common_voice_en_19725826.mp3	Those designed for grass pitches have studs on the outsole to aid grip.	3c1898a1da75b527a778bc6cd314d434b70e03531e5fe820f3295c2ba00c19d1589d4f8c1449c869753e07c3eaee9796a0e591aad8e4eba3ec50ed5cec5022f5	잔디 구장용으로 설계된 제품은 밑창에 스터드가 있어 접지력을 높여줍니다.	train
common_voice_en_19725827.mp3	That is interactive.	3c1898a1da75b527a778bc6cd314d434b70e03531e5fe820f3295c2ba00c19d1589d4f8c1449c869753e07c3eaee9796a0e591aad8e4eba3ec50ed5cec5022f5	대화형입니다.	train
common_voice_en_19725828.mp3	The county commission elects a chair who presides at meetings.	3c1898a1da75b527a778bc6cd314d434b70e03531e5fe820f3295c2ba00c19d1589d4f8c1449c869753e07c3eaee9796a0e591aad8e4eba3ec50ed5cec5022f5	카운티 위원회에서 회의를 주재하는 의장을 선출합니다.	train
common_voice_en_19725829.mp3	"""Are we on ""Cops"" again?"	3c1898a1da75b527a778bc6cd314d434b70e03531e5fe820f3295c2ba00c19d1589d4f8c1449c869753e07c3eaee9796a0e591aad8e4eba3ec50ed5cec5022f5	우리 또 '경찰'에 나온 건가요?	train
common_voice_en_19725840.mp3	Several editions survived.	3c1898a1da75b527a778bc6cd314d434b70e03531e5fe820f3295c2ba00c19d1589d4f8c1449c869753e07c3eaee9796a0e591aad8e4eba3ec50ed5cec5022f5	여러 에디션이 살아남았습니다.	train
common_voice_en_19725841.mp3	The town is also famous for its Pennsylvania German-style pottery, also sometimes called redware.	3c1898a1da75b527a778bc6cd314d434b70e03531e5fe820f3295c2ba00c19d1589d4f8c1449c869753e07c3eaee9796a0e591aad8e4eba3ec50ed5cec5022f5	이 마을은 레드웨어라고도 불리는 펜실베니아 독일식 도자기로도 유명합니다.	train
common_voice_en_19725843.mp3	His parents were Presbyterians but he early turned towards the Scottish Episcopal Church.	3c1898a1da75b527a778bc6cd314d434b70e03531e5fe820f3295c2ba00c19d1589d4f8c1449c869753e07c3eaee9796a0e591aad8e4eba3ec50ed5cec5022f5	그의 부모님은 장로교 신자였지만 그는 일찍이 스코틀랜드 성공회로 개종했습니다.	train
common_voice_en_19725844.mp3	Some major streets generally follow the ridgelines, including Simpsons Road and Macgregor Terrace.	3c1898a1da75b527a778bc6cd314d434b70e03531e5fe820f3295c2ba00c19d1589d4f8c1449c869753e07c3eaee9796a0e591aad8e4eba3ec50ed5cec5022f5	심슨 로드와 맥그레거 테라스 등 일부 주요 도로는 일반적으로 능선을 따라 이어집니다.	train
common_voice_en_19725855.mp3	Montclair High School also has both a string orchestra and a winds band.	3c1898a1da75b527a778bc6cd314d434b70e03531e5fe820f3295c2ba00c19d1589d4f8c1449c869753e07c3eaee9796a0e591aad8e4eba3ec50ed5cec5022f5	몽클레어 고등학교에는 현악 오케스트라와 관악단도 있습니다.	train
common_voice_en_19725856.mp3	Boston was named after Boston, Massachusetts.	3c1898a1da75b527a778bc6cd314d434b70e03531e5fe820f3295c2ba00c19d1589d4f8c1449c869753e07c3eaee9796a0e591aad8e4eba3ec50ed5cec5022f5	보스턴은 매사추세츠주 보스턴의 이름을 따서 명명되었습니다.	train
common_voice_en_19725857.mp3	"Rinaldi writes of Edmonds's life and how she became to be Franklin Thompson."	3c1898a1da75b527a778bc6cd314d434b70e03531e5fe820f3295c2ba00c19d1589d4f8c1449c869753e07c3eaee9796a0e591aad8e4eba3ec50ed5cec5022f5	리날디는 에드먼즈의 삶과 그녀가 어떻게 프랭클린 톰슨이 되었는지에 대해 글을 씁니다.	train
common_voice_en_19725859.mp3	"The reality is that it worked, we've protected jobs, and we got more jobs."	3c1898a1da75b527a778bc6cd314d434b70e03531e5fe820f3295c2ba00c19d1589d4f8c1449c869753e07c3eaee9796a0e591aad8e4eba3ec50ed5cec5022f5	현실은 그것이 효과가 있었고, 일자리를 보호했으며, 더 많은 일자리를 확보했다는 것입니다.	train
common_voice_en_19725885.mp3	Most Bengali people joined here as carpenters.	3c1898a1da75b527a778bc6cd314d434b70e03531e5fe820f3295c2ba00c19d1589d4f8c1449c869753e07c3eaee9796a0e591aad8e4eba3ec50ed5cec5022f5	대부분의 벵골 사람들은 이곳에서 목수로 일하고 있습니다.	train
common_voice_en_19725886.mp3	The island is approximately rectangular; it is long and wide.	3c1898a1da75b527a778bc6cd314d434b70e03531e5fe820f3295c2ba00c19d1589d4f8c1449c869753e07c3eaee9796a0e591aad8e4eba3ec50ed5cec5022f5	섬은 대략 직사각형이며 길고 넓습니다.	train
common_voice_en_19725888.mp3	Mailing lists were similarly problematic.	3c1898a1da75b527a778bc6cd314d434b70e03531e5fe820f3295c2ba00c19d1589d4f8c1449c869753e07c3eaee9796a0e591aad8e4eba3ec50ed5cec5022f5	메일링 리스트도 마찬가지로 문제가 있었습니다.	train
common_voice_en_19725889.mp3	The other winner was Sohn Kee-chung.	3c1898a1da75b527a778bc6cd314d434b70e03531e5fe820f3295c2ba00c19d1589d4f8c1449c869753e07c3eaee9796a0e591aad8e4eba3ec50ed5cec5022f5	다른 우승자는 손기정 씨였습니다.	train
common_voice_en_19725900.mp3	Another theory about is origin negates the Latin origin and proposes a Basque origin.	3c1898a1da75b527a778bc6cd314d434b70e03531e5fe820f3295c2ba00c19d1589d4f8c1449c869753e07c3eaee9796a0e591aad8e4eba3ec50ed5cec5022f5	기원에 대한 또 다른 이론은 라틴어 기원을 부정하고 바스크어 기원을 제안합니다.	train
common_voice_en_19725901.mp3	He has been reported as laughing during some of his jumps.	3c1898a1da75b527a778bc6cd314d434b70e03531e5fe820f3295c2ba00c19d1589d4f8c1449c869753e07c3eaee9796a0e591aad8e4eba3ec50ed5cec5022f5	그는 점프하는 동안 웃는다는 보고를 받기도 했습니다.	train
common_voice_en_19725902.mp3	Businesses take action on climate change for several reasons.	3c1898a1da75b527a778bc6cd314d434b70e03531e5fe820f3295c2ba00c19d1589d4f8c1449c869753e07c3eaee9796a0e591aad8e4eba3ec50ed5cec5022f5	기업이 기후 변화에 대응하는 데는 여러 가지 이유가 있습니다.	train
common_voice_en_19725950.mp3	"During the shoot he met his future wife, Rebecca Miller, the author's daughter."	3c1898a1da75b527a778bc6cd314d434b70e03531e5fe820f3295c2ba00c19d1589d4f8c1449c869753e07c3eaee9796a0e591aad8e4eba3ec50ed5cec5022f5	촬영 중에 그는 작가의 딸인 미래의 아내 레베카 밀러를 만났습니다.	train
common_voice_en_19725951.mp3	However, it is still not obvious what the exact molecular mechanism is.	3c1898a1da75b527a778bc6cd314d434b70e03531e5fe820f3295c2ba00c19d1589d4f8c1449c869753e07c3eaee9796a0e591aad8e4eba3ec50ed5cec5022f5	그러나 정확한 분자 메커니즘이 무엇인지는 아직 명확하지 않습니다.	train
