path	sentence	client_id	translation	split
common_voice_en_18278175.mp3	Chips, cheese and peas.	4be3a4362b3810aaad9d36d2f1600ba4f98bbc227e2d0d005b96f68b31ebcb06886e90a42e576fb1ea04165a99aa541cbcb5eca5006d00ab28511b952c9816f2	칩, 치즈, 완두콩.	train_covost
common_voice_en_18278185.mp3	She feigned offense at every opportunity.	4be3a4362b3810aaad9d36d2f1600ba4f98bbc227e2d0d005b96f68b31ebcb06886e90a42e576fb1ea04165a99aa541cbcb5eca5006d00ab28511b952c9816f2	그녀는 기회가 있을 때마다 불쾌한 척했습니다.	train_covost
common_voice_en_18278186.mp3	Why do I feel light-headed?	4be3a4362b3810aaad9d36d2f1600ba4f98bbc227e2d0d005b96f68b31ebcb06886e90a42e576fb1ea04165a99aa541cbcb5eca5006d00ab28511b952c9816f2	어지러운 이유는 무엇인가요?	train_covost
common_voice_en_18278188.mp3	We could be liable.	4be3a4362b3810aaad9d36d2f1600ba4f98bbc227e2d0d005b96f68b31ebcb06886e90a42e576fb1ea04165a99aa541cbcb5eca5006d00ab28511b952c9816f2	당사는 책임을 질 수 있습니다.	train
common_voice_en_18278196.mp3	"I'll just apply that to your order."	4be3a4362b3810aaad9d36d2f1600ba4f98bbc227e2d0d005b96f68b31ebcb06886e90a42e576fb1ea04165a99aa541cbcb5eca5006d00ab28511b952c9816f2	주문에 적용하겠습니다.	train_covost
common_voice_en_18278228.mp3	Oh No! I dropped my wallet!	4be3a4362b3810aaad9d36d2f1600ba4f98bbc227e2d0d005b96f68b31ebcb06886e90a42e576fb1ea04165a99aa541cbcb5eca5006d00ab28511b952c9816f2	안 돼! 지갑을 떨어뜨렸어요!	train_covost
common_voice_en_18607244.mp3	"I'm here for the placement interview."	4be3a4362b3810aaad9d36d2f1600ba4f98bbc227e2d0d005b96f68b31ebcb06886e90a42e576fb1ea04165a99aa541cbcb5eca5006d00ab28511b952c9816f2	배치 면접을 보러 왔습니다.	train
common_voice_en_18607245.mp3	Certainly she dwelt in Bohemia.	4be3a4362b3810aaad9d36d2f1600ba4f98bbc227e2d0d005b96f68b31ebcb06886e90a42e576fb1ea04165a99aa541cbcb5eca5006d00ab28511b952c9816f2	확실히 그녀는 보헤미아에 살았습니다.	train_covost
common_voice_en_18607246.mp3	Mr. Bucket has his hand on the bell-rope.	4be3a4362b3810aaad9d36d2f1600ba4f98bbc227e2d0d005b96f68b31ebcb06886e90a42e576fb1ea04165a99aa541cbcb5eca5006d00ab28511b952c9816f2	버킷 씨가 줄넘기에 손을 올리고 있습니다.	train_covost
common_voice_en_18607247.mp3	This will plug the leak.	4be3a4362b3810aaad9d36d2f1600ba4f98bbc227e2d0d005b96f68b31ebcb06886e90a42e576fb1ea04165a99aa541cbcb5eca5006d00ab28511b952c9816f2	이렇게 하면 누수가 차단됩니다.	train
common_voice_en_18607248.mp3	Those deep black eyes!	4be3a4362b3810aaad9d36d2f1600ba4f98bbc227e2d0d005b96f68b31ebcb06886e90a42e576fb1ea04165a99aa541cbcb5eca5006d00ab28511b952c9816f2	그 짙은 검은 눈동자!	train_covost
common_voice_en_19612304.mp3	“I’ve given him his dinner,” replied Mrs. Bower.	4d419a91b7de9354aea1f17096a0d71997051cd993e360efe75bb57f18776186c8f8532f87fd0f12d88ed70f49651475498dcf9dc5f6ca93e514e7472014afb0	"저녁을 드렸어요." 바우어 부인이 대답했습니다.	train
common_voice_en_19612305.mp3	They remain an iconic and ubiquitous fashion sneaker.	4d419a91b7de9354aea1f17096a0d71997051cd993e360efe75bb57f18776186c8f8532f87fd0f12d88ed70f49651475498dcf9dc5f6ca93e514e7472014afb0	여전히 상징적이고 어디에나 있는 패션 스니커즈입니다.	train
common_voice_en_19612306.mp3	This kind of sample is known as a bootstrap sample.	4d419a91b7de9354aea1f17096a0d71997051cd993e360efe75bb57f18776186c8f8532f87fd0f12d88ed70f49651475498dcf9dc5f6ca93e514e7472014afb0	이러한 종류의 샘플을 부트스트랩 샘플이라고 합니다.	train
common_voice_en_19612307.mp3	"""Bodhi"" means ""awakening"" or ""enlightenment""."	4d419a91b7de9354aea1f17096a0d71997051cd993e360efe75bb57f18776186c8f8532f87fd0f12d88ed70f49651475498dcf9dc5f6ca93e514e7472014afb0	'보디'는 '각성' 또는 '깨달음'을 의미합니다.	train
common_voice_en_19612308.mp3	He passed the audition and subsequently worked in Cyprus, Aden, Libya and Malta.	4d419a91b7de9354aea1f17096a0d71997051cd993e360efe75bb57f18776186c8f8532f87fd0f12d88ed70f49651475498dcf9dc5f6ca93e514e7472014afb0	오디션에 합격한 그는 이후 키프로스, 아덴, 리비아, 몰타에서 근무했습니다.	train
common_voice_en_19612314.mp3	Galamian taught concurrently at Curtis, Juilliard, and Meadowmount schools.	4d419a91b7de9354aea1f17096a0d71997051cd993e360efe75bb57f18776186c8f8532f87fd0f12d88ed70f49651475498dcf9dc5f6ca93e514e7472014afb0	갈라미안은 커티스, 줄리어드, 메도우마운트 학교에서 겸임으로 가르쳤습니다.	train
common_voice_en_19612315.mp3	"Then Chamberlain's and Gregory's men crossed White Oak Road."	4d419a91b7de9354aea1f17096a0d71997051cd993e360efe75bb57f18776186c8f8532f87fd0f12d88ed70f49651475498dcf9dc5f6ca93e514e7472014afb0	그리고 체임벌린과 그레고리의 부하들이 화이트 오크 로드를 건넜습니다.	train
common_voice_en_19612317.mp3	The cemetery is managed by Tewkesbury Borough Council.	4d419a91b7de9354aea1f17096a0d71997051cd993e360efe75bb57f18776186c8f8532f87fd0f12d88ed70f49651475498dcf9dc5f6ca93e514e7472014afb0	이 공동묘지는 트크스베리 자치구 의회에서 관리합니다.	train
common_voice_en_19612318.mp3	"Cairasco is a misparsed counting song, ""besmia mat acosomuset tamobenir marago""."	4d419a91b7de9354aea1f17096a0d71997051cd993e360efe75bb57f18776186c8f8532f87fd0f12d88ed70f49651475498dcf9dc5f6ca93e514e7472014afb0	카이라스코는 "베스미아 매트 아코소무셋 타모베니르 마라고"라는 잘못 표기된 계산 노래입니다.	train
common_voice_en_19612331.mp3	It takes many years of full-time saw filing to become proficient in the trade.	4d419a91b7de9354aea1f17096a0d71997051cd993e360efe75bb57f18776186c8f8532f87fd0f12d88ed70f49651475498dcf9dc5f6ca93e514e7472014afb0	톱질에 능숙해지려면 수년 동안 풀타임으로 톱질을 해야 합니다.	train
common_voice_en_19612334.mp3	The leader of the wolves.	4d419a91b7de9354aea1f17096a0d71997051cd993e360efe75bb57f18776186c8f8532f87fd0f12d88ed70f49651475498dcf9dc5f6ca93e514e7472014afb0	늑대들의 리더.	train
common_voice_en_19612335.mp3	"""Scouting Antiano"" primarily follows the Dutch system of Scouting."	4d419a91b7de9354aea1f17096a0d71997051cd993e360efe75bb57f18776186c8f8532f87fd0f12d88ed70f49651475498dcf9dc5f6ca93e514e7472014afb0	"스카우트 안티아노"는 주로 네덜란드의 스카우트 시스템을 따릅니다."	train
common_voice_en_19612337.mp3	"The Woolworth's logo appeared on the label of the discs."	4d419a91b7de9354aea1f17096a0d71997051cd993e360efe75bb57f18776186c8f8532f87fd0f12d88ed70f49651475498dcf9dc5f6ca93e514e7472014afb0	울워스의 로고가 디스크 라벨에 표시되어 있습니다.	train
common_voice_en_19874038.mp3	Cosala is a picturesque colonial town surrounded by myriad of natural attractions.	4d68710d1e395a46e28f3839038c9f02b36eb8cb5b0e1d34c605d802d6c9940739517b4e4ad935c1c1b14567653ff308b2f531dbadb569c5e4deb657b5fd5547	코살라는 수많은 자연 명소로 둘러싸인 그림 같은 식민지 시대 마을입니다.	train
common_voice_en_19874040.mp3	The necklaces are passed down through generations and are highly treasured by their owners.	4d68710d1e395a46e28f3839038c9f02b36eb8cb5b0e1d34c605d802d6c9940739517b4e4ad935c1c1b14567653ff308b2f531dbadb569c5e4deb657b5fd5547	이 목걸이는 여러 세대에 걸쳐 전해져 내려오며 소유자가 매우 소중하게 여깁니다.	train
common_voice_en_19874042.mp3	Ocean Township is accessible by several major roads.	4d68710d1e395a46e28f3839038c9f02b36eb8cb5b0e1d34c605d802d6c9940739517b4e4ad935c1c1b14567653ff308b2f531dbadb569c5e4deb657b5fd5547	오션 타운십은 여러 주요 도로를 통해 접근이 가능합니다.	train
common_voice_en_19874058.mp3	In many cases, a male could have a female name and vice versa.	4d68710d1e395a46e28f3839038c9f02b36eb8cb5b0e1d34c605d802d6c9940739517b4e4ad935c1c1b14567653ff308b2f531dbadb569c5e4deb657b5fd5547	많은 경우 남성이 여성 이름을 가질 수 있고 그 반대의 경우도 마찬가지입니다.	train
common_voice_en_19874059.mp3	Sometimes referred to as an angle brace.	4d68710d1e395a46e28f3839038c9f02b36eb8cb5b0e1d34c605d802d6c9940739517b4e4ad935c1c1b14567653ff308b2f531dbadb569c5e4deb657b5fd5547	앵글 브레이스라고도 합니다.	train
common_voice_en_19874060.mp3	"The circular pool has a copy of Giambologna's Mercury."	4d68710d1e395a46e28f3839038c9f02b36eb8cb5b0e1d34c605d802d6c9940739517b4e4ad935c1c1b14567653ff308b2f531dbadb569c5e4deb657b5fd5547	원형 수영장에는 지암볼로냐의 머큐리 모형이 있습니다.	train
common_voice_en_19874061.mp3	Upon his return, Brown reinstated the police chief.	4d68710d1e395a46e28f3839038c9f02b36eb8cb5b0e1d34c605d802d6c9940739517b4e4ad935c1c1b14567653ff308b2f531dbadb569c5e4deb657b5fd5547	복귀하자마자 브라운은 경찰청장으로 복귀했습니다.	train
common_voice_en_19874149.mp3	"The fifth song on the album is ""Where Did I Go Right?""."	4d68710d1e395a46e28f3839038c9f02b36eb8cb5b0e1d34c605d802d6c9940739517b4e4ad935c1c1b14567653ff308b2f531dbadb569c5e4deb657b5fd5547	앨범의 다섯 번째 곡은 "내가 어디로 갔었나?"입니다.	train
common_voice_en_19874152.mp3	"Lincoln's term as governor is the longest consecutive service in the state's history."	4d68710d1e395a46e28f3839038c9f02b36eb8cb5b0e1d34c605d802d6c9940739517b4e4ad935c1c1b14567653ff308b2f531dbadb569c5e4deb657b5fd5547	링컨의 주지사 재임 기간은 주 역사상 가장 긴 연임 기록입니다.	train
common_voice_en_19874154.mp3	"According to Bob Keeshan, Mr. Green Jeans was an extension of Brannum's real personality."	4d68710d1e395a46e28f3839038c9f02b36eb8cb5b0e1d34c605d802d6c9940739517b4e4ad935c1c1b14567653ff308b2f531dbadb569c5e4deb657b5fd5547	밥 키샨에 따르면, 미스터 그린 진은 브래넘의 실제 성격의 연장선상에 있다고 합니다.	train
common_voice_en_19874155.mp3	Many people emigrated to North and South America at this time.	4d68710d1e395a46e28f3839038c9f02b36eb8cb5b0e1d34c605d802d6c9940739517b4e4ad935c1c1b14567653ff308b2f531dbadb569c5e4deb657b5fd5547	이 시기에 많은 사람들이 북미와 남미로 이민을 떠났습니다.	train
common_voice_en_19874156.mp3	She has since spoken publicly about her regrets over writing that book.	4d68710d1e395a46e28f3839038c9f02b36eb8cb5b0e1d34c605d802d6c9940739517b4e4ad935c1c1b14567653ff308b2f531dbadb569c5e4deb657b5fd5547	이후 그녀는 그 책을 쓴 것에 대해 후회하는 마음을 공개적으로 밝혔습니다.	train
common_voice_en_19874158.mp3	President Ronald Reagan and his wife Nancy greeted the crew upon arrival.	4d68710d1e395a46e28f3839038c9f02b36eb8cb5b0e1d34c605d802d6c9940739517b4e4ad935c1c1b14567653ff308b2f531dbadb569c5e4deb657b5fd5547	로널드 레이건 대통령과 그의 부인 낸시가 도착하자마자 승무원들을 맞이했습니다.	train
common_voice_en_19680031.mp3	This is the first use of a talk box by Pink Floyd.	51442f034f0c2ee99e7c893c9595c931b233a290158d5eccc2b6852444ea6b327fdf7d3e3dd107f4fce090fbb2d89a6959bfb53a4f911bbb74154703b0ea4f73	핑크 플로이드가 토크 박스를 사용한 것은 이번이 처음입니다.	train
common_voice_en_19680032.mp3	For example, in his first album, Freak Out!	51442f034f0c2ee99e7c893c9595c931b233a290158d5eccc2b6852444ea6b327fdf7d3e3dd107f4fce090fbb2d89a6959bfb53a4f911bbb74154703b0ea4f73	예를 들어, 그의 첫 번째 앨범인 Freak Out!	train
common_voice_en_19680033.mp3	Their music combined funk rhythms and dissonant guitar riffs.	51442f034f0c2ee99e7c893c9595c931b233a290158d5eccc2b6852444ea6b327fdf7d3e3dd107f4fce090fbb2d89a6959bfb53a4f911bbb74154703b0ea4f73	이들의 음악은 펑크 리듬과 불협화음 기타 리프가 결합되어 있습니다.	train
common_voice_en_19680084.mp3	"The croaking resembles that of ""H. arborea"", but it is deeper and slower."	51442f034f0c2ee99e7c893c9595c931b233a290158d5eccc2b6852444ea6b327fdf7d3e3dd107f4fce090fbb2d89a6959bfb53a4f911bbb74154703b0ea4f73	삐걱거리는 소리는 "H. arborea"의 소리와 비슷하지만 더 깊고 느립니다.	train
common_voice_en_19680085.mp3	Jazz groups were fascinated and added the boobams to their percussion sections.	51442f034f0c2ee99e7c893c9595c931b233a290158d5eccc2b6852444ea6b327fdf7d3e3dd107f4fce090fbb2d89a6959bfb53a4f911bbb74154703b0ea4f73	재즈 그룹들은 부밤에 매료되어 타악기 섹션에 부밤을 추가했습니다.	train
