path	sentence	client_id	translation	split
common_voice_en_18488959.mp3	Fishing for bass is tough.	5cd95c7c22c6fd21f386f93b700187d1559ab9a63eab1b44b4af4717e61bee61dbf54a0de0d35e3014a441bc557f5a0a4d36ad4e3a815d4bd3c395c9e98daade	배스 낚시는 어렵습니다.	train_covost
common_voice_en_18488960.mp3	I am not angry, only a little hurt.	5cd95c7c22c6fd21f386f93b700187d1559ab9a63eab1b44b4af4717e61bee61dbf54a0de0d35e3014a441bc557f5a0a4d36ad4e3a815d4bd3c395c9e98daade	화난 게 아니라 약간 상처받은 것뿐입니다.	train_covost
common_voice_en_18488962.mp3	Fibre optics enable ultra-fast internet.	5cd95c7c22c6fd21f386f93b700187d1559ab9a63eab1b44b4af4717e61bee61dbf54a0de0d35e3014a441bc557f5a0a4d36ad4e3a815d4bd3c395c9e98daade	광섬유는 초고속 인터넷을 가능하게 합니다.	train_covost
common_voice_en_18488964.mp3	There are several species of horse chestnut tree, all of which bear conkers	5cd95c7c22c6fd21f386f93b700187d1559ab9a63eab1b44b4af4717e61bee61dbf54a0de0d35e3014a441bc557f5a0a4d36ad4e3a815d4bd3c395c9e98daade	마로니에 나무에는 여러 종이 있으며 모두 콘커를 품고 있습니다.	train_covost
common_voice_en_18488968.mp3	Here, let me show you again.	5cd95c7c22c6fd21f386f93b700187d1559ab9a63eab1b44b4af4717e61bee61dbf54a0de0d35e3014a441bc557f5a0a4d36ad4e3a815d4bd3c395c9e98daade	자, 다시 보여드리겠습니다.	train_covost
common_voice_en_18488992.mp3	"Many fans think they're in love, but unfortunately that's not canon."	5cd95c7c22c6fd21f386f93b700187d1559ab9a63eab1b44b4af4717e61bee61dbf54a0de0d35e3014a441bc557f5a0a4d36ad4e3a815d4bd3c395c9e98daade	많은 팬들이 사랑에 빠졌다고 생각하지만 안타깝게도 그것은 정설이 아닙니다.	train_covost
common_voice_en_18488996.mp3	April is tax season in the United States.	5cd95c7c22c6fd21f386f93b700187d1559ab9a63eab1b44b4af4717e61bee61dbf54a0de0d35e3014a441bc557f5a0a4d36ad4e3a815d4bd3c395c9e98daade	4월은 미국에서 세금 신고 시즌입니다.	train_covost
common_voice_en_18488997.mp3	His office was on the top floor of C building.	5cd95c7c22c6fd21f386f93b700187d1559ab9a63eab1b44b4af4717e61bee61dbf54a0de0d35e3014a441bc557f5a0a4d36ad4e3a815d4bd3c395c9e98daade	그의 사무실은 C빌딩 최상층에 있었습니다.	train_covost
common_voice_en_18488998.mp3	You must sleep, he urged.	5cd95c7c22c6fd21f386f93b700187d1559ab9a63eab1b44b4af4717e61bee61dbf54a0de0d35e3014a441bc557f5a0a4d36ad4e3a815d4bd3c395c9e98daade	잠을 자야 한다고 그는 촉구했습니다.	train_covost
common_voice_en_18489024.mp3	The candidate had lied repeatedly in order to get elected	5cd95c7c22c6fd21f386f93b700187d1559ab9a63eab1b44b4af4717e61bee61dbf54a0de0d35e3014a441bc557f5a0a4d36ad4e3a815d4bd3c395c9e98daade	후보자는 당선되기 위해 반복적으로 거짓말을 했습니다.	train_covost
common_voice_en_18489025.mp3	"That's where they cut off the Scottish Chiefs and killed all hands."	5cd95c7c22c6fd21f386f93b700187d1559ab9a63eab1b44b4af4717e61bee61dbf54a0de0d35e3014a441bc557f5a0a4d36ad4e3a815d4bd3c395c9e98daade	그곳에서 스코틀랜드 추장들을 잘라내고 모든 병력을 죽였습니다.	train_covost
common_voice_en_18489026.mp3	There was a longish pause.	5cd95c7c22c6fd21f386f93b700187d1559ab9a63eab1b44b4af4717e61bee61dbf54a0de0d35e3014a441bc557f5a0a4d36ad4e3a815d4bd3c395c9e98daade	잠시 멈칫했습니다.	train_covost
common_voice_en_18489027.mp3	The night was calm and snowy.	5cd95c7c22c6fd21f386f93b700187d1559ab9a63eab1b44b4af4717e61bee61dbf54a0de0d35e3014a441bc557f5a0a4d36ad4e3a815d4bd3c395c9e98daade	밤은 고요하고 눈이 내렸습니다.	train_covost
common_voice_en_18489028.mp3	There was no answer from the other side.	5cd95c7c22c6fd21f386f93b700187d1559ab9a63eab1b44b4af4717e61bee61dbf54a0de0d35e3014a441bc557f5a0a4d36ad4e3a815d4bd3c395c9e98daade	상대방의 답변이 없었습니다.	train_covost
common_voice_en_18489035.mp3	Capillary blood vessel.	5cd95c7c22c6fd21f386f93b700187d1559ab9a63eab1b44b4af4717e61bee61dbf54a0de0d35e3014a441bc557f5a0a4d36ad4e3a815d4bd3c395c9e98daade	모세혈관.	train_covost
common_voice_en_18489036.mp3	I was stuck in traffic all day!	5cd95c7c22c6fd21f386f93b700187d1559ab9a63eab1b44b4af4717e61bee61dbf54a0de0d35e3014a441bc557f5a0a4d36ad4e3a815d4bd3c395c9e98daade	하루 종일 교통 체증에 시달렸어요!	train_covost
common_voice_en_18489037.mp3	I for one have no doubt that it was your quick wits that saw us delivered from that hellish place.	5cd95c7c22c6fd21f386f93b700187d1559ab9a63eab1b44b4af4717e61bee61dbf54a0de0d35e3014a441bc557f5a0a4d36ad4e3a815d4bd3c395c9e98daade	그 지옥 같은 곳에서 우리를 구해준 것은 여러분의 재치 있는 순발력 덕분이라고 믿어 의심치 않습니다.	train_covost
common_voice_en_18489039.mp3	You need to get out of my way! he said aggressively	5cd95c7c22c6fd21f386f93b700187d1559ab9a63eab1b44b4af4717e61bee61dbf54a0de0d35e3014a441bc557f5a0a4d36ad4e3a815d4bd3c395c9e98daade	비켜주세요! 그는 공격적으로 말했습니다.	train_covost
common_voice_en_18489040.mp3	I hope you intend to keep your promise.	5cd95c7c22c6fd21f386f93b700187d1559ab9a63eab1b44b4af4717e61bee61dbf54a0de0d35e3014a441bc557f5a0a4d36ad4e3a815d4bd3c395c9e98daade	약속을 꼭 지키시길 바랍니다.	train_covost
common_voice_en_18489041.mp3	I’m never going to get the hang of this.	5cd95c7c22c6fd21f386f93b700187d1559ab9a63eab1b44b4af4717e61bee61dbf54a0de0d35e3014a441bc557f5a0a4d36ad4e3a815d4bd3c395c9e98daade	도저히 이해가 안 되네요.	train_covost
common_voice_en_18489043.mp3	John Lewis’s television advert for Christmas was extremely popular	5cd95c7c22c6fd21f386f93b700187d1559ab9a63eab1b44b4af4717e61bee61dbf54a0de0d35e3014a441bc557f5a0a4d36ad4e3a815d4bd3c395c9e98daade	존 루이스의 크리스마스 TV 광고가 큰 인기를 끌었습니다.	train_covost
common_voice_en_18489044.mp3	You want to go over and see his gang throw dirt.	5cd95c7c22c6fd21f386f93b700187d1559ab9a63eab1b44b4af4717e61bee61dbf54a0de0d35e3014a441bc557f5a0a4d36ad4e3a815d4bd3c395c9e98daade	가서 그의 갱단이 흙을 던지는 것을 보고 싶어요.	train_covost
common_voice_en_18489045.mp3	One of his ripest.	5cd95c7c22c6fd21f386f93b700187d1559ab9a63eab1b44b4af4717e61bee61dbf54a0de0d35e3014a441bc557f5a0a4d36ad4e3a815d4bd3c395c9e98daade	가장 잘 익은 것 중 하나입니다.	train_covost
common_voice_en_18489047.mp3	The head rather swims.	5cd95c7c22c6fd21f386f93b700187d1559ab9a63eab1b44b4af4717e61bee61dbf54a0de0d35e3014a441bc557f5a0a4d36ad4e3a815d4bd3c395c9e98daade	머리가 오히려 헤엄칩니다.	train_covost
common_voice_en_18489049.mp3	Do you want your boss to like you?	5cd95c7c22c6fd21f386f93b700187d1559ab9a63eab1b44b4af4717e61bee61dbf54a0de0d35e3014a441bc557f5a0a4d36ad4e3a815d4bd3c395c9e98daade	상사에게 호감을 얻고 싶으신가요?	train_covost
common_voice_en_18489050.mp3	My daughter is studying zoology at uni	5cd95c7c22c6fd21f386f93b700187d1559ab9a63eab1b44b4af4717e61bee61dbf54a0de0d35e3014a441bc557f5a0a4d36ad4e3a815d4bd3c395c9e98daade	제 딸은 대학에서 동물학을 공부하고 있습니다.	train_covost
common_voice_en_18489051.mp3	And you have been very kind to me, Jeeves.	5cd95c7c22c6fd21f386f93b700187d1559ab9a63eab1b44b4af4717e61bee61dbf54a0de0d35e3014a441bc557f5a0a4d36ad4e3a815d4bd3c395c9e98daade	그리고 지브스는 저에게 매우 친절하게 대해주셨어요.	train_covost
common_voice_en_18489052.mp3	"The pen's ink leaked into the bag."	5cd95c7c22c6fd21f386f93b700187d1559ab9a63eab1b44b4af4717e61bee61dbf54a0de0d35e3014a441bc557f5a0a4d36ad4e3a815d4bd3c395c9e98daade	펜의 잉크가 가방에 새어 들어갔습니다.	train_covost
common_voice_en_18489054.mp3	Halfway around the track one donkey got into an argument with its rider.	5cd95c7c22c6fd21f386f93b700187d1559ab9a63eab1b44b4af4717e61bee61dbf54a0de0d35e3014a441bc557f5a0a4d36ad4e3a815d4bd3c395c9e98daade	트랙 중간쯤에 당나귀 한 마리가 기수와 말다툼을 벌였습니다.	train_covost
common_voice_en_18489056.mp3	All operations have been carried on from Montreal and Toronto.	5cd95c7c22c6fd21f386f93b700187d1559ab9a63eab1b44b4af4717e61bee61dbf54a0de0d35e3014a441bc557f5a0a4d36ad4e3a815d4bd3c395c9e98daade	모든 운영은 몬트리올과 토론토에서 계속 진행되었습니다.	train_covost
common_voice_en_18489058.mp3	"What's that grub-thief got to do with it."	5cd95c7c22c6fd21f386f93b700187d1559ab9a63eab1b44b4af4717e61bee61dbf54a0de0d35e3014a441bc557f5a0a4d36ad4e3a815d4bd3c395c9e98daade	그 땅벌레 도둑이 무슨 상관이죠?	train_covost
common_voice_en_18489064.mp3	Do you have to pay a monthly fee for your bank’s current account?	5cd95c7c22c6fd21f386f93b700187d1559ab9a63eab1b44b4af4717e61bee61dbf54a0de0d35e3014a441bc557f5a0a4d36ad4e3a815d4bd3c395c9e98daade	은행 당좌 계좌의 월 수수료를 지불해야 하나요?	train_covost
common_voice_en_18489065.mp3	He was cold and distant.	5cd95c7c22c6fd21f386f93b700187d1559ab9a63eab1b44b4af4717e61bee61dbf54a0de0d35e3014a441bc557f5a0a4d36ad4e3a815d4bd3c395c9e98daade	그는 차갑고 멀게 느껴졌습니다.	train_covost
common_voice_en_18489066.mp3	"""I always thought you were such friends,"" said Angela."	5cd95c7c22c6fd21f386f93b700187d1559ab9a63eab1b44b4af4717e61bee61dbf54a0de0d35e3014a441bc557f5a0a4d36ad4e3a815d4bd3c395c9e98daade	"저는 항상 두 분이 정말 친구라고 생각했어요." 안젤라가 말했습니다.	train_covost
common_voice_en_18489067.mp3	Only the chance sound had led him to observe them.	5cd95c7c22c6fd21f386f93b700187d1559ab9a63eab1b44b4af4717e61bee61dbf54a0de0d35e3014a441bc557f5a0a4d36ad4e3a815d4bd3c395c9e98daade	우연한 소리에 이끌린 그는 그들을 관찰하게 되었습니다.	train_covost
common_voice_en_18489070.mp3	You fired me out of your house, in short.	5cd95c7c22c6fd21f386f93b700187d1559ab9a63eab1b44b4af4717e61bee61dbf54a0de0d35e3014a441bc557f5a0a4d36ad4e3a815d4bd3c395c9e98daade	한마디로 저를 집에서 쫓아내신 거죠.	train_covost
common_voice_en_18489071.mp3	Anthony was in class seven Y.	5cd95c7c22c6fd21f386f93b700187d1559ab9a63eab1b44b4af4717e61bee61dbf54a0de0d35e3014a441bc557f5a0a4d36ad4e3a815d4bd3c395c9e98daade	앤서니는 7학년 Y반이었습니다.	train_covost
common_voice_en_19795460.mp3	Yet he is such a man!	5cd95c7c22c6fd21f386f93b700187d1559ab9a63eab1b44b4af4717e61bee61dbf54a0de0d35e3014a441bc557f5a0a4d36ad4e3a815d4bd3c395c9e98daade	하지만 그는 그런 사람입니다!	train
common_voice_en_19795461.mp3	"WakeMed's main campus is located on New Bern Avenue in Raleigh, North Carolina."	5cd95c7c22c6fd21f386f93b700187d1559ab9a63eab1b44b4af4717e61bee61dbf54a0de0d35e3014a441bc557f5a0a4d36ad4e3a815d4bd3c395c9e98daade	WakeMed의 메인 캠퍼스는 노스캐롤라이나주 롤리의 뉴번 애비뉴에 위치해 있습니다.	train
common_voice_en_19795462.mp3	Carl Sandburg followed Austin as Illinois next poet laureate.	5cd95c7c22c6fd21f386f93b700187d1559ab9a63eab1b44b4af4717e61bee61dbf54a0de0d35e3014a441bc557f5a0a4d36ad4e3a815d4bd3c395c9e98daade	칼 샌드버그는 오스틴의 뒤를 이어 일리노이주 차기 시인상 수상자로 선정되었습니다.	train
common_voice_en_197534.mp3	To keep on pitching.	ac6c32f959398d495a2bd3ff3a6d7b3dc0f9700ded23aef5f248bc799b3210e84b90cf8eaca63f0bd7caad7fd8d2f1914223a32a39085381242d0f0b0411ce5d	계속 피칭하기.	train_covost
common_voice_en_197543.mp3	It is always nice to hear that your presence is appreciated.	ac6c32f959398d495a2bd3ff3a6d7b3dc0f9700ded23aef5f248bc799b3210e84b90cf8eaca63f0bd7caad7fd8d2f1914223a32a39085381242d0f0b0411ce5d	여러분의 존재를 인정해 주신다는 소식은 언제나 반갑습니다.	train_covost
common_voice_en_197544.mp3	They play duets together.	ac6c32f959398d495a2bd3ff3a6d7b3dc0f9700ded23aef5f248bc799b3210e84b90cf8eaca63f0bd7caad7fd8d2f1914223a32a39085381242d0f0b0411ce5d	함께 듀엣을 연주합니다.	train_covost
common_voice_en_197546.mp3	The runway seems way to short for this type of plane.	ac6c32f959398d495a2bd3ff3a6d7b3dc0f9700ded23aef5f248bc799b3210e84b90cf8eaca63f0bd7caad7fd8d2f1914223a32a39085381242d0f0b0411ce5d	활주로가 이런 종류의 비행기에 비해 너무 짧아 보입니다.	train_covost
common_voice_en_197550.mp3	Other times I want to do something good for the world.	ac6c32f959398d495a2bd3ff3a6d7b3dc0f9700ded23aef5f248bc799b3210e84b90cf8eaca63f0bd7caad7fd8d2f1914223a32a39085381242d0f0b0411ce5d	때로는 세상을 위해 좋은 일을 하고 싶을 때도 있습니다.	train_covost
common_voice_en_197551.mp3	The conundrum that foiled so many was all but a simple exercise for Dr. Masterson.	ac6c32f959398d495a2bd3ff3a6d7b3dc0f9700ded23aef5f248bc799b3210e84b90cf8eaca63f0bd7caad7fd8d2f1914223a32a39085381242d0f0b0411ce5d	많은 사람을 좌절시킨 이 수수께끼는 매스터슨 박사에게는 간단한 연습 문제일 뿐이었습니다.	train_covost
common_voice_en_197556.mp3	"I'm going to tell her what I think of her!"	ac6c32f959398d495a2bd3ff3a6d7b3dc0f9700ded23aef5f248bc799b3210e84b90cf8eaca63f0bd7caad7fd8d2f1914223a32a39085381242d0f0b0411ce5d	그녀에 대한 제 생각을 말씀드리겠습니다!	train_covost
common_voice_en_197558.mp3	The things that pop up at the last minute!	ac6c32f959398d495a2bd3ff3a6d7b3dc0f9700ded23aef5f248bc799b3210e84b90cf8eaca63f0bd7caad7fd8d2f1914223a32a39085381242d0f0b0411ce5d	마지막 순간에 튀어나오는 것들!	train_covost
common_voice_en_197559.mp3	Join the Club.	ac6c32f959398d495a2bd3ff3a6d7b3dc0f9700ded23aef5f248bc799b3210e84b90cf8eaca63f0bd7caad7fd8d2f1914223a32a39085381242d0f0b0411ce5d	클럽에 가입하세요.	train_covost
common_voice_en_197560.mp3	However, the authors ignore a very large body of work on tone mapping.	ac6c32f959398d495a2bd3ff3a6d7b3dc0f9700ded23aef5f248bc799b3210e84b90cf8eaca63f0bd7caad7fd8d2f1914223a32a39085381242d0f0b0411ce5d	그러나 저자들은 톤 매핑에 대한 방대한 양의 작업을 무시하고 있습니다.	train_covost
common_voice_en_197562.mp3	"You're far too valuable!"	ac6c32f959398d495a2bd3ff3a6d7b3dc0f9700ded23aef5f248bc799b3210e84b90cf8eaca63f0bd7caad7fd8d2f1914223a32a39085381242d0f0b0411ce5d	여러분은 너무 소중합니다!	train_covost
common_voice_en_197564.mp3	In biology we study plants and animals in their natural environment.	ac6c32f959398d495a2bd3ff3a6d7b3dc0f9700ded23aef5f248bc799b3210e84b90cf8eaca63f0bd7caad7fd8d2f1914223a32a39085381242d0f0b0411ce5d	생물학에서는 자연 환경에서 식물과 동물을 연구합니다.	train_covost
common_voice_en_197566.mp3	About how wealthy would you say?	ac6c32f959398d495a2bd3ff3a6d7b3dc0f9700ded23aef5f248bc799b3210e84b90cf8eaca63f0bd7caad7fd8d2f1914223a32a39085381242d0f0b0411ce5d	얼마나 부유하다고 말씀하시겠습니까?	train_covost
common_voice_en_197570.mp3	You two fellas sit in here.	ac6c32f959398d495a2bd3ff3a6d7b3dc0f9700ded23aef5f248bc799b3210e84b90cf8eaca63f0bd7caad7fd8d2f1914223a32a39085381242d0f0b0411ce5d	두 분은 여기 앉으세요.	train_covost
common_voice_en_197576.mp3	We will have to run if we want to catch that bus.	ac6c32f959398d495a2bd3ff3a6d7b3dc0f9700ded23aef5f248bc799b3210e84b90cf8eaca63f0bd7caad7fd8d2f1914223a32a39085381242d0f0b0411ce5d	저 버스를 타려면 달려야 합니다.	train_covost
common_voice_en_197577.mp3	Without a single quiver.	ac6c32f959398d495a2bd3ff3a6d7b3dc0f9700ded23aef5f248bc799b3210e84b90cf8eaca63f0bd7caad7fd8d2f1914223a32a39085381242d0f0b0411ce5d	떨림 없이.	train_covost
common_voice_en_197588.mp3	Yeah, better if people are already familiar with one and are thinking of switching to the other.	ac6c32f959398d495a2bd3ff3a6d7b3dc0f9700ded23aef5f248bc799b3210e84b90cf8eaca63f0bd7caad7fd8d2f1914223a32a39085381242d0f0b0411ce5d	예, 사람들이 이미 한 가지에 익숙하고 다른 것으로 전환을 고려하고 있다면 더 좋습니다.	train_covost
common_voice_en_197595.mp3	We subdivide the domain space using an octree.	ac6c32f959398d495a2bd3ff3a6d7b3dc0f9700ded23aef5f248bc799b3210e84b90cf8eaca63f0bd7caad7fd8d2f1914223a32a39085381242d0f0b0411ce5d	옥트리를 사용하여 도메인 공간을 세분화합니다.	train_covost
common_voice_en_197596.mp3	We ignore the other parents who don’t speak French.	ac6c32f959398d495a2bd3ff3a6d7b3dc0f9700ded23aef5f248bc799b3210e84b90cf8eaca63f0bd7caad7fd8d2f1914223a32a39085381242d0f0b0411ce5d	프랑스어를 못하는 다른 부모는 무시합니다.	train_covost
common_voice_en_197597.mp3	The hierarchy is visualized in the appendix.	ac6c32f959398d495a2bd3ff3a6d7b3dc0f9700ded23aef5f248bc799b3210e84b90cf8eaca63f0bd7caad7fd8d2f1914223a32a39085381242d0f0b0411ce5d	계층 구조는 부록에 시각화되어 있습니다.	train_covost
common_voice_en_197599.mp3	Of course, this is just the beginning.	ac6c32f959398d495a2bd3ff3a6d7b3dc0f9700ded23aef5f248bc799b3210e84b90cf8eaca63f0bd7caad7fd8d2f1914223a32a39085381242d0f0b0411ce5d	물론 이것은 시작에 불과합니다.	train_covost
common_voice_en_197606.mp3	It sounded as if you said no charge.	ac6c32f959398d495a2bd3ff3a6d7b3dc0f9700ded23aef5f248bc799b3210e84b90cf8eaca63f0bd7caad7fd8d2f1914223a32a39085381242d0f0b0411ce5d	마치 무료라고 말한 것처럼 들렸습니다.	train_covost
common_voice_en_197609.mp3	You got fifty cents?	ac6c32f959398d495a2bd3ff3a6d7b3dc0f9700ded23aef5f248bc799b3210e84b90cf8eaca63f0bd7caad7fd8d2f1914223a32a39085381242d0f0b0411ce5d	50센트 있어요?	train_covost
common_voice_en_197612.mp3	"I'm going to build skyscrapers a hundred stories high."	ac6c32f959398d495a2bd3ff3a6d7b3dc0f9700ded23aef5f248bc799b3210e84b90cf8eaca63f0bd7caad7fd8d2f1914223a32a39085381242d0f0b0411ce5d	100층 높이의 고층 빌딩을 지을 거예요.	train_covost
common_voice_en_197614.mp3	The biggest living thing is a mushroom.	ac6c32f959398d495a2bd3ff3a6d7b3dc0f9700ded23aef5f248bc799b3210e84b90cf8eaca63f0bd7caad7fd8d2f1914223a32a39085381242d0f0b0411ce5d	가장 큰 생명체는 버섯입니다.	train_covost
common_voice_en_197615.mp3	"That's what makes it romantic."	ac6c32f959398d495a2bd3ff3a6d7b3dc0f9700ded23aef5f248bc799b3210e84b90cf8eaca63f0bd7caad7fd8d2f1914223a32a39085381242d0f0b0411ce5d	이것이 바로 로맨틱한 이유입니다.	train_covost
common_voice_en_197617.mp3	Chlorophyll is essential for plant energy production.	ac6c32f959398d495a2bd3ff3a6d7b3dc0f9700ded23aef5f248bc799b3210e84b90cf8eaca63f0bd7caad7fd8d2f1914223a32a39085381242d0f0b0411ce5d	엽록소는 식물의 에너지 생산에 필수적인 요소입니다.	train_covost
common_voice_en_197619.mp3	Got to get some practice.	ac6c32f959398d495a2bd3ff3a6d7b3dc0f9700ded23aef5f248bc799b3210e84b90cf8eaca63f0bd7caad7fd8d2f1914223a32a39085381242d0f0b0411ce5d	연습을 좀 해야겠어요.	train_covost
common_voice_en_197624.mp3	On rainy days I will play inside.	ac6c32f959398d495a2bd3ff3a6d7b3dc0f9700ded23aef5f248bc799b3210e84b90cf8eaca63f0bd7caad7fd8d2f1914223a32a39085381242d0f0b0411ce5d	비오는 날에는 실내에서 놀아요.	train_covost
common_voice_en_197626.mp3	If you know of other games that play well with hands-free control, please post in the comments.	ac6c32f959398d495a2bd3ff3a6d7b3dc0f9700ded23aef5f248bc799b3210e84b90cf8eaca63f0bd7caad7fd8d2f1914223a32a39085381242d0f0b0411ce5d	핸즈프리 컨트롤로 잘 플레이되는 다른 게임을 알고 있다면 댓글로 알려주세요.	train_covost
common_voice_en_197630.mp3	I encourage everyone to contribute their voice to Project Common Voice.	ac6c32f959398d495a2bd3ff3a6d7b3dc0f9700ded23aef5f248bc799b3210e84b90cf8eaca63f0bd7caad7fd8d2f1914223a32a39085381242d0f0b0411ce5d	모두가 프로젝트 커먼 보이스에 목소리를 내주실 것을 권장합니다.	train_covost
common_voice_en_197640.mp3	The pixel probabilities are conditioned on the model state.	ac6c32f959398d495a2bd3ff3a6d7b3dc0f9700ded23aef5f248bc799b3210e84b90cf8eaca63f0bd7caad7fd8d2f1914223a32a39085381242d0f0b0411ce5d	픽셀 확률은 모델 상태에 따라 달라집니다.	train_covost
common_voice_en_197645.mp3	You keep out of this.	ac6c32f959398d495a2bd3ff3a6d7b3dc0f9700ded23aef5f248bc799b3210e84b90cf8eaca63f0bd7caad7fd8d2f1914223a32a39085381242d0f0b0411ce5d	이 일에 관여하지 마세요.	train_covost
common_voice_en_197646.mp3	Aldo and his grandma quickly discovered a new passion for coding.	ac6c32f959398d495a2bd3ff3a6d7b3dc0f9700ded23aef5f248bc799b3210e84b90cf8eaca63f0bd7caad7fd8d2f1914223a32a39085381242d0f0b0411ce5d	알도와 할머니는 코딩에 대한 새로운 열정을 금방 발견했습니다.	train_covost
common_voice_en_197648.mp3	"And of course, it's not very customizable."	ac6c32f959398d495a2bd3ff3a6d7b3dc0f9700ded23aef5f248bc799b3210e84b90cf8eaca63f0bd7caad7fd8d2f1914223a32a39085381242d0f0b0411ce5d	물론 사용자 지정할 수 있는 것은 아닙니다.	train_covost
common_voice_en_197649.mp3	"Don't say those things!"	ac6c32f959398d495a2bd3ff3a6d7b3dc0f9700ded23aef5f248bc799b3210e84b90cf8eaca63f0bd7caad7fd8d2f1914223a32a39085381242d0f0b0411ce5d	그런 말 하지 마세요!	train_covost
common_voice_en_197652.mp3	"That's what I mean."	ac6c32f959398d495a2bd3ff3a6d7b3dc0f9700ded23aef5f248bc799b3210e84b90cf8eaca63f0bd7caad7fd8d2f1914223a32a39085381242d0f0b0411ce5d	제 말이 그 말입니다.	train_covost
common_voice_en_197655.mp3	I have never seen this approach to this issue, but it might work.	ac6c32f959398d495a2bd3ff3a6d7b3dc0f9700ded23aef5f248bc799b3210e84b90cf8eaca63f0bd7caad7fd8d2f1914223a32a39085381242d0f0b0411ce5d	이 문제에 대한 이러한 접근 방식은 본 적이 없지만 효과가 있을 수 있습니다.	train_covost
common_voice_en_197661.mp3	A hands-free coding environment has a lot of moving parts, which can be overwhelming at first.	ac6c32f959398d495a2bd3ff3a6d7b3dc0f9700ded23aef5f248bc799b3210e84b90cf8eaca63f0bd7caad7fd8d2f1914223a32a39085381242d0f0b0411ce5d	핸즈프리 코딩 환경에는 움직이는 부분이 많기 때문에 처음에는 부담스러울 수 있습니다.	train_covost
common_voice_en_197664.mp3	The cushion was soft and inviting.	ac6c32f959398d495a2bd3ff3a6d7b3dc0f9700ded23aef5f248bc799b3210e84b90cf8eaca63f0bd7caad7fd8d2f1914223a32a39085381242d0f0b0411ce5d	쿠션이 부드럽고 매력적이었어요.	train_covost
common_voice_en_197667.mp3	"If it's not working, check the messages window to see if there are any error messages."	ac6c32f959398d495a2bd3ff3a6d7b3dc0f9700ded23aef5f248bc799b3210e84b90cf8eaca63f0bd7caad7fd8d2f1914223a32a39085381242d0f0b0411ce5d	작동하지 않는 경우 메시지 창에서 오류 메시지가 있는지 확인하세요.	train_covost
common_voice_en_197675.mp3	They raise their glasses.	ac6c32f959398d495a2bd3ff3a6d7b3dc0f9700ded23aef5f248bc799b3210e84b90cf8eaca63f0bd7caad7fd8d2f1914223a32a39085381242d0f0b0411ce5d	그들은 잔을 들어 올립니다.	train_covost
common_voice_en_197676.mp3	He instead offers an alternate explanation that relates to site scalability issues.	ac6c32f959398d495a2bd3ff3a6d7b3dc0f9700ded23aef5f248bc799b3210e84b90cf8eaca63f0bd7caad7fd8d2f1914223a32a39085381242d0f0b0411ce5d	대신 사이트 확장성 문제와 관련된 다른 설명을 제공합니다.	train_covost
common_voice_en_197677.mp3	The Tropic of Capricorn is on the Southern Hemisphere of the earth.	ac6c32f959398d495a2bd3ff3a6d7b3dc0f9700ded23aef5f248bc799b3210e84b90cf8eaca63f0bd7caad7fd8d2f1914223a32a39085381242d0f0b0411ce5d	염소자리는 지구의 남반구에 있습니다.	train_covost
common_voice_en_197682.mp3	A little college girl from a School of Journalism!	ac6c32f959398d495a2bd3ff3a6d7b3dc0f9700ded23aef5f248bc799b3210e84b90cf8eaca63f0bd7caad7fd8d2f1914223a32a39085381242d0f0b0411ce5d	저널리즘 스쿨에서 온 여대생!	train_covost
common_voice_en_197692.mp3	"I'm your guardian angel."	ac6c32f959398d495a2bd3ff3a6d7b3dc0f9700ded23aef5f248bc799b3210e84b90cf8eaca63f0bd7caad7fd8d2f1914223a32a39085381242d0f0b0411ce5d	저는 여러분의 수호천사입니다.	train_covost
common_voice_en_197695.mp3	The USA and many other countries of the world have their independence day in July.	ac6c32f959398d495a2bd3ff3a6d7b3dc0f9700ded23aef5f248bc799b3210e84b90cf8eaca63f0bd7caad7fd8d2f1914223a32a39085381242d0f0b0411ce5d	미국을 비롯한 세계 여러 나라에서는 7월에 독립기념일을 기념합니다.	train_covost
common_voice_en_197698.mp3	"Some sites have keyboard shortcuts you can bind easily, but others don't."	ac6c32f959398d495a2bd3ff3a6d7b3dc0f9700ded23aef5f248bc799b3210e84b90cf8eaca63f0bd7caad7fd8d2f1914223a32a39085381242d0f0b0411ce5d	일부 사이트에는 쉽게 바인딩할 수 있는 키보드 단축키가 있지만 그렇지 않은 사이트도 있습니다.	train_covost
common_voice_en_197699.mp3	Which one is mine?	ac6c32f959398d495a2bd3ff3a6d7b3dc0f9700ded23aef5f248bc799b3210e84b90cf8eaca63f0bd7caad7fd8d2f1914223a32a39085381242d0f0b0411ce5d	어느 것이 내 것일까요?	train_covost
common_voice_en_197701.mp3	I want to do something big and something important.	ac6c32f959398d495a2bd3ff3a6d7b3dc0f9700ded23aef5f248bc799b3210e84b90cf8eaca63f0bd7caad7fd8d2f1914223a32a39085381242d0f0b0411ce5d	저는 뭔가 크고 중요한 일을 하고 싶어요.	train_covost
common_voice_en_197703.mp3	Can you lend me your bycicle for a while.	ac6c32f959398d495a2bd3ff3a6d7b3dc0f9700ded23aef5f248bc799b3210e84b90cf8eaca63f0bd7caad7fd8d2f1914223a32a39085381242d0f0b0411ce5d	바이시클을 잠시 빌려주실 수 있나요?	train_covost
common_voice_en_197705.mp3	This is a bit trickier because it is awkward to number every column in an editor.	ac6c32f959398d495a2bd3ff3a6d7b3dc0f9700ded23aef5f248bc799b3210e84b90cf8eaca63f0bd7caad7fd8d2f1914223a32a39085381242d0f0b0411ce5d	편집기에서 모든 열에 번호를 매기는 것은 어색하기 때문에 조금 더 까다롭습니다.	train_covost
