path	sentence	client_id	translation	split
common_voice_en_18680693.mp3	"It is also mentioned in Robert Dallek's biography of Kennedy, """"."	4311ac2c9248c11f2c6a52cd2a2b3f7541c3058634ec391e4195c707bcfd2983f577468c8955ca622540e3c13a7a866839a8c84278e97eb2530e789a162231e9	"이는 로버트 달렉의 케네디 전기에도 언급되어 있습니다.".	train
common_voice_en_18680694.mp3	He was fluent in French, German, Spanish, and English and could read Latin.	4311ac2c9248c11f2c6a52cd2a2b3f7541c3058634ec391e4195c707bcfd2983f577468c8955ca622540e3c13a7a866839a8c84278e97eb2530e789a162231e9	그는 프랑스어, 독일어, 스페인어, 영어에 능통했고 라틴어도 읽을 줄 알았습니다.	train
common_voice_en_18680695.mp3	He continued to have difficulty finding publishers and audiences for his work in America.	4311ac2c9248c11f2c6a52cd2a2b3f7541c3058634ec391e4195c707bcfd2983f577468c8955ca622540e3c13a7a866839a8c84278e97eb2530e789a162231e9	그는 미국에서 자신의 작품에 대한 출판사와 관객을 찾는 데 계속 어려움을 겪었습니다.	train
common_voice_en_18680696.mp3	Its crew consists of three people.	4311ac2c9248c11f2c6a52cd2a2b3f7541c3058634ec391e4195c707bcfd2983f577468c8955ca622540e3c13a7a866839a8c84278e97eb2530e789a162231e9	승무원은 세 명으로 구성됩니다.	train
common_voice_en_18680697.mp3	Both have been open-pit mines.	4311ac2c9248c11f2c6a52cd2a2b3f7541c3058634ec391e4195c707bcfd2983f577468c8955ca622540e3c13a7a866839a8c84278e97eb2530e789a162231e9	둘 다 노천 광산입니다.	train
common_voice_en_18680698.mp3	"The owners' investment led to a season equally as dramatic."	4311ac2c9248c11f2c6a52cd2a2b3f7541c3058634ec391e4195c707bcfd2983f577468c8955ca622540e3c13a7a866839a8c84278e97eb2530e789a162231e9	구단주들의 투자는 드라마틱한 시즌으로 이어졌습니다.	train
common_voice_en_18680699.mp3	Alexander Bone, a saxophonist, was the inaugural winner.	4311ac2c9248c11f2c6a52cd2a2b3f7541c3058634ec391e4195c707bcfd2983f577468c8955ca622540e3c13a7a866839a8c84278e97eb2530e789a162231e9	첫 번째 우승자는 색소폰 연주자인 알렉산더 본이 차지했습니다.	train
common_voice_en_18680700.mp3	"He married Louise de Lorraine, known prior to marriage as ""Mademoiselle de Marsan""."	4311ac2c9248c11f2c6a52cd2a2b3f7541c3058634ec391e4195c707bcfd2983f577468c8955ca622540e3c13a7a866839a8c84278e97eb2530e789a162231e9	그는 결혼 전 '마드모아젤 드 마르산'으로 알려진 루이스 드 로레인과 결혼했습니다.	train
common_voice_en_18680701.mp3	Courts are the mere instruments of the law, and can will nothing.	4311ac2c9248c11f2c6a52cd2a2b3f7541c3058634ec391e4195c707bcfd2983f577468c8955ca622540e3c13a7a866839a8c84278e97eb2530e789a162231e9	법원은 단순한 법의 도구일 뿐이며 어떤 것도 강요할 수 없습니다.	train
common_voice_en_18680707.mp3	"""O'Bannon"" fought in many surface actions."	4311ac2c9248c11f2c6a52cd2a2b3f7541c3058634ec391e4195c707bcfd2983f577468c8955ca622540e3c13a7a866839a8c84278e97eb2530e789a162231e9	오배넌'은 많은 표면적 행동에서 싸웠습니다.	train
common_voice_en_18680708.mp3	Also, the Galois module structure of has been determined.	4311ac2c9248c11f2c6a52cd2a2b3f7541c3058634ec391e4195c707bcfd2983f577468c8955ca622540e3c13a7a866839a8c84278e97eb2530e789a162231e9	또한 Galois 모듈 구조가 결정되었습니다.	train
common_voice_en_18680709.mp3	The term comes from the mathematical concept of a singleton.	4311ac2c9248c11f2c6a52cd2a2b3f7541c3058634ec391e4195c707bcfd2983f577468c8955ca622540e3c13a7a866839a8c84278e97eb2530e789a162231e9	이 용어는 싱글톤의 수학적 개념에서 유래했습니다.	train
common_voice_en_18680710.mp3	"Following its introduction in China, the ""Now!"	4311ac2c9248c11f2c6a52cd2a2b3f7541c3058634ec391e4195c707bcfd2983f577468c8955ca622540e3c13a7a866839a8c84278e97eb2530e789a162231e9	중국에 도입된 후 '지금!	train
common_voice_en_18680711.mp3	The stone is made of an irregular slab of slate.	4311ac2c9248c11f2c6a52cd2a2b3f7541c3058634ec391e4195c707bcfd2983f577468c8955ca622540e3c13a7a866839a8c84278e97eb2530e789a162231e9	돌은 불규칙한 슬레이트 슬래브로 만들어져 있습니다.	train
common_voice_en_18680712.mp3	Peter Shinton, who is unaligned with any political party.	4311ac2c9248c11f2c6a52cd2a2b3f7541c3058634ec391e4195c707bcfd2983f577468c8955ca622540e3c13a7a866839a8c84278e97eb2530e789a162231e9	어떤 정당에도 소속되어 있지 않은 피터 신튼.	train
common_voice_en_18680713.mp3	They are also cross-trained to operate various types of weapons and equipment.	4311ac2c9248c11f2c6a52cd2a2b3f7541c3058634ec391e4195c707bcfd2983f577468c8955ca622540e3c13a7a866839a8c84278e97eb2530e789a162231e9	또한 다양한 종류의 무기와 장비를 조작할 수 있도록 교차 훈련을 받습니다.	train
common_voice_en_18680714.mp3	The new theatre proved to be a sensation.	4311ac2c9248c11f2c6a52cd2a2b3f7541c3058634ec391e4195c707bcfd2983f577468c8955ca622540e3c13a7a866839a8c84278e97eb2530e789a162231e9	새로운 극장은 센세이션을 일으켰습니다.	train
common_voice_en_18680715.mp3	Brad was drafted from the North Bay Centennials of the Ontario Hockey League.	4311ac2c9248c11f2c6a52cd2a2b3f7541c3058634ec391e4195c707bcfd2983f577468c8955ca622540e3c13a7a866839a8c84278e97eb2530e789a162231e9	Brad는 온타리오 하키 리그의 노스베이 센테니얼즈에서 드래프트되었습니다.	train
common_voice_en_18680716.mp3	He originally turned it down, saying he was unhappy with the script.	4311ac2c9248c11f2c6a52cd2a2b3f7541c3058634ec391e4195c707bcfd2983f577468c8955ca622540e3c13a7a866839a8c84278e97eb2530e789a162231e9	그는 원래 대본이 마음에 들지 않는다며 거절했습니다.	train
common_voice_en_18680717.mp3	"Weymouth was Frantz's girlfriend and often provided transportation for the band."	4311ac2c9248c11f2c6a52cd2a2b3f7541c3058634ec391e4195c707bcfd2983f577468c8955ca622540e3c13a7a866839a8c84278e97eb2530e789a162231e9	웨이머스는 프랜츠의 여자 친구로 종종 밴드의 교통편을 제공하기도 했습니다.	train
common_voice_en_18680718.mp3	The film features a more traditional Godzilla like kaiju called Raiga.	4311ac2c9248c11f2c6a52cd2a2b3f7541c3058634ec391e4195c707bcfd2983f577468c8955ca622540e3c13a7a866839a8c84278e97eb2530e789a162231e9	이 영화에는 라이가라는 전통적인 고질라 같은 카이주가 등장합니다.	train
common_voice_en_18680719.mp3	"The ""thureos"" was probably originally an adapted form of a Celtic shield."	4311ac2c9248c11f2c6a52cd2a2b3f7541c3058634ec391e4195c707bcfd2983f577468c8955ca622540e3c13a7a866839a8c84278e97eb2530e789a162231e9	'투레오스'는 원래 켈트족의 방패를 변형한 형태였을 가능성이 높습니다.	train
common_voice_en_18680720.mp3	Power supplies are typically less efficient when lightly or heavily loaded.	4311ac2c9248c11f2c6a52cd2a2b3f7541c3058634ec391e4195c707bcfd2983f577468c8955ca622540e3c13a7a866839a8c84278e97eb2530e789a162231e9	전원 공급 장치는 일반적으로 부하가 적거나 많을 때 효율성이 떨어집니다.	train
common_voice_en_18680721.mp3	The spill was contained by the navy before causing damage to the harbour itself.	4311ac2c9248c11f2c6a52cd2a2b3f7541c3058634ec391e4195c707bcfd2983f577468c8955ca622540e3c13a7a866839a8c84278e97eb2530e789a162231e9	유출 사고는 항구 자체에 피해를 입히기 전에 해군에 의해 봉쇄되었습니다.	train
common_voice_en_18680722.mp3	Neil was adept at both defence and offense.	4311ac2c9248c11f2c6a52cd2a2b3f7541c3058634ec391e4195c707bcfd2983f577468c8955ca622540e3c13a7a866839a8c84278e97eb2530e789a162231e9	닐은 수비와 공격 모두에 능숙했습니다.	train_covost
common_voice_en_18680723.mp3	Bird life, including several different raptors, is particularly diverse throughout the year.	4311ac2c9248c11f2c6a52cd2a2b3f7541c3058634ec391e4195c707bcfd2983f577468c8955ca622540e3c13a7a866839a8c84278e97eb2530e789a162231e9	여러 종류의 맹금류를 포함한 조류는 일 년 내내 특히 다양합니다.	train
common_voice_en_18680724.mp3	"Most releases of this album represent only a truncated version of ""Blue Desert""."	4311ac2c9248c11f2c6a52cd2a2b3f7541c3058634ec391e4195c707bcfd2983f577468c8955ca622540e3c13a7a866839a8c84278e97eb2530e789a162231e9	이 앨범의 대부분의 버전은 "푸른 사막"을 잘라낸 버전으로만 출시됩니다.	train
common_voice_en_18680725.mp3	Kragujevac has developed transportation infrastructure.	4311ac2c9248c11f2c6a52cd2a2b3f7541c3058634ec391e4195c707bcfd2983f577468c8955ca622540e3c13a7a866839a8c84278e97eb2530e789a162231e9	크라그예바츠는 교통 인프라가 발달했습니다.	train
common_voice_en_18680726.mp3	And, answering the latter, we go a long way toward answering the former.	4311ac2c9248c11f2c6a52cd2a2b3f7541c3058634ec391e4195c707bcfd2983f577468c8955ca622540e3c13a7a866839a8c84278e97eb2530e789a162231e9	그리고 후자의 질문에 답하는 것은 전자의 질문에 답하는 데 큰 도움이 됩니다.	train
common_voice_en_18680727.mp3	After a year, four of the New Zealanders were able to escape.	4311ac2c9248c11f2c6a52cd2a2b3f7541c3058634ec391e4195c707bcfd2983f577468c8955ca622540e3c13a7a866839a8c84278e97eb2530e789a162231e9	1년 후, 뉴질랜드인 4명은 탈출에 성공했습니다.	train
common_voice_en_18680728.mp3	In this process, the analyte solution is electrolyzed.	4311ac2c9248c11f2c6a52cd2a2b3f7541c3058634ec391e4195c707bcfd2983f577468c8955ca622540e3c13a7a866839a8c84278e97eb2530e789a162231e9	이 과정에서 분석 용액이 전기 분해됩니다.	train
common_voice_en_18680729.mp3	"The star marks the top of the Archer's bow."	4311ac2c9248c11f2c6a52cd2a2b3f7541c3058634ec391e4195c707bcfd2983f577468c8955ca622540e3c13a7a866839a8c84278e97eb2530e789a162231e9	별은 궁수의 활의 상단을 표시합니다.	train
common_voice_en_18680730.mp3	An annual community talent show, Kiwanis Kapers, occurs in the fall.	4311ac2c9248c11f2c6a52cd2a2b3f7541c3058634ec391e4195c707bcfd2983f577468c8955ca622540e3c13a7a866839a8c84278e97eb2530e789a162231e9	연례 커뮤니티 장기자랑인 키와니스 카퍼스는 가을에 열립니다.	train
common_voice_en_18680731.mp3	There was no agreement about the Holy Sepulchre, although it was discussed in Karlowitz.	4311ac2c9248c11f2c6a52cd2a2b3f7541c3058634ec391e4195c707bcfd2983f577468c8955ca622540e3c13a7a866839a8c84278e97eb2530e789a162231e9	카를로비츠에서 논의되긴 했지만 성묘에 대한 합의는 이루어지지 않았습니다.	train
common_voice_en_18680732.mp3	Rutland had only come back into existence a year before the station commenced.	4311ac2c9248c11f2c6a52cd2a2b3f7541c3058634ec391e4195c707bcfd2983f577468c8955ca622540e3c13a7a866839a8c84278e97eb2530e789a162231e9	러틀랜드는 방송국이 시작되기 1년 전에야 다시 모습을 드러냈습니다.	train
common_voice_en_18680733.mp3	The preface states that he had been collecting this information since a young boy.	4311ac2c9248c11f2c6a52cd2a2b3f7541c3058634ec391e4195c707bcfd2983f577468c8955ca622540e3c13a7a866839a8c84278e97eb2530e789a162231e9	서문에는 그가 어렸을 때부터 이 정보를 수집해 왔다고 적혀 있습니다.	train
common_voice_en_18680734.mp3	"Ed then visits Shari to apologize to her for Ray's actions."	4311ac2c9248c11f2c6a52cd2a2b3f7541c3058634ec391e4195c707bcfd2983f577468c8955ca622540e3c13a7a866839a8c84278e97eb2530e789a162231e9	이후 Ed는 샤리를 찾아가 레이의 행동에 대해 사과합니다.	train
common_voice_en_18680735.mp3	She has been a presidential candidate and is currently the president of Comité Eureka.	4311ac2c9248c11f2c6a52cd2a2b3f7541c3058634ec391e4195c707bcfd2983f577468c8955ca622540e3c13a7a866839a8c84278e97eb2530e789a162231e9	대통령 후보로 출마한 바 있으며 현재 유레카 위원회 회장으로 활동하고 있습니다.	train
common_voice_en_18680736.mp3	This became known as the Vung Ro Bay Incident.	4311ac2c9248c11f2c6a52cd2a2b3f7541c3058634ec391e4195c707bcfd2983f577468c8955ca622540e3c13a7a866839a8c84278e97eb2530e789a162231e9	이 사건은 붕로만 사건으로 알려지게 되었습니다.	train
common_voice_en_18680737.mp3	When the school was in the planning stages, students were to wear school uniforms.	4311ac2c9248c11f2c6a52cd2a2b3f7541c3058634ec391e4195c707bcfd2983f577468c8955ca622540e3c13a7a866839a8c84278e97eb2530e789a162231e9	학교를 계획하는 단계에서는 학생들이 교복을 입어야 했습니다.	train
common_voice_en_18680738.mp3	He specialized in claims on behalf of Native Americans against the federal government.	4311ac2c9248c11f2c6a52cd2a2b3f7541c3058634ec391e4195c707bcfd2983f577468c8955ca622540e3c13a7a866839a8c84278e97eb2530e789a162231e9	그는 연방 정부를 상대로 아메리카 원주민을 대신해 소송을 제기하는 일을 전문으로 했습니다.	train
common_voice_en_18680739.mp3	Hardwick.	4311ac2c9248c11f2c6a52cd2a2b3f7541c3058634ec391e4195c707bcfd2983f577468c8955ca622540e3c13a7a866839a8c84278e97eb2530e789a162231e9	하드윅.	train
common_voice_en_18680740.mp3	The Touareg comes as standard with a four-wheel drive system.	4311ac2c9248c11f2c6a52cd2a2b3f7541c3058634ec391e4195c707bcfd2983f577468c8955ca622540e3c13a7a866839a8c84278e97eb2530e789a162231e9	투아렉에는 사륜구동 시스템이 기본으로 제공됩니다.	train
common_voice_en_18680741.mp3	After their victory, the mercenaries named themselves the Mamertines after the Oscan war-god Mamers.	4311ac2c9248c11f2c6a52cd2a2b3f7541c3058634ec391e4195c707bcfd2983f577468c8955ca622540e3c13a7a866839a8c84278e97eb2530e789a162231e9	승리 후 용병들은 오스카의 전쟁 신 마메르의 이름을 따서 마메르타인이라 명명했습니다.	train
common_voice_en_18680742.mp3	He spent his career playing for Arsenal, Middlesbrough, Hull City.	4311ac2c9248c11f2c6a52cd2a2b3f7541c3058634ec391e4195c707bcfd2983f577468c8955ca622540e3c13a7a866839a8c84278e97eb2530e789a162231e9	아스널, 미들즈브러, 헐 시티에서 선수 생활을 했습니다.	train
common_voice_en_18680743.mp3	Bronstein was a chess visionary.	4311ac2c9248c11f2c6a52cd2a2b3f7541c3058634ec391e4195c707bcfd2983f577468c8955ca622540e3c13a7a866839a8c84278e97eb2530e789a162231e9	브론스타인은 체스의 선구자였습니다.	train
common_voice_en_18680744.mp3	"This was the nation's third consecutive appearance at the Olympics."	4311ac2c9248c11f2c6a52cd2a2b3f7541c3058634ec391e4195c707bcfd2983f577468c8955ca622540e3c13a7a866839a8c84278e97eb2530e789a162231e9	이로써 한국은 3회 연속 올림픽에 출전하게 되었습니다.	train
common_voice_en_18680745.mp3	Systems vary highly.	4311ac2c9248c11f2c6a52cd2a2b3f7541c3058634ec391e4195c707bcfd2983f577468c8955ca622540e3c13a7a866839a8c84278e97eb2530e789a162231e9	시스템은 매우 다양합니다.	train
common_voice_en_18680746.mp3	Burton and her sister took dance and art lessons, performing in local productions.	4311ac2c9248c11f2c6a52cd2a2b3f7541c3058634ec391e4195c707bcfd2983f577468c8955ca622540e3c13a7a866839a8c84278e97eb2530e789a162231e9	버튼과 여동생은 무용과 미술 수업을 들으며 지역 공연에 출연하기도 했습니다.	train
common_voice_en_18680747.mp3	The school was founded by Jack Abramoff and funded through his Capital Athletic Foundation.	4311ac2c9248c11f2c6a52cd2a2b3f7541c3058634ec391e4195c707bcfd2983f577468c8955ca622540e3c13a7a866839a8c84278e97eb2530e789a162231e9	이 학교는 잭 아브라모프가 설립했으며 그의 캐피탈 체육 재단을 통해 자금을 지원받았습니다.	train
common_voice_en_18680748.mp3	The use of salt prevents the attackers from precomputing a dictionary of derived keys.	4311ac2c9248c11f2c6a52cd2a2b3f7541c3058634ec391e4195c707bcfd2983f577468c8955ca622540e3c13a7a866839a8c84278e97eb2530e789a162231e9	솔트를 사용하면 공격자가 파생된 키 사전을 미리 계산하지 못합니다.	train
common_voice_en_18680749.mp3	Further developments occurred from Ringwood to Picket Post near the turn-off for Burley.	4311ac2c9248c11f2c6a52cd2a2b3f7541c3058634ec391e4195c707bcfd2983f577468c8955ca622540e3c13a7a866839a8c84278e97eb2530e789a162231e9	링우드에서 벌리로 향하는 분기점 근처의 피켓 포스트까지 추가 개발이 이루어졌습니다.	train
common_voice_en_18680750.mp3	She is the sister of actress Ann and actor John Cusack.	4311ac2c9248c11f2c6a52cd2a2b3f7541c3058634ec391e4195c707bcfd2983f577468c8955ca622540e3c13a7a866839a8c84278e97eb2530e789a162231e9	그녀는 배우 앤과 배우 존 쿠삭의 여동생입니다.	train
common_voice_en_18680751.mp3	The townsite is mainly made up of summer cabins.	4311ac2c9248c11f2c6a52cd2a2b3f7541c3058634ec391e4195c707bcfd2983f577468c8955ca622540e3c13a7a866839a8c84278e97eb2530e789a162231e9	마을은 주로 여름철 오두막으로 이루어져 있습니다.	train
common_voice_en_18680752.mp3	Akinetors correspond to pseudotensors in standard nomenclature.	4311ac2c9248c11f2c6a52cd2a2b3f7541c3058634ec391e4195c707bcfd2983f577468c8955ca622540e3c13a7a866839a8c84278e97eb2530e789a162231e9	아키네터는 표준 명명법에서 의사 텐서에 해당합니다.	train
common_voice_en_18680753.mp3	The state capital is Mérida, in the Libertador Municipality.	4311ac2c9248c11f2c6a52cd2a2b3f7541c3058634ec391e4195c707bcfd2983f577468c8955ca622540e3c13a7a866839a8c84278e97eb2530e789a162231e9	주도(州都)는 리베르타도르 지방 자치 단체의 메리다입니다.	train
common_voice_en_18680754.mp3	"This proclamation is sometimes regarded as ""the Edict of Milan for the Assyrian Church""."	4311ac2c9248c11f2c6a52cd2a2b3f7541c3058634ec391e4195c707bcfd2983f577468c8955ca622540e3c13a7a866839a8c84278e97eb2530e789a162231e9	이 칙령은 "아시리아 교회를 위한 밀라노 칙령"으로 간주되기도 합니다.	train
common_voice_en_18680755.mp3	She was succeeded by Judge Hadrian Volt.	4311ac2c9248c11f2c6a52cd2a2b3f7541c3058634ec391e4195c707bcfd2983f577468c8955ca622540e3c13a7a866839a8c84278e97eb2530e789a162231e9	그녀의 후임은 하드리안 볼트 판사였습니다.	train
common_voice_en_18680756.mp3	Test item writers are instructed to make their distractors plausible yet clearly incorrect.	4311ac2c9248c11f2c6a52cd2a2b3f7541c3058634ec391e4195c707bcfd2983f577468c8955ca622540e3c13a7a866839a8c84278e97eb2530e789a162231e9	시험 문항 작성자에게는 그럴듯하지만 명백히 틀린 문항을 만들라는 지시가 내려집니다.	train
common_voice_en_18680757.mp3	The vertical strip pattern involves moving the fingers up and down over the breast.	4311ac2c9248c11f2c6a52cd2a2b3f7541c3058634ec391e4195c707bcfd2983f577468c8955ca622540e3c13a7a866839a8c84278e97eb2530e789a162231e9	수직 스트립 패턴은 손가락을 가슴 위로 위아래로 움직이는 동작입니다.	train
common_voice_en_18680758.mp3	Sources disagree as to what happened to Brown after this.	4311ac2c9248c11f2c6a52cd2a2b3f7541c3058634ec391e4195c707bcfd2983f577468c8955ca622540e3c13a7a866839a8c84278e97eb2530e789a162231e9	그 후 브라운에게 무슨 일이 일어났는지에 대해서는 소식통에 따라 의견이 엇갈립니다.	train
common_voice_en_18680759.mp3	To the west are the Barracks of the Pavlovsky Regiment.	4311ac2c9248c11f2c6a52cd2a2b3f7541c3058634ec391e4195c707bcfd2983f577468c8955ca622540e3c13a7a866839a8c84278e97eb2530e789a162231e9	서쪽에는 파블로프스키 연대의 막사가 있습니다.	train
common_voice_en_18680760.mp3	"as they don't."	4311ac2c9248c11f2c6a52cd2a2b3f7541c3058634ec391e4195c707bcfd2983f577468c8955ca622540e3c13a7a866839a8c84278e97eb2530e789a162231e9	하지 않습니다.	train
common_voice_en_18680761.mp3	The Baltimore Ravens and Joe Flacco have also employed this technique.	4311ac2c9248c11f2c6a52cd2a2b3f7541c3058634ec391e4195c707bcfd2983f577468c8955ca622540e3c13a7a866839a8c84278e97eb2530e789a162231e9	볼티모어 레이븐스와 조 플라코도 이 기법을 사용했습니다.	train
common_voice_en_18680762.mp3	Her work is often characterized as simple, spare, and emotionally resonant.	4311ac2c9248c11f2c6a52cd2a2b3f7541c3058634ec391e4195c707bcfd2983f577468c8955ca622540e3c13a7a866839a8c84278e97eb2530e789a162231e9	그녀의 작품은 종종 단순하고 여유로우며 정서적으로 공감을 불러일으키는 것이 특징입니다.	train
common_voice_en_18680763.mp3	Its surface is a series of rolling hills, white sand beaches and cliffs.	4311ac2c9248c11f2c6a52cd2a2b3f7541c3058634ec391e4195c707bcfd2983f577468c8955ca622540e3c13a7a866839a8c84278e97eb2530e789a162231e9	표면은 구불구불한 언덕과 백사장, 절벽으로 이루어져 있습니다.	train
common_voice_en_18680765.mp3	Mrs. Burke Roche married Aurel de Batonyi, a Hungarian-born riding instructor and society horseman.	4311ac2c9248c11f2c6a52cd2a2b3f7541c3058634ec391e4195c707bcfd2983f577468c8955ca622540e3c13a7a866839a8c84278e97eb2530e789a162231e9	버크 로슈 여사는 헝가리 출신의 승마 강사이자 사교 승마 선수인 오렐 드 바토니와 결혼했습니다.	train
common_voice_en_18680766.mp3	He became a stockbroker and company director.	4311ac2c9248c11f2c6a52cd2a2b3f7541c3058634ec391e4195c707bcfd2983f577468c8955ca622540e3c13a7a866839a8c84278e97eb2530e789a162231e9	그는 주식 중개인이자 회사 이사가 되었습니다.	train
common_voice_en_18680767.mp3	Not all regions of the Green Party use the Principal Speaker system.	4311ac2c9248c11f2c6a52cd2a2b3f7541c3058634ec391e4195c707bcfd2983f577468c8955ca622540e3c13a7a866839a8c84278e97eb2530e789a162231e9	녹색당의 모든 지역에서 대표 연설자 시스템을 사용하는 것은 아닙니다.	train
common_voice_en_18680768.mp3	She has appeared in film, television, radio and theatre.	4311ac2c9248c11f2c6a52cd2a2b3f7541c3058634ec391e4195c707bcfd2983f577468c8955ca622540e3c13a7a866839a8c84278e97eb2530e789a162231e9	영화, 텔레비전, 라디오, 연극에 출연했습니다.	train
common_voice_en_18680769.mp3	There he tells her of his thoughts, before the discussion turns to love-making.	4311ac2c9248c11f2c6a52cd2a2b3f7541c3058634ec391e4195c707bcfd2983f577468c8955ca622540e3c13a7a866839a8c84278e97eb2530e789a162231e9	그곳에서 그는 그녀에게 자신의 생각을 이야기하고, 대화가 연애로 바뀌기 전에 자신의 생각을 이야기합니다.	train
common_voice_en_18680770.mp3	The first editor-in-chief of the merged publication was Stuart Hall.	4311ac2c9248c11f2c6a52cd2a2b3f7541c3058634ec391e4195c707bcfd2983f577468c8955ca622540e3c13a7a866839a8c84278e97eb2530e789a162231e9	합병된 출판물의 초대 편집장은 스튜어트 홀이었습니다.	train
common_voice_en_18680771.mp3	"Today, Lansingville's population is ethnically diverse, although many Slovak-Americans still live there."	4311ac2c9248c11f2c6a52cd2a2b3f7541c3058634ec391e4195c707bcfd2983f577468c8955ca622540e3c13a7a866839a8c84278e97eb2530e789a162231e9	오늘날 랜싱빌의 인구는 인종적으로 다양하지만, 여전히 많은 슬로바키아계 미국인이 거주하고 있습니다.	train
common_voice_en_18680772.mp3	Bowie was hit hard by the Great Depression like everywhere else.	4311ac2c9248c11f2c6a52cd2a2b3f7541c3058634ec391e4195c707bcfd2983f577468c8955ca622540e3c13a7a866839a8c84278e97eb2530e789a162231e9	보위도 다른 곳과 마찬가지로 대공황으로 큰 타격을 입었습니다.	train
common_voice_en_18680773.mp3	The Bois de Vincennes is also located in this arrondissement.	4311ac2c9248c11f2c6a52cd2a2b3f7541c3058634ec391e4195c707bcfd2983f577468c8955ca622540e3c13a7a866839a8c84278e97eb2530e789a162231e9	부아 드 빈센느도 이 구에 위치해 있습니다.	train
common_voice_en_18680774.mp3	"The word ""football"" in BrE refers to Association football, also known as soccer."	4311ac2c9248c11f2c6a52cd2a2b3f7541c3058634ec391e4195c707bcfd2983f577468c8955ca622540e3c13a7a866839a8c84278e97eb2530e789a162231e9	BrE에서 "축구"라는 단어는 축구라고도 알려진 협회 축구를 의미합니다.	train
common_voice_en_18680775.mp3	The press box is located at the top of the west grandstand.	4311ac2c9248c11f2c6a52cd2a2b3f7541c3058634ec391e4195c707bcfd2983f577468c8955ca622540e3c13a7a866839a8c84278e97eb2530e789a162231e9	프레스 박스는 서쪽 관람석 상단에 있습니다.	train
common_voice_en_18680776.mp3	Barnes and Co., merged with King & Sons thus forming King and Barnes.	4311ac2c9248c11f2c6a52cd2a2b3f7541c3058634ec391e4195c707bcfd2983f577468c8955ca622540e3c13a7a866839a8c84278e97eb2530e789a162231e9	반스 앤 코가 킹 앤 선스와 합병하여 킹 앤 반스가 탄생했습니다.	train
common_voice_en_18680777.mp3	"By this time, many boxing journalist were calling Barrera ""Mexico's next Julio César Chávez."	4311ac2c9248c11f2c6a52cd2a2b3f7541c3058634ec391e4195c707bcfd2983f577468c8955ca622540e3c13a7a866839a8c84278e97eb2530e789a162231e9	이 무렵 많은 복싱 저널리스트들은 바레라를 '멕시코의 제2의 훌리오 세자르 차베스'라고 불렀습니다.	train
common_voice_en_18680778.mp3	He was last seen helping women and children into lifeboats.	4311ac2c9248c11f2c6a52cd2a2b3f7541c3058634ec391e4195c707bcfd2983f577468c8955ca622540e3c13a7a866839a8c84278e97eb2530e789a162231e9	그는 마지막으로 여성과 어린이를 구명보트에 태우는 것을 돕는 모습이 목격되었습니다.	train
common_voice_en_18680779.mp3	This was the last known LinuxWorld or OpenSource World event.	4311ac2c9248c11f2c6a52cd2a2b3f7541c3058634ec391e4195c707bcfd2983f577468c8955ca622540e3c13a7a866839a8c84278e97eb2530e789a162231e9	이것이 마지막으로 알려진 LinuxWorld 또는 오픈소스 월드 행사였습니다.	train
common_voice_en_18680780.mp3	There has been substantial expansion of the service sector as a result of this.	4311ac2c9248c11f2c6a52cd2a2b3f7541c3058634ec391e4195c707bcfd2983f577468c8955ca622540e3c13a7a866839a8c84278e97eb2530e789a162231e9	그 결과 서비스 부문이 크게 확장되었습니다.	train
