path	sentence	client_id	translation	split
common_voice_en_197717.mp3	"You mean you're not coming back to work here?"	ac6c32f959398d495a2bd3ff3a6d7b3dc0f9700ded23aef5f248bc799b3210e84b90cf8eaca63f0bd7caad7fd8d2f1914223a32a39085381242d0f0b0411ce5d	여기서 다시 일하지 않겠다는 건가요?	train_covost
common_voice_en_197718.mp3	Second, with a keyboard you can hold a movement key and release when you reach your location.	ac6c32f959398d495a2bd3ff3a6d7b3dc0f9700ded23aef5f248bc799b3210e84b90cf8eaca63f0bd7caad7fd8d2f1914223a32a39085381242d0f0b0411ce5d	둘째, 키보드를 사용하면 이동 키를 누르고 있다가 원하는 위치에 도달하면 키를 놓을 수 있습니다.	train_covost
common_voice_en_197725.mp3	For occupying the wrong parking lot he had to pay a fine.	ac6c32f959398d495a2bd3ff3a6d7b3dc0f9700ded23aef5f248bc799b3210e84b90cf8eaca63f0bd7caad7fd8d2f1914223a32a39085381242d0f0b0411ce5d	주차장을 잘못 점유해 벌금을 내야 했습니다.	train_covost
common_voice_en_197726.mp3	This is as far as the elevator goes.	ac6c32f959398d495a2bd3ff3a6d7b3dc0f9700ded23aef5f248bc799b3210e84b90cf8eaca63f0bd7caad7fd8d2f1914223a32a39085381242d0f0b0411ce5d	엘리베이터는 여기까지입니다.	train_covost
common_voice_en_197733.mp3	The man who bought them last week was American.	ac6c32f959398d495a2bd3ff3a6d7b3dc0f9700ded23aef5f248bc799b3210e84b90cf8eaca63f0bd7caad7fd8d2f1914223a32a39085381242d0f0b0411ce5d	지난 주에 구매한 사람은 미국인이었습니다.	train_covost
common_voice_en_197734.mp3	Tonight we give you something entirely new and different.	ac6c32f959398d495a2bd3ff3a6d7b3dc0f9700ded23aef5f248bc799b3210e84b90cf8eaca63f0bd7caad7fd8d2f1914223a32a39085381242d0f0b0411ce5d	오늘 밤에는 완전히 새롭고 색다른 경험을 선사합니다.	train_covost
common_voice_en_197739.mp3	I get more of a kick out of it that way.	ac6c32f959398d495a2bd3ff3a6d7b3dc0f9700ded23aef5f248bc799b3210e84b90cf8eaca63f0bd7caad7fd8d2f1914223a32a39085381242d0f0b0411ce5d	저는 그렇게 하는 것이 더 재미있어요.	train_covost
common_voice_en_197742.mp3	I never saw that car before in my whole life.	ac6c32f959398d495a2bd3ff3a6d7b3dc0f9700ded23aef5f248bc799b3210e84b90cf8eaca63f0bd7caad7fd8d2f1914223a32a39085381242d0f0b0411ce5d	평생 저 차를 처음 봤어요.	train_covost
common_voice_en_197743.mp3	How could you say that at the funeral?	ac6c32f959398d495a2bd3ff3a6d7b3dc0f9700ded23aef5f248bc799b3210e84b90cf8eaca63f0bd7caad7fd8d2f1914223a32a39085381242d0f0b0411ce5d	장례식장에서 어떻게 그런 말을 할 수 있죠?	train_covost
common_voice_en_197747.mp3	Who the heck is Johnny?!	ac6c32f959398d495a2bd3ff3a6d7b3dc0f9700ded23aef5f248bc799b3210e84b90cf8eaca63f0bd7caad7fd8d2f1914223a32a39085381242d0f0b0411ce5d	조니는 대체 누구야?!	train_covost
common_voice_en_197749.mp3	The terrorist group made their demand.	ac6c32f959398d495a2bd3ff3a6d7b3dc0f9700ded23aef5f248bc799b3210e84b90cf8eaca63f0bd7caad7fd8d2f1914223a32a39085381242d0f0b0411ce5d	테러 단체의 요구가 있었습니다.	train_covost
common_voice_en_197756.mp3	"You've got a nerve accusing people of things!"	ac6c32f959398d495a2bd3ff3a6d7b3dc0f9700ded23aef5f248bc799b3210e84b90cf8eaca63f0bd7caad7fd8d2f1914223a32a39085381242d0f0b0411ce5d	남을 비난하는 배짱이 대단하네요!	train_covost
common_voice_en_197759.mp3	How much do you make a week?	ac6c32f959398d495a2bd3ff3a6d7b3dc0f9700ded23aef5f248bc799b3210e84b90cf8eaca63f0bd7caad7fd8d2f1914223a32a39085381242d0f0b0411ce5d	일주일에 얼마를 버나요?	train_covost
common_voice_en_197771.mp3	Could you provide an example of a realistic scenario?	ac6c32f959398d495a2bd3ff3a6d7b3dc0f9700ded23aef5f248bc799b3210e84b90cf8eaca63f0bd7caad7fd8d2f1914223a32a39085381242d0f0b0411ce5d	현실적인 시나리오의 예를 들어 주시겠어요?	train_covost
common_voice_en_197775.mp3	"I ain't seen him for a week."	ac6c32f959398d495a2bd3ff3a6d7b3dc0f9700ded23aef5f248bc799b3210e84b90cf8eaca63f0bd7caad7fd8d2f1914223a32a39085381242d0f0b0411ce5d	일주일 동안 못 봤어요.	train_covost
common_voice_en_197778.mp3	My friend was getting married and asked me to be her maid of honor.	ac6c32f959398d495a2bd3ff3a6d7b3dc0f9700ded23aef5f248bc799b3210e84b90cf8eaca63f0bd7caad7fd8d2f1914223a32a39085381242d0f0b0411ce5d	제 친구가 결혼을 앞두고 저에게 들러리를 서 달라고 부탁했어요.	train_covost
common_voice_en_197779.mp3	"I use ""links"" for the former and I simply speak the number for the latter."	ac6c32f959398d495a2bd3ff3a6d7b3dc0f9700ded23aef5f248bc799b3210e84b90cf8eaca63f0bd7caad7fd8d2f1914223a32a39085381242d0f0b0411ce5d	전자의 경우 '링크'를 사용하고 후자의 경우 번호를 말하기만 하면 됩니다.	train_covost
common_voice_en_197783.mp3	It could be computed in many ways which would give more or less equivalent results.	ac6c32f959398d495a2bd3ff3a6d7b3dc0f9700ded23aef5f248bc799b3210e84b90cf8eaca63f0bd7caad7fd8d2f1914223a32a39085381242d0f0b0411ce5d	여러 가지 방법으로 계산하면 어느 정도 동등한 결과를 얻을 수 있습니다.	train_covost
common_voice_en_197785.mp3	There are two basic approaches to dictating code: using custom grammars or using VoiceCode.	ac6c32f959398d495a2bd3ff3a6d7b3dc0f9700ded23aef5f248bc799b3210e84b90cf8eaca63f0bd7caad7fd8d2f1914223a32a39085381242d0f0b0411ce5d	코드 받아쓰기에는 사용자 지정 문법을 사용하거나 VoiceCode를 사용하는 두 가지 기본 접근 방식이 있습니다.	train_covost
common_voice_en_197791.mp3	"Currently, Mozilla's implementation requires that users train their own speech models."	ac6c32f959398d495a2bd3ff3a6d7b3dc0f9700ded23aef5f248bc799b3210e84b90cf8eaca63f0bd7caad7fd8d2f1914223a32a39085381242d0f0b0411ce5d	현재 Mozilla의 구현에서는 사용자가 직접 음성 모델을 학습해야 합니다.	train_covost
common_voice_en_197795.mp3	You mean the one who drank so much?	ac6c32f959398d495a2bd3ff3a6d7b3dc0f9700ded23aef5f248bc799b3210e84b90cf8eaca63f0bd7caad7fd8d2f1914223a32a39085381242d0f0b0411ce5d	술을 너무 많이 마신 분을 말하는 건가요?	train_covost
common_voice_en_197800.mp3	"In that case I'll ask the two executive officers to withdraw."	ac6c32f959398d495a2bd3ff3a6d7b3dc0f9700ded23aef5f248bc799b3210e84b90cf8eaca63f0bd7caad7fd8d2f1914223a32a39085381242d0f0b0411ce5d	그렇다면 두 임원에게 사퇴를 요청하겠습니다.	train_covost
common_voice_en_197805.mp3	You have been stopping me.	ac6c32f959398d495a2bd3ff3a6d7b3dc0f9700ded23aef5f248bc799b3210e84b90cf8eaca63f0bd7caad7fd8d2f1914223a32a39085381242d0f0b0411ce5d	당신은 나를 막고 있습니다.	train_covost
common_voice_en_197807.mp3	"It's not so bad."	ac6c32f959398d495a2bd3ff3a6d7b3dc0f9700ded23aef5f248bc799b3210e84b90cf8eaca63f0bd7caad7fd8d2f1914223a32a39085381242d0f0b0411ce5d	그렇게 나쁘지 않습니다.	train_covost
common_voice_en_197808.mp3	Last time I was in Australia Anne was in diapers.	ac6c32f959398d495a2bd3ff3a6d7b3dc0f9700ded23aef5f248bc799b3210e84b90cf8eaca63f0bd7caad7fd8d2f1914223a32a39085381242d0f0b0411ce5d	지난번에 호주에 갔을 때 앤은 기저귀를 차고 있었어요.	train_covost
common_voice_en_197810.mp3	It was after they got back from fishing.	ac6c32f959398d495a2bd3ff3a6d7b3dc0f9700ded23aef5f248bc799b3210e84b90cf8eaca63f0bd7caad7fd8d2f1914223a32a39085381242d0f0b0411ce5d	낚시를 마치고 돌아온 후였습니다.	train_covost
common_voice_en_197817.mp3	The article should contain URL where the dataset can be downloaded.	ac6c32f959398d495a2bd3ff3a6d7b3dc0f9700ded23aef5f248bc799b3210e84b90cf8eaca63f0bd7caad7fd8d2f1914223a32a39085381242d0f0b0411ce5d	문서에는 데이터 집합을 다운로드할 수 있는 URL이 포함되어야 합니다.	train_covost
