path	sentence	client_id	translation	split
common_voice_en_19416963.mp3	Winged males may or may not also exhibit bioluminescence.	c895f6ffc789443e064895d7a9eef515f9c01c86ff78b4141d2428a6fab1f9a4a6a52723124cba3640a86204d4ff027b96172a2738cb57943a336e044d934f24	날개 달린 수컷도 생체 발광을 보일 수도 있고 아닐 수도 있습니다.	train
common_voice_en_19416973.mp3	It is an Ontario College of Applied Arts and Technology.	c895f6ffc789443e064895d7a9eef515f9c01c86ff78b4141d2428a6fab1f9a4a6a52723124cba3640a86204d4ff027b96172a2738cb57943a336e044d934f24	온타리오 응용 예술 및 기술 대학입니다.	train
common_voice_en_19416974.mp3	This allows both co-operative and competitive multiplayer games.	c895f6ffc789443e064895d7a9eef515f9c01c86ff78b4141d2428a6fab1f9a4a6a52723124cba3640a86204d4ff027b96172a2738cb57943a336e044d934f24	이를 통해 협동 및 경쟁 멀티플레이어 게임을 모두 즐길 수 있습니다.	train
common_voice_en_19416975.mp3	If the ball passes out of bounds, the clock will also stop.	c895f6ffc789443e064895d7a9eef515f9c01c86ff78b4141d2428a6fab1f9a4a6a52723124cba3640a86204d4ff027b96172a2738cb57943a336e044d934f24	공이 바운드를 벗어나면 시계도 멈춥니다.	train
common_voice_en_19416976.mp3	Wortley grew, much like surrounding areas during the industrial revolution.	c895f6ffc789443e064895d7a9eef515f9c01c86ff78b4141d2428a6fab1f9a4a6a52723124cba3640a86204d4ff027b96172a2738cb57943a336e044d934f24	워틀리는 산업 혁명 당시 주변 지역과 마찬가지로 성장했습니다.	train
common_voice_en_19416977.mp3	This expansion benefited the city both economically and from the standpoint of tourism.	c895f6ffc789443e064895d7a9eef515f9c01c86ff78b4141d2428a6fab1f9a4a6a52723124cba3640a86204d4ff027b96172a2738cb57943a336e044d934f24	이러한 확장은 경제적으로나 관광의 관점에서나 도시에 도움이 되었습니다.	train
common_voice_en_19416978.mp3	Ghonda was given the post.	c895f6ffc789443e064895d7a9eef515f9c01c86ff78b4141d2428a6fab1f9a4a6a52723124cba3640a86204d4ff027b96172a2738cb57943a336e044d934f24	곤다가 이 직책을 맡게 되었습니다.	train
common_voice_en_19416979.mp3	In addition to his career as a museum director, Snoddy has made abstract paintings.	c895f6ffc789443e064895d7a9eef515f9c01c86ff78b4141d2428a6fab1f9a4a6a52723124cba3640a86204d4ff027b96172a2738cb57943a336e044d934f24	스노디는 박물관 디렉터로서의 경력 외에도 추상 회화 작품도 제작했습니다.	train
common_voice_en_19416980.mp3	"The redesign was to release hand-in-hand with the magazine's own redesign."	c895f6ffc789443e064895d7a9eef515f9c01c86ff78b4141d2428a6fab1f9a4a6a52723124cba3640a86204d4ff027b96172a2738cb57943a336e044d934f24	이번 개편은 매거진의 자체 개편과 함께 진행되었습니다.	train
common_voice_en_19416981.mp3	The text is a spiritual guide on contemplative prayer in the late Middle Ages.	c895f6ffc789443e064895d7a9eef515f9c01c86ff78b4141d2428a6fab1f9a4a6a52723124cba3640a86204d4ff027b96172a2738cb57943a336e044d934f24	이 텍스트는 중세 후기 관상 기도에 관한 영적 지침서입니다.	train
common_voice_en_19416982.mp3	Viktor has a younger brother Serhiy Onopko who also played as a professional footballer.	c895f6ffc789443e064895d7a9eef515f9c01c86ff78b4141d2428a6fab1f9a4a6a52723124cba3640a86204d4ff027b96172a2738cb57943a336e044d934f24	빅토르에게는 프로 축구 선수로 활약한 남동생 세르게이 오놉코가 있습니다.	train_covost
common_voice_en_19416993.mp3	The facility hosts numerous events, such as concerts, music festivals, conventions and boxing cards.	c895f6ffc789443e064895d7a9eef515f9c01c86ff78b4141d2428a6fab1f9a4a6a52723124cba3640a86204d4ff027b96172a2738cb57943a336e044d934f24	이 시설에서는 콘서트, 음악 축제, 컨벤션, 복싱 카드 등 다양한 이벤트가 열립니다.	train
common_voice_en_19416994.mp3	Production for his fifth album began the same year.	c895f6ffc789443e064895d7a9eef515f9c01c86ff78b4141d2428a6fab1f9a4a6a52723124cba3640a86204d4ff027b96172a2738cb57943a336e044d934f24	같은 해에 다섯 번째 앨범 제작이 시작되었습니다.	train
common_voice_en_19416995.mp3	The song is about depression and contemplating suicide.	c895f6ffc789443e064895d7a9eef515f9c01c86ff78b4141d2428a6fab1f9a4a6a52723124cba3640a86204d4ff027b96172a2738cb57943a336e044d934f24	이 노래는 우울증과 자살을 고민하는 내용을 담고 있습니다.	train
common_voice_en_19416996.mp3	Ute Pass is immediately west of town.	c895f6ffc789443e064895d7a9eef515f9c01c86ff78b4141d2428a6fab1f9a4a6a52723124cba3640a86204d4ff027b96172a2738cb57943a336e044d934f24	우테 고개는 마을 바로 서쪽에 있습니다.	train
common_voice_en_19416997.mp3	"He authored the children's book, ""Bedtime Stories from the Bible""."	c895f6ffc789443e064895d7a9eef515f9c01c86ff78b4141d2428a6fab1f9a4a6a52723124cba3640a86204d4ff027b96172a2738cb57943a336e044d934f24	그는 동화책 '성경 속 잠자리 이야기'를 저술했습니다.	train
common_voice_en_19417003.mp3	"""Cause"", ""promotional"" or ""attitude"" groups aim to change opinions and attitudes."	c895f6ffc789443e064895d7a9eef515f9c01c86ff78b4141d2428a6fab1f9a4a6a52723124cba3640a86204d4ff027b96172a2738cb57943a336e044d934f24	원인', '홍보' 또는 '태도' 그룹은 의견과 태도를 바꾸는 것을 목표로 합니다.	train
common_voice_en_19417004.mp3	Wells, ended her relationship with Wells when his other lover Rebecca West became pregnant.	c895f6ffc789443e064895d7a9eef515f9c01c86ff78b4141d2428a6fab1f9a4a6a52723124cba3640a86204d4ff027b96172a2738cb57943a336e044d934f24	웰스는 다른 연인인 레베카 웨스트가 임신을 하면서 웰스와의 관계를 끝냈습니다.	train
common_voice_en_19417005.mp3	It obeys the same rules of manipulation as the Legendre symbol.	c895f6ffc789443e064895d7a9eef515f9c01c86ff78b4141d2428a6fab1f9a4a6a52723124cba3640a86204d4ff027b96172a2738cb57943a336e044d934f24	레전드 심볼과 동일한 조작 규칙을 따릅니다.	train
common_voice_en_19417006.mp3	Encystment may also function in the dispersal of the worm.	c895f6ffc789443e064895d7a9eef515f9c01c86ff78b4141d2428a6fab1f9a4a6a52723124cba3640a86204d4ff027b96172a2738cb57943a336e044d934f24	암호화는 웜의 분산에도 기능할 수 있습니다.	train
common_voice_en_19417007.mp3	There is a timber mill in town as well.	c895f6ffc789443e064895d7a9eef515f9c01c86ff78b4141d2428a6fab1f9a4a6a52723124cba3640a86204d4ff027b96172a2738cb57943a336e044d934f24	마을에는 목재 공장도 있습니다.	train
common_voice_en_19417008.mp3	"O'Hara was a firm believer in American expansion, in the form of filibustering."	c895f6ffc789443e064895d7a9eef515f9c01c86ff78b4141d2428a6fab1f9a4a6a52723124cba3640a86204d4ff027b96172a2738cb57943a336e044d934f24	오하라는 필리버스터를 통해 미국의 확장을 확고하게 믿었습니다.	train
common_voice_en_19417009.mp3	It was also printed in Israel.	c895f6ffc789443e064895d7a9eef515f9c01c86ff78b4141d2428a6fab1f9a4a6a52723124cba3640a86204d4ff027b96172a2738cb57943a336e044d934f24	이스라엘에서도 인쇄되었습니다.	train
common_voice_en_19417010.mp3	Carrot juice has a uniquely sweet flavour of concentrated carrots.	c895f6ffc789443e064895d7a9eef515f9c01c86ff78b4141d2428a6fab1f9a4a6a52723124cba3640a86204d4ff027b96172a2738cb57943a336e044d934f24	당근 주스는 농축 당근의 독특한 달콤한 맛이 특징입니다.	train
common_voice_en_19417011.mp3	In spoken language, this focusing is often accompanied by a special intonation.	c895f6ffc789443e064895d7a9eef515f9c01c86ff78b4141d2428a6fab1f9a4a6a52723124cba3640a86204d4ff027b96172a2738cb57943a336e044d934f24	구어에서 이러한 집중은 종종 특별한 억양을 동반합니다.	train
common_voice_en_19417012.mp3	In Paris, he was an indifferent student and found the city distasteful.	c895f6ffc789443e064895d7a9eef515f9c01c86ff78b4141d2428a6fab1f9a4a6a52723124cba3640a86204d4ff027b96172a2738cb57943a336e044d934f24	파리에서 그는 무관심한 학생이었으며 도시를 불쾌하게 여겼습니다.	train
common_voice_en_19417018.mp3	It is part of Othaya town council and Othaya Constituency.	c895f6ffc789443e064895d7a9eef515f9c01c86ff78b4141d2428a6fab1f9a4a6a52723124cba3640a86204d4ff027b96172a2738cb57943a336e044d934f24	오타야 시의회와 오타야 선거구에 속해 있습니다.	train
common_voice_en_19417019.mp3	Everything had to be as near perfect as technically and humanly possible.	c895f6ffc789443e064895d7a9eef515f9c01c86ff78b4141d2428a6fab1f9a4a6a52723124cba3640a86204d4ff027b96172a2738cb57943a336e044d934f24	모든 것이 기술적으로나 인간적으로 가능한 한 완벽에 가까워야 했습니다.	train
common_voice_en_19417020.mp3	The county seat is Huntsville.	c895f6ffc789443e064895d7a9eef515f9c01c86ff78b4141d2428a6fab1f9a4a6a52723124cba3640a86204d4ff027b96172a2738cb57943a336e044d934f24	카운티 소재지는 헌츠빌입니다.	train
common_voice_en_19417021.mp3	"This first single had two b-sides: ""Stand Up"" and ""Maybe""."	c895f6ffc789443e064895d7a9eef515f9c01c86ff78b4141d2428a6fab1f9a4a6a52723124cba3640a86204d4ff027b96172a2738cb57943a336e044d934f24	"이 첫 번째 싱글에는 두 개의 비사이드가 있습니다: "Stand Up"과 ‘Maybe’."	train
common_voice_en_19417022.mp3	The couple had three sons.	c895f6ffc789443e064895d7a9eef515f9c01c86ff78b4141d2428a6fab1f9a4a6a52723124cba3640a86204d4ff027b96172a2738cb57943a336e044d934f24	이 부부에게는 세 아들이 있었습니다.	train
common_voice_en_19417023.mp3	Home games were played at the Liberty Bowl.	c895f6ffc789443e064895d7a9eef515f9c01c86ff78b4141d2428a6fab1f9a4a6a52723124cba3640a86204d4ff027b96172a2738cb57943a336e044d934f24	홈 경기는 리버티 보울에서 열렸습니다.	train
common_voice_en_19417024.mp3	However, Baidu was killed and Ghazan became a khan.	c895f6ffc789443e064895d7a9eef515f9c01c86ff78b4141d2428a6fab1f9a4a6a52723124cba3640a86204d4ff027b96172a2738cb57943a336e044d934f24	하지만 바이두는 죽고 가잔은 칸이 되었습니다.	train
common_voice_en_19417025.mp3	"Thus was born the ""San-Kan"" or Three ""Kanrei""."	c895f6ffc789443e064895d7a9eef515f9c01c86ff78b4141d2428a6fab1f9a4a6a52723124cba3640a86204d4ff027b96172a2738cb57943a336e044d934f24	이렇게 해서 '산칸' 또는 세 개의 '칸레이'가 탄생했습니다.	train
common_voice_en_19417026.mp3	As Ptah decreed in accordance with what Ra himself decrees.	c895f6ffc789443e064895d7a9eef515f9c01c86ff78b4141d2428a6fab1f9a4a6a52723124cba3640a86204d4ff027b96172a2738cb57943a336e044d934f24	프타가 라의 명령에 따라 선언한 대로.	train
common_voice_en_19417027.mp3	He appeared in two Stanley Cup Finals, winning once.	c895f6ffc789443e064895d7a9eef515f9c01c86ff78b4141d2428a6fab1f9a4a6a52723124cba3640a86204d4ff027b96172a2738cb57943a336e044d934f24	그는 스탠리 컵 결승전에 두 번 출전해 한 번 우승했습니다.	train
common_voice_en_19417033.mp3	"The ""typical"" ""china"" woman is no exception."	c895f6ffc789443e064895d7a9eef515f9c01c86ff78b4141d2428a6fab1f9a4a6a52723124cba3640a86204d4ff027b96172a2738cb57943a336e044d934f24	'전형적인' '중국' 여성도 예외는 아닙니다.	train
common_voice_en_19417034.mp3	"According to Oxford Dictionaries Online, racialism is ""another term for racism""."	c895f6ffc789443e064895d7a9eef515f9c01c86ff78b4141d2428a6fab1f9a4a6a52723124cba3640a86204d4ff027b96172a2738cb57943a336e044d934f24	옥스퍼드 사전 온라인에 따르면 인종주의는 "인종차별의 또 다른 용어"입니다.	train
common_voice_en_19417035.mp3	Coils are typically wound with enamelled copper wire, sometimes termed magnet wire.	c895f6ffc789443e064895d7a9eef515f9c01c86ff78b4141d2428a6fab1f9a4a6a52723124cba3640a86204d4ff027b96172a2738cb57943a336e044d934f24	코일은 일반적으로 자석 와이어라고도 하는 에나멜 처리된 구리 와이어로 감겨 있습니다.	train
common_voice_en_19417036.mp3	Aside from baseball, Hawkins also competed in basketball and football.	c895f6ffc789443e064895d7a9eef515f9c01c86ff78b4141d2428a6fab1f9a4a6a52723124cba3640a86204d4ff027b96172a2738cb57943a336e044d934f24	호킨스는 야구 외에도 농구와 축구에도 출전했습니다.	train
common_voice_en_19417037.mp3	They are very active, fast-growing and particularly attractive to tarantula hobbyists.	c895f6ffc789443e064895d7a9eef515f9c01c86ff78b4141d2428a6fab1f9a4a6a52723124cba3640a86204d4ff027b96172a2738cb57943a336e044d934f24	매우 활동적이고 빠르게 성장하며 특히 타란툴라 애호가들에게 매력적입니다.	train
common_voice_en_19417043.mp3	The bank was founded as Pennsylvania Savings Bank, by his grandfather.	c895f6ffc789443e064895d7a9eef515f9c01c86ff78b4141d2428a6fab1f9a4a6a52723124cba3640a86204d4ff027b96172a2738cb57943a336e044d934f24	이 은행은 그의 할아버지가 펜실베니아 저축은행으로 설립한 은행입니다.	train
common_voice_en_19417044.mp3	Legally, the entire system carries the name University of Arkansas.	c895f6ffc789443e064895d7a9eef515f9c01c86ff78b4141d2428a6fab1f9a4a6a52723124cba3640a86204d4ff027b96172a2738cb57943a336e044d934f24	법적으로 전체 시스템은 아칸소 대학교라는 이름을 사용합니다.	train
common_voice_en_19417045.mp3	It was partially funded by a foundation named for the Cooke Family.	c895f6ffc789443e064895d7a9eef515f9c01c86ff78b4141d2428a6fab1f9a4a6a52723124cba3640a86204d4ff027b96172a2738cb57943a336e044d934f24	쿡 가문의 이름을 딴 재단에서 일부 자금을 지원했습니다.	train
common_voice_en_19417046.mp3	He has also appeared in several movies and released nine albums.	c895f6ffc789443e064895d7a9eef515f9c01c86ff78b4141d2428a6fab1f9a4a6a52723124cba3640a86204d4ff027b96172a2738cb57943a336e044d934f24	또한 여러 영화에 출연하고 9개의 앨범을 발표했습니다.	train
common_voice_en_19417047.mp3	Estonians sent their four kings to Weissenstein accompanied by three squires.	c895f6ffc789443e064895d7a9eef515f9c01c86ff78b4141d2428a6fab1f9a4a6a52723124cba3640a86204d4ff027b96172a2738cb57943a336e044d934f24	에스토니아 사람들은 네 명의 왕과 세 명의 종자를 바이센슈타인으로 보냈습니다.	train
common_voice_en_19417048.mp3	Her line of dialogue consisted of one word, Look!	c895f6ffc789443e064895d7a9eef515f9c01c86ff78b4141d2428a6fab1f9a4a6a52723124cba3640a86204d4ff027b96172a2738cb57943a336e044d934f24	그녀의 대사는 "보세요!"라는 한 마디로 이루어졌습니다.	train
common_voice_en_19417049.mp3	"The episode also parodies the film ""Gettysburg"" which Parker and Stone disliked."	c895f6ffc789443e064895d7a9eef515f9c01c86ff78b4141d2428a6fab1f9a4a6a52723124cba3640a86204d4ff027b96172a2738cb57943a336e044d934f24	이 에피소드에서는 파커와 스톤이 싫어했던 영화 '게티스버그'를 패러디하기도 했습니다.	train
common_voice_en_19417050.mp3	He is interred in Arlington National Cemetery in Arlington, Virginia.	c895f6ffc789443e064895d7a9eef515f9c01c86ff78b4141d2428a6fab1f9a4a6a52723124cba3640a86204d4ff027b96172a2738cb57943a336e044d934f24	그는 버지니아주 알링턴에 있는 알링턴 국립묘지에 안장되어 있습니다.	train
common_voice_en_19417051.mp3	"He eventually became known as ""the Poughkeepsie Seer""."	c895f6ffc789443e064895d7a9eef515f9c01c86ff78b4141d2428a6fab1f9a4a6a52723124cba3640a86204d4ff027b96172a2738cb57943a336e044d934f24	그는 결국 '포킵시 선견자'라는 별명을 얻게 되었습니다.	train
