path	sentence	client_id	translation	split
common_voice_en_17555808.mp3	A filing case is now hard to buy.	2840e1708b3432b93a3c13007c994b48618f50fb6e18a8ef47c7a040ded1d934cddccc8e343d8daa0f7901270e04ba8fda6d44d090fbad3d02c501b265d6d73a	이제 파일링 케이스는 구매하기 어렵습니다.	train_covost
common_voice_en_17555818.mp3	His grandfather was an abusive alcoholic.	2840e1708b3432b93a3c13007c994b48618f50fb6e18a8ef47c7a040ded1d934cddccc8e343d8daa0f7901270e04ba8fda6d44d090fbad3d02c501b265d6d73a	그의 할아버지는 학대적인 알코올 중독자였습니다.	train_covost
common_voice_en_17555828.mp3	A smatter of French is worse than none.	2840e1708b3432b93a3c13007c994b48618f50fb6e18a8ef47c7a040ded1d934cddccc8e343d8daa0f7901270e04ba8fda6d44d090fbad3d02c501b265d6d73a	프랑스어가 적은 것은 없는 것만 못합니다.	train_covost
common_voice_en_17555836.mp3	The story of the city starts a few thousand years ago.	2840e1708b3432b93a3c13007c994b48618f50fb6e18a8ef47c7a040ded1d934cddccc8e343d8daa0f7901270e04ba8fda6d44d090fbad3d02c501b265d6d73a	이 도시의 이야기는 수천 년 전으로 거슬러 올라갑니다.	train_covost
common_voice_en_17555847.mp3	I love the fjords of Norway.	2840e1708b3432b93a3c13007c994b48618f50fb6e18a8ef47c7a040ded1d934cddccc8e343d8daa0f7901270e04ba8fda6d44d090fbad3d02c501b265d6d73a	저는 노르웨이의 피오르드를 좋아합니다.	train_covost
common_voice_en_17555851.mp3	I have a headache and a sore throat.	2840e1708b3432b93a3c13007c994b48618f50fb6e18a8ef47c7a040ded1d934cddccc8e343d8daa0f7901270e04ba8fda6d44d090fbad3d02c501b265d6d73a	두통과 목이 아파요.	train_covost
common_voice_en_17555868.mp3	Although the reduced capacity was justifiable in their opinion, they stayed the course.	2840e1708b3432b93a3c13007c994b48618f50fb6e18a8ef47c7a040ded1d934cddccc8e343d8daa0f7901270e04ba8fda6d44d090fbad3d02c501b265d6d73a	정원 감축은 정당한 조치라고 생각했지만, 그들은 그 방침을 고수했습니다.	train_covost
common_voice_en_17555894.mp3	"I'm letting her out of the house."	2840e1708b3432b93a3c13007c994b48618f50fb6e18a8ef47c7a040ded1d934cddccc8e343d8daa0f7901270e04ba8fda6d44d090fbad3d02c501b265d6d73a	그녀를 집 밖으로 내보낼 거예요.	train_covost
common_voice_en_17555965.mp3	There was a silence.	2840e1708b3432b93a3c13007c994b48618f50fb6e18a8ef47c7a040ded1d934cddccc8e343d8daa0f7901270e04ba8fda6d44d090fbad3d02c501b265d6d73a	침묵이 흘렀습니다.	train_covost
common_voice_en_17556009.mp3	She turned into her lachrymosity while visiting her grandparents.	2840e1708b3432b93a3c13007c994b48618f50fb6e18a8ef47c7a040ded1d934cddccc8e343d8daa0f7901270e04ba8fda6d44d090fbad3d02c501b265d6d73a	조부모님 댁을 방문했다가 유루증에 걸렸습니다.	train_covost
common_voice_en_17556010.mp3	Please make sure your recordings are not cut off.	2840e1708b3432b93a3c13007c994b48618f50fb6e18a8ef47c7a040ded1d934cddccc8e343d8daa0f7901270e04ba8fda6d44d090fbad3d02c501b265d6d73a	녹음이 끊어지지 않도록 주의하세요.	train_covost
common_voice_en_17556022.mp3	Content is health to the sick and riches to the poor.	2840e1708b3432b93a3c13007c994b48618f50fb6e18a8ef47c7a040ded1d934cddccc8e343d8daa0f7901270e04ba8fda6d44d090fbad3d02c501b265d6d73a	콘텐츠는 아픈 사람에게는 건강이 되고 가난한 사람에게는 풍요로움이 됩니다.	train_covost
common_voice_en_17556131.mp3	Thick glasses helped him read the print.	2840e1708b3432b93a3c13007c994b48618f50fb6e18a8ef47c7a040ded1d934cddccc8e343d8daa0f7901270e04ba8fda6d44d090fbad3d02c501b265d6d73a	두꺼운 안경이 글씨를 읽는 데 도움이 되었습니다.	train_covost
common_voice_en_17556146.mp3	"The term for these hidden costs is ""Externalities""."	2840e1708b3432b93a3c13007c994b48618f50fb6e18a8ef47c7a040ded1d934cddccc8e343d8daa0f7901270e04ba8fda6d44d090fbad3d02c501b265d6d73a	이러한 숨겨진 비용에 대한 용어는 "외부효과"입니다.	train_covost
common_voice_en_17556670.mp3	His Internet connection was too slow.	2840e1708b3432b93a3c13007c994b48618f50fb6e18a8ef47c7a040ded1d934cddccc8e343d8daa0f7901270e04ba8fda6d44d090fbad3d02c501b265d6d73a	인터넷 연결이 너무 느렸습니다.	train_covost
common_voice_en_17556693.mp3	Innocent as a new born babe.	2840e1708b3432b93a3c13007c994b48618f50fb6e18a8ef47c7a040ded1d934cddccc8e343d8daa0f7901270e04ba8fda6d44d090fbad3d02c501b265d6d73a	갓 태어난 아기처럼 순수합니다.	train_covost
common_voice_en_17556704.mp3	"It's too early to tell whether the strategy will pay off."	2840e1708b3432b93a3c13007c994b48618f50fb6e18a8ef47c7a040ded1d934cddccc8e343d8daa0f7901270e04ba8fda6d44d090fbad3d02c501b265d6d73a	이 전략이 성과를 거둘 수 있을지 말하기는 아직 이르다.	train_covost
common_voice_en_17636233.mp3	"That's often due to their nature."	2840e1708b3432b93a3c13007c994b48618f50fb6e18a8ef47c7a040ded1d934cddccc8e343d8daa0f7901270e04ba8fda6d44d090fbad3d02c501b265d6d73a	이는 종종 그 특성 때문이기도 합니다.	train_covost
common_voice_en_17636272.mp3	Some ads serve to cheat buyers.	2840e1708b3432b93a3c13007c994b48618f50fb6e18a8ef47c7a040ded1d934cddccc8e343d8daa0f7901270e04ba8fda6d44d090fbad3d02c501b265d6d73a	일부 광고는 구매자를 속이기 위해 게재됩니다.	train_covost
common_voice_en_17636283.mp3	The little town quickly evolved into a trade center between east and west.	2840e1708b3432b93a3c13007c994b48618f50fb6e18a8ef47c7a040ded1d934cddccc8e343d8daa0f7901270e04ba8fda6d44d090fbad3d02c501b265d6d73a	이 작은 마을은 동서양을 잇는 무역의 중심지로 빠르게 발전했습니다.	train_covost
common_voice_en_17636284.mp3	Keep your mouth shut and your eyes open.	2840e1708b3432b93a3c13007c994b48618f50fb6e18a8ef47c7a040ded1d934cddccc8e343d8daa0f7901270e04ba8fda6d44d090fbad3d02c501b265d6d73a	입을 다물고 눈을 크게 뜨세요.	train_covost
common_voice_en_17636296.mp3	The lake sparkled in the red hot sun.	2840e1708b3432b93a3c13007c994b48618f50fb6e18a8ef47c7a040ded1d934cddccc8e343d8daa0f7901270e04ba8fda6d44d090fbad3d02c501b265d6d73a	호수는 붉고 뜨거운 태양 아래 반짝반짝 빛났습니다.	train_covost
common_voice_en_17636303.mp3	The boy shook his head.	2840e1708b3432b93a3c13007c994b48618f50fb6e18a8ef47c7a040ded1d934cddccc8e343d8daa0f7901270e04ba8fda6d44d090fbad3d02c501b265d6d73a	소년은 고개를 저었다.	train_covost
common_voice_en_17636313.mp3	You know what I want.	2840e1708b3432b93a3c13007c994b48618f50fb6e18a8ef47c7a040ded1d934cddccc8e343d8daa0f7901270e04ba8fda6d44d090fbad3d02c501b265d6d73a	제가 원하는 게 뭔지 아시죠?	train_covost
common_voice_en_17636323.mp3	"It's wicked how Lara neglects her pussy cat."	2840e1708b3432b93a3c13007c994b48618f50fb6e18a8ef47c7a040ded1d934cddccc8e343d8daa0f7901270e04ba8fda6d44d090fbad3d02c501b265d6d73a	라라가 자신의 음부 고양이를 방치하는 건 정말 사악한 짓입니다.	train_covost
common_voice_en_17636338.mp3	Attack is the best form of defense.	2840e1708b3432b93a3c13007c994b48618f50fb6e18a8ef47c7a040ded1d934cddccc8e343d8daa0f7901270e04ba8fda6d44d090fbad3d02c501b265d6d73a	공격은 최고의 방어 수단입니다.	train_covost
common_voice_en_17636354.mp3	Every man is the architect of his destiny.	2840e1708b3432b93a3c13007c994b48618f50fb6e18a8ef47c7a040ded1d934cddccc8e343d8daa0f7901270e04ba8fda6d44d090fbad3d02c501b265d6d73a	모든 사람은 자신의 운명을 설계하는 사람입니다.	train_covost
common_voice_en_17636399.mp3	He who rises late must trot all day.	2840e1708b3432b93a3c13007c994b48618f50fb6e18a8ef47c7a040ded1d934cddccc8e343d8daa0f7901270e04ba8fda6d44d090fbad3d02c501b265d6d73a	늦게 일어나는 사람은 하루 종일 트로트를 불러야 합니다.	train_covost
common_voice_en_17684826.mp3	I understand you perfectly.	2840e1708b3432b93a3c13007c994b48618f50fb6e18a8ef47c7a040ded1d934cddccc8e343d8daa0f7901270e04ba8fda6d44d090fbad3d02c501b265d6d73a	완벽하게 이해합니다.	train_covost
common_voice_en_17684842.mp3	It takes a lot of help to finish these.	2840e1708b3432b93a3c13007c994b48618f50fb6e18a8ef47c7a040ded1d934cddccc8e343d8daa0f7901270e04ba8fda6d44d090fbad3d02c501b265d6d73a	이 작업을 완료하려면 많은 도움이 필요합니다.	train_covost
common_voice_en_17684886.mp3	She did not know.	2840e1708b3432b93a3c13007c994b48618f50fb6e18a8ef47c7a040ded1d934cddccc8e343d8daa0f7901270e04ba8fda6d44d090fbad3d02c501b265d6d73a	그녀는 몰랐습니다.	train_covost
common_voice_en_17684901.mp3	His heart sank as the jury returned a guilty verdict.	2840e1708b3432b93a3c13007c994b48618f50fb6e18a8ef47c7a040ded1d934cddccc8e343d8daa0f7901270e04ba8fda6d44d090fbad3d02c501b265d6d73a	배심원단이 유죄 평결을 내리자 그는 가슴이 내려앉았습니다.	train_covost
common_voice_en_17684941.mp3	What did you think?	2840e1708b3432b93a3c13007c994b48618f50fb6e18a8ef47c7a040ded1d934cddccc8e343d8daa0f7901270e04ba8fda6d44d090fbad3d02c501b265d6d73a	어떻게 생각하시나요?	train_covost
common_voice_en_17685051.mp3	It has gone now.	2840e1708b3432b93a3c13007c994b48618f50fb6e18a8ef47c7a040ded1d934cddccc8e343d8daa0f7901270e04ba8fda6d44d090fbad3d02c501b265d6d73a	이제 사라졌습니다.	train_covost
common_voice_en_17685086.mp3	The square peg will settle in the round hole.	2840e1708b3432b93a3c13007c994b48618f50fb6e18a8ef47c7a040ded1d934cddccc8e343d8daa0f7901270e04ba8fda6d44d090fbad3d02c501b265d6d73a	사각형 말뚝이 둥근 구멍에 고정됩니다.	train_covost
common_voice_en_17685140.mp3	The leaf drifts along with a slow spin.	2840e1708b3432b93a3c13007c994b48618f50fb6e18a8ef47c7a040ded1d934cddccc8e343d8daa0f7901270e04ba8fda6d44d090fbad3d02c501b265d6d73a	잎이 천천히 회전하면서 떠내려갑니다.	train_covost
common_voice_en_17685143.mp3	Constructing a cipher or hash to exhibit a substantial avalanche effect is one of its primary design objectives.	2840e1708b3432b93a3c13007c994b48618f50fb6e18a8ef47c7a040ded1d934cddccc8e343d8daa0f7901270e04ba8fda6d44d090fbad3d02c501b265d6d73a	상당한 눈사태 효과를 발휘하도록 암호 또는 해시를 구성하는 것이 주요 설계 목표 중 하나입니다.	train_covost
common_voice_en_17685144.mp3	We should celebrate our anniversary in the new karaoke bar.	2840e1708b3432b93a3c13007c994b48618f50fb6e18a8ef47c7a040ded1d934cddccc8e343d8daa0f7901270e04ba8fda6d44d090fbad3d02c501b265d6d73a	새 노래방에서 기념일을 축하해야겠어요.	train_covost
common_voice_en_17685152.mp3	This lamp is quite nice.	2840e1708b3432b93a3c13007c994b48618f50fb6e18a8ef47c7a040ded1d934cddccc8e343d8daa0f7901270e04ba8fda6d44d090fbad3d02c501b265d6d73a	이 램프는 꽤 멋지네요.	train_covost
common_voice_en_17716269.mp3	Team Four will meet up at point B with team Five.	2840e1708b3432b93a3c13007c994b48618f50fb6e18a8ef47c7a040ded1d934cddccc8e343d8daa0f7901270e04ba8fda6d44d090fbad3d02c501b265d6d73a	4팀은 5팀과 B 지점에서 만나게 됩니다.	train_covost
common_voice_en_17716271.mp3	Context is needed.	2840e1708b3432b93a3c13007c994b48618f50fb6e18a8ef47c7a040ded1d934cddccc8e343d8daa0f7901270e04ba8fda6d44d090fbad3d02c501b265d6d73a	컨텍스트가 필요합니다.	train_covost
common_voice_en_17716276.mp3	For example, two of the five bridges in the city today were built back then.	2840e1708b3432b93a3c13007c994b48618f50fb6e18a8ef47c7a040ded1d934cddccc8e343d8daa0f7901270e04ba8fda6d44d090fbad3d02c501b265d6d73a	예를 들어, 현재 도시에 있는 다섯 개의 다리 중 두 개는 당시 건설된 다리입니다.	train_covost
common_voice_en_17716299.mp3	Wisdom is better than strength.	2840e1708b3432b93a3c13007c994b48618f50fb6e18a8ef47c7a040ded1d934cddccc8e343d8daa0f7901270e04ba8fda6d44d090fbad3d02c501b265d6d73a	지혜는 힘보다 낫습니다.	train_covost
common_voice_en_17716419.mp3	Next Sunday is the twelfth of the month.	2840e1708b3432b93a3c13007c994b48618f50fb6e18a8ef47c7a040ded1d934cddccc8e343d8daa0f7901270e04ba8fda6d44d090fbad3d02c501b265d6d73a	다음 일요일은 매월 12일입니다.	train_covost
common_voice_en_17870066.mp3	High voltage!	2840e1708b3432b93a3c13007c994b48618f50fb6e18a8ef47c7a040ded1d934cddccc8e343d8daa0f7901270e04ba8fda6d44d090fbad3d02c501b265d6d73a	고전압!	train_covost
common_voice_en_17870173.mp3	Bit is the short term for binary digit.	2840e1708b3432b93a3c13007c994b48618f50fb6e18a8ef47c7a040ded1d934cddccc8e343d8daa0f7901270e04ba8fda6d44d090fbad3d02c501b265d6d73a	비트는 2진수의 줄임말입니다.	train_covost
common_voice_en_17962166.mp3	The experience in the coffin was literally immersive.	2840e1708b3432b93a3c13007c994b48618f50fb6e18a8ef47c7a040ded1d934cddccc8e343d8daa0f7901270e04ba8fda6d44d090fbad3d02c501b265d6d73a	관 안에서의 경험은 말 그대로 몰입감이 넘쳤습니다.	train_covost
common_voice_en_18129173.mp3	The discrete cosine transform is applied to blocks of eight by eight pixels.	2840e1708b3432b93a3c13007c994b48618f50fb6e18a8ef47c7a040ded1d934cddccc8e343d8daa0f7901270e04ba8fda6d44d090fbad3d02c501b265d6d73a	이산 코사인 변환은 8×8 픽셀의 블록에 적용됩니다.	train_covost
common_voice_en_18261062.mp3	When will you graduate?	2840e1708b3432b93a3c13007c994b48618f50fb6e18a8ef47c7a040ded1d934cddccc8e343d8daa0f7901270e04ba8fda6d44d090fbad3d02c501b265d6d73a	언제 졸업할 예정인가요?	train_covost
common_voice_en_18261064.mp3	We will continue to pursue the criminal until he is apprehended.	2840e1708b3432b93a3c13007c994b48618f50fb6e18a8ef47c7a040ded1d934cddccc8e343d8daa0f7901270e04ba8fda6d44d090fbad3d02c501b265d6d73a	범인이 검거될 때까지 계속해서 추적할 것입니다.	train_covost
common_voice_en_18261065.mp3	"True heroes don't profit from the suffering of others."	2840e1708b3432b93a3c13007c994b48618f50fb6e18a8ef47c7a040ded1d934cddccc8e343d8daa0f7901270e04ba8fda6d44d090fbad3d02c501b265d6d73a	진정한 영웅은 타인의 고통으로부터 이익을 얻지 않습니다.	train_covost
common_voice_en_18261066.mp3	"We're out of sellotape."	2840e1708b3432b93a3c13007c994b48618f50fb6e18a8ef47c7a040ded1d934cddccc8e343d8daa0f7901270e04ba8fda6d44d090fbad3d02c501b265d6d73a	셀로테이프가 다 떨어졌습니다.	train_covost
common_voice_en_18261069.mp3	All good things come to an end.	2840e1708b3432b93a3c13007c994b48618f50fb6e18a8ef47c7a040ded1d934cddccc8e343d8daa0f7901270e04ba8fda6d44d090fbad3d02c501b265d6d73a	모든 좋은 일에는 끝이 있습니다.	train_covost
common_voice_en_18261071.mp3	There is a lot of Literature on this subject.	2840e1708b3432b93a3c13007c994b48618f50fb6e18a8ef47c7a040ded1d934cddccc8e343d8daa0f7901270e04ba8fda6d44d090fbad3d02c501b265d6d73a	이 주제에 대한 많은 문헌이 있습니다.	train_covost
common_voice_en_18261075.mp3	Listen to my voice and think carefully.	2840e1708b3432b93a3c13007c994b48618f50fb6e18a8ef47c7a040ded1d934cddccc8e343d8daa0f7901270e04ba8fda6d44d090fbad3d02c501b265d6d73a	내 목소리에 귀를 기울이고 신중하게 생각하세요.	train_covost
common_voice_en_18261076.mp3	Clothes are folded and placed in a drawer.	2840e1708b3432b93a3c13007c994b48618f50fb6e18a8ef47c7a040ded1d934cddccc8e343d8daa0f7901270e04ba8fda6d44d090fbad3d02c501b265d6d73a	옷은 접어서 서랍에 넣습니다.	train_covost
common_voice_en_18261091.mp3	The paperwork was legible.	2840e1708b3432b93a3c13007c994b48618f50fb6e18a8ef47c7a040ded1d934cddccc8e343d8daa0f7901270e04ba8fda6d44d090fbad3d02c501b265d6d73a	서류는 읽기 쉬웠습니다.	train_covost
common_voice_en_18261097.mp3	Is it gluten-free?	2840e1708b3432b93a3c13007c994b48618f50fb6e18a8ef47c7a040ded1d934cddccc8e343d8daa0f7901270e04ba8fda6d44d090fbad3d02c501b265d6d73a	글루텐 프리인가요?	train_covost
common_voice_en_18261098.mp3	What would you have us called?	2840e1708b3432b93a3c13007c994b48618f50fb6e18a8ef47c7a040ded1d934cddccc8e343d8daa0f7901270e04ba8fda6d44d090fbad3d02c501b265d6d73a	저희를 뭐라고 부르시겠습니까?	train_covost
common_voice_en_18261116.mp3	Neither of these.	2840e1708b3432b93a3c13007c994b48618f50fb6e18a8ef47c7a040ded1d934cddccc8e343d8daa0f7901270e04ba8fda6d44d090fbad3d02c501b265d6d73a	둘 다 아닙니다.	train_covost
common_voice_en_18261125.mp3	New York City is a bustling metropolis.	2840e1708b3432b93a3c13007c994b48618f50fb6e18a8ef47c7a040ded1d934cddccc8e343d8daa0f7901270e04ba8fda6d44d090fbad3d02c501b265d6d73a	뉴욕은 분주한 대도시입니다.	train_covost
common_voice_en_18261129.mp3	Driving tests are nerve-racking.	2840e1708b3432b93a3c13007c994b48618f50fb6e18a8ef47c7a040ded1d934cddccc8e343d8daa0f7901270e04ba8fda6d44d090fbad3d02c501b265d6d73a	운전 테스트는 긴장되는 일입니다.	train_covost
common_voice_en_18261133.mp3	This is a stub page.	2840e1708b3432b93a3c13007c994b48618f50fb6e18a8ef47c7a040ded1d934cddccc8e343d8daa0f7901270e04ba8fda6d44d090fbad3d02c501b265d6d73a	이 페이지는 스텁 페이지입니다.	train_covost
common_voice_en_18261136.mp3	Some plastics consist of composite materials.	2840e1708b3432b93a3c13007c994b48618f50fb6e18a8ef47c7a040ded1d934cddccc8e343d8daa0f7901270e04ba8fda6d44d090fbad3d02c501b265d6d73a	일부 플라스틱은 복합 재료로 구성되어 있습니다.	train_covost
common_voice_en_18261142.mp3	Steel is easily recyclable.	2840e1708b3432b93a3c13007c994b48618f50fb6e18a8ef47c7a040ded1d934cddccc8e343d8daa0f7901270e04ba8fda6d44d090fbad3d02c501b265d6d73a	강철은 쉽게 재활용할 수 있습니다.	train_covost
common_voice_en_18261143.mp3	I will now accept questions from the floor.	2840e1708b3432b93a3c13007c994b48618f50fb6e18a8ef47c7a040ded1d934cddccc8e343d8daa0f7901270e04ba8fda6d44d090fbad3d02c501b265d6d73a	이제 플로어에서 질문을 받겠습니다.	train_covost
common_voice_en_18261145.mp3	I want to learn Zoology.	2840e1708b3432b93a3c13007c994b48618f50fb6e18a8ef47c7a040ded1d934cddccc8e343d8daa0f7901270e04ba8fda6d44d090fbad3d02c501b265d6d73a	동물학을 배우고 싶어요.	train_covost
common_voice_en_18261155.mp3	All this talk is making me hungry, shall we go out for lunch?	2840e1708b3432b93a3c13007c994b48618f50fb6e18a8ef47c7a040ded1d934cddccc8e343d8daa0f7901270e04ba8fda6d44d090fbad3d02c501b265d6d73a	얘기를 하다 보니 배가 고픈데 점심 먹으러 갈까요?	train_covost
common_voice_en_18261156.mp3	I suffer from carpal tunnel syndrome.	2840e1708b3432b93a3c13007c994b48618f50fb6e18a8ef47c7a040ded1d934cddccc8e343d8daa0f7901270e04ba8fda6d44d090fbad3d02c501b265d6d73a	손목 터널 증후군을 앓고 있습니다.	train_covost
common_voice_en_18261162.mp3	It was a gaping wound.	2840e1708b3432b93a3c13007c994b48618f50fb6e18a8ef47c7a040ded1d934cddccc8e343d8daa0f7901270e04ba8fda6d44d090fbad3d02c501b265d6d73a	상처가 벌어져 있었습니다.	train_covost
common_voice_en_18261164.mp3	There are no tricks here.	2840e1708b3432b93a3c13007c994b48618f50fb6e18a8ef47c7a040ded1d934cddccc8e343d8daa0f7901270e04ba8fda6d44d090fbad3d02c501b265d6d73a	여기에는 속임수가 없습니다.	train_covost
common_voice_en_18261171.mp3	Can you interpret this?	2840e1708b3432b93a3c13007c994b48618f50fb6e18a8ef47c7a040ded1d934cddccc8e343d8daa0f7901270e04ba8fda6d44d090fbad3d02c501b265d6d73a	이걸 해석할 수 있나요?	train_covost
common_voice_en_18261174.mp3	Separate the yolk from the egg.	2840e1708b3432b93a3c13007c994b48618f50fb6e18a8ef47c7a040ded1d934cddccc8e343d8daa0f7901270e04ba8fda6d44d090fbad3d02c501b265d6d73a	달걀에서 노른자를 분리합니다.	train_covost
common_voice_en_18261178.mp3	I pray you will get well soon.	2840e1708b3432b93a3c13007c994b48618f50fb6e18a8ef47c7a040ded1d934cddccc8e343d8daa0f7901270e04ba8fda6d44d090fbad3d02c501b265d6d73a	빨리 쾌차하시길 기도합니다.	train_covost
common_voice_en_18261180.mp3	I’ve got an extra large meat lover’s pizza, without the meat?	2840e1708b3432b93a3c13007c994b48618f50fb6e18a8ef47c7a040ded1d934cddccc8e343d8daa0f7901270e04ba8fda6d44d090fbad3d02c501b265d6d73a	고기가 없는 엑스트라 라지 사이즈의 고기 애호가용 피자를 주문할 수 있나요?	train_covost
common_voice_en_18261183.mp3	Press the asterisk key after the tone.	2840e1708b3432b93a3c13007c994b48618f50fb6e18a8ef47c7a040ded1d934cddccc8e343d8daa0f7901270e04ba8fda6d44d090fbad3d02c501b265d6d73a	신호음 뒤에 별표 키를 누릅니다.	train_covost
common_voice_en_18261184.mp3	The squirrel ran up the pine tree in a spiral.	2840e1708b3432b93a3c13007c994b48618f50fb6e18a8ef47c7a040ded1d934cddccc8e343d8daa0f7901270e04ba8fda6d44d090fbad3d02c501b265d6d73a	다람쥐는 나선형으로 소나무를 타고 올라갔습니다.	train_covost
common_voice_en_18261186.mp3	Refugees are normal people who have been displaced due to natural disaster or conflicts	2840e1708b3432b93a3c13007c994b48618f50fb6e18a8ef47c7a040ded1d934cddccc8e343d8daa0f7901270e04ba8fda6d44d090fbad3d02c501b265d6d73a	난민은 자연재해나 분쟁으로 인해 난민이 된 평범한 사람들입니다.	train_covost
common_voice_en_18261189.mp3	The score is deuce.	2840e1708b3432b93a3c13007c994b48618f50fb6e18a8ef47c7a040ded1d934cddccc8e343d8daa0f7901270e04ba8fda6d44d090fbad3d02c501b265d6d73a	점수는 듀스입니다.	train_covost
common_voice_en_18261193.mp3	Economists like predicting the Economy.	2840e1708b3432b93a3c13007c994b48618f50fb6e18a8ef47c7a040ded1d934cddccc8e343d8daa0f7901270e04ba8fda6d44d090fbad3d02c501b265d6d73a	경제학자들은 경제를 예측하는 것을 좋아합니다.	train_covost
common_voice_en_18261201.mp3	Sure, just grab whatever you need.	2840e1708b3432b93a3c13007c994b48618f50fb6e18a8ef47c7a040ded1d934cddccc8e343d8daa0f7901270e04ba8fda6d44d090fbad3d02c501b265d6d73a	물론, 필요한 것은 무엇이든 가져가세요.	train_covost
common_voice_en_18261209.mp3	Do you want your boss to like you?	2840e1708b3432b93a3c13007c994b48618f50fb6e18a8ef47c7a040ded1d934cddccc8e343d8daa0f7901270e04ba8fda6d44d090fbad3d02c501b265d6d73a	상사에게 호감을 얻고 싶으신가요?	train_covost
common_voice_en_18261210.mp3	A thing begun is half done.	2840e1708b3432b93a3c13007c994b48618f50fb6e18a8ef47c7a040ded1d934cddccc8e343d8daa0f7901270e04ba8fda6d44d090fbad3d02c501b265d6d73a	시작이 반입니다.	train_covost
common_voice_en_18261214.mp3	Please excuse me.	2840e1708b3432b93a3c13007c994b48618f50fb6e18a8ef47c7a040ded1d934cddccc8e343d8daa0f7901270e04ba8fda6d44d090fbad3d02c501b265d6d73a	실례합니다.	train_covost
common_voice_en_18261215.mp3	"Don't forget to add Basil."	2840e1708b3432b93a3c13007c994b48618f50fb6e18a8ef47c7a040ded1d934cddccc8e343d8daa0f7901270e04ba8fda6d44d090fbad3d02c501b265d6d73a	바질을 추가하는 것을 잊지 마세요.	train_covost
common_voice_en_18261216.mp3	Orient the table in the direction of the east wall.	2840e1708b3432b93a3c13007c994b48618f50fb6e18a8ef47c7a040ded1d934cddccc8e343d8daa0f7901270e04ba8fda6d44d090fbad3d02c501b265d6d73a	테이블의 방향을 동쪽 벽 방향으로 맞춥니다.	train_covost
common_voice_en_18261224.mp3	The tires became bald from heavy usage.	2840e1708b3432b93a3c13007c994b48618f50fb6e18a8ef47c7a040ded1d934cddccc8e343d8daa0f7901270e04ba8fda6d44d090fbad3d02c501b265d6d73a	과도한 사용으로 타이어가 마모되었습니다.	train_covost
common_voice_en_18261225.mp3	I was hoping you might be able to assist me with an acquisition.	2840e1708b3432b93a3c13007c994b48618f50fb6e18a8ef47c7a040ded1d934cddccc8e343d8daa0f7901270e04ba8fda6d44d090fbad3d02c501b265d6d73a	인수를 도와주실 수 있을까 해서요.	train_covost
common_voice_en_18261228.mp3	She has my utmost respect.	2840e1708b3432b93a3c13007c994b48618f50fb6e18a8ef47c7a040ded1d934cddccc8e343d8daa0f7901270e04ba8fda6d44d090fbad3d02c501b265d6d73a	진심으로 존경합니다.	train_covost
common_voice_en_18261229.mp3	Slice the aubergine.	2840e1708b3432b93a3c13007c994b48618f50fb6e18a8ef47c7a040ded1d934cddccc8e343d8daa0f7901270e04ba8fda6d44d090fbad3d02c501b265d6d73a	가지를 슬라이스합니다.	train_covost
common_voice_en_18261241.mp3	What can I do about my headache?	2840e1708b3432b93a3c13007c994b48618f50fb6e18a8ef47c7a040ded1d934cddccc8e343d8daa0f7901270e04ba8fda6d44d090fbad3d02c501b265d6d73a	두통은 어떻게 해야 하나요?	train_covost
common_voice_en_18261251.mp3	Slow down!	2840e1708b3432b93a3c13007c994b48618f50fb6e18a8ef47c7a040ded1d934cddccc8e343d8daa0f7901270e04ba8fda6d44d090fbad3d02c501b265d6d73a	천천히!	train_covost
common_voice_en_18261259.mp3	This is a safe place.	2840e1708b3432b93a3c13007c994b48618f50fb6e18a8ef47c7a040ded1d934cddccc8e343d8daa0f7901270e04ba8fda6d44d090fbad3d02c501b265d6d73a	이곳은 안전한 곳입니다.	train_covost
common_voice_en_18261260.mp3	I am feeling shattered.	2840e1708b3432b93a3c13007c994b48618f50fb6e18a8ef47c7a040ded1d934cddccc8e343d8daa0f7901270e04ba8fda6d44d090fbad3d02c501b265d6d73a	산산조각이 난 기분입니다.	train_covost
common_voice_en_18261267.mp3	It was a blessing in disguise.	2840e1708b3432b93a3c13007c994b48618f50fb6e18a8ef47c7a040ded1d934cddccc8e343d8daa0f7901270e04ba8fda6d44d090fbad3d02c501b265d6d73a	그것은 변장 속의 축복이었습니다.	train_covost
common_voice_en_18261268.mp3	Data is a vital ingredient of training machine learning models.	2840e1708b3432b93a3c13007c994b48618f50fb6e18a8ef47c7a040ded1d934cddccc8e343d8daa0f7901270e04ba8fda6d44d090fbad3d02c501b265d6d73a	데이터는 머신러닝 모델 학습의 핵심 요소입니다.	train_covost
common_voice_en_18261271.mp3	I would like to carve a wooden dolphin.	2840e1708b3432b93a3c13007c994b48618f50fb6e18a8ef47c7a040ded1d934cddccc8e343d8daa0f7901270e04ba8fda6d44d090fbad3d02c501b265d6d73a	나무 돌고래를 조각하고 싶어요.	train_covost
common_voice_en_18261278.mp3	It would be futile for a beginner to challenge a grandmaster.	2840e1708b3432b93a3c13007c994b48618f50fb6e18a8ef47c7a040ded1d934cddccc8e343d8daa0f7901270e04ba8fda6d44d090fbad3d02c501b265d6d73a	초보자가 그랜드마스터에게 도전하는 것은 무의미한 일입니다.	train_covost
