path	sentence	client_id	translation	split
common_voice_en_18561500.mp3	"""It is not true, monsieur,"" cried Celia earnestly."	381be909ff316356e4ae92d1902dff7c932f66f0c864fde9c7c21e7697759adbb52e924b4a10941546d8fbb2a7659fb795db90e6ad52681b236c76507df6d4d9	"사실이 아닙니다." 셀리아가 간절히 외쳤습니다.	train
common_voice_en_18561501.mp3	And pray has he done so?	381be909ff316356e4ae92d1902dff7c932f66f0c864fde9c7c21e7697759adbb52e924b4a10941546d8fbb2a7659fb795db90e6ad52681b236c76507df6d4d9	과연 그렇게 되었을까요?	train
common_voice_en_18561502.mp3	It is a rare Phenomenon.	381be909ff316356e4ae92d1902dff7c932f66f0c864fde9c7c21e7697759adbb52e924b4a10941546d8fbb2a7659fb795db90e6ad52681b236c76507df6d4d9	드문 현상입니다.	train
common_voice_en_18561503.mp3	I am not at all business-like.	381be909ff316356e4ae92d1902dff7c932f66f0c864fde9c7c21e7697759adbb52e924b4a10941546d8fbb2a7659fb795db90e6ad52681b236c76507df6d4d9	저는 전혀 비즈니스답지 않습니다.	train
common_voice_en_18561504.mp3	"You were found in a doorway, weren't you?"	381be909ff316356e4ae92d1902dff7c932f66f0c864fde9c7c21e7697759adbb52e924b4a10941546d8fbb2a7659fb795db90e6ad52681b236c76507df6d4d9	출입구에서 발견되셨죠?	train
common_voice_en_18561505.mp3	What time frame should we expect for it to be delivered?	381be909ff316356e4ae92d1902dff7c932f66f0c864fde9c7c21e7697759adbb52e924b4a10941546d8fbb2a7659fb795db90e6ad52681b236c76507df6d4d9	언제까지 배송될 것으로 예상하나요?	train
common_voice_en_18561506.mp3	That must be the reason you were so untidy in my dream	381be909ff316356e4ae92d1902dff7c932f66f0c864fde9c7c21e7697759adbb52e924b4a10941546d8fbb2a7659fb795db90e6ad52681b236c76507df6d4d9	그래서 내 꿈에서 네가 그렇게 지저분했던 거야?	train
common_voice_en_18561507.mp3	The hum from the streets, likewise, seems to swell into a shout.	381be909ff316356e4ae92d1902dff7c932f66f0c864fde9c7c21e7697759adbb52e924b4a10941546d8fbb2a7659fb795db90e6ad52681b236c76507df6d4d9	거리에서 들리는 윙윙거리는 소리도 마찬가지로 고함소리로 커지는 것 같습니다.	train
common_voice_en_18561508.mp3	I was in the dark there.	381be909ff316356e4ae92d1902dff7c932f66f0c864fde9c7c21e7697759adbb52e924b4a10941546d8fbb2a7659fb795db90e6ad52681b236c76507df6d4d9	그때는 어둠 속에 있었어요.	train
common_voice_en_18561509.mp3	Be cross to me if I deserve it.	381be909ff316356e4ae92d1902dff7c932f66f0c864fde9c7c21e7697759adbb52e924b4a10941546d8fbb2a7659fb795db90e6ad52681b236c76507df6d4d9	제가 그럴 자격이 있다면 저에게 십자가를 지세요.	train
common_voice_en_18561510.mp3	Alas, cultural differences meant they could not be together.	381be909ff316356e4ae92d1902dff7c932f66f0c864fde9c7c21e7697759adbb52e924b4a10941546d8fbb2a7659fb795db90e6ad52681b236c76507df6d4d9	아쉽게도 문화적 차이로 인해 두 사람은 함께할 수 없었습니다.	train_covost
common_voice_en_18561511.mp3	What a fatuous suggestion!	381be909ff316356e4ae92d1902dff7c932f66f0c864fde9c7c21e7697759adbb52e924b4a10941546d8fbb2a7659fb795db90e6ad52681b236c76507df6d4d9	참으로 쓸데없는 제안입니다!	train_covost
common_voice_en_18561532.mp3	Coffee is a type of Diuretics.	381be909ff316356e4ae92d1902dff7c932f66f0c864fde9c7c21e7697759adbb52e924b4a10941546d8fbb2a7659fb795db90e6ad52681b236c76507df6d4d9	커피는 이뇨제의 일종입니다.	train_covost
common_voice_en_18561534.mp3	But what he must have felt!	381be909ff316356e4ae92d1902dff7c932f66f0c864fde9c7c21e7697759adbb52e924b4a10941546d8fbb2a7659fb795db90e6ad52681b236c76507df6d4d9	하지만 그가 느꼈을 감정은 어떠했을까요!	train
common_voice_en_18561535.mp3	What a man!	381be909ff316356e4ae92d1902dff7c932f66f0c864fde9c7c21e7697759adbb52e924b4a10941546d8fbb2a7659fb795db90e6ad52681b236c76507df6d4d9	대단한 사람입니다!	train
common_voice_en_18561536.mp3	So he had got on in life, and here he was!	381be909ff316356e4ae92d1902dff7c932f66f0c864fde9c7c21e7697759adbb52e924b4a10941546d8fbb2a7659fb795db90e6ad52681b236c76507df6d4d9	그래서 그는 인생에 성공했고, 여기까지 왔습니다!	train
common_voice_en_18561542.mp3	Very vividly, sir.	381be909ff316356e4ae92d1902dff7c932f66f0c864fde9c7c21e7697759adbb52e924b4a10941546d8fbb2a7659fb795db90e6ad52681b236c76507df6d4d9	아주 생생하게 기억합니다.	train
common_voice_en_18561543.mp3	I looked at my watch, and saw that it was half-past ten.	381be909ff316356e4ae92d1902dff7c932f66f0c864fde9c7c21e7697759adbb52e924b4a10941546d8fbb2a7659fb795db90e6ad52681b236c76507df6d4d9	시계를 보니 10시가 반쯤 지났더군요.	train
common_voice_en_18561545.mp3	‘I don’t quite understand you,’ she said, as politely as she could.	381be909ff316356e4ae92d1902dff7c932f66f0c864fde9c7c21e7697759adbb52e924b4a10941546d8fbb2a7659fb795db90e6ad52681b236c76507df6d4d9	"저는 당신을 잘 이해하지 못합니다." 그녀는 최대한 정중하게 말했습니다.	train
common_voice_en_18561546.mp3	Small told me of the cat.	381be909ff316356e4ae92d1902dff7c932f66f0c864fde9c7c21e7697759adbb52e924b4a10941546d8fbb2a7659fb795db90e6ad52681b236c76507df6d4d9	스몰은 고양이 이야기를 들려주었습니다.	train_covost
common_voice_en_18561547.mp3	It may be difficult to make an algorithm completely bias-free.	381be909ff316356e4ae92d1902dff7c932f66f0c864fde9c7c21e7697759adbb52e924b4a10941546d8fbb2a7659fb795db90e6ad52681b236c76507df6d4d9	편향이 전혀 없는 알고리즘을 만드는 것은 어려울 수 있습니다.	train_covost
common_voice_en_18561552.mp3	My cricket bat has lasted over eighty games.	381be909ff316356e4ae92d1902dff7c932f66f0c864fde9c7c21e7697759adbb52e924b4a10941546d8fbb2a7659fb795db90e6ad52681b236c76507df6d4d9	제 크리켓 배트는 80경기 이상 지속되었습니다.	train_covost
common_voice_en_18561553.mp3	The woman was urging her to be quick.	381be909ff316356e4ae92d1902dff7c932f66f0c864fde9c7c21e7697759adbb52e924b4a10941546d8fbb2a7659fb795db90e6ad52681b236c76507df6d4d9	여자는 서둘러 달라고 재촉하고 있었습니다.	train
common_voice_en_18561554.mp3	The interface between the computer and the cable is broken.	381be909ff316356e4ae92d1902dff7c932f66f0c864fde9c7c21e7697759adbb52e924b4a10941546d8fbb2a7659fb795db90e6ad52681b236c76507df6d4d9	컴퓨터와 케이블 사이의 인터페이스가 손상되었습니다.	train
common_voice_en_18561555.mp3	Body language is a behavioral language that can be visually understood.	381be909ff316356e4ae92d1902dff7c932f66f0c864fde9c7c21e7697759adbb52e924b4a10941546d8fbb2a7659fb795db90e6ad52681b236c76507df6d4d9	보디랭귀지는 시각적으로 이해할 수 있는 행동 언어입니다.	train
common_voice_en_18561556.mp3	That I can tell you.	381be909ff316356e4ae92d1902dff7c932f66f0c864fde9c7c21e7697759adbb52e924b4a10941546d8fbb2a7659fb795db90e6ad52681b236c76507df6d4d9	제가 말씀드릴 수 있습니다.	train_covost
common_voice_en_18561563.mp3	Women had fooled men before today.	381be909ff316356e4ae92d1902dff7c932f66f0c864fde9c7c21e7697759adbb52e924b4a10941546d8fbb2a7659fb795db90e6ad52681b236c76507df6d4d9	오늘날까지 여성은 남성을 속여 왔습니다.	train
common_voice_en_18561564.mp3	Behind the room a door led into a little white-tiled bathroom.	381be909ff316356e4ae92d1902dff7c932f66f0c864fde9c7c21e7697759adbb52e924b4a10941546d8fbb2a7659fb795db90e6ad52681b236c76507df6d4d9	방 뒤에는 작은 흰색 타일로 된 욕실로 통하는 문이 있었습니다.	train_covost
common_voice_en_18561565.mp3	You are right, my child.	381be909ff316356e4ae92d1902dff7c932f66f0c864fde9c7c21e7697759adbb52e924b4a10941546d8fbb2a7659fb795db90e6ad52681b236c76507df6d4d9	네 말이 맞다, 우리 아이.	train_covost
