path	sentence	client_id	translation	split
common_voice_en_18684090.mp3	A public boat ramp is located on the Avon Park Lakes side.	f7b06c3f58a80ed5ec59993194389d73fc89c44258cd3b97cee81ec3284647bf4d0270a7edf3e02c0b4b2a2df6b7096d6d6c03e760ead202b8f1015add7e21a2	공공 보트 경사로가 에이번 파크 호수 쪽에 있습니다.	train
common_voice_en_19960661.mp3	"Wilson's push was virtually halted following his match at Destination X."	f983ee9314237ed75fac6a69403fe7ecb9fccd8760ce2e6f5cb6e0b34592aba3583167a31af2e53b988450780d84836052cb2cddd07a467b019610ae2fbd1496	윌슨의 밀어붙이기는 데스티네이션 X에서의 경기 이후 사실상 중단되었습니다.	train
common_voice_en_19960663.mp3	He was a consort of Bricta.	f983ee9314237ed75fac6a69403fe7ecb9fccd8760ce2e6f5cb6e0b34592aba3583167a31af2e53b988450780d84836052cb2cddd07a467b019610ae2fbd1496	그는 브릭타의 배우자였습니다.	train
common_voice_en_19960667.mp3	Bus services are provided by Metro.	f983ee9314237ed75fac6a69403fe7ecb9fccd8760ce2e6f5cb6e0b34592aba3583167a31af2e53b988450780d84836052cb2cddd07a467b019610ae2fbd1496	버스 서비스는 Metro에서 제공합니다.	train
common_voice_en_19960669.mp3	"As Anderssen's Opening is not commonly played, it is considered an irregular opening."	f983ee9314237ed75fac6a69403fe7ecb9fccd8760ce2e6f5cb6e0b34592aba3583167a31af2e53b988450780d84836052cb2cddd07a467b019610ae2fbd1496	안데르센의 오프닝은 일반적으로 연주되지 않기 때문에 비정기적인 오프닝으로 간주됩니다.	train
common_voice_en_19960670.mp3	He also produced several of his later films.	f983ee9314237ed75fac6a69403fe7ecb9fccd8760ce2e6f5cb6e0b34592aba3583167a31af2e53b988450780d84836052cb2cddd07a467b019610ae2fbd1496	그는 이후에도 여러 편의 영화를 제작했습니다.	train
common_voice_en_19960816.mp3	The plant grows from a central, budding, fleshy structure with fleshy, radiating roots.	f983ee9314237ed75fac6a69403fe7ecb9fccd8760ce2e6f5cb6e0b34592aba3583167a31af2e53b988450780d84836052cb2cddd07a467b019610ae2fbd1496	이 식물은 다육하고 방사형 뿌리를 가진 중앙의 싹이 트고 다육한 구조에서 자랍니다.	train
common_voice_en_19960817.mp3	"God is, as Whitehead says, ""the fellow sufferer who understands."""	f983ee9314237ed75fac6a69403fe7ecb9fccd8760ce2e6f5cb6e0b34592aba3583167a31af2e53b988450780d84836052cb2cddd07a467b019610ae2fbd1496	화이트헤드의 말처럼 신은 '이해하는 동료 고통자'입니다.	train
common_voice_en_19960819.mp3	Ten years later, his adoptive sister is turned to stone by an evil mage.	f983ee9314237ed75fac6a69403fe7ecb9fccd8760ce2e6f5cb6e0b34592aba3583167a31af2e53b988450780d84836052cb2cddd07a467b019610ae2fbd1496	10년 후, 그의 양녀는 사악한 마법사에 의해 돌로 변해버립니다.	train
common_voice_en_19960838.mp3	Rick and Bubba call themselves The Two Sexiest Fat Men Alive.	f983ee9314237ed75fac6a69403fe7ecb9fccd8760ce2e6f5cb6e0b34592aba3583167a31af2e53b988450780d84836052cb2cddd07a467b019610ae2fbd1496	릭과 버바는 스스로를 '세상에서 가장 섹시한 두 뚱뚱한 남자'라고 부릅니다.	train
common_voice_en_19960839.mp3	He began to focus more on writing.	f983ee9314237ed75fac6a69403fe7ecb9fccd8760ce2e6f5cb6e0b34592aba3583167a31af2e53b988450780d84836052cb2cddd07a467b019610ae2fbd1496	그는 글쓰기에 더 집중하기 시작했습니다.	train
common_voice_en_19960972.mp3	McCrone was also involved in other notable historical inquiries.	f983ee9314237ed75fac6a69403fe7ecb9fccd8760ce2e6f5cb6e0b34592aba3583167a31af2e53b988450780d84836052cb2cddd07a467b019610ae2fbd1496	맥크론은 다른 주목할 만한 역사적 조사에도 참여했습니다.	train
common_voice_en_19960973.mp3	The island is made up of Old Red Sandstone with some basaltic intrusions.	f983ee9314237ed75fac6a69403fe7ecb9fccd8760ce2e6f5cb6e0b34592aba3583167a31af2e53b988450780d84836052cb2cddd07a467b019610ae2fbd1496	이 섬은 현무암이 일부 침입한 오래된 붉은 사암으로 이루어져 있습니다.	train
common_voice_en_19960981.mp3	Lewes proudly claims to be The First Town in The First State.	f983ee9314237ed75fac6a69403fe7ecb9fccd8760ce2e6f5cb6e0b34592aba3583167a31af2e53b988450780d84836052cb2cddd07a467b019610ae2fbd1496	루이스는 첫 번째 주의 첫 번째 마을이라고 자랑스럽게 주장합니다.	train
common_voice_en_20069421.mp3	He was born in San Salvador.	f983ee9314237ed75fac6a69403fe7ecb9fccd8760ce2e6f5cb6e0b34592aba3583167a31af2e53b988450780d84836052cb2cddd07a467b019610ae2fbd1496	그는 산살바도르에서 태어났습니다.	train
common_voice_en_20069422.mp3	The Bonn Conference also provided a roadmap for subsequent political developments.	f983ee9314237ed75fac6a69403fe7ecb9fccd8760ce2e6f5cb6e0b34592aba3583167a31af2e53b988450780d84836052cb2cddd07a467b019610ae2fbd1496	본 회의는 또한 후속 정치 발전을 위한 로드맵을 제공했습니다.	train
common_voice_en_20069423.mp3	The time periods where the national team earned medals have been quite streaky.	f983ee9314237ed75fac6a69403fe7ecb9fccd8760ce2e6f5cb6e0b34592aba3583167a31af2e53b988450780d84836052cb2cddd07a467b019610ae2fbd1496	대표팀이 메달을 획득한 시기는 꽤 연속적이었습니다.	train
common_voice_en_20069425.mp3	This has led to the investigation of its phytochemistry.	f983ee9314237ed75fac6a69403fe7ecb9fccd8760ce2e6f5cb6e0b34592aba3583167a31af2e53b988450780d84836052cb2cddd07a467b019610ae2fbd1496	이로 인해 식물 화학에 대한 연구가 진행되었습니다.	train
common_voice_en_20069436.mp3	"The station was part of V's proposed takeover by Remstar."	f983ee9314237ed75fac6a69403fe7ecb9fccd8760ce2e6f5cb6e0b34592aba3583167a31af2e53b988450780d84836052cb2cddd07a467b019610ae2fbd1496	이 방송국은 V가 렘스타에 인수 제안을 했던 곳 중 하나였습니다.	train
common_voice_en_20069437.mp3	"Edward's ribauldequins had twelve barrels which fired salvoes of twelve balls."	f983ee9314237ed75fac6a69403fe7ecb9fccd8760ce2e6f5cb6e0b34592aba3583167a31af2e53b988450780d84836052cb2cddd07a467b019610ae2fbd1496	에드워드의 리볼데퀸에는 12개의 포신으로 12발의 포탄을 발사하는 포신이 있었습니다.	train
common_voice_en_20069438.mp3	Clara Dawes had no children.	f983ee9314237ed75fac6a69403fe7ecb9fccd8760ce2e6f5cb6e0b34592aba3583167a31af2e53b988450780d84836052cb2cddd07a467b019610ae2fbd1496	클라라 도스에게는 자녀가 없었습니다.	train
common_voice_en_20069439.mp3	It is one of the largest investors in emerging market equities.	f983ee9314237ed75fac6a69403fe7ecb9fccd8760ce2e6f5cb6e0b34592aba3583167a31af2e53b988450780d84836052cb2cddd07a467b019610ae2fbd1496	이머징 마켓 주식의 최대 투자자 중 하나입니다.	train
common_voice_en_20069440.mp3	They live at to deep, with only a few species preferring shallower, coastal waters.	f983ee9314237ed75fac6a69403fe7ecb9fccd8760ce2e6f5cb6e0b34592aba3583167a31af2e53b988450780d84836052cb2cddd07a467b019610ae2fbd1496	수심 깊은 곳에 서식하며, 얕은 연안 해역을 선호하는 종은 소수에 불과합니다.	train
common_voice_en_19630867.mp3	After the competition, the students continue to the homestay in Vladimir.	fdf0df76b287ef6d4405d81a740d3adaf9308b9feeceb55a0e58a4f82852f21a45f4255fde374b857c2e994020205692012ef84db6ccfe9bef7b9ba58853f3a2	대회가 끝난 후 학생들은 블라디미르에서 홈스테이를 계속합니다.	train
common_voice_en_19630868.mp3	"It is the first ""Castlevania"" title for the system."	fdf0df76b287ef6d4405d81a740d3adaf9308b9feeceb55a0e58a4f82852f21a45f4255fde374b857c2e994020205692012ef84db6ccfe9bef7b9ba58853f3a2	시스템 최초의 "캐슬바니아" 타이틀입니다.	train
common_voice_en_19630871.mp3	Narcissus Geyser is part of the Pink Cone Group.	fdf0df76b287ef6d4405d81a740d3adaf9308b9feeceb55a0e58a4f82852f21a45f4255fde374b857c2e994020205692012ef84db6ccfe9bef7b9ba58853f3a2	수선화 간헐천은 핑크 콘 그룹에 속해 있습니다.	train
common_voice_en_19630873.mp3	Delgado scored a goal and added three assists in his year with Colorado.	fdf0df76b287ef6d4405d81a740d3adaf9308b9feeceb55a0e58a4f82852f21a45f4255fde374b857c2e994020205692012ef84db6ccfe9bef7b9ba58853f3a2	델가도는 콜로라도에서 한 해 동안 1골을 넣고 3어시스트를 추가했습니다.	train
common_voice_en_19630875.mp3	The paper was formerly owned by Brown Publishing Company and Amos Press.	fdf0df76b287ef6d4405d81a740d3adaf9308b9feeceb55a0e58a4f82852f21a45f4255fde374b857c2e994020205692012ef84db6ccfe9bef7b9ba58853f3a2	이 신문은 이전에 브라운 출판사와 아모스 프레스가 소유하고 있었습니다.	train
common_voice_en_19720894.mp3	The clothing was soaked with his blood.	fdf0df76b287ef6d4405d81a740d3adaf9308b9feeceb55a0e58a4f82852f21a45f4255fde374b857c2e994020205692012ef84db6ccfe9bef7b9ba58853f3a2	옷은 그의 피로 흠뻑 젖어 있었습니다.	train
common_voice_en_19720895.mp3	Only a few of her films survive today.	fdf0df76b287ef6d4405d81a740d3adaf9308b9feeceb55a0e58a4f82852f21a45f4255fde374b857c2e994020205692012ef84db6ccfe9bef7b9ba58853f3a2	현재 그녀의 영화 중 몇 편만이 남아 있습니다.	train
common_voice_en_19720897.mp3	"According to De Niro, under no circumstances would United Artists accept Martin's script."	fdf0df76b287ef6d4405d81a740d3adaf9308b9feeceb55a0e58a4f82852f21a45f4255fde374b857c2e994020205692012ef84db6ccfe9bef7b9ba58853f3a2	드 니로에 따르면 유나이티드 아티스트는 어떤 상황에서도 마틴의 대본을 받아들이지 않았습니다.	train
common_voice_en_19720899.mp3	Mare Anguis can be seen northeast of Mare Crisium.	fdf0df76b287ef6d4405d81a740d3adaf9308b9feeceb55a0e58a4f82852f21a45f4255fde374b857c2e994020205692012ef84db6ccfe9bef7b9ba58853f3a2	마레 앙구이는 마레 크리시움의 북동쪽에서 볼 수 있습니다.	train
common_voice_en_19720944.mp3	Brochures and ticket sales can also be sponsored.	fdf0df76b287ef6d4405d81a740d3adaf9308b9feeceb55a0e58a4f82852f21a45f4255fde374b857c2e994020205692012ef84db6ccfe9bef7b9ba58853f3a2	브로셔 및 티켓 판매도 후원할 수 있습니다.	train
common_voice_en_19720945.mp3	Sal Bando singled home North to tie it.	fdf0df76b287ef6d4405d81a740d3adaf9308b9feeceb55a0e58a4f82852f21a45f4255fde374b857c2e994020205692012ef84db6ccfe9bef7b9ba58853f3a2	살 반도가 북쪽에서 홈런을 쳐 동점을 만들었습니다.	train
common_voice_en_19720946.mp3	Some devices can destroy entire star systems.	fdf0df76b287ef6d4405d81a740d3adaf9308b9feeceb55a0e58a4f82852f21a45f4255fde374b857c2e994020205692012ef84db6ccfe9bef7b9ba58853f3a2	일부 장치는 전체 별 시스템을 파괴할 수 있습니다.	train
common_voice_en_19720979.mp3	The valley heights have hiking trails owned by the state for public use.	fdf0df76b287ef6d4405d81a740d3adaf9308b9feeceb55a0e58a4f82852f21a45f4255fde374b857c2e994020205692012ef84db6ccfe9bef7b9ba58853f3a2	계곡 고지대에는 주정부 소유의 공공용 하이킹 코스가 있습니다.	train
common_voice_en_19720980.mp3	On the third day takes place the coronation of the Queen of Carnival.	fdf0df76b287ef6d4405d81a740d3adaf9308b9feeceb55a0e58a4f82852f21a45f4255fde374b857c2e994020205692012ef84db6ccfe9bef7b9ba58853f3a2	셋째 날에는 카니발의 여왕 대관식이 열립니다.	train
common_voice_en_19720981.mp3	The council also included Liberal Democrats and Independents.	fdf0df76b287ef6d4405d81a740d3adaf9308b9feeceb55a0e58a4f82852f21a45f4255fde374b857c2e994020205692012ef84db6ccfe9bef7b9ba58853f3a2	이 위원회에는 자유민주당과 무소속 의원도 포함되었습니다.	train
common_voice_en_19720982.mp3	The play spawned two film adaptations.	fdf0df76b287ef6d4405d81a740d3adaf9308b9feeceb55a0e58a4f82852f21a45f4255fde374b857c2e994020205692012ef84db6ccfe9bef7b9ba58853f3a2	이 연극은 두 편의 영화로도 제작되었습니다.	train
common_voice_en_19720983.mp3	The turnout was lowest of any country in the European Union.	fdf0df76b287ef6d4405d81a740d3adaf9308b9feeceb55a0e58a4f82852f21a45f4255fde374b857c2e994020205692012ef84db6ccfe9bef7b9ba58853f3a2	투표율은 유럽연합 국가 중 가장 낮은 투표율을 기록했습니다.	train
common_voice_en_19857509.mp3	His more recent work in this area has been distributed as patches against nvi.	fdf0df76b287ef6d4405d81a740d3adaf9308b9feeceb55a0e58a4f82852f21a45f4255fde374b857c2e994020205692012ef84db6ccfe9bef7b9ba58853f3a2	이 분야에 대한 그의 최근 작업은 nvi에 대한 패치로 배포되었습니다.	train
common_voice_en_19857510.mp3	He was educated at the Ecole Polytechnique in Paris.	fdf0df76b287ef6d4405d81a740d3adaf9308b9feeceb55a0e58a4f82852f21a45f4255fde374b857c2e994020205692012ef84db6ccfe9bef7b9ba58853f3a2	파리의 에콜 폴리테크니크에서 교육을 받았습니다.	train
common_voice_en_19857511.mp3	Legs must be locked, with toes pointing away from the body.	fdf0df76b287ef6d4405d81a740d3adaf9308b9feeceb55a0e58a4f82852f21a45f4255fde374b857c2e994020205692012ef84db6ccfe9bef7b9ba58853f3a2	다리를 고정하고 발가락이 몸에서 바깥쪽을 향하도록 해야 합니다.	train
common_voice_en_19857512.mp3	The two goddesses then fought over the fate of their creations.	fdf0df76b287ef6d4405d81a740d3adaf9308b9feeceb55a0e58a4f82852f21a45f4255fde374b857c2e994020205692012ef84db6ccfe9bef7b9ba58853f3a2	그 후 두 여신은 창조물의 운명을 놓고 싸웠습니다.	train
common_voice_en_19857513.mp3	It has been a very painful journey.	fdf0df76b287ef6d4405d81a740d3adaf9308b9feeceb55a0e58a4f82852f21a45f4255fde374b857c2e994020205692012ef84db6ccfe9bef7b9ba58853f3a2	매우 고통스러운 여정이었습니다.	train
common_voice_en_20038753.mp3	"Even the ""Saudi Gazette"" described the doubles match as a ""thrilling"" win."	fe767ba1ccb2347ddd7229a3503574ebedba03437efbe53532759fb8cc8afdc98ad208132531aa7609435005d8c9e974911d6bc17dc5201bf40c91c42b331794	'사우디 가제트'에서도 이 복식 경기를 '짜릿한' 승리로 묘사했습니다.	train
common_voice_en_20038754.mp3	Tridecanes are combustible colourless liquids.	fe767ba1ccb2347ddd7229a3503574ebedba03437efbe53532759fb8cc8afdc98ad208132531aa7609435005d8c9e974911d6bc17dc5201bf40c91c42b331794	트라이데칸은 가연성 무색 액체입니다.	train
common_voice_en_20038758.mp3	It was named for the Ohio River, which defines its eastern border.	fe767ba1ccb2347ddd7229a3503574ebedba03437efbe53532759fb8cc8afdc98ad208132531aa7609435005d8c9e974911d6bc17dc5201bf40c91c42b331794	동쪽 경계를 정의하는 오하이오 강에서 이름을 따왔습니다.	train
common_voice_en_20038760.mp3	"The caterpillars are accordingly called loopers, spanworms, or inchworms' after their characteristic looping gait."	fe767ba1ccb2347ddd7229a3503574ebedba03437efbe53532759fb8cc8afdc98ad208132531aa7609435005d8c9e974911d6bc17dc5201bf40c91c42b331794	따라서 애벌레는 특징적인 반복 걸음걸이의 이름을 따서 루퍼, 스팬웜 또는 인치웜이라고 불립니다.	train
common_voice_en_20038790.mp3	The lush foliage will take the breath away from first time mountaineers.	fe767ba1ccb2347ddd7229a3503574ebedba03437efbe53532759fb8cc8afdc98ad208132531aa7609435005d8c9e974911d6bc17dc5201bf40c91c42b331794	무성한 단풍은 처음 등산을 하는 분들의 숨을 멎게 할 것입니다.	train
common_voice_en_20038791.mp3	"He supported the Aedui's preexisting alliance with Rome."	fe767ba1ccb2347ddd7229a3503574ebedba03437efbe53532759fb8cc8afdc98ad208132531aa7609435005d8c9e974911d6bc17dc5201bf40c91c42b331794	그는 아에두이와 로마의 기존 동맹을 지지했습니다.	train
common_voice_en_20038792.mp3	It also includes the western shores of Lake Pontchartrain.	fe767ba1ccb2347ddd7229a3503574ebedba03437efbe53532759fb8cc8afdc98ad208132531aa7609435005d8c9e974911d6bc17dc5201bf40c91c42b331794	퐁샤르트랭 호수의 서쪽 기슭도 포함되어 있습니다.	train
common_voice_en_20038794.mp3	Clay is married to Becki Hine.	fe767ba1ccb2347ddd7229a3503574ebedba03437efbe53532759fb8cc8afdc98ad208132531aa7609435005d8c9e974911d6bc17dc5201bf40c91c42b331794	클레이는 베키 하인과 결혼했습니다.	train
common_voice_en_20038833.mp3	Isfahani carpets are known for their high quality.	fe767ba1ccb2347ddd7229a3503574ebedba03437efbe53532759fb8cc8afdc98ad208132531aa7609435005d8c9e974911d6bc17dc5201bf40c91c42b331794	이스파하니 카펫은 높은 품질로 유명합니다.	train
common_voice_en_20038834.mp3	Chris Claremont, left after three issues due to creative differences with editor Bob Harras.	fe767ba1ccb2347ddd7229a3503574ebedba03437efbe53532759fb8cc8afdc98ad208132531aa7609435005d8c9e974911d6bc17dc5201bf40c91c42b331794	크리스 클레어몬트, 편집자 밥 하라스와의 크리에이티브 의견 차이로 세 번의 이슈를 끝으로 떠났습니다.	train
common_voice_en_20038835.mp3	Her egalitarian upbringing with her cousins helped contribute to her sense of natural equality.	fe767ba1ccb2347ddd7229a3503574ebedba03437efbe53532759fb8cc8afdc98ad208132531aa7609435005d8c9e974911d6bc17dc5201bf40c91c42b331794	사촌들과 함께 평등주의적으로 성장한 덕분에 자연스럽게 평등 의식을 갖게 되었습니다.	train
common_voice_en_20038836.mp3	McHenry has proposed two laws.	fe767ba1ccb2347ddd7229a3503574ebedba03437efbe53532759fb8cc8afdc98ad208132531aa7609435005d8c9e974911d6bc17dc5201bf40c91c42b331794	맥헨리는 두 가지 법률을 제안했습니다.	train
common_voice_en_20038837.mp3	"""Musicians listed in order of appearance on each track""."	fe767ba1ccb2347ddd7229a3503574ebedba03437efbe53532759fb8cc8afdc98ad208132531aa7609435005d8c9e974911d6bc17dc5201bf40c91c42b331794	"각 트랙에 등장하는 순서대로 나열된 뮤지션".	train
common_voice_en_20038843.mp3	Smirnov died nine days later.	fe767ba1ccb2347ddd7229a3503574ebedba03437efbe53532759fb8cc8afdc98ad208132531aa7609435005d8c9e974911d6bc17dc5201bf40c91c42b331794	9일 후 스미르노프는 사망했습니다.	train
common_voice_en_20038844.mp3	On Mount Athos the Julian calendar is used to this day.	fe767ba1ccb2347ddd7229a3503574ebedba03437efbe53532759fb8cc8afdc98ad208132531aa7609435005d8c9e974911d6bc17dc5201bf40c91c42b331794	아토스 산에서는 오늘날까지 율리우스력을 사용하고 있습니다.	train
common_voice_en_20038845.mp3	Dering Way, Gravesend is the second largest campus.	fe767ba1ccb2347ddd7229a3503574ebedba03437efbe53532759fb8cc8afdc98ad208132531aa7609435005d8c9e974911d6bc17dc5201bf40c91c42b331794	데링 웨이, 그레이브스엔드는 두 번째로 큰 캠퍼스입니다.	train
common_voice_en_20038846.mp3	The team is rounded out by Nash, Nowitzki, Ray Allen, and Shawn Marion.	fe767ba1ccb2347ddd7229a3503574ebedba03437efbe53532759fb8cc8afdc98ad208132531aa7609435005d8c9e974911d6bc17dc5201bf40c91c42b331794	내쉬, 노비츠키, 레이 앨런, 숀 매리언이 팀을 완성합니다.	train
common_voice_en_20038847.mp3	His dire wolf is called Grey Wind.	fe767ba1ccb2347ddd7229a3503574ebedba03437efbe53532759fb8cc8afdc98ad208132531aa7609435005d8c9e974911d6bc17dc5201bf40c91c42b331794	그의 무시무시한 늑대는 회색 바람이라고 불립니다.	train
common_voice_en_20038865.mp3	The case of finite groups is most often studied.	fe767ba1ccb2347ddd7229a3503574ebedba03437efbe53532759fb8cc8afdc98ad208132531aa7609435005d8c9e974911d6bc17dc5201bf40c91c42b331794	유한 그룹의 경우가 가장 자주 연구됩니다.	train
common_voice_en_20038866.mp3	Few settlers came to Broome until after the American Revolution.	fe767ba1ccb2347ddd7229a3503574ebedba03437efbe53532759fb8cc8afdc98ad208132531aa7609435005d8c9e974911d6bc17dc5201bf40c91c42b331794	미국 독립 혁명 이후까지 브룸에 정착한 사람은 거의 없었습니다.	train
common_voice_en_20038868.mp3	It offers a full range of courses from pre-kindergarten to International Baccalaureate Diploma.	fe767ba1ccb2347ddd7229a3503574ebedba03437efbe53532759fb8cc8afdc98ad208132531aa7609435005d8c9e974911d6bc17dc5201bf40c91c42b331794	유치원부터 국제 바칼로레아 디플로마까지 다양한 과정을 제공합니다.	train
common_voice_en_20038869.mp3	The congregation set up a one-room apartment for them behind the chapel.	fe767ba1ccb2347ddd7229a3503574ebedba03437efbe53532759fb8cc8afdc98ad208132531aa7609435005d8c9e974911d6bc17dc5201bf40c91c42b331794	교회는 예배당 뒤편에 이들을 위한 원룸 아파트를 마련했습니다.	train
common_voice_en_19376989.mp3	She also pursued policies aimed at raising the levels of education throughout the country.	ff16788afc1f0af464bfb084e806c9966efc1e5b14c26412618fe60dce508eccc909db109542c53c8646757de3c62401b9f48fd1f871e002699d90249e52f725	또한 그녀는 전국적으로 교육 수준을 높이기 위한 정책을 추진했습니다.	train
common_voice_en_19376990.mp3	"The episode was the final work on ""Star Trek"" by executive producer Jeri Taylor."	ff16788afc1f0af464bfb084e806c9966efc1e5b14c26412618fe60dce508eccc909db109542c53c8646757de3c62401b9f48fd1f871e002699d90249e52f725	이 에피소드는 총괄 프로듀서인 제리 테일러가 '스타트렉'의 마지막 작품이었습니다.	train_covost
common_voice_en_19376991.mp3	The sitting member would not be opposed by the other faction.	ff16788afc1f0af464bfb084e806c9966efc1e5b14c26412618fe60dce508eccc909db109542c53c8646757de3c62401b9f48fd1f871e002699d90249e52f725	앉아있는 멤버는 다른 진영의 반대를 받지 않을 것입니다.	train
common_voice_en_19376992.mp3	The eastern and western sides are mountainous, separated by the Chilean Central Valley.	ff16788afc1f0af464bfb084e806c9966efc1e5b14c26412618fe60dce508eccc909db109542c53c8646757de3c62401b9f48fd1f871e002699d90249e52f725	동쪽과 서쪽은 칠레 중앙 계곡으로 분리된 산악 지대입니다.	train
common_voice_en_19376993.mp3	The speedway is owned and operated by Dover Motorsports.	ff16788afc1f0af464bfb084e806c9966efc1e5b14c26412618fe60dce508eccc909db109542c53c8646757de3c62401b9f48fd1f871e002699d90249e52f725	이 스피드웨이는 도버 모터스포츠가 소유하고 운영합니다.	train
common_voice_en_19376994.mp3	The Storseisundet Bridge crosses the municipal boundary.	ff16788afc1f0af464bfb084e806c9966efc1e5b14c26412618fe60dce508eccc909db109542c53c8646757de3c62401b9f48fd1f871e002699d90249e52f725	슈토르세이순데트 다리는 시 경계를 가로지릅니다.	train
common_voice_en_19376995.mp3	"In some areas of both Cardiganshire and Carmarthenshire they were known as ""pancosen""."	ff16788afc1f0af464bfb084e806c9966efc1e5b14c26412618fe60dce508eccc909db109542c53c8646757de3c62401b9f48fd1f871e002699d90249e52f725	카디건셔와 카마튼셔의 일부 지역에서는 "팬코센"이라고 불렀습니다.	train
common_voice_en_19376996.mp3	An example of this is the dog clutch, most commonly used in non-synchromesh transmissions.	ff16788afc1f0af464bfb084e806c9966efc1e5b14c26412618fe60dce508eccc909db109542c53c8646757de3c62401b9f48fd1f871e002699d90249e52f725	그 예로 비싱크로메시 전송에 가장 일반적으로 사용되는 도그 클러치를 들 수 있습니다.	train
common_voice_en_19376997.mp3	In the British Army, each regiment and corps has a different badge.	ff16788afc1f0af464bfb084e806c9966efc1e5b14c26412618fe60dce508eccc909db109542c53c8646757de3c62401b9f48fd1f871e002699d90249e52f725	영국군에서는 각 연대와 군단마다 다른 배지가 있습니다.	train
common_voice_en_19376998.mp3	"The crew reported air bubbles in the water supply for ""Endeavour""'s galley."	ff16788afc1f0af464bfb084e806c9966efc1e5b14c26412618fe60dce508eccc909db109542c53c8646757de3c62401b9f48fd1f871e002699d90249e52f725	승무원들은 '엔데버'의 갤리선에 공급되는 물에서 기포가 발생했다고 보고했습니다.	train
common_voice_en_19376999.mp3	But so was Gloria.	ff16788afc1f0af464bfb084e806c9966efc1e5b14c26412618fe60dce508eccc909db109542c53c8646757de3c62401b9f48fd1f871e002699d90249e52f725	하지만 글로리아도 마찬가지였습니다.	train_covost
common_voice_en_19377000.mp3	It connects Haeundae-gu to Suyeong-gu.	ff16788afc1f0af464bfb084e806c9966efc1e5b14c26412618fe60dce508eccc909db109542c53c8646757de3c62401b9f48fd1f871e002699d90249e52f725	해운대구와 수영구를 연결합니다.	train
common_voice_en_19377001.mp3	She was hard-working, but arrogant and imperious, which made her unpopular.	ff16788afc1f0af464bfb084e806c9966efc1e5b14c26412618fe60dce508eccc909db109542c53c8646757de3c62401b9f48fd1f871e002699d90249e52f725	그녀는 열심히 일했지만 오만하고 거만해서 인기가 없었습니다.	train
common_voice_en_19377003.mp3	Yes it is...and I guess that constitutes redeeming social value.	ff16788afc1f0af464bfb084e806c9966efc1e5b14c26412618fe60dce508eccc909db109542c53c8646757de3c62401b9f48fd1f871e002699d90249e52f725	네, 맞아요... 그리고 그것이 바로 사회적 가치를 실현하는 것이라고 생각합니다.	train
common_voice_en_19377009.mp3	Everyone was busy working on the still-incomplete runway.	ff16788afc1f0af464bfb084e806c9966efc1e5b14c26412618fe60dce508eccc909db109542c53c8646757de3c62401b9f48fd1f871e002699d90249e52f725	아직 완성되지 않은 활주로에서 모두가 바쁘게 작업하고 있었습니다.	train
common_voice_en_19377010.mp3	However, weapon designers at Los Alamos substituted the experimental core without notifying the DoD.	ff16788afc1f0af464bfb084e806c9966efc1e5b14c26412618fe60dce508eccc909db109542c53c8646757de3c62401b9f48fd1f871e002699d90249e52f725	그러나 로스 알라모스의 무기 설계자들은 국방부에 알리지 않고 실험용 핵을 교체했습니다.	train
common_voice_en_19377011.mp3	This is a pay channel, and is only broadcast on the Internet.	ff16788afc1f0af464bfb084e806c9966efc1e5b14c26412618fe60dce508eccc909db109542c53c8646757de3c62401b9f48fd1f871e002699d90249e52f725	이 채널은 유료 채널이며 인터넷에서만 방송됩니다.	train
