path	sentence	client_id	translation	split
common_voice_en_19377012.mp3	Saguenay is the seat of the judicial district of Chicoutimi.	ff16788afc1f0af464bfb084e806c9966efc1e5b14c26412618fe60dce508eccc909db109542c53c8646757de3c62401b9f48fd1f871e002699d90249e52f725	사게네는 치쿠티미 사법 관할 구역의 소재지입니다.	train
common_voice_en_19377013.mp3	He also served as chairman of the Honolulu City Council.	ff16788afc1f0af464bfb084e806c9966efc1e5b14c26412618fe60dce508eccc909db109542c53c8646757de3c62401b9f48fd1f871e002699d90249e52f725	또한 호놀룰루 시의회 의장을 역임하기도 했습니다.	train
common_voice_en_19377014.mp3	Cadillac made a small fortune as the post commander, possibly by collecting bribes.	ff16788afc1f0af464bfb084e806c9966efc1e5b14c26412618fe60dce508eccc909db109542c53c8646757de3c62401b9f48fd1f871e002699d90249e52f725	캐딜락은 포스트 사령관으로서 뇌물을 받아 작은 돈을 벌었습니다.	train
common_voice_en_19377016.mp3	He has contributed dozens of articles to scholarly journals in a variety of fields.	ff16788afc1f0af464bfb084e806c9966efc1e5b14c26412618fe60dce508eccc909db109542c53c8646757de3c62401b9f48fd1f871e002699d90249e52f725	그는 다양한 분야의 학술 저널에 수십 편의 논문을 기고했습니다.	train
common_voice_en_19377019.mp3	They stay near the warmer climates because their invertebrate prey is more accessible here.	ff16788afc1f0af464bfb084e806c9966efc1e5b14c26412618fe60dce508eccc909db109542c53c8646757de3c62401b9f48fd1f871e002699d90249e52f725	무척추동물 먹이가 더 쉽게 접근하기 때문에 따뜻한 기후 근처에 머물러 있습니다.	train
common_voice_en_18419995.mp3	There was a fag-end of sunset still functioning.	00e0b19b35312cb9f81b614b4b0db13b52e33ac025b85362e68ff87c6e3988351f0fbfab6e1b04cf982bc905d478ca6731fcb47aa44ac5aa80d3887a627f6ffe	일몰의 끝자락이 여전히 작동하고 있었습니다.	train_covost
common_voice_en_18419996.mp3	"I'm named after my uncle."	00e0b19b35312cb9f81b614b4b0db13b52e33ac025b85362e68ff87c6e3988351f0fbfab6e1b04cf982bc905d478ca6731fcb47aa44ac5aa80d3887a627f6ffe	제 이름은 삼촌의 이름을 따서 지었어요.	train_covost
common_voice_en_18419997.mp3	"""Temporarily, yes,"" I had to admit."	00e0b19b35312cb9f81b614b4b0db13b52e33ac025b85362e68ff87c6e3988351f0fbfab6e1b04cf982bc905d478ca6731fcb47aa44ac5aa80d3887a627f6ffe	"일시적으로는 그렇습니다."라고 인정할 수밖에 없었습니다."	train_covost
common_voice_en_18419998.mp3	"Gosh, I'm thirsty."	00e0b19b35312cb9f81b614b4b0db13b52e33ac025b85362e68ff87c6e3988351f0fbfab6e1b04cf982bc905d478ca6731fcb47aa44ac5aa80d3887a627f6ffe	이런, 목이 마르다.	train_covost
common_voice_en_18419999.mp3	She looked at me inquiringly.	00e0b19b35312cb9f81b614b4b0db13b52e33ac025b85362e68ff87c6e3988351f0fbfab6e1b04cf982bc905d478ca6731fcb47aa44ac5aa80d3887a627f6ffe	그녀는 저를 호기심 어린 눈으로 바라보았습니다.	train_covost
common_voice_en_18420010.mp3	Please drive on the left.	00e0b19b35312cb9f81b614b4b0db13b52e33ac025b85362e68ff87c6e3988351f0fbfab6e1b04cf982bc905d478ca6731fcb47aa44ac5aa80d3887a627f6ffe	왼쪽으로 주행하세요.	train
common_voice_en_18420011.mp3	She keeps fit by jogging at least twice a week.	00e0b19b35312cb9f81b614b4b0db13b52e33ac025b85362e68ff87c6e3988351f0fbfab6e1b04cf982bc905d478ca6731fcb47aa44ac5aa80d3887a627f6ffe	그녀는 일주일에 두 번 이상 조깅을 하며 건강을 유지합니다.	train_covost
common_voice_en_18420012.mp3	The college was established in eighteen fifty seven.	00e0b19b35312cb9f81b614b4b0db13b52e33ac025b85362e68ff87c6e3988351f0fbfab6e1b04cf982bc905d478ca6731fcb47aa44ac5aa80d3887a627f6ffe	이 대학은 1857년에 설립되었습니다.	train
common_voice_en_18420033.mp3	The fact is, darling, I am terribly worried.	00e0b19b35312cb9f81b614b4b0db13b52e33ac025b85362e68ff87c6e3988351f0fbfab6e1b04cf982bc905d478ca6731fcb47aa44ac5aa80d3887a627f6ffe	사실, 여보, 정말 걱정이 많이 돼요.	train
common_voice_en_18420034.mp3	"I get the feeling that's what I probably sound like to Germans."	00e0b19b35312cb9f81b614b4b0db13b52e33ac025b85362e68ff87c6e3988351f0fbfab6e1b04cf982bc905d478ca6731fcb47aa44ac5aa80d3887a627f6ffe	독일인들에게는 제가 그렇게 들릴 것 같다는 생각이 듭니다.	train_covost
common_voice_en_18420036.mp3	Wandering years, in which a journeyman went from place to place after his apprenticeship, to acquire further experience.	00e0b19b35312cb9f81b614b4b0db13b52e33ac025b85362e68ff87c6e3988351f0fbfab6e1b04cf982bc905d478ca6731fcb47aa44ac5aa80d3887a627f6ffe	방랑의 세월은 견습생이 더 많은 경험을 쌓기 위해 이곳저곳을 떠돌아다니는 기간입니다.	train_covost
common_voice_en_18420037.mp3	I see now that it was just some perverse form of egotism.	00e0b19b35312cb9f81b614b4b0db13b52e33ac025b85362e68ff87c6e3988351f0fbfab6e1b04cf982bc905d478ca6731fcb47aa44ac5aa80d3887a627f6ffe	이제야 비뚤어진 이기주의의 한 형태였다는 것을 알았습니다.	train_covost
common_voice_en_18420063.mp3	The Anglo-Saxon language is commonly known as Old English.	00e0b19b35312cb9f81b614b4b0db13b52e33ac025b85362e68ff87c6e3988351f0fbfab6e1b04cf982bc905d478ca6731fcb47aa44ac5aa80d3887a627f6ffe	앵글로색슨어는 일반적으로 고대 영어라고 알려져 있습니다.	train
common_voice_en_18420064.mp3	How did you go?	00e0b19b35312cb9f81b614b4b0db13b52e33ac025b85362e68ff87c6e3988351f0fbfab6e1b04cf982bc905d478ca6731fcb47aa44ac5aa80d3887a627f6ffe	어떻게 지내셨나요?	train
common_voice_en_18420065.mp3	The proceeding would be over about half an hour too soon.	00e0b19b35312cb9f81b614b4b0db13b52e33ac025b85362e68ff87c6e3988351f0fbfab6e1b04cf982bc905d478ca6731fcb47aa44ac5aa80d3887a627f6ffe	진행이 30분 정도 지나면 너무 빨리 끝납니다.	train
common_voice_en_18420066.mp3	My family and I lead a very peaceful existence in Cornwall.	00e0b19b35312cb9f81b614b4b0db13b52e33ac025b85362e68ff87c6e3988351f0fbfab6e1b04cf982bc905d478ca6731fcb47aa44ac5aa80d3887a627f6ffe	저희 가족과 저는 콘월에서 매우 평화로운 삶을 살고 있습니다.	train_covost
common_voice_en_18420067.mp3	"How do you know they won't?"	00e0b19b35312cb9f81b614b4b0db13b52e33ac025b85362e68ff87c6e3988351f0fbfab6e1b04cf982bc905d478ca6731fcb47aa44ac5aa80d3887a627f6ffe	그렇지 않다는 것을 어떻게 알 수 있을까요?	train_covost
common_voice_en_18420098.mp3	I unpursed my lips.	00e0b19b35312cb9f81b614b4b0db13b52e33ac025b85362e68ff87c6e3988351f0fbfab6e1b04cf982bc905d478ca6731fcb47aa44ac5aa80d3887a627f6ffe	입술을 풀었습니다.	train
common_voice_en_18420099.mp3	Is that crazy or what?	00e0b19b35312cb9f81b614b4b0db13b52e33ac025b85362e68ff87c6e3988351f0fbfab6e1b04cf982bc905d478ca6731fcb47aa44ac5aa80d3887a627f6ffe	미친 소리인가요?	train
common_voice_en_18420100.mp3	I was not sneezing.	00e0b19b35312cb9f81b614b4b0db13b52e33ac025b85362e68ff87c6e3988351f0fbfab6e1b04cf982bc905d478ca6731fcb47aa44ac5aa80d3887a627f6ffe	재채기를 하지 않았습니다.	train_covost
common_voice_en_18420102.mp3	I gave her a look.	00e0b19b35312cb9f81b614b4b0db13b52e33ac025b85362e68ff87c6e3988351f0fbfab6e1b04cf982bc905d478ca6731fcb47aa44ac5aa80d3887a627f6ffe	한 번 살펴봤어요.	train
common_voice_en_19478293.mp3	Where the Hell is Matt?	017ce31ae5f54cdead19d87fcbfec3bbad12e60c6bcf997419bb19a0392d7795490ad42d0075db52b9e2e2a125ce55143aadfb13b93c8f897e3607d3dcb408a9	맷은 대체 어디 있나요?	train
common_voice_en_19478294.mp3	"The Australian start-up franchise was given the nod ahead of South Africa's Southern Kings."	017ce31ae5f54cdead19d87fcbfec3bbad12e60c6bcf997419bb19a0392d7795490ad42d0075db52b9e2e2a125ce55143aadfb13b93c8f897e3607d3dcb408a9	호주의 스타트업 프랜차이즈가 남아프리카공화국의 서던 킹스를 제치고 선정되었습니다.	train
common_voice_en_19478295.mp3	Minsk is also the capital of Minsk Region.	017ce31ae5f54cdead19d87fcbfec3bbad12e60c6bcf997419bb19a0392d7795490ad42d0075db52b9e2e2a125ce55143aadfb13b93c8f897e3607d3dcb408a9	민스크는 민스크 지역의 수도이기도 합니다.	train
common_voice_en_19478296.mp3	He is the author of three books.	017ce31ae5f54cdead19d87fcbfec3bbad12e60c6bcf997419bb19a0392d7795490ad42d0075db52b9e2e2a125ce55143aadfb13b93c8f897e3607d3dcb408a9	그는 세 권의 책을 저술했습니다.	train
common_voice_en_19478297.mp3	"However, Davidson's most obvious characteristics are his plotting and style."	017ce31ae5f54cdead19d87fcbfec3bbad12e60c6bcf997419bb19a0392d7795490ad42d0075db52b9e2e2a125ce55143aadfb13b93c8f897e3607d3dcb408a9	하지만 데이비슨의 가장 두드러진 특징은 플롯과 스타일입니다.	train
common_voice_en_19478343.mp3	The interior floor is uneven in places with some small impacts.	017ce31ae5f54cdead19d87fcbfec3bbad12e60c6bcf997419bb19a0392d7795490ad42d0075db52b9e2e2a125ce55143aadfb13b93c8f897e3607d3dcb408a9	작은 충격이 있는 곳에서는 내부 바닥이 고르지 않습니다.	train
common_voice_en_19478344.mp3	He also taught sixth-form maths.	017ce31ae5f54cdead19d87fcbfec3bbad12e60c6bcf997419bb19a0392d7795490ad42d0075db52b9e2e2a125ce55143aadfb13b93c8f897e3607d3dcb408a9	그는 6학년 수학도 가르쳤습니다.	train
common_voice_en_19478345.mp3	Less commonly, vehicles may be flown in on a cargo plane.	017ce31ae5f54cdead19d87fcbfec3bbad12e60c6bcf997419bb19a0392d7795490ad42d0075db52b9e2e2a125ce55143aadfb13b93c8f897e3607d3dcb408a9	드물게 화물기를 통해 차량을 운송하는 경우도 있습니다.	train
common_voice_en_19478346.mp3	The Seagull Monument is believed to be the first monument dedicated to birds.	017ce31ae5f54cdead19d87fcbfec3bbad12e60c6bcf997419bb19a0392d7795490ad42d0075db52b9e2e2a125ce55143aadfb13b93c8f897e3607d3dcb408a9	갈매기 기념비는 새를 기리는 최초의 기념비로 알려져 있습니다.	train
common_voice_en_19478347.mp3	The group gained a local following.	017ce31ae5f54cdead19d87fcbfec3bbad12e60c6bcf997419bb19a0392d7795490ad42d0075db52b9e2e2a125ce55143aadfb13b93c8f897e3607d3dcb408a9	이 그룹은 현지에서 많은 팔로워를 확보했습니다.	train
common_voice_en_19478368.mp3	Leytonstone and Ilford remained in the Isthmian League Premier Division.	017ce31ae5f54cdead19d87fcbfec3bbad12e60c6bcf997419bb19a0392d7795490ad42d0075db52b9e2e2a125ce55143aadfb13b93c8f897e3607d3dcb408a9	레이튼스톤과 일포드는 이스트미안 리그 프리미어 디비전에 잔류했습니다.	train
common_voice_en_19478370.mp3	Dikes in the Athabasca Basin are related to the giant Mackenzie dike swarm.	017ce31ae5f54cdead19d87fcbfec3bbad12e60c6bcf997419bb19a0392d7795490ad42d0075db52b9e2e2a125ce55143aadfb13b93c8f897e3607d3dcb408a9	아타바스카 분지의 제방은 거대한 매켄지 제방 떼와 관련이 있습니다.	train
common_voice_en_19478372.mp3	He left school at the age of fifteen and worked as a mechanic.	017ce31ae5f54cdead19d87fcbfec3bbad12e60c6bcf997419bb19a0392d7795490ad42d0075db52b9e2e2a125ce55143aadfb13b93c8f897e3607d3dcb408a9	그는 열다섯 살에 학교를 그만두고 정비공으로 일했습니다.	train
common_voice_en_19478374.mp3	He went into ice dancing straight away.	017ce31ae5f54cdead19d87fcbfec3bbad12e60c6bcf997419bb19a0392d7795490ad42d0075db52b9e2e2a125ce55143aadfb13b93c8f897e3607d3dcb408a9	그는 곧바로 아이스댄스에 뛰어들었습니다.	train
common_voice_en_19478376.mp3	This was the first main-sequence star found to have an exoplanet orbiting it.	017ce31ae5f54cdead19d87fcbfec3bbad12e60c6bcf997419bb19a0392d7795490ad42d0075db52b9e2e2a125ce55143aadfb13b93c8f897e3607d3dcb408a9	이 별은 궤도를 도는 외계 행성이 있는 것으로 밝혀진 최초의 주계열성입니다.	train
common_voice_en_19478463.mp3	Drewry was born in Grimsby, Lincolnshire, and educated at the Grimsby Collegiate School.	017ce31ae5f54cdead19d87fcbfec3bbad12e60c6bcf997419bb19a0392d7795490ad42d0075db52b9e2e2a125ce55143aadfb13b93c8f897e3607d3dcb408a9	드루리는 링컨셔주 그림스비에서 태어나 그림스비 대학에서 교육을 받았습니다.	train
common_voice_en_19478464.mp3	The good summer life lasted until World War One.	017ce31ae5f54cdead19d87fcbfec3bbad12e60c6bcf997419bb19a0392d7795490ad42d0075db52b9e2e2a125ce55143aadfb13b93c8f897e3607d3dcb408a9	좋은 여름 생활은 1차 세계대전까지 지속되었습니다.	train
common_voice_en_19478465.mp3	This equation works as an inverse relationship.	017ce31ae5f54cdead19d87fcbfec3bbad12e60c6bcf997419bb19a0392d7795490ad42d0075db52b9e2e2a125ce55143aadfb13b93c8f897e3607d3dcb408a9	이 방정식은 역관계로 작동합니다.	train
common_voice_en_19478467.mp3	The statistics of victims include deaths through executions, man-made hunger, deportations, and forced labor.	017ce31ae5f54cdead19d87fcbfec3bbad12e60c6bcf997419bb19a0392d7795490ad42d0075db52b9e2e2a125ce55143aadfb13b93c8f897e3607d3dcb408a9	희생자 통계에는 처형, 인위적 기아, 추방, 강제 노동으로 인한 사망이 포함됩니다.	train
common_voice_en_19478484.mp3	This condition especially affects women because far fewer of them speak Spanish than men.	017ce31ae5f54cdead19d87fcbfec3bbad12e60c6bcf997419bb19a0392d7795490ad42d0075db52b9e2e2a125ce55143aadfb13b93c8f897e3607d3dcb408a9	특히 여성은 남성보다 스페인어를 구사하는 비율이 훨씬 적기 때문에 이 질환은 여성에게 더 큰 영향을 미칩니다.	train
